"2302.02541","Tam\'as Darvas","Tam\'as Darvas, Mingchen Xia, Kewei Zhang","A transcendental approach to non-Archimedean metrics of pseudoeffective
  classes","v.2 references updated. Presentation improved",,,,"math.AG math.CV math.DG","http://creativecommons.org/publicdomain/zero/1.0/","  We introduce the concept of non-Archimedean metrics attached to a
transcendental pseudoeffective cohomology class on a compact K\""ahler manifold.
This is obtained via extending the Ross-Witt Nystr\""om correspondence to the
relative case, and we point out that our construction agrees with that of
Boucksom-Jonsson when the class is induced by a pseudoeffective $\mathbb
Q$-line bundle.
  We introduce the notion of a flag configuration attached to a transcendental
big class, recovering the notion of a test configuration in the ample case. We
show that non-Archimedean finite energy metrics are approximable by flag
configurations, and very general versions of the radial Ding energy are
continuous, a novel result even in the ample case. As applications, we
characterize the delta invariant as the Ding semistability threshold of flag
configurations and filtrations and prove a YTD type existence theorem in terms
of flag configurations.
","[{""version"":""v1"",""created"":""Mon, 6 Feb 2023 02:54:45 GMT""},{""version"":""v2"",""created"":""Wed, 29 Mar 2023 20:09:05 GMT""}]","2023-03-31"
"2302.02542","Xiangzhi Cao","Xiangzhi Cao","Heat flow for VT harmonic map from compact manifold",,,,,"math.DG math.AP","http://creativecommons.org/licenses/by/4.0/","  In this paper, we obtain the existence of Dirichlet problem for VT harmonic
map from compact Riemannian manifold with or without boundary into compact
manifold via the heat flow method. We also obtain the existence of V T
geodesics uncer certain conditions on T.
","[{""version"":""v1"",""created"":""Mon, 6 Feb 2023 03:00:42 GMT""}]","2023-02-07"
"2302.02543","Siyao Liu","Siyao Liu","Geometric structures in $Sol_3$","35 pages. arXiv admin note: substantial text overlap with
  arXiv:2212.12243",,,,"math.DG","http://arxiv.org/licenses/nonexclusive-distrib/1.0/","  In this paper, we conclude the geometric structures in $Sol_3$ with the
Levi-Civita connection and the semi-symmetric non-metric connection. We discuss
two special cases to study the geometric structures in $Sol_3$ with the
semi-symmetric non-metric connection, namely $\widehat{P}=a(X_3)\partial_3$ and
$\widehat{P}=b(X_3)\partial_1$, also get relatively complete conclusions
respectively. As a special case, we investigate the geometric structures in
$Sol_3$ with the Levi-Civita connection.
","[{""version"":""v1"",""created"":""Mon, 6 Feb 2023 03:01:12 GMT""}]","2023-02-07"
"2302.02544","Shubhanshu Shekhar","Shubhanshu Shekhar, Aaditya Ramdas","Sequential change detection via backward confidence sequences","24 pages, 10 figures",,,,"math.ST cs.IT cs.LG math.IT stat.ME stat.ML stat.TH","http://creativecommons.org/licenses/by/4.0/","  We present a simple reduction from sequential estimation to sequential
changepoint detection (SCD). In short, suppose we are interested in detecting
changepoints in some parameter or functional $\theta$ of the underlying
distribution. We demonstrate that if we can construct a confidence sequence
(CS) for $\theta$, then we can also successfully perform SCD for $\theta$. This
is accomplished by checking if two CSs -- one forwards and the other backwards
-- ever fail to intersect. Since the literature on CSs has been rapidly
evolving recently, the reduction provided in this paper immediately solves
several old and new change detection problems. Further, our ""backward CS"",
constructed by reversing time, is new and potentially of independent interest.
We provide strong nonasymptotic guarantees on the frequency of false alarms and
detection delay, and demonstrate numerical effectiveness on several problems.
","[{""version"":""v1"",""created"":""Mon, 6 Feb 2023 03:03:24 GMT""}]","2023-02-07"
"2302.02545","Corey S. O'Hern","S. Zhang, W. Jin, D. Wang, D. Xu, J. Zhang, M. D. Shattuck, and C. S.
  O'Hern","Local and global measures of the shear moduli of jammed disk packings","17 pages, 21 figures","Phys. Rev. E 107 (2023) 054903","10.1103/PhysRevE.107.054903",,"cond-mat.soft","http://creativecommons.org/licenses/by-nc-nd/4.0/","  Strain-controlled isotropic compression gives rise to jammed packings of
repulsive, frictionless disks with either positive or negative global shear
moduli. We carry out computational studies to understand the contributions of
the negative shear moduli to the mechanical response of jammed disk packings.
We first decompose the ensemble-averaged, global shear modulus as $\langle
G\rangle = (1-{\cal F}_-) \langle G_+ \rangle + {\cal F}_- \langle G_-\rangle$,
where ${\cal F}_-$ is the fraction of jammed packings with negative shear
moduli and $\langle G_+\rangle$ and $\langle G_-\rangle$ are the average values
from packings with positive and negative moduli, respectively. We show that
$\langle G_+\rangle$ and $\langle|G_-|\rangle$ obey different power-law scaling
relations above and below $pN^2 \sim 1$. We then calculate analytically that
${\cal P}(G)$ is a Gamma distribution in the $pN^2 \ll 1$ limit. As $pN^2$
increases, the skewness of ${\cal P}(G)$ decreases and ${\cal P}(G)$ becomes a
skew-normal distribution with negative skewness in the $pN^2 \gg 1$ limit. We
also partition jammed disk packings into subsystems using Delanunay
triangulation of the disk centers to calculate local shear moduli. We show that
the local shear moduli defined from groups of adjacent triangles can be
negative even when $G > 0$. The spatial correlation function of local shear
moduli $C({\vec r})$ displays weak correlations for $pn_{\rm sub}^2 < 10^{-2}$,
where $n_{\rm sub}$ is the number of particles within each subsystem. However,
$C({\vec r})$ begins to develop long-ranged spatial correlations with four-fold
angular symmetry for $pn_{\rm sub}^2 \gtrsim 10^{-2}$.
","[{""version"":""v1"",""created"":""Mon, 6 Feb 2023 03:06:32 GMT""}]","2023-05-31"
"2302.02546","Xiangzhi Cao","Xiangzhi Cao","Schwarz Lemma for VT harmonic map",,,,,"math.DG","http://creativecommons.org/licenses/by/4.0/","  In this paper, we obtained Schwarz Lemma of $ VT $ harmonic map including
distance decreasing property and volume decreasing property under some
conditions about the eigenvalue of $ du^{+} \circ du $, $ T $ and the lower
bound of $ Ric_f^N $ or $ Ric_V^N $. We generalized Schwarz lemma of $ V $
harmonic map.
","[{""version"":""v1"",""created"":""Mon, 6 Feb 2023 03:08:15 GMT""},{""version"":""v2"",""created"":""Wed, 29 Mar 2023 11:19:30 GMT""}]","2023-03-30"
"2302.02547","Anh Phuong Ngo","Anh Phuong Ngo, Nhat Le, Hieu T. Nguyen, Abdullah Eroglu and Duong T.
  Nguyen","A Quantum Neural Network Regression for Modeling Lithium-ion Battery
  Capacity Degradation","Accepted for 2023 IEEE Green Technology Conference, Denver, Colorado,
  USA",,,,"eess.SY cs.LG cs.SY","http://arxiv.org/licenses/nonexclusive-distrib/1.0/","  Given the high power density low discharge rate and decreasing cost
rechargeable lithium-ion batteries LiBs have found a wide range of applications
such as power grid level storage systems electric vehicles and mobile devices.
Developing a framework to accurately model the nonlinear degradation process of
LiBs which is indeed a supervised learning problem becomes an important
research topic. This paper presents a classical-quantum hybrid machine learning
approach to capture the LiB degradation model that assesses battery cell life
loss from operating profiles. Our work is motivated by recent advances in
quantum computers as well as the similarity between neural networks and quantum
circuits. Similar to adjusting weight parameters in conventional neural
networks the parameters of the quantum circuit namely the qubits degree of
freedom can be tuned to learn a nonlinear function in a supervised learning
fashion. As a proof of concept paper our obtained numerical results with the
battery dataset provided by NASA demonstrate the ability of the quantum neural
networks in modeling the nonlinear relationship between the degraded capacity
and the operating cycles. We also discuss the potential advantage of the
quantum approach compared to conventional neural networks in classical
computers in dealing with massive data especially in the context of future
penetration of EVs and energy storage.
","[{""version"":""v1"",""created"":""Mon, 6 Feb 2023 03:28:25 GMT""}]","2023-02-07"
"2302.02548","Gerrit Welper","G. Welper","Learning Trees of $\ell_0$-Minimization Problems",,,,,"cs.LG cs.NA math.NA","http://arxiv.org/licenses/nonexclusive-distrib/1.0/","  The problem of computing minimally sparse solutions of under-determined
linear systems is $NP$ hard in general. Subsets with extra properties, may
allow efficient algorithms, most notably problems with the restricted isometry
property (RIP) can be solved by convex $\ell_1$-minimization. While these
classes have been very successful, they leave out many practical applications.
  In this paper, we consider adaptable classes that are tractable after
training on a curriculum of increasingly difficult samples. The setup is
intended as a candidate model for a human mathematician, who may not be able to
tackle an arbitrary proof right away, but may be successful in relatively
flexible subclasses, or areas of expertise, after training on a suitable
curriculum.
","[{""version"":""v1"",""created"":""Mon, 6 Feb 2023 03:40:02 GMT""}]","2023-02-07"
"2302.02549","Kohji Matsumoto","Shigeki Egami and Kohji Matsumoto","A function-field analogue of the Goldbach counting function and the
  associated Dirichlet series","10pages",,,,"math.NT","http://arxiv.org/licenses/nonexclusive-distrib/1.0/","  We consider a function-field analogue of Dirichlet series associated with the
Goldbach counting function, and prove that it can, or cannot, be continued
meromorphically to the whole plane. When it cannot, we further prove the
existence of the natural boundary of it.
","[{""version"":""v1"",""created"":""Mon, 6 Feb 2023 03:41:31 GMT""}]","2023-02-07"
"2302.02550","Ziqiang Li","Yi Wu, Ziqiang Li, Chaoyue Wang, Heliang Zheng, Shanshan Zhao, Bin Li,
  Dacheng Tao","Domain Re-Modulation for Few-Shot Generative Domain Adaptation","Under Review",,,,"cs.CV","http://creativecommons.org/licenses/by/4.0/","  In this study, we delve into the task of few-shot Generative Domain
Adaptation (GDA), which involves transferring a pre-trained generator from one
domain to a new domain using only a few reference images. Inspired by the way
human brains acquire knowledge in new domains, we present an innovative
generator structure called Domain Re-Modulation (DoRM). DoRM not only meets the
criteria of high quality, large synthesis diversity, and cross-domain
consistency, which were achieved by previous research in GDA, but also
incorporates memory and domain association, akin to how human brains operate.
Specifically, DoRM freezes the source generator and introduces new mapping and
affine modules (M&A modules) to capture the attributes of the target domain
during GDA. This process resembles the formation of new synapses in human
brains. Consequently, a linearly combinable domain shift occurs in the style
space. By incorporating multiple new M&A modules, the generator gains the
capability to perform high-fidelity multi-domain and hybrid-domain generation.
Moreover, to maintain cross-domain consistency more effectively, we introduce a
similarity-based structure loss. This loss aligns the auto-correlation map of
the target image with its corresponding auto-correlation map of the source
image during training. Through extensive experiments, we demonstrate the
superior performance of our DoRM and similarity-based structure loss in
few-shot GDA, both quantitatively and qualitatively. The code will be available
at https://github.com/wuyi2020/DoRM.
","[{""version"":""v1"",""created"":""Mon, 6 Feb 2023 03:55:35 GMT""},{""version"":""v2"",""created"":""Tue, 7 Feb 2023 03:37:01 GMT""},{""version"":""v3"",""created"":""Tue, 23 May 2023 15:26:45 GMT""}]","2023-05-24"
"2302.02551","Zachary Novack","Zachary Novack, Julian McAuley, Zachary C. Lipton, Saurabh Garg","CHiLS: Zero-Shot Image Classification with Hierarchical Label Sets","Accepted at ICML 2023",,,,"cs.CV cs.LG","http://creativecommons.org/licenses/by/4.0/","  Open vocabulary models (e.g. CLIP) have shown strong performance on zero-shot
classification through their ability generate embeddings for each class based
on their (natural language) names. Prior work has focused on improving the
accuracy of these models through prompt engineering or by incorporating a small
amount of labeled downstream data (via finetuning). However, there has been
little focus on improving the richness of the class names themselves, which can
pose issues when class labels are coarsely-defined and are uninformative. We
propose Classification with Hierarchical Label Sets (or CHiLS), an alternative
strategy for zero-shot classification specifically designed for datasets with
implicit semantic hierarchies. CHiLS proceeds in three steps: (i) for each
class, produce a set of subclasses, using either existing label hierarchies or
by querying GPT-3; (ii) perform the standard zero-shot CLIP procedure as though
these subclasses were the labels of interest; (iii) map the predicted subclass
back to its parent to produce the final prediction. Across numerous datasets
with underlying hierarchical structure, CHiLS leads to improved accuracy in
situations both with and without ground-truth hierarchical information. CHiLS
is simple to implement within existing zero-shot pipelines and requires no
additional training cost. Code is available at:
https://github.com/acmi-lab/CHILS.
","[{""version"":""v1"",""created"":""Mon, 6 Feb 2023 03:59:15 GMT""},{""version"":""v2"",""created"":""Tue, 7 Feb 2023 04:39:13 GMT""},{""version"":""v3"",""created"":""Wed, 31 May 2023 07:44:28 GMT""}]","2023-06-01"
"2302.02552","Peng Zhao","Yu-Jie Zhang, Zhen-Yu Zhang, Peng Zhao, Masashi Sugiyama","Adapting to Continuous Covariate Shift via Online Density Ratio
  Estimation",,,,,"cs.LG stat.ML","http://arxiv.org/licenses/nonexclusive-distrib/1.0/","  Dealing with distribution shifts is one of the central challenges for modern
machine learning. One fundamental situation is the \emph{covariate shift},
where the input distributions of data change from training to testing stages
while the input-conditional output distribution remains unchanged. In this
paper, we initiate the study of a more challenging scenario --
\emph{continuous} covariate shift -- in which the test data appear
sequentially, and their distributions can shift continuously. Our goal is to
adaptively train the predictor such that its prediction risk accumulated over
time can be minimized. Starting with the importance-weighted learning, we show
the method works effectively if the time-varying density ratios of test and
train inputs can be accurately estimated. However, existing density ratio
estimation methods would fail due to data scarcity at each time step. To this
end, we propose an online method that can appropriately reuse historical
information. Our density ratio estimation method is proven to perform well by
enjoying a dynamic regret bound, which finally leads to an excess risk
guarantee for the predictor. Empirical results also validate the effectiveness.
","[{""version"":""v1"",""created"":""Mon, 6 Feb 2023 04:03:33 GMT""}]","2023-02-07"
"2302.02553","Yanling Qiu","Yanling Qiu, Qianxue Feng, Boqin Cai, Hongan Wei, and Weiling Chen","A Correction-Based Dynamic Enhancement Framework towards Underwater
  Detection",,,,,"cs.CV","http://arxiv.org/licenses/nonexclusive-distrib/1.0/","  To assist underwater object detection for better performance, image
enhancement technology is often used as a pre-processing step. However, most of
the existing enhancement methods tend to pursue the visual quality of an image,
instead of providing effective help for detection tasks. In fact, image
enhancement algorithms should be optimized with the goal of utility
improvement. In this paper, to adapt to the underwater detection tasks, we
proposed a lightweight dynamic enhancement algorithm using a contribution
dictionary to guide low-level corrections. Dynamic solutions are designed to
capture differences in detection preferences. In addition, it can also balance
the inconsistency between the contribution of correction operations and their
time complexity. Experimental results in real underwater object detection tasks
show the superiority of our proposed method in both generalization and
real-time performance.
","[{""version"":""v1"",""created"":""Mon, 6 Feb 2023 04:11:52 GMT""}]","2023-02-07"
"2302.02554","Geoffrey Blake","Tony E. Karam and Geoffrey A. Blake","Anisotropic Lattice Expansion of Monolayer WSe2 Revealed by Ultrafast
  Electron Diffraction","Submitted to J. Phys. Chem. C, 21 pages, 7 figures",,,,"cond-mat.mtrl-sci cond-mat.mes-hall","http://creativecommons.org/licenses/by-nc-sa/4.0/","  Bulk layered MX2 transition metal chalcogenides (M = Mo, W and X = S, Se) are
known to exhibit an indirect to direct band gap transition as the number of
layers is reduced. Previous time-resolved work has principally focused on the
investigation of the transient evolution of the band structure after
photo-excitation, but additional information on the dynamics of the concomitant
lattice rearrangement is needed to fully understand this phenomenon. Here,
ultrafast electron diffraction is used to probe the atomic motion and bond
dilation in monolayer WSe2 with femtosecond temporal resolution. The change in
the intensity of the Bragg diffraction spots is characterized by
single-exponential dynamics, consistent with a collective response of the
lattice during electron-phonon and phonon-phonon equilibration that is
repeatable over many hours of illumination with ultrafast pulses. Moreover, a
transient and highly anisotropic lattice expansion is observed. A possible
explanation for this behavior is axial strain induced by the laser excitation
that breaks the degeneracy of the in-plane phonon modes, and that strongly
influences the electronic band structure. Such degeneracy-breaking induced by
distortions in the lattice are well characterized in static strain
measurements, and the results presented here provide valuable insights into the
nature and time scales of the structural rearrangement that occurs following
optical photo-excitation in monolayer tungsten diselenide.
","[{""version"":""v1"",""created"":""Mon, 6 Feb 2023 04:12:01 GMT""}]","2023-02-07"
"2302.02555","Yoshihiro Osakabe","Yoshihiro Osakabe and Akinori Asahara","Proposing Novel Extrapolative Compounds by Nested Variational
  Autoencoders","9 pages, 4 figures",,,,"cs.LG cond-mat.mtrl-sci","http://creativecommons.org/licenses/by-nc-nd/4.0/","  Materials informatics (MI), which uses artificial intelligence and data
analysis techniques to improve the efficiency of materials development, is
attracting increasing interest from industry. One of its main applications is
the rapid development of new high-performance compounds. Recently, several deep
generative models have been proposed to suggest candidate compounds that are
expected to satisfy the desired performance. However, they usually have the
problem of requiring a large amount of experimental datasets for training to
achieve sufficient accuracy. In actual cases, it is often possible to
accumulate only about 1000 experimental data at most. Therefore, the authors
proposed a deep generative model with nested two variational autoencoders
(VAEs). The outer VAE learns the structural features of compounds using
large-scale public data, while the inner VAE learns the relationship between
the latent variables of the outer VAE and the properties from small-scale
experimental data. To generate high performance compounds beyond the range of
the training data, the authors also proposed a loss function that amplifies the
correlation between a component of latent variables of the inner VAE and
material properties. The results indicated that this loss function contributes
to improve the probability of generating high-performance candidates.
Furthermore, as a result of verification test with an actual customer in
chemical industry, it was confirmed that the proposed method is effective in
reducing the number of experiments to $1/4$ compared to a conventional method.
","[{""version"":""v1"",""created"":""Mon, 6 Feb 2023 04:12:12 GMT""}]","2023-02-07"
"2302.02556","Agus Soenjaya","Agus Soenjaya and Thanh Tran","Global weak solution of the Landau-Lifshitz-Baryakhtar equation","24 pages",,,,"math.AP","http://arxiv.org/licenses/nonexclusive-distrib/1.0/","  The Landau--Lifshitz--Baryakhtar (LLBar) equation is a generalisation of the
Landau--Lifshitz--Gilbert (LLG) and the Landau--Lifshitz--Bloch (LLB) equations
which takes into account contributions from nonlocal damping and is valid at
moderate temperature below the Curie temperature. As such, it is able to
explain some discrepancies between the experimental observations and the known
theories in various problems on magnonics and magnetic domain-wall dynamics. In
this paper, the existence and uniqueness of weak and regular solutions to LLBar
equation are proven. H\""older continuity of the solution is also discussed.
","[{""version"":""v1"",""created"":""Mon, 6 Feb 2023 04:12:27 GMT""},{""version"":""v2"",""created"":""Thu, 9 Feb 2023 12:42:18 GMT""}]","2023-02-10"
"2302.02557","Shengheng Liu","Wenzhe Fan, Shengheng Liu, Chunguo Li, Yongming Huang","Fast Direct Localization for Millimeter Wave MIMO Systems via Deep ADMM
  Unfolding","5 pages, 3 figures, peer-reviewed and accepted for publication in
  IEEE Wireless Communications Letters",,"10.1109/LWC.2023.3243157",,"eess.SP","http://creativecommons.org/licenses/by/4.0/","  Massive arrays deployed in millimeter-wave systems enable high angular
resolution performance, which in turn facilitates sub-meter localization
services. Albeit suboptimal, up to now the most popular localization approach
has been based on a so-called two-step procedure, where triangulation is
applied upon aggregation of the angle-of-arrival (AoA) measurements from the
collaborative base stations. This is mainly due to the prohibitive
computational cost of the existing direct localization approaches in
large-scale systems. To address this issue, we propose a deep unfolding based
fast direct localization solver. First, the direct localization is formulated
as a joint $l_1$-$l_{2,1}$ norm sparse recovery problem, which is then solved
by using alternating direction method of multipliers (ADMM). Next, we develop a
deep ADMM unfolding network (DAUN) to learn the ADMM parameter settings from
the training data and a position refinement algorithm is proposed for DAUN.
Finally, simulation results showcase the superiority of the proposed DAUN over
the baseline solvers in terms of better localization accuracy, faster
convergence and significantly lower computational complexity.
","[{""version"":""v1"",""created"":""Mon, 6 Feb 2023 04:24:10 GMT""}]","2023-02-07"
"2302.02558","Anirudh Singh Rana","Anirudh Singh Rana and Sukratu Barve","A second order constitutive theory for polyatomic gases: theory and
  applications",,,,,"physics.flu-dyn","http://creativecommons.org/licenses/by/4.0/","  In the classical irreversible thermodynamics (CIT) framework, the Navier
Stokes Fourier (NSF) constitutive equations are obtained so as they satisfy the
entropy inequality, by and large assuming that the entropy flux is equal to the
heat flux over the temperature. This article is focused on the derivation of
second-order constitutive equations for polyatomic gases; it takes the basis of
CIT, but most importantly, allowing up to quadratic nonlinearities in the
entropy flux.
","[{""version"":""v1"",""created"":""Mon, 6 Feb 2023 04:32:44 GMT""}]","2023-02-07"
"2302.02559","Lixin Xu","Yuhao Mu, Baorong Chang, Lixin Xu","Cosmography via Gaussian Process with Gamma Ray Bursts","18 pages, 5 figures and 1 table. comments welcome",,,,"astro-ph.CO","http://creativecommons.org/licenses/by/4.0/","  In this paper, we firstly calibrate the Amati relation (the $E_{\rm p}-E_{\rm
iso}$ correlation) of gamma ray bursts (GRBs) at low redshifts ($z<0.8$) via
Gaussian process by using the type Ia supernovae samples from Pantheon+ under
the philosophy that objects at the same redshift should have the same
luminosity distance in any cosmology. As a result, this calibration derives the
distance moduli of GRBs at high redshifts ($z>0.8$). For an application of
these derived distance modulus of GRBs to cosmology, via Gaussian process
again, a series of cosmography parameters, which describe kinematics of our
Universe, up to the fifth oder, i.e. the Hubble parameter $H(z)$, the
deceleration parameter $q(z)$, the jerk parameter $j(z)$, the snap parameter
$s(z)$ and the lerk parameter $l(z)$, are reconstructed from the cosmic
observations. The result shows that the current quality of GRBs data points are
not good enough to give viable prediction of the kinematics of our Universe at
high redshifts.
","[{""version"":""v1"",""created"":""Mon, 6 Feb 2023 04:34:50 GMT""}]","2023-02-07"
