"2302.02658","Alain Rapaport","Emilio Molina (GIPSA-lab), Alain Rapaport (MISTEA)","Optimal synthesis for a class of L $\infty$ optimal control problems in
  the plane with L 1 constraint on the input",,,,"MISTEA - Axe syst{\`e}mes dynamiques","math.OC","http://arxiv.org/licenses/nonexclusive-distrib/1.0/","  For a particular class of planar dynamics that are linear with respect to the
control variable, we show that the feedback strategy ''null-singular null'' is
minimizing the maximum of a coordinate over infinite horizon, under a L 1
budget constraint on the control. Moreover, we characterize the optimal cost as
a function of the budget. The proof is based on an unusual use of the clock
form. This result generalizes the one obtained formerly for the SIR
epidemiological model to more general Kolmogorov dynamics, that we illustrate
on other biological models.
","[{""version"":""v1"",""created"":""Mon, 6 Feb 2023 09:56:05 GMT""}]","2023-02-07"
"2302.02659","Pablo G\'omez","Pablo G\'omez and Johan \""Ostman and Vinutha Magal Shreenath and
  Gabriele Meoni","PAseos Simulates the Environment for Operating multiple Spacecraft","Soon to be submitted to IEEE Access",,,,"cs.DC astro-ph.IM cs.SY eess.SY physics.comp-ph","http://creativecommons.org/licenses/by-sa/4.0/","  The next generation of spacecraft is anticipated to enable various new
applications involving onboard processing, machine learning and decentralised
operational scenarios. Even though many of these have been previously proposed
and evaluated, the operational constraints of real mission scenarios are often
either not considered or only rudimentary. Here, we present an open-source
Python module called PASEOS that is capable of modelling operational scenarios
involving one or multiple spacecraft. It considers several physical phenomena
including thermal, power, bandwidth and communications constraints as well as
the impact of radiation on spacecraft. PASEOS can be run both as a
high-performance-oriented numerical simulation and/or in a real-time mode
directly on edge hardware. We demonstrate these capabilities in three
scenarios, one in real-time simulation on a Unibap iX-10 100 satellite
processor, another in a simulation modelling an entire constellation performing
tasks over several hours and one training a machine learning model in a
decentralised setting. While we demonstrate tasks in Earth orbit, PASEOS is
conceptually designed to allow deep space scenarios too. Our results show that
PASEOS can model the described scenarios efficiently and thus provide insight
into operational considerations. We show this in terms of runtime and overhead
as well as by investigating the modelled temperature, battery status and
communication windows of a constellation. By running PASEOS on an actual
satellite processor, we showcase how PASEOS can be directly included in
hardware demonstrators for future missions. Overall, we provide the first
solution to holistically model the physical constraints spacecraft encounter in
Earth orbit and beyond. The PASEOS module is available open-source online
together with an extensive documentation to enable researchers to quickly
incorporate it in their studies.
","[{""version"":""v1"",""created"":""Mon, 6 Feb 2023 09:57:09 GMT""}]","2023-02-07"
"2302.02660","Ludovic Rifford","L Rifford (UCA)","Subdifferentials and Minimizing Sard Conjecture in Sub-Riemannian
  Geometry",,,,,"math.DG math.MG math.OC","http://arxiv.org/licenses/nonexclusive-distrib/1.0/","  We use techniques from nonsmooth analysis and geometric measure theory to
provide new examples of complete sub-Riemannian structures satisfying the
Minimizing Sard conjecture. In particular, we show that complete sub-Riemannian
structures associated with distributions of co-rank 2 or generic distributions
of rank $\ge$ 2 satisfy the Minimizing Sard conjecture.
","[{""version"":""v1"",""created"":""Mon, 6 Feb 2023 09:57:52 GMT""}]","2023-02-07"
"2302.02661","Zhiren Huang","Zhiren Huang, Alonso Espinosa Mireles de Villafranca, Charalampos
  Sipetas, Tri Quach","Crowd-sensing commuting patterns using multi-source wireless data: a
  case of Helsinki commuter trains","10 pages, 12 figures, Submitted to IEEE MDM 2023 (The 24th IEEE
  International Conference on Mobile Data Management) Research Track",,,,"cs.NI cs.CY","http://creativecommons.org/licenses/by-sa/4.0/","  Understanding the mobility patterns of commuter train passengers is crucial
for developing efficient and sustainable transportation systems in urban areas.
Traditional technologies, such as Automated Passenger Counters (APC) can
measure the aggregated numbers of passengers entering and exiting trains,
however, they do not provide detailed information nor passenger movements
beyond the train itself. To overcome this limitation we investigate the
potential combination of traditional APC with an emerging source capable of
collecting detailed mobility demand data. This new data source derives from the
pilot project TravelSense, led by the Helsinki Regional Transport Authority
(HSL), which utilizes Bluetooth beacons and HSL's mobile phone ticket
application to track anonymous passenger multimodal trajectories from origin to
destination. By combining TravelSense data with APC we are able to better
understand the structure of train users' journeys by identifying the origin and
destination locations, modes of transport used to access commuter train
stations, and boarding and alighting numbers at each station. These insights
can assist public transport planning decisions and ultimately help to
contribute to the goal of sustainable cities and communities by promoting the
use of seamless and environmentally friendly transportation options.
","[{""version"":""v1"",""created"":""Mon, 6 Feb 2023 09:59:33 GMT""}]","2023-02-07"
"2302.02662","Cl\'ement Romac","Thomas Carta, Cl\'ement Romac, Thomas Wolf, Sylvain Lamprier, Olivier
  Sigaud, Pierre-Yves Oudeyer","Grounding Large Language Models in Interactive Environments with Online
  Reinforcement Learning",,,,,"cs.LG","http://arxiv.org/licenses/nonexclusive-distrib/1.0/","  Recent works successfully leveraged Large Language Models' (LLM) abilities to
capture abstract knowledge about world's physics to solve decision-making
problems. Yet, the alignment between LLMs' knowledge and the environment can be
wrong and limit functional competence due to lack of grounding. In this paper,
we study an approach (named GLAM) to achieve this alignment through functional
grounding: we consider an agent using an LLM as a policy that is progressively
updated as the agent interacts with the environment, leveraging online
Reinforcement Learning to improve its performance to solve goals. Using an
interactive textual environment designed to study higher-level forms of
functional grounding, and a set of spatial and navigation tasks, we study
several scientific questions: 1) Can LLMs boost sample efficiency for online
learning of various RL tasks? 2) How can it boost different forms of
generalization? 3) What is the impact of online learning? We study these
questions by functionally grounding several variants (size, architecture) of
FLAN-T5.
","[{""version"":""v1"",""created"":""Mon, 6 Feb 2023 10:01:08 GMT""},{""version"":""v2"",""created"":""Fri, 12 May 2023 08:09:49 GMT""}]","2023-05-15"
"2302.02663","Barbara Benato","B\'arbara Caroline Benato and Alexandre Xavier Falc\~ao and
  Alexandru-Cristian Telea","Linking data separation, visual separation, and classifier performance
  using pseudo-labeling by contrastive learning","10 pages, 4 figures",,,,"cs.LG","http://arxiv.org/licenses/nonexclusive-distrib/1.0/","  Lacking supervised data is an issue while training deep neural networks
(DNNs), mainly when considering medical and biological data where supervision
is expensive. Recently, Embedded Pseudo-Labeling (EPL) addressed this problem
by using a non-linear projection (t-SNE) from a feature space of the DNN to a
2D space, followed by semi-supervised label propagation using a
connectivity-based method (OPFSemi). We argue that the performance of the final
classifier depends on the data separation present in the latent space and
visual separation present in the projection. We address this by first proposing
to use contrastive learning to produce the latent space for EPL by two methods
(SimCLR and SupCon) and by their combination, and secondly by showing, via an
extensive set of experiments, the aforementioned correlations between data
separation, visual separation, and classifier performance. We demonstrate our
results by the classification of five real-world challenging image datasets of
human intestinal parasites with only 1% supervised samples.
","[{""version"":""v1"",""created"":""Mon, 6 Feb 2023 10:01:38 GMT""}]","2023-02-07"
"2302.02664","Marek Rupniewski","Marek W. Rupniewski","Statistical reconstruction of pulse shapes from pulse streams",,,,,"eess.SP","http://creativecommons.org/licenses/by-nc-nd/4.0/","  A short sample sequence of a finite-length pulse signal allows for its
reconstruction only if the signal has a sparse representation in some basis.
The recurrence of the pulse allows for a statistical approach to its
reconstruction. We propose a novel method for this task. It is based on the
distribution of short sample sequences treated as points which lie along a
curve in a low-dimensional Euclidean space. We prove that the probability
distribution of the points along this curve determines the underlying pulse
signal uniquely. Based on this discovery, we propose an algorithm for pulse
estimation from a finite number of short sequences of pulse-stream samples.
","[{""version"":""v1"",""created"":""Mon, 6 Feb 2023 10:04:00 GMT""},{""version"":""v2"",""created"":""Wed, 24 May 2023 20:42:26 GMT""}]","2023-05-26"
"2302.02665","Thomas Jacumin","Zakaria Belhachmi and Thomas Jacumin","Adjoint Method in PDE-based Image Compression",,,,,"math.AP cs.NA math.NA","http://arxiv.org/licenses/nonexclusive-distrib/1.0/","  We consider a shape optimization based method for finding the best
interpolation data in the compression of images with noise. The aim is to
reconstruct missing regions by means of minimizing a data fitting term in an
$L^p$-norm between original images and their reconstructed counterparts using
linear diffusion PDE-based inpainting. Reformulating the problem as a
constrained optimization over sets (shapes), we derive the topological
asymptotic expansion of the considered shape functionals with respect to the
insertion of small ball (a single pixel) using the adjoint method. Based on the
achieved distributed topological shape derivatives, we propose a numerical
approach to determine the optimal set and present numerical experiments
showing, the efficiency of our method. Numerical computations are presented
that confirm the usefulness of our theoretical findings for PDE-based image
compression.
","[{""version"":""v1"",""created"":""Mon, 6 Feb 2023 10:05:29 GMT""}]","2023-02-07"
"2302.02666","Luca Capizzi","Luca Capizzi, Michele Mazzoni, and Olalla A. Castro-Alvaredo","Symmetry Resolved Entanglement of Excited States in Quantum Field Theory
  III: Bosonic and Fermionic Negativity","References added",,,,"hep-th cond-mat.stat-mech quant-ph","http://arxiv.org/licenses/nonexclusive-distrib/1.0/","  In two recent works, we studied the symmetry resolved R\'enyi entropies of
quasi-particle excited states in quantum field theory. We found that the
entropies display many model-independent features which we discussed and
analytically characterised. In this paper we extend this line of investigation
by providing analytical and numerical evidence that a similar universal
behavior arises for the symmetry resolved negativity. In particular, we compute
the ratio of charged moments of the partially transposed reduced density matrix
as an expectation value of twist operators. These are ``fused"" versions of the
more traditionally used branch point twist fields and were introduced in a
previous work. The use of twist operators allows us to perform the computation
in an arbitrary number of spacial dimensions. We show that, in the large-volume
limit, only the commutation relations between the twist operators and local
fields matter, and computations reduce to a purely combinatorial problem. We
address some specific issues regarding fermionic excitations, whose treatment
requires the notion of partial time-reversal transformation, and we discuss the
differences and analogies with their bosonic counterpart. We find that although
the operation of partial transposition requires a redefinition for fermionic
theories, the ratio of the negativity moments between an excited state and the
ground state is universal and identical for fermions and bosons as well as for
a large variety of very different states, ranging from simple qubit states to
the excited states of free quantum field theories. Our predictions are tested
numerically on a 1D Fermi chain.
","[{""version"":""v1"",""created"":""Mon, 6 Feb 2023 10:05:58 GMT""},{""version"":""v2"",""created"":""Fri, 17 Feb 2023 12:27:34 GMT""}]","2023-02-20"
"2302.02667","Nahuel Statuto","Nahuel Statuto, Irene Unceta, Jordi Nin and Oriol Pujol","A Scalable and Efficient Iterative Method for Copying Machine Learning
  Classifiers",,,,,"cs.LG","http://creativecommons.org/licenses/by/4.0/","  Differential replication through copying refers to the process of replicating
the decision behavior of a machine learning model using another model that
possesses enhanced features and attributes. This process is relevant when
external constraints limit the performance of an industrial predictive system.
Under such circumstances, copying enables the retention of original prediction
capabilities while adapting to new demands. Previous research has focused on
the single-pass implementation for copying. This paper introduces a novel
sequential approach that significantly reduces the amount of computational
resources needed to train or maintain a copy, leading to reduced maintenance
costs for companies using machine learning models in production. The
effectiveness of the sequential approach is demonstrated through experiments
with synthetic and real-world datasets, showing significant reductions in time
and resources, while maintaining or improving accuracy.
","[{""version"":""v1"",""created"":""Mon, 6 Feb 2023 10:07:41 GMT""},{""version"":""v2"",""created"":""Tue, 7 Feb 2023 09:33:37 GMT""}]","2023-02-08"
"2302.02668","Kate Minker","Kate Minker, Beno\^it Carry","Deficit of primitive compositions in binary asteroids and pairs","12 pages, 7 figures, last 5 pages are tables","A&A 672, A48 (2023)","10.1051/0004-6361/202245538",,"astro-ph.EP","http://arxiv.org/licenses/nonexclusive-distrib/1.0/","  Context. Small binary asteroid systems and pairs are thought to form through
fission induced by spin up via the Yarkovsky-O'Keefe-Radzievskii-Paddack (YORP)
effect. This process is expected to depend on their structural strength, hence
composition. Aims. We aim to determine how taxonomic classes, used as a proxy
for composition, distribute amongst binary asteroids and asteroid pairs
compared to the general population. Methods. We compare the distribution of
taxonomic classes of binary systems and pairs with that of a reference sample
of asteroids. We build this sample by selecting asteroids to reproduce the
orbital and size distribution of the binaries and pairs to minimize potential
biases between samples. Results. A strong deficit of primitive compositions (C,
B, P, D types) among binary asteroids and asteroid pairs is identified, as well
as a strong excess of asteroids with mafic-silicate rich surface compositions
(S, Q, V, A types). Conclusions. Amongst low mass, rapidly rotating asteroids,
those with mafic-silicate rich compositions are more likely to form multiple
asteroid systems than their primitive counterparts.
","[{""version"":""v1"",""created"":""Mon, 6 Feb 2023 10:10:25 GMT""}]","2023-03-29"
"2302.02669","Jasmin Raissy","Xavier Buff, Jasmin Raissy","Introduction to Fatou components in holomorphic dynamics","This work is part of the C.I.M.E. Lecture Notes ""Modern Aspects of
  Dynamical Systems'' to be published in the Springer Lecture Notes in
  Mathematics -- C.I.M.E. subseries, corresponding to the course taught by the
  second author in Cetraro in August 2021",,,,"math.DS math.CV","http://arxiv.org/licenses/nonexclusive-distrib/1.0/","  This survey is an introduction to the classification of Fatou components in
holomorphic dynamics. We start with the description of the Fatou and Julia sets
for rational maps of the Riemann sphere, and finish with an account of the
recent results on Fatou components for polynomial skew-products in complex
dimension two, where we focus on the key steps in the construction giving the
existence of a wandering domain for a polynomial endomorphism of
$\mathbb{C}^2$.
","[{""version"":""v1"",""created"":""Mon, 6 Feb 2023 10:15:04 GMT""}]","2023-02-07"
"2302.02670","Anthony DEVAUX","Anthony Devaux (BPH), C\'ecile Proust-Lima (BPH), Robin Genuer (BPH)","Random Forests for time-fixed and time-dependent predictors: The
  DynForest R package",,,,,"stat.ML cs.LG","http://arxiv.org/licenses/nonexclusive-distrib/1.0/","  The R package DynForest implements random forests for predicting a
categorical or a (multiple causes) time-to-event outcome based on time-fixed
and time-dependent predictors. Through the random forests, the time-dependent
predictors can be measured with error at subject-specific times, and they can
be endogeneous (i.e., impacted by the outcome process). They are modeled
internally using flexible linear mixed models (thanks to lcmm package) with
time-associations pre-specified by the user. DynForest computes dynamic
predictions that take into account all the information from time-fixed and
time-dependent predictors. DynForest also provides information about the most
predictive variables using variable importance and minimal depth. Variable
importance can also be computed on groups of variables. To display the results,
several functions are available such as summary and plot functions. This paper
aims to guide the user with a step-by-step example of the different functions
for fitting random forests within DynForest.
","[{""version"":""v1"",""created"":""Mon, 6 Feb 2023 10:18:03 GMT""}]","2023-02-07"
"2302.02671","Amey Deshpande","Yogita Mahatekar and Amey Deshpande","Solving fractional Hantavirus model: A new approach",,,,,"math.DS cs.NA math.NA","http://arxiv.org/licenses/nonexclusive-distrib/1.0/","  A three equation differential biodiversity model depicting spread and
propagation of Hantavirus epidemic amongst rodent species under the influence
of alien competing mouse species was introduced by Peixoto and Abramson in
2006. We analyze the Caputo time-fractional version of the Biodiversity model
along with added optimal control parameters as done by Yusof, Abdullah et al. A
new algorithm is proposed to solve fractional differential equations which is
derived from the implementation of Daftardar-Jafari Method(DJM) and implicit
$\theta$-method with $\theta=1$. This newly proposed algorithm is then used to
integrate the Optimal controlled Caputo time-fractional version of Biodiversity
Hantavirus model (OC-CTFBH model). The obtained solutions are plotted and
analyzed further for the effects of parameter variations.
","[{""version"":""v1"",""created"":""Mon, 6 Feb 2023 10:20:43 GMT""}]","2023-02-07"
"2302.02672","Aapo Hyv\""arinen","Aapo Hyv\""arinen, Ilyes Khemakhem, Ricardo Monti","Identifiability of latent-variable and structural-equation models: from
  linear to nonlinear","Revised final version of invited review to be published at Annals of
  the Institute of Statistical Mathematics",,,,"stat.ML cs.LG","http://creativecommons.org/licenses/by/4.0/","  An old problem in multivariate statistics is that linear Gaussian models are
often unidentifiable, i.e. some parameters cannot be uniquely estimated. In
factor (component) analysis, an orthogonal rotation of the factors is
unidentifiable, while in linear regression, the direction of effect cannot be
identified. For such linear models, non-Gaussianity of the (latent) variables
has been shown to provide identifiability. In the case of factor analysis, this
leads to independent component analysis, while in the case of the direction of
effect, non-Gaussian versions of structural equation modelling solve the
problem. More recently, we have shown how even general nonparametric nonlinear
versions of such models can be estimated. Non-Gaussianity is not enough in this
case, but assuming we have time series, or that the distributions are suitably
modulated by some observed auxiliary variables, the models are identifiable.
This paper reviews the identifiability theory for the linear and nonlinear
cases, considering both factor analytic models and structural equation models.
","[{""version"":""v1"",""created"":""Mon, 6 Feb 2023 10:21:21 GMT""},{""version"":""v2"",""created"":""Wed, 3 May 2023 08:35:48 GMT""}]","2023-05-04"
"2302.02673","Fabio Deelan Cunden","Fabio Deelan Cunden, Paolo Facchi, Marilena Ligab\`o","The semiclassical limit of a quantum Zeno dynamics","28 pages, 5 figures",,,,"math-ph math.CA math.MP quant-ph","http://creativecommons.org/licenses/by/4.0/","  Motivated by a quantum Zeno dynamics in a cavity quantum electrodynamics
setting, we study the asymptotics of a family of symbols corresponding to a
truncated momentum operator, in the semiclassical limit of vanishing Planck
constant $\hbar\to0$ and large quantum number $N\to\infty$, with $\hbar N$ kept
fixed. In a suitable topology, the limit is the discontinuous symbol
$p\chi_D(x,p)$ where $\chi_D$ is the characteristic function of the classically
permitted region $D$ in phase space. A refined analysis shows that the symbol
is asymptotically close to the function $p\chi_D^{(N)}(x,p)$, where
$\chi_D^{(N)}$ is a smooth version of $\chi_D$ related to the integrated Airy
function. We also discuss the limit from a dynamical point of view.
","[{""version"":""v1"",""created"":""Mon, 6 Feb 2023 10:24:15 GMT""},{""version"":""v2"",""created"":""Fri, 31 Mar 2023 21:05:59 GMT""}]","2023-04-04"
"2302.02674","Laurette Piani","Andre Izidoro, Laurette Piani (CRPG)","Origin of Water in the Terrestrial Planets: Insights from Meteorite Data
  and Planet Formation Models",,"Elements, 2022, 18 (3), pp.181-186","10.2138/gselements.18.3.181",,"astro-ph.EP physics.geo-ph","http://arxiv.org/licenses/nonexclusive-distrib/1.0/","  Water condensed as ice beyond the water snowline, the location in the Sun's
natal gaseous disk where temperatures were below 170 K. As the disk evolved and
cooled, the snowline moved inwards. A low temperature in the terrestrial
planet-forming region is unlikely to be the origin of water on the planets, and
the distinct isotopic compositions of planetary objects formed in the inner and
outer disks suggest limited early mixing of inner and outer Solar System
materials. Water in our terrestrial planets has rather been derived from
H-bearing materials indigenous to the inner disk and delivered by water-rich
planetesimals formed beyond the snowline and scattered inwards during the
growth, migration, and dynamical evolution of the giant planets.
","[{""version"":""v1"",""created"":""Mon, 6 Feb 2023 10:24:30 GMT""}]","2023-02-07"
"2302.02675","Diego Chamorro","Diego Chamorro (LaMME), David Llerena (LaMME)","Partial suitable solutions for the micropolar equations and regularity
  properties","arXiv admin note: text overlap with arXiv:2111.06653",,,,"math.AP","http://arxiv.org/licenses/nonexclusive-distrib/1.0/","  The incompressible Micropolar system is given by two coupled equations: the
first equation gives the evolution of the velocity field u while the second
equation gives the evolution of the microrotation field $\omega$. In this
article we will consider regularity problems for weak solutions of this system.
For this we will introduce the new notion of partial suitable solutions, which
imposes a specific behavior for the velocity field u only, and under some
classical hypotheses over the pressure, we will obtain a h{\""o}lderian gain for
both variables u and $\omega$.
","[{""version"":""v1"",""created"":""Mon, 6 Feb 2023 10:25:40 GMT""}]","2023-02-07"
