"2302.02778","Emil L{\o}vbak","Emil L{\o}vbak, Fr\'ed\'eric Blondeel, Adam Lee, Lander Vanroye,
  Andreas Van Barel and Giovanni Samaey","Reversible random number generation for adjoint Monte Carlo simulation
  of the heat equation","17 pages, 5 figures, submitted to the proceedings of MCQMC22",,,,"math.NA cs.NA","http://creativecommons.org/licenses/by/4.0/","  In PDE-constrained optimization, one aims to find design parameters that
minimize some objective, subject to the satisfaction of a partial differential
equation. A major challenges is computing gradients of the objective to the
design parameters, as applying the chain rule requires computing the Jacobian
of the design parameters to the PDE's state. The adjoint method avoids this
Jacobian by computing partial derivatives of a Lagrangian. Evaluating these
derivatives requires the solution of a second PDE with the adjoint differential
operator to the constraint, resulting in a backwards-in-time simulation.
  Particle-based Monte Carlo solvers are often used to compute the solution to
high-dimensional PDEs. However, such solvers have the drawback of introducing
noise to the computed results, thus requiring stochastic optimization methods.
To guarantee convergence in this setting, both the constraint and adjoint Monte
Carlo simulations should simulate the same particle trajectories. For large
simulations, storing full paths from the constraint equation for re-use in the
adjoint equation becomes infeasible due to memory limitations. In this paper,
we provide a reversible extension to the family of permuted congruential
pseudorandom number generators (PCG). We then use such a generator to recompute
these time-reversed paths for the heat equation, avoiding these memory issues.
","[{""version"":""v1"",""created"":""Mon, 6 Feb 2023 13:48:30 GMT""}]","2023-02-07"
"2302.02779","Benedicte Sverdrup Ofstad","Benedicte Sverdrup Ofstad and H{\aa}kon Emil Kristiansen and Einar
  Aurbakken and {\O}yvind Sigmundson Sch{\o}yen and Simen Kvaal and Thomas
  Bondo Pedersen","Adiabatic extraction of nonlinear optical properties from real-time
  time-dependent electronic-structure theory",,,,,"physics.chem-ph","http://creativecommons.org/licenses/by/4.0/","  Real-time simulations of laser-driven electron dynamics contain information
about molecular optical properties through all orders in response theory. These
properties can be extracted by assuming convergence of the power series
expansion of induced electric and magnetic multipole moments. However, the
accuracy relative to analytical results from response theory quickly
deteriorates for higher-order responses due to the presence of high-frequency
oscillations in the induced multipole moment in the time domain. This problem
has been ascribed to missing higher-order corrections. We here demonstrate that
the deviations are caused by nonadiabatic effects arising from the finite-time
ramping from zero to full strength of the external laser field. Three different
approaches, two using a ramped wave and one using a pulsed wave, for extracting
electrical properties from real-time time-dependent electronic-structure
simulations are investigated. The standard linear ramp is compared to a
quadratic ramp, which is found to yield highly accurate results for
polarizabilities, and first and second hyperpolarizabilities, at roughly half
the computational cost. Results for the third hyperpolarizability are presented
along with a simple, computable measure of reliability.
","[{""version"":""v1"",""created"":""Mon, 6 Feb 2023 13:49:50 GMT""}]","2023-02-07"
"2302.02780","Rishabh Gupta","Rishabh Gupta, Venktesh V., Mukesh Mohania, Vikram Goyal","Coherence and Diversity through Noise: Self-Supervised Paraphrase
  Generation via Structure-Aware Denoising","12 pages (main}; 22 pages in total",,,,"cs.CL cs.LG","http://arxiv.org/licenses/nonexclusive-distrib/1.0/","  In this paper, we propose SCANING, an unsupervised framework for paraphrasing
via controlled noise injection. We focus on the novel task of paraphrasing
algebraic word problems having practical applications in online pedagogy as a
means to reduce plagiarism as well as ensure understanding on the part of the
student instead of rote memorization. This task is more complex than
paraphrasing general-domain corpora due to the difficulty in preserving
critical information for solution consistency of the paraphrased word problem,
managing the increased length of the text and ensuring diversity in the
generated paraphrase. Existing approaches fail to demonstrate adequate
performance on at least one, if not all, of these facets, necessitating the
need for a more comprehensive solution. To this end, we model the noising
search space as a composition of contextual and syntactic aspects and sample
noising functions consisting of either one or both aspects. This allows for
learning a denoising function that operates over both aspects and produces
semantically equivalent and syntactically diverse outputs through grounded
noise injection. The denoising function serves as a foundation for learning a
paraphrasing function which operates solely in the input-paraphrase space
without carrying any direct dependency on noise. We demonstrate SCANING
considerably improves performance in terms of both semantic preservation and
producing diverse paraphrases through extensive automated and manual evaluation
across 4 datasets.
","[{""version"":""v1"",""created"":""Mon, 6 Feb 2023 13:50:57 GMT""}]","2023-02-07"
"2302.02781","Thilo Egenolf","Thilo Egenolf","Transition crossing of proton beams in SIS100",,,,,"physics.acc-ph","http://creativecommons.org/licenses/by/4.0/","  The proton cycle in the SIS100 synchrotron is designed to deliver single
bunches with $2\times10^{13}$ particles at 29 GeV. During the cycle beam
dynamics near transition energy have to be analyzed to avoid a significant
emittance blow-up. In the past two scenarios were discussed, a shift of the
transition energy above the extraction energy and a transition crossing with a
so called $\gamma_\mathrm{t}$ jump. To estimate the possible emittance blow-up
in both scenarios, longitudinal simulations are presented including the Johnsen
effect based on the second order phase slip factor and the effect of
longitudinal space charge. Furthermore, different parameters in the design of
the $\gamma_\mathrm{t}$ jump are varied and a set of parameters is proposed
that shows minimal longitudinal emittance growth in the simulations.
","[{""version"":""v1"",""created"":""Mon, 6 Feb 2023 13:54:10 GMT""}]","2023-02-07"
"2302.02782","Nathan Priddis","Annabelle Clawson, Drew Johnson, Duncan Morais, Nathan Priddis,
  Caroline B. White","Mirror Map for Landau-Ginzburg models with nonabelian groups","42 pages, 7 Sections, in v2 we updated some references",,,,"math.AG hep-th math-ph math.MP","http://arxiv.org/licenses/nonexclusive-distrib/1.0/","  BHK mirror symmetry as introduced by Berglund--H\""ubsch and Marc Krawitz
between Landau--Ginzburg (LG) models has been the topic of much study in recent
years. An LG model is determined by a potential function and a group of
symmetries. BHK mirror symmetry is only valid when the group of symmetries is
comprised of the so-called diagonal symmetries. Recently, an extension to BHK
mirror symmetry to include nonabelian symmetry groups has been conjectured. In
this article, we provide a mirror map at the level of state spaces between the
LG A-model state space and the LG B-model state space for the mirror model
predicted by the BHK mirror symmetry extension for nonabelian LG models. We
introduce two technical conditions, the Diagonal Scaling Condition, and the
Equivariant $\Phi$ condition, under which a bi-degree preserving isomorphism of
state spaces (the mirror map) is guaranteed to exist, and we prove that the
condition is always satisfied if the permutation part of the group is cyclic of
prime order.
","[{""version"":""v1"",""created"":""Mon, 6 Feb 2023 13:56:33 GMT""},{""version"":""v2"",""created"":""Tue, 14 Feb 2023 15:58:43 GMT""}]","2023-02-15"
"2302.02783","Carlo Nicolai","Mateusz {\L}elyk and Carlo Nicolai","Implicit Commitment in a General Setting",,,,,"math.LO","http://arxiv.org/licenses/nonexclusive-distrib/1.0/","  G\""odel's Incompleteness Theorems suggest that no single formal system can
capture the entirety of one's mathematical beliefs, while pointing at a
hierarchy of systems of increasing logical strength that make progressively
more explicit those \emph{implicit} assumptions. This notion of \emph{implicit
commitment} motivates directly or indirectly several research programmes in
logic and the foundations of mathematics; yet there hasn't been a direct
logical analysis of the notion of implicit commitment itself. In a recent
paper, \L elyk and Nicolai carried out an initial assessment of this project by
studying necessary conditions for implicit commitments; from seemingly weak
assumptions on implicit commitments of an arithmetical system $S$, it can be
derived that a uniform reflection principle for $S$ -- stating that all
numerical instances of theorems of $S$ are true -- must be contained in $S$'s
implicit commitments. This study gave rise to unexplored research avenues and
open questions. This paper addresses the main ones. We generalize this basic
framework for implicit commitments along two dimensions: in terms of iterations
of the basic implicit commitment operator, and via a study of implicit
commitments of theories in arbitrary first-order languages, not only couched in
an arithmetical language.
","[{""version"":""v1"",""created"":""Mon, 6 Feb 2023 13:56:39 GMT""},{""version"":""v2"",""created"":""Sun, 23 Apr 2023 14:16:06 GMT""}]","2023-04-25"
"2302.02784","Minou Khoshrangbaf","Amin Rezaei Akbarieh, Minou Khoshragbaf and Mohammad Atazadeh","Accretion disk around regular black holes","12 pages, 11 figures, 1 table",,,,"gr-qc astro-ph.GA","http://creativecommons.org/publicdomain/zero/1.0/","  Regular black holes are crucially important as approaches to solving the
singularity problem, and in this paper, the accretion disk of Bardeen and
Hayward models have been studied. For this purpose, we calculated the physical
properties of black holes, including radiant energy, luminosity derivative,
temperature, and conversion efficiency of accretion mass into radiation. The
obtained results show that the non-zero-free parameters of regular black holes
cause the radius of the innermost stable circular orbit of the disk to shift to
smaller values. As a result of this displacement, we saw an increase in the
profiles of radiant energy, luminosity derivative, and temperature. We also
find that Bardeen and Hayward's black holes are more efficient in converting
mass to radiation than Schwarzschild. Finally, we compared the free parameter
of these two black holes with the spin of the rotating black hole and found
that the Bardeen and Hayward black holes can mimic the slowly rotating Kerr
black hole.
","[{""version"":""v1"",""created"":""Mon, 6 Feb 2023 13:56:54 GMT""}]","2023-02-07"
"2302.02785","Lovis Heindrich","Lovis Heindrich, Saksham Consul, Falk Lieder","Leveraging AI to improve human planning in large partially observable
  environments",,,,,"cs.AI","http://creativecommons.org/licenses/by/4.0/","  AI can not only outperform people in many planning tasks, but also teach them
how to plan better. All prior work was conducted in fully observable
environments, but the real world is only partially observable. To bridge this
gap, we developed the first metareasoning algorithm for discovering
resource-rational strategies for human planning in partially observable
environments. Moreover, we developed an intelligent tutor teaching the
automatically discovered strategy by giving people feedback on how they plan in
increasingly more difficult problems. We showed that our strategy discovery
method is superior to the state-of-the-art and tested our intelligent tutor in
a preregistered training experiment with 330 participants. The experiment
showed that people's intuitive strategies for planning in partially observable
environments are highly suboptimal, but can be substantially improved by
training with our intelligent tutor. This suggests our human-centred tutoring
approach can successfully boost human planning in complex, partially observable
sequential decision problems.
","[{""version"":""v1"",""created"":""Mon, 6 Feb 2023 13:57:08 GMT""}]","2023-02-07"
"2302.02787","Lena Mangold","Lena Mangold and Camille Roth","Generative models for two-ground-truth partitions in networks",,,,,"cs.SI cond-mat.stat-mech cs.LG physics.data-an physics.soc-ph","http://arxiv.org/licenses/nonexclusive-distrib/1.0/","  A myriad of approaches have been proposed to characterise the mesoscale
structure of networks - most often as a partition based on patterns variously
called communities, blocks, or clusters. Clearly, distinct methods designed to
detect different types of patterns may provide a variety of answers to the
network's mesoscale structure. Yet, even multiple runs of a given method can
sometimes yield diverse and conflicting results, yielding entire landscapes of
partitions which potentially include multiple (locally optimal) mesoscale
explanations of the network. Such ambiguity motivates a closer look at the
ability of these methods to find multiple qualitatively different 'ground
truth' partitions in a network. Here, we propose a generative model which
allows for two distinct partitions to be built into the mesoscale structure of
a single benchmark network. We demonstrate a use case of the benchmark model by
exploring the power of stochastic block models (SBMs) to detect coexisting
bi-community and core-periphery structures of different strengths. We find that
the ability to detect the two partitions individually varies considerably by
SBM variant and that coexistence of both partitions is recovered only in a very
limited number of cases. Our findings suggest that in most instances only one -
in some way dominating - structure can be detected, even in the presence of
other partitions in the generated network. They underline the need for
considering entire landscapes of partitions when different competing
explanations exist and motivate future research to advance partition
coexistence detection methods. Our model also contributes to the field of
benchmark networks more generally by enabling further exploration of the
ability of new and existing methods to detect ambiguity in mesoscale structure
of networks.
","[{""version"":""v1"",""created"":""Mon, 6 Feb 2023 14:02:28 GMT""}]","2023-02-07"
"2302.02788","Matthew Smith","Matthew Smith, Lucas Maystre, Zhenwen Dai, Kamil Ciosek","A Strong Baseline for Batch Imitation Learning","28 pages (10 main, 18 appendix), 4 figures",,,,"cs.LG","http://arxiv.org/licenses/nonexclusive-distrib/1.0/","  Imitation of expert behaviour is a highly desirable and safe approach to the
problem of sequential decision making. We provide an easy-to-implement, novel
algorithm for imitation learning under a strict data paradigm, in which the
agent must learn solely from data collected a priori. This paradigm allows our
algorithm to be used for environments in which safety or cost are of critical
concern. Our algorithm requires no additional hyper-parameter tuning beyond any
standard batch reinforcement learning (RL) algorithm, making it an ideal
baseline for such data-strict regimes. Furthermore, we provide formal sample
complexity guarantees for the algorithm in finite Markov Decision Problems. In
doing so, we formally demonstrate an unproven claim from Kearns & Singh (1998).
On the empirical side, our contribution is twofold. First, we develop a
practical, robust and principled evaluation protocol for offline RL methods,
making use of only the dataset provided for model selection. This stands in
contrast to the vast majority of previous works in offline RL, which tune
hyperparameters on the evaluation environment, limiting the practical
applicability when deployed in new, cost-critical environments. As such, we
establish precedent for the development and fair evaluation of offline RL
algorithms. Second, we evaluate our own algorithm on challenging continuous
control benchmarks, demonstrating its practical applicability and
competitiveness with state-of-the-art performance, despite being a simpler
algorithm.
","[{""version"":""v1"",""created"":""Mon, 6 Feb 2023 14:03:33 GMT""}]","2023-02-07"
"2302.02789","Alexandre Rodrigues Dr.","Alexandre A. P. Rodrigues","Differential equations with pulses: existence and stability of periodic
  solutions","20 pages, 6 images, 1 table",,,,"math.DS","http://arxiv.org/licenses/nonexclusive-distrib/1.0/","  We consider generic differential equations in $\mathbb{R}$ with a finite
number of hyperbolic equilibria, which are subject to $\omega$--periodic
instantaneous perturbative pulses ($\omega>0$). Using the time-$ \omega$ map of
the original system (without perturbation), we are able to find all periodic
solutions of the perturbed system and study their stability. In this article,
we establish an algorithm to locate $\omega$--periodic solutions of impulsive
systems of frequency $\omega$, to study their stability and to locate
Saddle-node bifurcations. With our technique, we are able to fully characterise
the asymptotic dynamics of the system under consideration.
","[{""version"":""v1"",""created"":""Mon, 6 Feb 2023 14:06:52 GMT""}]","2023-02-07"
"2302.02790","Daniel Bogdoll","Daniel Bogdoll and Svenja Uhlemeyer and Kamil Kowol and J. Marius
  Z\""ollner","Perception Datasets for Anomaly Detection in Autonomous Driving: A
  Survey","Accepted for publication at IV 2023",,,,"cs.RO cs.CV","http://creativecommons.org/licenses/by/4.0/","  Deep neural networks (DNN) which are employed in perception systems for
autonomous driving require a huge amount of data to train on, as they must
reliably achieve high performance in all kinds of situations. However, these
DNN are usually restricted to a closed set of semantic classes available in
their training data, and are therefore unreliable when confronted with
previously unseen instances. Thus, multiple perception datasets have been
created for the evaluation of anomaly detection methods, which can be
categorized into three groups: real anomalies in real-world, synthetic
anomalies augmented into real-world and completely synthetic scenes. This
survey provides a structured and, to the best of our knowledge, complete
overview and comparison of perception datasets for anomaly detection in
autonomous driving. Each chapter provides information about tasks and ground
truth, context information, and licenses. Additionally, we discuss current
weaknesses and gaps in existing datasets to underline the importance of
developing further data.
","[{""version"":""v1"",""created"":""Mon, 6 Feb 2023 14:07:13 GMT""},{""version"":""v2"",""created"":""Fri, 31 Mar 2023 11:43:42 GMT""}]","2023-04-03"
"2302.02792","Hadi Nekoei","Hadi Nekoei, Akilesh Badrinaaraayanan, Amit Sinha, Mohammad Amini,
  Janarthanan Rajendran, Aditya Mahajan, Sarath Chandar","Dealing With Non-stationarity in Decentralized Cooperative Multi-Agent
  Deep Reinforcement Learning via Multi-Timescale Learning",,,,,"cs.LG","http://creativecommons.org/publicdomain/zero/1.0/","  Decentralized cooperative multi-agent deep reinforcement learning (MARL) can
be a versatile learning framework, particularly in scenarios where centralized
training is either not possible or not practical. One of the key challenges in
decentralized deep MARL is the non-stationarity of the learning environment
when multiple agents are learning concurrently. A commonly used and efficient
scheme for decentralized MARL is independent learning in which agents
concurrently update their policies independent of each other. We first show
that independent learning does not always converge, while sequential learning
where agents update their policies one after another in a sequence is
guaranteed to converge to an agent-by-agent optimal solution. In sequential
learning, when one agent updates its policy, all other agent's policies are
kept fixed, alleviating the challenge of non-stationarity due to concurrent
updates in other agents' policies. However, it can be slow because only one
agent is learning at any time. Therefore it might also not always be practical.
In this work, we propose a decentralized cooperative MARL algorithm based on
multi-timescale learning. In multi-timescale learning, all agents learn
concurrently, but at different learning rates. In our proposed method, when one
agent updates its policy, other agents are allowed to update their policies as
well, but at a slower rate. This speeds up sequential learning, while also
minimizing non-stationarity caused by other agents updating concurrently.
Multi-timescale learning outperforms state-of-the-art decentralized learning
methods on a set of challenging multi-agent cooperative tasks in the epymarl
(papoudakis2020) benchmark. This can be seen as a first step towards more
general decentralized cooperative deep MARL methods based on multi-timescale
learning.
","[{""version"":""v1"",""created"":""Mon, 6 Feb 2023 14:10:53 GMT""}]","2023-02-07"
"2302.02798","Shu Chen","Cui-Xian Guo, Xueliang Wang, Haiping Hu, Shu Chen","Accumulation of scale-free localized states induced by local
  non-Hermiticity","14 pages, 11 figures, published version in Phys. Rev. B as Editors'
  Suggestion","Phys. Rev. B 107, 134121 (2023)","10.1103/PhysRevB.107.134121",,"quant-ph cond-mat.other","http://creativecommons.org/licenses/by/4.0/","  The bulk states of Hermitian systems are believed insensitive to local
Hermitian impurities or perturbations except for a few impurity-induced bound
states. Thus, it is important to ask whether \textit{local} non-Hermiticity can
cause drastic changes to the original Hermitian systems. Here we address this
issue affirmatively and present exact solutions for the double chain model with
local non-Hermitian terms possessing parity-time ($\mathcal{PT}$) symmetry.
Induced by the non-Hermiticity, the system undergoes a sequence of
$\mathcal{PT}$-symmetry breakings, after which the eigenenergies appear in
complex conjugate pairs. The associated extended bulk states then become
scale-free localized and unidirectionally accumulated around the impurity.
There exist mobility edges separating the residual extended states until a full
scale-free localization of all eigenstates. Further increasing the
non-Hermitity counter-intuitively brings the system to a
$\mathcal{PT}$-restoration regime with fully real spectra except for a pair of
complex bound states. We demonstrate that the local non-Hermiticity generated
scale-free localization is a general phenomenon and can even survive the
quasiperiodic disorder. Our results indicate that the bulk properties of the
original Hermitian system can be globally reshaped by local non-Hermiticity.
","[{""version"":""v1"",""created"":""Mon, 6 Feb 2023 14:17:52 GMT""},{""version"":""v2"",""created"":""Sat, 18 Feb 2023 06:31:22 GMT""},{""version"":""v3"",""created"":""Sun, 30 Apr 2023 08:30:15 GMT""}]","2023-05-02"
"2302.02799","Sergey Stepanov E","Sergey E. Stepanov, Josef Mikes, Irina I. Tsyganok","New applications of the Ahlfors Laplacian",,,,,"math.DG","http://arxiv.org/licenses/nonexclusive-distrib/1.0/","  In this article, we consider an orthogonal decomposition of the traceless
part of the Ricci tensor of a compact Riemannian manifold and study its
application to the geometry of compact almost Ricci solitons. In addition, we
consider an orthogonal expansion of the traceless part of the second
fundamental form of a compact spacelike hypersurface in a Lorentzian manifold
and study its application to the problem of constructing solutions of general
relativistic constraint equations in vacuum. In these two cases, we use the
well-known Ahlfors Laplacian.
","[{""version"":""v1"",""created"":""Mon, 6 Feb 2023 14:20:11 GMT""}]","2023-02-07"
"2302.02800","Cong Zhang","Cong Zhang, Yongge Ma, Jinsong Yang","Black hole image encoding quantum gravity information","5+6 pages, 5 figures, revise the paper structure to make it more
  understandable and add more discussion in Sec. IV",,,,"gr-qc","http://creativecommons.org/licenses/by/4.0/","  The quantum extension of the Kruskal spacetime indicates the existence of a
companion black hole in the universe earlier than ours. It is shown that the
radiations from the companion black hole can enter its horizon, pass through
the deep Planck region, and show up from the white hole in our universe. These
radiations inlay extra bright rings in the image of the black hole in our
universe, and some of these rings appear distinctly in the shadow region.
Therefore, the image of the black hole observed by us encodes the information
of quantum gravity. The positions and widths of the bright rings are predicted
precisely. The predictive values for supermassive black holes are universal for
a quite general class of quantum-modified spacetimes with the phenomenon of
black hole to white hole transition. Thus, our result opens a new experimental
window to test this phenomenon predicted by quantum gravity.
","[{""version"":""v1"",""created"":""Mon, 6 Feb 2023 14:21:54 GMT""},{""version"":""v2"",""created"":""Mon, 20 Feb 2023 12:04:28 GMT""},{""version"":""v3"",""created"":""Tue, 28 Feb 2023 10:40:06 GMT""}]","2023-03-01"
