"2302.02416","Michael B\""orsch","Lukas Spantzel, Iv\'an P\'erez, Thomas Heitkamp, Anika Westphal,
  Stefanie Reuter, Ralf Mrowka, Michael B\""orsch","Monitoring oligomerization dynamics of individual human neurotensin
  receptors 1 in living cells and in SMALP nanodiscs","13 pages, 4 figures",,,,"q-bio.BM q-bio.SC","http://creativecommons.org/licenses/by/4.0/","  The human neurotensin receptor 1 (NTSR1) is a G protein-coupled receptor. The
receptor is activated by a small peptide ligand neurotensin. NTSR1 can be
expressed in HEK cells by stable transfection. Previously we used the
fluorescent protein markers mRuby3 or mNeonGreen fused to NTSR1 for EMCCD-based
structured illumination microscopy (SIM) in living HEK cells. Ligand binding
induced conformational changes in NTSR1 which triggered the intracellular
signaling processes. Recent single-molecule studies revealed a dynamic
monomer/dimer equilibrium of this receptor in artificial lipid bilayers. Here
we report on the oligomerization state of human NTSR1 from living cells by
trapping them into lipid nanodiscs. Briefly, SMALPs (styrene-maleic acid
copolymer lipid nanoparticles) were produced directly from the plasma membranes
of living HEK293T FlpIn cells. SMALPs with a diameter of 15 nm were soluble and
stable. NTSR1 in SMALPs were analyzed by single-molecule intensity measurements
one membrane patch at a time using a custom-built confocal anti-Brownian
electrokinetic trap (ABEL trap) microscope. We found oligomerization changes
before and after stimulation of the receptor with its ligand neurotensin.
","[{""version"":""v1"",""created"":""Sun, 5 Feb 2023 16:00:48 GMT""}]","2023-02-07"
"2302.02417","Minho Cho","Minho Cho, Andreas F. Holmsen, Jinha Kim and Minki Kim","Strong Erd\H{o}s-Hajnal properties in chordal graphs","17 pages",,,,"math.CO","http://arxiv.org/licenses/nonexclusive-distrib/1.0/","  A graph class $\mathcal{G}$ has the strong Erd\H{o}s-Hajnal property
(SEH-property) if there is a constant $c=c(\mathcal{G}) > 0$ such that for
every member $G$ of $\mathcal{G}$, either $G$ or its complement has $K_{m, m}$
as a subgraph where $m \geq \left\lfloor c|V(G)|\right\rfloor$. We prove that
the class of chordal graphs satisfy SEH-property with constant $c = 2/9$. On
the other hand, a strengthening of SEH-property which we call the colorful
Erd\H{o}s-Hajnal property was discussed in geometric settings by Alon et al.
(2005) and by Fox et al. (2012). Inspired by their results, we show that for
every pair $F_1, F_2$ of subtree families of the same size in a tree $T$ with
$k$ leaves, there exists subfamilies $F'_1 \subseteq F_1$ and $F'_2 \subseteq
F_2$ of size $\theta \left( \frac{\ln k}{k} \left| F_1 \right|\right)$ such
that either every pair of representatives from distinct subfamilies intersect
or every such pair do not intersect. Our results are asymptotically optimal.
","[{""version"":""v1"",""created"":""Sun, 5 Feb 2023 16:04:32 GMT""}]","2023-02-07"
"2302.02418","Chengfeng Cai","Xue-Min Jiang, Chengfeng Cai, Yu-Hang Su, Hong-Hao Zhang","Freeze-in Production of Pseudo-Nambu-Goldstone Dark Matter Model with a
  Real Scalar","30 pages, 10 figures",,,,"hep-ph","http://creativecommons.org/licenses/by/4.0/","  In this work, we study a pseudo-Nambu-Goldstone boson (pNGB) dark matter
model extended with a real scalar. The dark sector is assumed to be feebly
coupled with the standard model (SM) via a Higgs portal, so that the pNGB dark
matter is produced by the freeze-in mechanism. Since the production happened in
a very high energy era, we introduce an extra scalar field which is weakly
coupled to the SM for stablizing the electroweak vacuum. Our model can
reproduce the correct relic abundance of dark matter favored by observations.
In addition, we determine the evolution of couplings in higher energy scale by
solving the renormalization group equations, and show that the self coupling of
the real scalar, $\lambda_S$, and the mixing coupling between the Higgs field
and the real scalar, $\lambda_{HS}$ are stringently constrained by the
conditions of vacuum stability and couplings perturbativity up to the Planck
scale. We also find that the relic abundance of DM is insensitive to the values
of $\lambda_S$ and $\lambda_{HS}$ unless the dominant production processes are
$\overline{H}+H(S+S)\to\phi+\phi$ via t- and u-channels.
","[{""version"":""v1"",""created"":""Sun, 5 Feb 2023 16:05:45 GMT""},{""version"":""v2"",""created"":""Mon, 20 Feb 2023 08:13:20 GMT""}]","2023-02-21"
"2302.02419","Jiachen Luo","Jiachen Luo, Huy Phan, Joshua Reiss","deep learning of segment-level feature representation for speech emotion
  recognition in conversations","6 pages, 4 figures",,,,"cs.CL cs.SD eess.AS","http://arxiv.org/licenses/nonexclusive-distrib/1.0/","  Accurately detecting emotions in conversation is a necessary yet challenging
task due to the complexity of emotions and dynamics in dialogues. The emotional
state of a speaker can be influenced by many different factors, such as
interlocutor stimulus, dialogue scene, and topic. In this work, we propose a
conversational speech emotion recognition method to deal with capturing
attentive contextual dependency and speaker-sensitive interactions. First, we
use a pretrained VGGish model to extract segment-based audio representation in
individual utterances. Second, an attentive bi-directional gated recurrent unit
(GRU) models contextual-sensitive information and explores intra- and
inter-speaker dependencies jointly in a dynamic manner. The experiments
conducted on the standard conversational dataset MELD demonstrate the
effectiveness of the proposed method when compared against state-of the-art
methods.
","[{""version"":""v1"",""created"":""Sun, 5 Feb 2023 16:15:46 GMT""}]","2023-02-07"
"2302.02420","Yadi Wei","Yadi Wei, Roni Khardon","Direct Uncertainty Quantification","28 pages, 11 figures",,,,"cs.LG stat.ML","http://arxiv.org/licenses/nonexclusive-distrib/1.0/","  Traditional neural networks are simple to train but they produce
overconfident predictions, while Bayesian neural networks provide good
uncertainty quantification but optimizing them is time consuming. This paper
introduces a new approach, direct uncertainty quantification (DirectUQ), that
combines their advantages where the neural network directly outputs the mean
and variance of the last layer. DirectUQ can be derived as an alternative
variational lower bound, and hence benefits from collapsed variational
inference that provides improved regularizers. On the other hand, like
non-probabilistic models, DirectUQ enjoys simple training and one can use
Rademacher complexity to provide risk bounds for the model. Experiments show
that DirectUQ and ensembles of DirectUQ provide a good tradeoff in terms of run
time and uncertainty quantification, especially for out of distribution data.
","[{""version"":""v1"",""created"":""Sun, 5 Feb 2023 16:19:01 GMT""},{""version"":""v2"",""created"":""Fri, 10 Feb 2023 20:43:31 GMT""},{""version"":""v3"",""created"":""Tue, 16 May 2023 18:48:33 GMT""}]","2023-05-18"
"2302.02421","Peter Crooks","Peter Crooks and Jonathan Weitsman","Abelianization and the Duistermaat-Heckman theorem",,,,,"math.SG","http://arxiv.org/licenses/nonexclusive-distrib/1.0/","  Fix a compact connected Lie group $G$ with Lie algebra $\mathfrak{g}$, as
well as a strong Gelfand-Cetlin datum on $\mathfrak{g}^*$. Let us also fix a
connected symplectic manifold $M$ endowed with an effective Hamiltonian
$G$-action and proper moment map. We associate to such information a measure on
$\mathbb{R}^{\mathrm{b}}$, where $\mathrm{b}=\frac{1}{2}(\dim
G+\mathrm{rank}\hspace{2pt}G)$. We also express the Radon-Nikodym derivative of
this measure in terms of the volumes of the symplectic quotients of $M$ by $G$,
and thereby prove a non-abelian version of the Duistermaat-Heckman theorem.
","[{""version"":""v1"",""created"":""Sun, 5 Feb 2023 16:19:10 GMT""}]","2023-02-07"
"2302.02422","Diogo Buarque Franzosi","Diogo Buarque Franzosi","Towards the precise description of Composite Higgs models at colliders","26 pages, 10 figures",,,,"hep-ph","http://creativecommons.org/licenses/by/4.0/","  We present a framework to study the interactions among Nambu-Goldstone bosons
(NGB), pseudo-NGB (pNGBs) and gauge bosons in Composite Higgs (CH) models at
high energies, including operators of order $\mathcal{O}(p^4)$ and
$\mathcal{O}(p^2g^2)$ in the chiral expansion and topological terms. The set of
(p)NGBs comprises the longitudinal modes of electroweak bosons, the Higgs
boson, and possibly other scalar states from the dynamical spontaneous
electroweak symmetry breaking. The framework is implemented in a collider
simulation tool especially suited for the study of Goldstone Boson Scattering
(GBS), which includes vector boson scattering (VBS), di-Higgs production via
vector boson fusion (VBF) and the pair production of other pNGBs via VBF.
","[{""version"":""v1"",""created"":""Sun, 5 Feb 2023 16:19:47 GMT""}]","2023-02-07"
"2302.02423","Lawrence P. Horwitz","L.P. Horwitz","$N\geq 2$ Particles in the Framework of TeVeS","5 pages, no figures",,"10.1088/1742-6596/2482/1/012001",,"gr-qc","http://arxiv.org/licenses/nonexclusive-distrib/1.0/","  About 40 years ago, since no viable candidate for ""dark matter"" was
discovered, M. Milgrom and J. Bekenstein introduced a non-covariant modfication
of gravitational theory ((MOND) to account for the anomalpous rotation curves
of galaxies. Bekenstein and Sanders then developed a relativistically covariant
form of the theory, called TeVeS, involvimg scalar and tensor fields which
accounts for the rotation currves as well asfor the observed lensing of
background radiation around galaxies without the introduction of ""dark matter"".
The dynamical behavior of a particle in such a gravitational theory has
recently been discussed by Horwitz, Gershon and Schiffer. In this paper we
study the dynamics of the $N \geq 2$ particle problem in the framework of the
TeVeS theory.
","[{""version"":""v1"",""created"":""Sun, 5 Feb 2023 16:35:12 GMT""}]","2023-05-31"
"2302.02424","Heung-Sik Kim","Heung-Sik Kim, Sang Hyeon Park, Myung Joon Han","Epitaxially strained ultrathin LaNiO$_3$/LaAlO$_3$ and
  LaNiO$_3$/SrTiO$_3$ superlattices: a density functional theory + $U$ study","9 pages, 8 figures","Current Applied Physics 50, 53-60 (2023)","10.1016/j.cap.2023.03.012",,"cond-mat.str-el cond-mat.mtrl-sci","http://arxiv.org/licenses/nonexclusive-distrib/1.0/","  By employing first-principles electronic structure calculations we
investigate nickelate superlattices [LaNiO$_3$]$_1$/[LaAlO$_3$]$_1$ and
[LaNiO$_3$]$_1$/[SrTiO$_3$]$_1$ with (001) orientation under epitaxial tensile
strain. Within density functional theory augmented by mean-field treatement of
on-site electronic correlations, the ground states show remarkable dependence
on the correlation strength and the strain. In the weakly and intermediately
correlated regimes with small epitaxial strain, the charge-disproportionated
insulating states with antiferromagneitc order is favored over the other
orbital and spin ordered phases. On the other hand, in the strongly correlated
regime or under the large tensile strain, ferromagnetic spin states with
Jahn-Teller orbital order become most stable. The effect from polar interfaces
in LaNiO$_3$]$_1$/[SrTiO$_3$]$_1$ is found to be noticeable in our
single-layered geometry. Detailed discussion is presented in comparison with
previous experimental and theoretical studies.
","[{""version"":""v1"",""created"":""Sun, 5 Feb 2023 16:43:37 GMT""},{""version"":""v2"",""created"":""Tue, 7 Feb 2023 01:57:12 GMT""},{""version"":""v3"",""created"":""Mon, 10 Apr 2023 18:05:36 GMT""}]","2023-04-12"
"2302.02425","Robert Grossman","Robert L. Grossman, Maryellen L. Giger, Julie A. Johnson, Jeremy D.
  Marks, Jessica P. Ridgway, Julian Solway, and Walter M. Stadler","Principles and Guidelines for Sharing Biomedical Data for Secondary Use:
  The University of Chicago Perspective","6 pages",,,,"q-bio.OT","http://creativecommons.org/licenses/by/4.0/","  Academic medical centers are generating an increasing amount of biomedical
data and there is an increasing demand for biomedical data for research
purposes by research projects, research consortia, companies, and other third
parties. At the same time, as the number of patients grows and the amount of
data per patient grows, there is an increasing possibility that some
information about some patients may become available if the data is shared with
third parties and the third parties have a data breach or violate the terms of
the data use agreement. Balancing the importance of research that may result in
improved patient outcomes with the importance of protecting patient data is
challenging. The article discusses the principles, considerations about risks
and mitigating risks, and guidelines used at the University of Chicago used for
making decisions about sharing biomedical data with third parties.
","[{""version"":""v1"",""created"":""Sun, 5 Feb 2023 16:43:58 GMT""}]","2023-02-07"
"2302.02426","Xin Liu","Xin Liu, Zixian Yang, Lei Ying","Online Nonstochastic Control with Adversarial and Static Constraints",,,,,"cs.LG cs.SY eess.SY","http://arxiv.org/licenses/nonexclusive-distrib/1.0/","  This paper studies online nonstochastic control problems with adversarial and
static constraints. We propose online nonstochastic control algorithms that
achieve both sublinear regret and sublinear adversarial constraint violation
while keeping static constraint violation minimal against the optimal
constrained linear control policy in hindsight. To establish the results, we
introduce an online convex optimization with memory framework under adversarial
and static constraints, which serves as a subroutine for the constrained online
nonstochastic control algorithms. This subroutine also achieves the
state-of-the-art regret and constraint violation bounds for constrained online
convex optimization problems, which is of independent interest. Our experiments
demonstrate the proposed control algorithms are adaptive to adversarial
constraints and achieve smaller cumulative costs and violations. Moreover, our
algorithms are less conservative and achieve significantly smaller cumulative
costs than the state-of-the-art algorithm.
","[{""version"":""v1"",""created"":""Sun, 5 Feb 2023 16:46:12 GMT""}]","2023-02-07"
"2302.02427","Pramod P Nair","Sneha K H, Adhithya Sudeesh, Pramod P Nair, Prashanth Suravajhala","Biologically inspired ChaosNet architecture for Hypothetical Protein
  Classification",,,,,"cs.LG","http://creativecommons.org/licenses/by/4.0/","  ChaosNet is a type of artificial neural network framework developed for
classification problems and is influenced by the chaotic property of the human
brain. Each neuron of the ChaosNet architecture is the one-dimensional chaotic
map called the Generalized Luroth Series (GLS). The addition of GLS as neurons
in ChaosNet makes the computations straightforward while utilizing the
advantageous elements of chaos. With substantially less data, ChaosNet has been
demonstrated to do difficult classification problems on par with or better than
traditional ANNs. In this paper, we use Chaosnet to perform a functional
classification of Hypothetical proteins [HP], which is indeed a topic of great
interest in bioinformatics. The results obtained with significantly lesser
training data are compared with the standard machine learning techniques used
in the literature.
","[{""version"":""v1"",""created"":""Sun, 5 Feb 2023 16:48:49 GMT""}]","2023-02-07"
"2302.02428","Golsa Mirbagheri","Golsa Mirbagheri, Ikemefuna Uba, Kesete Ghebreyessus, Uwe Hommerich,
  Seth Fraden, Michael Stehnach, Demetris Geddis","Numerical analysis of the propagation modes of photo-switching
  PDMS-arylazopyrazole optical waveguide and thin-film spectroscopic
  characterization",,"SPIE PHOTONICS WEST 2023 Integrated Optics: Devices, Materials,
  and Technologies XXVII",,"12424 - 101 V. 3","physics.optics physics.app-ph","http://arxiv.org/licenses/nonexclusive-distrib/1.0/","  A new light responsive arylazopyrazole (AAP) containing polymer matrix thin
film is fabricated by spin-coating of different concentrations of the AAP azo
dye into the polydimethylsiloxane (PDMS) polymer at 150C. The new AAP molecular
switch was also used to fabricate a solid-state PDMS-AAP waveguide by contact
lithography and soft replica modeling methods in the micrometer scale. The
refractive index of the spin-coated photoswitchable material can be modulated
via the reversible trans-to-cis photoisomerization behavior of the AAP unit
using different concentrations. When 0.01 M solution of the AAP unit was used,
the refractive of the composite was 2.32 in the trans state and dropped to 1.85
in the cis state in the operating wavelength of 340 nm. At higher
concentrations of 0.020 and 0.03 M, a wide refractive index tuning is achieved
under the same wavelength. In 0.030 M the refractive index was 2.65 for the
trans state and 2.0 for the cis state. The results suggest that the increase in
refractive index tuning is related to the concentration of the AAP unit of the
composite film. Theoretically, the spectral properties of the composite film
are also simulated with two methods: 1) the Maxwell Equations; and 2) the
frequency dependent finite element, showing excellent agreement for the
different propagation modes of the proposed waveguide for regulated signals of
365/525 nm wavelengths. Furthermore, the photoisomerization of the PDMS-AAP
thin film is analyzed with UV-vis spectroscopy to demonstrate the isomerization
responses of the AAP moiety in the solid state. Additionally, preliminary
photomechanical actuation properties of the composite film have been
investigated. The PDMS-AAP waveguide described in this study provides a new
approach for optically tunable photonics applications in the Visible-IR region.
","[{""version"":""v1"",""created"":""Sun, 5 Feb 2023 16:51:12 GMT""}]","2023-02-07"
"2302.02429","Pablo G P\'erez-Gonz\'alez","Pablo G. P\'erez-Gonz\'alez, Luca Costantin, Danial Langeroodi,
  Pierluigi Rinaldi, Marianna Annunziatella, Olivier Ilbert, Luis Colina, Hans
  Ulrik Noorgaard-Nielsen, Thomas Greve, G\""oran Ostlin, Gillian Wright,
  Almudena Alonso-Herrero, Javier \'Alvarez-M\'arquez, Karina I. Caputi,
  Andreas Eckart, Olivier Le F\`evre, \'Alvaro Labiano, Macarena
  Garc\'ia-Mar\'in, Jens Hjorth, Sarah Kendrew, John P. Pye, Tuomo Tikkanen,
  Paul van der Werf, Fabian Walter, Martin Ward, Arjan Bik, Leindert Boogaard,
  Sarah E. I. Bosman, Alejandro Crespo G\'omez, Steven Gillman, Edoardo Iani,
  Iris Jermann, Jens Melinder, Romain A. Meyer, Thibaud Moutard, Ewine van
  Dishoek, Thomas Henning, Pierre-Olivier Lagage, Manuel Guedel, Florian
  Peissker, Tom Ray, Bart Vandenbussche, \'Angela Garc\'ia-Argum\'anez, and
  Rosa Mar\'ia M\'erida","Life beyond 30: probing the -20<M_UV<-17 luminosity function at 8<z<13
  with the NIRCam parallel field of the MIRI Deep Survey","Accepted for publication in ApJL, in memoriam Hans Ulrik
  Noorgaard-Nielsen and Olivier Le F\`evre",,,,"astro-ph.GA","http://arxiv.org/licenses/nonexclusive-distrib/1.0/","  We present the ultraviolet luminosity function and an estimate of the cosmic
star formation rate density at $8<z<13$ derived from deep NIRCam observations
taken in parallel with the MIRI Deep Survey (MDS) of the Hubble Ultra Deep
Field (HUDF), NIRCam covering the parallel field 2 (HUDF-P2). Our deep (40
hours) NIRCam observations reach a F277W magnitude of 30.8 ($5\sigma$), more
than 2 magnitudes deeper than JWST public datasets already analyzed to find
high redshift galaxies. We select a sample of 44 $z>8$ galaxy candidates based
on their dropout nature in the F115W and/or F150W filters, a high probability
for their photometric redshifts, estimated with three different codes, being at
$z>8$, good fits based on $\chi^2$ calculations, and predominant solutions
compared to $z<8$ alternatives. We find mild evolution in the luminosity
function from $z\sim13$ to $z\sim8$, i.e., only a small increase in the average
number density of $\sim$0.2 dex, while the faint-end slope and absolute
magnitude of the knee remain approximately constant, with values
$\alpha=-2.2\pm0.1$ and $M^*=-20.8\pm0.2$ mag. Comparing our results with the
predictions of state-of-the-art galaxy evolution models, we find two main
results: (1) a slower increase with time in the cosmic star formation rate
density compared to a steeper rise predicted by models; (2) nearly a factor of
10 higher star formation activity concentrated in scales around 2 kpc in
galaxies with stellar masses $\sim10^8$ M$_\odot$ during the first 350 Myr of
the Universe, $z\sim12$, with models matching better the luminosity density
observational estimations $\sim$150 Myr later, by $z\sim9$.
","[{""version"":""v1"",""created"":""Sun, 5 Feb 2023 16:52:36 GMT""},{""version"":""v2"",""created"":""Tue, 7 Feb 2023 17:06:17 GMT""},{""version"":""v3"",""created"":""Wed, 8 Feb 2023 10:06:40 GMT""},{""version"":""v4"",""created"":""Mon, 22 May 2023 16:25:16 GMT""}]","2023-05-23"
"2302.02430","Diana Avadanii","Diana Avadanii, Anna Kareer, Lars Hansen, Angus Wilkinson","Calibration and data analysis routines for nanoindentation with
  spherical tips",,,,,"cond-mat.mtrl-sci","http://creativecommons.org/licenses/by-sa/4.0/","  Instrumented spherical nanoindentation with a continuous stiffness
measurement has gained increased popularity in material science studies in
brittle and ductile materials alike. These investigations span hypotheses
related to a wide range of microphysics involving grain boundaries, twins,
dislocation densities, ion-induced damage and more. These studies rely on the
implementation of different methodologies for instrument calibration and for
circumventing tip shape imperfections. In this study, we test, integrate, and
re-adapt published strategies for tip and machine-stiffness calibration for
spherical tips. We propose a routine for independently calibrating the
effective tip radius and the machine stiffness using three reference materials
(fused silica, sapphire, glassy carbon), which requires the parametrization of
the effective radius as a function of load. We validate our proposed workflow
against key benchmarks, such as variation of Young's modulus with depth. We
apply the resulting calibrations to data collected in materials with varying
ductility (olivine, titanium, and tungsten) to extract indentation
stress-strain curves. We also test the impact of the machine stiffness on
recently proposed methods for identification of yield stress, and compare the
influence of different conventions on assessing the indentation size effect.
Finally, we synthesize these analysis routines in a single workflow for use in
future studies aiming to extract and process data from spherical
nanoindentation.
","[{""version"":""v1"",""created"":""Sun, 5 Feb 2023 16:56:53 GMT""}]","2023-02-07"
"2302.02431","Mark Morris","Mark R. Morris","The Galactic Black Hole","29 pages, 12 figures, 210 references. Slightly revised and updated
  version of Chapter 2 of the volume, ""Active Galactic Nuclei"", 2022,
  coordinated by Fran\c{c}oise Combes, ISTE/Wiley,",,"10.1002/9781394163724",,"astro-ph.GA gr-qc","http://creativecommons.org/licenses/by/4.0/","  The black hole at the center of our Milky Way Galaxy -- the Galactic Black
Hole, or GBH -- is a rather modest representative of its class. With a mass of
4 x 10^6 solar masses, it is well over a thousand times less massive than the
most extreme supermassive black holes known to be powering the most luminous
quasars. Furthermore, the Galactic Black Hole has a remarkably dim accretion
flow, and its luminous energy output is overwhelmed by the dense cluster of
bright stars and red giants that surround it, except at radio wavelengths.
However, the proximity of the GBH compensates for its restrained activity;
being over 100 times closer than the next nearest supermassive black hole in a
galactic nucleus, it offers us an unparalleled opportunity to observe its
behavior in detail. Consequently, far more observational attention has been
paid to the GBH and its entourage of stars and gas than to any other single
object outside the solar system. This review covers the history of our
recognition of the GBH, its presently known physical characteristics, the
manifestations of its current and past activity, and the prospects for refining
our knowledge with future research.
","[{""version"":""v1"",""created"":""Sun, 5 Feb 2023 17:01:43 GMT""},{""version"":""v2"",""created"":""Thu, 16 Feb 2023 23:28:57 GMT""}]","2023-02-20"
"2302.02432","Ziqiao Wang","Ziqiao Wang, Yongyi Mao","Tighter Information-Theoretic Generalization Bounds from Supersamples","Accepted to ICML 2023",,,,"stat.ML cs.IT cs.LG math.IT","http://arxiv.org/licenses/nonexclusive-distrib/1.0/","  In this work, we present a variety of novel information-theoretic
generalization bounds for learning algorithms, from the supersample setting of
Steinke & Zakynthinou (2020)-the setting of the ""conditional mutual
information"" framework. Our development exploits projecting the loss pair
(obtained from a training instance and a testing instance) down to a single
number and correlating loss values with a Rademacher sequence (and its shifted
variants). The presented bounds include square-root bounds, fast-rate bounds,
including those based on variance and sharpness, and bounds for interpolating
algorithms etc. We show theoretically or empirically that these bounds are
tighter than all information-theoretic bounds known to date on the same
supersample setting.
","[{""version"":""v1"",""created"":""Sun, 5 Feb 2023 17:06:27 GMT""},{""version"":""v2"",""created"":""Fri, 2 Jun 2023 15:35:35 GMT""}]","2023-06-05"
