"2304.00965","Felix Finster","Felix Finster","Solving the Linearized Field Equations of the Causal Action Principle in
  Minkowski Space","91 pages, LaTeX, 10 figures",,,,"math-ph math.AP math.MP","http://arxiv.org/licenses/nonexclusive-distrib/1.0/","  The linearized field equations for causal fermion systems in Minkowski space
are analyzed systematically using methods of functional analysis and Fourier
analysis. Taking into account a direction-dependent local phase freedom, we
find a multitude of homogeneous solutions. The time evolution of the
inhomogeneous equations is studied. It leads to the dynamical creation of
retarded solutions as well as to the generation of non-propagating
perturbations.
","[{""version"":""v1"",""created"":""Mon, 3 Apr 2023 13:33:29 GMT""}]","2023-04-05"
"2304.00966","Vlad-George Dedu","Vlad Dedu and Anton Poluektov","Towards the precision measurement of CP violation in $B\to
  D^{\ast}\mu\nu$ decays at LHCb",,,,,"hep-ph hep-ex","http://creativecommons.org/licenses/by/4.0/","  Measurement of $CP$-violating observables in semileptonic decays is a
sensitive null-test of the Standard Model: any $CP$ violation would be an
unambiguous sign of New Physics effects. The model-independent technique to
measure parity and $CP$-odd observables in the $B\to D^{\ast}\mu\nu$ decays is
proposed, which effectively cancels out parity-even terms in the decay density
together with the associated theory uncertainty. The feasibility study is
performed with pseudoexperiments, and the sensitivity at the LHCb experiment is
estimated. Finally, the most significant systematic effects and the data-driven
ways to control them are considered.
","[{""version"":""v1"",""created"":""Mon, 3 Apr 2023 13:34:31 GMT""}]","2023-04-04"
"2304.00967","Zhuofan Zong","Zhuofan Zong, Dongzhi Jiang, Guanglu Song, Zeyue Xue, Jingyong Su,
  Hongsheng Li, Yu Liu","Temporal Enhanced Training of Multi-view 3D Object Detector via
  Historical Object Prediction","Tech report. Codes will be available at
  https://github.com/Sense-X/HoP",,,,"cs.CV","http://creativecommons.org/licenses/by/4.0/","  In this paper, we propose a new paradigm, named Historical Object Prediction
(HoP) for multi-view 3D detection to leverage temporal information more
effectively. The HoP approach is straightforward: given the current timestamp
t, we generate a pseudo Bird's-Eye View (BEV) feature of timestamp t-k from its
adjacent frames and utilize this feature to predict the object set at timestamp
t-k. Our approach is motivated by the observation that enforcing the detector
to capture both the spatial location and temporal motion of objects occurring
at historical timestamps can lead to more accurate BEV feature learning. First,
we elaborately design short-term and long-term temporal decoders, which can
generate the pseudo BEV feature for timestamp t-k without the involvement of
its corresponding camera images. Second, an additional object decoder is
flexibly attached to predict the object targets using the generated pseudo BEV
feature. Note that we only perform HoP during training, thus the proposed
method does not introduce extra overheads during inference. As a plug-and-play
approach, HoP can be easily incorporated into state-of-the-art BEV detection
frameworks, including BEVFormer and BEVDet series. Furthermore, the auxiliary
HoP approach is complementary to prevalent temporal modeling methods, leading
to significant performance gains. Extensive experiments are conducted to
evaluate the effectiveness of the proposed HoP on the nuScenes dataset. We
choose the representative methods, including BEVFormer and BEVDet4D-Depth to
evaluate our method. Surprisingly, HoP achieves 68.5% NDS and 62.4% mAP with
ViT-L on nuScenes test, outperforming all the 3D object detectors on the
leaderboard. Codes will be available at https://github.com/Sense-X/HoP.
","[{""version"":""v1"",""created"":""Mon, 3 Apr 2023 13:35:29 GMT""}]","2023-04-04"
"2304.00968","Mareike Berger","Mareike Berger and Pieter Rein ten Wolde","Synchronous replication initiation of multiple origins","22 pages, 12 figures",,,,"physics.bio-ph physics.comp-ph","http://creativecommons.org/licenses/by/4.0/","  Initiating replication synchronously at multiple origins of replication
allows the bacterium Escherichia coli to divide even faster than the time it
takes to replicate the entire chromosome in nutrient-rich environments. What
mechanisms give rise to synchronous replication initiation remains however
poorly understood. Via mathematical modelling, we identify four distinct
synchronization regimes depending on two quantities: the duration of the
so-called licensing period during which the initiation potential in the cell
remains high after the first origin has fired and the duration of the blocking
period during which already initiated origins remain blocked. For synchronous
replication initiation, the licensing period must be long enough such that all
origins can be initiated, but shorter than the blocking period to prevent
reinitiation of origins that have already fired. We find an analytical
expression for the degree of synchrony as a function of the duration of the
licensing period, which we confirm by simulations. Our model reveals that the
delay between the firing of the first and the last origin scales with the
coefficient of variation (CV) of the initiation volume. Matching these to the
values measured experimentally shows that the firing rate must rise with the
cell volume with an effective Hill coefficient that is at least 20; the
probability that all origins fire before the blocking period is over is then at
least 92%. Our analysis thus reveals that the low CV of the initiation volume
is a consequence of synchronous replication initiation. Finally, we show that
the previously presented molecular model for the regulation of replication
initiation in E. coli can give rise to synchronous replication initiation for
biologically realistic parameters.
","[{""version"":""v1"",""created"":""Mon, 3 Apr 2023 13:36:58 GMT""}]","2023-04-04"
"2304.00969","Mohamed Chatti","Mohamed Amine Chatti and Mouadh Guesmi and Laura Vorgerd and Thao Ngo
  and Shoeb Joarder and Qurat Ul Ain and Arham Muslim","Is More Always Better? The Effects of Personal Characteristics and Level
  of Detail on the Perception of Explanations in a Recommender System","Proceedings of the 30th ACM Conference on User Modeling, Adaptation
  and Personalization (UMAP'22)",,"10.1145/3503252.3531304",,"cs.AI cs.HC cs.IR","http://creativecommons.org/licenses/by-nc-nd/4.0/","  Despite the acknowledgment that the perception of explanations may vary
considerably between end-users, explainable recommender systems (RS) have
traditionally followed a one-size-fits-all model, whereby the same explanation
level of detail is provided to each user, without taking into consideration
individual user's context, i.e., goals and personal characteristics. To fill
this research gap, we aim in this paper at a shift from a one-size-fits-all to
a personalized approach to explainable recommendation by giving users agency in
deciding which explanation they would like to see. We developed a transparent
Recommendation and Interest Modeling Application (RIMA) that provides on-demand
personalized explanations of the recommendations, with three levels of detail
(basic, intermediate, advanced) to meet the demands of different types of
end-users. We conducted a within-subject study (N=31) to investigate the
relationship between user's personal characteristics and the explanation level
of detail, and the effects of these two variables on the perception of the
explainable RS with regard to different explanation goals. Our results show
that the perception of explainable RS with different levels of detail is
affected to different degrees by the explanation goal and user type.
Consequently, we suggested some theoretical and design guidelines to support
the systematic design of explanatory interfaces in RS tailored to the user's
context.
","[{""version"":""v1"",""created"":""Mon, 3 Apr 2023 13:40:08 GMT""}]","2023-04-04"
"2304.00970","Andy Liaw","Yuting Xu, Andy Liaw, Robert P. Sheridan, Vladimir Svetnik","Development and Evaluation of Conformal Prediction Methods for QSAR",,,,,"q-bio.BM cs.LG q-bio.QM","http://arxiv.org/licenses/nonexclusive-distrib/1.0/","  The quantitative structure-activity relationship (QSAR) regression model is a
commonly used technique for predicting biological activities of compounds using
their molecular descriptors. Predictions from QSAR models can help, for
example, to optimize molecular structure; prioritize compounds for further
experimental testing; and estimate their toxicity. In addition to the accurate
estimation of the activity, it is highly desirable to obtain some estimate of
the uncertainty associated with the prediction, e.g., calculate a prediction
interval (PI) containing the true molecular activity with a pre-specified
probability, say 70%, 90% or 95%. The challenge is that most machine learning
(ML) algorithms that achieve superior predictive performance require some
add-on methods for estimating uncertainty of their prediction. The development
of these algorithms is an active area of research by statistical and ML
communities but their implementation for QSAR modeling remains limited.
Conformal prediction (CP) is a promising approach. It is agnostic to the
prediction algorithm and can produce valid prediction intervals under some weak
assumptions on the data distribution. We proposed computationally efficient CP
algorithms tailored to the most advanced ML models, including Deep Neural
Networks and Gradient Boosting Machines. The validity and efficiency of
proposed conformal predictors are demonstrated on a diverse collection of QSAR
datasets as well as simulation studies.
","[{""version"":""v1"",""created"":""Mon, 3 Apr 2023 13:41:09 GMT""}]","2023-04-04"
"2304.00971","Hanrong Ye","Hanrong Ye, Dan Xu","Joint 2D-3D Multi-Task Learning on Cityscapes-3D: 3D Detection,
  Segmentation, and Depth Estimation","A supplementary document for ""TaskPrompter: Spatial-Channel
  Multi-Task Prompting for Dense Scene Understanding"" accepted by ICLR 2023.
  Project page:
  https://github.com/prismformore/Multi-Task-Transformer/tree/main/TaskPrompter","ICLR 2023",,,"cs.CV cs.LG","http://creativecommons.org/licenses/by-nc-sa/4.0/","  This report serves as a supplementary document for TaskPrompter, detailing
its implementation on a new joint 2D-3D multi-task learning benchmark based on
Cityscapes-3D. TaskPrompter presents an innovative multi-task prompting
framework that unifies the learning of (i) task-generic representations, (ii)
task-specific representations, and (iii) cross-task interactions, as opposed to
previous approaches that separate these learning objectives into different
network modules. This unified approach not only reduces the need for meticulous
empirical structure design but also significantly enhances the multi-task
network's representation learning capability, as the entire model capacity is
devoted to optimizing the three objectives simultaneously. TaskPrompter
introduces a new multi-task benchmark based on Cityscapes-3D dataset, which
requires the multi-task model to concurrently generate predictions for
monocular 3D vehicle detection, semantic segmentation, and monocular depth
estimation. These tasks are essential for achieving a joint 2D-3D understanding
of visual scenes, particularly in the development of autonomous driving
systems. On this challenging benchmark, our multi-task model demonstrates
strong performance compared to single-task state-of-the-art methods and
establishes new state-of-the-art results on the challenging 3D detection and
depth estimation tasks.
","[{""version"":""v1"",""created"":""Mon, 3 Apr 2023 13:41:35 GMT""},{""version"":""v2"",""created"":""Wed, 5 Apr 2023 13:27:21 GMT""},{""version"":""v3"",""created"":""Thu, 6 Apr 2023 12:58:28 GMT""}]","2023-04-07"
"2304.00972","Chunyu Guo","Chunyu Guo, Glenn Wagner, Carsten Putzke, Dong Chen, Kaize Wang, Ling
  Zhang, Martin Gutierrez-Amigo, Ion Errea, Maia G. Vergniory, Claudia Felser,
  Mark H. Fischer, Titus Neupert, and Philip J. W. Moll","Correlated order at the tipping point in the kagome metal CsV$_3$Sb$_5$",,,,,"cond-mat.str-el cond-mat.mtrl-sci","http://creativecommons.org/licenses/by-nc-nd/4.0/","  Spontaneously broken symmetries are at the heart of many phenomena of quantum
matter and physics more generally. However, determining the exact symmetries
broken can be challenging due to imperfections such as strain, in particular
when multiple electronic orders form complex interactions. This is exemplified
by charge order in some kagome systems, which are speculated to show nematicity
and flux order from orbital currents. We fabricated highly symmetric samples of
a member of this family, CsV$_3$Sb$_5$, and measured their transport
properties. We find the absence of measurable anisotropy at any temperature in
the unperturbed material, however, a striking in-plane transport anisotropy
appears when either weak magnetic fields or strains are present. A symmetry
analysis indicates that a perpendicular magnetic field can indeed lead to
in-plane anisotropy by inducing a flux order coexisting with more conventional
bond order. Our results provide a unifying picture for the controversial charge
order in kagome metals and highlight the need for microscopic materials control
in the identification of broken symmetries.
","[{""version"":""v1"",""created"":""Mon, 3 Apr 2023 13:44:31 GMT""}]","2023-04-04"
"2304.00973","Thomas Cecil","T. Cecil, C. Albert, A. J. Anderson, P. S. Barry, B. Benson, C.
  Cotter, C. Chang, M. Dobbs, K. Dibert, R. Gualtieri, K. S. Karkare, M.
  Lisovenko, D. P. Marrone, J. Montgomery, Z. Pan, G. Robson, M. Rouble, E.
  Shirokoff, G. Smecher, G. Wang, and V. Yefremenko","Fabrication Development for SPT-SLIM, a Superconducting Spectrometer for
  Line Intensity Mapping","7 pages, 7 figures, presented at 2022 Applied Superconductivity
  Conference",,"10.1109/TASC.2023.3259919",,"astro-ph.IM physics.ins-det","http://arxiv.org/licenses/nonexclusive-distrib/1.0/","  Line Intensity Mapping (LIM) is a new observational technique that uses
low-resolution observations of line emission to efficiently trace the
large-scale structure of the Universe out to high redshift. Common mm/sub-mm
emission lines are accessible from ground-based observatories, and the
requirements on the detectors for LIM at mm-wavelengths are well matched to the
capabilities of large-format arrays of superconducting sensors. We describe the
development of an R = 300 on-chip superconducting filter-bank spectrometer
covering the 120--180 GHz band optimized for future mm-LIM experiments,
focusing on SPT-SLIM, a pathfinder LIM instrument for the South Pole Telescope.
Radiation is coupled from the telescope optical system to the spectrometer chip
via an array of feedhorn-coupled orthomode transducers. Superconducting
microstrip transmission lines then carry the signal to an array of channelizing
half-wavelength resonators, and the output of each spectral channel is sensed
by a lumped element kinetic inductance detector (leKID). Key areas of
development include incorporating new low-loss dielectrics to improve both the
achievable spectral resolution and optical efficiency and development of a
robust fabrication process to create a galvanic connection between ultra-pure
superconducting thin-films to realize multi-material (hybrid) leKIDs. We
provide an overview of the spectrometer design, fabrication process, and
prototype devices.
","[{""version"":""v1"",""created"":""Mon, 3 Apr 2023 13:44:35 GMT""}]","2023-04-20"
"2304.00975","Francesco Marchetti","Francesco Marchetti, Emma Perracchione, Anna Volpara, Anna Maria
  Massone, Stefano De Marchi, Michele Piana","Mapped Variably Scaled Kernels: Applications to Solar Imaging",,,,,"math.NA cs.NA","http://creativecommons.org/licenses/by-sa/4.0/","  Variably scaled kernels and mapped bases constructed via the so-called fake
nodes approach are two different strategies to provide adaptive bases for
function interpolation. In this paper, we focus on kernel-based interpolation
and we present what we call mapped variably scaled kernels, which take
advantage of both strategies. We present some theoretical analysis and then we
show their efficacy via numerical experiments. Moreover, we test such a new
basis for image reconstruction tasks in the framework of hard X-ray
astronomical imaging.
","[{""version"":""v1"",""created"":""Mon, 3 Apr 2023 13:45:16 GMT""}]","2023-04-04"
"2304.00976","Kazuki Tokuda","Takahiro Ohno, Kazuki Tokuda, Ayu Konishi, Takeru Matsumoto, Marta
  Sewi{\l}o, Hiroshi Kondo, Hidetoshi Sano, Kisetsu Tsuge, Sarolta Zahorecz,
  Nao Goto, Naslim Neelamkodan, Tony Wong, Hajime Fukushima, Tatsuya Takekoshi,
  Kazuyuki Muraoka, Akiko Kawamura, Kengo Tachihara, Yasuo Fukui, Toshikazu
  Onishi","An Unbiased CO Survey Toward the Northern Region of the Small Magellanic
  Cloud with the Atacama Compact Array. II. CO Cloud Catalog","18 pages, 9 figures. Accepted for publication in The Astrophysical
  Journal",,"10.3847/1538-4357/accadb",,"astro-ph.GA","http://creativecommons.org/licenses/by/4.0/","  The nature of molecular clouds and their statistical behavior in sub-solar
metallicity environments are not fully explored yet. We analyzed an unbiased
CO($J$ = 2-1) survey data at a spatial resolution of $\sim$2 pc in the northern
region of the Small Magellanic Cloud (SMC) with the Atacama Compact Array to
characterize the CO cloud properties. A cloud decomposition analysis identified
426 spatially/velocity-independent CO clouds and their substructures. Based on
the cross-matching with known infrared catalogs by Spitzer and Herschel, more
than 90% CO clouds show spatial correlations with point sources. We
investigated the basic properties of the CO clouds and found that the
radius-velocity linewidth ($R$-$\sigma_{v}$) relation follows the Milky Way
(MW) like power-low exponent, but the intercept is $\sim$1.5 times lower than
that in the MW. The mass functions ($dN/dM$) of the CO luminosity and virial
mass are characterized by an exponent of $\sim$1.7, which is consistent with
previously reported values in the Large Magellanic Cloud and MW.
","[{""version"":""v1"",""created"":""Mon, 3 Apr 2023 13:46:18 GMT""}]","2023-06-06"
"2304.00978","Mattia Cavicchi","Giuseppe Ancona, Mattia Cavicchi, Robert Laterveer, Giulia Sacc\`a","Relative and absolute Lefschetz standard conjectures for some Lagrangian
  fibrations","27 pages, comments welcome",,,,"math.AG","http://creativecommons.org/licenses/by/4.0/","  We show that the hyper-K\""ahler varieties of OG10-type constructed by
Laza-Sacc\`a-Voisin (LSV) verify the Lefschetz standard conjecture. This is an
application of a more general result, stating that certain Lagrangian
fibrations verify this conjecture. The main technical assumption of this
general result is that the Lagrangian fibration satisfies the hypotheses of
Ng\^o's support theorem. Verifying that the LSV tenfolds do satisfy those
hypotheses is of independent interest. Another point of independent interest of
the paper is the definition and the study of the Lefschetz standard conjecture
in the relative setting, and its relation to the classical absolute case.
","[{""version"":""v1"",""created"":""Mon, 3 Apr 2023 13:46:32 GMT""}]","2023-04-04"
"2304.00979","Xinwei Liu","Xinwei Liu, Kiran Raja, Renfang Wang, Hong Qiu, Hucheng Wu, Dechao
  Sun, Qiguang Zheng, Nian Liu, Xiaoxia Wang, Gehang Huang, Raghavendra
  Ramachandra, Christoph Busch","A Latent Fingerprint in the Wild Database","Submitted to IEEE Transactions on Information Forensics and Security
  (under review)",,,,"cs.CV","http://creativecommons.org/licenses/by/4.0/","  Latent fingerprints are among the most important and widely used evidence in
crime scenes, digital forensics and law enforcement worldwide. Despite the
number of advancements reported in recent works, we note that significant open
issues such as independent benchmarking and lack of large-scale evaluation
databases for improving the algorithms are inadequately addressed. The
available databases are mostly of semi-public nature, lack of acquisition in
the wild environment, and post-processing pipelines. Moreover, they do not
represent a realistic capture scenario similar to real crime scenes, to
benchmark the robustness of the algorithms. Further, existing databases for
latent fingerprint recognition do not have a large number of unique
subjects/fingerprint instances or do not provide ground truth/reference
fingerprint images to conduct a cross-comparison against the latent. In this
paper, we introduce a new wild large-scale latent fingerprint database that
includes five different acquisition scenarios: reference fingerprints from (1)
optical and (2) capacitive sensors, (3) smartphone fingerprints, latent
fingerprints captured from (4) wall surface, (5) Ipad surface, and (6)
aluminium foil surface. The new database consists of 1,318 unique fingerprint
instances captured in all above mentioned settings. A total of 2,636 reference
fingerprints from optical and capacitive sensors, 1,318 fingerphotos from
smartphones, and 9,224 latent fingerprints from each of the 132 subjects were
provided in this work. The dataset is constructed considering various age
groups, equal representations of genders and backgrounds. In addition, we
provide an extensive set of analysis of various subset evaluations to highlight
open challenges for future directions in latent fingerprint recognition
research.
","[{""version"":""v1"",""created"":""Mon, 3 Apr 2023 13:47:38 GMT""}]","2023-04-04"
"2304.00980","Rebekka Garreis","Rebekka Garreis and Chuyao Tong and Jocelyn Terle and Max Josef
  Ruckriegel and Jonas Daniel Gerber and Lisa Maria G\""achter and Kenji
  Watanabe and Takashi Taniguchi and Thomas Ihn and Klaus Ensslin and Wei
  Wister Huang","Long-lived valley states in bilayer graphene quantum dots","Rebekka Garreis and Chuyao Tong contributed equally to this paper",,,,"cond-mat.mes-hall quant-ph","http://arxiv.org/licenses/nonexclusive-distrib/1.0/","  Bilayer graphene (BLG) is emerging as a promising host material for
electrically controllable qubits in a two-dimensional system. Of particular
interest is the ability to encode quantum information not only as spin qubits
but also in the so-called valley degree of freedom, a two-fold orbital
degeneracy that arises from the symmetry of the hexagonal Bravais lattice.
Known spin-mixing and orbital-mixing mechanisms are unlikely to be at work for
valleys. Moreover, the topological nature of valley states in BLG promises
unique routes for coherent qubit manipulation. Gate-defined BLG quantum-dot
devices have been recently established as a versatile building block for
accessing high-quality spin and valley quantum states. However, measurements of
the relaxation time of valley states -- which ultimately limits these qubits'
coherence properties and therefore their suitability as practical qubits --
remained so far elusive. Here we report the first measurement of the
characteristic relaxation times of spin and valley states, obtained in a
high-quality BLG device containing gate-defined double quantum dots. We show
that valley states can be distinguished with a fidelity of well above
$99\,\text{%}$ and report remarkably long relaxation time between valley
triplets and singlets, exceeding $500\,\text{ms}$ at $B=250\,\text{mT}$, more
than one order of magnitude longer than the relaxation times we measure for
spin states. Our approach to isolating valley states paves the way to measuring
coherent valley-qubit oscillations and, in combination with the recently
demonstrated electrical tunability of the valley $g$-factor, could provide a
practical platform for the electrical control of long-lived valley qubits in
BLG.
","[{""version"":""v1"",""created"":""Mon, 3 Apr 2023 13:48:42 GMT""}]","2023-04-04"
"2304.00984","Shu-Min Wu","Xiao-Wei Fan, Hao-Yu Wu, Rui-Di Wang, Xiao-Li Huang, Hao-Sheng Zeng,
  Shu-Min Wu","Does Hawking effect always degrade fidelity of quantum teleportation in
  Schwarzschild spacetime?","16 pages, 3 figures",,,,"gr-qc quant-ph","http://creativecommons.org/licenses/by/4.0/","  Previous studies have shown that the Hawking effect always destroys quantum
correlations and the fidelity of quantum teleportation in the Schwarzschild
black hole. Here, we investigate the fidelity of quantum teleportation of Dirac
fields between users in Schwarzschild spacetime. We find that, with the
increase of the Hawking temperature, the fidelity of quantum teleportation can
monotonically increases, monotonically decreases, or non-monotonically
increases, depending on the choice of the initial state, which means that the
Hawking effect can create net fidelity of quantum teleportation. This striking
result banishes the extended belief that the Hawking effect of the black hole
can only destroy the fidelity of quantum teleportation. We also find that
quantum steering cannot fully guarantee the fidelity of quantum teleportation
in Schwarzschild spacetime. This new unexpected source may provide a new idea
for the experimental evidence of the Hawking effect.
","[{""version"":""v1"",""created"":""Mon, 3 Apr 2023 13:52:07 GMT""}]","2023-04-04"
