"2304.00698","XuMeng Gong","Cheng Yang, Xumeng Gong, Chuan Shi and Philip S. Yu","A Post-Training Framework for Improving Heterogeneous Graph Neural
  Networks","WWW 2023, 12 pages",,"10.1145/3543507.3583282",,"cs.SI","http://arxiv.org/licenses/nonexclusive-distrib/1.0/","  Recent years have witnessed the success of heterogeneous graph neural
networks (HGNNs) in modeling heterogeneous information networks (HINs). In this
paper, we focus on the benchmark task of HGNNs, i.e., node classification, and
empirically find that typical HGNNs are not good at predicting the label of a
test node whose receptive field (1) has few training nodes from the same
category or (2) has multiple training nodes from different categories. A
possible explanation is that their message passing mechanisms may involve
noises from different categories, and cannot fully explore task-specific
knowledge such as the label dependency between distant nodes. Therefore,
instead of introducing a new HGNN model, we propose a general post-training
framework that can be applied on any pretrained HGNNs to further inject
task-specific knowledge and enhance their prediction performance. Specifically,
we first design an auxiliary system that estimates node labels based on (1) a
global inference module of multi-channel label propagation and (2) a local
inference module of network schema-aware prediction. The mechanism of our
auxiliary system can complement the pretrained HGNNs by providing extra
task-specific knowledge. During the post-training process, we will strengthen
both system-level and module-level consistencies to encourage the cooperation
between a pretrained HGNN and our auxiliary system. In this way, both systems
can learn from each other for better performance. In experiments, we apply our
framework to four typical HGNNs. Experimental results on three benchmark
datasets show that compared with pretrained HGNNs, our post-training framework
can enhance Micro-F1 by a relative improvement of 3.9% on average. Code, data
and appendix are available at https://github.com/GXM1141/HGPF.
","[{""version"":""v1"",""created"":""Mon, 3 Apr 2023 03:15:33 GMT""}]","2023-04-04"
"2304.00699","Josef Svoboda","Sergei Gukov, Ludmil Katzarkov, Josef Svoboda","$\hat{Z}_b$ for plumbed manifolds and splice diagrams","39 pages, comments welcome",,,,"math.GT math.AG math.QA","http://arxiv.org/licenses/nonexclusive-distrib/1.0/","  We study $q$-series invariants of 3-manifolds $\hat{Z}_b$ defined by
Gukov--Pei--Putrov--Vafa using techniques from the theory of normal surface
singularities such as splice diagrams. This provides a link between algebraic
geometry with quantum topology. We show that the (suitably normalized) sum of
all $\hat{Z}_b$ depends only on the splice diagram, and in particular, it
agrees for manifolds with the same universal Abelian cover. Using these ideas
we find simple formulas for $\hat{Z}_b$ invariants of Seifert manifolds that
resemble equivariant Poincar\'e series of corresponding quasihomogeneous
singularity. Applications include a better understanding of the vanishing of
the $q$-series $\hat{Z}_b$.
","[{""version"":""v1"",""created"":""Mon, 3 Apr 2023 03:35:27 GMT""}]","2023-04-04"
"2304.00700","Ankang Liu","Ankang Liu and Alexander M. Finkel'stein","Spin waves in layered antiferromagnets with honeycomb structure","15 pages, 6 figures","Phys. Rev. B 105, 214409 (2022)","10.1103/PhysRevB.105.214409",,"cond-mat.mtrl-sci","http://arxiv.org/licenses/nonexclusive-distrib/1.0/","  We develop a description of spin waves in a $3D$ quantum $XY$ antiferromagnet
(AFM) in terms of macroscopic variables, magnetization and N\'eel vector
densities. We consider a layered AFM with spins located on the honeycomb
lattice. In the discussed system, the spectrum of spin waves consists of four
modes, all well captured by our macroscopic description. The gapless mode of
the spin waves, i.e., magnons, is described by a system of equations, which has
a structure general for the Goldstone mode in AFMs. We demonstrate that the
parameters in the spin Hamiltonian can be evaluated by fitting the experimental
data with the results obtained for the four modes using the macroscopic
variable approach. The description of AFM in terms of macroscopic variables can
be easily extended to the case when the lattice of the magnetic substance is
deformed by an external strain or acoustic wave.
","[{""version"":""v1"",""created"":""Mon, 3 Apr 2023 03:36:52 GMT""}]","2023-04-04"
"2304.00701","Roohi Dalal","Roohi Dalal, Xiangchong Li, Andrina Nicola, Joe Zuntz, Michael A.
  Strauss, Sunao Sugiyama, Tianqing Zhang, Markus M. Rau, Rachel Mandelbaum,
  Masahiro Takada, Surhud More, Hironao Miyatake, Arun Kannawadi, Masato
  Shirasaki, Takanori Taniguchi, Ryuichi Takahashi, Ken Osato, Takashi Hamana,
  Masamune Oguri, Atsushi J. Nishizawa, Andr\'es A. Plazas Malag\'on, Tomomi
  Sunayama, David Alonso, An\v{z}e Slosar, Robert Armstrong, James Bosch,
  Yutaka Komiyama, Robert H. Lupton, Nate B. Lust, Lauren A. MacArthur, Satoshi
  Miyazaki, Hitoshi Murayama, Takahiro Nishimichi, Yuki Okura, Paul A. Price,
  Philip J. Tait, Masayuki Tanaka and Shiang-Yu Wang","Hyper Suprime-Cam Year 3 Results: Cosmology from Cosmic Shear Power
  Spectra","35 pages, 18 figures, 6 tables, for coordinated submission to PRD
  with other HSC Y3 weak lensing cosmology papers - see
  https://hsc-release.mtk.nao.ac.jp/doc/index.php/wly3/",,,,"astro-ph.CO","http://arxiv.org/licenses/nonexclusive-distrib/1.0/","  We measure weak lensing cosmic shear power spectra from the three-year galaxy
shear catalog of the Hyper Suprime-Cam (HSC) Subaru Strategic Program imaging
survey. The shear catalog covers $416 \ \mathrm{deg}^2$ of the northern sky,
with a mean $i$-band seeing of 0.59 arcsec and an effective galaxy number
density of 15 $\mathrm{arcmin}^{-2}$ within our adopted redshift range. With an
$i$-band magnitude limit of 24.5 mag, and four tomographic redshift bins
spanning $0.3 \leq z_{\mathrm{ph}} \leq 1.5$ based on photometric redshifts, we
obtain a high-significance measurement of the cosmic shear power spectra, with
a signal-to-noise ratio of approximately 26.4 in the multipole range
$300<\ell<1800$. The accuracy of our power spectrum measurement is tested
against realistic mock shear catalogs, and we use these catalogs to get a
reliable measurement of the covariance of the power spectrum measurements. We
use a robust blinding procedure to avoid confirmation bias, and model various
uncertainties and sources of bias in our analysis, including point spread
function systematics, redshift distribution uncertainties, the intrinsic
alignment of galaxies and the modeling of the matter power spectrum. For a flat
$\Lambda$CDM model, we find $S_8 \equiv \sigma_8 (\Omega_m/0.3)^{0.5}
=0.776^{+0.032}_{-0.033}$, which is in excellent agreement with the constraints
from the other HSC Year 3 cosmology analyses, as well as those from a number of
other cosmic shear experiments. This result implies a $\sim$$2\sigma$-level
tension with the Planck 2018 cosmology. We study the effect that various
systematic errors and modeling choices could have on this value, and find that
they can shift the best-fit value of $S_8$ by no more than $\sim$$0.5\sigma$,
indicating that our result is robust to such systematics.
","[{""version"":""v1"",""created"":""Mon, 3 Apr 2023 03:37:01 GMT""},{""version"":""v2"",""created"":""Tue, 4 Apr 2023 17:22:14 GMT""}]","2023-04-05"
"2304.00702","Xiangchong Li","Xiangchong Li, Tianqing Zhang, Sunao Sugiyama, Roohi Dalal, Markus M.
  Rau, Rachel Mandelbaum, Masahiro Takada, Surhud More, Michael A. Strauss,
  Hironao Miyatake, Masato Shirasaki, Takashi Hamana, Masamune Oguri, Wentao
  Luo, Atsushi J. Nishizawa, Ryuichi Takahashi, Andrina Nicola, Ken Osato, Arun
  Kannawadi, Tomomi Sunayama, Robert Armstrong, Yutaka Komiyama, Robert H.
  Lupton, Nate B. Lust, Satoshi Miyazaki, Hitoshi Murayama, Takahiro
  Nishimichi, Yuki Okura, Paul A. Price, Philip J. Tait, Masayuki Tanaka, and
  Shiang-Yu Wang","Hyper Suprime-Cam Year 3 Results: Cosmology from Cosmic Shear Two-point
  Correlation Functions","36 pages, 29 figures, 4 tables, for coordinated submission to PRD
  with other HSC Y3 weak lensing cosmology papers - see
  https://hsc-release.mtk.nao.ac.jp/doc/index.php/wly3/",,,,"astro-ph.CO","http://arxiv.org/licenses/nonexclusive-distrib/1.0/","  We perform a blinded cosmology analysis with cosmic shear two-point
correlation functions (2PCFs) measured from more than 25 million galaxies in
the Hyper Suprime-Cam three-year shear catalog in four tomographic redshift
bins ranging from 0.3 to 1.5. After conservative masking and galaxy selection,
the survey covers 416 deg$^2$ of the northern sky with an effective galaxy
number density of 15 arcmin$^{-2}$ over the four redshift bins. The 2PCFs
adopted for cosmology analysis are measured in the angular range: $7.1 <
\theta/{\rm arcmin} < 56.6$ for $\xi_+$ and $31.2 <\theta/{\rm arcmin} < 248$
for $\xi_-$, with a total signal-to-noise ratio of 26.6. We apply a
conservative, wide, flat prior on the photometric redshift errors on the last
two tomographic bins, and the relative magnitudes of the cosmic shear amplitude
across four redshift bins allow us to calibrate the photometric redshift
errors. With this flat prior on redshift errors, we find $\Omega_{\rm
m}=0.256_{-0.044}^{+0.056}$ and $S_8\equiv \sigma_8 \sqrt{\Omega_{\rm
m}/0.3}=0.769_{-0.034}^{+0.031}$ (both 68\% CI) for a flat $\Lambda$ cold dark
matter cosmology. We find, after unblinding, that our constraint on $S_8$ is
consistent with the Fourier space cosmic shear and the 3$\times$2pt analyses on
the same HSC dataset. We carefully study the potential systematics from
astrophysical and systematic model uncertainties in our fiducial analysis using
synthetic data, and report no biases (including projection bias in the
posterior space) greater than $0.5\sigma$ in the estimation of $S_8$. Our
analysis hints that the mean redshifts of the two highest tomographic bins are
higher than initially estimated. In addition, a number of consistency tests are
conducted to assess the robustness of our analysis. Comparing our result with
Planck-2018 cosmic microwave background observations, we find a ~$2\sigma$
tension for the $\Lambda$CDM model.
","[{""version"":""v1"",""created"":""Mon, 3 Apr 2023 03:37:02 GMT""},{""version"":""v2"",""created"":""Tue, 4 Apr 2023 17:21:56 GMT""}]","2023-04-05"
"2304.00703","Surhud More","Surhud More, Sunao Sugiyama, Hironao Miyatake, Markus Michael Rau,
  Masato Shirasaki, Xiangchong Li, Atsushi J. Nishizawa, Ken Osato, Tianqing
  Zhang, Masahiro Takada, Takashi Hamana, Ryuichi Takahashi, Roohi Dalal,
  Rachel Mandelbaum, Michael A. Strauss, Yosuke Kobayashi, Takahiro Nishimichi,
  Masamune Oguri, Arun Kannawadi, Robert Armstrong, Yutaka Komiyama, Robert H.
  Lupton, Nate B. Lust, Satoshi Miyazaki, Hitoshi Murayama, Yuki Okura, Paul A.
  Price, Philip J. Tait, Masayuki Tanaka, and Shiang-Yu Wang","Hyper Suprime-Cam Year 3 Results: Measurements of Clustering of
  SDSS-BOSS Galaxies, Galaxy-Galaxy Lensing and Cosmic Shear","30 pages, 24 figures, for coordinated submission to PRD with other
  HSC Y3 weak lensing cosmology papers - see
  https://hsc-release.mtk.nao.ac.jp/doc/index.php/wly3/ , added references to
  companion papers",,,,"astro-ph.CO","http://arxiv.org/licenses/nonexclusive-distrib/1.0/","  We use the Sloan Digital Sky Survey (SDSS) BOSS galaxies and their overlap
with approximately 416 sq. degree of deep $grizy$-band imaging from the Subaru
Hyper Suprime-Cam Survey (HSC). We measure three two-point correlations that
form the basis of the cosmological inference presented in our companion papers,
Miyatake et al. and Sugiyama et al. We use three approximately volume limited
subsamples of spectroscopic galaxies by their $i$-band magnitude from the
SDSS-BOSS: LOWZ (0.1<z<0.35), CMASS1 (0.43<z<0.55) and CMASS2 (0.55<z<0.7),
respectively. We present high signal-to-noise ratio measurements of the
projected correlation functions of these galaxies, which is expected to be
proportional to the matter correlation function times the bias of galaxies on
large scales. In order to break the degeneracy between the amplitude of the
matter correlation and the bias of these galaxies, we use the distortions of
the shapes of galaxies in HSC due to weak gravitational lensing, to measure the
galaxy-galaxy lensing signal, which probes the galaxy-matter cross-correlation
of the SDSS-BOSS galaxies. We also measure the cosmic shear correlation
functions from HSC galaxies which is related to the projected matter
correlation function. We demonstrate the robustness of our measurements with a
variety of systematic tests. Our use of a single sample of HSC source galaxies
is crucial to calibrate any residual systematic biases in the inferred
redshifts of our galaxies. We also describe the construction of a suite of
mocks: i) spectroscopic galaxy catalogs which obey the clustering and abundance
of each of the three SDSS-BOSS subsamples, and ii) galaxy shape catalogs which
obey the footprint of the HSC survey and have been appropriately sheared by the
large-scale structure expected in a $\Lambda$-CDM model. We use these mock
catalogs to compute the covariance of each of our observables.
","[{""version"":""v1"",""created"":""Mon, 3 Apr 2023 03:37:03 GMT""},{""version"":""v2"",""created"":""Tue, 4 Apr 2023 16:23:27 GMT""}]","2023-04-05"
"2304.00704","Hironao Miyatake","Hironao Miyatake, Sunao Sugiyama, Masahiro Takada, Takahiro
  Nishimichi, Xiangchong Li, Masato Shirasaki, Surhud More, Yosuke Kobayashi,
  Atsushi J. Nishizawa, Markus M. Rau, Tianqing Zhang, Ryuichi Takahashi, Roohi
  Dalal, Rachel Mandelbaum, Michael A. Strauss, Takashi Hamana, Masamune Oguri,
  Ken Osato, Wentao Luo, Arun Kannawadi, Bau-Ching Hsieh, Robert Armstrong,
  Yutaka Komiyama, Robert H. Lupton, Nate B. Lust, Lauren A. MacArthur, Satoshi
  Miyazaki, Hitoshi Murayama, Yuki Okura, Paul A. Price, Tomomi Sunayama,
  Philip J. Tait, Masayuki Tanaka, and Shiang-Yu Wang","Hyper Suprime-Cam Year 3 Results: Cosmology from Galaxy Clustering and
  Weak Lensing with HSC and SDSS using the Emulator Based Halo Model","39 pages, 25 figures, 5 tables, for coordinated submission to PRD
  with other HSC Y3 weak lensing cosmology papers - see
  https://hsc-release.mtk.nao.ac.jp/doc/index.php/wly3/. arXiv admin note: text
  overlap with arXiv:2111.02419",,,,"astro-ph.CO","http://arxiv.org/licenses/nonexclusive-distrib/1.0/","  We present cosmology results from a blinded joint analysis of cosmic shear,
$\xi_{\pm}(\vartheta)$, galaxy-galaxy weak lensing, $\Delta\!\Sigma(R)$, and
projected galaxy clustering, $w_{\rm p}(R)$, measured from the Hyper
Suprime-Cam three-year (HSC-Y3) shape catalog and the Sloan Digital Sky Survey
(SDSS) DR11 spectroscopic galaxy catalog - a 3$\times$2pt cosmology analysis.
We define luminosity-cut samples of SDSS galaxies to serve as the tracers of
$w_{\rm p}$ and as the lens samples for $\Delta\!\Sigma$ in three spectroscopic
redshift bins spanning the range $0.15<z<0.7$. For the $\xi_{\pm}$ and
$\Delta\!\Sigma$ measurements, we use a single source sample over 416 deg$^2$,
selected from HSC-Y3 based on having photometric redshifts (photo-$z$) greater
than 0.75. For cosmological parameter inference, we use Dark Emulator combined
with a halo occupation distribution prescription to model $w_{\rm p}$ and
$\Delta\!\Sigma$ down to quasi-nonlinear scales. In our baseline analysis we
employ an uninformative flat prior of the residual photo-$z$ error to model a
residual bias in the mean redshift of HSC source galaxies. We obtain a robust
constraint on the cosmological parameters for the flat $\Lambda$CDM model:
$S_8=\sigma_8(\Omega_{\rm m}/0.3)^{0.5}=0.763^{+0.040}_{-0.036}$ (68% C.I.), or
the best-constrained parameter given by $S'_8=\sigma_8(\Omega_{\rm
m}/0.3)^{0.22}=0.721\pm 0.028$, determined with about 4% fractional precision.
Our HSC-Y3 data exhibits about 2.5$\sigma$ tension with the Planck inferred
$S_8$ value for the $\Lambda$CDM model, and hints at a non-zero residual
photo-$z$ bias implying that the true mean redshift of the HSC galaxies at
$z\gtrsim 0.75$ is higher than that implied by the original photo-$z$
estimates.
","[{""version"":""v1"",""created"":""Mon, 3 Apr 2023 03:37:04 GMT""},{""version"":""v2"",""created"":""Tue, 4 Apr 2023 14:52:29 GMT""},{""version"":""v3"",""created"":""Thu, 6 Apr 2023 15:04:24 GMT""}]","2023-04-07"
"2304.00705","Masahiro Takada","Sunao Sugiyama, Hironao Miyatake, Surhud More, Xiangchong Li, Masato
  Shirasaki, Masahiro Takada, Yosuke Kobayashi, Ryuichi Takahashi, Takahiro
  Nishimichi, Atsushi J. Nishizawa, Markus M. Rau, Tianqing Zhang, Roohi Dalal,
  Rachel Mandelbaum, Michael A. Strauss, Takashi Hamana, Masamune Oguri, Ken
  Osato, Arun Kannawadi, Robert Armstrong, Yutaka Komiyama, Robert H. Lupton,
  Nate B. Lust, Satoshi Miyazaki, Hitoshi Murayama, Yuki Okura, Paul A. Price,
  Philip J. Tait, Masayuki Tanaka, and Shiang-Yu Wang","Hyper Suprime-Cam Year 3 Results: Cosmology from Galaxy Clustering and
  Weak Lensing with HSC and SDSS using the Minimal Bias Model","29 pages, 17 figures, 4 tables, for coordinated submission to PRD
  with other HSC Y3 weak lensing cosmology papers - see
  https://hsc-release.mtk.nao.ac.jp/doc/index.php/wly3/",,,,"astro-ph.CO","http://arxiv.org/licenses/nonexclusive-distrib/1.0/","  We present cosmological parameter constraints from a blind joint analysis of
three two-point correlation functions measured from the Year 3 Hyper
Suprime-Cam (HSC-Y3) imaging data, covering 416 deg$^2$, and the SDSS DR11
spectroscopic galaxies spanning the redshift range $[0.15, 0.70]$. We subdivide
the SDSS galaxies into three volume-limited samples separated in redshift, each
of which acts as a large-scale structure tracer characterized by the
measurement of the projected correlation function, $w_{\rm p}(R)$. We also use
the measurements of the galaxy-galaxy weak lensing signal $\Delta \Sigma(R)$
for each of these SDSS samples which act as lenses for a secure sample of
source galaxies selected from the HSC-Y3 shape catalog based on their
photometric redshifts. We combine these measurements with the cosmic shear
correlation functions, $\xi_{\pm}(\vartheta)$, measured for our HSC source
sample. We model these observables with the minimal bias model of the galaxy
clustering observables in the context of a flat $\Lambda$CDM cosmology. We use
conservative scale cuts, $R>12$ and $8~h^{-1}$Mpc, for $\Delta\Sigma$ and
$w_{\rm p}$, respectively, where the minimal bias model is valid, in addition
to conservative prior on the residual bias in the mean redshift of the HSC
photometric source galaxies. Our baseline analysis yields
$S_8=0.775^{+0.043}_{-0.038}$ (68% C.I.) for the $\Lambda$CDM model, after
marginalizing over uncertainties in other parameters. Our value of $S_8$ is
consistent with that from the Planck 2018 data, but the credible interval of
our result is still relatively large. Our results are statistically consistent
with those of a companion paper, which extends this analysis to smaller scales
with an emulator-based halo model.
","[{""version"":""v1"",""created"":""Mon, 3 Apr 2023 03:37:05 GMT""},{""version"":""v2"",""created"":""Tue, 4 Apr 2023 14:49:29 GMT""}]","2023-04-05"
"2304.00706","Rong Wei","Ping Cheng, Rong Wei, Tusheng Zhang","Large deviations of reflected weakly interacting particle systems",,,,,"math.PR","http://creativecommons.org/licenses/by-sa/4.0/","  In this paper, we prove a large deviation principle for the empirical
measures of a system of weakly interacting diffusion with reflection. We adopt
the weak convergence approach. To make this approach work, we show that the
sequence of empirical measures of the controlled reflected system will converge
to the weak solution of an associated reflected McKean--Vlasov equation.
","[{""version"":""v1"",""created"":""Mon, 3 Apr 2023 03:46:59 GMT""}]","2023-04-04"
"2304.00707","Krishnakumar Balasubramanian","Krishnakumar Balasubramanian, Promit Ghosal, Ye He","High-dimensional scaling limits and fluctuations of online least-squares
  SGD with smooth covariance",,,,,"math.PR math.OC math.ST stat.ML stat.TH","http://arxiv.org/licenses/nonexclusive-distrib/1.0/","  We derive high-dimensional scaling limits and fluctuations for the online
least-squares Stochastic Gradient Descent (SGD) algorithm by taking the
properties of the data generating model explicitly into consideration. Our
approach treats the SGD iterates as an interacting particle system, where the
expected interaction is characterized by the covariance structure of the input.
Assuming smoothness conditions on moments of order up to eight orders, and
without explicitly assuming Gaussianity, we establish the high-dimensional
scaling limits and fluctuations in the form of infinite-dimensional Ordinary
Differential Equations (ODEs) or Stochastic Differential Equations (SDEs). Our
results reveal a precise three-step phase transition of the iterates; it goes
from being ballistic, to diffusive, and finally to purely random behavior, as
the noise variance goes from low, to moderate and finally to very-high noise
setting. In the low-noise setting, we further characterize the precise
fluctuations of the (scaled) iterates as infinite-dimensional SDEs. We also
show the existence and uniqueness of solutions to the derived limiting ODEs and
SDEs. Our results have several applications, including characterization of the
limiting mean-square estimation or prediction errors and their fluctuations
which can be obtained by analytically or numerically solving the limiting
equations.
","[{""version"":""v1"",""created"":""Mon, 3 Apr 2023 03:50:00 GMT""}]","2023-04-04"
"2304.00708","Jingkai Yang","Jingkai Yang, Qiwen Ran, Hongyu Wu and Jing Ma","Links Assignment Scheme based on Potential Edges Importance in
  Dual-layer Wavelength Routing Optical Satellite Networks","This is the manuscript version that was submitted to the
  International Journal of Satellite Communications and Networking
  (SAT-23-0018)",,,,"cs.NI","http://creativecommons.org/licenses/by-nc-nd/4.0/","  With the development of the massive satellite constellation and the on-orbit
laser-based communication equipment, the wavelength routing optical satellite
network (WROSN) becomes a potential solution for on-orbit, high-capacity, and
high-speed communication. Since the inter-satellite links (ISLs) are
time-varying, one of the fundamental considerations in the construction of the
WROSN is assigning limited laser communication terminals for each satellite to
establish ISLs with the visible satellites. Therefore, we propose a links
assignment scheme (LAS) based on the potential edges importance matrix (PEIM)
algorithm to construct a temporarily stable topology of the ISLs for a
dual-layer constellation. The simulation results showed that the LAS based on
the PEIM algorithm is better than LAS based on the random or Greedy algorithm
in terms of node-to-node distance, node pair connectivity, wavelength demand,
and transmission delay. The node pair connectivity and wavelength demand in
WROSN is a trade-off problem. The research in this paper also brings a novel
method for reduction of the cost of the on-board resources, that is through
designing topology of the ISLs with links assignment algorithm.
","[{""version"":""v1"",""created"":""Mon, 3 Apr 2023 04:01:20 GMT""}]","2023-04-04"
"2304.00709","Xu Tan","Xu Tan, Jiawei Yang, Junqi Chen, Sylwan Rahardja, Susanto Rahardja","Improving Autoencoder-based Outlier Detection with Adjustable
  Probabilistic Reconstruction Error and Mean-shift Outlier Scoring","15 pages, 9 figures. Submitted to IEEE Transactions on Neural
  Networks and Learning Systems (TNNLS)",,,,"cs.LG","http://arxiv.org/licenses/nonexclusive-distrib/1.0/","  Autoencoders were widely used in many machine learning tasks thanks to their
strong learning ability which has drawn great interest among researchers in the
field of outlier detection. However, conventional autoencoder-based methods
lacked considerations in two aspects. This limited their performance in outlier
detection. First, the mean squared error used in conventional autoencoders
ignored the judgment uncertainty of the autoencoder, which limited their
representation ability. Second, autoencoders suffered from the abnormal
reconstruction problem: some outliers can be unexpectedly reconstructed well,
making them difficult to identify from the inliers. To mitigate the
aforementioned issues, two novel methods were proposed in this paper. First, a
novel loss function named Probabilistic Reconstruction Error (PRE) was
constructed to factor in both reconstruction bias and judgment uncertainty. To
further control the trade-off of these two factors, two weights were introduced
in PRE producing Adjustable Probabilistic Reconstruction Error (APRE), which
benefited the outlier detection in different applications. Second, a
conceptually new outlier scoring method based on mean-shift (MSS) was proposed
to reduce the false inliers caused by the autoencoder. Experiments on 32
real-world outlier detection datasets proved the effectiveness of the proposed
methods. The combination of the proposed methods achieved 41% of the relative
performance improvement compared to the best baseline. The MSS improved the
performance of multiple autoencoder-based outlier detectors by an average of
20%. The proposed two methods have the potential to advance autoencoder's
development in outlier detection. The code is available on www.OutlierNet.com
for reproducibility.
","[{""version"":""v1"",""created"":""Mon, 3 Apr 2023 04:01:29 GMT""}]","2023-04-04"
