"2304.00561","Athanasia Toliou","Athanasia Toliou and Mikael Granvik","Resonant mechanisms that produce near-Sun asteroids","20 pages","MNRAS 521 (2023) 4819-4837","10.1093/mnras/stad862",,"astro-ph.EP","http://creativecommons.org/licenses/by/4.0/","  All near-Earth asteroids (NEAs) that reach sufficiently small perihelion
distances will undergo a so-called super-catastrophic disruption. The
mechanisms causing such disruptions are currently unknown or, at least,
undetermined. To help guide theoretical and experimental work to understand the
disruption mechanism, we use numerical simulations of a synthetic NEA
population to identify the resonant mechanisms that are responsible for driving
NEAs close to the Sun, determine how these different mechanisms relate to their
dynamical lifetimes at small heliocentric distances and calculate the average
time they spend at different heliocentric distances. Typically, resonances
between NEAs and the terrestrial and giant planets are able to dramatically
reduce the perihelion distances of the former. We developed an algorithm that
scans the orbital evolution of asteroids and automatically identifies
occurrences of mean motion and secular resonances. We find that most near-Sun
asteroids are pushed to small perihelion distances by the 3:1J and 4:1J
mean-motion resonances with Jupiter, as well as the secular resonances v6,
v5,v3 and v4. The time-scale of the small-perihelion evolution is fastest for
the 4:1J, followed by the 3:1J, while v5 is the slowest.~7% of the test
asteroids were not trapped in a resonance during the latest stages of their
dynamical evolution, which suggests that the secular oscillation of the
eccentricity due to the Kozai mechanism, a planetary close encounter or a
resonance that we have not identified pushed them below the estimated average
disruption distance.
","[{""version"":""v1"",""created"":""Sun, 2 Apr 2023 16:11:26 GMT""}]","2023-04-04"
"2304.00562","Pietro Savazzi","Francesco Silino, Fabio Dell'Acqua, Pietro Savazzi, Anna Vizziello,
  Diego Biz, Federico Brega","Linear approximation of CPM signals for a reduced-complexity, multi-mode
  telemetry transmitter","to be published in the IEEE ICC 2023 Conference Proceedings: SAC
  Satellite and Space Communications Track",,,,"eess.SP","http://creativecommons.org/licenses/by-nc-sa/4.0/","  In space applications, hardware (HW) implementation is made more expensive
not only by the levels of performance required, but also by complex and
rigorous HW qualification tests. Reducing qualification cost and time is thus a
key design requirement. In this paper, a new versatile transmitter is proposed
for space telemetry, capable of soft-switching across different linear and
continuous phase modulation schemes while maintaining the same hardware
structure. This permits a single HW qualification to ``cover'' diverse uses of
the same hardware, and thus avoid re-qualification in case of configuration
changes. The envisaged solution foresees the use of a single filter, suitable
not only for linear modulations such as M-QAM, but also for continuous phase
modulation methods. At this stage, we focus on pulse code modulation/frequency
modulation (PCM/FM), for which we propose a minimum mean square error (MMSE)
algorithm. The proposed algorithm, which adds to the system flexibility and
effectiveness, may use a single first filter based on Laurent decomposition for
initialization, if needed. Performances are assessed using the mean square
error (MSE) measure between the proposed MMSE-modulated signal and the
completely modulated signal. Simulation results confirm that the proposed
algorithm leads to MSE values that are lower than the case of Laurent
decomposition using the first component only.
","[{""version"":""v1"",""created"":""Sun, 2 Apr 2023 16:11:41 GMT""}]","2023-04-04"
"2304.00563","D\'enes Sexty","Erhard Seiler, D\'enes Sexty, Ion-Olimpiu Stamatescu","Complex Langevin: Correctness criteria, boundary terms and spectrum","25 pages, 8 figures",,,,"hep-lat hep-th","http://arxiv.org/licenses/nonexclusive-distrib/1.0/","  The Complex Langevin (CL) method to simulate `complex probabilities', ideally
produces expectation values for the observables that converge to a limit equal
to the expectation values obtained with the original complex `probability'
measure. The situation may be spoiled in two ways: failure to converge and
convergence to the wrong limit. It was found long ago that `wrong convergence'
is caused by boundary terms; non-convergence may arise from bad spectral
properties of the various evolution operators related to the CL process, and is
also signalled by boundary terms, although superficially they may seem
unrelated. Here we propose a class of criteria which allow to rule out boundary
terms and at the same time bad spectrum. It turns out, however, that the two
phenomena are not strictly related: while there is a regime in which the
criteria are satisfied and the spectrum is good, there is also an intermediate
regime in which the criteria are violated, boundary terms are present, leading
to wrong convergence of CL, yet the spectrum still looks good. This shows that
the absence of boundary terms is crucial for correctness, wheres the spectrum
plays only a subsidiary role.
","[{""version"":""v1"",""created"":""Sun, 2 Apr 2023 16:12:09 GMT""}]","2023-04-04"
"2304.00564","Yu-Ran Zhang","Yu-Ran Zhang, Franco Nori","Metrological detection of multipartite entanglement through dynamical
  symmetries","6+4 pages, 2+0 figures",,,,"quant-ph","http://arxiv.org/licenses/nonexclusive-distrib/1.0/","  Multipartite entanglement, characterized by the quantum Fisher information
(QFI), plays a central role in quantum-enhanced metrology and understanding
quantum many-body physics. With a dynamical generalization of the Mazur-Suzuki
relations, we provide a rigorous lower bound on the QFI for the thermal Gibbs
states in terms of dynamical symmetries, i.e., operators with periodic time
dependence. We demonstrate that this bound can be saturated when considering a
complete set of dynamical symmetries. Moreover, this lower bound with dynamical
symmetries can be generalized to the QFI matrix and to the QFI for the thermal
pure states, predicted by the eigenstate thermalization hypothesis. Our results
reveal a new perspective to detect multipartite entanglement and other
generalized variances in an equilibrium system, from its nonstationary
dynamical properties, and is promising for studying emergent nonequilibrium
many-body physics.
","[{""version"":""v1"",""created"":""Sun, 2 Apr 2023 16:18:37 GMT""}]","2023-04-04"
"2304.00565","Valentin Bakoev","Stoyan Kapralov, Valentin Bakoev, Kaloyan Kapralov","Algorithms for Construction, Classification and Enumeration of Closed
  Knight's Paths","7 pages, 4 tables",,,,"math.CO cs.DS","http://creativecommons.org/licenses/by-nc-nd/4.0/","  Two algorithms for construction of all closed knight's paths of lengths up to
16 are presented. An approach for classification (up to equivalence) of all
such paths is considered. By applying the construction algorithms and
classification approach, we enumerate both unrestricted and non-intersecting
knight's paths and show the obtained results.
","[{""version"":""v1"",""created"":""Sun, 2 Apr 2023 16:22:06 GMT""}]","2023-04-04"
"2304.00566","Aleksandra Drozd-Rzoska Dr.hab.","Agata Angelika Rzoska and Aleksandra Drozd-Rzoska","The Story about One Island and Four Cities. The Socio-Economic Soft
  Matter Model - Based Report","17 pages, 9 Figures",,,,"physics.soc-ph econ.GN q-fin.EC","http://creativecommons.org/licenses/by/4.0/","  The report discusses the emergence of the Socio-Economic Soft Matter (SE-SM)
as the result of interactions between physics and economy. First, demographic
changes since the Industrial Revolution onset are tested using Soft Matter
science tools. Notable in the support of innovative derivative-based and
distortions-sensitive analytic tools. It revealed the Weibull type powered
exponential increase, with a notably lesser rising rate since the crossover
detected near the year 1970. Subsequently, demographic (SE-SM) patterns are
tested for Rapa Nui (Easter) Island model case and for four large 'hallmark
cities' where the rise and decay phases have occurred. They are Detroit and
Cleveland in the USA and Lodz (former textile industry center) and Bytom
(former coal mining center) in Poland. The analysis explicitly revealed scaling
patterns for demographic changes, influenced by the historical and
socio-economic backgrounds and the long-lasting determinism in population
changes. Universalistic features of demographic changes are discussed within
the Socio-Economic Soft Matter concept.
","[{""version"":""v1"",""created"":""Sun, 2 Apr 2023 16:23:55 GMT""}]","2023-04-04"
"2304.00567","Varun Kumar","Varun Kumar, Somdatta Goswami, Daniel J. Smith, George Em Karniadakis","Real-Time Prediction of Multiple Output States in Diesel Engines using a
  Deep Neural Operator Framework",,,,,"eess.SP","http://creativecommons.org/licenses/by-nc-nd/4.0/","  We develop a data-driven deep neural operator framework to approximate
multiple output states for a diesel engine and generate real-time predictions
with reasonable accuracy. As emission norms become more stringent, the need for
fast and accurate models that enable analysis of system behavior have become an
essential requirement for system development. The fast transient processes
involved in the operation of a combustion engine make it difficult to develop
accurate physics-based models for such systems. As an alternative to physics
based models, we develop an operator-based regression model (DeepONet) to learn
the relevant output states for a mean-value gas flow engine model using the
engine operating conditions as input variables. We have adopted a mean-value
model as a benchmark for comparison, simulated using Simulink. The developed
approach necessitates using the initial conditions of the output states to
predict the accurate sequence over the temporal domain. To this end, a
sequence-to-sequence approach is embedded into the proposed framework. The
accuracy of the model is evaluated by comparing the prediction output to ground
truth generated from Simulink model. The maximum $\mathcal L_2$ relative error
observed was approximately $6.5\%$. The sensitivity of the DeepONet model is
evaluated under simulated noise conditions and the model shows relatively low
sensitivity to noise. The uncertainty in model prediction is further assessed
by using a mean ensemble approach. The worst-case error at the $(\mu +
2\sigma)$ boundary was found to be $12\%$. The proposed framework provides the
ability to predict output states in real-time and enables data-driven learning
of complex input-output operator mapping. As a result, this model can be
applied during initial development stages, where accurate models may not be
available.
","[{""version"":""v1"",""created"":""Sun, 2 Apr 2023 16:24:04 GMT""}]","2023-04-04"
"2304.00568","Darryl Seligman","Darryl Z. Seligman and Amaya Moro-Mart\'in","Interstellar Objects","51 pages, 10 figures, invited review for Contemporary Physics,
  comments welcome",,,,"astro-ph.EP astro-ph.GA","http://creativecommons.org/licenses/by/4.0/","  Since 2017, two macroscopic interstellar objects have been discovered in the
inner Solar System, both of which are distinct in nature. The first
interstellar object, 1I/`Oumuamua, passed within $\sim63$ lunar distances of
the Earth, appeared asteroidal lacking detectable levels of gas or dust loss,
yet exhibited a nongravitational acceleration. 1I/`Oumuamua's brief visit left
open questions regarding its provenance which has given rise to many
theoretical hypotheses, including an icy comet lacking a dust coma, an
elongated fragment of a planet or planetesimal that was tidally disrupted, and
an ultra-porous fractal aggregate. The second interstellar object, 2I/Borisov,
was distinct from 1I/`Oumuamua in terms of its bulk physical properties and
displayed a definitive cometary tail. We review the discoveries of these
objects, the subsequent observations and characterizations, and the theoretical
hypotheses regarding their origins. We describe 1I/`Oumuamua and 2I/Borisov in
the context of active asteroids and comets in the Solar System. The discovery
of these two objects implies a galactic-wide population of $\sim10^{26}$
similar bodies. Forthcoming observatories should detect many more interstellar
planetesimals which may offer new insights into how planetary formation
processes vary throughout the Galaxy.
","[{""version"":""v1"",""created"":""Sun, 2 Apr 2023 16:24:53 GMT""}]","2023-04-04"
"2304.00569","Seth Siriya","Seth Siriya, Jingge Zhu, Dragan Ne\v{s}i\'c, Ye Pu","Stability Bounds for Learning-Based Adaptive Control of Discrete-Time
  Multi-Dimensional Stochastic Linear Systems with Input Constraints","21 pages, 1 figure, submitted to 62nd IEEE Conference on Decision and
  Control",,,,"eess.SY cs.LG cs.SY math.OC","http://arxiv.org/licenses/nonexclusive-distrib/1.0/","  We consider the problem of adaptive stabilization for discrete-time,
multi-dimensional linear systems with bounded control input constraints and
unbounded stochastic disturbances, where the parameters of the true system are
unknown. To address this challenge, we propose a certainty-equivalent control
scheme which combines online parameter estimation with saturated linear
control. We establish the existence of a high probability stability bound on
the closed-loop system, under additional assumptions on the system and noise
processes. Finally, numerical examples are presented to illustrate our results.
","[{""version"":""v1"",""created"":""Sun, 2 Apr 2023 16:38:13 GMT""}]","2023-04-04"
"2304.00570","Bo Zhou","Bo Zhou, Huidong Xie, Qiong Liu, Xiongchao Chen, Xueqi Guo, Zhicheng
  Feng, S. Kevin Zhou, Biao Li, Axel Rominger, Kuangyu Shi, James S. Duncan,
  Chi Liu","FedFTN: Personalized Federated Learning with Deep Feature Transformation
  Network for Multi-institutional Low-count PET Denoising",,,,,"eess.IV cs.CV cs.LG","http://creativecommons.org/licenses/by/4.0/","  Low-count PET is an efficient way to reduce radiation exposure and
acquisition time, but the reconstructed images often suffer from low
signal-to-noise ratio (SNR), thus affecting diagnosis and other downstream
tasks. Recent advances in deep learning have shown great potential in improving
low-count PET image quality, but acquiring a large, centralized, and diverse
dataset from multiple institutions for training a robust model is difficult due
to privacy and security concerns of patient data. Moreover, low-count PET data
at different institutions may have different data distribution, thus requiring
personalized models. While previous federated learning (FL) algorithms enable
multi-institution collaborative training without the need of aggregating local
data, addressing the large domain shift in the application of
multi-institutional low-count PET denoising remains a challenge and is still
highly under-explored. In this work, we propose FedFTN, a personalized
federated learning strategy that addresses these challenges. FedFTN uses a
local deep feature transformation network (FTN) to modulate the feature outputs
of a globally shared denoising network, enabling personalized low-count PET
denoising for each institution. During the federated learning process, only the
denoising network's weights are communicated and aggregated, while the FTN
remains at the local institutions for feature transformation. We evaluated our
method using a large-scale dataset of multi-institutional low-count PET imaging
data from three medical centers located across three continents, and showed
that FedFTN provides high-quality low-count PET images, outperforming previous
baseline FL reconstruction methods across all low-count levels at all three
institutions.
","[{""version"":""v1"",""created"":""Sun, 2 Apr 2023 16:39:59 GMT""}]","2023-04-04"
"2304.00571","Qiangqiang Wu","Qiangqiang Wu and Tianyu Yang and Ziquan Liu and Baoyuan Wu and Ying
  Shan and Antoni B. Chan","DropMAE: Masked Autoencoders with Spatial-Attention Dropout for Tracking
  Tasks","CVPR 2023; V2: fixed typos in Table-2",,,,"cs.CV","http://arxiv.org/licenses/nonexclusive-distrib/1.0/","  In this paper, we study masked autoencoder (MAE) pretraining on videos for
matching-based downstream tasks, including visual object tracking (VOT) and
video object segmentation (VOS). A simple extension of MAE is to randomly mask
out frame patches in videos and reconstruct the frame pixels. However, we find
that this simple baseline heavily relies on spatial cues while ignoring
temporal relations for frame reconstruction, thus leading to sub-optimal
temporal matching representations for VOT and VOS. To alleviate this problem,
we propose DropMAE, which adaptively performs spatial-attention dropout in the
frame reconstruction to facilitate temporal correspondence learning in videos.
We show that our DropMAE is a strong and efficient temporal matching learner,
which achieves better finetuning results on matching-based tasks than the
ImageNetbased MAE with 2X faster pre-training speed. Moreover, we also find
that motion diversity in pre-training videos is more important than scene
diversity for improving the performance on VOT and VOS. Our pre-trained DropMAE
model can be directly loaded in existing ViT-based trackers for fine-tuning
without further modifications. Notably, DropMAE sets new state-of-the-art
performance on 8 out of 9 highly competitive video tracking and segmentation
datasets. Our code and pre-trained models are available at
https://github.com/jimmy-dq/DropMAE.git.
","[{""version"":""v1"",""created"":""Sun, 2 Apr 2023 16:40:42 GMT""},{""version"":""v2"",""created"":""Fri, 7 Apr 2023 02:55:28 GMT""}]","2023-04-10"
"2304.00572","Seogjoo Jang","Seogjoo J. Jang and Young Min Rhee","Modified Fermi's golden rule rate expressions","8 pages and no figure",,,,"quant-ph physics.chem-ph","http://arxiv.org/licenses/nonexclusive-distrib/1.0/","  Fermi's golden rule (FGR) serves as the basis for many expressions of
spectroscopic observables and quantum transition rates. The utility of FGR has
been demonstrated through decades of experimental confirmation. However, there
still remain important cases where the evaluation of a FGR rate is ambiguous or
ill-defined. Examples are cases where the rate has divergent terms due to the
sparsity in the density of final states or system Hamiltonians go through time
dependent fluctuations. Strictly speaking, assumptions of FGR are no longer
valid for such cases. However, it is still possible to define modified FGR rate
expressions that are useful as effective rates. The resulting modified FGR rate
expressions resolve a long standing ambiguity often encountered in using FGR
and offer more reliable ways to model general rate processes.
","[{""version"":""v1"",""created"":""Sun, 2 Apr 2023 16:41:27 GMT""}]","2023-04-04"
"2304.00573","Marc Rigter","Marc Rigter","Risk-Sensitive and Robust Model-Based Reinforcement Learning and
  Planning","DPhil (PhD) thesis, University of Oxford",,,,"cs.LG cs.AI","http://arxiv.org/licenses/nonexclusive-distrib/1.0/","  Many sequential decision-making problems that are currently automated, such
as those in manufacturing or recommender systems, operate in an environment
where there is either little uncertainty, or zero risk of catastrophe. As
companies and researchers attempt to deploy autonomous systems in less
constrained environments, it is increasingly important that we endow sequential
decision-making algorithms with the ability to reason about uncertainty and
risk.
  In this thesis, we will address both planning and reinforcement learning (RL)
approaches to sequential decision-making. In the planning setting, it is
assumed that a model of the environment is provided, and a policy is optimised
within that model. Reinforcement learning relies upon extensive random
exploration, and therefore usually requires a simulator in which to perform
training. In many real-world domains, it is impossible to construct a perfectly
accurate model or simulator. Therefore, the performance of any policy is
inevitably uncertain due to the incomplete knowledge about the environment.
Furthermore, in stochastic domains, the outcome of any given run is also
uncertain due to the inherent randomness of the environment. These two sources
of uncertainty are usually classified as epistemic, and aleatoric uncertainty,
respectively. The over-arching goal of this thesis is to contribute to
developing algorithms that mitigate both sources of uncertainty in sequential
decision-making problems.
  We make a number of contributions towards this goal, with a focus on
model-based algorithms...
","[{""version"":""v1"",""created"":""Sun, 2 Apr 2023 16:44:14 GMT""}]","2023-04-04"
"2304.00574","Yuen San Lo","Y. S. Lo, R. I. Woodward, N. Walk, M. Lucamarini, I. De Marco, T. K.
  Para\""iso, M. Pittaluga, T. Roger, M. Sanzaro, Z. L. Yuan, and A. J. Shields","Simplified intensity- and phase-modulated transmitter for modulator-free
  decoy-state quantum key distribution",,"APL Photonics 8, 036111 (2023)","10.1063/5.0128445",,"quant-ph","http://arxiv.org/licenses/nonexclusive-distrib/1.0/","  Quantum key distribution (QKD) allows secret key exchange between two users
with unconditional security. For QKD to be widely deployed, low cost and
compactness are crucial requirements alongside high performance. Currently, the
majority of QKD systems demonstrated rely on bulk intensity and phase
modulators to generate optical pulses with precisely defined amplitude and
relative phase difference i.e., to encode information as signal states and
decoy states. However, these modulators are expensive and bulky, thereby
limiting the compactness of QKD systems. Here, we present and experimentally
demonstrate a novel optical transmitter design to overcome this disadvantage by
generating intensity- and phase-tunable pulses at GHz clock speeds. Our design
removes the need for bulk modulators by employing directly modulated lasers in
combination with optical injection locking and coherent interference. This
scheme is, therefore, well suited to miniaturization and photonic integration,
and we implement a proof-of-principle QKD demonstration to highlight potential
applications.
","[{""version"":""v1"",""created"":""Sun, 2 Apr 2023 16:44:25 GMT""}]","2023-04-04"
"2304.00575","Berthold Lausen","Juan Pablo Equihua, Henrik Nordmark, Maged Ali, Berthold Lausen","Modelling customer churn for the retail industry in a deep learning
  based sequential framework","21 pages, 12 figures",,,,"stat.ML cs.LG stat.AP","http://arxiv.org/licenses/nonexclusive-distrib/1.0/","  As retailers around the world increase efforts in developing targeted
marketing campaigns for different audiences, predicting accurately which
customers are most likely to churn ahead of time is crucial for marketing teams
in order to increase business profits. This work presents a deep survival
framework to predict which customers are at risk of stopping to purchase with
retail companies in non-contractual settings. By leveraging the survival model
parameters to be learnt by recurrent neural networks, we are able to obtain
individual level survival models for purchasing behaviour based only on
individual customer behaviour and avoid time-consuming feature engineering
processes usually done when training machine learning models.
","[{""version"":""v1"",""created"":""Sun, 2 Apr 2023 16:48:43 GMT""}]","2023-04-04"
"2304.00576","Katherine Jones-Smith","Katherine Jones-Smith, Harsh Mathur","Modified Newtonian Dynamics as an Alternative to the Planet Nine
  Hypothesis","Under review at the Astronomical Journal. Complementary to the
  findings of Migaszewski in arXiv:2303.13339",,,,"gr-qc astro-ph.EP astro-ph.GA","http://creativecommons.org/licenses/by/4.0/","  A new class of Kuiper belt objects that lie beyond Neptune with semimajor
axes greater than 250 astronomical units show orbital anomalies that have been
interpreted as evidence for an undiscovered ninth planet. We show that a
modified gravity theory known as MOND (Modified Newtonian Dynamics) provides an
alternative explanation for the anomalies using the well-established secular
approximation. We predict that the major axes of the orbits will be aligned
with the direction towards the galactic center and that the orbits cluster in
phase space, in agreement with observations of Kuiper belt objects from the new
class. Thus MOND, which can explain galactic rotation without invoking dark
matter, might also be observable in the outer solar system.
","[{""version"":""v1"",""created"":""Sun, 2 Apr 2023 16:50:51 GMT""}]","2023-04-04"
"2304.00577","Kosar Asadi","Kosar Asadi, Amin Nassiri-Rad, Hassan Firouzjahi","Stochastic Multiple Fields Inflation: Diffusion Dominated Regime","40 pages, 15 figures",,,,"astro-ph.CO gr-qc hep-th","http://creativecommons.org/licenses/by/4.0/","  We study multiple fields inflation in diffusion dominated regime using
stochastic $\delta N$ formalism. The fields are under pure Brownian motion in a
dS background with boundaries in higher dimensional field space. This setup can
be realized towards the final stages of the ultra slow-roll setup where the
classical drifts fall off exponentially and the perturbations are driven by
quantum kicks. We consider both symmetric and asymmetric boundaries with
absorbing and reflective boundary conditions and calculate the average number
of e-folds, the first crossing probabilities and the power spectrum. We study
the primordial black holes (PBHs) formation in this setup and calculate the
mass fraction and the contribution of PBHs in dark matter energy density for
various higher dimensional field spaces.
","[{""version"":""v1"",""created"":""Sun, 2 Apr 2023 17:05:21 GMT""}]","2023-04-04"
