"2304.00828","Francois Hamel","Matthieu Alfaro (LMRS), Fran\c{c}ois Hamel (I2M), Lionel Roques
  (BioSP)","Propagation or extinction in bistable equations: the non-monotone role
  of initial fragmentation",,,,,"math.AP","http://arxiv.org/licenses/nonexclusive-distrib/1.0/","  In this paper, we investigate the large-time behavior of bounded solutions of
the Cauchy problem for a reaction-diffusion equation in $\mathbb{R}^N$ with
bistable reaction term. We consider initial conditions that are chiefly
indicator functions of bounded Borel sets. We examine how geometric
transformations of the supports of these initial conditions affect the
propagation or extinction of the solutions at large time. We also consider two
fragmentation indices defined in the set of bounded Borel sets and we establish
some propagation or extinction results when the initial supports are weakly or
highly fragmented. Lastly, we show that the large-time dynamics of the
solutions is not monotone with respect to the considered fragmentation indices,
even for equimeasurable sets.
","[{""version"":""v1"",""created"":""Mon, 3 Apr 2023 09:15:09 GMT""}]","2023-04-04"
"2304.00829","Mathilde Hary","Mathilde Hary, Lauri Salmela, Piotr Ryczkowski, Francesca Gallazzi,
  John M. Dudley and Go\""ery Genty","Tailored supercontinuum generation using genetic algorithmoptimized
  Fourier domain pulse shaping",,,,,"physics.optics","http://creativecommons.org/licenses/by-nc-nd/4.0/","  We report the generation of spectrally-tailored supercontinuum using
Fourier-domain pulse shaping of femtosecond pulses injected into a highly
nonlinear fiber controlled by a genetic algorithm. User-selectable spectral
enhancement is demonstrated over the 1550-2000~nm wavelength range, with the
ability to both select a target central wavelength and a target bandwidth in
the range 1--5~nm. The spectral enhancement factor relative to unshaped input
pulses is typically $\sim$5--20 in the range 1550--1800~nm and increases for
longer wavelengths, exceeding a factor of 160 around 2000~nm. We also
demonstrate results where the genetic algorithm is applied to the enhancement
of up to four wavelengths simultaneously.
","[{""version"":""v1"",""created"":""Mon, 3 Apr 2023 09:15:46 GMT""}]","2023-04-04"
"2304.00830","Yuancheng Wang","Yuancheng Wang, Zeqian Ju, Xu Tan, Lei He, Zhizheng Wu, Jiang Bian,
  Sheng Zhao","AUDIT: Audio Editing by Following Instructions with Latent Diffusion
  Models",,,,,"cs.SD cs.AI cs.CL cs.LG eess.AS","http://arxiv.org/licenses/nonexclusive-distrib/1.0/","  Audio editing is applicable for various purposes, such as adding background
sound effects, replacing a musical instrument, and repairing damaged audio.
Recently, some diffusion-based methods achieved zero-shot audio editing by
using a diffusion and denoising process conditioned on the text description of
the output audio. However, these methods still have some problems: 1) they have
not been trained on editing tasks and cannot ensure good editing effects; 2)
they can erroneously modify audio segments that do not require editing; 3) they
need a complete description of the output audio, which is not always available
or necessary in practical scenarios. In this work, we propose AUDIT, an
instruction-guided audio editing model based on latent diffusion models.
Specifically, AUDIT has three main design features: 1) we construct triplet
training data (instruction, input audio, output audio) for different audio
editing tasks and train a diffusion model using instruction and input (to be
edited) audio as conditions and generating output (edited) audio; 2) it can
automatically learn to only modify segments that need to be edited by comparing
the difference between the input and output audio; 3) it only needs edit
instructions instead of full target audio descriptions as text input. AUDIT
achieves state-of-the-art results in both objective and subjective metrics for
several audio editing tasks (e.g., adding, dropping, replacement, inpainting,
super-resolution). Demo samples are available at https://audit-demo.github.io/.
","[{""version"":""v1"",""created"":""Mon, 3 Apr 2023 09:15:51 GMT""},{""version"":""v2"",""created"":""Wed, 5 Apr 2023 12:13:48 GMT""}]","2023-04-06"
"2304.00831","Thierry Pradier","Thierry Pradier","Estimating Source Distances for High Energy Neutrinos: A Method for
  Improving Electromagnetic Follow-up Searches","Changes after A&A Referee report. In particular new title and new
  Figure 1 with different parameters. Accepted for publication as A&A Letter to
  the Editor",,,,"astro-ph.HE","http://arxiv.org/licenses/nonexclusive-distrib/1.0/","  High Energy Neutrino telescopes such as IceCube or KM3NeT issue public alerts
describing the characteristics of possible astrophysical high energy neutrino
events. This information, in particular the arrival direction and the
associated uncertainty of the neutrino candidates, is used by observatories to
search for possible electromagnetic counterparts. Such searches are complicated
by the localization areas as high as tens of squared degrees or more and the
absence of constraints on the distance or nature of the source, contrarily to
gravitational wave alerts issued by instruments such as LIGO/Virgo. A method to
derive a probable distance for the astrophysical source possibly associated to
a HEN event is described, which can be used in a cross-match with galaxy
catalogues to search for possible electromagnetic counterparts. This is
intended as a guide for high energy neutrino followup campaigns.
","[{""version"":""v1"",""created"":""Mon, 3 Apr 2023 09:19:18 GMT""},{""version"":""v2"",""created"":""Mon, 22 May 2023 08:39:59 GMT""}]","2023-05-23"
"2304.00832","Yuxuan Hu","Yuxuan Hu, Pyongwon Suh","Coherent-Constructible Correspondence for Toric Fibrations","34 pages, 8 figures",,,,"math.AG math.AT math.SG","http://creativecommons.org/licenses/by/4.0/","  Let $\Sigma$ be a fan inside the lattice $\mathbb{Z}^n$, and
$\mathcal{E}:\mathbb{Z}^n \rightarrow \operatorname{Pic}{S}$ be a map of
abelian groups. We introduce the notion of a principal toric fibration
$\mathcal{X}_{\Sigma, \mathcal{E}}$ over the base scheme $S$, relativizing the
usual toric construction for $\Sigma$. We show that the category of
ind-coherent sheaves on such a fibration is equivalent to the global section of
the Kashiwara-Schapira stack twisted by a certain local system of categories
with stalk $\operatorname{Ind}\operatorname{Coh} S$. It is a simultaneous
generalization of the work of Harder-Katzarkov [HK19] and of Kuwagaki [Kuw20],
and should be seen as a family-version of the coherent-constructible
correspondence [FLTZ11].
","[{""version"":""v1"",""created"":""Mon, 3 Apr 2023 09:20:13 GMT""}]","2023-04-04"
"2304.00833","Xavier Rivas","Xavier Rivas, Modesto Salgado, Silvia Souto","Some contributions to k-contact Lagrangian field equations, symmetries
  and dissipation laws","28pp",,,,"math-ph math.MP","http://creativecommons.org/licenses/by/4.0/","  It is well known that k-contact geometry is a suitable framework to deal with
non-conservative field theories. In this paper, we study some relations between
solutions of the k-contact Euler-Lagrange equations, symmetries, dissipation
laws and Newtonoid vector fields. We review the k-contact Euler-Lagrange
equations written in terms of k-vector fields and sections and provide new
results relating the solutions in both approaches. We also study different kind
of symmetries depending on the structures they preserve: natural (preserving
the Lagrangian function), dynamical (preserving the solutions), and k-contact
(preserving the underlying geometric structures) symmetries. For some of these
symmetries, we provide Noether-like theorems relating symmetries and
dissipation laws. We also analyse the relation between k-contact symmetries and
Newtonoid vector fields. Throughout the paper, we will use the damped vibrating
string as our main illustrative example.
","[{""version"":""v1"",""created"":""Mon, 3 Apr 2023 09:21:39 GMT""}]","2023-04-04"
"2304.00834","Sukhendusekhar Sarkar","Arkabrata Gupta, Chirashree Lahiri, and S. Sarkar","Allowed $\beta^-$ Decay of Bare Atoms (A$\sim$ 60-80) in Stellar
  Environments","36 pages, 10 figures, 7 tables",,,,"nucl-th","http://creativecommons.org/licenses/by/4.0/","  We have calculated $\beta^-$ decay rates to the continuum and bound states of
some fully ionized atoms in the stellar s-process environment having free
electron density and temperature in the range $n_e = 10^{26} $ cm$^{-3} -
10^{27} $ cm$^{-3}$ and $T = 10^8$ K - $5 \times 10^{8}$ K, respectively. The
presence of bare atoms in these particular situations has been confirmed by
solving Saha ionization equation taking into account the ionization potential
depression (IPD). At these temperatures, low lying excited energy levels of
parent nuclei may have thermal equilibrium population and those excited levels
may also decay via $\beta^-$ emission. The Nuclear Matrix Element (NME) of all
the transitions of the set of 15 nuclei is calculated using nuclear
shell-model. These NME are then used to calculate the comparative half-life
($ft_{1/2}$) of the transitions. Calculated terrestrial half-lives of the
$\beta^-$ decays are in good agreement with the experimental results in most of
the cases. Decay to bound and continuum states of bare atoms from
ground/isomeric levels and excited nuclear levels have been calculated
separately. The ratio of bound state to continuum state decay rates as a
function of IPD modified $Q$-value reveals that bound state $\beta^-$ decay
rate may compete and even dominate for $Q$-value $<$ 100 keV. The importance of
the bound state $\beta^-$ decay in stellar situations has been shown
explicitly. We have calculated total $\beta^-$ decay rates (bound state plus
continuum state) taking into account IPD corrected neutral atom $Q$-value as a
function of density and temperature. We have also presented results for the
stellar $\beta^-$ half-lives and compared the ratio of neutral atom to bare
atom half-lives for different density and temperature combinations. These
results may be useful for s-process nucleosynthesis calculations.
","[{""version"":""v1"",""created"":""Mon, 3 Apr 2023 09:23:30 GMT""}]","2023-04-04"
"2304.00835","Lucas Gr\'eaux","Lucas Gr\'eaux, Jonathan Biteau, Tarek Hassan, Olivier Hervet, Mireia
  Nievas Rosillo, David A. Williams","STeVECat, the Spectral TeV Extragalactic Catalog",,,,,"astro-ph.HE astro-ph.CO","http://creativecommons.org/licenses/by-nc-nd/4.0/","  The three main collaborations operating the current generation of imaging
atmospheric Cherenkov telescopes (IACTs: H.E.S.S., MAGIC, VERITAS) publish
their gamma-ray data in different formats and repositories. Extragalactic
sources are highly variable at very-high energies (VHE, $E>100\,$GeV), and a
unified repository would enable joint analyses of collections of extragalactic
VHE spectra. To this aim, we have developed the Spectral TeV Extragalactic
Catalog, STeVECat, which gathers high-level products of IACT observations from
1992 to 2021. We selected all publications in journals referenced in TeVCat
that presented archival spectra with at least two points. We compiled the
corresponding spectral data and formatted them following the convention adopted
in available public repositories (GammaCat and VTSCat). In addition to spectral
points with associated physical units, we provide meta-data featuring
observation periods, livetime, excess counts over background and significance,
as well as the coordinates, types and redshifts of the sources whenever
available. STeVECat combines observations from 173 journal publications,
compared to 72 in the previous reference compilation of extragalactic gamma-ray
spectra (Biteau \& Williams, 2015). STeVECat is the most extensive set of VHE
extragalactic spectra collected so far, with 403 spectra from 73 sources. The
full catalog can readily be loaded with GammaPy, the Science Analysis Tool
selected by the Cherenkov Telescope Array Observatory. Our compilation efforts
enable population studies of extragalactic gamma-ray sources, studies of the
GeV-TeV connection, and studies of absorption on the extragalactic background
light.
","[{""version"":""v1"",""created"":""Mon, 3 Apr 2023 09:23:41 GMT""}]","2023-04-04"
"2304.00836","Nicholas Loutrel","Nicholas Loutrel","Eccentric Catastrophes & What To Do With Them","21 pages, 9 figures, comments welcome",,,,"gr-qc math-ph math.MP","http://arxiv.org/licenses/nonexclusive-distrib/1.0/","  Analytic modeling of gravitational waves from inspiraling eccentric binaries
poses an interesting mathematical challenge. When constructing analytic
waveforms in the frequency domain, one has to contend with the fact that the
phase of the Fourier integral in non-monotonic, resulting in a breakdown of the
standard stationary phase approximation. In this work, we study this breakdown
within the context of catastrophe theory. We find that the stationary phase
approximation holds in the context of eccentric Keplerian orbits when the
Fourier frequency satisfies $f_{\rm min} < f < f_{\rm max}$, where $f_{\rm
min/max}$ are integer multiples of the apocenter/pericenter frequencies,
respectively. For values outside of this interval, the phase undergoes a fold
catastrophe, giving rise to an Airy function approximation of the Fourier
integral. Using these two different approximations, we generate a matched
asymptotic expansion that approximates generic Fourier integrals of Keplerian
motion for bound orbits across all frequency values. This asymptotic expansion
is purely analytic and closed-form. We discuss several applications of this
investigation and the resulting approximation, specifically: 1) the development
and improvement of effective fly-by waveforms, 2) the transition from burst
emission in the high eccentricity limit to wave-like emission in the
quasi-circular limit, which results in an analogy between eccentric
gravitational wave bursts and Bose-Einstein condensates, and 3) the calculation
of f-mode amplitudes from stars in eccentric orbits in terms of complex Hansen
coefficients. The techniques and approximations developed herein are generic,
and will be useful for future studies of gravitational waves from eccentric
binaries within the context of post-Newtonian theory.
","[{""version"":""v1"",""created"":""Mon, 3 Apr 2023 09:27:06 GMT""}]","2023-04-04"
"2304.00837","Hao Zhu","Hao Zhu, Shaowen Xie, Zhen Liu, Fengyi Liu, Qi Zhang, You Zhou, Yi
  Lin, Zhan Ma, Xun Cao","Disorder-invariant Implicit Neural Representation","Journal extension of the CVPR'23 highlight paper ""DINER:
  Disorder-invariant Implicit Neural Representation"". In the extension, we
  model the expressive power of the DINER using parametric functions in the
  attribute space. As a result, better results are achieved than the conference
  version. arXiv admin note: substantial text overlap with arXiv:2211.07871",,,,"cs.CV eess.SP","http://arxiv.org/licenses/nonexclusive-distrib/1.0/","  Implicit neural representation (INR) characterizes the attributes of a signal
as a function of corresponding coordinates which emerges as a sharp weapon for
solving inverse problems. However, the expressive power of INR is limited by
the spectral bias in the network training. In this paper, we find that such a
frequency-related problem could be greatly solved by re-arranging the
coordinates of the input signal, for which we propose the disorder-invariant
implicit neural representation (DINER) by augmenting a hash-table to a
traditional INR backbone. Given discrete signals sharing the same histogram of
attributes and different arrangement orders, the hash-table could project the
coordinates into the same distribution for which the mapped signal can be
better modeled using the subsequent INR network, leading to significantly
alleviated spectral bias. Furthermore, the expressive power of the DINER is
determined by the width of the hash-table. Different width corresponds to
different geometrical elements in the attribute space, \textit{e.g.}, 1D curve,
2D curved-plane and 3D curved-volume when the width is set as $1$, $2$ and $3$,
respectively. More covered areas of the geometrical elements result in stronger
expressive power. Experiments not only reveal the generalization of the DINER
for different INR backbones (MLP vs. SIREN) and various tasks (image/video
representation, phase retrieval, refractive index recovery, and neural radiance
field optimization) but also show the superiority over the state-of-the-art
algorithms both in quality and speed. \textit{Project page:}
\url{https://ezio77.github.io/DINER-website/}
","[{""version"":""v1"",""created"":""Mon, 3 Apr 2023 09:28:48 GMT""}]","2023-04-04"
"2304.00838","Dingyun Zhang","Dingyun Zhang, Chenglai Zhong, Yudong Guo, Yang Hong, Juyong Zhang","MetaHead: An Engine to Create Realistic Digital Head","Project page: https://ustc3dv.github.io/MetaHead/",,,,"cs.CV cs.GR","http://arxiv.org/licenses/nonexclusive-distrib/1.0/","  Collecting and labeling training data is one important step for
learning-based methods because the process is time-consuming and biased. For
face analysis tasks, although some generative models can be used to generate
face data, they can only achieve a subset of generation diversity,
reconstruction accuracy, 3D consistency, high-fidelity visual quality, and easy
editability. One recent related work is the graphics-based generative method,
but it can only render low realism head with high computation cost. In this
paper, we propose MetaHead, a unified and full-featured controllable digital
head engine, which consists of a controllable head radiance field(MetaHead-F)
to super-realistically generate or reconstruct view-consistent 3D controllable
digital heads and a generic top-down image generation framework LabelHead to
generate digital heads consistent with the given customizable feature labels.
Experiments validate that our controllable digital head engine achieves the
state-of-the-art generation visual quality and reconstruction accuracy.
Moreover, the generated labeled data can assist real training data and
significantly surpass the labeled data generated by graphics-based methods in
terms of training effect.
","[{""version"":""v1"",""created"":""Mon, 3 Apr 2023 09:29:17 GMT""}]","2023-04-04"
"2304.00839","Laurenz Rettig","J. Maklar, P. Walmsley, I. R. Fisher, and L. Rettig","Ultrafast spatiotemporal dynamics of a charge-density wave using
  femtosecond dark-field momentum microscopy","8 pages, 4 figures","Proc. SPIE 12419, Ultrafast Phenomena and Nanophotonics XXVII,
  1241903 (15 March 2023)","10.1117/12.2649985",,"cond-mat.str-el","http://creativecommons.org/licenses/by-nc-nd/4.0/","  Understanding phase competition and phase separation in quantum materials
requires access to the spatiotemporal dynamics of electronic ordering phenomena
on a micro- to nanometer length- and femtosecond timescale. While time- and
angle-resolved photoemission (trARPES) experiments provide sensitivity to the
femtosecond dynamics of electronic ordering, they typically lack the required
spatial resolution. Here, we demonstrate ultrafast dark-field photoemission
microscopy (PEEM) using a momentum microscope, providing access to ultrafast
electronic order on the microscale. We investigate the prototypical
charge-density wave (CDW) compound TbTe3 in the vicinity of a buried crystal
defect, demonstrating real- and reciprocal-space configurations combined with a
pump-probe approach. We find CDW order to be suppressed in the region covered
by the crystal defect, most likely due to locally imposed strain. Comparing the
ultrafast dynamics in different areas of the sample reveals a substantially
smaller response to optical excitation and faster relaxation of excited
carriers in the defect area, which we attribute to enhanced particle-hole
scattering and defect-induced relaxation channels.
","[{""version"":""v1"",""created"":""Mon, 3 Apr 2023 09:33:14 GMT""}]","2023-04-04"
"2304.00840","Zhiwen Zhao","Zhiwen Zhao, Xiaoxin Zheng","Asymptotic stability of homogeneous solutions to Navier-Stokes equations
  under $L^{p}$-perturbations",,,,,"math.AP","http://arxiv.org/licenses/nonexclusive-distrib/1.0/","  It is known that there has been classified for all $(-1)$-homogeneous
axisymmetric no-swirl solutions of the three-dimensional Navier-Stokes
equations with a possible singular ray. The main purpose of this paper is to
show that the least singular solutions among such solutions other than Landau
solutions to the Navier-Stokes equations are asymptotically stable under
$L^{3}$-perturbations. Moreover, we establish the $L^{q}$ decay estimate with
an explicit decay rate and a sharp constant for any $q>3$. For that purpose, we
first study the global well-posedness of solutions to the perturbed equations
under small initial data in $L_{\sigma}^{3}$ space and the local well-posedness
with any initial data in $L_{\sigma}^{p}$ spaces for $p\geq3$.
","[{""version"":""v1"",""created"":""Mon, 3 Apr 2023 09:36:03 GMT""},{""version"":""v2"",""created"":""Tue, 4 Apr 2023 13:16:20 GMT""}]","2023-04-05"
"2304.00841","Michael Stumpf","Michael P.H. Stumpf","Hypergraph Animals","11 pages, 4 figures",,,,"q-bio.MN cond-mat.dis-nn math.CO","http://creativecommons.org/licenses/by-sa/4.0/","  Here we introduce simple structures for the analysis of complex hypergraphs,
hypergraph animals. These structures are designed to describe the local node
neighbourhoods of nodes in hypergraphs. We establish their relationships to
lattice animals and network motifs and develop their combinatorial properties,
for sparse and uncorrelated hypergraphs. Here we can make use of the tight link
of hypergraph animals to partition numbers, which opens up a vast mathematical
framework for the analysis of hypergraph animals. We then study their
abundances in random hypergraphs. Two transferable insights result from this
analysis: (i) it establishes the importance of high-cardinality edges in
ensembles of random hypergraphs that are inspired by the classical
Erdos-Reny\'i random graphs; and (ii) there is a close connection between
degree and hyperedge cardinality in random hypergraphs that shapes the animal
abundances and spectra profoundly. Together these two findings imply that we
need to spend more effort on investigating and developing suitable conditional
ensembles of random hypergraph that can capture real-world structures and their
complex dependency structures.
","[{""version"":""v1"",""created"":""Mon, 3 Apr 2023 09:37:27 GMT""}]","2023-04-04"
"2304.00842","Sen Guo","Guan-Ru Li, Guo-Ping Li, Sen Guo","Phase transition grade and microstructure of AdS black holes in massive
  gravity","17 pages, 3 figures","Class.Quant.Grav. 39 (2022) 19, 195011","10.1088/1361-6382/ac8c7c",,"gr-qc","http://arxiv.org/licenses/nonexclusive-distrib/1.0/","  Considering that under the framework of the massive gravity theory, the
interaction between the mass gravitons and Schwarzschild black hole (BH) could
make it carry a scalar charge, the phase transition process caused by this
scalar charge is investigated in this analysis. The phase transition grade and
microstructure of those BHs are investigated from both macroscopic and
microscopic points of view. From the macroscopic point of view, it is found
that Ehrenfest equations are satisfied at the phase transition critical point,
which implies that the phase transition grade of those BHs is second-order.
Based on the BH molecules model and Landau continuous phase transition theory,
the phase transition of those BHs from the microcosmic point of view is
analyzed. The critical exponents obtained from the two perspectives are
consistent. By investigating the Ruppeiner geometry, the microstructure feature
of those BHs is revealed. These results suggest that the phase transition of BH
in massive gravity is a standard second-order phase transition at the critical
point, and the microscopic details of those BHs are different from the RN-AdS
BH in standard Einstein gravity.
","[{""version"":""v1"",""created"":""Mon, 3 Apr 2023 09:37:45 GMT""}]","2023-04-04"
"2304.00843","Xiang Zhang","Xiang Zhang, Boyang Wang, Yaomin Lu, Haiou Liu, Jianwei Gong, and
  Huiyan Chen","A Hierarchical Multi-Vehicle Coordinated Motion Planning Method based on
  Interactive Spatio-Temporal Corridors",,,,,"cs.RO","http://arxiv.org/licenses/nonexclusive-distrib/1.0/","  Multi-vehicle coordinated motion planning has always been challenged to
safely and efficiently resolve conflicts under non-holonomic dynamic
constraints. Constructing spatial-temporal corridors for multi-vehicle can
decouple the high-dimensional conflicts and further reduce the difficulty of
obtaining feasible trajectories. Therefore, this paper proposes a novel
hierarchical method based on interactive spatio-temporal corridors (ISTCs). In
the first layer, based on the initial guidance trajectories, Mixed Integer
Quadratic Programming is designed to construct ISTCs capable of resolving
conflicts in generic multi-vehicle scenarios. And then in the second layer,
Non-Linear Programming is settled to generate in-corridor trajectories that
satisfy the vehicle dynamics. By introducing ISTCs, the multi-vehicle
coordinated motion planning problem is able to be decoupled into single-vehicle
trajectory optimization problems, which greatly decentralizes the computational
pressure and has great potential for real-world applications. Besides, the
proposed method searches for feasible solutions in the 3-D $(x,y,t)$
configuration space, preserving more possibilities than the traditional
velocity-path decoupling method. Simulated experiments in unsignalized
intersection and challenging dense scenarios have been conduced to verify the
feasibility and adaptability of the proposed framework.
","[{""version"":""v1"",""created"":""Mon, 3 Apr 2023 09:42:02 GMT""}]","2023-04-04"
