"2304.04467","Saharon Shelah","Saharon Shelah","Stable frames and weights",,,,"E108","math.LO","http://creativecommons.org/licenses/by/4.0/","  Was paper 839 in the author's list until winter 2023 when it was divided into
three.
  Part I: We would like to generalize imaginary elements, weight of
ortp$(a,M,N), {\mathbf P}$-weight, ${\mathbf P}$-simple types, etc. from
[She90, Ch. III,V,\S4] to the context of good frames. This requires allowing
the vocabulary to have predicates and function symbols of infinite arity, but
it seemed that we do not suffer any real loss.
  Part II: Good frames were suggested in [She09d] as the (bare bones) right
parallel among a.e.c. to superstable (among elementary classes). Here we
consider $(\mu, \lambda, \kappa)$-frames as candidates for being the right
parallel to the class of $|T|^+$-saturated models of a stable theory (among
elementary classes). A loss as compared to the superstable case is that going
up by induction on cardinals is problematic (for cardinals of small
cofinality). But this arises only when we try to lift. For this context we
investigate the dimension.
  Part III: In the context of Part II, we consider the main gap problem for the
parallel of somewhat saturated model; showing we are not worse than in the
first order case.
","[{""version"":""v1"",""created"":""Mon, 10 Apr 2023 09:11:26 GMT""}]","2023-04-11"
"2304.04468","Changshuo Liu","Changshuo Liu, Wenqiao Zhang, Beng Chin Ooi, James Wei Luen Yip,
  Lingze Zeng, Kaiping Zheng","Toward Cohort Intelligence: A Universal Cohort Representation Learning
  Framework for Electronic Health Record Analysis","10 pages",,,,"cs.LG cs.AI","http://arxiv.org/licenses/nonexclusive-distrib/1.0/","  Electronic Health Records (EHR) are generated from clinical routine care
recording valuable information of broad patient populations, which provide
plentiful opportunities for improving patient management and intervention
strategies in clinical practice. To exploit the enormous potential of EHR data,
a popular EHR data analysis paradigm in machine learning is EHR representation
learning, which first leverages the individual patient's EHR data to learn
informative representations by a backbone, and supports diverse health-care
downstream tasks grounded on the representations. Unfortunately, such a
paradigm fails to access the in-depth analysis of patients' relevance, which is
generally known as cohort studies in clinical practice. Specifically, patients
in the same cohort tend to share similar characteristics, implying their
resemblance in medical conditions such as symptoms or diseases. In this paper,
we propose a universal COhort Representation lEarning (CORE) framework to
augment EHR utilization by leveraging the fine-grained cohort information among
patients. In particular, CORE first develops an explicit patient modeling task
based on the prior knowledge of patients' diagnosis codes, which measures the
latent relevance among patients to adaptively divide the cohorts for each
patient. Based on the constructed cohorts, CORE recodes the pre-extracted EHR
data representation from intra- and inter-cohort perspectives, yielding
augmented EHR data representation learning. CORE is readily applicable to
diverse backbone models, serving as a universal plug-in framework to infuse
cohort information into healthcare methods for boosted performance. We conduct
an extensive experimental evaluation on two real-world datasets, and the
experimental results demonstrate the effectiveness and generalizability of
CORE.
","[{""version"":""v1"",""created"":""Mon, 10 Apr 2023 09:12:37 GMT""},{""version"":""v2"",""created"":""Tue, 11 Apr 2023 15:15:05 GMT""},{""version"":""v3"",""created"":""Wed, 12 Apr 2023 07:12:42 GMT""}]","2023-04-13"
"2304.04469","Andrew Mansour","V. V. Flambaum and A. J. Mansour","Variation of the quadrupole hyperfine structure and nuclear radius due
  to an interaction with scalar and axion dark matter","v2: References added",,,,"hep-ph astro-ph.CO nucl-th physics.atom-ph","http://creativecommons.org/licenses/by/4.0/","  Atomic spectroscopy is used to search for the space-time variation of
fundamental constants which may be due to an interaction with scalar and
pseudo-scalar (axion) dark matter. In this letter, we study the effects which
are produced by the variation of the nuclear radius and electric quadrupole
moment. The sensitivity of the electric quadrupole hyperfine structure to both
the variation of the quark mass and the effects of dark matter exceeds that of
the magnetic hyperfine structure by 1-2 orders of magnitude. Therefore, the
measurement of the variation of the ratio of the electric quadrupole and
magnetic dipole hyperfine constants is proposed. The sensitivity of the optical
clock transitions in the Yb$^+$ ion to the variation of the nuclear radius
allows us to extract, from experimental data, limits on the variation of the
hadron and quark masses, the QCD parameter $\theta$ and the interaction with
axion and scalar dark matter.
","[{""version"":""v1"",""created"":""Mon, 10 Apr 2023 09:14:30 GMT""},{""version"":""v2"",""created"":""Wed, 12 Apr 2023 05:14:20 GMT""}]","2023-04-13"
"2304.04470","Nallappabhavithran G","NallappaBhavithran G and Selvakumar R","Kernel Code for DNA Digital Data Storage","12 pages, 1 figure",,,,"cs.IT math.IT","http://creativecommons.org/licenses/by/4.0/","  The biggest challenge when using DNA as a storage medium is maintaining its
stability. The relative occurrence of Guanine (G) and Cytosine (C) is essential
for the longevity of DNA. In addition to that, reverse complementary base pairs
should not be present in the code. These challenges are overcome by a proper
choice of group homomorphisms. Algorithms for storage and retrieval of
information in DNA stings are written by using kernel code. Complexities of
these algorithms are less compared to the existing algorithms. Construction
procedures followed in this paper are capable of constructing codes of required
sizes and Reverse complement distance.
","[{""version"":""v1"",""created"":""Mon, 10 Apr 2023 09:16:02 GMT""}]","2023-04-11"
"2304.04471","Zhanyu Ma","Zhanyu Ma, Cheolhee Han, Yigal Meir and Eran Sela","Identifying dissipative phase transitions from entropy and conductance",,,,,"cond-mat.mes-hall cond-mat.str-el","http://arxiv.org/licenses/nonexclusive-distrib/1.0/","  Dissipative phase transitions (DPT) occur when a small quantum system
interacts with a bath of harmonic oscillators. At equilibrium, DPTs are
accompanied by an entropy change, signaling the loss of coherence. Despite
extensive efforts, equilibrium DPTs have yet to be observed. Here, we
demonstrate that ongoing experiments on double quantum dots that measure
entropy using a nearby quantum point contact (QPC) realize the celebrated
spin-boson model and allow to measure the entropy change of its DPT. We find a
Kosterlitz-Thouless flow diagram, leading to a universal jump in the spin-bath
interaction, reflected in a discontinuity in the zero temperature QPC
conductance.
","[{""version"":""v1"",""created"":""Mon, 10 Apr 2023 09:19:02 GMT""}]","2023-04-11"
"2304.04472","Daniel Ortega","Daniel Ortega, Sarina Meyer, Antje Schweitzer and Ngoc Thang Vu","Modeling Speaker-Listener Interaction for Backchannel Prediction","Published in IWSDS 2023",,,,"cs.CL","http://creativecommons.org/licenses/by-nc-nd/4.0/","  We present our latest findings on backchannel modeling novelly motivated by
the canonical use of the minimal responses Yeah and Uh-huh in English and their
correspondent tokens in German, and the effect of encoding the speaker-listener
interaction. Backchanneling theories emphasize the active and continuous role
of the listener in the course of the conversation, their effects on the
speaker's subsequent talk, and the consequent dynamic speaker-listener
interaction. Therefore, we propose a neural-based acoustic backchannel
classifier on minimal responses by processing acoustic features from the
speaker speech, capturing and imitating listeners' backchanneling behavior, and
encoding speaker-listener interaction. Our experimental results on the
Switchboard and GECO datasets reveal that in almost all tested scenarios the
speaker or listener behavior embeddings help the model make more accurate
backchannel predictions. More importantly, a proper interaction encoding
strategy, i.e., combining the speaker and listener embeddings, leads to the
best performance on both datasets in terms of F1-score.
","[{""version"":""v1"",""created"":""Mon, 10 Apr 2023 09:22:06 GMT""}]","2023-04-11"
"2304.04473","Daniel Graf","Daniel Graf and Alex J. W. Thom","A simple and efficient route towards improved energetics within the
  framework of density-corrected density functional theory",,,,,"physics.chem-ph","http://creativecommons.org/licenses/by/4.0/","  The crucial step in density-corrected Hartree-Fock density functional theory
(DC(HF)-DFT) is to decide whether the density produced by the density
functional for a specific calculation is erroneous and hence should be replaced
by, in this case, the HF density. We introduce an indicator, based on the
difference in non-interacting kinetic energies between DFT and HF calculations,
to determine when the HF density is the better option. Our kinetic energy
indicator directly compares the self-consistent density of the analysed
functional with the HF density, is size-intensive, reliable, and most
importantly highly efficient. Moreover, we present a procedure that makes best
use of the computed quantities necessary for DC(HF)-DFT by additionally
evaluating a related hybrid functional and, in that way, not only ""corrects""
the density but also the functional itself; we call that procedure corrected
Hartree-Fock density functional theory (C(HF)-DFT).
","[{""version"":""v1"",""created"":""Mon, 10 Apr 2023 09:22:28 GMT""}]","2023-04-11"
"2304.04474","Guanlve Li","Weiqi Zhang, Guanlve Li, Jianheng Tang, Jia Li and Fugee Tsung","Missing Data Imputation with Graph Laplacian Pyramid Network","12 pages, 5 figures",,,,"cs.LG","http://arxiv.org/licenses/nonexclusive-distrib/1.0/","  Data imputation is a prevalent and important task due to the ubiquitousness
of missing data. Many efforts try to first draft a completed data and second
refine to derive the imputation results, or ""draft-then-refine"" for short. In
this work, we analyze this widespread practice from the perspective of
Dirichlet energy. We find that a rudimentary ""draft"" imputation will decrease
the Dirichlet energy, thus an energy-maintenance ""refine"" step is in need to
recover the overall energy. Since existing ""refine"" methods such as Graph
Convolutional Network (GCN) tend to cause further energy decline, in this work,
we propose a novel framework called Graph Laplacian Pyramid Network (GLPN) to
preserve Dirichlet energy and improve imputation performance. GLPN consists of
a U-shaped autoencoder and residual networks to capture global and local
detailed information respectively. By extensive experiments on several
real-world datasets, GLPN shows superior performance over state-of-the-art
methods under three different missing mechanisms. Our source code is available
at https://github.com/liguanlue/GLPN.
","[{""version"":""v1"",""created"":""Mon, 10 Apr 2023 09:23:34 GMT""}]","2023-04-11"
"2304.04475","Janani Venugopalan","Gaurav Deshkar, Jayanta Kshirsagar, Harshal Hayatnagarkar, and Janani
  Venugopalan","Epidemic Control on a Large-Scale-Agent-Based Epidemiology Model using
  Deep Deterministic Policy Gradient",,,,,"cs.LG cs.SY eess.SY","http://creativecommons.org/licenses/by/4.0/","  To mitigate the impact of the pandemic, several measures include lockdowns,
rapid vaccination programs, school closures, and economic stimulus. These
interventions can have positive or unintended negative consequences. Current
research to model and determine an optimal intervention automatically through
round-tripping is limited by the simulation objectives, scale (a few thousand
individuals), model types that are not suited for intervention studies, and the
number of intervention strategies they can explore (discrete vs continuous). We
address these challenges using a Deep Deterministic Policy Gradient (DDPG)
based policy optimization framework on a large-scale (100,000 individual)
epidemiological agent-based simulation where we perform multi-objective
optimization. We determine the optimal policy for lockdown and vaccination in a
minimalist age-stratified multi-vaccine scenario with a basic simulation for
economic activity. With no lockdown and vaccination (mid-age and elderly),
results show optimal economy (individuals below the poverty line) with balanced
health objectives (infection, and hospitalization). An in-depth simulation is
needed to further validate our results and open-source our framework.
","[{""version"":""v1"",""created"":""Mon, 10 Apr 2023 09:26:07 GMT""}]","2023-04-11"
"2304.04476","Aymen Khaleel","Aymen Khaleel, Ertugrul Basar","Electromagnetic Interference Cancellation for RIS-Assisted
  Communications","To appear in IEEE Communications Letters, \c{opyright}2023 IEEE",,"10.1109/LCOMM.2023.3280131",,"eess.SP cs.IT math.IT","http://arxiv.org/licenses/nonexclusive-distrib/1.0/","  Reconfigurable intelligent surface (RIS)-empowered communication is an
emerging technology that has recently received growing attention as a potential
candidate for next-generation wireless communications. Although RISs have shown
the potential of manipulating the wireless channel through passive beamforming,
it is shown that they can also bring undesired side effects, such as reflecting
the electromagnetic interference (EMI) from the surrounding environment to the
receiver side. In this study, we propose a novel EMI cancellation scheme to
mitigate the impact of the EMI by exploiting its special time-domain structure
and considering a clever passive beamforming method at the RIS. Compared to its
benchmark, computer simulations show that the proposed scheme achieves superior
performance in terms of the average signal-to-interference-plus-noise ratio
(SINR) and outage probability (OP), especially when the EMI power is comparable
to the power of the information signal impinging on the RIS surface.
","[{""version"":""v1"",""created"":""Mon, 10 Apr 2023 09:30:53 GMT""},{""version"":""v2"",""created"":""Thu, 1 Jun 2023 09:00:06 GMT""}]","2023-06-02"
"2304.04477","Jesus Maldonado","J. Maldonado, A. Petralia, G. Mantovan, M. Rainer, A. F. Lanza, C. Di
  Maio, S. Colombo, D. Nardiello, S. Benatti, L. Borsato, I. Carleo, S.
  Desidera, G. Micela, V. Nascimbeni, L. Malavolta, M. Damasso, A. Sozzetti, L.
  Affer, K. Biazzo, A. Bignamini, A. S. Bonomo, F. Borsa, M. B. Lund, L.
  Mancini, E. Molinari, and M. Molinaro","The GAPS programme at TNG XLIII. A massive brown dwarf orbiting the
  active M dwarf TOI-5375","Accepted for publication in Astronomy & Astrophysics",,,,"astro-ph.SR astro-ph.EP","http://arxiv.org/licenses/nonexclusive-distrib/1.0/","  Context. Massive substellar companions orbiting active low-mass stars are
rare. They, however, offer an excellent opportunity to study the main
mechanisms involved in the formation and evolution of substellar objects. Aims.
We aim to unravel the physical nature of the transit signal observed by the
TESS space mission on the active M dwarf TOI-5375. Methods. We analysed the
available TESS photometric data as well as high-resolution (R $\sim$ 115000)
HARPS-N spectra. We combined these data to characterise the star TOI-5375 and
to disentangle signals related to stellar activity from the companion transit
signal in the light-curve data. We ran an MCMC analysis to derive the orbital
solution and apply state-of-the-art Gaussian process regression to deal with
the stellar activity signal. Results. We reveal the presence of a companion in
the brown dwarf / very-low-mass star boundary orbiting around the star
TOI-5375. The best-fit model corresponds to a companion with an orbital period
of 1.721564 $\pm$ 10$^{\rm -6}$ d, a mass of 77 $\pm$ 8 $M_{\rm J}$ and a
radius of 0.99 $\pm$ 0.16 $R_{\rm J}$. Conclusions. We derive a rotation period
for the host star of 1.9692 $\pm$ 0.0004 d, and we conclude that the star is
very close to synchronising its rotation with the orbital period of the
companion.
","[{""version"":""v1"",""created"":""Mon, 10 Apr 2023 09:33:02 GMT""},{""version"":""v2"",""created"":""Thu, 27 Apr 2023 09:42:09 GMT""}]","2023-04-28"
"2304.04478","Daniel Ortega","Daniel Ortega, Chia-Yu Li, Ngoc Thang Vu","Oh, Jeez! or Uh-huh? A Listener-aware Backchannel Predictor on ASR
  Transcriptions","Published in ICASSP 2020",,,,"cs.CL cs.SD eess.AS","http://creativecommons.org/licenses/by-nc-sa/4.0/","  This paper presents our latest investigation on modeling backchannel in
conversations. Motivated by a proactive backchanneling theory, we aim at
developing a system which acts as a proactive listener by inserting
backchannels, such as continuers and assessment, to influence speakers. Our
model takes into account not only lexical and acoustic cues, but also
introduces the simple and novel idea of using listener embeddings to mimic
different backchanneling behaviours. Our experimental results on the
Switchboard benchmark dataset reveal that acoustic cues are more important than
lexical cues in this task and their combination with listener embeddings works
best on both, manual transcriptions and automatically generated transcriptions.
","[{""version"":""v1"",""created"":""Mon, 10 Apr 2023 09:33:29 GMT""}]","2023-04-11"
"2304.04479","Yu-Xiao Liu","Chun-Chun Zhu, Qin Tan, Yu-Peng Zhang, Yu-Xiao Liu","Evolution of Fermion Resonance in Thick Brane","26 pages, 12 figures",,,,"hep-th","http://arxiv.org/licenses/nonexclusive-distrib/1.0/","  In this work, we investigate numerical evolution of massive Kaluza-Klein (KK)
modes of a Dirac field on a thick brane. We deduce the Dirac equation in
five-dimensional spacetime, and obtain the time-dependent evolution equation
and Schr\""odinger-like equation of the extra-dimensional component. We use the
Dirac KK resonances as the initial data and study the corresponding dynamics.
By monitoring the decay law of the left- and right-chiral KK resonances, we
compute the corresponding lifetimes and find that there could exist long-lived
KK modes on the brane. Especially, for the lightest KK resonance with a large
coupling parameter and a large three momentum, it will have an extremely long
lifetime.
","[{""version"":""v1"",""created"":""Mon, 10 Apr 2023 09:34:35 GMT""}]","2023-04-11"
"2304.04480","Yannis Stamatiou","V. Liagkou and P.E. Nastou and P. Spirakis and Y.C. Stamatiou","On the existence of highly organized communities in networks of locally
  interacting agents",,,,,"cs.CR cs.DM","http://creativecommons.org/licenses/by/4.0/","  In this paper we investigate phenomena of spontaneous emergence or purposeful
formation of highly organized structures in networks of related agents. We show
that the formation of large organized structures requires exponentially large,
in the size of the structures, networks. Our approach is based on Kolmogorov,
or descriptional, complexity of networks viewed as finite size strings. We
apply this approach to the study of the emergence or formation of simple
organized, hierarchical, structures based on Sierpinski Graphs and we prove a
Ramsey type theorem that bounds the number of vertices in Kolmogorov random
graphs that contain Sierpinski Graphs as subgraphs. Moreover, we show that
Sierpinski Graphs encompass close-knit relationships among their vertices that
facilitate fast spread and learning of information when agents in their
vertices are engaged in pairwise interactions modelled as two person games.
Finally, we generalize our findings for any organized structure with succinct
representations. Our work can be deployed, in particular, to study problems
related to the security of networks by identifying conditions which enable or
forbid the formation of sufficiently large insider subnetworks with malicious
common goal to overtake the network or cause disruption of its operation.
","[{""version"":""v1"",""created"":""Mon, 10 Apr 2023 09:39:41 GMT""}]","2023-04-11"
"2304.04481","Sergio Cecotti","Sergio Cecotti","Hwang-Oguiso invariants and frozen singularities in Special Geometry","54 pages",,,,"hep-th math-ph math.MP","http://creativecommons.org/licenses/by/4.0/","  In Special Geometry there are two inequivalent notions of ""Kodaira type"" for
a singular fiber: one associated with its local monodromy and one with its
Hwang-Oguiso characteristic cycle. When the two Kodaira types are not equal the
geometry is subtler and its deformation space gets smaller (""partially frozen""
singularities). The paper analyzes the physical interpretation of the
Hwang-Oguiso invariant in the context of 4d N=2 QFT and describes the
surprising phenomena which appear when it does not coincide with the monodromy
type. The Hwang-Oguiso multiple fibers are in one-to-one correspondence with
the partially frozen singularities in M-theory compactified on a local elliptic
K3: a chain of string dualities relates the two geometric set-ups. Paying
attention to a few subtleties, this correspondence explains in purely geometric
terms how the ""same"" Kodaira elliptic fiber may have different deformations
spaces. The geometric computation of the number of deformations agrees with the
physical expectations. At the end we briefly outline the implications of the
Hwang-Oguiso invariants for the classification program of 4d N=2 SCFTs.
","[{""version"":""v1"",""created"":""Mon, 10 Apr 2023 09:40:10 GMT""}]","2023-04-11"
"2304.04482","Dina Prialnik Dr.","Adam Parhi and Dina Prialnik","Sublimation of ices during the early evolution of Kuiper belt objects","8 pages, 7 figures",,"10.1093/mnras/stad1086",,"astro-ph.EP","http://arxiv.org/licenses/nonexclusive-distrib/1.0/","  Kuiper belt objects, such as Arrokoth, the probable progenitors of
short-period comets, formed and evolved at large heliocentric distances, where
the ambient temperatures appear to be sufficiently low for preserving volatile
ices. By detailed numerical simulations, we follow the long-term evolution of
small bodies, composed of amorphous water ice, dust, and ices of other volatile
species that are commonly observed in comets. The heat sources are solar
radiation and the decay of short-lived radionuclides. The bodies are highly
porous and gases released in the interior flow through the porous medium. The
most volatile ices, CO and CH$_4$ , are found to be depleted down to the center
over a time scale on the order of 100 Myr. Sublimation fronts advance from the
surface inward, and when the temperature in the inner part rises sufficiently,
bulk sublimation throughout the interior reduces gradually the volatile ices
content until they are completely lost. All the other ices survive, which is
compatible with data collected by New Horizons on Arrokoth, showing the
presence of methanol, and possibly, H$_2$O, CO$_2$, NH$_3$ and C$_2$H$_6$, but
no hypervolatiles. The effect of short-lived radionuclides is to increase the
sublimation equilibrium temperatures and reduce volatile depletion times. We
consider the effect of the bulk density, abundance ratios and heliocentric
distance. At 100~au, CO is depleted, but CH$_4$ survives to present time,
except for a thin outer layer. Since CO is abundantly detected in comets, we
conclude that the source of highly volatile species in active comets must be
gas trapped in amorphous ice.
","[{""version"":""v1"",""created"":""Mon, 10 Apr 2023 09:42:40 GMT""}]","2023-04-19"
"2304.04483","Qiang Li","Ruobing Jiang, Tianyi Yang, Sitian Qian, Yong Ban, Jingshu Li,
  Zhengyun You, Qiang Li","Searching for Majorana Neutrinos at a Same-Sign Muon Collider","15 pages, 8 figures",,,,"hep-ph hep-ex","http://creativecommons.org/licenses/by/4.0/","  Majorana properties of neutrinos have long been a focus in the pursuit of
possible new physics beyond the standard model, which has motivated lots of
dedicated theoretical and experimental studies. A future same-sign muon
collider is an ideal platform to search for Majorana neutrinos through the
Lepton Number Violation process. Specifically, this t-channel kind of process
is less kinematically suppressed and has a good advantage in probing Majorana
neutrinos at high mass regions up to 10 TeV. In this paper, we perform a
detailed fast Monte Carlo simulation study through examining three different
final states: 1) pure-leptonic state with electrons or muons, 2) semi-leptonic
state, and 3) pure-hadronic state in the resolved or merged categories.
Furthermore, we perform a full simulation study on the pure-leptonic final
state to validate our fast simulation results.
","[{""version"":""v1"",""created"":""Mon, 10 Apr 2023 09:44:26 GMT""}]","2023-04-11"
