"2304.04364","Xiangwen Deng","Xiangwen Deng, Yufeng Wang, Yuanhao Cai, Jingxiang Sun, Yebin Liu, and
  Haoqian Wang","ITportrait: Image-Text Coupled 3D Portrait Domain Adaptation",,,,,"cs.MM","http://arxiv.org/licenses/nonexclusive-distrib/1.0/","  Domain adaptation of 3D portraits has gained more and more attention.
However, the transfer mechanism of existing methods is mainly based on vision
or language, which ignores the potential of vision-language combined guidance.
In this paper, we propose an Image-Text multi-modal framework, namely Image and
Text portrait (ITportrait), for 3D portrait domain adaptation. ITportrait
relies on a two-stage alternating training strategy. In the first stage, we
employ a 3D Artistic Paired Transfer (APT) method for image-guided style
transfer. APT constructs paired photo-realistic portraits to obtain accurate
artistic poses, which helps ITportrait to achieve high-quality 3D style
transfer. In the second stage, we propose a 3D Image-Text Embedding (ITE)
approach in the CLIP space. ITE uses a threshold function to self-adaptively
control the optimization direction of images or texts in the CLIP space.
Comprehensive experiments prove that our ITportrait achieves state-of-the-art
(SOTA) results and benefits downstream tasks. All source codes and pre-trained
models will be released to the public.
","[{""version"":""v1"",""created"":""Mon, 10 Apr 2023 03:20:05 GMT""},{""version"":""v2"",""created"":""Fri, 28 Apr 2023 09:02:59 GMT""},{""version"":""v3"",""created"":""Tue, 2 May 2023 13:40:10 GMT""},{""version"":""v4"",""created"":""Mon, 15 May 2023 06:56:19 GMT""}]","2023-05-16"
"2304.04365","Todor Milanov E","Todor Milanov and Xiaokun Xia","Reflection vectors and quantum cohomology of blowups","51 pages",,,,"math.AG","http://creativecommons.org/licenses/by/4.0/","  Let $X$ be a smooth projective variety with a semi-simple quantum cohomology.
It is known that the blow up $Bl(X)$ of $X$ at one point also has semi-simple
quantum cohomology. In particular, the monodromy group of the quantum
cohomology of $Bl(X)$ is a reflection group. We found explicit formulas for
certain generators of the monodromy group of the quantum cohomology of $Bl(X)$
depending only on the geometry of the exceptional divisor.
","[{""version"":""v1"",""created"":""Mon, 10 Apr 2023 03:26:03 GMT""}]","2023-04-11"
"2304.04366","Kang Zhao","Kang Zhao, Jianru Xue, Xiangning Meng, Gengxin Li, and Mengsen Wu","Learning Residual Model of Model Predictive Control via Random Forests
  for Autonomous Driving","8 pages, 8 figures",,,,"cs.RO cs.LG cs.SY eess.SY","http://arxiv.org/licenses/nonexclusive-distrib/1.0/","  One major issue in learning-based model predictive control (MPC) for
autonomous driving is the contradiction between the system model's prediction
accuracy and computation efficiency. The more situations a system model covers,
the more complex it is, along with highly nonlinear and nonconvex properties.
These issues make the optimization too complicated to solve and render
real-time control impractical.To address these issues, we propose a
hierarchical learning residual model which leverages random forests and linear
regression.The learned model consists of two levels. The low level uses linear
regression to fit the residues, and the high level uses random forests to
switch different linear models. Meanwhile, we adopt the linear dynamic bicycle
model with error states as the nominal model.The switched linear regression
model is added to the nominal model to form the system model. It reformulates
the learning-based MPC as a quadratic program (QP) problem and optimization
solvers can effectively solve it. Experimental path tracking results show that
the driving vehicle's prediction accuracy and tracking accuracy are
significantly improved compared with the nominal MPC.Compared with the
state-of-the-art Gaussian process-based nonlinear model predictive control
(GP-NMPC), our method gets better performance on tracking accuracy while
maintaining a lower computation consumption.
","[{""version"":""v1"",""created"":""Mon, 10 Apr 2023 03:32:09 GMT""}]","2023-04-11"
"2304.04367","Qian Zhao","Qian Zhao, Yan-Xi Wu, Mamutjan Ababekri, Zhong-Peng Li, Liang Tang,
  Jian-Xing Li","Angle-dependent pair production in the polarized two-photon
  Breit-Wheeler process",,,"10.1103/PhysRevD.107.096013",,"hep-ph","http://creativecommons.org/licenses/by/4.0/","  The advent of laser-driven high-intensity $\gamma$-photon beams has opened up
new opportunities for designing advanced photon-photon colliders. Such
colliders have the potential to produce a large yield of linear Breit-Wheeler
(LBW) pairs in a single shot, which offers a unique platform for studying the
polarized LBW process. In our recent work [Phys. Rev. D 105, L071902(2022)], we
investigated the polarization characteristics of LBW pair production in CP
$\gamma$-photon collisions. To fully clarify the polarization effects involving
both CP and LP $\gamma$-photons, here we further investigate the LBW process
using the polarized cross section with explicit azimuthal-angle dependence due
to the base rotation of photon polarization vectors. We accomplished this by
defining a new spin basis for positrons and electrons, which enables us to
decouple the transverse and longitudinal spin components of $e^\pm$. By means
of analytical calculations and Monte Carlo simulations, we find that the linear
polarization of photon can induce the highly angle-dependent pair yield and
polarization distributions. The comprehensive knowledge of the polarized LBW
process will also open up avenues for investigating the higher-order
photon-photon scattering, the laser-driven quantum electrodynamic plasmas and
the high-energy astrophysics.
","[{""version"":""v1"",""created"":""Mon, 10 Apr 2023 03:38:12 GMT""}]","2023-05-31"
"2304.04368","Wenyun Li","Wenyun Li, Guo Zhong, Xingyu Lu, Chi-Man Pun","Locality Preserving Multiview Graph Hashing for Large Scale Remote
  Sensing Image Search","5 pages,icassp accepted",,,,"cs.CV","http://creativecommons.org/licenses/by-sa/4.0/","  Hashing is very popular for remote sensing image search. This article
proposes a multiview hashing with learnable parameters to retrieve the queried
images for a large-scale remote sensing dataset. Existing methods always
neglect that real-world remote sensing data lies on a low-dimensional manifold
embedded in high-dimensional ambient space. Unlike previous methods, this
article proposes to learn the consensus compact codes in a view-specific
low-dimensional subspace. Furthermore, we have added a hyperparameter learnable
module to avoid complex parameter tuning. In order to prove the effectiveness
of our method, we carried out experiments on three widely used remote sensing
data sets and compared them with seven state-of-the-art methods. Extensive
experiments show that the proposed method can achieve competitive results
compared to the other method.
","[{""version"":""v1"",""created"":""Mon, 10 Apr 2023 03:39:30 GMT""}]","2023-04-11"
"2304.04369","Bing Gu","Bing Gu","Local diabatic representation of conical intersection quantum dynamics",,,,,"quant-ph physics.chem-ph","http://arxiv.org/licenses/nonexclusive-distrib/1.0/","  Conical intersections are ubiquitous in polyatomic molecules and responsible
for a wide range of phenomena in chemistry and physics. We introduce and
implement a local diabatic representation for the correlated electron-nuclear
dynamics around conical intersections. It employs the adiabatic electronic
states but avoids the singularity of nonadiabatic couplings, and is robust to
different gauge choices of the electronic wavefunction phases. Illustrated by a
two-dimensional conical intersection model, this representation captures
nonadiabatic transitions, electronic coherence, and geometric phase.
","[{""version"":""v1"",""created"":""Mon, 10 Apr 2023 03:46:18 GMT""}]","2023-04-11"
"2304.04370","Yongfeng Zhang","Yingqiang Ge, Wenyue Hua, Jianchao Ji, Juntao Tan, Shuyuan Xu,
  Yongfeng Zhang","OpenAGI: When LLM Meets Domain Experts","18 pages, 6 figures, 7 tables",,,,"cs.AI cs.CL cs.LG","http://arxiv.org/licenses/nonexclusive-distrib/1.0/","  Human intelligence has the remarkable ability to assemble basic skills into
complex ones so as to solve complex tasks. This ability is equally important
for Artificial Intelligence (AI), and thus, we assert that in addition to the
development of large, comprehensive intelligent models, it is equally crucial
to equip such models with the capability to harness various domain-specific
expert models for complex task-solving in the pursuit of Artificial General
Intelligence (AGI). Recent developments in Large Language Models (LLMs) have
demonstrated remarkable learning and reasoning abilities, making them promising
as a controller to select, synthesize, and execute external models to solve
complex tasks. In this project, we develop OpenAGI, an open-source AGI research
platform, specifically designed to offer complex, multi-step tasks and
accompanied by task-specific datasets, evaluation metrics, and a diverse range
of extensible models. OpenAGI formulates complex tasks as natural language
queries, serving as input to the LLM. The LLM subsequently selects,
synthesizes, and executes models provided by OpenAGI to address the task.
Furthermore, we propose a Reinforcement Learning from Task Feedback (RLTF)
mechanism, which uses the task-solving result as feedback to improve the LLM's
task-solving ability. Thus, the LLM is responsible for synthesizing various
external models for solving complex tasks, while RLTF provides feedback to
improve its task-solving ability, enabling a feedback loop for self-improving
AI. We believe that the paradigm of LLMs operating various expert models for
complex task-solving is a promising approach towards AGI. To facilitate the
community's long-term improvement and evaluation of AGI's ability, we
open-source the code, benchmark, and evaluation methods of the OpenAGI project
at https://github.com/agiresearch/OpenAGI.
","[{""version"":""v1"",""created"":""Mon, 10 Apr 2023 03:55:35 GMT""},{""version"":""v2"",""created"":""Wed, 12 Apr 2023 23:37:32 GMT""}]","2023-04-14"
"2304.04371","Zhen Chao","Zhen Chao, Weihua Geng, Robert Krasny","Integral equation method for the 1D steady-state Poisson-Nernst-Planck
  equations","15 pages, 7 figures",,,,"math.NA cs.NA","http://arxiv.org/licenses/nonexclusive-distrib/1.0/","  An integral equation method is presented for the 1D steady-state
Poisson-Nernst-Planck equations modeling ion transport through membrane
channels. The differential equations are recast as integral equations using
Green's 3rd identity yielding a fixed-point problem for the electric potential
gradient and ion concentrations. The integrals are discretized by a combination
of midpoint and trapezoid rules and the resulting algebraic equations are
solved by Gummel iteration. Numerical tests for electroneutral and
non-electroneutral systems demonstrate the method's 2nd order accuracy and
ability to resolve sharp boundary layers. The method is applied to a 1D model
of the K$^+$ ion channel with a fixed charge density that ensures cation
selectivity. In these tests, the proposed integral equation method yields
potential and concentration profiles in good agreement with published results.
","[{""version"":""v1"",""created"":""Mon, 10 Apr 2023 03:57:09 GMT""}]","2023-04-11"
"2304.04372","Tommaso Mariotti","Jir\^o Akahori, Nien-Lin Liu, Maria Elvira Mancino, Tommaso Mariotti,
  Yukie Yasuda","Symmetric positive semi-definite Fourier estimator of instantaneous
  variance-covariance matrix",,,,,"stat.ME q-fin.ST","http://arxiv.org/licenses/nonexclusive-distrib/1.0/","  In this paper we propose an estimator of spot covariance matrix which ensure
symmetric positive semi-definite estimations. The proposed estimator relies on
a suitable modification of the Fourier covariance estimator in Malliavin and
Mancino (2009) and it is consistent for suitable choices of the weighting
kernel. The accuracy and the ability of the estimator to produce positive
semi-definite covariance matrices is evaluated with an extensive numerical
study, in comparison with the competitors present in the literature. The
results of the simulation study are confirmed under many scenarios, that
consider the dimensionality of the problem, the asynchronicity of data and the
presence of several specification of market microstructure noise.
","[{""version"":""v1"",""created"":""Mon, 10 Apr 2023 04:06:10 GMT""}]","2023-04-11"
"2304.04373","Lucas Yong","Lyudmila Korobenko, Olly Milshstein, Lucas Yong","Weighted 1-dimensional Orlicz-Poincar\'e inequalities",,,,,"math.FA math.AP","http://creativecommons.org/licenses/by/4.0/","  In this paper we establish necessary and sufficient conditions for weighted
Orlicz-Poincar\'e inequalities in dimension one. Our theorems generalize the
main results of Chua and Wheeden, who established necessary and sufficient
conditions for weighted $(q,p)$ Poincar\'e inequalities. We give an example of
a weight satisfying sufficient conditions for a $(\Phi, p)$ Orlicz-Poincar\'e
inequality where the gauge norm with respect to $\Phi$ is a bump on the
Lebesgue $L^p$ norm. This weight, on the other hand, does not satisfy a $(q,p)$
Poincar\'e inequality for any $q > p$.
","[{""version"":""v1"",""created"":""Mon, 10 Apr 2023 04:14:59 GMT""}]","2023-04-11"
"2304.04374","AmirEmad Ghassami","AmirEmad Ghassami, Ilya Shpitser, Eric Tchetgen Tchetgen","Partial Identification of Causal Effects Using Proxy Variables",,,,,"stat.ME math.ST stat.ML stat.TH","http://creativecommons.org/licenses/by/4.0/","  Proximal causal inference is a recently proposed framework for evaluating the
causal effect of a treatment on an outcome variable in the presence of
unmeasured confounding (Miao et al., 2018; Tchetgen Tchetgen et al., 2020). For
nonparametric point identification of causal effects, the framework leverages a
pair of so-called treatment and outcome confounding proxy variables, in order
to identify a bridge function that matches the dependence of potential outcomes
or treatment variables on the hidden factors to corresponding functions of
observed proxies. Unique identification of a causal effect via a bridge
function crucially requires that proxies are sufficiently relevant for hidden
factors, a requirement that has previously been formalized as a completeness
condition. However, completeness is well-known not to be empirically testable,
and although a bridge function may be well-defined in a given setting, lack of
completeness, sometimes manifested by availability of a single type of proxy,
may severely limit prospects for identification of a bridge function and thus a
causal effect; therefore, potentially restricting the application of the
proximal causal framework. In this paper, we propose partial identification
methods that do not require completeness and obviate the need for
identification of a bridge function. That is, we establish that proxies of
unobserved confounders can be leveraged to obtain bounds on the causal effect
of the treatment on the outcome even if available information does not suffice
to identify either a bridge function or a corresponding causal effect of
interest. We further establish analogous partial identification results in
related settings where identification hinges upon hidden mediators for which
proxies are available, however such proxies are not sufficiently rich for point
identification of a bridge function or a corresponding causal effect of
interest.
","[{""version"":""v1"",""created"":""Mon, 10 Apr 2023 04:18:27 GMT""},{""version"":""v2"",""created"":""Sun, 23 Apr 2023 00:36:32 GMT""}]","2023-04-25"
"2304.04375","Takeshi Chiba","Takeshi Chiba and Shunichiro Kinoshita","Note on the Time Dilation for Charged Quantum Clocks","10 pages, 2 figures",,,,"gr-qc hep-th","http://creativecommons.org/licenses/by-sa/4.0/","  We derive the time dilation formula for charged quantum clocks in
electromagnetic fields. As a concrete example of non-inertial motion, we
consider a cyclotron motion in a uniform magnetic field. Applying the time
dilation formula to coherent state of the charged quantum clock, we evaluate
the time dilation quantum-mechanically.
","[{""version"":""v1"",""created"":""Mon, 10 Apr 2023 04:20:16 GMT""}]","2023-04-11"
"2304.04376","Weijia Wu","Weijia Wu, Yuzhong Zhao, Zhuang Li, Jiahong Li, Mike Zheng Shou,
  Umapada Pal, Dimosthenis Karatzas, Xiang Bai","ICDAR 2023 Video Text Reading Competition for Dense and Small Text",,"ICDAR 2023 competition",,,"cs.CV","http://creativecommons.org/licenses/by/4.0/","  Recently, video text detection, tracking, and recognition in natural scenes
are becoming very popular in the computer vision community. However, most
existing algorithms and benchmarks focus on common text cases (e.g., normal
size, density) and single scenarios, while ignoring extreme video text
challenges, i.e., dense and small text in various scenarios. In this
competition report, we establish a video text reading benchmark, DSText, which
focuses on dense and small text reading challenges in the video with various
scenarios. Compared with the previous datasets, the proposed dataset mainly
include three new challenges: 1) Dense video texts, a new challenge for video
text spotter. 2) High-proportioned small texts. 3) Various new scenarios, e.g.,
Game, sports, etc. The proposed DSText includes 100 video clips from 12 open
scenarios, supporting two tasks (i.e., video text tracking (Task 1) and
end-to-end video text spotting (Task 2)). During the competition period (opened
on 15th February 2023 and closed on 20th March 2023), a total of 24 teams
participated in the three proposed tasks with around 30 valid submissions,
respectively. In this article, we describe detailed statistical information of
the dataset, tasks, evaluation protocols and the results summaries of the ICDAR
2023 on DSText competition. Moreover, we hope the benchmark will promise video
text research in the community.
","[{""version"":""v1"",""created"":""Mon, 10 Apr 2023 04:20:34 GMT""}]","2023-04-11"
"2304.04377","Xiaoyang Zheng","Xiaoyang Zheng, Fuyu Lv, Zilong Wang, Qingwen Liu, Xiaoyi Zeng","Delving into E-Commerce Product Retrieval with Vision-Language
  Pre-training","5 pages, 4 figures, accepted to SIRIP 2023",,"10.1145/3539618.3591859",,"cs.IR","http://arxiv.org/licenses/nonexclusive-distrib/1.0/","  E-commerce search engines comprise a retrieval phase and a ranking phase,
where the first one returns a candidate product set given user queries.
Recently, vision-language pre-training, combining textual information with
visual clues, has been popular in the application of retrieval tasks. In this
paper, we propose a novel V+L pre-training method to solve the retrieval
problem in Taobao Search. We design a visual pre-training task based on
contrastive learning, outperforming common regression-based visual pre-training
tasks. In addition, we adopt two negative sampling schemes, tailored for the
large-scale retrieval task. Besides, we introduce the details of the online
deployment of our proposed method in real-world situations. Extensive
offline/online experiments demonstrate the superior performance of our method
on the retrieval task. Our proposed method is employed as one retrieval channel
of Taobao Search and serves hundreds of millions of users in real time.
","[{""version"":""v1"",""created"":""Mon, 10 Apr 2023 04:28:25 GMT""},{""version"":""v2"",""created"":""Mon, 17 Apr 2023 07:03:35 GMT""}]","2023-04-18"
"2304.04378","Jin Myeong Kim","Jinmyeong Kim, Boris I. Ivanov, \c{C}a\u{g}lar Kutlu, Seongtae Park,
  Arjan F. Van Loo, Yasunobu Nakamura, Sergey V. Uchaikin, Seonjeong Oh,
  Violeta Gkika, Andrei Matlashov, Woohyun Chung, Yannis K. Semertzidis","Josephson Parametric Amplifier in Axion Experiments","to be published in JPS Conference Proceedings (LT29)",,,,"cond-mat.supr-con hep-ph","http://creativecommons.org/licenses/by/4.0/","  The axion is a hypothetical particle, a promising candidate for dark matter,
and a solution to the strong CP problem. Axion haloscope search experiments
deal with a signal power comparable to noise uncertainty at millikelvin
temperature. We use a flux-driven Josephson parametric amplifier (JPA) with the
aim of approaching a noise level near the theoretically allowed limit of half
quanta. In our measurements to characterize the JPA we have found the added
noise to the system with a JPA as the first-stage amplifier to be lower than
110 mK at the frequencies from 0.938 GHz to 0.963 GHz.
","[{""version"":""v1"",""created"":""Mon, 10 Apr 2023 04:36:12 GMT""},{""version"":""v2"",""created"":""Thu, 20 Apr 2023 01:56:09 GMT""}]","2023-04-21"
"2304.04379","Chris Pinner","Humberto Bautista Serrano, Bishnu Paudel and Chris Pinner","The integer group determinants for the semidihedral group of order 16",,,,,"math.NT","http://arxiv.org/licenses/nonexclusive-distrib/1.0/","  We obtain a complete description of the integer group determinants for
SmallGroup(16,8), the semidihedral group of order 16.
  While this paper was in preparation, a complete descriptions for this group
was independently obtained by Yuka Yamaguchi and Naoya Yamaguchi in [21] (and
the other remaining group of order 16 in [20]). We offer our version here for
anyone interested in a slightly different approach.
","[{""version"":""v1"",""created"":""Mon, 10 Apr 2023 04:42:20 GMT""}]","2023-04-11"
"2304.04380","Jingyi Wang","J. Wang, I. Aravena, C. G. Petra","An adaptive sampling sequential quadratic programming method for
  nonsmooth stochastic optimization with upper-$\mathcal{C}^2$ objective","arXiv admin note: text overlap with arXiv:2204.09631",,,,"math.OC","http://creativecommons.org/licenses/by/4.0/","  We propose an optimization algorithm that incorporates adaptive sampling for
stochastic nonsmooth nonconvex optimization problems with upper-$\mathcal{C}^2$
objective functions. Upper-$\mathcal{C}^2$ is a weakly concave property that
exists naturally in many applications, particularly certain classes of
solutions to parametric optimization problems, e.g., recourse of stochastic
programming and projection into closed sets. Our algorithm is a stochastic
sequential quadratic programming (SQP) method extended to nonsmooth problems
with upper$\mathcal{C}^2$ objectives and is globally convergent in expectation
with bounded algorithmic parameters. The capabilities of our algorithm are
demonstrated by solving a joint production, pricing and shipment problem, as
well as a realistic optimal power flow problem as used in current power grid
industry practice.
","[{""version"":""v1"",""created"":""Mon, 10 Apr 2023 04:45:53 GMT""}]","2023-04-11"
"2304.04381","Md Ishtyaq Mahmud","Md Ishtyaq Mahmud, Ahmed Abdelgawad, Venkata P. Yanambaka","A Deep Analysis of Hybrid-Multikey-PUF","6,8th IEEE World Forum on Internet of Things (IEEE WFIoT2022)",,,,"cs.CR cs.NI","http://creativecommons.org/licenses/by/4.0/","  Unique key generation is essential for encryption purposes between Internet
of Things (IoT) devices. To produce a unique key for this encryption, Physical
Unclonable Functions (PUFs) might be employed. Also, the Random Number
Generator (RNG) is used in many different domains; nonetheless, security is one
of the most important areas that require the best RNG. In this article, We
investigate the quality of random numbers generated by Physical Unclonable
Functions (PUFs). We have analyzed three Figures of Merit (FoMs), Uniqueness,
Randomness, and Reliability of PUFs implemented on different FPGAs. In our
experiments, we have operated the test devices at different temperatures
(20{\deg}F, 40{\deg}F, 60{\deg}F, 80{\deg}F, 120{\deg}F, 140{\deg}F). In the
PUF that we have analyzed, the key is generated in 1 second on average. We also
have analyzed and described the essential properties of random number generator
that is most vital considering things to secure our Internet of Things(IoT)
devices.
","[{""version"":""v1"",""created"":""Mon, 10 Apr 2023 04:47:15 GMT""}]","2023-04-11"
"2304.04382","Yuto Kawase","Yuto Kawase","Birkhoff's variety theorem for relative algebraic theories","34 pages",,,,"math.CT","http://arxiv.org/licenses/nonexclusive-distrib/1.0/","  An algebraic theory, sometimes called an equational theory, is a theory
defined by finitary operations and equations, such as the theories of groups
and of rings. It is well known that algebraic theories are equivalent to
finitary monads on $\mathbf{Set}$. In this paper, we generalize this phenomenon
to locally finitely presentable categories using partial Horn logic. For each
locally finitely presentable category $\mathscr{A}$, we define an ""algebraic
concept"" relative to $\mathscr{A}$, which will be called an
$\mathscr{A}$-relative algebraic theory, and show that $\mathscr{A}$-relative
algebraic theories are equivalent to finitary monads on $\mathscr{A}$. Finally,
we generalize Birkhoff's variety theorem for classical algebraic theories to
our relative algebraic theories.
","[{""version"":""v1"",""created"":""Mon, 10 Apr 2023 04:48:33 GMT""}]","2023-04-11"
