"2304.04599","Lorenzo Maria Stanca","Lorenzo Maria Stanca","Recursive Preferences, Correlation Aversion, and the Temporal Resolution
  of Uncertainty",,,,,"econ.TH","http://creativecommons.org/licenses/by/4.0/","  Models of recursive utility are of central importance in many economic
applications. This paper investigates a new behavioral feature exhibited by
these models: aversion to risks that exhibit persistence (positive
autocorrelation) through time, referred to as correlation aversion. I introduce
a formal notion of such a property and provide a characterization based on risk
attitudes, and show that correlation averse preferences admit a specific
variational representation. I discuss how these findings imply that attitudes
toward correlation are a crucial behavioral aspect driving the applications of
recursive utility in fields such as asset pricing, climate policy, and optimal
fiscal policy.
","[{""version"":""v1"",""created"":""Mon, 10 Apr 2023 14:13:44 GMT""}]","2023-04-11"
"2304.04600","Yilong Yang","Yilong Yang, Srinandan Dasmahapatra, Sasan Mahmoodi","Rotation-Scale Equivariant Steerable Filters","Accepted by MIDL 2023",,,,"cs.CV","http://arxiv.org/licenses/nonexclusive-distrib/1.0/","  Incorporating either rotation equivariance or scale equivariance into CNNs
has proved to be effective in improving models' generalization performance.
However, jointly integrating rotation and scale equivariance into CNNs has not
been widely explored. Digital histology imaging of biopsy tissue can be
captured at arbitrary orientation and magnification and stored at different
resolutions, resulting in cells appearing in different scales. When
conventional CNNs are applied to histopathology image analysis, the
generalization performance of models is limited because 1) a part of the
parameters of filters are trained to fit rotation transformation, thus
decreasing the capability of learning other discriminative features; 2)
fixed-size filters trained on images at a given scale fail to generalize to
those at different scales. To deal with these issues, we propose the
Rotation-Scale Equivariant Steerable Filter (RSESF), which incorporates
steerable filters and scale-space theory. The RSESF contains copies of filters
that are linear combinations of Gaussian filters, whose direction is controlled
by directional derivatives and whose scale parameters are trainable but
constrained to span disjoint scales in successive layers of the network.
Extensive experiments on two gland segmentation datasets demonstrate that our
method outperforms other approaches, with much fewer trainable parameters and
fewer GPU resources required. The source code is available at:
https://github.com/ynulonger/RSESF.
","[{""version"":""v1"",""created"":""Mon, 10 Apr 2023 14:13:56 GMT""}]","2023-04-11"
"2304.04601","Hao Chen","Hao Chen, Jie Ma","A property on monochromatic copies of graphs containing a triangle",,,,,"math.CO","http://arxiv.org/licenses/nonexclusive-distrib/1.0/","  A graph $H$ is called common and respectively, strongly common if the number
of monochromatic copies of $H$ in a 2-edge-coloring $\phi$ of a large clique is
asymptotically minimised by the random coloring with an equal proportion of
each color and respectively, by the random coloring with the same proportion of
each color as in $\phi$. A well-known theorem of Jagger, {\v S}t'ov{\' i}{\v
c}ek and Thomason states that every graph containing a $K_4$ is not common.
Here we prove an analogous result that every graph containing a $K_3$ and with
at least four edges is not strongly common.
","[{""version"":""v1"",""created"":""Mon, 10 Apr 2023 14:16:25 GMT""}]","2023-04-11"
"2304.04602","Zihan Ding","Zihan Ding, Yuanpei Chen, Allen Z. Ren, Shixiang Shane Gu, Hao Dong,
  Chi Jin","Learning a Universal Human Prior for Dexterous Manipulation from Human
  Preference",,,,,"cs.RO cs.HC cs.LG","http://creativecommons.org/licenses/by/4.0/","  Generating human-like behavior on robots is a great challenge especially in
dexterous manipulation tasks with robotic hands. Even in simulation with no
sample constraints, scripting controllers is intractable due to high degrees of
freedom, and manual reward engineering can also be hard and lead to
non-realistic motions. Leveraging the recent progress on Reinforcement Learning
from Human Feedback (RLHF), we propose a framework to learn a universal human
prior using direct human preference feedback over videos, for efficiently
tuning the RL policy on 20 dual-hand robot manipulation tasks in simulation,
without a single human demonstration. One task-agnostic reward model is trained
through iteratively generating diverse polices and collecting human preference
over the trajectories; it is then applied for regularizing the behavior of
polices in the fine-tuning stage. Our method empirically demonstrates more
human-like behaviors on robot hands in diverse tasks including even unseen
tasks, indicating its generalization capability.
","[{""version"":""v1"",""created"":""Mon, 10 Apr 2023 14:17:33 GMT""}]","2023-04-11"
"2304.04603","Ratan Othayoth","Ratan Othayoth","Kinetic energy fluctuation-driven locomotor transitions on potential
  energy landscapes of beam obstacle traversal and self-righting","arXiv admin note: substantial text overlap with arXiv:2006.12717",,,,"physics.bio-ph","http://creativecommons.org/licenses/by/4.0/","  Despite contending with constraints imposed by the environment, morphology,
and physiology, animals move well by physically interactingwith the environment
to use and transition between modes such as running, climbing, and
self-righting. By contrast, robots struggle to do so in real world.
Understanding the principles of how locomotor transitions emerge from
constrained physical interaction is necessary for robots to move robustly using
similar strategies. Recent studies discovered that discoid cockroaches use and
transition between diverse locomotor modes to traverse beams and self-right on
ground. For both systems, animals probabilistically transitioned between modes
via multiple pathways, while its self-propulsion created kinetic energy
fluctuation. Here, we seek mechanistic explanations for these observations by
adopting a physics-based approach that integrates biological and robotic
studies.
  We discovered that animal and robot locomotor transitions during beam
obstacle traversal and ground self-righting are barrier-crossing transitions on
potential energy landscapes. Whereas animals and robot traversed stiff beams by
rolling their body betweenbeam, they pushed across flimsy beams, suggesting a
concept of terradynamic favorability where modes with easier physical
interaction are more likely to occur. Robotic beam traversal revealed that,
system state either remains in a favorable mode or transitions to one when
energy fluctuation is comparable to the transition barrier. Robotic
self-righting transitions occurred similarly and revealed that changing system
parameters lowers barriers over which comparable fluctuation can induce
transitions. Thetransitionsof animalsin both systems mostly occurred similarly,
but sensory feedback may facilitate its beam traversal. Finally, we developed a
method to measure animal movement across large spatiotemporal scales in a
terrain treadmill.
","[{""version"":""v1"",""created"":""Mon, 10 Apr 2023 14:19:02 GMT""}]","2023-04-11"
"2304.04604","Amaresh Datta","Alexey Guscov, Amaresh Datta, Anton Karpishkov, Igor Denisenko,
  Vladimir Saleev","Probing Gluons at the Spin Physics Detector","Accepted for publication in MDPI Physics special issue `From Heavy
  Ions to Astroparticle Physics'",,,,"hep-ex","http://creativecommons.org/licenses/by/4.0/","  The Spin Physics Detector (SPD) at the Nuclotron based Ion Collider fAcility
(NICA) is a multi-purpose experiment designed to study nucleon spin structure
in the three dimensions. With capabilities to collide polarized protons and
deuterons with center of mass energy up to 27 GeV and luminosity up to $10^{32}
\rm cm^{-2} \ s^{-1}$ for protons (an order of magnitude less for deuterons),
the experiment will allow measurements of cross-sections and spin asymmetries
of hadronic processes sensitive to the unpolarized and various polarized
(helicity, Sivers, Boer-Mulders) gluon distributions inside the nucleons.
Results from the SPD will be complementary to the present high energy spin
experiments at the RHIC facility or future experiments like the EIC (at BNL)
and AFTER (at LHC). SPD will provide data in moderate and large Bjorken-x for
much improved global analyses of spin structures of the basic building blocks
of Nature. With polarized deuteron collisions, SPD will be the unique
laboratory for probing tensor polarized gluon distributions. In addition, there
are also possibilities of colliding other light nuclei like Carbon at reduced
collision energy and luminosity at the first stage of the experiment.
","[{""version"":""v1"",""created"":""Mon, 10 Apr 2023 14:20:11 GMT""},{""version"":""v2"",""created"":""Wed, 12 Apr 2023 13:50:28 GMT""},{""version"":""v3"",""created"":""Tue, 23 May 2023 09:46:41 GMT""}]","2023-05-24"
"2304.04605","Iona Kondo","Iona Kondo, Takahiro Sumi, Naoki Koshimoto, Nicholas J. Rattenbury,
  Daisuke Suzuki, and David P. Bennett","Prediction of Planet Yields by the PRime-focus Infrared Microlensing
  Experiment Microlensing Survey","25 pages, 17 figures, and 3 tables. Accept for publication in The
  Astronomical Journal",,"10.3847/1538-3881/acccf9",,"astro-ph.EP astro-ph.GA","http://creativecommons.org/licenses/by/4.0/","  The PRime-focus Infrared Microlensing Experiment (PRIME) will be the first to
conduct a dedicated near infrared (NIR) microlensing survey by using a 1.8m
telescope with a wide field of view of 1.45 ${\rm deg^{2}}$ at the South
African Astronomical Observatory (SAAO). The major goals of the PRIME
microlensing survey are to measure the microlensing event rate in the inner
Galactic bulge to help design the observing strategy for the exoplanet
microlensing survey by the {\it Nancy Grace Roman Space Telescope} and to make
a first statistical measurement of exoplanet demographics in the central bulge
fields where optical observations are very difficult owing to the high
extinction in these fields. Here we conduct a simulation of the PRIME
microlensing survey to estimate its planet yields and determine the optimal
survey strategy, using a Galactic model optimized for the inner Galactic bulge.
In order to maximize the number of planet detections and the range of planet
mass, we compare the planet yields among four observation strategies. Assuming
{the \citet{2012Natur.481..167C} mass function as modified by
\citet{2019ApJS..241....3P}}, we predict that PRIME will detect planetary
signals for $42-52$ planets ($1-2$ planets with $M_p \leq 1 M_\oplus$, $22-25$
planets with mass $1 M_\oplus < M_p \leq 100 M_\oplus$, $19-25$ planets $100
M_\oplus < M_p \leq 10000 M_\oplus$), per year depending on the chosen
observation strategy.
","[{""version"":""v1"",""created"":""Mon, 10 Apr 2023 14:21:48 GMT""}]","2023-06-07"
"2304.04606","Abraham Smith","Abraham George Smith, Denis Kutn\'ar, Ivan Richter Vogelius, Sune
  Darkner and Jens Petersen","Localise to segment: crop to improve organ at risk segmentation accuracy",,,,,"eess.IV cs.CV","http://creativecommons.org/licenses/by/4.0/","  Increased organ at risk segmentation accuracy is required to reduce cost and
complications for patients receiving radiotherapy treatment. Some deep learning
methods for the segmentation of organs at risk use a two stage process where a
localisation network first crops an image to the relevant region and then a
locally specialised network segments the cropped organ of interest. We
investigate the accuracy improvements brought about by such a localisation
stage by comparing to a single-stage baseline network trained on full
resolution images. We find that localisation approaches can improve both
training time and stability and a two stage process involving both a
localisation and organ segmentation network provides a significant increase in
segmentation accuracy for the spleen, pancreas and heart from the Medical
Segmentation Decathlon dataset. We also observe increased benefits of
localisation for smaller organs. Source code that recreates the main results is
available at \href{https://github.com/Abe404/localise_to_segment}{this https
URL}.
","[{""version"":""v1"",""created"":""Mon, 10 Apr 2023 14:22:10 GMT""}]","2023-04-11"
"2304.04607","Isabel G\'omez Palos","Isabel G\'omez-Palos, Miguel Vazquez-Pufleau, Richard S Sch\""aufele,
  Anastasiia Mikhalchan, Afshin Pendashteh, \'Alvaro Ridruejo and Juan J.
  Vilatela","Gas-to-nanotextile: high-performance materials from floating 1D
  nanoparticles","36 pages, 25 figures","I. G\'omez-Palos, M. Vazquez-Pufleau, R. S. Sch\""aufele, A.
  Mikhalchan, A. Pendashteh, \'A. Ridruejo and J. J. Vilatela, Nanoscale, 2023,
  15, 6052-6074","10.1039/D3NR00289F",,"cond-mat.mtrl-sci physics.app-ph","http://arxiv.org/licenses/nonexclusive-distrib/1.0/","  Suspended in the gas phase, 1D inorganic nanoparticles (nanotubes and
nanowires) grow to hundreds of microns in a second and can be thus directly
assembled into freestanding network materials. The corresponding process
continuously transforms gas precursors into aerosols into aerogels into
macroscopic nanotextiles. By enabling the assembly of very high aspect ratio
nanoparticles, this processing route has translated into high-performance
structural materials, transparent conductors and battery anodes, amongst other
embodiments. This paper reviews progress in the application of such
manufacturing process to nanotubes and nanowires. It analyses 1D nanoparticle
growth through floating catalyst chemical vapour deposition (FCCVD), in terms
of reaction selectivity, scalability and its inherently ultra-fast growth rates
(107-108 atoms per second) up to 1000 times faster than for substrate CVD. We
summarise emerging descriptions of the formation of aerogels through
percolation theory and multi-scale models for the collision and aggregation of
1D nanoparticles. The paper shows that macroscopic ensembles of 1D
nanoparticles resemble textiles in their porous network structure, high
flexibility and damage-tolerance. Their bulk properties depend strongly on
inter-particle properties and are dominated by alignment and volume fraction.
Selected examples of nanotextiles that surpass granular and monolithic
materials include structural fibres with polymer-like toughness, transparent
conductors, and slurry-free composite electrodes for energy storage.
","[{""version"":""v1"",""created"":""Mon, 10 Apr 2023 14:23:15 GMT""}]","2023-04-11"
"2304.04608","Xiaotian Wang","Guangqian Ding, Chengwu Xie, Jingbo Bai, Zhenxiang Cheng, Xiaotian
  Wang, Weikang Wu","Recipe for single-pair-Weyl-points phonons carrying the same chiral
  charges",,,,,"cond-mat.mtrl-sci","http://creativecommons.org/licenses/by/4.0/","  Recently, Wang et al. [Phys. Rev. B, 106, 195129 (2022)] challenged a widely
held belief in the field of Weyl physics, demonstrating that
single-pair-Weyl-points (SP-WPs) can exist in nonmagnetic spinless systems,
contrary to previous assumptions that they could only exist in magnetic
systems. Wang et al. observed that the SP-WPs with opposite and even chiral
charges (i.e., |C| = 2 or 4) could also exist in nonmagnetic spinless systems.
In this Letter, we present a novel finding in which SP-WPs have a partner,
namely a charged nodal surface, in nonmagnetic spinless systems. In contrast to
previous observations, we show that the SP-WPs can have uneven chiral charges
(i.e., |C| = 1). We identify 6 (out of 230) space groups (SGs) that contain
such SP-WPs by searching the encyclopedia of emergent particles in
three-dimensional crystals. Our finds were confirmed through the phonon spectra
of two specific materials Zr3O (with SG 182) and NaPH2NO3 (with SG 173). This
discovery broadens the range of materials that can host SP-WPs and applies to
other nonmagnetic spinless crystals.
","[{""version"":""v1"",""created"":""Mon, 10 Apr 2023 14:24:18 GMT""}]","2023-04-11"
"2304.04609","Zhiguang Liu","Zhiguang Liu, Minkun Cai, Shenda Hong, Junli Shi, Sai Xie, Chang Liu,
  Huifeng Du, James D. Morin, Gang Li, Wang Liu, Hong Wang, Ke Tang, Nicholas
  X. Fang, Chuan Fei Guo","Inverse design of artificial skins",,,,,"cond-mat.soft physics.app-ph","http://arxiv.org/licenses/nonexclusive-distrib/1.0/","  Mimicking the perceptual functions of human cutaneous mechanoreceptors,
artificial skins or flexible pressure sensors can transduce tactile stimuli to
quantitative electrical signals. Conventional methods to design such devices
follow a forward structure-to-property routine based on trial-and-error
experiments/simulations, which take months or longer to determine one solution
valid for one specific material. Target-oriented inverse design that shows far
higher output efficiency has proven effective in other fields, but is still
absent for artificial skins because of the difficulties in acquiring big data.
Here, we report a property-to-structure inverse design of artificial skins
based on small dataset machine learning, exhibiting a comprehensive efficiency
at least four orders of magnitude higher than the conventional routine. The
inverse routine can predict hundreds of solutions that overcome the intrinsic
signal saturation problem for linear response in hours, and the solutions are
valid to a variety of materials. Our results demonstrate that the inverse
design allowed by small dataset is an efficient and powerful tool to target
multifarious applications of artificial skins, which can potentially advance
the fields of intelligent robots, advanced healthcare, and human-machine
interfaces.
","[{""version"":""v1"",""created"":""Mon, 10 Apr 2023 14:24:28 GMT""}]","2023-04-11"
"2304.04610","Debashish Roy","Debashish Roy, Manish Shrivastava","Attention at SemEval-2023 Task 10: Explainable Detection of Online
  Sexism (EDOS)",,,,,"cs.CL","http://creativecommons.org/licenses/by/4.0/","  In this paper, we have worked on interpretability, trust, and understanding
of the decisions made by models in the form of classification tasks. The task
is divided into 3 subtasks. The first task consists of determining Binary
Sexism Detection. The second task describes the Category of Sexism. The third
task describes a more Fine-grained Category of Sexism. Our work explores
solving these tasks as a classification problem by fine-tuning
transformer-based architecture. We have performed several experiments with our
architecture, including combining multiple transformers, using domain adaptive
pretraining on the unlabelled dataset provided by Reddit and Gab, Joint
learning, and taking different layers of transformers as input to a
classification head. Our system (with team name Attention) was able to achieve
a macro F1 score of 0.839 for task A, 0.5835 macro F1 score for task B and
0.3356 macro F1 score for task C at the Codalab SemEval Competition. Later we
improved the accuracy of Task B to 0.6228 and Task C to 0.3693 in the test set.
","[{""version"":""v1"",""created"":""Mon, 10 Apr 2023 14:24:52 GMT""}]","2023-04-11"
"2304.04611","Cupid Collaboration","CUPID and CROSS collaborations: K. Alfonso, A. Armatol, C. Augier,
  F.T. Avignone III, O. Azzolini, M. Balata, I.C. Bandac, A.S. Barabash, G.
  Bari, A. Barresi, D. Baudin, F. Bellini, G. Benato, V. Berest, M. Beretta, M.
  Bettelli, M. Biassoni, J. Billard, V. Boldrini, A. Branca, C. Brofferio, C.
  Bucci, J.M. Calvo-Mozota, J. Camilleri, A. Campani, C. Capelli, S. Capelli,
  L. Cappelli, L. Cardani, P. Carniti, N. Casali, E. Celi, C. Chang, D. Chiesa,
  M. Clemenza, I. Colantoni, S. Copello, E. Craft, O. Cremonesi, R.J. Creswick,
  A. Cruciani, A. D'Addabbo, G. D'Imperio, S. Dabagov, I. Dafinei, F.A.
  Danevich, M. De Jesus, P. de Marcillac, S. Dell'Oro, S. Di Domizio, S. Di
  Lorenzo, T. Dixon, V. Domp\'e, A. Drobizhev, L. Dumoulin, G. Fantini, M.
  Faverzani, E. Ferri, F. Ferri, F. Ferroni, E. Figueroa-Feliciano, L.
  Foggetta, J. Formaggio, A. Franceschi, C. Fu, S. Fu, B.K. Fujikawa, A.
  Gallas, J. Gascon, S. Ghislandi, A. Giachero, A. Gianvecchio, M. Girola, L.
  Gironi, A. Giuliani, P. Gorla, C. Gotti, C. Grant, P. Gras, P.V. Guillaumon,
  T.D. Gutierrez, K. Han, E.V. Hansen, K.M. Heeger, D.L. Helis, H.Z. Huang, A.
  Ianni, L. Imbert, J. Johnston, A. Juillard, G. Karapetrov, G. Keppel, H.
  Khalife, V.V. Kobychev, Yu.G. Kolomensky, S.I. Konovalov, R. Kowalski, T.
  Langford, M. Lefevre, R. Liu, Y. Liu, P. Loaiza, L. Ma, M. Madhukuttan, F.
  Mancarella, C.A. Marrache-Kikuchi, L. Marini, S. Marnieros, M. Martinez, R.H.
  Maruyama, Ph. Mas, D. Mayer, G. Mazzitelli, Y. Mei, S. Milana, S. Morganti,
  T. Napolitano, M. Nastasi, J. Nikkel, S. Nisi, C. Nones, E.B. Norman, V.
  Novosad, I. Nutini, T. O'Donnell, E. Olivieri, M. Olmi, J.L. Ouellet, S.
  Pagan, C. Pagliarone, L. Pagnanini, L. Pattavina, M. Pavan, H. Peng, G.
  Pessina, V. Pettinacci, C. Pira, S. Pirro, D.V. Poda, O.G. Polischuk, I.
  Ponce, S. Pozzi, E. Previtali, A. Puiu, S. Quitadamo, A. Ressa, R. Rizzoli,
  C. Rosenfeld, P. Rosier, J.A. Scarpaci, B. Schmidt, V. Sharma, V.N. Shlegel,
  V. Singh, M. Sisti, P. Slocum, D. Speller, P.T. Surukuchi, L. Taffarello, C.
  Tomei, J.A. Torres, V.I. Tretyak, A. Tsymbaliuk, M. Velazquez, K.J. Vetter,
  S.L. Wagaarachchi, G. Wang, L. Wang, R. Wang, B. Welliver, J. Wilson, K.
  Wilson, L.A. Winslow, M. Xue, L. Yan, J. Yang, V. Yefremenko, V.I. Umatov,
  M.M. Zarytskyy, J. Zhang, A. Zolotarova, and S. Zucchelli","Twelve-crystal prototype of Li$_2$MoO$_4$ scintillating bolometers for
  CUPID and CROSS experiments","Prepared for submission to JINST; 23 pages, 9 figures, and 4 tables",,,,"physics.ins-det nucl-ex","http://creativecommons.org/licenses/by/4.0/","  An array of twelve 0.28 kg lithium molybdate (LMO) low-temperature bolometers
equipped with 16 bolometric Ge light detectors, aiming at optimization of
detector structure for CROSS and CUPID double-beta decay experiments, was
constructed and tested in a low-background pulse-tube-based cryostat at the
Canfranc underground laboratory in Spain. Performance of the scintillating
bolometers was studied depending on the size of phonon NTD-Ge sensors glued to
both LMO and Ge absorbers, shape of the Ge light detectors (circular vs.
square, from two suppliers), in different light collection conditions (with and
without reflector, with aluminum coated LMO crystal surface). The scintillating
bolometer array was operated over 8 months in the low-background conditions
that allowed to probe a very low, $\mu$Bq/kg, level of the LMO crystals
radioactive contamination by $^{228}$Th and $^{226}$Ra.
","[{""version"":""v1"",""created"":""Mon, 10 Apr 2023 14:25:13 GMT""}]","2023-04-11"
"2304.04612","Hiroyuki Ootomo","Hiroyuki Ootomo and Rio Yokota","Mixed-Precision Random Projection for RandNLA on Tensor Cores","PASC'23",,,,"cs.DC","http://arxiv.org/licenses/nonexclusive-distrib/1.0/","  Random projection can reduce the dimension of data while capturing its
structure and is a fundamental tool for machine learning, signal processing,
and information retrieval, which deal with a large amount of data today.
RandNLA (Randomized Numerical Linear Algebra) leverages random projection to
reduce the computational complexity of low-rank decomposition of tensors and
solve least-square problems. While the computation of the random projection is
a simple matrix multiplication, its asymptotic computational complexity is
typically larger than other operations in a RandNLA algorithm. Therefore,
various studies propose methods for reducing its computational complexity. We
propose a fast mixed-precision random projection method on NVIDIA GPUs using
Tensor Cores for single-precision tensors. We exploit the fact that the random
matrix requires less precision, and develop a highly optimized matrix
multiplication between FP32 and FP16 matrices -- SHGEMM (Single and
Half-precision GEMM) -- on Tensor Cores, where the random matrix is stored in
FP16. Our method can compute Randomized SVD 1.28 times faster and Random
projection high order SVD 1.75 times faster than baseline single-precision
implementations while maintaining accuracy.
","[{""version"":""v1"",""created"":""Mon, 10 Apr 2023 14:27:14 GMT""}]","2023-04-11"
"2304.04613","Mousumi Akter","Mousumi Akter, Souvika Sarkar, Shubhra Kanti Karmaker Santu","On Evaluation of Bangla Word Analogies",,,,,"cs.CL","http://creativecommons.org/licenses/by-nc-sa/4.0/","  This paper presents a high-quality dataset for evaluating the quality of
Bangla word embeddings, which is a fundamental task in the field of Natural
Language Processing (NLP). Despite being the 7th most-spoken language in the
world, Bangla is a low-resource language and popular NLP models fail to perform
well. Developing a reliable evaluation test set for Bangla word embeddings are
crucial for benchmarking and guiding future research. We provide a
Mikolov-style word analogy evaluation set specifically for Bangla, with a
sample size of 16678, as well as a translated and curated version of the
Mikolov dataset, which contains 10594 samples for cross-lingual research. Our
experiments with different state-of-the-art embedding models reveal that Bangla
has its own unique characteristics, and current embeddings for Bangla still
struggle to achieve high accuracy on both datasets. We suggest that future
research should focus on training models with larger datasets and considering
the unique morphological characteristics of Bangla. This study represents the
first step towards building a reliable NLP system for the Bangla language1.
","[{""version"":""v1"",""created"":""Mon, 10 Apr 2023 14:27:35 GMT""}]","2023-04-11"
