"2304.07760","Congwen Liu","Congwen Liu and Heng Xu","Lipschitz continuity of the solutions to the Dirichlet problems for the
  invariant laplacians","7 pages",,,,"math.AP","http://creativecommons.org/licenses/by/4.0/","  This short note is motivated by an attempt to understand the distinction
between the Laplace operator and the hyperbolic Laplacian on the unit ball of
$\mathbb{R}^n$, regarding the Lipschitz continuity of the solutions to the
corresponding Dirichlet problems. We investigate the Dirichlet problem
\begin{equation*} \left\{\begin{array}{ll} \Delta_{\vartheta} u = 0, & \text{
in }\, \mathbb{B}^n,\\ u=\phi, & \text{ on }\, \mathbb{S}^{n-1},
\end{array}\right. \end{equation*} where \[ \Delta_{\vartheta} := (1-|x|^2)
\bigg\{ \frac {1-|x|^2} {4} \Delta + \vartheta \sum_{j=1}^n x_{j} \frac
{\partial } {\partial x_j} + \vartheta \left( \frac {n}{2}-1- \vartheta \right)
I\bigg\}. \] We show that the Lipschitz continuity of boundary data always
implies the Lipschitz continuity of the solutions if $\vartheta > 0$, but does
not when $\vartheta \leq 0$.
","[{""version"":""v1"",""created"":""Sun, 16 Apr 2023 12:21:25 GMT""}]","2023-04-18"
"2304.07761","Anshuman Baruah","Anshuman Baruah and Ali \""Ovg\""un and Atri Deshamukhya","Quasinormal Modes and Bounding Greybody Factors of GUP-corrected Black
  Holes in Kalb-Ramond Gravity",,,,,"gr-qc hep-th","http://creativecommons.org/licenses/by/4.0/","  The vacuum expectation value of the non-minimally coupled Kalb-Ramond (KR)
field leads to spontaneous local Lorentz symmetry violation, and static
spherically symmetric solutions exist. In this study, we study the quasinormal
modes (QNMs) of modified black holes in non-minimally coupled KR gravity. We
employ a higher-order Pad\'e averaged WKB method to compute the QNMs for
scalar, electromagnetic, and gravitational perturbations. In order to account
for quantum corrections, we examine the geometric characteristics of the
horizon and QNMs by introducing the generalized uncertainty principle.
Additionally, we shed light on the impact of the Lorentz violating parameters
on our findings and estimate QNMs for different perturbations. Our findings
reveal the influence of the Lorentz violating parameters in the model on the
QNM frequencies and their reliance on the GUP parameters.
","[{""version"":""v1"",""created"":""Sun, 16 Apr 2023 12:26:05 GMT""}]","2023-04-18"
"2304.07762","HeeChang Lim","Linqi Yu, Mustafa Z. Yousif, Young-Woo Lee, Xiaojue Zhu, Meng Zhang,
  Paraskovia Kolesova, Hee-Chang Lim","Predicting unavailable parameters from existing velocity fields of
  turbulent flows using a GAN-based model","16 pages, 14 figures",,,,"physics.flu-dyn","http://creativecommons.org/publicdomain/zero/1.0/","  In this study, an efficient deep-learning model is developed to predict
unavailable parameters, e.g., streamwise velocity, temperature, and pressure
from available velocity components. This model, termed mapping generative
adversarial network (M-GAN), consists of a label information generator (LIG)
and an enhanced super-resolution generative adversarial network (ESRGAN). LIG
can generate label information helping the model to predict different
parameters. The GAN-based model receives the label information from LIG and
existing velocity data to generate the unavailable parameters. Two-dimensional
(2D) Rayleigh-B{\'e}nard flow and turbulent channel flow are used to evaluate
the performance of M-GAN. Firstly, M-GAN is trained and evaluated by 2D direct
numerical simulation (DNS) data of a Rayleigh-B{\'e}nard flow. From the
results, it can be shown that M-GAN can predict temperature distribution from
the two-dimensional velocities. Furthermore, DNS data of turbulent channel flow
at two different friction Reynolds numbers $Re_\tau$ = 180 and 550 are applied
simultaneously to train the M-GAN and examine its predicting ability for the
pressure fields and the streamwise velocity from the other two velocity
components. The instantaneous and statistical results of the predicted data
agree well with the DNS data, even for the flow at $Re_\tau$ = 395, indicating
that M-GAN can be trained to learn the mapping function of the unknown fields
with good interpolation capability.
","[{""version"":""v1"",""created"":""Sun, 16 Apr 2023 12:26:49 GMT""}]","2023-04-18"
"2304.07763","Xiuyuan Qin Qin","Xiuyuan Qin, Huanhuan Yuan, Pengpeng Zhao, Junhua Fang, Fuzhen Zhuang,
  Guanfeng Liu, Victor Sheng","Meta-optimized Contrastive Learning for Sequential Recommendation","11 Pages,8 figures",,"10.1145/3539618.3591727",,"cs.IR","http://arxiv.org/licenses/nonexclusive-distrib/1.0/","  Contrastive Learning (CL) performances as a rising approach to address the
challenge of sparse and noisy recommendation data. Although having achieved
promising results, most existing CL methods only perform either hand-crafted
data or model augmentation for generating contrastive pairs to find a proper
augmentation operation for different datasets, which makes the model hard to
generalize. Additionally, since insufficient input data may lead the encoder to
learn collapsed embeddings, these CL methods expect a relatively large number
of training data (e.g., large batch size or memory bank) to contrast. However,
not all contrastive pairs are always informative and discriminative enough for
the training processing. Therefore, a more general CL-based recommendation
model called Meta-optimized Contrastive Learning for sequential Recommendation
(MCLRec) is proposed in this work. By applying both data augmentation and
learnable model augmentation operations, this work innovates the standard CL
framework by contrasting data and model augmented views for adaptively
capturing the informative features hidden in stochastic data augmentation.
Moreover, MCLRec utilizes a meta-learning manner to guide the updating of the
model augmenters, which helps to improve the quality of contrastive pairs
without enlarging the amount of input data. Finally, a contrastive
regularization term is considered to encourage the augmentation model to
generate more informative augmented views and avoid too similar contrastive
pairs within the meta updating. The experimental results on commonly used
datasets validate the effectiveness of MCLRec.
","[{""version"":""v1"",""created"":""Sun, 16 Apr 2023 12:30:33 GMT""},{""version"":""v2"",""created"":""Wed, 26 Apr 2023 14:34:39 GMT""},{""version"":""v3"",""created"":""Tue, 16 May 2023 04:30:07 GMT""},{""version"":""v4"",""created"":""Wed, 17 May 2023 04:08:26 GMT""}]","2023-05-18"
"2304.07764","Iraklis Giannakis","Iraklis Giannakis, Anshuman Bhardwaj, Lydia Sam, Georgios Leontidis","Deep learning universal crater detection using Segment Anything Model
  (SAM)","11 pages, 7 Figures, preprint of a submitted paper in Icarus (under
  review)",,,,"cs.CV eess.IV","http://creativecommons.org/licenses/by/4.0/","  Craters are amongst the most important morphological features in planetary
exploration. To that extent, detecting, mapping and counting craters is a
mainstream process in planetary science, done primarily manually, which is a
very laborious and time-consuming process. Recently, machine learning (ML) and
computer vision have been successfully applied for both detecting craters and
estimating their size. Existing ML approaches for automated crater detection
have been trained in specific types of data e.g. digital elevation model (DEM),
images and associated metadata for orbiters such as the Lunar Reconnaissance
Orbiter Camera (LROC) etc.. Due to that, each of the resulting ML schemes is
applicable and reliable only to the type of data used during the training
process. Data from different sources, angles and setups can compromise the
reliability of these ML schemes. In this paper we present a universal crater
detection scheme that is based on the recently proposed Segment Anything Model
(SAM) from META AI. SAM is a prompt-able segmentation system with zero-shot
generalization to unfamiliar objects and images without the need for additional
training. Using SAM we can successfully identify crater-looking objects in any
type of data (e,g, raw satellite images Level-1 and 2 products, DEMs etc.) for
different setups (e.g. Lunar, Mars) and different capturing angles. Moreover,
using shape indexes, we only keep the segmentation masks of crater-like
features. These masks are subsequently fitted with an ellipse, recovering both
the location and the size/geometry of the detected craters.
","[{""version"":""v1"",""created"":""Sun, 16 Apr 2023 12:36:37 GMT""}]","2023-04-18"
"2304.07765","Filippo Sarti","Filippo Sarti, Alessio Savini","Measurable bounded cohomology of measured groupoids","48 pages. Comments are welcome!",,,,"math.DS math.FA math.GR","http://arxiv.org/licenses/nonexclusive-distrib/1.0/","  We introduce the notion of measurable bounded cohomology for measured
groupoids, extending continuous bounded cohomology of locally compact groups.
We show that the measurable bounded cohomology of the semidirect groupoid
associated to a measure class preserving action of a locally compact group $G$
on a regular space is isomorphic to the continuous bounded cohomology of $G$
with twisted coefficients. We also prove the invariance of measurable bounded
cohomology under similarity. As an application, we compare the bounded
cohomology of (weakly) orbit equivalent actions and of measure equivalent
groups. In this way we recover an isomorphism in bounded cohomology similar to
one proved by Monod and Shalom. For amenable groupoids, we show that the
measurable bounded cohomology vanishes. This generalizes previous results by
Monod, Anantharaman-Delaroche and Renault, and Blank.
","[{""version"":""v1"",""created"":""Sun, 16 Apr 2023 12:37:32 GMT""}]","2023-04-18"
"2304.07766","Jacopo Pegoraro","Jacopo Pegoraro, Jesus O. Lacruz, Tommy Azzino, Marco Mezzavilla,
  Michele Rossi, Joerg Widmer, Sundeep Rangan","JUMP: Joint communication and sensing with Unsynchronized transceivers
  Made Practical","30 pages, 14 figures",,,,"eess.SP","http://creativecommons.org/licenses/by/4.0/","  Wideband millimeter-wave communication systems can be extended to provide
radar-like sensing capabilities on top of data communication, in a
cost-effective manner. However, the development of joint communication and
sensing technology is hindered by practical challenges, such as occlusions to
the line-of-sight path and clock asynchrony between devices. The latter
introduces time-varying timing and frequency offsets that prevent the
estimation of sensing parameters and, in turn, the use of standard signal
processing solutions. Existing approaches cannot be applied to commonly used
phased-array receivers, as they build on stringent assumptions about the
multipath environment, and are computationally complex. We present JUMP, the
first system enabling practical bistatic and asynchronous joint communication
and sensing, while achieving accurate target tracking and micro-Doppler
extraction in realistic conditions. Our system compensates for the timing
offset by exploiting the channel correlation across subsequent packets.
Further, it tracks multipath reflections and eliminates frequency offsets by
observing the phase of a dynamically-selected static reference path. JUMP has
been implemented on a 60 GHz experimental platform, performing extensive
evaluations of human motion sensing, including non-line-of-sight scenarios. In
our results, JUMP attains comparable tracking performance to a full-duplex
monostatic system and similar micro-Doppler quality with respect to a
phase-locked bistatic receiver.
","[{""version"":""v1"",""created"":""Sun, 16 Apr 2023 12:39:54 GMT""}]","2023-04-18"
"2304.07767","Xiang Li Lxws","Xiang Li, Xi Cen, Zunwei Fu and Zhongci Hang","Boundedness of the multilinear integral operators on Heisenberg group",,,,,"math.CA","http://creativecommons.org/licenses/by/4.0/","  In this paper, we will obtain the sharp constant for multilinear integral
operator on Heisenberg group Lebesgue space which is based on the Stein-Weiss
lemma, the boundedness for multilinear integral operator on Heisenberg group
$A_p$ weighted Morrey space and the sharp constant for multilinear integral
operator on Heisenberg group two power weight Morrey space.
","[{""version"":""v1"",""created"":""Sun, 16 Apr 2023 12:46:40 GMT""},{""version"":""v2"",""created"":""Wed, 7 Jun 2023 09:22:03 GMT""}]","2023-06-08"
"2304.07768","Mauro Mobilia","Mauro Mobilia","Polarization and Consensus in a Voter Model under Time-Fluctuating
  Influences","18 pages, 6 figures, 3 appendices","Physics 5, 517-536 (2023)","10.3390/physics5020037",,"cond-mat.stat-mech cs.SI nlin.AO physics.soc-ph","http://arxiv.org/licenses/nonexclusive-distrib/1.0/","  We study the effect of time-fluctuating social influences on the formation of
polarization and consensus in a three-party community consisting of two types
of voters (""leftists"" and ""rightists"") holding extreme opinions, and moderate
agents acting as ""centrists"". The former are incompatible and do not interact,
while centrists hold an intermediate opinion and can interact with extreme
voters. When a centrist and a leftist/rightist interact, they can become either
both centrists or both leftists/rightists. The population eventually either
reaches consensus with one of the three opinions, or a polarization state
consisting of a frozen mixture of leftists and rightists. As a main novelty,
here agents interact subject to time-fluctuating external influences favouring
in turn the spread of leftist and rightist opinions, or the rise of centrism.
We determine the fate of the population under various scenarios, and show how
the rate of change of external influences can drastically affect the
polarization and consensus probabilities, as well as the mean time to reach the
final state.
","[{""version"":""v1"",""created"":""Sun, 16 Apr 2023 12:57:16 GMT""},{""version"":""v2"",""created"":""Mon, 1 May 2023 16:01:08 GMT""},{""version"":""v3"",""created"":""Tue, 9 May 2023 08:55:35 GMT""}]","2023-05-10"
"2304.07769","Zahra Dehghanian","Zahra Dehghanian, Saeed Saravani, Maryam Amirmazlaghani, Mohammad
  Rahmati","Regularized Complete Cycle Consistent GAN for Anomaly Detection",,,,,"cs.LG","http://arxiv.org/licenses/nonexclusive-distrib/1.0/","  This study presents an adversarial method for anomaly detection in real-world
applications, leveraging the power of generative adversarial neural networks
(GANs) through cycle consistency in reconstruction error. Previous methods
suffer from the high variance between class-wise accuracy which leads to not
being applicable for all types of anomalies. The proposed method named RCALAD
tries to solve this problem by introducing a novel discriminator to the
structure, which results in a more efficient training process. Additionally,
RCALAD employs a supplementary distribution in the input space to steer
reconstructions toward the normal data distribution, effectively separating
anomalous samples from their reconstructions and facilitating more accurate
anomaly detection. To further enhance the performance of the model, two novel
anomaly scores are introduced. The proposed model has been thoroughly evaluated
through extensive experiments on six various datasets, yielding results that
demonstrate its superiority over existing state-of-the-art models. The code is
readily available to the research community at
https://github.com/zahraDehghanian97/RCALAD.
","[{""version"":""v1"",""created"":""Sun, 16 Apr 2023 13:05:39 GMT""}]","2023-04-18"
"2304.07770","Antonino Paolo Milone","A. P. Milone","Multiple Stellar Populations in Globular Clusters with JWST","Four pages and two figures. Proceedings of the IAUS 377: Early
  Disk-Galaxy Formation from JWST to the Milky Way. Kuala-Lumpur,February 6-10,
  2023",,,,"astro-ph.SR astro-ph.GA","http://arxiv.org/licenses/nonexclusive-distrib/1.0/","  I present the first evidence of multiple populations in the globular cluster
(GCs) 47Tucanae based on images collected with the near-infrared camera
(NIRCam) on board the James Webb Space Telescope (JWST). While NIRCam
photometry is poorly sensitive to multiple populations among stars brighter
than the main-sequence (MS) knee, the M-dwarfs more-massive than 0.1 solar
masses define a wide F115W-F322W2 color range due to multiple populations. The
star-to-star color differences are mostly due to the different amounts of water
vapor (hence oxygen) that affect the spectra of M-dwarfs. The chromosome map
unveils an extended first population (1P) composed of M-dwarfs with different
metallicities and three main groups of second-population (2P) stars that are
depleted in oxygen with respect to the 1P. I present the discovery of an MS of
very-low-mass stars (masses smaller than 0.1 solar masses) and tentatively
associated it with a sequence composed of O-rich stars alone.
","[{""version"":""v1"",""created"":""Sun, 16 Apr 2023 13:09:53 GMT""}]","2023-04-18"
"2304.07771","Ali Muhammad Ali Rushdi","Ali Muhammad Rushdi and Muhammad Ali Rushdi","Towards a Switching-Algebraic Theory of Weighted Monotone Voting
  Systems: The Case of Banzhaf Voting Indices","34 pages, a single figure",,,,"cs.GT cs.LO","http://creativecommons.org/licenses/by/4.0/","  This paper provides a serious attempt towards constructing a
switching-algebraic theory for weighted monotone voting systems, whether they
are scalar-weighted or vector-weighted. The paper concentrates on the
computation of a prominent index of voting powers, viz., the Banzhaf voting
index. This computation involves two distinct operations: (a) either Boolean
differencing (Boolean differentiation) or Boolean quotient construction
(Boolean restriction), and (b) computation of the weight (the number of true
vectors or minterms) of a switching function. We introduce novel Boolean-based
symmetry-aware techniques for computing the Banzhaf index by way of four voting
systems. The paper finally outlines further steps needed towards the
establishment of a full-fledged switching-algebraic theory of weighted monotone
voting systems. Througout the paper, a tutorial flavour is retained, multiple
solutions of consistent results are given, and a liasion is established among
game-theoretic voting theory, switching algebra, and sytem reliability
analysis.
","[{""version"":""v1"",""created"":""Sun, 16 Apr 2023 13:12:00 GMT""}]","2023-04-18"
"2304.07772","Samuel Reyd","Samuel Reyd, Amal Zouaq, Papa Abdou Karim Karou Diallo","A Comprehensive Evaluation of the Copy Mechanism for Natural Language to
  SPARQL Query Generation",,,,,"cs.CL cs.LG","http://creativecommons.org/licenses/by-nc-sa/4.0/","  In recent years, the field of neural machine translation (NMT) for SPARQL
query generation has witnessed a significant growth. Recently, the
incorporation of the copy mechanism with traditional encoder-decoder
architectures and the use of pre-trained encoder-decoders have set new
performance benchmarks. This paper presents a large variety of experiments that
replicate and expand upon recent NMT-based SPARQL generation studies, comparing
pre-trained and non-pre-trained models, question annotation formats, and the
use of a copy mechanism for non-pre-trained and pre-trained models. Our results
show that either adding the copy mechanism or using a question annotation
improves performances for nonpre-trained models and for pre-trained models,
setting new baselines for three popular datasets.
","[{""version"":""v1"",""created"":""Sun, 16 Apr 2023 13:12:26 GMT""},{""version"":""v2"",""created"":""Mon, 1 May 2023 13:37:56 GMT""}]","2023-05-02"
"2304.07773","Zhen Luo","Zhen Luo, Junyi Ma, Zijie Zhou and Guangming Xiong","PCPNet: An Efficient and Semantic-Enhanced Transformer Network for Point
  Cloud Prediction",,,,,"cs.CV cs.RO","http://creativecommons.org/licenses/by/4.0/","  The ability to predict future structure features of environments based on
past perception information is extremely needed by autonomous vehicles, which
helps to make the following decision-making and path planning more reasonable.
Recently, point cloud prediction (PCP) is utilized to predict and describe
future environmental structures by the point cloud form. In this letter, we
propose a novel efficient Transformer-based network to predict the future LiDAR
point clouds exploiting the past point cloud sequences. We also design a
semantic auxiliary training strategy to make the predicted LiDAR point cloud
sequence semantically similar to the ground truth and thus improves the
significance of the deployment for more tasks in real-vehicle applications. Our
approach is completely self-supervised, which means it does not require any
manual labeling and has a solid generalization ability toward different
environments. The experimental results show that our method outperforms the
state-of-the-art PCP methods on the prediction results and semantic similarity,
and has a good real-time performance. Our open-source code and pre-trained
models are available at https://github.com/Blurryface0814/PCPNet.
","[{""version"":""v1"",""created"":""Sun, 16 Apr 2023 13:12:33 GMT""}]","2023-04-18"
"2304.07774","Muhammad Salman","Muhammad Salman, Armin Haller, Sergio J. Rodr\'iguez M\'endez","Syntactic Complexity Identification, Measurement, and Reduction Through
  Controlled Syntactic Simplification","This work is accepted and presented in International workshop on
  Learning with Knowledge Graphs (IWLKG) at WSDM'2023 Conference",,,,"cs.CL cs.IR","http://creativecommons.org/publicdomain/zero/1.0/","  Text simplification is one of the domains in Natural Language Processing
(NLP) that offers an opportunity to understand the text in a simplified manner
for exploration. However, it is always hard to understand and retrieve
knowledge from unstructured text, which is usually in the form of compound and
complex sentences. There are state-of-the-art neural network-based methods to
simplify the sentences for improved readability while replacing words with
plain English substitutes and summarising the sentences and paragraphs. In the
Knowledge Graph (KG) creation process from unstructured text, summarising long
sentences and substituting words is undesirable since this may lead to
information loss. However, KG creation from text requires the extraction of all
possible facts (triples) with the same mentions as in the text. In this work,
we propose a controlled simplification based on the factual information in a
sentence, i.e., triple. We present a classical syntactic dependency-based
approach to split and rephrase a compound and complex sentence into a set of
simplified sentences. This simplification process will retain the original
wording with a simple structure of possible domain facts in each sentence,
i.e., triples. The paper also introduces an algorithm to identify and measure a
sentence's syntactic complexity (SC), followed by reduction through a
controlled syntactic simplification process. Last, an experiment for a dataset
re-annotation is also conducted through GPT3; we aim to publish this refined
corpus as a resource. This work is accepted and presented in International
workshop on Learning with Knowledge Graphs (IWLKG) at WSDM-2023 Conference. The
code and data is available at www.github.com/sallmanm/SynSim.
","[{""version"":""v1"",""created"":""Sun, 16 Apr 2023 13:13:58 GMT""}]","2023-04-18"
"2304.07775","Wenke Xia","Wenke Xia, Xingjian Li, Andong Deng, Haoyi Xiong, Dejing Dou, Di Hu","Robust Cross-Modal Knowledge Distillation for Unconstrained Videos",,,,,"cs.CV cs.MM","http://arxiv.org/licenses/nonexclusive-distrib/1.0/","  Cross-modal distillation has been widely used to transfer knowledge across
different modalities, enriching the representation of the target unimodal one.
Recent studies highly relate the temporal synchronization between vision and
sound to the semantic consistency for cross-modal distillation. However, such
semantic consistency from the synchronization is hard to guarantee in
unconstrained videos, due to the irrelevant modality noise and differentiated
semantic correlation. To this end, we first propose a \textit{Modality Noise
Filter} (MNF) module to erase the irrelevant noise in teacher modality with
cross-modal context. After this purification, we then design a
\textit{Contrastive Semantic Calibration} (CSC) module to adaptively distill
useful knowledge for target modality, by referring to the differentiated
sample-wise semantic correlation in a contrastive fashion. Extensive
experiments show that our method could bring a performance boost compared with
other distillation methods in both visual action recognition and video
retrieval task. We also extend to the audio tagging task to prove the
generalization of our method. The source code is available at
\href{https://github.com/GeWu-Lab/cross-modal-distillation}{https://github.com/GeWu-Lab/cross-modal-distillation}.
","[{""version"":""v1"",""created"":""Sun, 16 Apr 2023 13:16:58 GMT""},{""version"":""v2"",""created"":""Thu, 27 Apr 2023 04:08:08 GMT""}]","2023-04-28"
"2304.07776","Symon Serbenyuk","Symon Serbenyuk","One modification of the Salem function","9 pages",,,,"math.GM","http://arxiv.org/licenses/nonexclusive-distrib/1.0/","  The present article is devoted to one example which related to the Salem
function. The main attention is given to properties of one type of functions
including items related to functional equations, graphs, the Lebesgue integral,
etc.
","[{""version"":""v1"",""created"":""Sun, 16 Apr 2023 13:19:29 GMT""}]","2023-04-18"
