"2304.07709","Ludovico Pinzari Lp","Ludovico Pinzari","Development of Tools for the Classification of Peer Groups Geographies
  in the Analysis of Health Care Variation","235 pages, 30 figures","International journal of health geographics 17,Article number: 42
  (2018)","10.13140/RG.2.2.34935.44969/1",,"stat.AP math.PR stat.ME stat.OT","http://creativecommons.org/licenses/by/4.0/","  This dissertation is based on a project co-founded by the Health Market
Quality Program (now Rozetta Institute) and the Australian Institute of Health
and Welfare. The overall objective of this work is to provide a framework and a
tool for classification and clustering of homogeneous geographic areas based on
aggregated population data. Thus, to enable the presentation and reporting of
comparable information of individual units with peers, I develop the
Homogeneity and Location indices to measure respectively the dispersion and
central tendency of a categorical ordinal distribution. The advantages of such
indices include statistical efficiency and a simple presentation of results.
Our approach is founded on the general theory of probability distributions, and
our aim is to provide a natural benchmark for a homogeneity measure in terms of
what is a ""high"" and ""low"" concentration of a probability distribution.
Currently, there is no accepted benchmark that could be used to assess the
homogeneity of a categorical ordinal variable. In this work, the proposed
statistical indices are used to assess the socioeconomic homogeneity of the
commonly used SA3 Australia census geography and analyse the variation of GP
attenders in the metropolitan area of Sydney. The approach can be used to
classify any geographic area and explore variation across any specified
geographical boundaries. The SA3 dataset and scripts (R/Python) to develop
these indices have been made available on my GitHub account:
https://github.com/lpinzari/homogeneity-location-index
","[{""version"":""v1"",""created"":""Sun, 16 Apr 2023 07:06:18 GMT""}]","2023-04-18"
"2304.07710","Stefano Longhi","Stefano Longhi","Anderson localization in dissipative lattices","10 pages, 3 figures, to appear in Annalen der Physik",,"10.1002/andp.202200658",,"cond-mat.dis-nn physics.optics quant-ph","http://arxiv.org/licenses/nonexclusive-distrib/1.0/","  Anderson localization predicts that wave spreading in disordered lattices can
come to a complete halt, providing a universal mechanism for {dynamical
localization}. In the one-dimensional Hermitian Anderson model with
uncorrelated diagonal disorder, there is a one-to-one correspondence between
dynamical localization and spectral localization, i.e. the exponential
localization of all the Hamiltonian eigenfunctions. This correspondence can be
broken when dealing with disordered dissipative lattices. Recently, it has been
shown that when the system exchanges particles with the surrounding environment
and random fluctuations of the dissipation are introduced, spectral
localization is observed but without dynamical localization. Such previous
studies considered lattices with mixed conservative (Hamiltonian) and
dissipative dynamics, and were restricted to a semiclassical analysis. However,
Anderson localization in purely dissipative lattices, displaying an entirely
Lindbladian dynamics, remains largely unexplored. Here we consider the
purely-dissipative Anderson model in the framework of a Lindblad master
equation and show that, akin to the semiclassical models with conservative
hopping and random dissipation, one observes dynamical delocalization in spite
of strong spectral localization of all eigenstates of the Liouvillian
superoperator. This result is very distinct than delocalization observed in the
Anderson model with dephasing effects, where dynamical delocalization arises
from the delocalization of the stationary state of the Liouvillian
superoperator.
","[{""version"":""v1"",""created"":""Sun, 16 Apr 2023 07:23:07 GMT""}]","2023-04-18"
"2304.07711","Wendong Zhang","Wendong Zhang and Qingjie Chai and Quanqi Zhang and Chengwei Wu","Obstacle-Transformer: A Trajectory Prediction Network Based on
  Surrounding Trajectories","8 pages, 4 figures","IET Cyber-Systems and Robotics, 2023, 5(1), e12066","10.1049/csy2.12066",,"cs.CV","http://arxiv.org/licenses/nonexclusive-distrib/1.0/","  Recurrent Neural Network, Long Short-Term Memory, and Transformer have made
great progress in predicting the trajectories of moving objects. Although the
trajectory element with the surrounding scene features has been merged to
improve performance, there still exist some problems to be solved. One is that
the time series processing models will increase the inference time with the
increase of the number of prediction sequences. Another lies in which the
features can not be extracted from the scene's image and point cloud in some
situations. Therefore, this paper proposes an Obstacle-Transformer to predict
trajectory in a constant inference time. An ``obstacle'' is designed by the
surrounding trajectory rather than images or point clouds, making
Obstacle-Transformer more applicable in a wider range of scenarios. Experiments
are conducted on ETH and UCY data sets to verify the performance of our model.
","[{""version"":""v1"",""created"":""Sun, 16 Apr 2023 07:26:59 GMT""}]","2023-04-18"
"2304.07712","Yaolong Zhang","Yaolong Zhang and Bin Jiang","Universal Machine Learning for the Response of Atomistic Systems to
  External Fields","8 figures",,,,"physics.chem-ph","http://arxiv.org/licenses/nonexclusive-distrib/1.0/","  Machine learned interatomic interaction potentials have enabled efficient and
accurate molecular simulations of closed systems. However, external fields,
which can greatly change the chemical structure and/or reactivity, have been
seldom included in current machine learning models. This work proposes a
universal field-induced recursively embedded atom neural network (FIREANN)
model, which integrates a pseudo field vector-dependent feature into atomic
descriptors to represent system-field interactions with rigorous rotational
equivariance. This ""one-for-all"" approach correlates various response
properties like dipole moment and polarizability with the field-dependent
potential energy in a single model, very suitable for spectroscopic and
dynamics simulations in both molecular and periodic systems in the presence of
electric fields. Especially for periodic systems, we find that FIREANN can
overcome the intrinsic multiple-value issue of the polarization by training
atomic forces only. This model paves the way to efficiently modeling
complicated systems in strong external fields such as electrified interfaces.
","[{""version"":""v1"",""created"":""Sun, 16 Apr 2023 07:32:14 GMT""}]","2023-04-18"
"2304.07713","Stefano Longhi","Stefano Longhi","Anderson localization without eigenstates in photonic quantum walks","5 pages, 4 figures, to appear in Optics Letters",,"10.1364/OL.484924",,"cond-mat.dis-nn physics.optics quant-ph","http://arxiv.org/licenses/nonexclusive-distrib/1.0/","  Anderson localization is ubiquitous in wavy systems with strong static and
uncorrelated disorder. The delicate destructive interference underlying
Anderson localization is usually washed out in the presence of temporal
fluctuations or aperiodic drives in the Hamiltonian, leading to delocalization
and restoring transport. However, in one-dimensional lattices with off-diagonal
disorder Anderson localization can persist for arbitrary time-dependent
drivings that do not break a hidden conservation law originating from the
chiral symmetry, leading to the dubbed 'localization without eigenstates'. Here
it is shown that such an intriguing phenomenon can be observed in discrete-time
photonic quantum walks with static disorder applied to the coin operator, and
can be extended to non-Hermitian dynamics as well.
","[{""version"":""v1"",""created"":""Sun, 16 Apr 2023 07:36:28 GMT""}]","2023-05-10"
"2304.07714","Xunjiang Luo","Xun-Jiang Luo","The generalization of Benalcazar-Bernevig-Hughes model to arbitrary
  dimensions",,,,,"cond-mat.mes-hall","http://arxiv.org/licenses/nonexclusive-distrib/1.0/","  The Benalcazar-Bernevig-Hughes (BBH) model [Science 357, 61 (2017)],
featuring bulk quadrupole moment, edge dipole moments, and corner states, is a
paradigm of both higher-order topological insulators and topological multipole
insulators. In this work, we generalize the BBH model to arbitrary dimensions
and demonstrate the bulk multipole moment. In our demonstration, the analytical
solution of corner states can be directly constructed, which possesses a
unified and elegant form. Based on the corner states solution and chiral
symmetries analysis, we develop a general boundary projection method to extract
the boundary Hamiltonians, which thoroughly reveals the boundary-localized
multipole moments of lower dimension, the hallmark of topological multipole
insulators. Our work facilitates the unified understanding of topological
multipole insulators and unveils their cascade hierarchy versatilely.
","[{""version"":""v1"",""created"":""Sun, 16 Apr 2023 07:40:09 GMT""}]","2023-04-18"
"2304.07715","Ruofan Jiang","Ruofan Jiang","Almost ordinary Abelian surfaces over global function fields with
  application to integral points",,,,,"math.NT math.AG","http://creativecommons.org/licenses/by/4.0/","  Let $A$ be a non-isotrivial almost ordinary Abelian surface with possibly bad
reductions over a global function field of odd characteristic $p$. Suppose
$\Delta$ is an infinite set of positive integers, such that
$\left(\frac{m}{p}\right)=1$ for $\forall m\in \Delta$. If $A$ doesn't admit
any global real multiplication, we prove the existence of infinitely many
places modulo which the reduction of $A$ has endomorphism ring containing
$\mathbb{Z}[x]/(x^2-m)$ for some $m\in \Delta$. This generalizes the
$S$-integrality conjecture for elliptic curves over number fields, as proved in
arXiv:math/0509485, to the setting of Abelian surfaces over global function
fields. As a corollary, we show that there are infinitely many places modulo
which $A$ is not simple, generalizing the main result of arXiv:1812.11679 to
the non-ordinary case.
","[{""version"":""v1"",""created"":""Sun, 16 Apr 2023 07:52:59 GMT""}]","2023-04-18"
"2304.07716","Moustapha Diaby","Moustapha Diaby, Mark Karwan, and Lei Sun","On modeling NP-Complete problems as polynomial-sized linear programs:
  Escaping/Side-stepping the ""barriers""","24 pages; 4 figures; 2 tables; Version 2: Minor typos corrected;
  Version 3: Discussion/editorial clarification in section 2.2.1 (last
  paragraph); This version (4): Further clarification in last paragraph of
  section 2.2.1",,,,"cs.CC cs.DS math.OC","http://creativecommons.org/licenses/by-nc-nd/4.0/","  In view of the extended formulations (EFs) developments (e.g. ""Fiorini, S.,
S. Massar, S. Pokutta, H.R. Tiwary, and R. de Wolf [2015]. Exponential Lower
Bounds for Polytopes in Combinatorial Optimization. Journal of the ACM 62:2""),
we focus in this paper on the question of whether it is possible to model an
NP-Complete problem as a polynomial-sized linear program. For the sake of
simplicity of exposition, the discussions are focused on the TSP. We show that
a finding that there exists no polynomial-sized extended formulation of ""the
TSP polytope"" does not (necessarily) imply that it is ""impossible"" for a
polynomial-sized linear program to solve the TSP optimization problem. We show
that under appropriate conditions the TSP optimization problem can be solved
without recourse to the traditional city-to-city (""travel leg"") variables,
thereby side-stepping/""escaping from"" ""the TSP polytope"" and hence, the
barriers. Some illustrative examples are discussed.
","[{""version"":""v1"",""created"":""Sun, 16 Apr 2023 07:56:26 GMT""},{""version"":""v2"",""created"":""Sat, 22 Apr 2023 23:07:03 GMT""},{""version"":""v3"",""created"":""Thu, 11 May 2023 01:38:56 GMT""},{""version"":""v4"",""created"":""Wed, 7 Jun 2023 19:26:58 GMT""}]","2023-06-09"
"2304.07717","Shinzo Bannai","Shinzo Bannai, Hiro-o Tokunaga and Emiko Yorisaki","Ramified and Split models of elliptic surfaces and bitangent lines of
  quartic curves","16 pages",,,,"math.AG","http://arxiv.org/licenses/nonexclusive-distrib/1.0/","  We define ramified and split models of elliptic surfaces and study the
relation between the two models. We focus on certain rational elliptic surfaces
from these points of views and as an application, we give an observation on
bitantgent lines of an irreducible quartic with at most nodes.
","[{""version"":""v1"",""created"":""Sun, 16 Apr 2023 08:03:38 GMT""}]","2023-04-18"
"2304.07718","Yongchan Kwon","Yongchan Kwon, James Zou","Data-OOB: Out-of-bag Estimate as a Simple and Efficient Data Value","18 pages, to be published at ICML 2023",,,,"cs.LG stat.ML","http://creativecommons.org/licenses/by-sa/4.0/","  Data valuation is a powerful framework for providing statistical insights
into which data are beneficial or detrimental to model training. Many
Shapley-based data valuation methods have shown promising results in various
downstream tasks, however, they are well known to be computationally
challenging as it requires training a large number of models. As a result, it
has been recognized as infeasible to apply to large datasets. To address this
issue, we propose Data-OOB, a new data valuation method for a bagging model
that utilizes the out-of-bag estimate. The proposed method is computationally
efficient and can scale to millions of data by reusing trained weak learners.
Specifically, Data-OOB takes less than 2.25 hours on a single CPU processor
when there are $10^6$ samples to evaluate and the input dimension is 100.
Furthermore, Data-OOB has solid theoretical interpretations in that it
identifies the same important data point as the infinitesimal jackknife
influence function when two different points are compared. We conduct
comprehensive experiments using 12 classification datasets, each with thousands
of sample sizes. We demonstrate that the proposed method significantly
outperforms existing state-of-the-art data valuation methods in identifying
mislabeled data and finding a set of helpful (or harmful) data points,
highlighting the potential for applying data values in real-world applications.
","[{""version"":""v1"",""created"":""Sun, 16 Apr 2023 08:03:58 GMT""},{""version"":""v2"",""created"":""Fri, 28 Apr 2023 04:10:43 GMT""},{""version"":""v3"",""created"":""Thu, 1 Jun 2023 04:03:02 GMT""}]","2023-06-02"
"2304.07719","Prasenjit Sanyal","Tanmoy Mondal, Stefano Moretti, Shoaib Munir and Prasenjit Sanyal","Electroweak multi-Higgs production: A smoking gun for the Type-I 2HDM","8 pages, 6 figures",,,,"hep-ph","http://creativecommons.org/licenses/by/4.0/","  Extending the Higgs sector of the Standard Model (SM) by just one additional
Higgs doublet field leads to the 2-Higgs Doublet Model (2HDM). In the Type-I
$Z_2$-symmetric limit of the 2HDM, all the five new physical Higgs states can
be fairly light, $\mathcal{O}(100)$\,GeV or less, without being in conflict
with current data from the direct Higgs boson searches and the $B$-physics
measurements. In this article, we establish that the new neutral as well
charged Higgs bosons in this model can all be simultaneously observable in the
multi-$b$ final state. The statistical significance of the signature for each
of these Higgs states, resulting from the Electro-Weak (EW) production of their
pairs, can exceed 5$\sigma$ at the 13\,TeV High-Luminosity Large Hadron
Collider (HL-LHC) with 3000\,fb$^{-1}$ integrated luminosity. Since the
parameter space configurations where this is achievable are precluded in the
other, more extensively pursued, 2HDM Types, an experimental validation of our
findings would be a clear indication that the true underlying Higgs sector in
nature is the Type-I 2HDM.
","[{""version"":""v1"",""created"":""Sun, 16 Apr 2023 08:05:53 GMT""}]","2023-04-18"
"2304.07720","Laura Magrini","A. Hourihane, P. Francois, C. C. Worley, L. Magrini, A. Gonneau, A. R.
  Casey, G. Gilmore, S. Randich, G. G. Sacco, A. Recio-Blanco, A. J. Korn, C.
  Allende Prieto, R. Smiljanic, R. Blomme, A. Bragaglia, N. A. Walton, S. Van
  Eck, T. Bensby, A Lanzafame, A. Frasca, E. Franciosini, F. Damiani, K. Lind,
  M. Bergemann, P. Bonifacio, V. Hill, A. Lobel, D. Montes, D. K. Feuillet, G.
  Tautvaisene, G. Guiglion, H. M. Tabernero, J. I. Gonzalez Hernandez, M.
  Gebran, M. Van der Swaelmen, Mikolaitis, S. Daflon, T. Merle, T. Morel, J. R.
  Lewis, E. A. Gonzalez Solares, D. N. A. Murphy, R. D. Jeffries, R. J.
  Jackson, S. Feltzing, T. Prusti, G. Carraro, K. Biazzo, L. Prisinzano, P.
  Jofre, S. Zaggia, A. Drazdauskas, E. Stonkute, E. Marfil, F. Jimenez-Esteban,
  L. Mahy, M. L. Gutierrez Albarran, S. R. Berlanas, W. Santos, L. Morbidelli,
  L. Spina, R. Minkeviciute","The Gaia-ESO Survey: homogenisation of stellar parameters and elemental
  abundances","A&A accepted, minor revision, 36 pages, 38 figures",,,,"astro-ph.SR astro-ph.GA","http://arxiv.org/licenses/nonexclusive-distrib/1.0/","  The Gaia-ESO Survey is a public spectroscopic survey that has targeted
$\gtrsim10^5$ stars covering all major components of the Milky Way from the end
of 2011 to 2018, delivering its public final release in May 2022. Unlike other
spectroscopic surveys, Gaia-ESO is the only survey that observed stars across
all spectral types with dedicated, specialised analyses: from O
($T_\mathrm{eff} \sim 30,000-52,000$~K) all the way to K-M ($\gtrsim$3,500~K).
The physics throughout these stellar regimes varies significantly, which has
previously prohibited any detailed comparisons between stars of significantly
different type. In the final data release (internal data release 6) of the
Gaia-ESO Survey, we provide the final database containing a large number of
products such as radial velocities, stellar parameters and elemental
abundances, rotational velocity, and also, e.g., activity and accretion
indicators in young stars and membership probability in star clusters for more
than 114,000 stars. The spectral analysis is coordinated by a number of Working
Groups (WGs) within the Survey, which specialise in the various stellar
samples. Common targets are analysed across WGs to allow for comparisons (and
calibrations) amongst instrumental setups and spectral types. Here we describe
the procedures employed to ensure all Survey results are placed on a common
scale to arrive at a single set of recommended results for all Survey
collaborators to use. We also present some general quality and consistency
checks performed over all Survey results.
","[{""version"":""v1"",""created"":""Sun, 16 Apr 2023 08:11:36 GMT""}]","2023-04-18"
"2304.07721","Ghanta Sai Krishna","Prathistith Raj Medi, Ghanta Sai Krishna, Praneeth Nemani,
  Satyanarayana Vollala, Santosh Kumar","A Novel end-to-end Framework for Occluded Pixel Reconstruction with
  Spatio-temporal Features for Improved Person Re-identification",,,,,"cs.CV","http://creativecommons.org/licenses/by/4.0/","  Person re-identification is vital for monitoring and tracking crowd movement
to enhance public security. However, re-identification in the presence of
occlusion substantially reduces the performance of existing systems and is a
challenging area. In this work, we propose a plausible solution to this problem
by developing effective occlusion detection and reconstruction framework for
RGB images/videos consisting of Deep Neural Networks. Specifically, a CNN-based
occlusion detection model classifies individual input frames, followed by a
Conv-LSTM and Autoencoder to reconstruct the occluded pixels corresponding to
the occluded frames for sequential (video) and non-sequential (image) data,
respectively. The quality of the reconstructed RGB frames is further refined
and fine-tuned using a Conditional Generative Adversarial Network (cGAN). Our
method is evaluated on four well-known public data sets of the domain, and the
qualitative reconstruction results are indeed appealing. Quantitative
evaluation in terms of re-identification accuracy of the Siamese network showed
an exceptional Rank-1 accuracy after occluded pixel reconstruction on various
datasets. A comparative analysis with state-of-the-art approaches also
demonstrates the robustness of our work for use in real-life surveillance
systems.
","[{""version"":""v1"",""created"":""Sun, 16 Apr 2023 08:14:29 GMT""}]","2023-04-18"
"2304.07722","Sara Saeidian","Sara Saeidian (1), Giulia Cervia (2), Tobias J. Oechtering (1), Mikael
  Skoglund (1) ((1) KTH Royal Institute of Technology, (2) IMT Nord Europe)","Pointwise Maximal Leakage on General Alphabets","Accepted for presentation at ISIT2023",,,,"cs.IT cs.CR math.IT","http://arxiv.org/licenses/nonexclusive-distrib/1.0/","  Pointwise maximal leakage (PML) is an operationally meaningful privacy
measure that quantifies the amount of information leaking about a secret $X$ to
a single outcome of a related random variable $Y$. In this paper, we extend the
notion of PML to random variables on arbitrary probability spaces. We develop
two new definitions: First, we extend PML to countably infinite random
variables by considering adversaries who aim to guess the value of discrete
(finite or countably infinite) functions of $X$. Then, we consider adversaries
who construct estimates of $X$ that maximize the expected value of their
corresponding gain functions. We use this latter setup to introduce a highly
versatile form of PML that captures many scenarios of practical interest whose
definition requires no assumptions about the underlying probability spaces.
","[{""version"":""v1"",""created"":""Sun, 16 Apr 2023 08:19:52 GMT""}]","2023-04-18"
"2304.07723","Yihua Bai Bai","Yihua Bai, Qing Zhang, Tan Zhang, Haoran Lv, Jiadian Yan, Jiandong
  Wang, Shenhe Fu, Guangwei Hu, Cheng-Wei Qiu and Yuanjie Yang","Airy-like hyperbolic shear polariton in high symmetry van der Waals
  crystals",,,,,"physics.optics","http://arxiv.org/licenses/nonexclusive-distrib/1.0/","  Controlling light at the nanoscale by exploiting ultra-confined polaritons -
hybrid light and matter waves - in various van der Waals (vdW) materials
empowers unique opportunities for many nanophotonic on-chip technologies. So
far, mainstream approaches have relied interfacial techniques (e.g., refractive
optics, meta-optics and moire engineering) to manipulate polariton wavefront.
Here, we propose that orbital angular momentum (OAM) of incident light could
offer a new degree of freedom to structure vdW polaritons. With vortex
excitations, we observed a new class of accelerating polariton waves -
Airy-like hyperbolic phonon polaritons (PhPs) in high-symmetry orthorhombic vdW
crystal {\alpha}-MoO3. In analogous to the well-known Airy beams in free space,
such Airy-like PhPs also exhibit self-accelerating, nonspreading and
self-healing characteristics. Interestingly, the helical phase gradient of
vortex beam leads to asymmetry excitation of polaritons, as a result, the
Airy-like PhPs possess asymmetric propagation feature even with a symmetric
mode, analogous to the asymmetry hyperbolic shear polaritons in low-symmetry
crystals. Our finding highlights the potential of OAM to manipulate polaritons
in vdW materials, which could be further extended into a variety of
applications such as active structured polaritonic devices.
","[{""version"":""v1"",""created"":""Sun, 16 Apr 2023 08:24:28 GMT""}]","2023-04-18"
"2304.07724","Zhifeng Ma","Zhifeng Ma, Hao Zhang, Jie Liu","MS-LSTM: Exploring Spatiotemporal Multiscale Representations in Video
  Prediction Domain","arXiv admin note: substantial text overlap with arXiv:2206.03010",,,,"cs.CV","http://arxiv.org/licenses/nonexclusive-distrib/1.0/","  The drastic variation of motion in spatial and temporal dimensions makes the
video prediction task extremely challenging. Existing RNN models obtain higher
performance by deepening or widening the model. They obtain the multi-scale
features of the video only by stacking layers, which is inefficient and brings
unbearable training costs (such as memory, FLOPs, and training time). Different
from them, this paper proposes a spatiotemporal multi-scale model called
MS-LSTM wholly from a multi-scale perspective. On the basis of stacked layers,
MS-LSTM incorporates two additional efficient multi-scale designs to fully
capture spatiotemporal context information. Concretely, we employ LSTMs with
mirrored pyramid structures to construct spatial multi-scale representations
and LSTMs with different convolution kernels to construct temporal multi-scale
representations. Detailed comparison experiments with eight baseline models on
four video datasets show that MS-LSTM has better performance but lower training
costs.
","[{""version"":""v1"",""created"":""Sun, 16 Apr 2023 08:25:02 GMT""},{""version"":""v2"",""created"":""Sat, 22 Apr 2023 05:38:45 GMT""}]","2023-04-25"
