"2304.07661","Xiang Cui","Xiang Cui, Alexandra Chronopoulou","Optimal Sampling for Estimation of Fractional Brownian Motion",,,,,"stat.ME math.PR math.ST stat.TH","http://arxiv.org/licenses/nonexclusive-distrib/1.0/","  In this paper, we focus on multiple sampling problems for the estimation of
the fractional Brownian motion when the maximum number of samples is limited,
extending existing results in the literature in a non-Markovian framework. Two
classes of sampling schemes are proposed: a deterministic scheme and a
level-triggered scheme. For the deterministic sampling scheme, the sampling
times are selected beforehand and do not depend on the process trajectory. For
the level-triggered sampling scheme, the sampling times are the times when the
process crosses predetermined thresholds. The sampling times are selected
sequentially in time and depend on the process trajectory. For each of the
schemes, we derive the optimal sampling times by minimizing the aggregate
squared error distortion. We then show that the optimal sampling strategies
heavily depend on the dependence structure of the process.
","[{""version"":""v1"",""created"":""Sun, 16 Apr 2023 00:08:38 GMT""}]","2023-04-18"
"2304.07662","Takayuki Myo","Takayuki Myo, Emiko Hiyama","Structure of neutron-rich He $\Lambda$ hypernuclei using the cluster
  orbital shell model","6 pages, 4 figures, typos corrected","Physical Review C 107, 054302 (2023)","10.1103/PhysRevC.107.054302",,"nucl-th nucl-ex","http://arxiv.org/licenses/nonexclusive-distrib/1.0/","  We calculated the energy spectra of the neutron-rich He $\Lambda$ hypernuclei
with $A=6$ to 9 within the framework of an $\alpha + \Lambda +Xn$ ($X=1$--4)
cluster model using the cluster orbital shell model. The employed constituent
particles reproduce their observed properties. For resonant states of core
nuclei such as $^5$He, $^6$He, and $^7$He, the complex scaling method is
employed to obtain energies and decay widths. The calculated ground states of
$^6_{\Lambda}$He and $^7_{\Lambda}$He are in good agreement with published
data. The energy levels of $^8_{\Lambda}$He and $^9_{\Lambda}$He are predicted.
In $^9_{\Lambda}$He, we find one deeply bound state and two excited resonant
states, which are proposed to be produced at the Japan proton accelerator
research complex (J-PARC) by the double-charge-exchange reaction $(\pi^-, K^+)$
using a $^9$Be target.
","[{""version"":""v1"",""created"":""Sun, 16 Apr 2023 00:44:22 GMT""},{""version"":""v2"",""created"":""Wed, 3 May 2023 23:25:00 GMT""}]","2023-05-05"
"2304.07663","Zoe Yan","Zoe Z. Yan, Yiqi Ni, Alexander Chuang, Pavel E. Dolgirev, Kushal
  Seetharam, Eugene Demler, Carsten Robens, Martin Zwierlein","Dissipationless flow in a Bose-Fermi mixture","12 pages, 10 figures",,,,"cond-mat.quant-gas cond-mat.str-el physics.atom-ph quant-ph","http://creativecommons.org/licenses/by/4.0/","  Interacting mixtures of bosons and fermions are ubiquitous in nature. They
form the backbone of the standard model of physics, provide a framework for
understanding quantum materials such as unconventional superconductors and
two-dimensional electronic systems, and are of technological importance in
$^3$He/$^4$He dilution refrigerators. Bose-Fermi mixtures are predicted to
exhibit an intricate phase diagram featuring coexisting liquids, supersolids,
composite fermions, coupled superfluids, and quantum phase transitions in
between. However, their coupled thermodynamics and collective behavior
challenge our understanding, in particular for strong boson-fermion
interactions. Clean realizations of fully controllable systems are scarce.
Ultracold atomic gases offer an ideal platform to experimentally investigate
Bose-Fermi mixtures, as the species concentration and interaction strengths can
be freely tuned. Here, we study the collective oscillations of a spin-polarized
Fermi gas immersed in a Bose-Einstein condensate (BEC) as a function of the
boson-fermion interaction strength and temperature. Remarkably, for strong
interspecies interactions the fermionic collective excitations evolve to
perfectly mimic the bosonic superfluid collective modes, and fermion flow
becomes dissipationless. With increasing number of thermal excitations in the
Bose gas, the fermions' dynamics exhibit a crossover from the collisionless to
the hydrodynamic regime, reminiscent of the emergence of hydrodynamics in
two-dimensional electron fluids. Our findings open the door towards
understanding non-equilibrium dynamics of strongly interacting Bose-Fermi
mixtures.
","[{""version"":""v1"",""created"":""Sun, 16 Apr 2023 00:58:05 GMT""}]","2023-04-18"
"2304.07664","Hsin-Po Wang","Ting-Chun Lin, Hsin-Po Wang","Optimal Self-Dual Inequalities to Order Polarized BECs","To be presented at ISIT 2023",,,,"cs.IT math.IT","http://arxiv.org/licenses/nonexclusive-distrib/1.0/","  $1 - (1-x^M) ^ {2^M} > (1 - (1-x)^M) ^{2^M}$ is proved for all $x \in [0,1]$
and all $M > 1$. This confirms a conjecture about polar code, made by Wu and
Siegel in 2019, that $W^{0^m 1^M}$ is more reliable than $W^{1^m 0^M}$, where
$W$ is any binary erasure channel and $M = 2^m$. The proof relies on a
remarkable relaxation that $m$ needs not be an integer, a cleverly crafted
hexavariate ordinary differential equation, and a genius generalization of
Green's theorem that concerns function composition. The resulting inequality is
optimal, $M$ cannot be $2^m - 1$, witnessing how far polar code deviates from
Reed--Muller code.
","[{""version"":""v1"",""created"":""Sun, 16 Apr 2023 01:31:18 GMT""}]","2023-04-18"
"2304.07665","Upala Junaida Islam","Upala Junaida Islam and Kamran Paynabar and George Runger and Ashif
  Sikandar Iquebal","Dynamic Exploration-Exploitation Trade-Off in Active Learning Regression
  with Bayesian Hierarchical Modeling","31 pages, 8 figures, 1 table, submitted to IISE Transaction",,,,"cs.LG stat.ML","http://arxiv.org/licenses/nonexclusive-distrib/1.0/","  Active learning provides a framework to adaptively sample the most
informative experiments towards learning an unknown black-box function. Various
approaches of active learning have been proposed in the literature, however,
they either focus on exploration or exploitation in the design space. Methods
that do consider exploration-exploitation simultaneously employ fixed or ad-hoc
measures to control the trade-off that may not be optimal. In this paper, we
develop a Bayesian hierarchical approach to dynamically balance the
exploration-exploitation trade-off as more data points are queried. We
subsequently formulate an approximate Bayesian computation approach based on
the linear dependence of data samples in the feature space to sample from the
posterior distribution of the trade-off parameter obtained from the Bayesian
hierarchical model. Simulated and real-world examples show the proposed
approach achieves at least 6% and 11% average improvement when compared to pure
exploration and exploitation strategies respectively. More importantly, we note
that by optimally balancing the trade-off between exploration and exploitation,
our approach performs better or at least as well as either pure exploration or
pure exploitation.
","[{""version"":""v1"",""created"":""Sun, 16 Apr 2023 01:40:48 GMT""}]","2023-04-18"
"2304.07666","Yikang Liu","Yikang Liu, Ziyin Zhang, Wanyang Zhang, Shisen Yue, Xiaojing Zhao,
  Xinyuan Cheng, Yiwen Zhang, Hai Hu","ArguGPT: evaluating, understanding and identifying argumentative essays
  generated by GPT models",,,,,"cs.CL","http://arxiv.org/licenses/nonexclusive-distrib/1.0/","  AI generated content (AIGC) presents considerable challenge to educators
around the world. Instructors need to be able to detect such text generated by
large language models, either with the naked eye or with the help of some
tools. There is also growing need to understand the lexical, syntactic and
stylistic features of AIGC. To address these challenges in English language
teaching, we first present ArguGPT, a balanced corpus of 4,038 argumentative
essays generated by 7 GPT models in response to essay prompts from three
sources: (1) in-class or homework exercises, (2) TOEFL and (3) GRE writing
tasks. Machine-generated texts are paired with roughly equal number of
human-written essays with three score levels matched in essay prompts. We then
hire English instructors to distinguish machine essays from human ones. Results
show that when first exposed to machine-generated essays, the instructors only
have an accuracy of 61% in detecting them. But the number rises to 67% after
one round of minimal self-training. Next, we perform linguistic analyses of
these essays, which show that machines produce sentences with more complex
syntactic structures while human essays tend to be lexically more complex.
Finally, we test existing AIGC detectors and build our own detectors using SVMs
and RoBERTa. Results suggest that a RoBERTa fine-tuned with the training set of
ArguGPT achieves above 90% accuracy in both essay- and sentence-level
classification. To the best of our knowledge, this is the first comprehensive
analysis of argumentative essays produced by generative large language models.
Machine-authored essays in ArguGPT and our models will be made publicly
available at https://github.com/huhailinguist/ArguGPT
","[{""version"":""v1"",""created"":""Sun, 16 Apr 2023 01:50:26 GMT""}]","2023-04-18"
"2304.07667","Hsin-Po Wang","Hsin-Po Wang, Chi-Wei Chin","Density Devolution for Ordering Synthetic Channels","To be presented at ISIT 2023",,,,"cs.IT math.IT","http://arxiv.org/licenses/nonexclusive-distrib/1.0/","  Constructing a polar code is all about selecting a subset of rows from a
Kronecker power of $[^1_1{}^0_1]$. It is known that, under successive
cancellation decoder, some rows are Pareto-better than the other. For instance,
whenever a user sees a substring $01$ in the binary expansion of a row index
and replaces it with $10$, the user obtains a row index that is always more
welcomed. We call this a ""rule"" and denote it by $10 \succcurlyeq 01$. In
present work, we first enumerate some rules over binary erasure channels such
as $1001 \succcurlyeq 0110$ and $10001 \succcurlyeq 01010$ and $10101
\succcurlyeq 01110$. We then summarize them using a ""rule of rules"": if $10a
\succcurlyeq 01b$ is a rule, where $a$ and $b$ are arbitrary binary strings,
then $100a \succcurlyeq 010b$ and $101a \succcurlyeq 011b$ are rules. This
work's main contribution is using field theory, Galois theory, and numerical
analysis to develop an algorithm that decides if a rule of rules is
mathematically sound. We apply the algorithm to enumerate some rules of rules.
Each rule of rule is capable of generating an infinite family of rules. For
instance, $10c01 \succcurlyeq 01c10$ for arbitrary binary string $c$ can be
generated. We found an application of $10c01 \succcurlyeq 01c10$ that is
related to integer partition and the dominance order therein.
","[{""version"":""v1"",""created"":""Sun, 16 Apr 2023 01:54:14 GMT""}]","2023-04-18"
"2304.07668","Nazar Waheed","Nazar Waheed, Ateeq Ur Rehman, Anushka Nehra, Mahnoor Farooq, Nargis
  Tariq, Mian Ahmad Jan, Fazlullah Khan, Abeer Z. Alalmaie, Priyadarsi Nanda","FedBlockHealth: A Synergistic Approach to Privacy and Security in
  IoT-Enabled Healthcare through Federated Learning and Blockchain","Submitted to: Globecom 2023",,,,"cs.CR cs.AI cs.LG","http://creativecommons.org/licenses/by/4.0/","  The rapid adoption of Internet of Things (IoT) devices in healthcare has
introduced new challenges in preserving data privacy, security and patient
safety. Traditional approaches need to ensure security and privacy while
maintaining computational efficiency, particularly for resource-constrained IoT
devices. This paper proposes a novel hybrid approach combining federated
learning and blockchain technology to provide a secure and privacy-preserved
solution for IoT-enabled healthcare applications. Our approach leverages a
public-key cryptosystem that provides semantic security for local model
updates, while blockchain technology ensures the integrity of these updates and
enforces access control and accountability. The federated learning process
enables a secure model aggregation without sharing sensitive patient data. We
implement and evaluate our proposed framework using EMNIST datasets,
demonstrating its effectiveness in preserving data privacy and security while
maintaining computational efficiency. The results suggest that our hybrid
approach can significantly enhance the development of secure and
privacy-preserved IoT-enabled healthcare applications, offering a promising
direction for future research in this field.
","[{""version"":""v1"",""created"":""Sun, 16 Apr 2023 01:55:31 GMT""}]","2023-04-18"
"2304.07669","Saleh Naqib","M. I. Naher, M. A. Ali, M. M. Hossain, M. M. Uddin, S. H. Naqib","A comprehensive ab-initio insights into the pressure dependent
  mechanical, phonon, bonding, electronic, optical, and thermal properties of
  CsV3Sb5 Kagome compound",,,,,"cond-mat.mtrl-sci","http://creativecommons.org/licenses/by/4.0/","  In this paper, we have presented a comprehensive study of the physical
properties of Kagome superconductor CsV3Sb5 using the density functional theory
(DFT). The structural, mechanical, electronic, atomic bonding, hardness,
thermodynamic, and optical properties, and their pressure dependences have been
investigated for the first time. The calculated ground state lattice parameters
and volume are in excellent agreement with available experimental results. The
estimated single-crystal elastic constants ensured the mechanical stability of
the compound, whereas phonon spectra endorse dynamical stability at zero
pressure. The electronic band structure, energy density of states, optical
properties confirmed the metallic features. The Pugh ratio, Poisson's ratio of
the compound revealed softness and ductility. The hardness, estimated from
several formulae, is quite low while the machinability index predicted good
machinability with excellent dry lubricating properties. The compound shows
tendency towards structural instability at a pressure around 18 GPa. The
optical constants have also been studied to correlate those with electronic
properties and to predict possible applications of this compound. Both
mechanical and optical properties show anisotropy.CsV3Sb5 is predicted to be an
efficient absorber of ultraviolet radiation. The compound is also an efficient
reflector of visible light.
","[{""version"":""v1"",""created"":""Sun, 16 Apr 2023 02:00:18 GMT""}]","2023-04-18"
"2304.07670","Davin Hill","Aria Masoomi, Davin Hill, Zhonghui Xu, Craig P Hersh, Edwin K.
  Silverman, Peter J. Castaldi, Stratis Ioannidis, Jennifer Dy","Explanations of Black-Box Models based on Directional Feature
  Interactions",,"International Conference on Learning Representations, 2022",,,"cs.LG","http://creativecommons.org/licenses/by/4.0/","  As machine learning algorithms are deployed ubiquitously to a variety of
domains, it is imperative to make these often black-box models transparent.
Several recent works explain black-box models by capturing the most influential
features for prediction per instance; such explanation methods are univariate,
as they characterize importance per feature. We extend univariate explanation
to a higher-order; this enhances explainability, as bivariate methods can
capture feature interactions in black-box models, represented as a directed
graph. Analyzing this graph enables us to discover groups of features that are
equally important (i.e., interchangeable), while the notion of directionality
allows us to identify the most influential features. We apply our bivariate
method on Shapley value explanations, and experimentally demonstrate the
ability of directional explanations to discover feature interactions. We show
the superiority of our method against state-of-the-art on CIFAR10, IMDB,
Census, Divorce, Drug, and gene data.
","[{""version"":""v1"",""created"":""Sun, 16 Apr 2023 02:00:25 GMT""}]","2023-04-18"
"2304.07671","Paolo Piersanti","Xin Peng, Paolo Piersanti and Xiaoqin Shen","Numerical approximation of the solution of Koiter's model for an
  elliptic membrane shell subjected to an obstacle via the penalty method",,,,,"math.NA cs.NA math.AP","http://creativecommons.org/licenses/by/4.0/","  This paper is devoted to the analysis of a numerical scheme based on the
Finite Element Method for approximating the solution of Koiter's model for a
linearly elastic elliptic membrane shell subjected to remaining confined in a
prescribed half-space.
  First, we show that the solution of the obstacle problem under consideration
is uniquely determined and satisfies a set of variational inequalities which
are governed by a fourth order elliptic operator, and which are posed over a
non-empty, closed, and convex subset of a suitable space.
  Second, we show that the solution of the obstacle problem under consideration
can be approximated by means of the penalty method.
  Third, we show that the solution of the corresponding penalised problem is
more regular up to the boundary.
  Fourth, we write down the mixed variational formulation corresponding to the
penalised problem under consideration, and we show that the solution of the
mixed variational formulation is more regular up to the boundary as well. In
view of this result concerning the augmentation of the regularity of the
solution of the mixed penalised problem, we are able to approximate the
solution of the one such problem by means of a Finite Element scheme.
  Finally, we present numerical experiments corroborating the validity of the
mathematical results we obtained.
","[{""version"":""v1"",""created"":""Sun, 16 Apr 2023 02:09:53 GMT""}]","2023-04-18"
"2304.07672","Qiang Zhang","Yingting Miao and Qiang Zhang","Optimal Investment and Consumption Strategies with General and Linear
  Transaction Costs under CRRA Utility",,,,,"q-fin.PM","http://arxiv.org/licenses/nonexclusive-distrib/1.0/","  Transaction costs play a critical role in asset allocation and consumption
strategies in portfolio management. We apply the methods of dynamic programming
and singular perturbation expansion to derive the closed-form leading solutions
to this problem for small transaction costs with arbitrary transaction cost
structure by maximizing the expected CRRA (constant relative risk aversion)
utility function for this problem. We also discuss in detail the case which
consists of both fixed and proportional transaction costs.
","[{""version"":""v1"",""created"":""Sun, 16 Apr 2023 02:17:05 GMT""}]","2023-04-18"
"2304.07673","Dan Li","Ahmad Kokhahi, Dan Li","GLHAD: A Group Lasso-based Hybrid Attack Detection and Localization
  Framework for Multistage Manufacturing Systems",,,,,"stat.AP cs.SY eess.SY","http://arxiv.org/licenses/nonexclusive-distrib/1.0/","  As Industry 4.0 and digitalization continue to advance, the reliance on
information technology increases, making the world more vulnerable to
cyber-attacks, especially cyber-physical attacks that can manipulate physical
systems and compromise operational data integrity. Detecting cyber-attacks in
multistage manufacturing systems (MMS) is crucial due to the growing
sophistication of attacks and the complexity of MMS. Attacks can propagate
throughout the system, affecting subsequent stages and making detection more
challenging than in single-stage systems. Localization is also critical due to
the complex interactions in MMS. To address these challenges, a group lasso
regression-based framework is proposed to detect and localize attacks in MMS.
The proposed algorithm outperforms traditional hypothesis testing-based methods
in expected detection delay and localization accuracy, as demonstrated in a
linear multistage manufacturing system.
","[{""version"":""v1"",""created"":""Sun, 16 Apr 2023 02:31:08 GMT""}]","2023-04-18"
"2304.07674","Nathan Klein","Nathan Klein and Neil Olver","Thin trees for laminar families",,,,,"cs.DS","http://arxiv.org/licenses/nonexclusive-distrib/1.0/","  In the laminar-constrained spanning tree problem, the goal is to find a
minimum-cost spanning tree which respects upper bounds on the number of times
each cut in a given laminar family is crossed. This generalizes the
well-studied degree-bounded spanning tree problem, as well as a previously
studied setting where a chain of cuts is given. We give the first
constant-factor approximation algorithm; in particular we show how to obtain a
multiplicative violation of the crossing bounds of less than 22 while losing
less than a factor of 5 in terms of cost.
  Our result compares to the natural LP relaxation. As a consequence, our
results show that given a $k$-edge-connected graph and a laminar family
$\mathcal{L} \subseteq 2^V$ of cuts, there exists a spanning tree which
contains only an $O(1/k)$ fraction of the edges across every cut in
$\mathcal{L}$. This can be viewed as progress towards the Thin Tree Conjecture,
which (in a strong form) states that this guarantee can be obtained for all
cuts simultaneously.
","[{""version"":""v1"",""created"":""Sun, 16 Apr 2023 02:33:04 GMT""}]","2023-04-18"
"2304.07675","Jielin Qiu","Jielin Qiu, Peide Huang, Makiya Nakashima, Jaehyun Lee, Jiacheng Zhu,
  Wilson Tang, Pohao Chen, Christopher Nguyen, Byung-Hak Kim, Debbie Kwon,
  Douglas Weber, Ding Zhao, David Chen","Multimodal Representation Learning of Cardiovascular Magnetic Resonance
  Imaging","24 pages",,,,"cs.CV","http://arxiv.org/licenses/nonexclusive-distrib/1.0/","  Self-supervised learning is crucial for clinical imaging applications, given
the lack of explicit labels in healthcare. However, conventional approaches
that rely on precise vision-language alignment are not always feasible in
complex clinical imaging modalities, such as cardiac magnetic resonance (CMR).
CMR provides a comprehensive visualization of cardiac anatomy, physiology, and
microstructure, making it challenging to interpret. Additionally, CMR reports
require synthesizing information from sequences of images and different views,
resulting in potentially weak alignment between the study and diagnosis report
pair. To overcome these challenges, we propose \textbf{CMRformer}, a multimodal
learning framework to jointly learn sequences of CMR images and associated
cardiologist's reports. Moreover, one of the major obstacles to improving CMR
study is the lack of large, publicly available datasets. To bridge this gap, we
collected a large \textbf{CMR dataset}, which consists of 13,787 studies from
clinical cases. By utilizing our proposed CMRformer and our collected dataset,
we achieved remarkable performance in real-world clinical tasks, such as CMR
image retrieval and diagnosis report retrieval. Furthermore, the learned
representations are evaluated to be practically helpful for downstream
applications, such as disease classification. Our work could potentially
expedite progress in the CMR study and lead to more accurate and effective
diagnosis and treatment.
","[{""version"":""v1"",""created"":""Sun, 16 Apr 2023 02:35:27 GMT""}]","2023-04-18"
"2304.07676","Nazar Waheed","Nazar Waheed, Fazlullah Khan, Mian Ahmad Jan, Abeer Z. Alalmaie,
  Priyadarsi Nanda","Privacy-Enhanced Living: A Local Differential Privacy Approach to Secure
  Smart Home Data","Submitted to IEEE COINS",,,,"cs.CR","http://creativecommons.org/licenses/by/4.0/","  The rapid expansion of Internet of Things (IoT) devices in smart homes has
significantly improved the quality of life, offering enhanced convenience,
automation, and energy efficiency. However, this proliferation of connected
devices raises critical concerns regarding security and privacy of the user
data. In this paper, we propose a differential privacy-based system to ensure
comprehensive security for data generated by smart homes. We employ the
randomized response technique for the data and utilize Local Differential
Privacy (LDP) to achieve data privacy. The data is then transmitted to an
aggregator, where an obfuscation method is applied to ensure individual
anonymity. Furthermore, we implement the Hidden Markov Model (HMM) technique at
the aggregator level and apply differential privacy to the private data
received from smart homes. Consequently, our approach achieves a dual layer of
privacy protection, addressing the security concerns associated with IoT
devices in smart cities.
","[{""version"":""v1"",""created"":""Sun, 16 Apr 2023 02:36:32 GMT""},{""version"":""v2"",""created"":""Tue, 2 May 2023 19:59:14 GMT""}]","2023-05-04"
"2304.07677","Peter Harrowell","Richard K Bowles, Peter Harrowell","Crystal Growth Rates from Molecular Liquids: The Kinetics of Entropy
  Loss",,,,,"cond-mat.soft cond-mat.mtrl-sci","http://creativecommons.org/licenses/by-nc-sa/4.0/","  It has been established empirically that the rate of addition of molecules to
the crystal during crystal growth from the melt is proportional to
exp(-|{\Delta}S_fus|/R) where {\Delta}S_fus is the entropy of fusion. Here we
show that this entropic slowdown arises directly from the separation of the
entropy loss and energy loss processes associated with the freezing of the
liquid. We present a theoretical treatment of the kinetics based on a model
flat energy landscape and derive an explicit expression for the coupling
magnitude in terms of the crystal-melt interfacial free energy. The
implications of our work for nucleation kinetics are also discussed.
","[{""version"":""v1"",""created"":""Sun, 16 Apr 2023 02:57:44 GMT""}]","2023-04-18"
