"2304.07588","Alexandre Bousse","Alexandre Bousse, Venkata Sai Sundar Kandarpa, Simon Rit, Alessandro
  Perelli, Mengzhou Li, Guobao Wang, Jian Zhou, Ge Wang","Systematic Review on Learning-based Spectral CT","28 pages, 9 figures",,,,"physics.med-ph eess.IV","http://creativecommons.org/licenses/by/4.0/","  Spectral computed tomography (CT) has recently emerged as an advanced version
of medical CT and significantly improves conventional (single-energy) CT.
Spectral CT has two main forms: dual-energy computed tomography (DECT) and
photon-counting computed tomography (PCCT), which offer image improvement,
material decomposition, and feature quantification relative to conventional CT.
However, the inherent challenges of spectral CT, evidenced by data and image
artifacts, remain a bottleneck for clinical applications. To address these
problems, machine learning techniques have been widely applied to spectral CT.
In this review, we present the state-of-the-art data-driven techniques for
spectral CT.
","[{""version"":""v1"",""created"":""Sat, 15 Apr 2023 16:07:31 GMT""}]","2023-04-18"
"2304.07589","Daniel Sternheimer","Daniel Sternheimer","The reasonable effectiveness of mathematical deformation theory in
  physics","8 pages","Published pp. 131-138 in Geometric methods in physics, Trends
  Math., Birkhauser/Springer, Cham, 2019",,,"math-ph hep-th math.MP","http://arxiv.org/licenses/nonexclusive-distrib/1.0/","  This is a brief reminder, with extensions, from a different angle and for a
less specialized audience, of my presentation at WGMP32 in July 2013, to which
I refer for more details on the topics hinted at in the title, mainly
deformation theory applied to quantization and symmetries (of elementary
particles).
","[{""version"":""v1"",""created"":""Sat, 15 Apr 2023 16:24:25 GMT""}]","2023-04-18"
"2304.07590","Yihong Dong","Yihong Dong, Xue Jiang, Zhi Jin, and Ge Li","Self-collaboration Code Generation via ChatGPT",,,,,"cs.SE","http://arxiv.org/licenses/nonexclusive-distrib/1.0/","  Although Large Language Models (LLMs) have demonstrated remarkable
code-generation ability, they still struggle with complex tasks. In real-world
software development, humans usually tackle complex tasks through collaborative
teamwork, a strategy that significantly controls development complexity and
enhances software quality. Inspired by this, we present a self-collaboration
framework for code generation employing LLMs, exemplified by ChatGPT.
Specifically, through role instructions, 1) Multiple LLMs act as distinct
``experts'', each responsible for a specific subtask within a complex task; 2)
Specify the way to collaborate and interact, so that different roles form a
virtual team to facilitate each other's work, ultimately the virtual team
addresses code generation tasks collaboratively without the need for human
intervention. To effectively organize and manage this virtual team, we
incorporate software-development methodology into the framework. Thus, we
assemble an elementary team consisting of three ChatGPT roles (i.e., analyst,
coder, and tester) responsible for software development's analysis, coding, and
testing stages. We conduct comprehensive experiments on various code-generation
benchmarks. Experimental results indicate that self-collaboration code
generation relatively improves 29.9%-47.1% Pass@1 compared to direct code
generation, achieving state-of-the-art performance and even surpassing GPT-4.
Moreover, we showcase that self-collaboration could potentially enable LLMs to
efficiently handle complex real-world tasks that are not readily solved by
direct code generation, as evidenced in case study.
","[{""version"":""v1"",""created"":""Sat, 15 Apr 2023 16:33:32 GMT""},{""version"":""v2"",""created"":""Wed, 24 May 2023 17:58:54 GMT""}]","2023-05-25"
"2304.07591","Jonathan Pool","Jonathan Robert Pool","Accessibility Metatesting: Comparing Nine Testing Tools","4 pages, 5 tables, 3 supplementary files",,"10.1145/3587281.3587282",,"cs.HC cs.SE","http://creativecommons.org/licenses/by/4.0/","  Automated web accessibility testing tools have been found complementary. The
implication: To catch as many issues as possible, use multiple tools. Doing
this efficiently entails integration costs. Is there a small set of tools that,
together, make additional tools redundant? I approach this problem by comparing
nine comprehensive accessibility testing tools that are amenable to
integration: alfa, axe-core, Continuum, Equal Access, HTML CodeSniffer, Nu Html
Checker, QualWeb, Tenon, and WAVE. I tested 121 web pages of interest to CVS
Health with these tools. Each tool only fractionally duplicated any other tool.
Each discovered numerous issue instances missed by all the others. Thus,
testing with all nine tools was substantially more informative than testing
with any subset.
","[{""version"":""v1"",""created"":""Sat, 15 Apr 2023 16:38:23 GMT""}]","2023-04-18"
"2304.07592","Eliodoro Chiavazzo","Giovanni Trezza, Eliodoro Chiavazzo","Leveraging Composition-Based Material Descriptors for Machine Learning
  Optimization","34 pages, 11 figure panels in the main document, 5 figure panels in
  the supp. info, preprint",,,,"cond-mat.other","http://creativecommons.org/licenses/by/4.0/","  In this study, we evaluate several classifiers and focus on selecting a
minimal set of appropriate material features. Our objective is to propose and
discuss general strategies for reducing the number of descriptors required for
material classification. The first strategy involves testing whether the
critical temperature of the target material property is invariant with respect
to binary groups of composition-based features. We also propose a
multi-objective optimization procedure to reduce the set of composition-based
material descriptors. The latter procedure is found to be particularly useful
when applied to Bayesian classifiers. We test the proposed strategies focusing
on low-temperature superconductors material data extracted from a public
database.
","[{""version"":""v1"",""created"":""Sat, 15 Apr 2023 16:42:02 GMT""}]","2023-04-18"
"2304.07593","Pia Cuk","Pia \v{C}uk, Robin Senge, Mikko Lauri, Simone Frintrop","Teacher Network Calibration Improves Cross-Quality Knowledge
  Distillation","The implementation is available at:
  https://github.com/PiaCuk/distillistic",,,,"cs.CV cs.AI","http://arxiv.org/licenses/nonexclusive-distrib/1.0/","  We investigate cross-quality knowledge distillation (CQKD), a knowledge
distillation method where knowledge from a teacher network trained with
full-resolution images is transferred to a student network that takes as input
low-resolution images. As image size is a deciding factor for the computational
load of computer vision applications, CQKD notably reduces the requirements by
only using the student network at inference time. Our experimental results show
that CQKD outperforms supervised learning in large-scale image classification
problems. We also highlight the importance of calibrating neural networks: we
show that with higher temperature smoothing of the teacher's output
distribution, the student distribution exhibits a higher entropy, which leads
to both, a lower calibration error and a higher network accuracy.
","[{""version"":""v1"",""created"":""Sat, 15 Apr 2023 16:55:43 GMT""}]","2023-04-18"
"2304.07594","Gayatri Manjeera Jami","Jami Gayatri Manjeera, Alisha Malla, Masani Venkata Lakshmi Pravallika","Preventing Malicious Use of Keyloggers Using Anti-Keyloggers","5 Pages,4 Figures, Literature Survey, Methodology",,,,"cs.CR","http://arxiv.org/licenses/nonexclusive-distrib/1.0/","  Multinational corporations routinely track how its employees use their
computers, the internet, or email. There are roughly a thousand devices on the
market that enable businesses to monitor their workforce. Observe what their
users do online, in their emails, and on their so-called personal laptops while
at work. Our team will develop a key-logger for this Journal project that will
allow us to capture every keystroke. Additionally, it will enable us to capture
the mouse movements and clicks. This will enable us to keep an eye on how a
person uses the internet and every other application on his or her ""own""
computer. Keyloggers, on the other hand, can also be used to steal data in the
form of malware or something comparable. An anti-key logger will also be
created to address this issue, allowing us to determine whether a key logger is
already monitoring the system. We will be able to remain watchful and maintain
the security of the data on our system thanks to the anti-keylogger.
","[{""version"":""v1"",""created"":""Sat, 15 Apr 2023 16:56:24 GMT""}]","2023-04-18"
"2304.07595","Christoph Schmid","Christoph Schmid","The Gravito-Maxwell Equations of General Relativity in the local
  reference frame of a GR-noninertial observer","19 pages","Classical and Quantum Gravity 40, 055005 (2023)","10.1088/1361-6382/acb3a8",,"gr-qc","http://creativecommons.org/licenses/by-nc-nd/4.0/","  We show that the acceleration-difference of neighboring free-falling
particles (= geodesic deviation) measured in the local reference frame of a
GR-noninertial observer is not given by the Riemann tensor. With the
gravito-electric field of GR defined as the acceleration of free-falling
quasistatic particles relative to the observer, the divergence of the
gravito-electric field measured in the reference frame of a GR-noninertial
observer is different from the Ricci curvature $R^0_{\,\,0}$. We derive our
exact, explicit, and simple gravito-Gauss law for the divergence of the
gravito-electric field in our new reference frame of a GR-noninertial observer
with his LONB (Local Ortho-Normal Basis) and his LONB-connections in his time
and 3-directions: the sources of the divergence of the gravito-electric field
are contributed by all fields including the GR-gravitational fields,
gravito-electric and gravito-magnetic. In the reference frame of a GR-inertial
observer our gravito-Gauss law coincides with Einstein's $R^0_{\,\,0}$
equation, which does not have gravitational fields as sources. We derive the
gravito-Ampere law, the gravito-Faraday law and the law for the divergence of
the gravito-magnetic field. The densities of energy, momentum, and
momentum-flow of GR-gravitational fields are local observables, but depend on
observer with his local reference frame: these quantities are zero if measured
by a GR-inertial observer. For a GR-noninertial observer the sources of
gravitational energy, momentum, and momentum-flow densities have the opposite
sign from the electromagnetic and matter sources. In the gravito-Gauss law the
sources contributed by gravitational energy and momentum-flow densities have a
repulsive effect on the gravitational acceleration-difference of particles.
","[{""version"":""v1"",""created"":""Sat, 15 Apr 2023 17:03:16 GMT""}]","2023-04-18"
"2304.07596","Alisha Sharma","Alisha Sharma, Jason Geder, Joseph Lingevitch, Theodore Martin, Daniel
  Lofaro, Donald Sofge","Acoustic Beamforming for Object-relative Distance Estimation and Control
  in Unmanned Air Vehicles using Propulsion System Noise","7 pages, 12 figures",,,,"cs.RO cs.SD eess.AS","http://creativecommons.org/licenses/by/4.0/","  Unmanned air vehicles often produce significant noise from their propulsion
systems. Using this broadband signal as ""acoustic illumination"" for an
auxiliary sensing system could make vehicles more robust at a minimal cost. We
present an acoustic beamforming-based algorithm that estimates object-relative
distance with a small two-microphone array using the generated propulsion
system noise of a vehicle. We demonstrate this approach in several closed-loop
distance feedback control tests with a mounted quad-rotor vehicle in a noisy
environment and show accurate object-relative distance estimates more than 2x
further than the baseline channel-based approach. We conclude that this
approach is robust to several practical vehicle and noise situations and shows
promise for use in more complex operating environments.
","[{""version"":""v1"",""created"":""Sat, 15 Apr 2023 17:03:21 GMT""}]","2023-04-18"
"2304.07597","Christoph Reich","Christoph Reich, Tim Prangemeier, Andr\'e O. Fran\c{c}ani, Heinz
  Koeppl","An Instance Segmentation Dataset of Yeast Cells in Microstructures","IEEE EMBC 2023 (accepted), Christoph Reich and Tim Prangemeier ---
  both authors contributed equally",,,,"cs.CV","http://arxiv.org/licenses/nonexclusive-distrib/1.0/","  Extracting single-cell information from microscopy data requires accurate
instance-wise segmentations. Obtaining pixel-wise segmentations from microscopy
imagery remains a challenging task, especially with the added complexity of
microstructured environments. This paper presents a novel dataset for
segmenting yeast cells in microstructures. We offer pixel-wise instance
segmentation labels for both cells and trap microstructures. In total, we
release 493 densely annotated microscopy images. To facilitate a unified
comparison between novel segmentation algorithms, we propose a standardized
evaluation strategy for our dataset. The aim of the dataset and evaluation
strategy is to facilitate the development of new cell segmentation approaches.
The dataset is publicly available at
https://christophreich1996.github.io/yeast_in_microstructures_dataset/ .
","[{""version"":""v1"",""created"":""Sat, 15 Apr 2023 17:05:24 GMT""},{""version"":""v2"",""created"":""Sun, 23 Apr 2023 11:30:29 GMT""}]","2023-04-25"
"2304.07598","Trishie Sharma","Trishie Sharma (1), Rachit Agarwal (2) and Sandeep Kumar Shukla (1)
  ((1) Indian Institute of Technology Kanpur, India, (2) Merkle Science, India)","Understanding Rug Pulls: An In-Depth Behavioral Analysis of Fraudulent
  NFT Creators",,,,,"cs.CR","http://creativecommons.org/licenses/by/4.0/","  The explosive growth of non-fungible tokens (NFTs) on Web3 has created a new
frontier for digital art and collectibles, but also an emerging space for
fraudulent activities. This study provides an in-depth analysis of NFT rug
pulls, which are fraudulent schemes aimed at stealing investors' funds. Using
data from 758 rug pulls across 10 NFT marketplaces, we examine the structural
and behavioral properties of these schemes, identify the characteristics and
motivations of rug-pullers, and classify NFT projects into groups based on
creators' association with their accounts. Our findings reveal that repeated
rug pulls account for a significant proportion of the rise in NFT-related
cryptocurrency crimes, with one NFT collection attempting 37 rug pulls within
three months. Additionally, we identify the largest group of creators
influencing the majority of rug pulls, and demonstrate the connection between
rug-pullers of different NFT projects through the use of the same wallets to
store and move money. Our study contributes to the understanding of NFT market
risks and provides insights for designing preventative strategies to mitigate
future losses.
","[{""version"":""v1"",""created"":""Sat, 15 Apr 2023 17:10:20 GMT""}]","2023-04-18"
"2304.07599","Katiana Kontolati","Katiana Kontolati, Somdatta Goswami, George Em Karniadakis, Michael D.
  Shields","Learning in latent spaces improves the predictive accuracy of deep
  neural operators","22 pages, 12 figures",,,,"cs.LG cs.NA math.DS math.NA","http://arxiv.org/licenses/nonexclusive-distrib/1.0/","  Operator regression provides a powerful means of constructing
discretization-invariant emulators for partial-differential equations (PDEs)
describing physical systems. Neural operators specifically employ deep neural
networks to approximate mappings between infinite-dimensional Banach spaces. As
data-driven models, neural operators require the generation of labeled
observations, which in cases of complex high-fidelity models result in
high-dimensional datasets containing redundant and noisy features, which can
hinder gradient-based optimization. Mapping these high-dimensional datasets to
a low-dimensional latent space of salient features can make it easier to work
with the data and also enhance learning. In this work, we investigate the
latent deep operator network (L-DeepONet), an extension of standard DeepONet,
which leverages latent representations of high-dimensional PDE input and output
functions identified with suitable autoencoders. We illustrate that L-DeepONet
outperforms the standard approach in terms of both accuracy and computational
efficiency across diverse time-dependent PDEs, e.g., modeling the growth of
fracture in brittle materials, convective fluid flows, and large-scale
atmospheric flows exhibiting multiscale dynamical features.
","[{""version"":""v1"",""created"":""Sat, 15 Apr 2023 17:13:09 GMT""}]","2023-04-18"
"2304.07600","Hendrik Scheidel","Hendrik Scheidel, Houshyar Asadi, Tobias Bellmann, Andreas Seefried,
  Shady Mohamed and Saeid Nahavandi","A novel approach of a deep reinforcement learning based motion cueing
  algorithm for vehicle driving simulation",,,,,"cs.RO cs.SY eess.SY","http://creativecommons.org/licenses/by/4.0/","  In the field of motion simulation, the level of immersion strongly depends on
the motion cueing algorithm (MCA), as it transfers the reference motion of the
simulated vehicle to a motion of the motion simulation platform (MSP). The
challenge for the MCA is to reproduce the motion perception of a real vehicle
driver as accurately as possible without exceeding the limits of the workspace
of the MSP in order to provide a realistic virtual driving experience. In case
of a large discrepancy between the perceived motion signals and the optical
cues, motion sickness may occur with the typical symptoms of nausea, dizziness,
headache and fatigue. Existing approaches either produce non-optimal results,
e.g., due to filtering, linearization, or simplifications, or the required
computational time exceeds the real-time requirements of a closed-loop
application.
  In this work a new solution is presented, where not a human designer
specifies the principles of the MCA but an artificial intelligence (AI) learns
the optimal motion by trial and error in an interaction with the MSP. To
achieve this, deep reinforcement learning (RL) is applied, where an agent
interacts with an environment formulated as a Markov decision process~(MDP).
This allows the agent to directly control a simulated MSP to obtain feedback on
its performance in terms of platform workspace usage and the motion acting on
the simulator user. The RL algorithm used is proximal policy optimization
(PPO), where the value function and the policy corresponding to the control
strategy are learned and both are mapped in artificial neural networks (ANN).
This approach is implemented in Python and the functionality is demonstrated by
the practical example of pre-recorded lateral maneuvers. The subsequent
validation on a standardized double lane change shows that the RL algorithm is
able to learn the control strategy and improve the quality of...
","[{""version"":""v1"",""created"":""Sat, 15 Apr 2023 17:24:03 GMT""}]","2023-04-18"
"2304.07601","Wilhelm Treschow","Sara Maad Sasane and Wilhelm Treschow","Embedded eigenvalues for asymptotically periodic ODE systems","17 pages",,,,"math.FA","http://creativecommons.org/licenses/by/4.0/","  We investigate the persistance of embedded eigenvalues under perturbations of
a certain self-adjoint Schr\""odinger-type differential operator in
$L^2(\mathbb{R};\mathbb{R}^n)$, with an asymptotically periodic potential. The
studied perturbations are small and belong to a certain Banach space with a
specified decay rate, in particular, a weighted space of continuous matrix
valued functions. Our main result is that the set of perturbations for which
the embedded eigenvalue persists forms a smooth manifold with a specified
co-dimension. This is done using tools from Floquet theory, basic Banach space
calculus, exponential dichotomies and their roughness properties, and
Lyapunov-Schmidt reduction. A second result is provided, where under an extra
assumption, it can be proved that the first result holds even when the space of
perturbations is replaced by a much smaller space, as long as it contains a
minimal subspace. In the end, as a way of showing that the investigated setting
exists, a concrete example is presented. The example itself relates to a
problem from quantum mechanics and represents a system of electrons in an
infinite one-dimensional crystal.
","[{""version"":""v1"",""created"":""Sat, 15 Apr 2023 17:35:05 GMT""}]","2023-04-18"
"2304.07602","Vahid Azimi Mousolou","Mahroo Shiranzaei, Jonas Fransson, Vahid Azimi-Mousolou","Temperature-anisotropy conjugate magnon squeezing in antiferromagnets",,,,,"quant-ph cond-mat.mes-hall","http://creativecommons.org/publicdomain/zero/1.0/","  Quantum squeezing is a fundamental resource for quantum science and
technology. Here we examine temperature and anisotropy -induced squeezing of
quantum fluctuations associated with two-mode magnon states in uniaxial
antiferromagnetic materials. As a result of nonlinearity we find a conjugate
magnon squeezing effect led by temperature and anisotropy for all two-mode
energy eigenbasis states of the system. While temperature induces amplitude
squeezing, anisotropy causes phase squeezing in magnon states. We show that the
anisotropy gives rise to the larger squeeze factor compared to temperature.
However, it is seen that temperature-induced squeezing is naturally related to
the squeezed property of the two-mode magnon states. The analysis shows that
after a sharp squeezing effect up to a finite value of anisotropy, increasing
anisotropy beyond this value does not cause significant further squeezing.
Nevertheless, increasing the temperature continuously causes compression.
Despite the competition between temperature and anisotropy -induced squeezings,
we show that an optimal finite value of anisotropy allows achieving high
temperature and low energy stabilized magnon squeezing. We believe our results
provide a clear and novel pathway toward the experimental detection of
squeezing effects in quantum magnonics.
","[{""version"":""v1"",""created"":""Sat, 15 Apr 2023 17:36:17 GMT""}]","2023-04-18"
"2304.07603","Francis Wagner","Bogdan Chornomaz, Francis Wagner","Quasilinear Emulation of Turing Machines by S-machines","127 pages, 22 figures",,,,"math.GR","http://arxiv.org/licenses/nonexclusive-distrib/1.0/","  We prove that for any $\varepsilon>0$, a non-deterministic Turing machine
$\mathcal{T}$ with time complexity $T(n)$ can be emulated by an $S$-machine
with time and space complexities at most $T(n)^{1+\varepsilon}$ and $T(n)$,
respectively. This improves the bounds on the emulation in arXiv:math/9811105
and leads to improved bounds in the main theorem of arXiv:math/9811106. In
particular, for a non-hyperbolic finitely generated group $G$ whose word
problem has linear time complexity, this yields an embedding of $G$ into a
finitely presented group $H$ such that $G$ has bounded distortion in $H$ and
the Dehn function of $G$ in $H$ is bounded above by $n^{2+\varepsilon}$, an
optimal bound modulo the $\varepsilon$ factor. As a means to this end, we
introduce and develop the theory of $S$-graphs, giving a different perspective
on the construction of $S$-machines akin to a crude object-oriented programming
language.
","[{""version"":""v1"",""created"":""Sat, 15 Apr 2023 17:39:08 GMT""}]","2023-04-18"
"2304.07604","Hermann Kroll","Hermann Kroll and Christin Katharina Kreutz and Pascal Sackhoff and
  Wolf-Tilo Balke","Enriching Simple Keyword Queries for Domain-Aware Narrative Retrieval","Accepted at JCDL2023. 12 pages. Full Research Paper",,,,"cs.DL","http://creativecommons.org/licenses/by/4.0/","  Providing effective access paths to content is a key task in digital
libraries. Oftentimes, such access paths are realized through advanced query
languages, which, on the one hand, users may find challenging to learn or use,
and on the other, requires libraries to convert their content into a high
quality structured representation. As a remedy, narrative information access
proposes to query library content through structured patterns directly, to
ensure validity and coherence of information. However, users still find it
challenging to express their information needs in such patterns. Therefore,
this work bridges the gap by introducing a method that deduces patterns from
keyword searches. Moreover, our user studies with participants from the
biomedical domain show their acceptance of our prototypical system.
","[{""version"":""v1"",""created"":""Sat, 15 Apr 2023 17:43:03 GMT""},{""version"":""v2"",""created"":""Fri, 28 Apr 2023 13:20:51 GMT""}]","2023-05-01"
"2304.07605","Tian-Xiao He","Tian-Xiao He and Peter J.-S. Shiue","Divisibility of the Sums of the Power of Consecutive Integers",,,,,"math.CO","http://creativecommons.org/licenses/by/4.0/","  We study the divisibility of the sums of the odd power of consecutive
integers, $S(m,k)=1^{mk}+2^{mk}+\cdots+k^{mk}$ and $1^k+2^k+\cdots+n^k$ for odd
integers $m$ and $k$, by using the Girard-Waring identity. Faulhaber's approach
for the divisibilities is discussed. Some expressions of power sums in terms of
Stirling numbers of the second kind are represented.
","[{""version"":""v1"",""created"":""Sat, 15 Apr 2023 17:46:24 GMT""}]","2023-04-18"
