"2304.09606","Ben Xu","Teng Yang and Zefeng Cai and Zhengtao Huang and Wenlong Tang and
  Ruosong Shi and Andy Godfrey and Hanxing Liu and Yuanhua Lin and Ce-Wen Nan
  and LinFeng Zhang and Han Wang and Ben Xu","Screening Spin Lattice Interaction Using Deep Learning Approach","8 pages, 4 figures",,,,"cond-mat.mtrl-sci","http://arxiv.org/licenses/nonexclusive-distrib/1.0/","  Atomic simulations hold significant value in clarifying crucial matters such
as phase transitions and energy transport in materials science. Their success
stems from the presence of potential energy functions capable of accurately
depicting the relationship between system energy and lattice changes. In
magnetic materials, two atomic scale degrees of freedom come into play: the
lattice and the magnetic moment. Nonetheless, precisely portraying the
interaction energy and its impact on lattice and spin-driving forces, such as
atomic force and magnetic torque, remains a formidable task in the
computational domain. Consequently, there is no atomic-scale approach capable
of elucidating the evolution of lattice and spin at the same time in magnetic
materials. Addressing this knowledge deficit, we present DeepSPIN, a versatile
approach that generates high-precision predictive models of energy, atomic
forces, and magnetic torque in magnetic systems. This is achieved by
integrating first-principles calculations of magnetic excited states with
advanced deep learning techniques via active learning. We thoroughly explore
the methodology, accuracy, and scalability of our proposed model in this paper.
Our technique adeptly connects first-principles computations and atomic-scale
simulations of magnetic materials. This synergy presents opportunities to
utilize these calculations in devising and tackling theoretical and practical
obstacles concerning magnetic materials.
","[{""version"":""v1"",""created"":""Wed, 19 Apr 2023 12:24:56 GMT""}]","2023-04-20"
"2304.09607","Yaoxun Xu","Yaoxun Xu and Baiji Liu and Qiaochu Huang and, Xingchen Song and
  Zhiyong Wu and Shiyin Kang and Helen Meng","CB-Conformer: Contextual biasing Conformer for biased word recognition",,,,,"cs.SD cs.CL eess.AS","http://creativecommons.org/licenses/by/4.0/","  Due to the mismatch between the source and target domains, how to better
utilize the biased word information to improve the performance of the automatic
speech recognition model in the target domain becomes a hot research topic.
Previous approaches either decode with a fixed external language model or
introduce a sizeable biasing module, which leads to poor adaptability and slow
inference. In this work, we propose CB-Conformer to improve biased word
recognition by introducing the Contextual Biasing Module and the Self-Adaptive
Language Model to vanilla Conformer. The Contextual Biasing Module combines
audio fragments and contextual information, with only 0.2% model parameters of
the original Conformer. The Self-Adaptive Language Model modifies the internal
weights of biased words based on their recall and precision, resulting in a
greater focus on biased words and more successful integration with the
automatic speech recognition model than the standard fixed language model. In
addition, we construct and release an open-source Mandarin biased-word dataset
based on WenetSpeech. Experiments indicate that our proposed method brings a
15.34% character error rate reduction, a 14.13% biased word recall increase,
and a 6.80% biased word F1-score increase compared with the base Conformer.
","[{""version"":""v1"",""created"":""Wed, 19 Apr 2023 12:26:04 GMT""},{""version"":""v2"",""created"":""Tue, 25 Apr 2023 07:45:40 GMT""}]","2023-04-26"
"2304.09608","William Bialek","William Bialek and Joshua W. Shaevitz","Long time scales, individual differences, and scale invariance in animal
  behavior",,,,,"q-bio.NC cond-mat.dis-nn q-bio.QM","http://arxiv.org/licenses/nonexclusive-distrib/1.0/","  The explosion of data on animal behavior in more natural contexts highlights
the fact that these behaviors exhibit correlations across many time scales. But
there are major challenges in analyzing these data: records of behavior in
single animals have fewer independent samples than one might expect; in pooling
data from multiple animals, individual differences can mimic long-ranged
temporal correlations; conversely long-ranged correlations can lead to an
over-estimate of individual differences. We suggest an analysis scheme that
addresses these problems directly, apply this approach to data on the
spontaneous behavior of walking flies, and find evidence for scale invariant
correlations over nearly three decades in time, from seconds to one hour. Three
different measures of correlation are consistent with a single underlying
scaling field of dimension $\Delta = 0.180\pm 0.005$.
","[{""version"":""v1"",""created"":""Wed, 19 Apr 2023 12:26:29 GMT""}]","2023-04-20"
"2304.09609","Wendong Zhang","Wendong Zhang","MMDR: A Result Feature Fusion Object Detection Approach for Autonomous
  System","9 pages, 12 figures",,,,"cs.CV cs.AI","http://arxiv.org/licenses/nonexclusive-distrib/1.0/","  Object detection has been extensively utilized in autonomous systems in
recent years, encompassing both 2D and 3D object detection. Recent research in
this field has primarily centered around multimodal approaches for addressing
this issue.In this paper, a multimodal fusion approach based on result
feature-level fusion is proposed. This method utilizes the outcome features
generated from single modality sources, and fuses them for downstream
tasks.Based on this method, a new post-fusing network is proposed for
multimodal object detection, which leverages the single modality outcomes as
features. The proposed approach, called Multi-Modal Detector based on Result
features (MMDR), is designed to work for both 2D and 3D object detection tasks.
Compared to previous multimodal models, the proposed approach in this paper
performs feature fusion at a later stage, enabling better representation of the
deep-level features of single modality sources. Additionally, the MMDR model
incorporates shallow global features during the feature fusion stage, endowing
the model with the ability to perceive background information and the overall
input, thereby avoiding issues such as missed detections.
","[{""version"":""v1"",""created"":""Wed, 19 Apr 2023 12:28:42 GMT""}]","2023-04-20"
"2304.09610","Fabio Mastrogiacomo","F. Dalla Volta, F. Mastrogiacomo, P. Spiga","On the strong connectivity of the 2-Engel graphs of almost simple groups",,,,,"math.GR math.CO","http://arxiv.org/licenses/nonexclusive-distrib/1.0/","  The Engel graph of a finite group $G$ is a directed graph encoding the pairs
of elements in $G$ satisfying some Engel word. Recent work of Lucchini and the
third author shows that, except for a few well-understood cases, the Engel
graphs of almost simple groups are strongly connected. In this paper, we give a
refinement to this analysis.
","[{""version"":""v1"",""created"":""Wed, 19 Apr 2023 12:32:10 GMT""}]","2023-04-20"
"2304.09611","George Papadakis","Nikolaos Petikidis and George Papadakis","Investigation of Submergence Depth and Wave-Induced Effects on the
  Performance of a Fully Passive Energy Harvesting Flapping Foil Operating
  Beneath the Free Surface",,,,,"physics.flu-dyn","http://creativecommons.org/licenses/by/4.0/","  This paper investigates the performance of a fully passive flapping foil
device for energy harvesting in a free surface flow. The study uses numerical
simulations to examine the effects of varying submergence depths and the impact
of monochromatic waves on the foil's performance. The results show that the
fully passive flapping foil device can achieve high efficiency for submergence
depths between 4 and 9 chords, with an ""optimum"" submergence depth where the
flapping foil performance is maximised. The performance was found to be
correlated with the resonant frequency of the heaving motion and its proximity
to the damped natural frequency. The effects of regular waves on the foil's
performance were also investigated, showing that waves with a frequency close
to that of the natural frequency of the flapping foil aided energy harvesting.
Overall, this study provides insights that could be useful for future design
improvements for fully passive flapping foil devices for energy harvesting
operating near the free surface.
","[{""version"":""v1"",""created"":""Wed, 19 Apr 2023 12:34:57 GMT""}]","2023-04-20"
"2304.09612","The ATLAS Collaboration","ATLAS Collaboration","Test of CP-invariance of the Higgs boson in vector-boson fusion
  production and its decay into four leptons","62 pages in total, author list starting page 45, 17 figures, 6
  tables, submitted to JHEP. All figures including auxiliary figures are
  available at
  https://atlas.web.cern.ch/Atlas/GROUPS/PHYSICS/PAPERS/HIGG-2018-30/",,,"CERN-EP-2023-030","hep-ex","http://creativecommons.org/licenses/by/4.0/","  A search for CP violation in the decay kinematics and vector-boson production
of the Higgs boson is performed in the $H \to ZZ^{*} \to 4\ell$ ($\ell =
e,\mu$) decay channel. The results are based on proton-proton collision data
produced at the LHC at a centre-of-mass energy of 13 TeV and recorded by the
ATLAS detector from 2015 to 2018, corresponding to an integrated luminosity of
139 $\mbox{fb\(^{-1}\)}$. Matrix element-based optimal observables are used to
constrain CP-odd couplings beyond the Standard Model in the framework of
Standard Model effective field theory expressed in the Warsaw and Higgs bases.
Differential fiducial cross-section measurements of the optimal observables are
also performed, and a new fiducial cross-section measurement for
vector-boson-fusion production is provided. All measurements are in agreement
with the Standard Model prediction of a CP-even Higgs boson.
","[{""version"":""v1"",""created"":""Wed, 19 Apr 2023 12:35:09 GMT""}]","2023-04-20"
"2304.09613","David Martinez-del-R\'io","Nikos Kallinikos, Robert S. MacKay, David Martinez-del-Rio","Regions without flux surfaces of given class for magnetic fields in
  toroidal geometry",,,,,"physics.plasm-ph math.DS","http://arxiv.org/licenses/nonexclusive-distrib/1.0/","  A Converse KAM method for 3D vector fields, establishing regions through
which pass no invariant 2-tori transverse to a given direction field, is tested
on some helical perturbations of an axisymmetric magnetic field in toroidal
geometry. It finds regions corresponding to magnetic islands and chaos for the
fieldline flow. Minimization of these regions is proposed as a tool to help in
the design of plasma confinement devices of tokamak and stellarator type.
","[{""version"":""v1"",""created"":""Wed, 19 Apr 2023 12:37:31 GMT""},{""version"":""v2"",""created"":""Fri, 21 Apr 2023 09:00:40 GMT""}]","2023-04-24"
"2304.09614","Yang Shu Hua","Shu-Hua Yang, Chun-Mei Pi, Xiao-Ping Zheng and Fridolin Weber","Confronting strange stars with compact-star observations and new physics","26 pages, 11 figures. Review paper accepted for publication in
  Universe",,,,"astro-ph.HE gr-qc","http://creativecommons.org/licenses/by/4.0/","  Strange stars ought to exist in the universe according to the strange quark
matter hypothesis, which states that matter made of roughly equal numbers of
up, down, and strange quarks could be the true ground state of baryonic matter
rather than ordinary atomic nuclei. Theoretical models of strange quark matter,
such as the standard MIT bag model, the density-dependent quark mass model, or
the quasi-particle model, however, appear to be unable to reproduce some of the
properties (masses, radii and tidal deformabilities) of recently observed
compact stars. This is different if alternative gravity theory (e.g.,
non-Newtonian gravity) or dark matter (e.g., mirror dark matter) are
considered, which resolve these issues. The possible existence of strange stars
could thus provide a clue to new physics, as discussed in this review.
","[{""version"":""v1"",""created"":""Wed, 19 Apr 2023 12:43:13 GMT""}]","2023-04-20"
"2304.09615","Hong Wah Chan","H.W. Chan, V. Prodanovi\'c, A.M.M.G. Theulings, S. Tao, J. Smedley,
  C.W. Hagen, P.M. Sarro and H. v.d. Graaf","The construction and characterization of MgO transmission dynodes",,,,,"physics.ins-det","http://arxiv.org/licenses/nonexclusive-distrib/1.0/","  In this work we demonstrate that ultra-thin (5 and 15 nm) MgO transmission
dynodes (tynodes) with sufficient high transmission electron yield (TEY) can be
constructed. These tynodes act as electron amplification stages in a novel
vacuum electron multiplier: the Timed Photon Counter (TiPC). The ultra-thin
membranes with a diameter of 30 {\mu}m are arranged in a square 64-by-64-array.
The TEY was determined with a scanning electron microscope (SEM) using primary
electrons with primary energies of 0.75 - 5 keV. The method allow us to make a
TEY map of the surface while simultaneously imaging the surface. The TEY of
individual membranes can be extracted from the TEY map. An averaged maximum TEY
of 4.6 +/- 0.2 was achieved by using 1.35 keV primary electrons on a TiN/MgO
bi-layer membrane with a layer thickness of 2 and 5 nm, respectively. The
TiN/MgO membrane with a layer thickness of 2 and 15 nm, respectively, has a
maximum TEY of 3.3 +/- 0.1 (2.35 keV). Furthermore, the effect of the electric
field strength on transmission (secondary) electron emission was investigated
by placing the emission surface of a tynode in close proximity to a planar
collector. By increasing the electric potential between the tynode and the
collector, from -50 V to -100 V, the averaged maximum TEY improved from 4.6 +/-
0.2 to 5.0 +/- 0.3 at a primary energy of 1.35 keV with an upper limit of 5.5
on one of the membranes.
","[{""version"":""v1"",""created"":""Wed, 19 Apr 2023 12:47:10 GMT""}]","2023-04-20"
"2304.09616","Josu Goikoetxea","J. Goikoetxea, M. Arantzeta, I. San Martin","Bridging Natural Language Processing and Psycholinguistics:
  computationally grounded semantic similarity datasets for Basque and Spanish",,,,,"cs.CL","http://creativecommons.org/licenses/by/4.0/","  We present a computationally-grounded word similarity dataset based on two
well-known Natural Language Processing resources; text corpora and knowledge
bases. This dataset aims to fulfil a gap in psycholinguistic research by
providing a variety of quantifications of semantic similarity in an extensive
set of noun pairs controlled by variables that play a significant role in
lexical processing. The dataset creation has consisted in three steps, 1)
computing four key psycholinguistic features for each noun; concreteness,
frequency, semantic and phonological neighbourhood density; 2) pairing nouns
across these four variables; 3) for each noun pair, assigning three types of
word similarity measurements, computed out of text, Wordnet and hybrid
embeddings. The present dataset includes noun pairs' information in Basque and
European Spanish, but further work intends to extend it to more languages.
","[{""version"":""v1"",""created"":""Wed, 19 Apr 2023 12:47:51 GMT""},{""version"":""v2"",""created"":""Thu, 20 Apr 2023 08:23:21 GMT""}]","2023-04-21"
"2304.09617","Amir Masoud Ghalamzan Esfahani","Vishnu Rajendran S, Bappaditya Debnath, Bappaditya Debnath, Sariah
  Mghames, Willow Mandil, Soran Parsa, Simon Parsons, Amir Ghalamzan-E","Towards Autonomous Selective Harvesting: A Review of Robot Perception,
  Robot Design, Motion Planning and Control","Preprint: to be appeared in Journal of Field Robotics",,,,"cs.RO","http://creativecommons.org/licenses/by-sa/4.0/","  This paper provides an overview of the current state-of-the-art in selective
harvesting robots (SHRs) and their potential for addressing the challenges of
global food production. SHRs have the potential to increase productivity,
reduce labour costs, and minimise food waste by selectively harvesting only
ripe fruits and vegetables. The paper discusses the main components of SHRs,
including perception, grasping, cutting, motion planning, and control. It also
highlights the challenges in developing SHR technologies, particularly in the
areas of robot design, motion planning and control. The paper also discusses
the potential benefits of integrating AI and soft robots and data-driven
methods to enhance the performance and robustness of SHR systems. Finally, the
paper identifies several open research questions in the field and highlights
the need for further research and development efforts to advance SHR
technologies to meet the challenges of global food production. Overall, this
paper provides a starting point for researchers and practitioners interested in
developing SHRs and highlights the need for more research in this field.
","[{""version"":""v1"",""created"":""Wed, 19 Apr 2023 12:50:15 GMT""}]","2023-04-20"
"2304.09618","Goran Radunovi\'c","Peter De Maesschalck (1), Renato Huzak (1), Ansfried Janssens (1),
  Goran Radunovi\'c (2) ((1) Hasselt University, (2) University of Zagreb)","Minkowski dimension and slow-fast polynomial Li\'{e}nard equations near
  infinity",,,,,"math.DS","http://arxiv.org/licenses/nonexclusive-distrib/1.0/","  In planar slow-fast systems, fractal analysis of (bounded) sequences in
$\mathbb R$ has proved important for detection of the first non-zero Lyapunov
quantity in singular Hopf bifurcations, determination of the maximum number of
limit cycles produced by slow-fast cycles, defined in the finite plane, etc.
One uses the notion of Minkowski dimension of sequences generated by slow
relation function. Following a similar approach, together with
Poincar\'{e}--Lyapunov compactification, in this paper we focus on a fractal
analysis near infinity of the slow-fast generalized Li\'{e}nard equations $\dot
x=y-\sum_{k=0}^{n+1} B_kx^k,\ \dot y=-\epsilon\sum_{k=0}^{m}A_kx^k$. We extend
the definition of the Minkowski dimension to unbounded sequences. This helps us
better understand the fractal nature of slow-fast cycles that are detected
inside the slow-fast Li\'{e}nard equations and contain a part at infinity.
","[{""version"":""v1"",""created"":""Wed, 19 Apr 2023 12:50:17 GMT""}]","2023-04-20"
"2304.09619","Yifan Jing","Yifan Jing, Chieu-Minh Tran, Ruixiang Zhang","Measure doubling of small sets in $\mathrm{SO}(3,\mathbb{R})$","40 pages. Comments are welcome",,,,"math.GR math.CO math.LO math.NT","http://creativecommons.org/licenses/by/4.0/","  Let $\mathrm{SO}(3,\mathbb{R})$ be the 3D-rotation group equipped with the
real-manifold topology and the normalized Haar measure $\mu$. Resolving a
problem by Breuillard and Green, we show that if $A \subseteq
\mathrm{SO}(3,\mathbb{R})$ is an open subset with sufficiently small measure,
then $$ \mu(A^2) > 3.99 \mu(A).$$ We also show a more general result for the
product of two sets, which can be seen as a Brunn-Minkowski-type inequality for
sets with small measure in $\mathrm{SO}(3,\mathbb{R})$.
","[{""version"":""v1"",""created"":""Wed, 19 Apr 2023 12:53:51 GMT""}]","2023-04-20"
"2304.09620","Chengzhun Lu","Chengzhun Lu, Zhangrun Xia, Krzysztof Przystupa, Orest Kochan, Jun Su","DCELANM-Net:Medical Image Segmentation based on Dual Channel Efficient
  Layer Aggregation Network with Learner",,,,,"eess.IV cs.CV","http://arxiv.org/licenses/nonexclusive-distrib/1.0/","  The DCELANM-Net structure, which this article offers, is a model that
ingeniously combines a Dual Channel Efficient Layer Aggregation Network
(DCELAN) and a Micro Masked Autoencoder (Micro-MAE). On the one hand, for the
DCELAN, the features are more effectively fitted by deepening the network
structure; the deeper network can successfully learn and fuse the features,
which can more accurately locate the local feature information; and the
utilization of each layer of channels is more effectively improved by widening
the network structure and residual connections. We adopted Micro-MAE as the
learner of the model. In addition to being straightforward in its methodology,
it also offers a self-supervised learning method, which has the benefit of
being incredibly scaleable for the model.
","[{""version"":""v1"",""created"":""Wed, 19 Apr 2023 12:57:52 GMT""}]","2023-04-20"
"2304.09621","Yi-Fei Lu","Yi-Fei Lu, Yang Wang, Hong-Wei Li, Mu-Sheng Jiang, Xiao-Xu Zhang,
  Ying-Ying Zhang, Yu Zhou, Xiao-Lei Jiang, Chun Zhou, Wan-Su Bao","Simple Security Proof of Mode-Pairing Quantum Key Distribution",,,,,"quant-ph","http://creativecommons.org/licenses/by/4.0/","  Mode-pairing (MP) quantum key distribution (QKD) eliminates the requirements
of phase locking and phase tracking compared with twin-field (TF) QKD while
still surpassing the fundamental rate-distance limit of QKD. The complexity of
the experimental implementation is reduced while the efficiency is also
guaranteed. The security of MP-QKD is proved rigorously by examining the
consistency of the states detailly between MP-QKD and the fixed-pairing scheme
under all of Eve's possible interference, where the latter is equivalent to
measurement-device-independent (MDI) QKD. Here we propose a simple and
straightforward method to prove the information-theoretic security of MP-QKD.
Specifically, an entanglement scheme for MP-QKD is proposed and its security is
proved using entanglement purification. Then the security of MP-QKD can be
guaranteed with the equivalence of the entanglement scheme and
prepare-and-measure scheme for MP-QKD. With this approach, it is beneficial to
analyze and understand the performance and security of MP-QKD. We explain why
the pairing rounds in MP-QKD can be decoupled and determined by the measurement
results announced by a third party, which is the key difference between MP-QKD
and MDI-QKD. Moreover, we analyze the security of MP-QKD with the allowed
optimal pairing strategy, which is significant for the secret key rate, under
collective and coherent attacks.
","[{""version"":""v1"",""created"":""Wed, 19 Apr 2023 12:59:43 GMT""}]","2023-04-20"
"2304.09622","Ivan Dyakonov","M. Dryazov, Yu. Biriukov, I. Dyakonov, K. Taratorin, A. Korneev, M.
  Rakhlin, A. Galimov, G. Klimko, S. Sorokin, M. Kulagina, Yu. Zadiranov, A.
  Toropov, F. Bergmann, S. Straupe, S. Kulik","Resource-efficient low-loss four-channel active demultiplexer for single
  photons","8 pages, 7 figures",,,,"quant-ph","http://arxiv.org/licenses/nonexclusive-distrib/1.0/","  We report a design and implementation of a resource-efficient spatial
demultiplexer which produces 4 indistinguishable photons with efficiency of
39.7% per channel. Our scheme is based on a free-space storage/delay line which
accumulates 4 photons and releases them by a controlled polarization rotation
using a single Pockels cell.
","[{""version"":""v1"",""created"":""Wed, 19 Apr 2023 13:00:11 GMT""}]","2023-04-20"
"2304.09623","Pranav Jeevan P","Chirag P, Mukta Wagle, Ravi Kant Gupta, Pranav Jeevan, Amit Sethi","CHATTY: Coupled Holistic Adversarial Transport Terms with Yield for
  Unsupervised Domain Adaptation","10 pages, 4 figures",,,,"cs.CV eess.IV","http://creativecommons.org/licenses/by/4.0/","  We propose a new technique called CHATTY: Coupled Holistic Adversarial
Transport Terms with Yield for Unsupervised Domain Adaptation. Adversarial
training is commonly used for learning domain-invariant representations by
reversing the gradients from a domain discriminator head to train the feature
extractor layers of a neural network. We propose significant modifications to
the adversarial head, its training objective, and the classifier head. With the
aim of reducing class confusion, we introduce a sub-network which displaces the
classifier outputs of the source and target domain samples in a learnable
manner. We control this movement using a novel transport loss that spreads
class clusters away from each other and makes it easier for the classifier to
find the decision boundaries for both the source and target domains. The
results of adding this new loss to a careful selection of previously proposed
losses leads to improvement in UDA results compared to the previous
state-of-the-art methods on benchmark datasets. We show the importance of the
proposed loss term using ablation studies and visualization of the movement of
target domain sample in representation space.
","[{""version"":""v1"",""created"":""Wed, 19 Apr 2023 13:00:23 GMT""},{""version"":""v2"",""created"":""Thu, 20 Apr 2023 16:39:43 GMT""}]","2023-04-21"
"2304.09624","Dimitri Faure","Dimitri Faure and Mathias Rousset","A general martingale approach to large noise homogenization","51 pages. v1: Preliminary version. v2: Sent for publication version",,,,"math.PR","http://arxiv.org/licenses/nonexclusive-distrib/1.0/","  We consider Markov processes with generator of the form $\gamma
\mathcal{L}_{1} + \mathcal{L}_{0}$, in which $\mathcal{L}_{1}$ generates a
so-called dominant process that converges at large times towards a random point
in a fixed subset called the effective state space. Using the usual
characterization through martingales problems, we give general conditions under
which homogenization holds true: the original process converges, when $\gamma$
is large and for the Meyer-Zheng pseudo-path topology and for
finite-dimensional time marginals, towards an identified effective Markov
process on the effective space. Few simple model examples for diffusions are
studied.
","[{""version"":""v1"",""created"":""Wed, 19 Apr 2023 13:01:34 GMT""},{""version"":""v2"",""created"":""Sun, 14 May 2023 00:02:43 GMT""}]","2023-05-16"
