"2304.09285","Benjamin Killeen","Benjamin D. Killeen, Han Zhang, Jan Mangulabnan, Mehran Armand, Russel
  H. Taylor, Greg Osgood, Mathias Unberath","Pelphix: Surgical Phase Recognition from X-ray Images in Percutaneous
  Pelvic Fixation",,,,,"cs.LG cs.AI cs.CV q-bio.QM","http://creativecommons.org/licenses/by/4.0/","  Surgical phase recognition (SPR) is a crucial element in the digital
transformation of the modern operating theater. While SPR based on video
sources is well-established, incorporation of interventional X-ray sequences
has not yet been explored. This paper presents Pelphix, a first approach to SPR
for X-ray-guided percutaneous pelvic fracture fixation, which models the
procedure at four levels of granularity -- corridor, activity, view, and frame
value -- simulating the pelvic fracture fixation workflow as a Markov process
to provide fully annotated training data. Using added supervision from
detection of bony corridors, tools, and anatomy, we learn image representations
that are fed into a transformer model to regress surgical phases at the four
granularity levels. Our approach demonstrates the feasibility of X-ray-based
SPR, achieving an average accuracy of 93.8% on simulated sequences and 67.57%
in cadaver across all granularity levels, with up to 88% accuracy for the
target corridor in real data. This work constitutes the first step toward SPR
for the X-ray domain, establishing an approach to categorizing phases in
X-ray-guided surgery, simulating realistic image sequences to enable machine
learning model development, and demonstrating that this approach is feasible
for the analysis of real procedures. As X-ray-based SPR continues to mature, it
will benefit procedures in orthopedic surgery, angiography, and interventional
radiology by equipping intelligent surgical systems with situational awareness
in the operating room.
","[{""version"":""v1"",""created"":""Tue, 18 Apr 2023 20:48:14 GMT""}]","2023-04-20"
"2304.09286","Young-Ho Kim","Young-Ho Kim and \`Eric Lluch and Gulsun Mehmet and Florin C. Ghesu
  and Ankur Kapoor","AI-based Agents for Automated Robotic Endovascular Guidewire
  Manipulation",,,,,"cs.RO","http://arxiv.org/licenses/nonexclusive-distrib/1.0/","  Endovascular guidewire manipulation is essential for minimally-invasive
clinical applications (Percutaneous Coronary Intervention (PCI), Mechanical
thrombectomy techniques for acute ischemic stroke (AIS), or Transjugular
intrahepatic portosystemic shunt (TIPS)). All procedures commonly require 3D
vessel geometries from 3D CTA (Computed Tomography Angiography) images. During
these procedures, the clinician generally places a guiding catheter in the
ostium of the relevant vessel and then manipulates a wire through the catheter
and across the blockage. The clinician only uses X-ray fluoroscopy
intermittently to visualize and guide the catheter, guidewire, and other
devices. However, clinicians still passively control guidewires/catheters by
relying on limited indirect observation (i.e., 2D partial view of devices, and
intermittent updates due to radiation limit) from X-ray fluoroscopy. Modeling
and controlling the guidewire manipulation in coronary vessels remains
challenging because of the complicated interaction between guidewire motions
with different physical properties (i.e., loads, coating) and vessel geometries
with lumen conditions resulting in a highly non-linear system. This paper
introduces a scalable learning pipeline to train AI-based agent models toward
automated endovascular predictive device controls. First, we create a scalable
environment by pre-processing 3D CTA images, providing patient-specific 3D
vessel geometry and the centerline of the coronary. Next, we apply a large
quantity of randomly generated motion sequences from the proximal end to
generate wire states associated with each environment using a physics-based
device simulator. Then, we reformulate the control problem to a
sequence-to-sequence learning problem, in which we use a Transformer-based
model, trained to handle non-linear sequential forward/inverse transition
functions.
","[{""version"":""v1"",""created"":""Tue, 18 Apr 2023 20:53:25 GMT""}]","2023-04-20"
"2304.09287","Wenping Wang","Wenping Wang, Yunxi Guo, Chiyao Shen, Shuai Ding, Guangdeng Liao, Hao
  Fu, Pramodh Karanth Prabhakar","Integrity and Junkiness Failure Handling for Embedding-based Retrieval:
  A Case Study in Social Network Search",,,"10.1145/3539618.3591831",,"cs.IR cs.AI","http://arxiv.org/licenses/nonexclusive-distrib/1.0/","  Embedding based retrieval has seen its usage in a variety of search
applications like e-commerce, social networking search etc. While the approach
has demonstrated its efficacy in tasks like semantic matching and contextual
search, it is plagued by the problem of uncontrollable relevance. In this
paper, we conduct an analysis of embedding-based retrieval launched in early
2021 on our social network search engine, and define two main categories of
failures introduced by it, integrity and junkiness. The former refers to issues
such as hate speech and offensive content that can severely harm user
experience, while the latter includes irrelevant results like fuzzy text
matching or language mismatches. Efficient methods during model inference are
further proposed to resolve the issue, including indexing treatments and
targeted user cohort treatments, etc. Though being simple, we show the methods
have good offline NDCG and online A/B tests metrics gain in practice. We
analyze the reasons for the improvements, pointing out that our methods are
only preliminary attempts to this important but challenging problem. We put
forward potential future directions to explore.
","[{""version"":""v1"",""created"":""Tue, 18 Apr 2023 20:53:47 GMT""}]","2023-04-20"
"2304.09289","Alex Matzkin","J. Allam and A. Matzkin","From observer-dependent facts to frame-dependent measurement records in
  Wigner friend scenarios",,,,,"quant-ph","http://arxiv.org/licenses/nonexclusive-distrib/1.0/","  The description of Wigner-friend scenarios -- in which external agents
describe a closed laboratory containing a friend making a measurement --
remains problematic due to the ambiguous nature of quantum measurements. One
option is to endorse assumptions leading to observer-dependent facts, given
that the friend's measurement outcome is not defined from the point of view of
the external observers. We introduce in this work a model showing that these
assumptions can also lead to measurement records that depend on the inertial
reference frame in which the agents make their observations. Our model is based
on an entangled pair shared by the friend and a distant agent performing
space-like separated measurements. An external observer at rest relative to the
closed laboratory and observers in a moving frame do not agree on the observed
records, which are not Lorentz transforms of one another.
","[{""version"":""v1"",""created"":""Tue, 18 Apr 2023 20:54:57 GMT""}]","2023-04-20"
"2304.09292","Alejandro Pardo Pintos","Alejandro Pardo Pintos, Diego Shalom, Enzo Tagliazucchi, Gabriel
  Mindlin, Marcos Trevisan","A model of phase-coupled delay equations for the dynamics of word usage","7 pages, 3 figures. APP, GM, and MT designed and performed the
  research, APP and DES analyzed the data, and APP, ET and MT wrote the paper.
  The authors declare no conflict of interes",,,,"physics.soc-ph","http://creativecommons.org/licenses/by-nc-sa/4.0/","  Cycles of word usage have been described using an integro-differential
Volterra model close to a Hopf bifurcation. Here we transform this system to a
phase model, which allows us to phase-couple the words and address the
observation of coherent oscillations in word usage.
","[{""version"":""v1"",""created"":""Tue, 18 Apr 2023 20:58:15 GMT""},{""version"":""v2"",""created"":""Mon, 22 May 2023 16:33:28 GMT""}]","2023-05-23"
"2304.09293","Ido Siovitz","Ido Siovitz, Stefan Lannig, Yannick Deller, Helmut Strobel, Markus K.
  Oberthaler and Thomas Gasenzer","Universal dynamics of rogue waves in a quenched spinor Bose condensate",,,,,"cond-mat.quant-gas hep-ph","http://arxiv.org/licenses/nonexclusive-distrib/1.0/","  Universal scaling dynamics of a many-body system far from equilibrium signals
the proximity of the time-evolution to a non-thermal fixed point. We find
universal dynamics connected with rogue-wave like events in the mutually
coupled magnetic components of a spinor gas which propagate in an effectively
random potential. The frequency of these caustics is affected by the time
varying spatial correlation length of the potential, giving rise to an
additional exponent $\delta_\mathrm{c} \simeq 1/3$ for temporal scaling, which
is different by a factor $\sim 4/3$ from the exponent $\beta_V \simeq 1/4$
characterizing the scaling of the correlation length $\ell_V \sim
t^{\,\beta_V}$ with time. As a result of the caustics, real-time instanton
defects appear in the Larmor phase of the spin-1 system as vortices in space
and time. The temporal correlations determining the frequency of instanton
events to occur scale in time as $t^{\, \delta_\mathrm{I}}$. This suggests that
the universality class of a non-thermal fixed point could be characterized by
different, mutually related exponents defining the coarsening evolution in time
and space, respectively. Our results have a strong relevance for understanding
pattern coarsening from first principles and potential implications for
dynamics ranging from the early universe to geophysical dynamics and micro
physics.
","[{""version"":""v1"",""created"":""Tue, 18 Apr 2023 20:58:41 GMT""}]","2023-04-20"
"2304.09294","Alberto Lastra","Alberto Lastra and S{\l}awomir Michalik","On sequences preserving q-Gevrey asymptotic expansions",,,,,"math.CV math.AP math.FA","http://creativecommons.org/licenses/by-nc-nd/4.0/","  The modification of the coefficients of formal power series is analyzed in
order that such variation preserves q-Gevrey asymptotic properties, in
particular q-Gevrey asymptotic expansions. A characterization of such sequences
is determined, providing a handy tool in practice. The sequence of q-factorials
is proved to preserve q-Gevrey asymptotic expansions.
","[{""version"":""v1"",""created"":""Tue, 18 Apr 2023 20:58:54 GMT""}]","2023-04-20"
"2304.09295","Mohammed Abdallah Dr","Mohammed H. Abdallah (1), Rasha M. Samir (1), Denis A. Leahy (2),
  Ashraf A. Shaker (1) ((1) Astronomy Department, National Research Institute
  of Astronomy and Geophysics (NRIAG), Cairo, Egypt, (2) Department of Physics
  and Astronomy, University of Calgary, Calgary, Canada)","Nustar observation of the binary system 4U 0114+65",,,"10.1093/mnras/stad1199",,"astro-ph.HE","http://arxiv.org/licenses/nonexclusive-distrib/1.0/","  The high mass X-ray binary system 4U 0114+65 was observed by Nustar in
October 2019, and by XMM-Newton in August 2015. Here we performed spectral and
timing analysis of the Nustar observation, and carry out timing analysis on the
XMM-Newton data. We measured the spin period of the neutron star from both
observations and found a spin-up rate $\dot{p} = 1.54 \pm 0.38 \times 10^{-6} s
s^{-1}$. During the Nustar observation two flares occured, one occured shortly
after the start of the observation and the other near the end separated by a
long period of low/quiescent- state. The large and sudden flares mostly
resulted from accretion of Corotating Interaction Region (CIR) material. A
common spectral model to HMXBs, powerlaw with high energy cutoff and absorption
at low energy, gave a good fit to both flaring and quiescent states. A
flourescent iron line was not required in fitting any of the states. On the
other hand, very tentative evidence of Cyclotron Resonant Scattering Feature
(CRSF) at $\sim$ 17 keV was found during fitting using cyclabs model, however
fitting improvement was not significant enough to confirm its detection, plus a
very narrow width (< 1 keV) was obtained for the line and its first harmonic.
Visual inspection of the spectra showed a deficiency of emission near the
expected first and second harmonic. Another important feature visually noticed
in the spectra is the presence of hard tail above 50 keV. This could be
explained by the shocked material bounding the CIR.
","[{""version"":""v1"",""created"":""Tue, 18 Apr 2023 20:58:56 GMT""}]","2023-05-04"
"2304.09296","Taehee Ko","Taehee Ko, Joseph Heindel, Xingyi Guan, Teresa Head-Gordon, David
  Williams-Young and Chao Yang","Using Diffusion Maps to Analyze Reaction Dynamics for a Hydrogen
  Combustion Benchmark Dataset",,,,,"physics.chem-ph physics.comp-ph","http://arxiv.org/licenses/nonexclusive-distrib/1.0/","  We use local diffusion maps to assess the quality of two types of collective
variables (CVs) for a recently published hydrogen combustion benchmark
dataset~\cite{guan2022benchmark} that contains ab initio molecular dynamics
trajectories and normal modes along minimum energy paths. This approach was
recently advocated in~\cite{tlldiffmap20} for assessing CVs and analyzing
reactions modeled by classical molecular dynamics simulations. We report the
effectiveness of this approach to molecular systems modeled by quantum ab
initio molecular dynamics. In addition to assessing the quality of CVs, we also
use global diffusion maps to perform committor analysis as proposed
in~\cite{tlldiffmap20}. We show that the committor function obtained from the
global diffusion map allows us to identify transition regions of interest in
several hydrogen combustion reaction channels.
","[{""version"":""v1"",""created"":""Tue, 18 Apr 2023 20:59:00 GMT""}]","2023-04-20"
"2304.09297","Daniel Egger","Conrad J. Haupt and Daniel J. Egger","Leakage in restless quantum gate calibration",,,,,"quant-ph","http://arxiv.org/licenses/nonexclusive-distrib/1.0/","  Quantum computers require high fidelity quantum gates. These gates are
obtained by routine calibration tasks that eat into the availability of
cloud-based devices. Restless circuit execution speeds-up characterization and
calibration by foregoing qubit reset in between circuits. Post-processing the
measured data recovers the desired signal. However, since the qubits are not
reset, leakage -- typically present at the beginning of the calibration -- may
cause issues. Here, we develop a simulator of restless circuit execution based
on a Markov Chain to study the effect of leakage. In the context of error
amplifying single-qubit gates sequences, we show that restless calibration
tolerates up to 0.5% of leakage which is large compared to the $10^{-4}$ gate
fidelity of modern single-qubit gates. Furthermore, we show that restless
circuit execution with leaky gates reduces by 33% the sensitivity of the ORBIT
cost function developed by J. Kelly et al. which is typically used in
closed-loop optimal control~[Phys. Rev. Lett. 112, 240504 (2014)]. Our results
are obtained with standard qubit state discrimination showing that restless
circuit execution is resilient against misclassified non-computational states.
In summary, the restless method is sufficiently robust against leakage in both
standard and closed-loop optimal control gate calibration to provided accurate
results.
","[{""version"":""v1"",""created"":""Tue, 18 Apr 2023 20:59:16 GMT""}]","2023-04-20"
"2304.09298","Andreas L\""ohne","Andreas L\""ohne","Existence of solutions for polyhedral convex set optimization problems","compared to the first version, the ordering cone C is now allowed to
  contain lines",,,,"math.OC","http://arxiv.org/licenses/nonexclusive-distrib/1.0/","  Polyhedral convex set optimization problems are the simplest optimization
problems with set-valued objective function. Their role in set optimization is
comparable to the role of linear programs in scalar optimization. Vector linear
programs and multiple objective linear programs provide proper subclasses. In
this article we choose a solution concept for arbitrary polyhedral convex set
optimization problems out of several alternatives, show existence of solutions
and characterize the existence of solutions in different ways. Two known
results are obtained as particular cases, both with proofs being easier than
the original ones: The existence of solutions of bounded polyhedral convex set
optimization problems and a characterization of the existence of solutions of
vector linear programs.
","[{""version"":""v1"",""created"":""Tue, 18 Apr 2023 21:01:38 GMT""},{""version"":""v2"",""created"":""Wed, 24 May 2023 12:36:52 GMT""}]","2023-05-25"
"2304.09299","Sam Ross","Sam Ross, Nicole Sullivan, Jina Yoon","Virtual Fidgets: Opportunities and Design Principles for Bringing
  Fidgeting to Online Learning","6 pages, 3 figures, CHI LBW 2023",,,,"cs.HC","http://arxiv.org/licenses/nonexclusive-distrib/1.0/","  We present design guidelines for incorporating fidgeting into the virtual
world as a tool for students in online lectures. Fidgeting is associated with
increased attention and self-regulation, and has the potential to help students
focus. Currently there are no fidgets, physical or virtual, designed for
preserving attention specifically in online learning environments, and no
heuristics for designing fidgets within this domain. We identify three virtual
fidget proxies to serve as design probes for studying student experiences with
virtual fidgeting. Through a study of eight students using our virtual fidget
proxies in online lectures, we identify eight emergent themes that encompass
student experience with virtual fidgeting in lectures. Based on these themes,
we present four principles for designing domain-specific virtual fidgets for
online lectures. We identify that virtual fidgets for lectures should be
context-aware, visually appealing, easy to adopt, and physically interactive.
","[{""version"":""v1"",""created"":""Tue, 18 Apr 2023 21:03:30 GMT""}]","2023-04-20"
"2304.09300","Rudy Dissler","Rudy Dissler","Relative trisections of fiber bundles over the circle","29 pages, 30 figures",,,,"math.GT math.DG","http://creativecommons.org/licenses/by/4.0/","  For an oriented $4$--dimensional fiber bundle over $S^{1}$, we build a
relative trisection from a sutured Heegaard splitting of the fiber. We provide
an algorithm to explicitly construct the associated relative trisection
diagram, from a sutured Heegaard diagram of the fiber. As an application, we
glue our relative trisection diagrams with existing diagrams to recover
trisected closed fiber bundles over $S^1$ and trisected spun manifolds, and to
provide trisections for $4$--dimensional open-books.
","[{""version"":""v1"",""created"":""Tue, 18 Apr 2023 21:08:01 GMT""}]","2023-04-20"
"2304.09301","Walid Maalej","Abir Bouraffa, Gian-Luca Fuhrmann, and Walid Maalej","Developers' Visuo-spatial Mental Model and Program Comprehension","To appear in 2023 International Conference on Software Engineering
  (ICSE 2023). Authors' version of the work",,,,"cs.SE","http://arxiv.org/licenses/nonexclusive-distrib/1.0/","  Previous works from research and industry have proposed a spatial
representation of code in a canvas, arguing that a navigational code space
confers developers the freedom to organise elements according to their
understanding. By allowing developers to translate logical relatedness into
spatial proximity, this code representation could aid in code navigation and
comprehension. However, the association between developers' code comprehension
and their visuo-spatial mental model of the code is not yet well understood.
This mental model is affected on the one hand by the spatial code
representation and on the other by the visuo-spatial working memory of
developers.
  We address this knowledge gap by conducting an online experiment with 20
developers following a between-subject design. The control group used a
conventional tab-based code visualization, while the experimental group used a
code canvas to complete three code comprehension tasks. Furthermore, we measure
the participants' visuo-spatial working memory using a Corsi Block test at the
end of the tasks. Our results suggest that, overall, neither the spatial
representation of code nor the visuo-spatial working memory of developers has a
significant impact on comprehension performance. However, we identified
significant differences in the time dedicated to different comprehension
activities such as navigation, annotation, and UI interactions.
","[{""version"":""v1"",""created"":""Tue, 18 Apr 2023 21:08:12 GMT""}]","2023-04-20"
"2304.09302","Adithyavairavan Murali","Adithyavairavan Murali, Arsalan Mousavian, Clemens Eppner, Adam
  Fishman, Dieter Fox","CabiNet: Scaling Neural Collision Detection for Object Rearrangement
  with Procedural Scene Generation",,,,,"cs.RO cs.CV","http://creativecommons.org/licenses/by/4.0/","  We address the important problem of generalizing robotic rearrangement to
clutter without any explicit object models. We first generate over 650K
cluttered scenes - orders of magnitude more than prior work - in diverse
everyday environments, such as cabinets and shelves. We render synthetic
partial point clouds from this data and use it to train our CabiNet model
architecture. CabiNet is a collision model that accepts object and scene point
clouds, captured from a single-view depth observation, and predicts collisions
for SE(3) object poses in the scene. Our representation has a fast inference
speed of 7 microseconds per query with nearly 20% higher performance than
baseline approaches in challenging environments. We use this collision model in
conjunction with a Model Predictive Path Integral (MPPI) planner to generate
collision-free trajectories for picking and placing in clutter. CabiNet also
predicts waypoints, computed from the scene's signed distance field (SDF), that
allows the robot to navigate tight spaces during rearrangement. This improves
rearrangement performance by nearly 35% compared to baselines. We
systematically evaluate our approach, procedurally generate simulated
experiments, and demonstrate that our approach directly transfers to the real
world, despite training exclusively in simulation. Robot experiment demos in
completely unknown scenes and objects can be found at this http
https://cabinet-object-rearrangement.github.io
","[{""version"":""v1"",""created"":""Tue, 18 Apr 2023 21:09:55 GMT""}]","2023-04-20"
"2304.09303","Giovanni Pellegrini Dr","Giovanni Pellegrini and Jacopo Bertolotti","Phase-Retrieval with Incomplete Autocorrelations Using Deep
  Convolutional Autoencoders",,,,,"eess.IV physics.optics","http://creativecommons.org/licenses/by/4.0/","  Phase-retrieval techniques aim to recover the original signal from just the
modulus of its Fourier transform, which is usually much easier to measure than
its phase, but the standard iterative techniques tend to fail if only part of
the modulus information is available. We show that a neural network can be
trained to perform phase retrieval using only incomplete information, and we
discuss advantages and limitations of this approach.
","[{""version"":""v1"",""created"":""Tue, 18 Apr 2023 21:10:26 GMT""}]","2023-04-20"
"2304.09304","Ciprian Manolescu","Sergei Gukov, James Halverson, Ciprian Manolescu, Fabian Ruehle","Searching for ribbons with machine learning","23 pages, 10 figures",,,,"math.GT cs.LG","http://arxiv.org/licenses/nonexclusive-distrib/1.0/","  We apply Bayesian optimization and reinforcement learning to a problem in
topology: the question of when a knot bounds a ribbon disk. This question is
relevant in an approach to disproving the four-dimensional smooth Poincar\'e
conjecture; using our programs, we rule out many potential counterexamples to
the conjecture. We also show that the programs are successful in detecting many
ribbon knots in the range of up to 70 crossings.
","[{""version"":""v1"",""created"":""Tue, 18 Apr 2023 21:12:56 GMT""}]","2023-04-20"
"2304.09305","Lili Zheng","Lili Zheng, Garvesh Raskutti","High-dimensional Multi-class Classification with Presence-only Data",,,,,"stat.ME math.ST stat.AP stat.TH","http://creativecommons.org/licenses/by/4.0/","  Classification with positive and unlabeled (PU) data frequently arises in
bioinformatics, clinical data, and ecological studies, where collecting
negative samples can be prohibitively expensive. While prior works on PU data
focus on binary classification, in this paper we consider multiple positive
labels, a practically important and common setting. We introduce a
multinomial-PU model and an ordinal-PU model, suited to unordered and ordered
labels respectively. We propose proximal gradient descent-based algorithms to
minimize the l_{1,2}-penalized log-likelihood losses, with convergence
guarantees to stationary points of the non-convex objective. Despite the
challenging non-convexity induced by the presence-only data and multi-class
labels, we prove statistical error bounds for the stationary points within a
neighborhood around the true parameters under the high-dimensional regime. This
is made possible through a careful characterization of the landscape of the
log-likelihood loss in the neighborhood. In addition, simulations and two real
data experiments demonstrate the empirical benefits of our algorithms compared
to the baseline methods.
","[{""version"":""v1"",""created"":""Tue, 18 Apr 2023 21:17:17 GMT""}]","2023-04-20"
"2304.09306","Sarah Frei","Sarah Frei and Lena Ji","A threefold violating a local-to-global principle for rationality","6 pages",,,,"math.AG math.NT","http://arxiv.org/licenses/nonexclusive-distrib/1.0/","  In this note we construct a conditional example of a smooth projective
threefold that is irrational over $\mathbb Q$ but is rational at all places.
Our example uses a genus $2$ curve $C$ of Bruin--Stoll and is conditional on
the Birch--Swinnerton-Dyer conjecture for $C$.
","[{""version"":""v1"",""created"":""Tue, 18 Apr 2023 21:27:54 GMT""}]","2023-04-20"
