"2304.11824","Arkadeep Narayan Chaudhury","Arkadeep Narayan Chaudhury and Christopher G. Atkeson","Controlled illumination for perception and manipulation of Lambertian
  objects","Project webpage: https://anonymousprojectsite.github.io/",,,,"cs.RO cs.CV","http://creativecommons.org/licenses/by-nc-sa/4.0/","  Controlling illumination can generate high quality information about object
surface normals and depth discontinuities at a low computational cost. In this
work we demonstrate a robot workspace-scaled controlled illumination approach
that generates high quality information for table top scale objects for robotic
manipulation. With our low angle of incidence directional illumination approach
we can precisely capture surface normals and depth discontinuities of
Lambertian objects. We demonstrate three use cases of our approach for robotic
manipulation. We show that 1) by using the captured information we can perform
general purpose grasping with a single point vacuum gripper, 2) we can visually
measure the deformation of known objects, and 3) we can estimate pose of known
objects and track unknown objects in the robot's workspace. Additional
demonstrations of the results presented in the work can be viewed on the
project webpage https://anonymousprojectsite.github.io/.
","[{""version"":""v1"",""created"":""Mon, 24 Apr 2023 05:18:24 GMT""}]","2023-04-25"
"2304.11825","Rodwell Kufakunesu","Woundjiagu\'e Apollinaire, Rodwell Kufakunesu, Julius Esunge","Optimal Investment-Consumption-Insurance with Partial Information and
  Correlation Between Assets Price and Factor Process","36 pages",,,,"math.OC","http://arxiv.org/licenses/nonexclusive-distrib/1.0/","  In this research, we present an analysis of the optimal investment,
consumption, and life insurance acquisition problem for a wage earner with
partial information. Our study considers the non-linear filter case where risky
asset prices are correlated to the factor processes under constant relative
risk aversion (CRRA) preferences. We introduce a more general framework with an
incomplete market, random parameters adapted to the Brownian motion filtration,
and a general factor process with a non-linear state estimation and a
correlation between the state process (risky asset prices) and the factor
process. To address the wage earner's problem, we formulate it as a stochastic
control problem with partial information where the risky assets prices are
correlated to the factor processes. Our framework is extensive since the
non-linear filter applied to the linear case gives a more robust result than
the Kalman filter. We obtain the non-linear filter through the Zakai equation
and derive a system of the Hamilton-Jacobi-Bellman (HJB) equation and two
backward stochastic differential equations (BSDE). We establish the existence
and uniqueness of the solution, prove the verification theorem, and construct
the optimal strategy.
","[{""version"":""v1"",""created"":""Mon, 24 Apr 2023 05:18:44 GMT""}]","2023-04-25"
"2304.11826","Marc Hellmuth","Marc Hellmuth and Peter F. Stadler","The Theory of Gene Family Histories",,,,,"q-bio.PE cs.DM math.CO","http://arxiv.org/licenses/nonexclusive-distrib/1.0/","  Most genes are part of larger families of evolutionary related genes. The
history of gene families typically involves duplications and losses of genes as
well as horizontal transfers into other organisms. The reconstruction of
detailed gene family histories, i.e., the precise dating of evolutionary events
relative to phylogenetic tree of the underlying species has remained a
challenging topic despite their importance as a basis for detailed
investigations into adaptation and functional evolution of individual members
of the gene family. The identification of orthologs, moreover, is a
particularly important subproblem of the more general setting considered here.
In the last few years, an extensive body of mathematical results has appeared
that tightly links orthology, a formal notion of best matches among genes, and
horizontal gene transfer. The purpose of this chapter is the broadly outline
some of the key mathematical insights and to discuss their implication for
practical applications. In particular, we focus on tree-free methods, i.e.,
methods to infer orthology or horizontal gene transfer as well as gene trees,
species trees and reconciliations between them without using \emph{a priori}
knowledge of the underlying trees or statistical models for the inference of
phylogenetic trees. Instead, the initial step aims to extract binary relations
among genes.
","[{""version"":""v1"",""created"":""Mon, 24 Apr 2023 05:26:15 GMT""}]","2023-04-25"
"2304.11827","Shivansh Walia","Shivansh Walia, Tejas Iyer, Shubham Tripathi and Akshith Vanaparthy","Safe and Secure Smart Home using Cisco Packet Tracer","11 pages",,,,"cs.CR cs.NI","http://creativecommons.org/publicdomain/zero/1.0/","  This project presents an implementation and designing of safe, secure and
smart home with enhanced levels of security features which uses IoT-based
technology. We got our motivation for this project after learning about
movement of west towards smart homes and designs. This galvanized us to engage
in this work as we wanted for homeowners to have a greater control over their
in-house environment while also promising more safety and security features for
the denizen. This contrivance of smart-home archetype has been intended to
assimilate many kinds of sensors, boards along with advanced IoT devices and
programming languages all of which in conjunction validate control and
monitoring prowess over discrete electronic items present in home.
","[{""version"":""v1"",""created"":""Mon, 24 Apr 2023 05:29:08 GMT""}]","2023-04-25"
"2304.11828","Min Yi","Min Yi, Ming Xue, Peihong Cong, Yang Song, Haiyang Zhang, Lingfeng
  Wang, Liucheng Zhou, Yinghong Li, Wanlin Guo","Machine learning for predicting fatigue properties of additively
  manufactured materials",,,,,"cond-mat.mtrl-sci","http://arxiv.org/licenses/nonexclusive-distrib/1.0/","  Fatigue properties of additively manufactured (AM) materials depend on many
factors such as AM processing parameter, microstructure, residual stress,
surface roughness, porosities, post-treatments, etc. Their evaluation
inevitably requires these factors combined as many as possible, thus resulting
in low efficiency and high cost. In recent years, their assessment by
leveraging the power of machine learning (ML) has gained increasing attentions.
Here, we present a comprehensive overview on the state-of-the-art progress of
applying ML strategies to predict fatigue properties of AM materials, as well
as their dependence on AM processing and post-processing parameters such as
laser power, scanning speed, layer height, hatch distance, built direction,
post-heat temperature, etc. A few attempts in employing feedforward neural
network (FNN), convolutional neural network (CNN), adaptive network-based fuzzy
system (ANFS), support vector machine (SVM) and random forest (RF) to predict
fatigue life and RF to predict fatigue crack growth rate are summarized. The ML
models for predicting AM materials' fatigue properties are found intrinsically
similar to the commonly used ones, but are modified to involve AM features.
Finally, an outlook for challenges (i.e., small dataset, multifarious features,
overfitting, low interpretability, unable extension from AM material data to
structure life) and potential solutions for the ML prediction of AM materials'
fatigue properties is provided.
","[{""version"":""v1"",""created"":""Mon, 24 Apr 2023 05:31:53 GMT""}]","2023-04-25"
"2304.11829","Lu Zeyu","Zeyu Lu, Chengyue Wu, Xinyuan Chen, Yaohui Wang, Lei Bai, Yu Qiao,
  Xihui Liu","Hierarchical Diffusion Autoencoders and Disentangled Image Manipulation",,,,,"cs.CV cs.AI","http://arxiv.org/licenses/nonexclusive-distrib/1.0/","  Diffusion models have attained impressive visual quality for image synthesis.
However, how to interpret and manipulate the latent space of diffusion models
has not been extensively explored. Prior work diffusion autoencoders encode the
semantic representations into a semantic latent code, which fails to reflect
the rich information of details and the intrinsic feature hierarchy. To
mitigate those limitations, we propose Hierarchical Diffusion Autoencoders
(HDAE) that exploit the fine-grained-to-abstract and lowlevel-to-high-level
feature hierarchy for the latent space of diffusion models. The hierarchical
latent space of HDAE inherently encodes different abstract levels of semantics
and provides more comprehensive semantic representations. In addition, we
propose a truncated-feature-based approach for disentangled image manipulation.
We demonstrate the effectiveness of our proposed approach with extensive
experiments and applications on image reconstruction, style mixing,
controllable interpolation, detail-preserving and disentangled image
manipulation, and multi-modal semantic image synthesis.
","[{""version"":""v1"",""created"":""Mon, 24 Apr 2023 05:35:59 GMT""},{""version"":""v2"",""created"":""Tue, 25 Apr 2023 17:11:34 GMT""}]","2023-04-26"
"2304.11830","Chao Ju","Chao Ju","Chern-Simons Theory, Ehrhart Polynomials, and Representation Theory",,,,,"math-ph hep-th math.MP","http://creativecommons.org/licenses/by/4.0/","  The Hilbert space of level $q$ Chern-Simons theory of gauge group $G$ of the
ADE type quantized on $T^2$ can be represented by points that lie on the weight
lattice of the Lie algebra $\mathfrak{g}$ up to some discrete identifications.
Of special significance are the points that also lie on the root lattice. The
generating functions that count the number of such points are quasi-periodic
Ehrhart polynomials which coincide with the generating functions of $SU(q)$
representation of the ADE subgroups of $SU(2)$ given by the McKay
correspondence.
","[{""version"":""v1"",""created"":""Mon, 24 Apr 2023 05:38:35 GMT""}]","2023-04-25"
"2304.11831","Janhavi Baghel","Janhavi Baghel, P. Kharb, Silpa S., Luis C. Ho, C. M. Harrison","Radio Polarization: A Powerful Resource for Understanding the Blazar
  Divide","Conference Proceeding - IAUS 375: The Multimessenger Chakra of Blazar
  Jets; 4 pages, 1 figure",,,,"astro-ph.GA","http://creativecommons.org/licenses/by/4.0/","  With high-sensitivity kiloparsec-scale radio polarimetry, we can examine the
jet-medium interactions and get a better understanding of the blazar divide in
radio-loud (RL) AGN. We are analyzing the radio polarimetric observations with
the EVLA and GMRT of 24 quasars and BL Lacs belonging to the Palomar-Green (PG)
sample. The RL quasars show extensive polarisation structures in their cores,
jets, lobes, and hotspots, whereas preliminary results suggest that BL Lacs
exhibit polarisation primarily in their cores and inner jet regions. These
findings imply that both intrinsic (central engine-related) and extrinsic
(environment-related) variables are important in the formation of the blazar
subclasses. The Fanaroff-Riley (FR) dichotomy can also be studied assuming RL
unification and looking through the lens of blazars. Due to the radio-unbiased
nature of the optically/UV-selected PG sample, we find a large fraction of the
PG quasars are restarted, distorted (S- or X-shaped), or have a hybrid FR
morphology.
","[{""version"":""v1"",""created"":""Mon, 24 Apr 2023 05:39:20 GMT""}]","2023-04-25"
"2304.11832","Dongyang Liu","Dongyang Liu, Meina Kan, Shiguang Shan, Xilin Chen","Function-Consistent Feature Distillation","ICLR 2023",,,,"cs.CV","http://arxiv.org/licenses/nonexclusive-distrib/1.0/","  Feature distillation makes the student mimic the intermediate features of the
teacher. Nearly all existing feature-distillation methods use L2 distance or
its slight variants as the distance metric between teacher and student
features. However, while L2 distance is isotropic w.r.t. all dimensions, the
neural network's operation on different dimensions is usually anisotropic,
i.e., perturbations with the same 2-norm but in different dimensions of
intermediate features lead to changes in the final output with largely
different magnitude. Considering this, we argue that the similarity between
teacher and student features should not be measured merely based on their
appearance (i.e., L2 distance), but should, more importantly, be measured by
their difference in function, namely how later layers of the network will read,
decode, and process them. Therefore, we propose Function-Consistent Feature
Distillation (FCFD), which explicitly optimizes the functional similarity
between teacher and student features. The core idea of FCFD is to make teacher
and student features not only numerically similar, but more importantly produce
similar outputs when fed to the later part of the same network. With FCFD, the
student mimics the teacher more faithfully and learns more from the teacher.
Extensive experiments on image classification and object detection demonstrate
the superiority of FCFD to existing methods. Furthermore, we can combine FCFD
with many existing methods to obtain even higher accuracy. Our codes are
available at https://github.com/LiuDongyang6/FCFD.
","[{""version"":""v1"",""created"":""Mon, 24 Apr 2023 05:43:29 GMT""}]","2023-04-25"
"2304.11833","Fil Simovic","Pravin Kumar Dahal, Fil Simovic","The Hawking temperature of dynamical black holes via Rindler
  transformations","10 pages, 1 figure. Comments welcome",,,,"gr-qc","http://creativecommons.org/licenses/by-nc-nd/4.0/","  The Vaidya metric serves as a useful model-building tool that captures many
essential features of dynamical and/or evaporating black hole spacetimes.
Working in a semiclassical setting, we show that in the limit of slow
evaporation, a general spherically symmetric metric subject to certain
regularity conditions is uniquely described by a linear ingoing Vaidya metric
in the near-horizon region. This suggests a universal description of the
near-horizon geometry of evaporating black holes in terms of the linear Vaidya
metric. We also demonstrate that the linear Vaidya metric can be brought into
manifestly conformally static form, allowing us to determine the Hawking
temperature associated with the Vaidya background with respect to the conformal
vacuum. Since back-reaction is implicitly accounted for, we conclude that
slowly evaporating black holes are indeed accurately described by quasistatic
sequences of Schwarzschild metrics even when dynamical effects are present.
","[{""version"":""v1"",""created"":""Mon, 24 Apr 2023 05:44:04 GMT""}]","2023-04-25"
"2304.11834","Yonggan Fu","Yonggan Fu, Ye Yuan, Shang Wu, Jiayi Yuan, Yingyan Lin","Robust Tickets Can Transfer Better: Drawing More Transferable
  Subnetworks in Transfer Learning","Accepted by DAC 2023",,,,"cs.LG","http://arxiv.org/licenses/nonexclusive-distrib/1.0/","  Transfer learning leverages feature representations of deep neural networks
(DNNs) pretrained on source tasks with rich data to empower effective
finetuning on downstream tasks. However, the pretrained models are often
prohibitively large for delivering generalizable representations, which limits
their deployment on edge devices with constrained resources. To close this gap,
we propose a new transfer learning pipeline, which leverages our finding that
robust tickets can transfer better, i.e., subnetworks drawn with properly
induced adversarial robustness can win better transferability over vanilla
lottery ticket subnetworks. Extensive experiments and ablation studies validate
that our proposed transfer learning pipeline can achieve enhanced
accuracy-sparsity trade-offs across both diverse downstream tasks and sparsity
patterns, further enriching the lottery ticket hypothesis.
","[{""version"":""v1"",""created"":""Mon, 24 Apr 2023 05:44:42 GMT""}]","2023-04-25"
"2304.11835","Yonggan Fu","Yonggan Fu, Yuecheng Li, Chenghui Li, Jason Saragih, Peizhao Zhang,
  Xiaoliang Dai, Yingyan Lin","Auto-CARD: Efficient and Robust Codec Avatar Driving for Real-time
  Mobile Telepresence","Accepted by CVPR 2023",,,,"cs.CV","http://arxiv.org/licenses/nonexclusive-distrib/1.0/","  Real-time and robust photorealistic avatars for telepresence in AR/VR have
been highly desired for enabling immersive photorealistic telepresence.
However, there still exists one key bottleneck: the considerable computational
expense needed to accurately infer facial expressions captured from
headset-mounted cameras with a quality level that can match the realism of the
avatar's human appearance. To this end, we propose a framework called
Auto-CARD, which for the first time enables real-time and robust driving of
Codec Avatars when exclusively using merely on-device computing resources. This
is achieved by minimizing two sources of redundancy. First, we develop a
dedicated neural architecture search technique called AVE-NAS for avatar
encoding in AR/VR, which explicitly boosts both the searched architectures'
robustness in the presence of extreme facial expressions and hardware
friendliness on fast evolving AR/VR headsets. Second, we leverage the temporal
redundancy in consecutively captured images during continuous rendering and
develop a mechanism dubbed LATEX to skip the computation of redundant frames.
Specifically, we first identify an opportunity from the linearity of the latent
space derived by the avatar decoder and then propose to perform adaptive latent
extrapolation for redundant frames. For evaluation, we demonstrate the efficacy
of our Auto-CARD framework in real-time Codec Avatar driving settings, where we
achieve a 5.05x speed-up on Meta Quest 2 while maintaining a comparable or even
better animation quality than state-of-the-art avatar encoder designs.
","[{""version"":""v1"",""created"":""Mon, 24 Apr 2023 05:45:12 GMT""}]","2023-04-25"
"2304.11836","Sizheng Ma","Sizheng Ma, Vijay Varma, Leo C. Stein, Francois Foucart, Matthew D.
  Duez, Lawrence E. Kidder, Harald P. Pfeiffer, Mark A. Scheel","Numerical simulations of black hole-neutron star mergers in
  scalar-tensor gravity",,,,,"gr-qc","http://arxiv.org/licenses/nonexclusive-distrib/1.0/","  We present a numerical-relativity simulation of a black hole - neutron star
merger in scalar-tensor (ST) gravity with binary parameters consistent with the
gravitational wave event GW200115. In this exploratory simulation, we consider
the Damour-Esposito-Farese extension to Brans-Dicke theory, and maximize the
effect of spontaneous scalarization by choosing a soft equation of state and ST
theory parameters at the edge of known constraints. We extrapolate the
gravitational waves, including tensor and scalar (breathing) modes, to future
null-infinity. The numerical waveforms undergo ~ 22 wave cycles before the
merger, and are in good agreement with predictions from post-Newtonian theory
during the inspiral. We find the ST system evolves faster than its
general-relativity (GR) counterpart due to dipole radiation, merging a full
gravitational-wave cycle before the GR counterpart. This enables easy
differentiation between the ST waveforms and GR in the context of parameter
estimation. However, we find that dipole radiation's effect may be partially
degenerate with the NS tidal deformability during the late inspiral stage, and
a full Bayesian analysis is necessary to fully understand the degeneracies
between ST and binary parameters in GR.
","[{""version"":""v1"",""created"":""Mon, 24 Apr 2023 05:59:16 GMT""}]","2023-04-25"
"2304.11837","Yao Su","Yao Su, Pengkang Yu, Matthew J. Gerber, Lecheng Ruan, Tsu-Chin Tsao","Fault-tolerant Control of Over-actuated UAV Platform under Propeller
  Failure",,,,,"cs.RO cs.SY eess.SY","http://creativecommons.org/licenses/by-nc-nd/4.0/","  Propeller failure is one major reason for the falling and crashing of
multirotor Unmanned Aerial Vehicles (UAVs). While conventional multirotors can
barely handle this issue due to underactuation, over-actuated platforms can
still pursue the flight with proper fault-tolerant control (FTC). This paper
investigates such a controller for one such over-actuated multirotor aerial
platform composing quadcopters mounted on passive joints with input redundancy
in both the high-level vehicle control and the low-level quadcopter control of
vectored thrusts. To fully utilize the input redundancies of the whole platform
under propeller failure, our proposed FTC controller has a hierarchical control
architecture with three main components: (i) a low-level adjustment strategy to
avoid propeller-level thrust saturation; (ii) a compensation loop to attenuate
introduced disturbance; (iii) a nullspace-based control allocation framework to
avoid quadcopter-level thrust saturation. Through reallocating actuator inputs
in both the low-level and high-level control loops, the low-level quadcopter
control can be maintained with at most two failed propellers and the whole
platform can be stabilized without crashing. The proposed controller is
extensively studied in both simulation and real-world experiments to
demonstrate its superior performance.
","[{""version"":""v1"",""created"":""Mon, 24 Apr 2023 06:05:24 GMT""}]","2023-04-25"
"2304.11838","Zhen Qin","Zhen Qin","Dynamic Compressive Sensing based on RLS for Underwater Acoustic
  Communications",,,,,"eess.SP","http://arxiv.org/licenses/nonexclusive-distrib/1.0/","  Sparse structures are widely recognized and utilized in channel estimation.
Two typical mechanisms, namely proportionate updating (PU) and zero-attracting
(ZA) techniques, achieve better performance, but their computational complexity
are higher than non-sparse counterparts. In this paper, we propose a DCS
technique based on the recursive least squares (RLS) algorithm which can
simultaneously achieve improved performance and reduced computational
complexity. Specifically, we develop the sparse adaptive subspace
pursuit-improved RLS (SpAdSP-IRLS) algorithm by updating only the sparse
structure in the IRLS to track significant coefficients. The complexity of the
SpAdSP-IRLS algorithm is successfully reduced to
$\mathcal{O}(L^2+2L(s+1)+10s)$, compared with the order of
$\mathcal{O}(3L^2+4L)$ for the standard RLS. Here, $L$ represents the length of
the channel, and $s$ represents the size of the support set. Our experiments on
both synthetic and real data show the superiority of the proposed SpAdSP-IRLS,
even though only $s$ elements are updated in the channel estimation.
","[{""version"":""v1"",""created"":""Mon, 24 Apr 2023 06:05:29 GMT""},{""version"":""v2"",""created"":""Thu, 4 May 2023 18:29:26 GMT""}]","2023-05-08"
"2304.11839","Naoya Onizawa","Naoya Onizawa, Kyo Kuroki, Duckgyu Shin, Takahiro Hanyu","Local Energy Distribution Based Hyperparameter Determination for
  Stochastic Simulated Annealing","13 pages",,,,"cs.LG math.OC","http://arxiv.org/licenses/nonexclusive-distrib/1.0/","  This paper presents a local energy distribution based hyperparameter
determination for stochastic simulated annealing (SSA). SSA is capable of
solving combinatorial optimization problems faster than typical simulated
annealing (SA), but requires a time-consuming hyperparameter search. The
proposed method determines hyperparameters based on the local energy
distributions of spins (probabilistic bits). The spin is a basic computing
element of SSA and is graphically connected to other spins with its weights.
The distribution of the local energy can be estimated based on the central
limit theorem (CLT). The CLT-based normal distribution is used to determine the
hyperparameters, which reduces the time complexity for hyperparameter search
from O(n^3) of the conventional method to O(1). The performance of SSA with the
determined hyperparameters is evaluated on the Gset and K2000 benchmarks for
maximum-cut problems. The results show that the proposed method achieves mean
cut values of approximately 98% of the best-known cut values.
","[{""version"":""v1"",""created"":""Mon, 24 Apr 2023 06:16:09 GMT""}]","2023-04-25"
"2304.11840","Dingwei Zhang","Yadang Chen, Dingwei Zhang, Zhi-xin Yang, Enhua Wu","Robust and Efficient Memory Network for Video Object Segmentation","Accepted by ICME 2023. 6 pages, 6 figures",,,,"cs.CV cs.MM","http://arxiv.org/licenses/nonexclusive-distrib/1.0/","  This paper proposes a Robust and Efficient Memory Network, referred to as
REMN, for studying semi-supervised video object segmentation (VOS).
Memory-based methods have recently achieved outstanding VOS performance by
performing non-local pixel-wise matching between the query and memory. However,
these methods have two limitations. 1) Non-local matching could cause
distractor objects in the background to be incorrectly segmented. 2) Memory
features with high temporal redundancy consume significant computing resources.
For limitation 1, we introduce a local attention mechanism that tackles the
background distraction by enhancing the features of foreground objects with the
previous mask. For limitation 2, we first adaptively decide whether to update
the memory features depending on the variation of foreground objects to reduce
temporal redundancy. Second, we employ a dynamic memory bank, which uses a
lightweight and differentiable soft modulation gate to decide how many memory
features need to be removed in the temporal dimension. Experiments demonstrate
that our REMN achieves state-of-the-art results on DAVIS 2017, with a
$\mathcal{J\&F}$ score of 86.3% and on YouTube-VOS 2018, with a $\mathcal{G}$
over mean of 85.5%. Furthermore, our network shows a high inference speed of
25+ FPS and uses relatively few computing resources.
","[{""version"":""v1"",""created"":""Mon, 24 Apr 2023 06:19:21 GMT""}]","2023-04-25"
