"2304.12105","Alexander Sushkov","Alexander O. Sushkov","EuCl$_3\cdot 6$H$_2$O as the solid-state platform for searches for new
  P,T-odd physics",,,,,"cond-mat.other","http://arxiv.org/licenses/nonexclusive-distrib/1.0/","  Condensed matter systems offer the opportunity to maximize the number of
spins, probed in magnetic resonance experiments that search for physics beyond
the standard model. EuCl$_3\cdot 6$H$_2$O is a promising solid-state platform
for such searches. The narrow inhomogeneous linewidth of the Eu optical
$^7\hspace{-0.1em}F_0 \leftrightarrow\,^5\hspace{-0.1em}D_0$ transition in this
material opens the opportunity to optically pump the $^{153}$Eu nuclear spin
ensemble into a single hyperfine sublevel. The closely-spaced opposite-parity
nuclear energy levels, and the low-energy collective octupole mode, or a
possible static octupole deformation, enhance the $^{153}$Eu nuclear Schiff
moment. The optimistic estimate of the effective electric field is
$E^*=10\,$MV/cm. With this estimate, the CASPEr-electric search for the gluon
interaction of axion dark matter can reach QCD axion sensitivity with a 3~cm
sample.
","[{""version"":""v1"",""created"":""Mon, 24 Apr 2023 14:06:40 GMT""}]","2023-04-25"
"2304.12106","Anibal Pacheco-Sanchez","Anibal Pacheco-Sanchez, Omar Jord\'an-Garc\'ia, Eloy
  Ram\'rez-Garc\'ia, David Jim\'enez","Static and small-signal modeling of radiofrequency hexagonal boron
  nitride switches",,"IEEE Journal of the Electron Devices Society, 2023","10.1109/JEDS.2023.3268349",,"physics.app-ph","http://arxiv.org/licenses/nonexclusive-distrib/1.0/","  A first modeling approximation of the general performance of radiofrequency
(RF) switches based on hexagonal boron nitride (hBN), a two-dimensional (2D)
dielectric material is presented. The I-V characteristics intrinsic and
extrinsic impedance parameters, the return loss, insertion loss and isolation
of RF 2D switches fabricated with hBN are described here by a equivalent
circuit models. Straightforward analytical expressions are obtained. In
contrast to conventional switches, the unique RF performance of the hBN switch,
at ON-state, i.e., a direct improvement with frequency of the insertion loss,
is accurately described by considering a capacitor in the intrinsic part of the
model. The latter is suggested to be related to storaged charge during the
resistive switching mechanism. The highest mean relative error obtained between
modeling and measurements of the return loss is of 7.6% with the approach
presented here which overcomes the 42.5% of difference obtained with a previous
model with an incomplete intrinsic device description.
","[{""version"":""v1"",""created"":""Mon, 24 Apr 2023 14:08:01 GMT""}]","2023-04-25"
"2304.12107","Hendrik M\""uller","Hendrik M\""uller, Alejandro Mus, Andrei Lobanov","Using multiobjective optimization to reconstruct interferometric data
  (I)","to appear in A&A",,,,"astro-ph.IM astro-ph.GA math.OC","http://creativecommons.org/licenses/by/4.0/","  Imaging in radioastronomy is an ill-posed inverse problem. Particularly the
Event Horizon Telescope (EHT) Collaboration investigated the fidelity of their
image reconstructions convincingly by large surveys solving the problem with
different optimization parameters. This strategy faces a limitation for the
existing methods when imaging the active galactic nuclei (AGN): large and
expensive surveys solving the problem with different optimization parameters
are time-consumptive. We present a novel nonconvex, multiobjective optimization
modeling approach that gives a different type of claim and may provide a
pathway to overcome this limitation. To this end we used a multiobjective
version of the genetic algorithm (GA): the Multiobjective Evolutionary
Algorithm Based on Decomposition, or MOEA/D. GA strategies explore the
objective function by evolutionary operations to find the different local
minima, and to avoid getting trapped in saddle points. First, we have tested
our algorithm (MOEA/D) using synthetic data based on the 2017 Event Horizon
Telescope (EHT) array and a possible EHT + next-generation EHT (ngEHT)
configuration. We successfully recover a fully evolved Pareto front of
non-dominated solutions for these examples. The Pareto front divides into
clusters of image morphologies representing the full set of locally optimal
solutions. We discuss approaches to find the most natural guess among these
solutions and demonstrate its performance on synthetic data. Finally, we apply
MOEA/D to observations of the black hole shadow in Messier 87 (M87) with the
EHT data in 2017. MOEA/D is very flexible, faster than any other Bayesian
method and explores more solutions than Regularized Maximum Likelihood methods
(RML).
","[{""version"":""v1"",""created"":""Mon, 24 Apr 2023 14:11:09 GMT""},{""version"":""v2"",""created"":""Wed, 26 Apr 2023 19:41:40 GMT""},{""version"":""v3"",""created"":""Sat, 13 May 2023 15:23:18 GMT""}]","2023-05-16"
"2304.12108","Johannes Bracher","Johannes Bracher, Lotta R\""uter, Fabian Kr\""uger, Sebastian Lerch,
  Melanie Schienle","Direction Augmentation in the Evaluation of Armed Conflict Predictions","8 pages, 3 figures",,,,"stat.AP","http://creativecommons.org/licenses/by/4.0/","  In many forecasting settings, there is a specific interest in predicting the
sign of an outcome variable correctly in addition to its magnitude. For
instance, when forecasting armed conflicts, positive and negative log-changes
in monthly fatalities represent escalation and de-escalation, respectively, and
have very different implications. In the ViEWS forecasting challenge, a
prediction competition on state-based violence, a novel evaluation score called
targeted absolute deviation with direction augmentation (TADDA) has therefore
been suggested, which accounts for both for the sign and magnitude of
log-changes. While it has a straightforward intuitive motivation, the empirical
results of the challenge show that a no-change model always predicting a
log-change of zero outperforms all submitted forecasting models under the TADDA
score. We provide a statistical explanation for this phenomenon. Analyzing the
properties of TADDA, we find that in order to achieve good scores, forecasters
often have an incentive to predict no or only modest log-changes. In
particular, there is often an incentive to report conservative point
predictions considerably closer to zero than the forecaster's actual predictive
median or mean. In an empirical application, we demonstrate that a no-change
model can be improved upon by tailoring predictions to the particularities of
the TADDA score. We conclude by outlining some alternative scoring concepts.
","[{""version"":""v1"",""created"":""Mon, 24 Apr 2023 14:11:40 GMT""}]","2023-04-25"
"2304.12109","Jamie Tucker-Foltz","Jan Dreier and Jamie Tucker-Foltz","Pseudorandom Finite Models","Extended version of LICS 2023 conference paper",,,,"cs.LO cs.CR","http://creativecommons.org/licenses/by/4.0/","  We study pseudorandomness and pseudorandom generators from the perspective of
logical definability. Building on results from ordinary derandomization and
finite model theory, we show that it is possible to deterministically
construct, in polynomial time, graphs and relational structures that are
statistically indistinguishable from random structures by any sentence of first
order or least fixed point logics. This raises the question of whether such
constructions can be implemented via logical transductions from simpler
structures with less entropy. In other words, can logical formulas be
pseudorandom generators? We provide a complete classification of when this is
possible for first order logic, fixed point logic, and fixed point logic with
parity, and provide partial results and conjectures for first order logic with
parity.
","[{""version"":""v1"",""created"":""Mon, 24 Apr 2023 14:12:00 GMT""}]","2023-04-25"
"2304.12110","Hugo Vanneuville","Hugo Vanneuville","Exponential decay of the volume for Bernoulli percolation: a proof via
  stochastic comparison","9 pages",,,,"math.PR","http://creativecommons.org/licenses/by/4.0/","  Let us consider subcritical Bernoulli percolation on a connected, transitive,
infinite and locally finite graph. In this paper, we propose a new (and short)
proof of the exponential decay property for the volume of clusters. We neither
rely on differential inequalities nor on the BK inequality. We rather use
stochastic comparison techniques, which are inspired by (and simpler than)
those proposed in [Van22] to study the diameter of clusters. We are also very
inspired by the adaptation of these techniques in [Eas22].
","[{""version"":""v1"",""created"":""Mon, 24 Apr 2023 14:13:09 GMT""}]","2023-04-25"
"2304.12111","Romain Petrides","Romain Petrides","Non planar free boundary minimal disks into ellipsoids",,,,,"math.DG math.AP","http://creativecommons.org/licenses/by/4.0/","  We prove the existence of embedded non planar free boundary minimal disks
into rotationally symmetric ellipsoids of $\mathbb{R}^3$. The construction
relies on the optimization of combinations of first and second Steklov
eigenvalues renormalized by the length of the boundary, among metrics on the
disk. We also prove that non planar free boundary harmonic maps from a disk
into a ellipsoid of $\mathbb{R}^3$ such that the coordinate functions are first
or second Steklov eigenfunctions with respect to the associated critical metric
is a minimal immersion (without branched points) and that if the critical
metric is even with respect to the coordinates of the disk, then the minimal
immersion is an embedding.
","[{""version"":""v1"",""created"":""Mon, 24 Apr 2023 14:14:13 GMT""}]","2023-04-25"
"2304.12112","Mikko Majamaa","Henrik Martikainen, Mikko Majamaa and Jani Puttonen","Coordinated Dynamic Spectrum Sharing Between Terrestrial and
  Non-Terrestrial Networks in 5G and Beyond","Accepted to be published in: 24th IEEE International Symposium on a
  World of Wireless, Mobile and Multimedia Networks (WoWMoM), June 12-15 2023,
  Boston, Massachusetts",,,,"cs.NI","http://creativecommons.org/licenses/by/4.0/","  The emerging Non-Terrestrial Networks (NTNs) can aid to provide 5G and beyond
services everywhere and anytime. However, the vast emergence of NTN systems
will introduce an unseen interference to both the existing satellite systems
and Terrestrial Networks (TNs). For that, there is a need for novel ideas on
how to efficiently utilize the co-existing systems with the ever-increasing
competition on scarce spectrum resources. Dynamic Spectrum Sharing (DSS) is a
promising technique in which different systems can operate on the same
spectrum, thus increasing the spectrum efficiency and offering better coverage
for the users. In this paper, we present a centralized scheme for achieving
coordinated DSS to protect the primary TN while providing NTN with sufficient
resources. The scheme is evaluated by system simulations in a scenario with a
TN and low earth orbit satellite. The results reveal that in a low traffic
demand situation, the primary TN users are not affected negatively while the
NTN can provide service to the rural area. In high-demand traffic situations,
the peak performance of the TN inevitably suffers but the TN cell edge and NTN
users' performance is improved.
","[{""version"":""v1"",""created"":""Mon, 24 Apr 2023 14:15:13 GMT""},{""version"":""v2"",""created"":""Tue, 25 Apr 2023 07:00:49 GMT""}]","2023-04-26"
"2304.12113","Zsombor Feh\'er","Zsombor Feh\'er","A note on non-isotopic Seifert surfaces in the 4-ball","6 pages, 2 figures",,,,"math.GT","http://arxiv.org/licenses/nonexclusive-distrib/1.0/","  We give a 2-parameter family of links and a 4-parameter family of knots with
pairs of Seifert surfaces that are not isotopic in $D^4$. This generalizes the
main example of Hayden-Kim-Miller-Park-Sundberg and the proof is similarly
based on the Seifert form.
","[{""version"":""v1"",""created"":""Mon, 24 Apr 2023 14:15:53 GMT""}]","2023-04-25"
"2304.12114","Pau Colomer Saus","Pau Colomer Saus and Andreas Winter","Decoupling by local random unitaries without simultaneous smoothing, and
  applications to multi-user quantum information tasks","33 pages, 6 figures. The idea of the telescoping trick has
  independently and concurrently been discovered for multipartite decoupling by
  Hao-Chung Cheng, Li Gao and Mario Berta",,,,"quant-ph cs.IT math-ph math.IT math.MP","http://creativecommons.org/licenses/by/4.0/","  We show that a simple telescoping sum trick, together with the triangle
inequality and a tensorisation property of expected-contractive coefficients of
random channels, allow us to achieve general simultaneous decoupling for
multiple users via local actions. Employing both old [Dupuis et al. Commun.
Math. Phys. 328:251-284 (2014)] and new methods [Dupuis, arXiv:2105.05342], we
obtain bounds on the expected deviation from ideal decoupling either in the
one-shot setting in terms of smooth min-entropies, or the finite block length
setting in terms of R\'enyi entropies. These bounds are essentially optimal
without the need to address the simultaneous smoothing conjecture, which
remains unresolved.
  This leads to one-shot, finite block length, and asymptotic achievability
results for several tasks in quantum Shannon theory, including local randomness
extraction of multiple parties, multi-party assisted entanglement
concentration, multi-party quantum state merging, and quantum coding for the
quantum multiple access channel. Because of the one-shot nature of our
protocols, we obtain achievability results without the need for time-sharing,
which at the same time leads to easy proofs of the asymptotic coding theorems.
We show that our one-shot decoupling bounds furthermore yield achievable rates
(so far only conjectured) for multi-user randomness extraction, multipartite
state merging and quantum multiple access channel communication in compound
settings, that is for only partially known i.i.d. source or channel.
","[{""version"":""v1"",""created"":""Mon, 24 Apr 2023 14:17:32 GMT""}]","2023-05-19"
"2304.12115","Bal\'azs Pej\'o","Balazs Pejo and Nikolett Kapui","SQLi Detection with ML: A data-source perspective","Extended version of an accepted paper at SECRYPT 2023",,,,"cs.CR cs.LG","http://creativecommons.org/licenses/by-nc-nd/4.0/","  Almost 50 years after the invention of SQL, injection attacks are still
top-tier vulnerabilities of today's ICT systems. Consequently, SQLi detection
is still an active area of research, where the most recent works incorporate
machine learning techniques into the proposed solutions. In this work, we
highlight the shortcomings of the previous ML-based results focusing on four
aspects: the evaluation methods, the optimization of the model parameters, the
distribution of utilized datasets, and the feature selection. Since no single
work explored all of these aspects satisfactorily, we fill this gap and provide
an in-depth and comprehensive empirical analysis. Moreover, we cross-validate
the trained models by using data from other distributions. This aspect of ML
models (trained for SQLi detection) was never studied. Yet, the sensitivity of
the model's performance to this is crucial for any real-life deployment.
Finally, we validate our findings on a real-world industrial SQLi dataset.
","[{""version"":""v1"",""created"":""Mon, 24 Apr 2023 14:17:34 GMT""}]","2023-04-25"
"2304.12116","Ananthu P. Surendran","Ananthu P. Surendran, Domenico Montemurro, Gunta Kunakova, Xavier
  Palermo, Kiryl Niherysh, Edoardo trabaldo, Dmitry Golubev, Jana Andzane,
  Donats Erts, Floriana Lombardi and Thilo Bauch","Current-phase relation of a short multi-mode Bi2Se3 topological
  insulator nanoribbon Josephson junction with ballistic transport modes",,"Supercond. Sci. Technol. 36 064003, 2023","10.1088/1361-6668/accf40",,"cond-mat.supr-con","http://creativecommons.org/licenses/by-nc-nd/4.0/","  We used the asymmetric superconducting quantum interference device (SQUID)
technique to extract the current phase relation (CPR) of a Josephson junction
with a 3D-topological insulator (TI) Bi2Se3 nanobelt as the barrier. The
obtained CPR shows deviations from the standard sinusoidal CPR with a
pronounced forward skewness. At temperatures below 200 mK, the junction
skewness values are above the zero temperature limit for short diffusive
junctions. Fitting of the extracted CPR shows that most of the supercurrent is
carried by ballistic topological surface states (TSSs), with a small
contribution of diffusive channels primarily due to the bulk. These findings
are instrumental in engineering devices that can fully exploit the properties
of the topologically protected surface states of 3D TIs.
","[{""version"":""v1"",""created"":""Mon, 24 Apr 2023 14:18:18 GMT""}]","2023-05-15"
"2304.12117","Leon M\""achler","Leon M\""achler, Ivan Ezhov, Suprosanna Shit, and Johannes C. Paetzold","FedPIDAvg: A PID controller inspired aggregation method for Federated
  Learning",,,,,"cs.LG","http://creativecommons.org/licenses/by/4.0/","  This paper presents FedPIDAvg, the winning submission to the Federated Tumor
Segmentation Challenge 2022 (FETS22). Inspired by FedCostWAvg, our winning
contribution to FETS21, we contribute an improved aggregation strategy for
federated and collaborative learning. FedCostWAvg is a weighted averaging
method that not only considers the number of training samples of each cluster
but also the size of the drop of the respective cost function in the last
federated round. This can be interpreted as the derivative part of a PID
controller (proportional-integral-derivative controller). In FedPIDAvg, we
further add the missing integral term. Another key challenge was the vastly
varying size of data samples per center. We addressed this by modeling the data
center sizes as following a Poisson distribution and choosing the training
iterations per center accordingly. Our method outperformed all other
submissions.
","[{""version"":""v1"",""created"":""Mon, 24 Apr 2023 14:20:53 GMT""}]","2023-04-25"
"2304.12118","Antti Niemi","Jianmei Wang, Jin Dai, Antti J. Niemi, Xubiao Peng","From Feynman's ratchet to timecrystalline molecular motors","3 figures 2 movies",,,,"cond-mat.soft nlin.AO physics.bio-ph q-bio.BM","http://creativecommons.org/licenses/by/4.0/","  Cats use the connection governing parallel transport in the space of shapes
to land safely on their feet. Here we argue that this connection also explains
the impressive performance of molecular motors by enabling molecules to evade
conclusions of Feynman's ratchet-and-pawl analysis. We first demonstrate, using
simple molecular models, how directed rotational motion can emerge from shape
changes even without angular momentum. We then computationally design knotted
polyalanine molecules and show how their shape space connection organizes
individual atom thermal vibrations into collective rotational motion,
independently of angular momentum. Our simulations show that rotational motion
arises effortlessly even in ambient water, making the molecule an effective
theory time crystal. Our findings have potential for practical molecular motor
design and engineering and can be verified through high-precision nuclear
magnetic resonance measurements.
","[{""version"":""v1"",""created"":""Mon, 24 Apr 2023 14:21:30 GMT""}]","2023-04-25"
"2304.12119","Romain Petrides","Romain Petrides","Laplace eigenvalues and non-planar minimal spheres into 3-dimensional
  ellipsoids",,,,,"math.DG math.AP","http://creativecommons.org/licenses/by/4.0/","  We give a sufficient condition for branched minimal immersions of spheres
into ellipsoids to be embedded: we show that if the coordinate functions of the
branched minimal immersion are first or second eigenfunctions with respect to a
natural metric on the sphere involved in this problem, called critical metric,
then it is an embedding into a 2-dimensional ellipsoid or an immersion into a
3-dimensional ellipsoid. If in addition this critical metric is rotationally
symmetric with respect to an axis and symmetric with respect to the orthogonal
plane then the immersion is an embedding. We also give a construction of
non-planar minimal spheres into 3-dimensional ellipsoids such that the
coordinate functions are first and second eigenfunctions with respect to the
critical metric obtained by maximization of linear combinations of first and
second (area renormalized) Laplace eigenvalues among metrics on the sphere
having the aforementionned symmetry constraints or not.
","[{""version"":""v1"",""created"":""Mon, 24 Apr 2023 14:21:57 GMT""}]","2023-04-25"
"2304.12120","Dachun Yang","Chaoan Li, Xianjie Yan and Dachun Yang","Anisotropic Ball Campanato-Type Function Spaces and Their Applications","64 pages; Submitted. arXiv admin note: text overlap with
  arXiv:2112.11653 by other authors",,,,"math.FA math.AP math.CA","http://arxiv.org/licenses/nonexclusive-distrib/1.0/","  Let $A$ be a general expansive matrix and let $X$ be a ball quasi-Banach
function space on $\mathbb R^n$, which supports both a Fefferman--Stein
vector-valued maximal inequality and the boundedness of the powered
Hardy--Littlewood maximal operator on its associate space. The authors first
introduce some anisotropic ball Campanato-type function spaces associated with
both $A$ and $X$, prove that these spaces are dual spaces of anisotropic Hardy
spaces $H_X^A(\mathbb R^n)$ associated with both $A$ and $X$, and obtain
various anisotropic Littlewood--Paley function characterizations of
$H_X^A(\mathbb R^n)$. Also, as applications, the authors establish several
equivalent characterizations of anisotropic ball Campanato-type function
spaces, which, combined with the atomic decomposition of tent spaces associated
with both $A$ and $X$, further induces their Carleson measure
characterizations. All these results have a wide range of generality and,
particularly, even when they are applied to Morrey spaces and Orlicz-slice
spaces, some of the obtained results are also new. The novelties of this
article are reflected in that, to overcome the essential difficulties caused by
the absence of both an explicit expression and the absolute continuity of
quasi-norm $\|\cdot\|_X$, the authors embed $X$ under consideration into the
anisotropic weighted Lebesgue space with certain special weight and then fully
use the known results of this weighted Lebesgue space.
","[{""version"":""v1"",""created"":""Mon, 24 Apr 2023 14:22:23 GMT""}]","2023-04-25"
"2304.12121","Luka Podrug","Tomislav Do\v{s}li\'c and Luka Podrug","Sweet division problems: from chocolate bars to honeycomb strips and
  back",,,,,"math.CO","http://creativecommons.org/licenses/by/4.0/","  We consider two division problems on narrow strips of square and hexagonal
lattices. In both cases we compute the bivariate enumerating sequences and the
corresponding generating functions, which allowed us to determine the
asymptotic behavior of the total number of such subdivisions and the expected
number of parts. For the square lattice we extend results of two recent
references by establishing polynomiality of enumerating sequences forming
columns and diagonals of the triangular enumerating sequence. In the hexagonal
case, we find a number of new combinatorial interpretations of the Fibonacci
numbers and find combinatorial proofs of some Fibonacci related identities. We
also show how both cases could be treated via the transfer matrix method and
discuss some directions for future research.
","[{""version"":""v1"",""created"":""Mon, 24 Apr 2023 14:24:30 GMT""}]","2023-04-25"
"2304.12122","Manuel Schwonberg","Manuel Schwonberg, Fadoua El Bouazati, Nico M. Schmidt, Hanno
  Gottschalk","Augmentation-based Domain Generalization for Semantic Segmentation","Accepted at Intelligent Vehicles Symposium 2023 (IV 2023)
  Autonomy@Scale Workshop",,,,"cs.CV cs.AI cs.LG cs.RO","http://arxiv.org/licenses/nonexclusive-distrib/1.0/","  Unsupervised Domain Adaptation (UDA) and domain generalization (DG) are two
research areas that aim to tackle the lack of generalization of Deep Neural
Networks (DNNs) towards unseen domains. While UDA methods have access to
unlabeled target images, domain generalization does not involve any target data
and only learns generalized features from a source domain. Image-style
randomization or augmentation is a popular approach to improve network
generalization without access to the target domain. Complex methods are often
proposed that disregard the potential of simple image augmentations for
out-of-domain generalization. For this reason, we systematically study the in-
and out-of-domain generalization capabilities of simple, rule-based image
augmentations like blur, noise, color jitter and many more. Based on a full
factorial design of experiment design we provide a systematic statistical
evaluation of augmentations and their interactions. Our analysis provides both,
expected and unexpected, outcomes. Expected, because our experiments confirm
the common scientific standard that combination of multiple different
augmentations out-performs single augmentations. Unexpected, because combined
augmentations perform competitive to state-of-the-art domain generalization
approaches, while being significantly simpler and without training overhead. On
the challenging synthetic-to-real domain shift between Synthia and Cityscapes
we reach 39.5% mIoU compared to 40.9% mIoU of the best previous work. When
additionally employing the recent vision transformer architecture DAFormer we
outperform these benchmarks with a performance of 44.2% mIoU
","[{""version"":""v1"",""created"":""Mon, 24 Apr 2023 14:26:53 GMT""}]","2023-04-25"
