"2304.11961","Sebastian Berns","Sebastian Berns, Simon Colton, Christian Guckelsberger","Towards Mode Balancing of Generative Models via Diversity Weights","Accepted for oral presentation and publication in the proceedings of
  the International Conference on Computational Creativity (ICCC) 2023",,,,"cs.LG cs.AI","http://creativecommons.org/licenses/by/4.0/","  Large data-driven image models are extensively used to support creative and
artistic work. Under the currently predominant distribution-fitting paradigm, a
dataset is treated as ground truth to be approximated as closely as possible.
Yet, many creative applications demand a diverse range of output, and creators
often strive to actively diverge from a given data distribution. We argue that
an adjustment of modelling objectives, from pure mode coverage towards mode
balancing, is necessary to accommodate the goal of higher output diversity. We
present diversity weights, a training scheme that increases a model's output
diversity by balancing the modes in the training dataset. First experiments in
a controlled setting demonstrate the potential of our method. We discuss
connections of our approach to diversity, equity, and inclusion in generative
machine learning more generally, and computational creativity specifically. An
implementation of our algorithm is available at
https://github.com/sebastianberns/diversity-weights
","[{""version"":""v1"",""created"":""Mon, 24 Apr 2023 09:55:17 GMT""},{""version"":""v2"",""created"":""Tue, 16 May 2023 14:35:37 GMT""}]","2023-05-17"
"2304.11962","The ATLAS Collaboration","ATLAS Collaboration","Search for high-mass $W\gamma$ and $Z\gamma$ resonances using hadronic
  W/Z boson decays from 139 fb$^{-1}$ of $pp$ collisions at $\sqrt{s}=$ 13 TeV
  with the ATLAS detector","43 pages in total, author list starting page 26, 8 figures, 3 tables,
  submitted to JHEP. All figures including auxiliary figures are available at
  http://atlas.web.cern.ch/Atlas/GROUPS/PHYSICS/PAPERS/HDBS-2019-10",,,"CERN-EP-2022-241","hep-ex","http://creativecommons.org/licenses/by/4.0/","  A search for high-mass charged and neutral bosons decaying to $W\gamma$ and
$Z\gamma$ final states is presented in this paper. The analysis uses a data
sample of $\sqrt{s} = 13$ TeV proton-proton collisions with an integrated
luminosity of 139 fb$^{-1}$ collected by the ATLAS detector during LHC Run 2
operation. The sensitivity of the search is determined using models of the
production and decay of spin-1 charged bosons and spin-0/2 neutral bosons. The
range of resonance masses explored extends from 1.0 TeV to 6.8 TeV. At these
high resonance masses, it is beneficial to target the hadronic decays of the
$W$ and $Z$ bosons because of their large branching fractions. The decay
products of the high-momentum $W/Z$ bosons are strongly collimated and
boosted-boson tagging techniques are employed to improve the sensitivity. No
evidence of a signal above the Standard Model backgrounds is observed, and
upper limits on the production cross-sections of these bosons times their
branching fractions to $W\gamma$ and $Z\gamma$ are derived for various boson
production models.
","[{""version"":""v1"",""created"":""Mon, 24 Apr 2023 09:55:35 GMT""}]","2023-04-25"
"2304.11963","Zhongda Chu","Zhuoxuan Li, Zhongda Chu, Fei Teng","Optimal Design of Neural Network Structure for Power System Frequency
  Security Constraints",,,,,"eess.SY cs.SY","http://creativecommons.org/licenses/by-nc-nd/4.0/","  Recently, frequency security is challenged by high uncertainty and low
inertia in power system with high penetration of Renewable Energy Sources
(RES). In the context of Unit Commitment (UC) problems, frequency security
constraints represented by neural networks have been developed and embedded
into the optimization problem to represent complicated frequency dynamics.
However, there are two major disadvantages related to this technique: the risk
of overconfident prediction and poor computational efficiency. To handle these
disadvantages, novel methodologies are proposed to optimally design the neural
network structure, including the use of asymmetric loss function during the
training stage and scientifically selecting neural network size and topology.
The effectiveness of the proposed methodologies are validated by case study
which reveals the improvement of conservativeness and mitigation of computation
performance issues.
","[{""version"":""v1"",""created"":""Mon, 24 Apr 2023 09:59:28 GMT""}]","2023-04-25"
"2304.11964","Shuhei Yokoo","Shuhei Yokoo, Peifei Zhu, Junki Ishikawa, Rintaro Hasegawa","3rd Place Solution to Meta AI Video Similarity Challenge",,,,,"cs.CV","http://creativecommons.org/licenses/by/4.0/","  This paper presents our 3rd place solution in both Descriptor Track and
Matching Track of the Meta AI Video Similarity Challenge (VSC2022), a
competition aimed at detecting video copies. Our approach builds upon existing
image copy detection techniques and incorporates several strategies to exploit
on the properties of video data, resulting in a simple yet powerful solution.
By employing our proposed method, we achieved substantial improvements in
accuracy compared to the baseline results (Descriptor Track: 38% improvement,
Matching Track: 60% improvement). Our code is publicly available here:
https://github.com/line/Meta-AI-Video-Similarity-Challenge-3rd-Place-Solution
","[{""version"":""v1"",""created"":""Mon, 24 Apr 2023 10:00:09 GMT""},{""version"":""v2"",""created"":""Thu, 18 May 2023 05:37:24 GMT""}]","2023-05-19"
"2304.11965","Pierre Naz\'e","Pierre Naz\'e","Optimal work fluctuations for finite-time and weak processes","3+1 pages, 3 figures. arXiv admin note: text overlap with
  arXiv:2210.11975",,,,"cond-mat.stat-mech","http://creativecommons.org/licenses/by/4.0/","  The optimal protocols for the irreversible work achieve their maximum
usefulness if their work fluctuations are the smallest ones. In this work, for
isothermal processes subjected to finite-time and weak drivings, I show using
the linear-response theory that the optimal protocol for the irreversible work
is the same for the variance of work. This conclusion is based on the work
fluctuation-dissipation theorem $\overline{W}=\Delta F+\beta \sigma_W^2/2$,
extended now to finite-time and weak drivings. To illustrate such a relation, I
analyze the example of an overdamped Brownian motion subjected to an anharmonic
stiffening trap and white noise for fast processes. By contrast with the
already known results in the literature for classical systems, the
linear-response theory approach of the work probabilistic distribution is not a
Gaussian reduction.
","[{""version"":""v1"",""created"":""Mon, 24 Apr 2023 10:01:28 GMT""}]","2023-04-25"
"2304.11966","Wenwen Yu","Wenwen Yu, Mingyu Liu, Mingrui Chen, Ning Lu, Yinlong Wen, Yuliang
  Liu, Dimosthenis Karatzas, Xiang Bai","ICDAR 2023 Competition on Reading the Seal Title","ICDAR2023 Competition on ReST report (To be appear in ICDAR 2023)",,,,"cs.CV","http://arxiv.org/licenses/nonexclusive-distrib/1.0/","  Reading seal title text is a challenging task due to the variable shapes of
seals, curved text, background noise, and overlapped text. However, this
important element is commonly found in official and financial scenarios, and
has not received the attention it deserves in the field of OCR technology. To
promote research in this area, we organized ICDAR 2023 competition on reading
the seal title (ReST), which included two tasks: seal title text detection
(Task 1) and end-to-end seal title recognition (Task 2). We constructed a
dataset of 10,000 real seal data, covering the most common classes of seals,
and labeled all seal title texts with text polygons and text contents. The
competition opened on 30th December, 2022 and closed on 20th March, 2023. The
competition attracted 53 participants from academia and industry including 28
submissions for Task 1 and 25 submissions for Task 2, which demonstrated
significant interest in this challenging task. In this report, we present an
overview of the competition, including the organization, challenges, and
results. We describe the dataset and tasks, and summarize the submissions and
evaluation results. The results show that significant progress has been made in
the field of seal title text reading, and we hope that this competition will
inspire further research and development in this important area of OCR
technology.
","[{""version"":""v1"",""created"":""Mon, 24 Apr 2023 10:01:41 GMT""},{""version"":""v2"",""created"":""Mon, 5 Jun 2023 21:56:29 GMT""}]","2023-06-07"
"2304.11967","David Beyer","David Beyer, Christian Holm","A Generalized Grand-Reaction Method for Modelling the Exchange of Weak
  (Polyprotic) Acids between a Solution and a Weak Polyelectrolyte Phase","17 pages, 9 figures",,,,"cond-mat.soft","http://creativecommons.org/licenses/by/4.0/","  We introduce a Monte-Carlo method that allows for the simulation of a
polymeric phase containing a weak polyelectrolyte, which is coupled to a
reservoir at a fixed pH, salt concentration and total concentration of a weak
polyprotic acid. The method generalizes the established Grand-Reaction Method
by Landsgesell et al. [Macromolecules 53, 3007-3020 (2020)] and thus allows for
the simulation of polyelectrolyte systems coupled to reservoirs with a more
complex chemical composition. In order to set the required input parameters
that correspond to a desired reservoir composition, we propose a generalization
of the recently published chemical potential tuning algorithm of Miles et al.
[Phys. Rev. E 105, 045311 (2022)]. To test the proposed tuning procedure, we
perform extensive numerical tests for both ideal and interacting systems.
Finally, as a showcase, we apply the method to a simple test system which
consists of a weak polybase solution that is coupled to a reservoir containing
a small diprotic acid. The complex interplay of the ionization various species,
the electrostatic interactions and the partitioning of small ions leads to a
non-monotonous, stepwise swelling behaviour of the weak polybase chains.
","[{""version"":""v1"",""created"":""Mon, 24 Apr 2023 10:02:05 GMT""}]","2023-04-25"
"2304.11968","Zhe Li","Jinyu Yang, Mingqi Gao, Zhe Li, Shang Gao, Fangjing Wang, Feng Zheng","Track Anything: Segment Anything Meets Videos","Tech-report",,,,"cs.CV","http://arxiv.org/licenses/nonexclusive-distrib/1.0/","  Recently, the Segment Anything Model (SAM) gains lots of attention rapidly
due to its impressive segmentation performance on images. Regarding its strong
ability on image segmentation and high interactivity with different prompts, we
found that it performs poorly on consistent segmentation in videos. Therefore,
in this report, we propose Track Anything Model (TAM), which achieves
high-performance interactive tracking and segmentation in videos. To be
detailed, given a video sequence, only with very little human participation,
i.e., several clicks, people can track anything they are interested in, and get
satisfactory results in one-pass inference. Without additional training, such
an interactive design performs impressively on video object tracking and
segmentation. All resources are available on
{https://github.com/gaomingqi/Track-Anything}. We hope this work can facilitate
related research.
","[{""version"":""v1"",""created"":""Mon, 24 Apr 2023 10:04:06 GMT""},{""version"":""v2"",""created"":""Fri, 28 Apr 2023 03:21:27 GMT""}]","2023-05-01"
"2304.11969","Ziqi Xu","Ziqi Xu, Debo Cheng, Jiuyong Li, Jixue Liu, Lin Liu, Kui Yu","Causal Effect Estimation with Variational AutoEncoder and the Front Door
  Criterion",,,,,"cs.LG stat.ME","http://arxiv.org/licenses/nonexclusive-distrib/1.0/","  An essential problem in causal inference is estimating causal effects from
observational data. The problem becomes more challenging with the presence of
unobserved confounders. When there are unobserved confounders, the commonly
used back-door adjustment is not applicable. Although the instrumental variable
(IV) methods can deal with unobserved confounders, they all assume that the
treatment directly affects the outcome, and there is no mediator between the
treatment and the outcome. This paper aims to use the front-door criterion to
address the challenging problem with the presence of unobserved confounders and
mediators. In practice, it is often difficult to identify the set of variables
used for front-door adjustment from data. By leveraging the ability of deep
generative models in representation learning, we propose FDVAE to learn the
representation of a Front-Door adjustment set with a Variational AutoEncoder,
instead of trying to search for a set of variables for front-door adjustment.
Extensive experiments on synthetic datasets validate the effectiveness of FDVAE
and its superiority over existing methods. The experiments also show that the
performance of FDVAE is not sensitive to the causal strength of unobserved
confounders and is feasible in the case of dimensionality mismatch between
learned representations and the ground truth. We further apply the method to
three real-world datasets to demonstrate its potential applications.
","[{""version"":""v1"",""created"":""Mon, 24 Apr 2023 10:04:28 GMT""}]","2023-04-25"
"2304.11970","Zerui Chen","Zerui Chen, Shizhe Chen, Cordelia Schmid, Ivan Laptev","gSDF: Geometry-Driven Signed Distance Functions for 3D Hand-Object
  Reconstruction","Accepted by CVPR 2023. Project Page:
  https://zerchen.github.io/projects/gsdf.html",,,,"cs.CV","http://arxiv.org/licenses/nonexclusive-distrib/1.0/","  Signed distance functions (SDFs) is an attractive framework that has recently
shown promising results for 3D shape reconstruction from images. SDFs
seamlessly generalize to different shape resolutions and topologies but lack
explicit modelling of the underlying 3D geometry. In this work, we exploit the
hand structure and use it as guidance for SDF-based shape reconstruction. In
particular, we address reconstruction of hands and manipulated objects from
monocular RGB images. To this end, we estimate poses of hands and objects and
use them to guide 3D reconstruction. More specifically, we predict kinematic
chains of pose transformations and align SDFs with highly-articulated hand
poses. We improve the visual features of 3D points with geometry alignment and
further leverage temporal information to enhance the robustness to occlusion
and motion blurs. We conduct extensive experiments on the challenging ObMan and
DexYCB benchmarks and demonstrate significant improvements of the proposed
method over the state of the art.
","[{""version"":""v1"",""created"":""Mon, 24 Apr 2023 10:05:48 GMT""}]","2023-04-25"
"2304.11971","Laszlo Lovasz","D\'aniel Keliger, L\'aszl\'o Lov\'asz, Tam\'as M\'ori, Gergely \'Odor","Switchover phenomenon for general graphs",,,,,"math.CO math.PR","http://creativecommons.org/licenses/by/4.0/","  We study SIR type epidemics on graphs in two scenarios: (i) when the initial
infections start from a well connected central region, (ii) when initial
infections are distributed uniformly. Previously, \'Odor et al. demonstrated on
a few random graph models that the expectation of the total number of
infections undergoes a switchover phenomenon; the central region is more
dangerous for small infection rates, while for large rates, the uniform seeding
is expected to infect more nodes. We rigorously prove this claim under mild,
deterministic assumptions on the underlying graph. If we further assume that
the central region has a large enough expansion, the second moment of the
degree distribution is bounded and the number of initial infections is
comparable to the number of vertices, the difference between the two scenarios
is shown to be macroscopic.
","[{""version"":""v1"",""created"":""Mon, 24 Apr 2023 10:09:34 GMT""}]","2023-04-25"
"2304.11972","Sebastien Elie Hadjadj","S. E. Hadjadj, C. Gonz\'alez-Orellana, J. Lawrence, D. Bikaljevi\'c,
  M. Pe\~na-D\'iaz, P. Gargiani, L. Aballe, J. Naumann, M. \'A. Ni\~no, M.
  Foerster, S. Ruiz-G\'omez, S. Thakur, I. Kumberg, J. Taylor, J. Hayes, J.
  Torres, C. Luo, F. Radu, D. G. de Oteyza, W. Kuch, J. I. Pascual, C. Rogero,
  M. Ilyn","Epitaxial monolayers of magnetic 2D semiconductor FeBr$_{2}$ grown on
  Au(111)","20 pages, 17 figures,",,,,"cond-mat.mtrl-sci","http://creativecommons.org/licenses/by/4.0/","  Magnetic two-dimensional (2D) semiconductors have attracted a lot of
attention because modern preparation techniques are capable of providing single
crystal films of these materials with precise control of thickness down to the
single-layer limit. It opens up a way to study rich variety of electronic and
magnetic phenomena with promising routes towards potential applications. We
have investigated the initial stages of epitaxial growth of the magnetic van
der Waals semiconductor FeBr\textsubscript{2} on a single-crystal Au(111)
substrate by means of low-temperature scanning tunneling microscopy, low-energy
electron diffraction, x-ray photoemission spectroscopy, low-energy electron
emission microscopy and x-ray photoemission electron microscopy. Magnetic
properties of the one- and two-layer thick films were measured via x-ray
absorption spectroscopy/x-ray magnetic circular dichroism. Our findings show a
striking difference in the magnetic behaviour of the single layer of
FeBr\textsubscript{2} and its bulk counterpart, which can be attributed to the
modifications in the crystal structure due to the interaction with the
substrate.
","[{""version"":""v1"",""created"":""Mon, 24 Apr 2023 10:12:26 GMT""}]","2023-04-25"
"2304.11973","Malgorzata Frelek-Kozak Mrs.","A. Zaborowska, \L. Kurpaska, M. Clozel, E.J. Olivier, J.H. O'Connell,
  M. Vanazzi, F. Di Fonzo, A. Azarov, I. J\'o\'zwik, M. Frelek-Kozak,
  R.Diduszko, J.H. Neethling, J. Jagielski","Absolute radiation tolerance of amorphous alumina coatings at room
  temperature",,"Ceramics International 47 (2021) 34740 34750","10.1016/j.ceramint.2021.09.013",,"cond-mat.mtrl-sci","http://creativecommons.org/licenses/by-nc-nd/4.0/","  In this study structural and mechanical properties of a 1 um thick Al2O3
coating, deposited on 316L stainless steel by Pulsed Laser Deposition (PLD),
subjected to high energy ion irradiation were assessed. Mechanical properties
of pristine and ion-modified specimens were investigated using the
nanoindentation technique. A comprehensive characterization combining
Transmission Electron Microscopy and Grazing-Incidence X-ray Diffraction
provided deep insight into the structure of the tested material at the nano-
and micro- scale. Variation in the local atomic ordering of the irradiated zone
at different doses was investigated using a reduced distribution function
analysis obtained from electron diffraction data. Findings from nanoindentation
measurements revealed a slight reduction in hardness of all irradiated layers.
At the same time TEM examination indicated that the irradiated layer remained
amorphous over the whole dpa range. No evidence of crystallization, void
formation or element segregation was observed up to the highest implanted dose.
Reported mechanical and structural findings were critically compared with each
other pointing to the conclusion that under given irradiation conditions, over
the whole range of doses used, alumina coatings exhibit excellent radiation
resistance. Obtained data strongly suggest that investigated material may be
considered as a promising candidate for next-generation nuclear reactors,
especially LFR-type, where high corrosion protection is one of the highest
prerogatives to be met.
","[{""version"":""v1"",""created"":""Mon, 24 Apr 2023 10:13:28 GMT""}]","2023-04-25"
"2304.11974","Henrique Buglia","H. Buglia, M. Jarmolovicius, L. Galdino, R.I. Killey, and P. Bayvel","A Closed-form Expression for the Gaussian Noise Model in the Presence of
  Raman Amplification","arXiv admin note: text overlap with arXiv:2210.09067",,,,"eess.SP","http://creativecommons.org/licenses/by/4.0/","  A closed-form model for the nonlinear interference (NLI) in Raman amplified
links is presented, the formula accounts for both forward (FW) and backward
(BW) pumping schemes and inter-channel stimulated Raman scattering (ISRS)
effect. The formula also accounts for an arbitrary number of pumps, discrete or
distributed Raman amplification setup, wavelength-dependent fibre parameters,
and launch power profiles. The formula is suitable for ultra-wideband (UWB)
optical transmission systems and is applied in a system with 13 THz optical
bandwidth corresponding to transmission over the S-, C-, and L- band. The
accuracy of the closed-form formula is validated through comparison with
numerical integration of the Gaussian noise (GN) model and split-step Fourier
method (SSFM) simulations in a point-to-point transmission link.
","[{""version"":""v1"",""created"":""Mon, 24 Apr 2023 10:15:03 GMT""},{""version"":""v2"",""created"":""Tue, 30 May 2023 12:21:36 GMT""}]","2023-05-31"
"2304.11975","Yin-Dong Zheng","Yin-Dong Zheng, Guo Chen, Minglei Yuan, Tong Lu","MRSN: Multi-Relation Support Network for Video Action Detection","6 pages",,,,"cs.CV","http://creativecommons.org/licenses/by/4.0/","  Action detection is a challenging video understanding task, requiring
modeling spatio-temporal and interaction relations. Current methods usually
model actor-actor and actor-context relations separately, ignoring their
complementarity and mutual support. To solve this problem, we propose a novel
network called Multi-Relation Support Network (MRSN). In MRSN, Actor-Context
Relation Encoder (ACRE) and Actor-Actor Relation Encoder (AARE) model the
actor-context and actor-actor relation separately. Then Relation Support
Encoder (RSE) computes the supports between the two relations and performs
relation-level interactions. Finally, Relation Consensus Module (RCM) enhances
two relations with the long-term relations from the Long-term Relation Bank
(LRB) and yields a consensus. Our experiments demonstrate that modeling
relations separately and performing relation-level interactions can achieve and
outperformer state-of-the-art results on two challenging video datasets: AVA
and UCF101-24.
","[{""version"":""v1"",""created"":""Mon, 24 Apr 2023 10:15:31 GMT""}]","2023-04-25"
"2304.11976","Kenichi Fujita","Kenichi Fujita, Takanori Ashihara, Hiroki Kanagawa, Takafumi Moriya,
  Yusuke Ijima","Zero-shot text-to-speech synthesis conditioned using self-supervised
  speech representation model","5 pages,3 figures, Accepted to IEEE ICASSP 2023 workshop
  Self-supervision in Audio, Speech and Beyond",,,,"cs.SD cs.LG eess.AS","http://arxiv.org/licenses/nonexclusive-distrib/1.0/","  This paper proposes a zero-shot text-to-speech (TTS) conditioned by a
self-supervised speech-representation model acquired through self-supervised
learning (SSL). Conventional methods with embedding vectors from x-vector or
global style tokens still have a gap in reproducing the speaker characteristics
of unseen speakers. A novel point of the proposed method is the direct use of
the SSL model to obtain embedding vectors from speech representations trained
with a large amount of data. We also introduce the separate conditioning of
acoustic features and a phoneme duration predictor to obtain the disentangled
embeddings between rhythm-based speaker characteristics and
acoustic-feature-based ones. The disentangled embeddings will enable us to
achieve better reproduction performance for unseen speakers and rhythm transfer
conditioned by different speeches. Objective and subjective evaluations showed
that the proposed method can synthesize speech with improved similarity and
achieve speech-rhythm transfer.
","[{""version"":""v1"",""created"":""Mon, 24 Apr 2023 10:15:58 GMT""}]","2023-04-25"
"2304.11977","Jenny Taylor","The PANDA Collaboration","Hyperon signatures in the PANDA experiment at FAIR",,,,,"nucl-ex hep-ex","http://creativecommons.org/licenses/by-nc-nd/4.0/","  We present a detailed simulation study of the signatures from the sequential
decays of the triple-strange pbar p -> {\Omega}+{\Omega}- -> K+{\Lambda}barK-
{\Lambda} -> K+pbar{\pi}+K-p{\pi}- process in the PANDA central tracking system
with focus on hit patterns and precise time measurement. We present a
systematic approach for studying physics channels at the detector level and
develop input criteria for tracking algorithms and trigger lines. Finally, we
study the beam momentum dependence on the reconstruction efficiency for the
PANDA detector.
","[{""version"":""v1"",""created"":""Mon, 24 Apr 2023 10:17:41 GMT""}]","2023-04-25"
