"2303.14416","Mohammad Qatawneh","Baker Alhasn, Mohammad Qatawneh, Wesam Alkmobaideen","Blockchain Technology for Preventing Counterfeit in Health Insurance","I uploaded the wrong paper, which has been already published in 2021
  international Conference on Information Technology (ICIT)",,,,"cs.CR","http://creativecommons.org/licenses/by-sa/4.0/","  The paper proposes a Blockchain (BC) system to prevent counterfeiting in
health insurance sector. The results show the system strength in terms of
achieving data integrity and privacy of data. Moreover, the results show that
the consensus algorithm can effectively reduce the total validation time for
the proposed system.
","[{""version"":""v1"",""created"":""Sat, 25 Mar 2023 09:50:36 GMT""},{""version"":""v2"",""created"":""Wed, 29 Mar 2023 06:30:46 GMT""}]","2023-03-30"
"2303.14417","Hao Wang","Hao Wang","Analysis and Visualization of the Parameter Space of Matrix
  Factorization-based Recommender Systems",,,,,"cs.IR","http://creativecommons.org/licenses/by/4.0/","  Recommender system is the most successful commercial technology in the past
decade. Technical mammoth such as Temu, TikTok and Amazon utilize the
technology to generate enormous revenues each year. Although there have been
enough research literature on accuracy enhancement of the technology,
explainable AI is still a new idea to the field. In 2022, the author of this
paper provides a geometric interpretation of the matrix factorization-based
methods and uses geometric approximation to solve the recommendation problem.
We continue the research in this direction in this paper, and visualize the
inner structure of the parameter space of matrix factorization technologies. We
show that the parameters of matrix factorization methods are distributed within
a hyper-ball. After further analysis, we prove that the distribution of the
parameters is not multivariate normal.
","[{""version"":""v1"",""created"":""Sat, 25 Mar 2023 09:58:19 GMT""}]","2023-03-28"
"2303.14418","Baocheng Zhang","Hongbin Zhang, Baocheng Zhang","Shielding of Penrose superradiance in optical black holes",,"Eur. Phys. J. C 83, 233 (2023)","10.1140/epjc/s10052-023-11389-y",,"gr-qc","http://arxiv.org/licenses/nonexclusive-distrib/1.0/","  We investigate the effect of superradiance shielding for the analogue
rotating black holes simulated by optical vortices by calculating the radial
motion of massless particles in such spacetime background. We add the
conditions $E<L\Omega_{r_{e}}$ and $L>0$ to judge the classically forbidden
region of superradiance. It is found that the superradiance forbidden region
exists near the static limit inside the ergosphere,which will limit the
classical Penrose process for the particles with some specific energies and
angular momenta. Once these particles satisfying the superradiance conditions
aremeasured at the outside of the ergosphere, this shows that the Penrose
process can be quantum.
","[{""version"":""v1"",""created"":""Sat, 25 Mar 2023 10:03:18 GMT""}]","2023-03-28"
"2303.14419","Hao Wang","Hao Wang","Evolution of the Online Rating Platform Data Structures and its
  Implications for Recommender Systems",,,,,"cs.IR","http://creativecommons.org/licenses/by/4.0/","  Online rating platform represents the new trend of online cultural and
commercial goods consumption. The user rating data on such platforms are foods
for recommender system algorithms. Understanding the evolution pattern and its
underlying mechanism is the key to understand the structures of input data for
recommender systems. Prior research on input data analysis for recommender
systems is quite limited, with a notable exception in 2018 [6]. In this paper,
we take advantage of Poisson Process to analyze the evolution mechanism of the
input data structures. We discover that homogeneous Poisson Process could not
capture the mechanism of user rating behavior on online rating platforms, and
inhomogeneous Poisson Process is compatible with the formation process.
","[{""version"":""v1"",""created"":""Sat, 25 Mar 2023 10:07:59 GMT""}]","2023-03-28"
"2303.14420","Xiaoshi Wu","Xiaoshi Wu, Keqiang Sun, Feng Zhu, Rui Zhao, Hongsheng Li","Better Aligning Text-to-Image Models with Human Preference","15 pages, 11 figures",,,,"cs.CV cs.AI","http://creativecommons.org/licenses/by/4.0/","  Recent years have witnessed a rapid growth of deep generative models, with
text-to-image models gaining significant attention from the public. However,
existing models often generate images that do not align well with human
aesthetic preferences, such as awkward combinations of limbs and facial
expressions. To address this issue, we collect a dataset of human choices on
generated images from the Stable Foundation Discord channel. Our experiments
demonstrate that current evaluation metrics for generative models do not
correlate well with human choices. Thus, we train a human preference classifier
with the collected dataset and derive a Human Preference Score (HPS) based on
the classifier. Using the HPS, we propose a simple yet effective method to
adapt Stable Diffusion to better align with human aesthetic preferences. Our
experiments show that the HPS outperforms CLIP in predicting human choices and
has good generalization capability towards images generated from other models.
By tuning Stable Diffusion with the guidance of the HPS, the adapted model is
able to generate images that are more preferred by human users.
","[{""version"":""v1"",""created"":""Sat, 25 Mar 2023 10:09:03 GMT""}]","2023-04-10"
"2303.14421","Dominik J. M\""uhlematter","Dominik J. M\""uhlematter, Nina Wiedemann, Yanan Xin and Martin Raubal","Spatially-Aware Car-Sharing Demand Prediction","16 pages, 6 figures",,,,"cs.LG","http://creativecommons.org/licenses/by/4.0/","  In recent years, car-sharing services have emerged as viable alternatives to
private individual mobility, promising more sustainable and resource-efficient,
but still comfortable transportation. Research on short-term prediction and
optimization methods has improved operations and fleet control of car-sharing
services; however, long-term projections and spatial analysis are sparse in the
literature. We propose to analyze the average monthly demand in a station-based
car-sharing service with spatially-aware learning algorithms that offer high
predictive performance as well as interpretability. In particular, we compare
the spatially-implicit Random Forest model with spatially-aware methods for
predicting average monthly per-station demand. The study utilizes a rich set of
socio-demographic, location-based (e.g., POIs), and car-sharing-specific
features as input, extracted from a large proprietary car-sharing dataset and
publicly available datasets. We show that the global Random Forest model with
geo-coordinates as an input feature achieves the highest predictive performance
with an R-squared score of 0.87, while local methods such as Geographically
Weighted Regression perform almost on par and additionally yield exciting
insights into the heterogeneous spatial distributions of factors influencing
car-sharing behaviour. Additionally, our study offers effective as well as
highly interpretable methods for diagnosing and planning the placement of
car-sharing stations.
","[{""version"":""v1"",""created"":""Sat, 25 Mar 2023 10:10:11 GMT""}]","2023-03-28"
"2303.14422","Hannes Vandecasteele","Hannes Vandecasteele and Giovanni Samaey","Pseudo-Marginal Approximation to the Free Energy in a Micro-Macro Markov
  Chain Monte Carlo Method","21 pages, 8 figures",,,,"math.NA cs.NA math.PR","http://creativecommons.org/licenses/by/4.0/","  We introduce a generalised micro-macro Markov chain Monte Carlo (mM-MCMC)
method with pseudo-marginal approximation to the free energy, that is able to
accelerate sampling of the microscopic Gibbs distributions when there is a
time-scale separation between the macroscopic dynamics of a reaction coordinate
and the remaining microscopic degrees of freedom. The mM-MCMC method attains
this efficiency by iterating four steps: i) Propose a new value of the reaction
coordinate; ii) Accept or reject the macroscopic sample; iii) Run a biased
simulation that creates a microscopic molecular instance that lies close to the
newly sampled macroscopic reaction coordinate value; iv) Microscopic
accept/reject step for the new microscopic sample. In the present paper, we
eliminate the main computational bottleneck of earlier versions of this method:
the necessity to have an accurate approximation of the free energy. We show
that introduction of a pseudo-marginal approximation significantly reduces the
computational cost of the microscopic accept/reject step, while still providing
unbiased samples. We illustrate the method's behaviour on several molecular
systems with low-dimensional reaction coordinates.
","[{""version"":""v1"",""created"":""Sat, 25 Mar 2023 10:11:10 GMT""}]","2023-03-28"
"2303.14423","Mohammad Rostami","Yuliang Cai, Jesse Thomason, Mohammad Rostami","Task-Attentive Transformer Architecture for Continual Learning of
  Vision-and-Language Tasks Using Knowledge Distillation",,,,,"cs.LG","http://arxiv.org/licenses/nonexclusive-distrib/1.0/","  The size and the computational load of fine-tuning large-scale pre-trained
neural network are becoming two major obstacles in adopting machine learning in
many applications. Continual learning (CL) can serve as a remedy through
enabling knowledge-transfer across sequentially arriving tasks which relaxes
the need to fine-tune all network weights from scratch. However, existing CL
algorithms primarily consider learning unimodal vision-only or language-only
tasks. We develop a transformer-based CL architecture for learning bimodal
vision-and-language tasks based on increasing the number of the learnable
parameters dynamically and using knowledge distillation. The new additional
parameters are used to specialize the network for each task. Our approach
enables sharing information between the tasks while addressing the challenge of
catastrophic forgetting. Our approach is scalable learning to a large number of
tasks because it requires little memory and time overhead. Our model reaches
state-of-the-art performance on challenging vision-and-language tasks.
","[{""version"":""v1"",""created"":""Sat, 25 Mar 2023 10:16:53 GMT""}]","2023-03-28"
"2303.14424","Giuseppe Lancia","Giuseppe Lancia and Marcello Dalpasso","Orbits, schemes and dynamic programming procedures for the TSP 4-OPT
  neighborhood",,,,,"cs.DS","http://creativecommons.org/licenses/by-nc-nd/4.0/","  We discuss the way to group all 25 possible 4-OPT moves into 7 orbits of
equivalent moves. We then describe two implementations, one for a $\Theta(n^3)$
algorithm by de Berg's et al. and one of a $\Theta(n^2)$ algorithm by Glover,
for finding the best 4-OPT move via dynamic programming.
","[{""version"":""v1"",""created"":""Sat, 25 Mar 2023 10:19:13 GMT""}]","2023-03-28"
"2303.14425","Zhouhong Gu","Zhouhong Gu, Sihang Jiang, Wenhao Huang, Jiaqing Liang, Hongwei Feng,
  Yanghua Xiao","Sem4SAP: Synonymous Expression Mining From Open Knowledge Graph For
  Language Model Synonym-Aware Pretraining",,,,,"cs.CL cs.AI","http://creativecommons.org/licenses/by/4.0/","  The model's ability to understand synonymous expression is crucial in many
kinds of downstream tasks. It will make the model to better understand the
similarity between context, and more robust to the synonym substitution attack.
However, many Pretrained Language Model (PLM) lack synonym knowledge due to
limitation of small-scale synsets and PLM's pretraining objectives. In this
paper, we propose a framework called Sem4SAP to mine synsets from Open
Knowledge Graph (Open-KG) and using the mined synsets to do synonym-aware
pretraining for language models. We propose to coarsly filter the content in
Open-KG and use the frequency information to better help the clustering process
under low-resource unsupervised conditions. We expand the mined synsets by
migrating core semantics between synonymous expressions.We also propose two
novel and effective synonym-aware pre-training methods for injecting synonym
knowledge into PLMs.Extensive experiments demonstrate that Sem4SAP can
dramatically outperform the original PLMs and other baselines on ten different
tasks.
","[{""version"":""v1"",""created"":""Sat, 25 Mar 2023 10:19:14 GMT""}]","2023-03-28"
"2303.14426","C S Yadav Dr.","Sheetal, Pabitra K. Biswas, K. Yokoyama, D. T. Adroja and C. S. Yadav","Muon spin relaxation and emergence of disorder-induced unconventional
  dynamic magnetic fluctuations in Dy$_{2}$Zr$_{2}$O$_{7}$","6 pages, 5 figures",,,,"cond-mat.str-el cond-mat.mtrl-sci","http://arxiv.org/licenses/nonexclusive-distrib/1.0/","  The disordered pyrochlore oxide Dy$_{2}$Zr$_{2}$O$_{7}$ shows the signatures
of field-induced spin freezing with remnant zero-point spin-ice entropy at 5
kOe magnetic field. We have performed zero-field and longitudinal field Muon
spin relaxation ($\mu$SR) studies on Dy$_{2}$Zr$_{2}$O$_{7}$. Our zero field
studies reveal the absence of both long-range ordering and spin freezing down
to 62 mK. The $\mu$SR relaxation rate exhibits a temperature-independent
plateau below 4 K, indicating a dynamic ground state of fluctuating spins
similar to the well-known spin ice system Dy$_{2}$Ti$_{2}$O$_{7}$. The
low-temperature spin fluctuations persist in the longitudinal field of 20 kOe
as well and show unusual field dependence of the relaxation rate, which is
uncommon for a spin-liquid system. Our results, combined with the previous
studies do not show any evidence of spin ice or spin glass ground state, rather
point to a disorder-induced dynamic magnetic ground state in the
Dy$_{2}$Zr$_{2}$O$_{7}$ material.
","[{""version"":""v1"",""created"":""Sat, 25 Mar 2023 10:19:29 GMT""}]","2023-03-28"
"2303.14427","Yanis Taege","Yanis Taege, Tim Samuel Winter, Sophia Laura Schulz, Bernhard
  Messerschmidt and \c{C}a\u{g}lar Ataman","Generation of biaxially accelerating static Airy light-sheets with
  3D-printed freeform micro-optics","13 pages, 6 figures, 2 tables. submitted",,,,"physics.optics","http://creativecommons.org/licenses/by/4.0/","  One-dimensional Airy beams allow the generation of thin light-sheets without
scanning, simplifying the complex optical arrangements of light-sheet
microscopes (LSM) with an extended field-of-view (FOV). However, their uniaxial
acceleration limits the maximum numerical aperture of the detection objective
in order to keep both the active and inactive axes within the depth-of-field.
This problem is particularly pronounced in miniaturized LSM implementations,
such as those for endomicroscopy or multi-photon neural imaging in
freely-moving animals using head-mounted miniscopes. We propose a new method to
generate a static Airy light-sheet with biaxial acceleration, based on a novel
phase profile. This light-sheet has the geometry of a spherical shell whose
radius of curvature can be designed to match the field curvature of the
micro-objective. We present an analytical model for the analysis of the
light-sheet parameters and verify it by numerical simulations in the paraxial
regime. We also discuss a micro-optical experimental implementation combining
gradient-index optics with a 3D-nano-printed, fully refractive phase plate. The
results confirm that we are able to match detection curvatures with radii in
the 1.5 to 2 mm range.
","[{""version"":""v1"",""created"":""Sat, 25 Mar 2023 10:20:10 GMT""}]","2023-03-28"
"2303.14428","Samidh Pal","Samidh Pal","A New Production Function Approach","16 pages",,,,"econ.TH","http://creativecommons.org/licenses/by-nc-sa/4.0/","  This paper presents a new nested production function that is specifically
designed for analyzing capital and labor intensity of manufacturing industries
in developing and developed regions. The paper provides a rigorous theoretical
foundation for this production function, as well as an empirical analysis of
its performance in a sample of industries. The analysis shows that the
production function can be used to accurately estimate the level of capital and
labor intensity in industries, as well as to analyze the capacity utilization
of these industries.
","[{""version"":""v1"",""created"":""Sat, 25 Mar 2023 10:21:22 GMT""}]","2023-03-28"
"2303.14429","Yaroslav Zharov","Yaroslav Zharov, Evelina Ametova, Rebecca Spiecker, Tilo Baumbach,
  Genoveva Burca, Vincent Heuveline","Shot Noise Reduction in Radiographic and Tomographic Multi-Channel
  Imaging with Self-Supervised Deep Learning","To be submitted to Optics Express",,,,"cs.CV","http://creativecommons.org/licenses/by/4.0/","  Noise is an important issue for radiographic and tomographic imaging
techniques. It becomes particularly critical in applications where additional
constraints force a strong reduction of the Signal-to-Noise Ratio (SNR) per
image. These constraints may result from limitations on the maximum available
flux or permissible dose and the associated restriction on exposure time.
Often, a high SNR per image is traded for the ability to distribute a given
total exposure capacity per pixel over multiple channels, thus obtaining
additional information about the object by the same total exposure time. These
can be energy channels in the case of spectroscopic imaging or time channels in
the case of time-resolved imaging. In this paper, we report on a method for
improving the quality of noisy multi-channel (time or energy-resolved) imaging
datasets. The method relies on the recent Noise2Noise (N2N) self-supervised
denoising approach that learns to predict a noise-free signal without access to
noise-free data. N2N in turn requires drawing pairs of samples from a data
distribution sharing identical signals while being exposed to different samples
of random noise. The method is applicable if adjacent channels share enough
information to provide images with similar enough information but independent
noise. We demonstrate several representative case studies, namely spectroscopic
(k-edge) X-ray tomography, in vivo X-ray cine-radiography, and
energy-dispersive (Bragg edge) neutron tomography. In all cases, the N2N method
shows dramatic improvement and outperforms conventional denoising methods. For
such imaging techniques, the method can therefore significantly improve image
quality, or maintain image quality with further reduced exposure time per
image.
","[{""version"":""v1"",""created"":""Sat, 25 Mar 2023 10:33:41 GMT""}]","2023-03-28"
"2303.14430","Zhouzheng Li","Zhouzheng Li and Hao Liu","Beta-VAE has 2 Behaviors: PCA or ICA?","9 pages, 13 figures",,,,"cs.LG cs.AI","http://creativecommons.org/licenses/by/4.0/","  Beta-VAE is a very classical model for disentangled representation learning,
the use of an expanding bottleneck that allow information into the decoder
gradually is key to representation disentanglement as well as high-quality
reconstruction. During recent experiments on such fascinating structure, we
discovered that the total amount of latent variables can affect the
representation learnt by the network: with very few latent variables, the
network tend to learn the most important or principal variables, acting like a
PCA; with very large numbers of latent variables, the variables tend to be more
disentangled, and act like an ICA. Our assumption is that the competition
between latent variables while trying to gain the most information bandwidth
can lead to this phenomenon.
","[{""version"":""v1"",""created"":""Sat, 25 Mar 2023 10:34:42 GMT""}]","2023-03-28"
"2303.14431","Raghvendra Posti","Raghvendra Posti, Abhishek Kumar, Mayank Baghoria, Bhanu Prakash,
  Dhananjay Tiwari, Debangsu Roy","Odd symmetry planar Hall effect: A method of detecting current-induced
  in-plane magnetization switching",,,"10.1063/5.0143904",,"cond-mat.mes-hall","http://arxiv.org/licenses/nonexclusive-distrib/1.0/","  Type-x device attracts considerable interest in the field of spintronics due
to its robust spin-orbit torque (SOT) induced magnetization switching, and easy
deposition technique. However, universally applicable and straightforward
detection of type-X magnetization reversal is still elusive, unlike type-Z
switching, which employs DC-based anomalous Hall effect measurement. Here, we,
demonstrated that the odd planar Hall signal (O-PHV) exhibits an odd symmetry
with the application of an external magnetic field which motivates us to
develop a reading mechanism for detecting magnetization switching of in-plane
magnetized type-X devices. We verified our DC-based reading mechanism in the
Pt/Co/NiFe/Pt stack where a thin Co layer is inserted to create dissimilar
interfaces about the NiFe layer. Remarkably, the current-induced in-plane
fields are found to be significantly large in Pt/Co/NiFe/Pt stack. Further, we
successfully employed the O-PHV method to detect the current-induced
magnetization switching. The pure DC nature of the writing and reading
mechanism of our proposed type-X detection technique through O-PHV makes it the
easiest in-plane magnetization detection technique. Moreover, the high
repeatability and easy detection of our proposed method will open new avenues
toward in-plane SOT switching based memory devices and sensors.
","[{""version"":""v1"",""created"":""Sat, 25 Mar 2023 10:37:00 GMT""}]","2023-04-20"
"2303.14432","Gianluigi Rozza","Julien Genovese, Francesco Ballarin, Gianluigi Rozza and Claudio
  Canuto","Weighted reduced order methods for uncertainty quantification in
  computational fluid dynamics",,,,,"math.NA cs.NA","http://arxiv.org/licenses/nonexclusive-distrib/1.0/","  In this manuscript we propose and analyze weighted reduced order methods for
stochastic Stokes and Navier-Stokes problems depending on random input data
(such as forcing terms, physical or geometrical coefficients, boundary
conditions). We will compare weighted methods such as weighted greedy and
weighted POD with non-weighted ones in case of stochastic parameters. In
addition we will analyze different sampling and weighting choices to overcome
the curse of dimensionality with high dimensional parameter spaces.
","[{""version"":""v1"",""created"":""Sat, 25 Mar 2023 10:42:00 GMT""}]","2023-03-28"
"2303.14433","Jihyo Kim","Jihyo Kim, Jeonghyeon Kim, Sangheum Hwang","Deep Active Learning with Contrastive Learning Under Realistic Data Pool
  Assumptions","AAAI 2023 Workshop on Practical Deep Learning in the Wild",,,,"cs.CV cs.LG","http://arxiv.org/licenses/nonexclusive-distrib/1.0/","  Active learning aims to identify the most informative data from an unlabeled
data pool that enables a model to reach the desired accuracy rapidly. This
benefits especially deep neural networks which generally require a huge number
of labeled samples to achieve high performance. Most existing active learning
methods have been evaluated in an ideal setting where only samples relevant to
the target task, i.e., in-distribution samples, exist in an unlabeled data
pool. A data pool gathered from the wild, however, is likely to include samples
that are irrelevant to the target task at all and/or too ambiguous to assign a
single class label even for the oracle. We argue that assuming an unlabeled
data pool consisting of samples from various distributions is more realistic.
In this work, we introduce new active learning benchmarks that include
ambiguous, task-irrelevant out-of-distribution as well as in-distribution
samples. We also propose an active learning method designed to acquire
informative in-distribution samples in priority. The proposed method leverages
both labeled and unlabeled data pools and selects samples from clusters on the
feature space constructed via contrastive learning. Experimental results
demonstrate that the proposed method requires a lower annotation budget than
existing active learning methods to reach the same level of accuracy.
","[{""version"":""v1"",""created"":""Sat, 25 Mar 2023 10:46:10 GMT""}]","2023-03-28"
"2303.14434","Marcel F. Langer","Marcel F. Langer, Florian Knoop, Christian Carbogno, Matthias
  Scheffler and Matthias Rupp","Heat flux for semi-local machine-learning potentials","6 pages, 3 figures, excluding supplement (12 pages, 10 figures), v2:
  fixed figures. Additional information at https://marcel.science/gknet",,,,"cond-mat.mtrl-sci cs.LG physics.comp-ph","http://arxiv.org/licenses/nonexclusive-distrib/1.0/","  The Green-Kubo (GK) method is a rigorous framework for heat transport
simulations in materials. However, it requires an accurate description of the
potential-energy surface and carefully converged statistics. Machine-learning
potentials can achieve the accuracy of first-principles simulations while
allowing to reach well beyond their simulation time and length scales at a
fraction of the cost. In this paper, we explain how to apply the GK approach to
the recent class of message-passing machine-learning potentials, which
iteratively consider semi-local interactions beyond the initial interaction
cutoff. We derive an adapted heat flux formulation that can be implemented
using automatic differentiation without compromising computational efficiency.
The approach is demonstrated and validated by calculating the thermal
conductivity of zirconium dioxide across temperatures.
","[{""version"":""v1"",""created"":""Sat, 25 Mar 2023 10:57:46 GMT""},{""version"":""v2"",""created"":""Tue, 28 Mar 2023 11:52:55 GMT""}]","2023-03-29"
