"2303.14217","Fotios Petropoulos","Fotios Petropoulos, Gilbert Laporte, Emel Aktas, Sibel A. Alumur,
  Claudia Archetti, Hayriye Ayhan, Maria Battarra, Julia A. Bennell, Jean-Marie
  Bourjolly, John E. Boylan, Mich\`ele Breton, David Canca, Laurent Charlin, Bo
  Chen, Cihan Tugrul Cicek, Louis Anthony Cox Jr, Christine S.M. Currie, Erik
  Demeulemeester, Li Ding, Stephen M. Disney, Matthias Ehrgott, Martin J.
  Eppler, G\""une\c{s} Erdo\u{g}an, Bernard Fortz, L. Alberto Franco, Jens
  Frische, Salvatore Greco, Amanda J. Gregory, Raimo P. H\""am\""al\""ainen, Willy
  Herroelen, Mike Hewitt, Jan Holmstr\""om, John N. Hooker, Tu\u{g}\c{c}e
  I\c{s}{\i}k, Jill Johnes, Bahar Y. Kara, \""Ozlem Karsu, Katherine Kent,
  Charlotte K\""ohler, Martin Kunc, Yong-Hong Kuo, Judit Lienert, Adam N.
  Letchford, Janny Leung, Dong Li, Haitao Li, Ivana Ljubi\'c, Andrea Lodi,
  Sebasti\'an Lozano, Virginie Lurkin, Silvano Martello, Ian G. McHale, Gerald
  Midgley, John D.W. Morecroft, Akshay Mutha, Ceyda O\u{g}uz, Sanja Petrovic,
  Ulrich Pferschy, Harilaos N. Psaraftis, Sam Rose, Lauri Saarinen, Said Salhi,
  Jing-Sheng Song, Dimitrios Sotiros, Kathryn E. Stecke, Arne K. Strauss,
  \.Isten\c{c} Tarhan, Clemens Thielen, Paolo Toth, Greet Vanden Berghe,
  Christos Vasilakis, Vikrant Vaze, Daniele Vigo, Kai Virtanen, Xun Wang,
  Rafa{\l} Weron, Leroy White, Tom Van Woensel, Mike Yearworth, E. Alper
  Y{\i}ld{\i}r{\i}m, Georges Zaccour, Xuying Zhao","Operational Research: Methods and Applications",,,,,"math.OC","http://creativecommons.org/licenses/by/4.0/","  Throughout its history, Operational Research has evolved to include a variety
of methods, models and algorithms that have been applied to a diverse and wide
range of contexts. This encyclopedic article consists of two main sections:
methods and applications. The first aims to summarise the up-to-date knowledge
and provide an overview of the state-of-the-art methods and key developments in
the various subdomains of the field. The second offers a wide-ranging list of
areas where Operational Research has been applied. The article is meant to be
read in a nonlinear fashion. It should be used as a point of reference or
first-port-of-call for a diverse pool of readers: academics, researchers,
students, and practitioners. The entries within the methods and applications
sections are presented in alphabetical order.
  The authors dedicate this paper to the 2023 Turkey/Syria earthquake victims.
We sincerely hope that advances in OR will play a role towards minimising the
pain and suffering caused by this and future catastrophes.
","[{""version"":""v1"",""created"":""Fri, 24 Mar 2023 18:12:37 GMT""}]","2023-03-28"
"2303.14218","Yong Du","Yu Zheng, Jiahui Zhan, Shengfeng He, Junyu Dong, and Yong Du","Curricular Contrastive Regularization for Physics-aware Single Image
  Dehazing","This paper is accepted by CVPR2023",,,,"cs.CV","http://arxiv.org/licenses/nonexclusive-distrib/1.0/","  Considering the ill-posed nature, contrastive regularization has been
developed for single image dehazing, introducing the information from negative
images as a lower bound. However, the contrastive samples are nonconsensual, as
the negatives are usually represented distantly from the clear (i.e., positive)
image, leaving the solution space still under-constricted. Moreover, the
interpretability of deep dehazing models is underexplored towards the physics
of the hazing process. In this paper, we propose a novel curricular contrastive
regularization targeted at a consensual contrastive space as opposed to a
non-consensual one. Our negatives, which provide better lower-bound
constraints, can be assembled from 1) the hazy image, and 2) corresponding
restorations by other existing methods. Further, due to the different
similarities between the embeddings of the clear image and negatives, the
learning difficulty of the multiple components is intrinsically imbalanced. To
tackle this issue, we customize a curriculum learning strategy to reweight the
importance of different negatives. In addition, to improve the interpretability
in the feature space, we build a physics-aware dual-branch unit according to
the atmospheric scattering model. With the unit, as well as curricular
contrastive regularization, we establish our dehazing network, named C2PNet.
Extensive experiments demonstrate that our C2PNet significantly outperforms
state-of-the-art methods, with extreme PSNR boosts of 3.94dB and 1.50dB,
respectively, on SOTS-indoor and SOTS-outdoor datasets.
","[{""version"":""v1"",""created"":""Fri, 24 Mar 2023 18:18:25 GMT""},{""version"":""v2"",""created"":""Thu, 1 Jun 2023 13:36:30 GMT""}]","2023-06-02"
"2303.14219","EPTCS","Clemens Grabmayer (GSSI)","Proceedings Twelfth International Workshop on Computing with Terms and
  Graphs",,"EPTCS 377, 2023","10.4204/EPTCS.377",,"cs.LO","http://creativecommons.org/licenses/by/4.0/","  The workshop TERMGRAPH 2022 took place at Technion in Haifa, Israel, on
August 1, 2022, in the Pre-FLoC workshop block (July 31-August 1) of FLoC 2022
(Federated Logic Conference 2022, July 31-August 12). As such, TERMGRAPH 2022
was a one-day satellite event of the conference FSCD 2022 (Formal Structures of
Computation and Deduction 2020, August 2-5).
","[{""version"":""v1"",""created"":""Fri, 24 Mar 2023 18:26:26 GMT""},{""version"":""v2"",""created"":""Sun, 2 Apr 2023 20:10:28 GMT""}]","2023-04-04"
"2303.14220","Cl\'ement Chadebec","Cl\'ement Chadebec and St\'ephanie Allassonni\`ere","Variational Inference for Longitudinal Data Using Normalizing Flows",,,,,"stat.ML cs.LG","http://arxiv.org/licenses/nonexclusive-distrib/1.0/","  This paper introduces a new latent variable generative model able to handle
high dimensional longitudinal data and relying on variational inference. The
time dependency between the observations of an input sequence is modelled using
normalizing flows over the associated latent variables. The proposed method can
be used to generate either fully synthetic longitudinal sequences or
trajectories that are conditioned on several data in a sequence and
demonstrates good robustness properties to missing data. We test the model on 6
datasets of different complexity and show that it can achieve better likelihood
estimates than some competitors as well as more reliable missing data
imputation. A code is made available at
\url{https://github.com/clementchadebec/variational_inference_for_longitudinal_data}.
","[{""version"":""v1"",""created"":""Fri, 24 Mar 2023 18:29:18 GMT""}]","2023-03-28"
"2303.14221","Elizaveta Kovtun","Andrei Zaichenko, Aleksei Kazakov, Elizaveta Kovtun, and Semen
  Budennyy","The Battle of Information Representations: Comparing Sentiment and
  Semantic Features for Forecasting Market Trends",,,,,"cs.LG","http://creativecommons.org/licenses/by/4.0/","  The study of the stock market with the attraction of machine learning
approaches is a major direction for revealing hidden market regularities. This
knowledge contributes to a profound understanding of financial market dynamics
and getting behavioural insights, which could hardly be discovered with
traditional analytical methods. Stock prices are inherently interrelated with
world events and social perception. Thus, in constructing the model for stock
price prediction, the critical stage is to incorporate such information on the
outside world, reflected through news and social media posts. To accommodate
this, researchers leverage the implicit or explicit knowledge representations:
(1) sentiments extracted from the texts or (2) raw text embeddings. However,
there is too little research attention to the direct comparison of these
approaches in terms of the influence on the predictive power of financial
models. In this paper, we aim to close this gap and figure out whether the
semantic features in the form of contextual embeddings are more valuable than
sentiment attributes for forecasting market trends. We consider the corpus of
Twitter posts related to the largest companies by capitalization from NASDAQ
and their close prices. To start, we demonstrate the connection of tweet
sentiments with the volatility of companies' stock prices. Convinced of the
existing relationship, we train Temporal Fusion Transformer models for price
prediction supplemented with either tweet sentiments or tweet embeddings. Our
results show that in the substantially prevailing number of cases, the use of
sentiment features leads to higher metrics. Noteworthy, the conclusions are
justifiable within the considered scenario involving Twitter posts and stocks
of the biggest tech companies.
","[{""version"":""v1"",""created"":""Fri, 24 Mar 2023 18:30:15 GMT""}]","2023-03-28"
"2303.14222","Zoe Tieges Dr","Oliver Vinzelberg, Mark David Jenkins, Gordon Morison, David McMinn
  and Zoe Tieges","Lay Text Summarisation Using Natural Language Processing: A Narrative
  Literature Review",,,,,"cs.CL","http://creativecommons.org/licenses/by/4.0/","  Summarisation of research results in plain language is crucial for promoting
public understanding of research findings. The use of Natural Language
Processing to generate lay summaries has the potential to relieve researchers'
workload and bridge the gap between science and society. The aim of this
narrative literature review is to describe and compare the different text
summarisation approaches used to generate lay summaries. We searched the
databases Web of Science, Google Scholar, IEEE Xplore, Association for
Computing Machinery Digital Library and arXiv for articles published until 6
May 2022. We included original studies on automatic text summarisation methods
to generate lay summaries. We screened 82 articles and included eight relevant
papers published between 2020 and 2021, all using the same dataset. The results
show that transformer-based methods such as Bidirectional Encoder
Representations from Transformers (BERT) and Pre-training with Extracted
Gap-sentences for Abstractive Summarization (PEGASUS) dominate the landscape of
lay text summarisation, with all but one study using these methods. A
combination of extractive and abstractive summarisation methods in a hybrid
approach was found to be most effective. Furthermore, pre-processing approaches
to input text (e.g. applying extractive summarisation) or determining which
sections of a text to include, appear critical. Evaluation metrics such as
Recall-Oriented Understudy for Gisting Evaluation (ROUGE) were used, which do
not consider readability. To conclude, automatic lay text summarisation is
under-explored. Future research should consider long document lay text
summarisation, including clinical trial reports, and the development of
evaluation metrics that consider readability of the lay summary.
","[{""version"":""v1"",""created"":""Fri, 24 Mar 2023 18:30:50 GMT""}]","2023-03-28"
"2303.14223","Benjamin Wunsch","James L. McDonagh, Benjamin H. Wunsch, Stamatia Zavitsanou, Alexander
  Harrison, Bruce Elmegreen, Stacey Gifford, Theodore van Kessel, and Flaviu
  Cipcigan","Machine Guided Discovery of Novel Carbon Capture Solvents","21 single-column pages (LaTex article), 8 figures, 2 tables, separate
  ESI",,,,"cs.LG","http://creativecommons.org/licenses/by-nc-nd/4.0/","  The increasing importance of carbon capture technologies for deployment in
remediating CO2 emissions, and thus the necessity to improve capture materials
to allow scalability and efficiency, faces the challenge of materials
development, which can require substantial costs and time. Machine learning
offers a promising method for reducing the time and resource burdens of
materials development through efficient correlation of structure-property
relationships to allow down-selection and focusing on promising candidates.
Towards demonstrating this, we have developed an end-to-end ""discovery cycle""
to select new aqueous amines compatible with the commercially viable acid gas
scrubbing carbon capture. We combine a simple, rapid laboratory assay for CO2
absorption with a machine learning based molecular fingerprinting model
approach. The prediction process shows 60% accuracy against experiment for both
material parameters and 80% for a single parameter on an external test set. The
discovery cycle determined several promising amines that were verified
experimentally, and which had not been applied to carbon capture previously. In
the process we have compiled a large, single-source data set for carbon capture
amines and produced an open source machine learning tool for the identification
of amine molecule candidates
(https://github.com/IBM/Carbon-capture-fingerprint-generation).
","[{""version"":""v1"",""created"":""Fri, 24 Mar 2023 18:32:38 GMT""}]","2023-03-28"
"2303.14224","Jeremy Worsfold","Jeremy Worsfold and Tim Rogers","Binary synchronization of noise-coupled oscillators","Corrected Typos",,,,"nlin.AO","http://creativecommons.org/licenses/by/4.0/","  After decades of study, there are only two known mechanisms to induce global
synchronization in a population of oscillators: deterministic coupling and
common forcing. The inclusion of independent random forcing in these models
typically serves to drive disorder, increasing the stability of the incoherent
state. Here we show that the reverse is also possible. We propose and analyse a
simple model of purely noise coupled oscillators whose linear response around
incoherence is identical to that of the paradigmatic Kuramoto model, but which
exhibits binary phase locking instead of full coherence. We characterise the
phase diagram, stationary states and approximate low dimensional dynamics for
the model, revealing the curious behaviour of this new mechanism of
synchronization.
","[{""version"":""v1"",""created"":""Fri, 24 Mar 2023 18:38:00 GMT""},{""version"":""v2"",""created"":""Thu, 30 Mar 2023 10:35:50 GMT""}]","2023-03-31"
"2303.14225","Grigorii Bobkov A.","G.A. Bobkov, I. V. Bobkova, A. M. Bobkov","Proximity effect in superconductor/antiferromagnet hybrids: Neel
  triplets and impurity suppression of superconductivity","7 pages, 9 figures",,,,"cond-mat.supr-con cond-mat.mes-hall","http://creativecommons.org/licenses/by/4.0/","  By now two possible physical mechanisms of superconductivity suppression at
superconductor/antiferromagnet (S/AF) interfaces, which work even for
interfaces with compensated antiferromagnets, were reported. One of them
suggests that the Neel order of the AF induces rapidly oscillating spin-triplet
correlations in the S layer. They are called Neel triplets and they suppress
singlet superconductivity. Nonmagnetic disorder destroys this type of triplet
correlations. As a result, the critical temperature of the S/AF bilayer grows
with impurity strength. The second mechanism, on the contrary, suggests that
nonmagnetic impurity scattering suppresses superconductivity in S/AF hybrids.
The predictions were made in the framework of two different quasiclassical
approaches [G. A. Bobkov et al. Phys. Rev. B 106, 144512 (2022) and E. H. Fyhn
et al. arXiv:2210.09325]. Here we suggest the unified theory of the proximity
effect in thin-film S/AF structures, which incorporates the both pictures as
limiting cases and study the proximity effect at S/AF interfaces for arbitrary
impurity strength, chemical potential and the value of the Neel exchange field.
","[{""version"":""v1"",""created"":""Fri, 24 Mar 2023 18:40:52 GMT""}]","2023-03-28"
"2303.14226","Abhineet Agarwal","Abhineet Agarwal, Anish Agarwal, Suhas Vijaykumar","Synthetic Combinations: A Causal Inference Framework for Combinatorial
  Interventions",,,,,"stat.ME cs.LG econ.EM stat.ML","http://creativecommons.org/licenses/by/4.0/","  We consider a setting with $N$ heterogeneous units and $p$ interventions. Our
goal is to learn unit-specific potential outcomes for any combination of these
$p$ interventions, i.e., $N \times 2^p$ causal parameters. Choosing
combinations of interventions is a problem that naturally arises in many
applications such as factorial design experiments, recommendation engines
(e.g., showing a set of movies that maximizes engagement for users),
combination therapies in medicine, selecting important features for ML models,
etc. Running $N \times 2^p$ experiments to estimate the various parameters is
infeasible as $N$ and $p$ grow. Further, with observational data there is
likely confounding, i.e., whether or not a unit is seen under a combination is
correlated with its potential outcome under that combination. To address these
challenges, we propose a novel model that imposes latent structure across both
units and combinations. We assume latent similarity across units (i.e., the
potential outcomes matrix is rank $r$) and regularity in how combinations
interact (i.e., the coefficients in the Fourier expansion of the potential
outcomes is $s$ sparse). We establish identification for all causal parameters
despite unobserved confounding. We propose an estimation procedure, Synthetic
Combinations, and establish finite-sample consistency under precise conditions
on the observation pattern. Our results imply Synthetic Combinations
consistently estimates unit-specific potential outcomes given $\text{poly}(r)
\times (N + s^2p)$ observations. In comparison, previous methods that do not
exploit structure across both units and combinations have sample complexity
scaling as $\min(N \times s^2p, \ \ r \times (N + 2^p))$. We use Synthetic
Combinations to propose a data-efficient experimental design mechanism for
combinatorial causal inference. We corroborate our theoretical findings with
numerical simulations.
","[{""version"":""v1"",""created"":""Fri, 24 Mar 2023 18:45:44 GMT""}]","2023-03-28"
"2303.14227","Rafael Pina","Rafael Pina, Varuna De Silva and Corentin Artaud","Causality Detection for Efficient Multi-Agent Reinforcement Learning",,,,,"cs.AI cs.LG cs.MA","http://arxiv.org/licenses/nonexclusive-distrib/1.0/","  When learning a task as a team, some agents in Multi-Agent Reinforcement
Learning (MARL) may fail to understand their true impact in the performance of
the team. Such agents end up learning sub-optimal policies, demonstrating
undesired lazy behaviours. To investigate this problem, we start by formalising
the use of temporal causality applied to MARL problems. We then show how
causality can be used to penalise such lazy agents and improve their
behaviours. By understanding how their local observations are causally related
to the team reward, each agent in the team can adjust their individual credit
based on whether they helped to cause the reward or not. We show empirically
that using causality estimations in MARL improves not only the holistic
performance of the team, but also the individual capabilities of each agent. We
observe that the improvements are consistent in a set of different
environments.
","[{""version"":""v1"",""created"":""Fri, 24 Mar 2023 18:47:44 GMT""}]","2023-03-28"
"2303.14228","Andrew Cudd","T2K Collaboration: K. Abe, N. Akhlaq, R. Akutsu, A. Ali, S. Alonso
  Monsalve, C. Alt, C. Andreopoulos, M. Antonova, S. Aoki, T. Arihara, Y.
  Asada, Y. Ashida, E.T. Atkin, G.J. Barker, G. Barr, D. Barrow, M.
  Batkiewicz-Kwasniak, F. Bench, V. Berardi, L. Berns, S. Bhadra, A. Blanchet,
  A. Blondel, S. Bolognesi, T. Bonus, S. Bordoni, S.B. Boyd, A. Bravar, C.
  Bronner, S. Bron, A. Bubak, M. Buizza Avanzini, J.A. Caballero Carretero, S.
  Cao, A.J. Carter, S.L. Cartwright, M.G. Catanesi, A. Cervera, J. Chakrani, D.
  Cherdack, G. Christodoulou, M. Cicerchia, J. Coleman, G. Collazuol, L. Cook,
  A. Cudd, C. Dalmazzone, Yu.I. Davydov, A. De Roeck, G. De Rosa, T. Dealtry,
  C.C. Delogu, C. Densham, A. Dergacheva, F. Di Lodovico, S. Dolan, D. Douqa,
  T.A. Doyle, O. Drapier, J. Dumarchez, P. Dunne, K. Dygnarowicz, A. Eguchi, S.
  Emery-Schrenk, A. Ershova, M. Feltre, A.J. Finch, G.A. Fiorentini Aguirre, G.
  Fiorillo, J.M. Franco Pati\~no, M. Friend, Y. Fujii, Y. Fukuda, K.
  Fusshoeller, L. Giannessi, C. Giganti, V. Glagolev, M. Gonin, J. Gonz\'alez
  Rosa, E.A.G. Goodman, A. Gorin, M. Grassi, M. Guigue, D.R. Hadley, J.T.
  Haigh, P. Hamacher-Baumann, D.A. Harris, M. Hartz, T. Hasegawa, S. Hassani,
  N.C. Hastings, Y. Hayato, A. Hiramoto, M. Hogan, J. Holeczek, A. Holin, T.
  Holvey, N.T. Hong Van, T. Honjo, F. Iacob, A.K. Ichikawa, M. Ikeda, T.
  Ishida, M. Ishitsuka, H.T. Israel, A. Izmaylov, N. Izumi, M. Jakkapu, B.
  Jamieson, S.J. Jenkins, C. Jes\'us-Valls, J.J. Jiang, P. Jonsson, C.K. Jung,
  P.B. Jurj, M. Kabirnezhad, A.C. Kaboth, T. Kajita, H. Kakuno, J. Kameda, S.P.
  Kasetti, Y. Kataoka, T. Katori, M. Kawaue, E. Kearns, M. Khabibullin, A.
  Khotjantsev, T. Kikawa, S. King, J. Kisiel, T. Kobata, T. Kobayashi, L. Koch,
  A. Konaka, L.L. Kormos, Y. Koshio, A. Kostin, K. Kowalik, Y. Kudenko, S.
  Kuribayashi, R. Kurjata, T. Kutter, M. Kuze, M. La Commara, L. Labarga, K.
  Lachner, J. Lagoda, S.M. Lakshmi, M. Lamers James, M. Lamoureux, A. Langella,
  D. Last, N. Latham, M. Laveder, L. Lavitola, M. Lawe, Y. Lee, C. Lin, S.-K.
  Lin, R.P. Litchfield, S.L. Liu, A. Longhin, K.R. Long, L. Ludovici, X. Lu, T.
  Lux, L.N. Machado, L. Magaletti, K. Mahn, M. Malek, M. Mandal, S. Manly, A.D.
  Marino, L. Marti-Magro, D.G.R. Martin, M. Martini, T. Maruyama, T. Matsubara,
  V. Matveev, C. Mauger, K. Mavrokoridis, E. Mazzucato, N. McCauley, J.
  McElwee, K.S. McFarland, C. McGrew, A. Mefodiev, G.D. Megias, L. Mellet, M.
  Mezzetto, A. Minamino, O. Mineev, S. Mine, M. Miura, L. Molina Bueno, S.
  Moriyama, Th.A. Mueller, D. Munford, L. Munteanu, K. Nagai, Y. Nagai, T.
  Nakadaira, K. Nakagiri, M. Nakahata, Y. Nakajima, A. Nakamura, H. Nakamura,
  K. Nakamura, K.D. Nakamura, Y. Nakano, S. Nakayama, T. Nakaya, K. Nakayoshi,
  C.E.R. Naseby, T.V. Ngoc, V.Q. Nguyen, K. Niewczas, Y. Nishimura, K.
  Nishizaki, F. Nova, J.C. Nugent, H.M. O'Keeffe, L. O'Sullivan, T. Odagawa, T.
  Ogawa, K. Okumura, T. Okusawa, R.A. Owen, Y. Oyama, V. Palladino, V. Paolone,
  M. Pari, J. Parlone, S. Parsa, J. Pasternak, M. Pavin, D. Payne, G.C. Penn,
  D. Pershey, L. Pickering, C. Pidcott, G. Pintaudi, C. Pistillo, B. Popov, K.
  Porwit, M. Posiadala-Zezula, Y.S. Prabhu, F. Pupilli, B. Quilain, T.
  Radermacher, E. Radicioni, B. Radics, P.N. Ratoff, M. Reh, C. Riccio, E.
  Rondio, S. Roth, A. Rubbia, A.C. Ruggeri, C.A. Ruggles, A. Rychter, K.
  Sakashita, F. S\'anchez, G. Santucci, C.M. Schloesser, K. Scholberg, M.
  Scott, Y. Seiya, T. Sekiguchi, H. Sekiya, D. Sgalaberna, A. Shaikhiev, M.
  Shiozawa, W. Shorrock, A. Shvartsman, K. Skwarczynski, D. Smyczek, M. Smy,
  J.T. Sobczyk, H. Sobel, F.J.P. Soler, Y. Sonoda, A.J. Speers, R. Spina, I.A.
  Suslov, S. Suvorov, A. Suzuki, S.Y. Suzuki, Y. Suzuki, A.A. Sztuc, M. Tada,
  S. Tairafune, S. Takayasu, A. Takeda, Y. Takeuchi, K. Takifuji, H.K. Tanaka,
  M. Tani, A. Teklu, V.V. Tereshchenko, N. Teshima, N. Thamm, L.F. Thompson, W.
  Toki, C. Touramanis, T. Towstego, K.M. Tsui, T. Tsukamoto, M. Tzanov, Y.
  Uchida, M. Vagins, D. Vargas, G. Vasseur, C. Vilela, E. Villa, W.G.S.
  Vinning, U. Virginet, T. Vladisavljevic, T. Wachala, J.G. Walsh, Y. Wang, L.
  Wan, D. Wark, M.O. Wascko, A. Weber, R. Wendell, M.J. Wilking, C. Wilkinson,
  J.R. Wilson, K. Wood, C. Wret, J. Xia, Y.-h. Xu, K. Yamamoto, C. Yanagisawa,
  G. Yang, T. Yano, K. Yasutome, N. Yershov, U. Yevarouskaya, M. Yokoyama, Y.
  Yoshimoto, M. Yu, R. Zaki, A. Zalewska, J. Zalipska, K. Zaremba, G. Zarnecki,
  X. Zhao, T. Zhu, M. Ziembicki, E.D. Zimmerman, M. Zito, S. Zsoldos","First measurement of muon neutrino charged-current interactions on
  hydrocarbon without pions in the final state using multiple detectors with
  correlated energy spectra at T2K",,,,,"hep-ex","http://creativecommons.org/licenses/by/4.0/","  This paper reports the first measurement of muon neutrino charged-current
interactions without pions in the final state using multiple detectors with
correlated energy spectra at T2K. The data was collected on hydrocarbon targets
using the off-axis T2K near detector (ND280) and the on-axis T2K near detector
(INGRID) with neutrino energy spectra peaked at 0.6 GeV and 1.1 GeV
respectively. The correlated neutrino flux presents an opportunity to reduce
the impact of the flux uncertainty and to study the energy dependence of
neutrino interactions. The extracted double-differential cross sections are
compared to several Monte Carlo neutrino-nucleus interaction event generators
showing the agreement between both detectors individually and with the
correlated result.
","[{""version"":""v1"",""created"":""Fri, 24 Mar 2023 18:48:21 GMT""}]","2023-03-28"
"2303.14229","Alberto Espuny D\'iaz","Alberto Espuny D\'iaz, Lyuben Lichev, Dieter Mitsche, Alexandra
  Wesolek","Sharp threshold for embedding balanced spanning trees in random
  geometric graphs",,,,,"math.CO cs.DM","http://creativecommons.org/licenses/by/4.0/","  A rooted tree is balanced if the degree of a vertex depends only on its
distance to the root. In this paper we determine the sharp threshold for the
appearance of a large family of balanced spanning trees in the random geometric
graph $\mathcal{G}(n,r,d)$. In particular, we find the sharp threshold for
balanced binary trees. More generally, we show that all sequences of balanced
trees with uniformly bounded degrees and height tending to infinity appear
above a sharp threshold, and none of these appears below the same value. Our
results hold more generally for geometric graphs satisfying a mild condition on
the distribution of their vertex set, and we provide a polynomial time
algorithm to find such trees.
","[{""version"":""v1"",""created"":""Fri, 24 Mar 2023 18:49:03 GMT""}]","2023-03-28"
