"2303.14318","Takayuki Myo","Takayuki Myo, Kiyoshi Kato","Soft dipole resonance in $^8$C and its isospin symmetry with $^8$He","7 pages, 4 figures","Physical Review C 107, 034305 (2023)","10.1103/PhysRevC.107.034305",,"nucl-th nucl-ex","http://arxiv.org/licenses/nonexclusive-distrib/1.0/","  We investigate the soft dipole resonance in the proton-rich nucleus
$^8_6$C$_2$, which is a collective dipole oscillation of four valence protons
against the $\alpha$ core,and discuss the isospin symmetry with the mirror
nucleus $^8_2$He$_6$. We use the $\alpha+N+N+N+N$ five-body cluster model and
many-body resonances are obtained using the complex-scaling method. The $1^-$
resonance of $^8_6$C$_2$ is confirmed at the excitation energy of 13 MeV with a
large decay width of 24 MeV, and its structure is similar to the soft dipole
resonance in $^8_2$He$_6$, such as the configuration mixing and the spatial
properties. These results indicate a good isospin symmetry in the soft dipole
resonances of two nuclei with a common collective excitation of multiproton and
multineutron, while the ground states of two nuclei show different properties
due to the Coulomb repulsion of valence protons in $^8_6$C$_2$, leading to the
symmetry breaking. In conclusion, the appearance of the isospin symmetry
differs depending on the states of $^8_6$C$_2$ and $^8_2$He$_6$.
","[{""version"":""v1"",""created"":""Sat, 25 Mar 2023 01:10:12 GMT""}]","2023-03-28"
"2303.14319","Michael Brown","Michael K. Brown, Daniel Erman","Results on virtual resolutions for toric varieties",,,,,"math.AG math.AC","http://arxiv.org/licenses/nonexclusive-distrib/1.0/","  We give a short, new proof of a recent result of Hanlon-Hicks-Lazarev about
toric varieties. As in their work, this leads to a proof of a conjecture of
Berkesch-Erman-Smith on virtual resolutions and to a resolution of the diagonal
in the simplicial case.
","[{""version"":""v1"",""created"":""Sat, 25 Mar 2023 01:12:56 GMT""}]","2023-03-28"
"2303.14320","Hao Zhou Mr","Hao Zhou, Melike Erol-Kantarci, Yuanwei Liu, and H. Vincent Poor","A Survey on Model-based, Heuristic, and Machine Learning Optimization
  Approaches in RIS-aided Wireless Networks",,,,,"eess.SP","http://creativecommons.org/publicdomain/zero/1.0/","  Reconfigurable intelligent surfaces (RISs) have received considerable
attention as a key enabler for envisioned 6G networks, for the purpose of
improving the network capacity, coverage, efficiency, and security with low
energy consumption and low hardware cost. However, integrating RISs into the
existing infrastructure greatly increases the network management complexity,
especially for controlling a significant number of RIS elements. To unleash the
full potential of RISs, efficient optimization approaches are of great
importance. This work provides a comprehensive survey on optimization
techniques for RIS-aided wireless communications, including model-based,
heuristic, and machine learning (ML) algorithms. In particular, we first
summarize the problem formulations in the literature with diverse objectives
and constraints, e.g., sum-rate maximization, power minimization, and imperfect
channel state information constraints. Then, we introduce model-based
algorithms that have been used in the literature, such as alternating
optimization, the majorization-minimization method, and successive convex
approximation. Next, heuristic optimization is discussed, which applies
heuristic rules for obtaining low-complexity solutions. Moreover, we present
state-of-the-art ML algorithms and applications towards RISs, i.e., supervised
and unsupervised learning, reinforcement learning, federated learning, graph
learning, transfer learning, and hierarchical learning-based approaches.
Model-based, heuristic, and ML approaches are compared in terms of stability,
robustness, optimality and so on, providing a systematic understanding of these
techniques. Finally, we highlight RIS-aided applications towards 6G networks
and identify future challenges.
","[{""version"":""v1"",""created"":""Sat, 25 Mar 2023 01:16:28 GMT""}]","2023-03-28"
"2303.14321","Daniel Lemire","Daniel Lemire","Exact Short Products From Truncated Multipliers","Software at https://github.com/lemire/exactshortlib",,,,"cs.DS","http://creativecommons.org/licenses/by/4.0/","  We sometimes need to compute the most significant digits of the product of
small integers with a multiplier requiring much storage: e.g., a large integer
(e.g., $5^{100}$) or an irrational number ($\pi$). We only need to access the
most significant digits of the multiplier-as long as the integers are
sufficiently small. We provide an efficient algorithm to compute the range of
integers given a truncated multiplier and a desired number of digits.
","[{""version"":""v1"",""created"":""Sat, 25 Mar 2023 01:26:00 GMT""}]","2023-03-28"
"2303.14322","Usman Nazir","U. Nazir, W. Islam, M. Taj","Spatio-Temporal driven Attention Graph Neural Network with Block
  Adjacency matrix (STAG-NN-BA)",,"KDD 2023",,,"cs.CV","http://creativecommons.org/licenses/by/4.0/","  Despite the recent advances in deep neural networks, standard convolutional
kernels limit the applications of these networks to the Euclidean domain only.
Considering the geodesic nature of the measurement of the earth's surface,
remote sensing is one such area that can benefit from non-Euclidean and
spherical domains. For this purpose, we propose a novel Graph Neural Network
architecture for spatial and spatio-temporal classification using satellite
imagery. We propose a hybrid attention method to learn the relative importance
of irregular neighbors in remote sensing data. Instead of classifying each
pixel, we propose a method based on Simple Linear Iterative Clustering (SLIC)
image segmentation and Graph Attention GAT. The superpixels obtained from SLIC
become the nodes of our Graph Convolution Network (GCN). We then construct a
region adjacency graph (RAG) where each superpixel is connected to every other
adjacent superpixel in the image, enabling information to propagate globally.
Finally, we propose a Spatially driven Attention Graph Neural Network (SAG-NN)
to classify each RAG. We also propose an extension to our SAG-NN for
spatio-temporal data. Unlike regular grids of pixels in images, superpixels are
irregular in nature and cannot be used to create spatio-temporal graphs. We
introduce temporal bias by combining unconnected RAGs from each image into one
supergraph. This is achieved by introducing block adjacency matrices resulting
in novel Spatio-Temporal driven Attention Graph Neural Network with Block
Adjacency matrix (STAG-NN-BA). We evaluate our proposed methods on two remote
sensing datasets namely Asia14 and C2D2. In comparison with both non-graph and
graph-based approaches our SAG-NN and STAG-NN-BA achieved superior accuracy on
all the datasets while incurring less computation cost. The code and dataset
will be made public via our GitHub repository.
","[{""version"":""v1"",""created"":""Sat, 25 Mar 2023 01:26:50 GMT""}]","2023-03-28"
"2303.14323","Joe Ngai","M. Chrysler, J. Gabel, T.-L. Lee, Z. Zhu, T. C. Kaspar, P. V. Sushko,
  S. A. Chambers, and J. H. Ngai","Surface termination control of charge transfer and band alignment across
  a semiconductor-crystalline oxide heterojunction","17 pages, 5 figures",,,,"cond-mat.mtrl-sci","http://creativecommons.org/licenses/by-nc-nd/4.0/","  Charge redistribution across heterojunctions has long been utilized to induce
functional response in materials systems. Here we examine how the composition
of the terminating surface affects charge transfer across a heterojunction
consisting of Si and the crystalline complex oxide SrTiO3. Itinerant electrons
in Si migrate across the interface toward the surface of SrTiO3 due to surface
depletion. The electron transfer in turn creates an electric field across the
interface that modifies the interfacial dipole associated with bonding between
SrTiO3 and Si, leading to a change in the band alignment from type-II to
type-III. By capping the SrTiO3 surface with ultra-thin layers of BaO, SrO or
TiO2, charge transfer across the interface can be weakened or inhibited. Ab
initio modeling implicates the adsorption of oxygen as driving surface
depletion in SrTiO3. The electronic coupling between the surface and buried
interface expands the functionality of semiconductor-crystalline oxide
heterojunctions.
","[{""version"":""v1"",""created"":""Sat, 25 Mar 2023 01:31:09 GMT""}]","2023-03-28"
"2303.14324","Gang Wu","Gang Wu, Junjun Jiang, Yuanchao Bai, and Xianming Liu","Incorporating Transformer Designs into Convolutions for Lightweight
  Image Super-Resolution","9 pages, 9 figures",,,,"cs.CV","http://creativecommons.org/licenses/by/4.0/","  In recent years, the use of large convolutional kernels has become popular in
designing convolutional neural networks due to their ability to capture
long-range dependencies and provide large receptive fields. However, the
increase in kernel size also leads to a quadratic growth in the number of
parameters, resulting in heavy computation and memory requirements. To address
this challenge, we propose a neighborhood attention (NA) module that upgrades
the standard convolution with a self-attention mechanism. The NA module
efficiently extracts long-range dependencies in a sliding window pattern,
thereby achieving similar performance to large convolutional kernels but with
fewer parameters.
  Building upon the NA module, we propose a lightweight single image
super-resolution (SISR) network named TCSR. Additionally, we introduce an
enhanced feed-forward network (EFFN) in TCSR to improve the SISR performance.
EFFN employs a parameter-free spatial-shift operation for efficient feature
aggregation. Our extensive experiments and ablation studies demonstrate that
TCSR outperforms existing lightweight SISR methods and achieves
state-of-the-art performance. Our codes are available at
\url{https://github.com/Aitical/TCSR}.
","[{""version"":""v1"",""created"":""Sat, 25 Mar 2023 01:32:18 GMT""}]","2023-03-28"
"2303.14325","Xukun Zhou","Xukun Zhou, Jiwei Li, Tianwei Zhang, Lingjuan Lyu, Muqiao Yang, Jun He","Backdoor Attacks with Input-unique Triggers in NLP",,,,,"cs.CL","http://arxiv.org/licenses/nonexclusive-distrib/1.0/","  Backdoor attack aims at inducing neural models to make incorrect predictions
for poison data while keeping predictions on the clean dataset unchanged, which
creates a considerable threat to current natural language processing (NLP)
systems. Existing backdoor attacking systems face two severe issues:firstly,
most backdoor triggers follow a uniform and usually input-independent pattern,
e.g., insertion of specific trigger words, synonym replacement. This
significantly hinders the stealthiness of the attacking model, leading the
trained backdoor model being easily identified as malicious by model probes.
Secondly, trigger-inserted poisoned sentences are usually disfluent,
ungrammatical, or even change the semantic meaning from the original sentence,
making them being easily filtered in the pre-processing stage. To resolve these
two issues, in this paper, we propose an input-unique backdoor attack(NURA),
where we generate backdoor triggers unique to inputs. IDBA generates
context-related triggers by continuing writing the input with a language model
like GPT2. The generated sentence is used as the backdoor trigger. This
strategy not only creates input-unique backdoor triggers, but also preserves
the semantics of the original input, simultaneously resolving the two issues
above. Experimental results show that the IDBA attack is effective for attack
and difficult to defend: it achieves high attack success rate across all the
widely applied benchmarks, while is immune to existing defending methods. In
addition, it is able to generate fluent, grammatical, and diverse backdoor
inputs, which can hardly be recognized through human inspection.
","[{""version"":""v1"",""created"":""Sat, 25 Mar 2023 01:41:54 GMT""}]","2023-03-28"
"2303.14326","Yuan Da Liao","Gaopei Pan, Yuan Da Liao, Weilun Jiang, Jonathan D'Emidio, Yang Qi and
  Zi Yang Meng","Computing entanglement entropy of interacting fermions with quantum
  Monte Carlo: Why we failed and how to get it right","6+3 pages, 4+2 figures",,,,"cond-mat.str-el cond-mat.stat-mech math-ph math.MP physics.comp-ph quant-ph","http://arxiv.org/licenses/nonexclusive-distrib/1.0/","  There is no doubt that the information hidden in quantum entanglement can be
used to infer the organizing principle of various quantum phases of matter,
ranging from spontaneous symmetry breaking phases, quantum critical points to
topologically ordered states. It is far from clear, however, whether
entanglement measures, such as the entanglement entropy (EE), can actually be
obtained with the precision required to observe these subtle features --
usually in the form of universal finite size scaling behavior -- in highly
entangled quantum matter. In the case of 2D interacting fermionic lattice
models with gapless spectra, such as in the Hubbard model, the computation of
the EE has faced severe limitations, making reliable data in the universal
scaling regime off limits to all existing numerical algorithms. Here we explain
the reason for the previously unsuccessful attempts in EE computations in
quantum Monte Carlo simulations and more importantly, show how to overcome the
conceptual and computational barrier with the incremental algorithm[1,2], such
that the computation of the EE in 2D interacting fermion systems finally
becomes easy and reliable.
","[{""version"":""v1"",""created"":""Sat, 25 Mar 2023 01:56:09 GMT""},{""version"":""v2"",""created"":""Sun, 2 Apr 2023 11:43:08 GMT""}]","2023-04-04"
"2303.14327","Josiah Foster","Josiah Foster","The Lefschetz standard conjectures for IHSMs of generalized Kummer
  deformation type in certain degrees","37 pages",,,,"math.AG","http://creativecommons.org/licenses/by/4.0/","  For a projective $2n$-dimensional irreducible holomorphic symplectic manifold
$Y$ of generalized Kummer deformation type and $j>1$ the smallest divisor of
$n+1$, we prove the Lefschetz standard conjectures in degree $<2(n+1)(j-1)/j$.
We show that the restriction homomorphism from the cohomology of a projective
deformation of a moduli space of Gieseker-stable sheaves on an abelian surface
to the cohomology of $Y$ is surjective in these degrees. A corollary is that
the Lefschetz standard conjectures hold for $Y$ when $n+1$ is prime. The proofs
rely on Markman's description of the monodromy of generalized Kummer varieties,
Verbitsky's theory of hyperholomorphic sheaves, and the decomposition theorem.
","[{""version"":""v1"",""created"":""Sat, 25 Mar 2023 02:00:14 GMT""}]","2023-03-28"
"2303.14328","Amir Hossein Sadeghi","Alireza Bakhshi, Erfan Hassannayebi, Amir Hossein Sadeghi","Optimizing Sepsis Care through Heuristics Methods in Process Mining: A
  Trajectory Analysis","22 pages, 6 figures, 1 table",,,,"cs.CY cs.SY eess.SY","http://arxiv.org/licenses/nonexclusive-distrib/1.0/","  Process mining can help acquire insightful knowledge and heighten the
system's performance. In this study, we surveyed the trajectories of 1050
sepsis patients in a regional hospital in the Netherlands from the registration
to the discharge phase. Based on this real-world case study, the event log
comprises events and activities related to the emergency ward, admission to
hospital wards, and discharge enriched with data from lab experiments and
triage checklists. At first, we aim to discover this process through Heuristics
Miner (HM) and Inductive Miner (IM) methods. Then, we analyze a systematic
process model based on organizational information and knowledge. Besides, we
address conformance checking given medical guidelines for these patients and
monitor the related flows on the systematic process model. The results show
that HM and IM are inadequate in identifying the relevant process. However,
using a systematic process model based on expert knowledge and organizational
information resulted in an average fitness of 97.8%, a simplicity of 77.7%, and
a generalization of 80.2%. The analyses demonstrate that process mining can
shed light on the patient flow in the hospital and inspect the day-to-day
clinical performance versus medical guidelines. Also, the process models
obtained by the HM and IM methods cannot provide a concrete comprehension of
the process structure for stakeholders compared to the systematic process
model. The implications of our findings include the potential for process
mining to improve the quality of healthcare services, optimize resource
allocation, and reduce costs. Our study also highlights the importance of
considering expert knowledge and organizational information in developing
effective process models.
","[{""version"":""v1"",""created"":""Sat, 25 Mar 2023 02:05:03 GMT""}]","2023-03-28"
"2303.14329","Amirmohammad Pasdar","Miao Hu, Zhenxiao Luo, Amirmohammad Pasdar, Young Choon Lee, Yipeng
  Zhou, and Di Wu","Edge-Based Video Analytics: A Survey",,,,,"cs.DC cs.CV","http://creativecommons.org/licenses/by/4.0/","  Edge computing has been getting a momentum with ever-increasing data at the
edge of the network. In particular, huge amounts of video data and their
real-time processing requirements have been increasingly hindering the
traditional cloud computing approach due to high bandwidth consumption and high
latency. Edge computing in essence aims to overcome this hindrance by
processing most video data making use of edge servers, such as small-scale
on-premises server clusters, server-grade computing resources at mobile base
stations and even mobile devices like smartphones and tablets; hence, the term
edge-based video analytics. However, the actual realization of such analytics
requires more than the simple, collective use of edge servers. In this paper,
we survey state-of-the-art works on edge-based video analytics with respect to
applications, architectures, techniques, resource management, security and
privacy. We provide a comprehensive and detailed review on what works, what
doesn't work and why. These findings give insights and suggestions for next
generation edge-based video analytics. We also identify open issues and
research directions.
","[{""version"":""v1"",""created"":""Sat, 25 Mar 2023 02:11:31 GMT""}]","2023-03-28"
"2303.14330","Chlo\'e Bourquin","Chlo\'e Bourquin, Jonathan Por\'ee, Brice Rauby, Vincent Perrot, Nin
  Ghigo, Hatim Belgharbi, Samuel B\'elanger, Gerardo Ramos-Palacios, Nelson
  Cort\'es, Hugo Ladret, Lamyae Ikan, Christian Casanova, Fr\'ed\'eric Lesage,
  and Jean Provost","Quantitative pulsatility measurements using 3D Dynamic Ultrasound
  Localization Microscopy","10 pages, 6 figures. Supplementary materials 1 (video):
  https://youtu.be/DQ3Cf4w1J_0 ; Supplementary materials 2 (video):
  https://youtu.be/U1V7m6rtyYM",,,,"physics.med-ph","http://creativecommons.org/licenses/by/4.0/","  A rise in blood flow velocity variations (i.e., pulsatility) in the brain,
caused by the stiffening of upstream arteries, is associated with cognitive
impairment and neurodegenerative diseases. The study of this phenomenon
requires brain-wide pulsatility measurements, with high penetration depth and
high spatiotemporal resolution. The development of Dynamic Ultrasound
Localization Microscopy (DULM), based on ULM, has enabled pulsatility
measurements in the rodent brain in 2D. However, 2D imaging accesses only one
slice of the brain and measures biased velocities due to 2D projection. Herein,
we present 3D DULM, which can extract quantitative pulsatility measurements in
the cat brain with craniotomy and in the whole mouse brain through the skull,
showing a wide range of flow hemodynamics in both large and small vessels. We
highlighted a decrease in pulsatility along the vascular tree in the cat brain,
and performed an intra-animal validation of the method by showing consistent
measurements between the two sides of the Willis circle in the mouse brain. Our
study provides the first step towards a new biomarker that would allow the
detection of dynamic abnormalities in microvessels in the whole brain volume,
which could be linked to early signs of neurodegenerative diseases.
","[{""version"":""v1"",""created"":""Sat, 25 Mar 2023 02:17:46 GMT""}]","2023-03-28"
"2303.14331","Ru Zheng","Ru Zheng, Rong-Qiang He, and Zhong-Yi Lu","Natural orbitals renormalization group approach to a spin-1/2 impurity
  interacting with two helical liquids",,,"10.1103/PhysRevB.107.115149",,"cond-mat.str-el","http://arxiv.org/licenses/nonexclusive-distrib/1.0/","  Using the natural orbitals renormalization group, we studied the problem of a
localized spin- 1/2 impurity coupled to two helical liquids via the Kondo
interaction in a quantum spin Hall insulator, based on the Kane-Mele model
defined in a finite zigzag graphene nanoribbon. We investigated the influence
of the Kondo couplings with the helical liquids on both the static and dynamic
properties of the ground state. The number and distinct spatial structures of
the active natural orbitals (ANOs), which play essential roles in constructing
the ground-state wave function, were first analyzed. Our numerical results
indicate that two ANOs emerge, equal to the number of helical liquids.
Specifically, at the coupling symmetry point, both ANOs are fully active with
their spatial structures being respectively constituted by the different
helical liquids. In comparison, when deviating from the symmetry point, only
one ANO remains fully active, which is dominantly constructed by the helical
liquid with the larger Kondo coupling. Local screening of the impurity,
described by the impurity spin polarization and susceptibility, was further
studied. It shows that at the coupling symmetry point, the impurity is
maximally polarized and the spin susceptibility reaches the maximum. On the
contrary, the impurity tends to be screened without polarization when the Kondo
couplings deviate well from the symmetry point. The Kondo screening cloud,
manifested by the spin correlation between the impurity and the conduction
electrons, was finally explored. It is demonstrated that the Kondo cloud is
mainly formed by the helical liquid with the larger Kondo coupling to the
impurity. On the other hand, the spin-orbital coupling breaks the symmetry in
spatial distribution of the spin correlation, leading to anisotropy in the
Kondo cloud.
","[{""version"":""v1"",""created"":""Sat, 25 Mar 2023 02:20:54 GMT""}]","2023-03-28"
"2303.14332","Ashwin Kumar","Ashwin Kumar, Yevgeniy Vorobeychik, William Yeoh","Using Simple Incentives to Improve Two-Sided Fairness in Ridesharing
  Systems","Accepted for publication at the International Conference on Automated
  Planning and Scheduling (ICAPS) 2023",,,,"cs.AI","http://creativecommons.org/licenses/by/4.0/","  State-of-the-art order dispatching algorithms for ridesharing batch passenger
requests and allocate them to a fleet of vehicles in a centralized manner,
optimizing over the estimated values of each passenger-vehicle matching using
integer linear programming (ILP). Using good estimates of future values, such
ILP-based approaches are able to significantly increase the service rates
(percentage of requests served) for a fixed fleet of vehicles. However, such
approaches that focus solely on maximizing efficiency can lead to disparities
for both drivers (e.g., income inequality) and passengers (e.g., inequality of
service for different groups). Existing approaches that consider fairness only
do it for naive assignment policies, require extensive training, or look at
only single-sided fairness. We propose a simple incentive-based fairness scheme
that can be implemented online as a part of this ILP formulation that allows us
to improve fairness over a variety of fairness metrics. Deriving from a lens of
variance minimization, we describe how these fairness incentives can be
formulated for two distinct use cases for passenger groups and driver fairness.
We show that under mild conditions, our approach can guarantee an improvement
in the chosen metric for the worst-off individual. We also show empirically
that our Simple Incentives approach significantly outperforms prior art,
despite requiring no retraining; indeed, it often leads to a large improvement
over the state-of-the-art fairness-aware approach in both overall service rate
and fairness.
","[{""version"":""v1"",""created"":""Sat, 25 Mar 2023 02:24:27 GMT""}]","2023-03-28"
