"2303.14095","Kailun Yang","Ze Shi, Hao Shi, Kailun Yang, Zhe Yin, Yining Lin, Kaiwei Wang","PanoVPR: Towards Unified Perspective-to-Equirectangular Visual Place
  Recognition via Sliding Windows across the Panoramic View","Code and datasets will be made available at
  https://github.com/zafirshi/PanoVPR",,,,"cs.CV cs.RO eess.IV","http://arxiv.org/licenses/nonexclusive-distrib/1.0/","  Visual place recognition has received increasing attention in recent years as
a key technology in autonomous driving and robotics. The current mainstream
approaches use either the perspective view retrieval perspective view (P2P)
paradigm or the equirectangular image retrieval equirectangular image (E2E)
paradigm. However, a natural and practical idea is that users only have
consumer-grade pinhole cameras to obtain query perspective images and retrieve
them in panoramic database images from map providers. To this end, we propose
PanoVPR, a sliding-window-based perspective-to-equirectangular (P2E) visual
place recognition framework, which eliminates feature truncation caused by hard
cropping by sliding windows over the whole equirectangular image and computing
and comparing feature descriptors between windows. In addition, this unified
framework allows for directly transferring the network structure used in
perspective-to-perspective (P2P) methods without modification. To facilitate
training and evaluation, we derive the pitts250k-P2E dataset from the pitts250k
and achieve promising results, and we also establish a P2E dataset in a
real-world scenario by a mobile robot platform, which we refer to YQ360. Code
and datasets will be made available at https://github.com/zafirshi/PanoVPR.
","[{""version"":""v1"",""created"":""Fri, 24 Mar 2023 16:00:01 GMT""}]","2023-03-27"
"2303.14096","Jongheon Jeong","Jongheon Jeong, Sihyun Yu, Hankook Lee, Jinwoo Shin","Enhancing Multiple Reliability Measures via Nuisance-extended
  Information Bottleneck","25 pages; CVPR 2023",,,,"cs.LG cs.CV","http://arxiv.org/licenses/nonexclusive-distrib/1.0/","  In practical scenarios where training data is limited, many predictive
signals in the data can be rather from some biases in data acquisition (i.e.,
less generalizable), so that one cannot prevent a model from co-adapting on
such (so-called) ""shortcut"" signals: this makes the model fragile in various
distribution shifts. To bypass such failure modes, we consider an adversarial
threat model under a mutual information constraint to cover a wider class of
perturbations in training. This motivates us to extend the standard information
bottleneck to additionally model the nuisance information. We propose an
autoencoder-based training to implement the objective, as well as practical
encoder designs to facilitate the proposed hybrid discriminative-generative
training concerning both convolutional- and Transformer-based architectures.
Our experimental results show that the proposed scheme improves robustness of
learned representations (remarkably without using any domain-specific
knowledge), with respect to multiple challenging reliability measures. For
example, our model could advance the state-of-the-art on a recent challenging
OBJECTS benchmark in novelty detection by $78.4\% \rightarrow 87.2\%$ in AUROC,
while simultaneously enjoying improved corruption, background and (certified)
adversarial robustness. Code is available at
https://github.com/jh-jeong/nuisance_ib.
","[{""version"":""v1"",""created"":""Fri, 24 Mar 2023 16:03:21 GMT""}]","2023-03-27"
"2303.14097","Sebastiano Carpi","Sebastiano Carpi, Luca Tomassini","Energy bounds for vertex operator algebra extensions","19 pages, revised version","Letters in Mathematical Physics 113 (2023), no. 3, article n. 59","10.1007/s11005-023-01682-y",,"math.QA hep-th math-ph math.MP","http://arxiv.org/licenses/nonexclusive-distrib/1.0/","  Let V be a simple unitary vertex operator algebra and U be a (polynomially)
energy-bounded unitary subalgebra containing the conformal vector of V. We give
two sufficient conditions implying that V is energy-bounded. The first
condition is that U is a compact orbifold for some compact group G of unitary
automorphisms of V. The second condition is that V is exponentially
energy-bounded and it is a finite direct sum of simple U-modules. As
consequence of the second condition, we prove that if U is a regular
energy-bounded unitary subalgebra of a simple unitary vertex operator V, then
$V$ is energy-bounded. In particular, every simple unitary extension (with the
same conformal vector) of a simple unitary affine vertex operator algebra
associated with a semisimple Lie algebra is energy-bounded.
","[{""version"":""v1"",""created"":""Fri, 24 Mar 2023 16:04:39 GMT""},{""version"":""v2"",""created"":""Sun, 28 May 2023 15:05:50 GMT""}]","2023-05-30"
"2303.14098","Emilien Flayac","Emilien Flayac, Karim Dahia, Bruno H\'eriss\'e, and Fr\'ed\'eric Jean","Nonlinear Fisher Particle Output Feedback Control and its application to
  Terrain Aided Navigation",,,"10.1109/CDC.2017.8263874",,"math.OC","http://creativecommons.org/licenses/by/4.0/","  This paper presents state estimation and stochastic optimal control gathered
in one global optimization problem generating dual effect i.e. the control can
improve the future estimation. As the optimal policy is impossible to compute,
a sub-optimal policy that preserves this coupling is constructed thanks to the
Fisher Information Matrix (FIM) and a Particle Filter. This method has been
applied to the localization and guidance of a drone over a known terrain with
height measurements only. The results show that the new method improves the
estimation accuracy compared to nominal trajectories.
","[{""version"":""v1"",""created"":""Fri, 24 Mar 2023 16:05:48 GMT""}]","2023-03-27"
"2303.14100","Kourosh Darvish","Marta Skreta, Naruki Yoshikawa, Sebastian Arellano-Rubach, Zhi Ji,
  Lasse Bj{\o}rn Kristensen, Kourosh Darvish, Al\'an Aspuru-Guzik, Florian
  Shkurti, Animesh Garg","Errors are Useful Prompts: Instruction Guided Task Programming with
  Verifier-Assisted Iterative Prompting",,,,,"cs.RO","http://creativecommons.org/licenses/by/4.0/","  Generating low-level robot task plans from high-level natural language
instructions remains a challenging problem. Although large language models have
shown promising results in generating plans, the accuracy of the output remains
unverified. Furthermore, the lack of domain-specific language data poses a
limitation on the applicability of these models. In this paper, we propose
CLAIRIFY, a novel approach that combines automatic iterative prompting with
program verification to ensure programs written in data-scarce domain-specific
language are syntactically valid and incorporate environment constraints. Our
approach provides effective guidance to the language model on generating
structured-like task plans by incorporating any errors as feedback, while the
verifier ensures the syntactic accuracy of the generated plans. We demonstrate
the effectiveness of CLAIRIFY in planning chemistry experiments by achieving
state-of-the-art results. We also show that the generated plans can be executed
on a real robot by integrating them with a task and motion planner.
","[{""version"":""v1"",""created"":""Fri, 24 Mar 2023 16:06:11 GMT""}]","2023-03-27"
"2303.14102","Marco Gaido","Marco Gaido","Distributed Silhouette Algorithm: Evaluating Clustering on Big Data",,,,,"cs.DC cs.AI cs.DS","http://creativecommons.org/licenses/by-sa/4.0/","  In the big data era, the key feature that each algorithm needs to have is the
possibility of efficiently running in parallel in a distributed environment.
The popular Silhouette metric to evaluate the quality of a clustering,
unfortunately, does not have this property and has a quadratic computational
complexity with respect to the size of the input dataset. For this reason, its
execution has been hindered in big data scenarios, where clustering had to be
evaluated otherwise. To fill this gap, in this paper we introduce the first
algorithm that computes the Silhouette metric with linear complexity and can
easily execute in parallel in a distributed environment. Its implementation is
freely available in the Apache Spark ML library.
","[{""version"":""v1"",""created"":""Fri, 24 Mar 2023 16:10:43 GMT""}]","2023-03-27"
"2303.14103","Andreas Ketterer","Andreas Ketterer, Thomas Wellens","Characterizing crosstalk of superconducting transmon processors","9 pages, 6 figures",,,,"quant-ph","http://arxiv.org/licenses/nonexclusive-distrib/1.0/","  Currently available quantum computing hardware based on superconducting
transmon architectures realizes networks of hundreds of qubits with the
possibility of controlled nearest-neighbor interactions. However, the inherent
noise and decoherence effects of such quantum chips considerably alter basic
gate operations and lead to imperfect outputs of the targeted quantum
computations. In this work, we focus on the characterization of crosstalk
effects which manifest themselves in correlations between simultaneously
executed quantum gates on neighboring qubits. After a short explanation of the
physical origin of such correlations, we show how to efficiently and
systematically characterize the magnitude of such crosstalk effects on an
entire quantum chip using the randomized benchmarking protocol. We demonstrate
the introduced protocol by running it on real quantum hardware provided by IBM
observing significant alterations in gate fidelities due to crosstalk. Lastly,
we use the gained information in order to propose more accurate means to
simulate noisy quantum hardware by devising an appropriate crosstalk-aware
noise model.
","[{""version"":""v1"",""created"":""Fri, 24 Mar 2023 16:11:28 GMT""}]","2023-03-27"
"2303.14104","Carla Ferreira","Sara Simoes, Ana Ribeiro, Carla Ferreira, and Nuno Preguica","JepREST: Functional tests for distributed REST applications","in Portuguese language",,,,"cs.DC cs.DB cs.SE","http://creativecommons.org/licenses/by/4.0/","  Application services often support mobile and web applications with REST
interfaces, implemented using a set of distributed components that interact
with each other. This approach allows services to have high availability and
performance at a lower cost than a monolithic system. However, the existence of
multiple components makes the development process of these systems more complex
and therefore susceptible to errors. In this paper, we present JepREST, a
system that automates the use of Jepsen libraries to test the correctness of
distributed applications that provide a REST interface. Based on a service
interface specification, JepREST generates and executes a set of tests with
multiple clients performing operations concurrently, subsequently verifying if
the system behaviour is linearizable. The preliminary evaluation shows that
JepREST simplifies the testing of REST applications.
","[{""version"":""v1"",""created"":""Fri, 24 Mar 2023 16:13:37 GMT""}]","2023-03-27"
"2303.14105","Marie D'haene","Marie D'haene, Jun-ichi Inoguchi and Joeri Van der Veken","Parallel and totally umbilical hypersurfaces of the four-dimensional
  Thurston geometry $\text{Sol}^4_0$","18 pages",,,,"math.DG","http://arxiv.org/licenses/nonexclusive-distrib/1.0/","  We study hypersurfaces of the four-dimensional Thurston geometry
$\text{Sol}^4_0$, which is a Riemannian homogeneous space and a solvable Lie
group. In particular, we give a full classification of hypersurfaces whose
second fundamental form is a Codazzi tensor, including totally geodesic
hypersurfaces and hypersurfaces with parallel second fundamental form, and of
totally umbilical hypersurfaces of $\text{Sol}^4_0$. We also give a closed
expression for the Riemann curvature tensor of $\text{Sol}^4_0$, using two
integrable complex structures.
","[{""version"":""v1"",""created"":""Fri, 24 Mar 2023 16:15:13 GMT""}]","2023-03-27"
"2303.14106","Matthias F\""ugger","Raghda El Shehaby and Matthias F\""ugger and Andreas Steininger","On the Susceptibility of QDI Circuits to Transient Faults",,,,,"cs.AR","http://creativecommons.org/licenses/by/4.0/","  By design, quasi delay-insensitive (QDI) circuits exhibit higher resilience
against timing variations as compared to their synchronous counterparts. Since
computation in QDI circuits is event-based rather than clock-triggered,
spurious events due to transient faults such as radiation-induced glitches, a
priori are of higher concern in QDI circuits.
  In this work we propose a formal framework with the goal to gain a deeper
understanding on how susceptible QDI circuits are to transient faults. We
introduce a worst-case model for transients in circuits. We then prove an
equivalence of faults within this framework and use this result to provably
exhaustively check QDI circuits, a linear Muller pipeline and a cyclic Muller
pipeline, for their susceptibility to produce non-stable output signals.
","[{""version"":""v1"",""created"":""Fri, 24 Mar 2023 16:15:49 GMT""}]","2023-03-27"
"2303.14107","Edoardo Vitagliano","Graciela B. Gelmini, Jonah Hyman, Anna Simpson, Edoardo Vitagliano","Primordial black hole dark matter from catastrogenesis with unstable
  pseudo-Goldstone bosons","24 pages, 4 figures",,,,"hep-ph astro-ph.CO","http://arxiv.org/licenses/nonexclusive-distrib/1.0/","  We propose a new scenario for the formation of asteroid-mass primordial black
holes (PBHs). Our mechanism is based on the annihilation of the string-wall
network associated with the breaking of a $U(1)$ global symmetry into a
discrete $Z_N$ symmetry. If the potential has multiple local minima ($N>1$) the
network is stable, and the annihilation is guaranteed by a bias among the
different vacua. The collapse of the string-wall network is accompanied by
catastrogenesis, a large production of pseudo-Goldstone bosons (pGBs) -- e.g.
axions, ALPs, or majorons -- gravitational waves, and PBHs. If pGBs rapidly
decay into products that thermalize, as predicted e.g. in the high-quality QCD
axion and heavy majoron models, they do not contribute to the dark matter
population, but we show that PBHs can constitute 100% of the dark matter. The
gravitational wave background produced by catastrogenesis with heavy unstable
axions, ALPs, or majorons could be visible in future interferometers.
","[{""version"":""v1"",""created"":""Fri, 24 Mar 2023 16:16:57 GMT""}]","2023-03-27"
"2303.14108","Martin \v{Z}onda","Mat\v{e}j Mezera, Jana Men\v{s}\'ikov\'a, Pavel Bal\'a\v{z}, Martin
  \v{Z}onda","Neural Network Quantum States analysis of the Shastry-Sutherland model","Submission to SciPost",,,,"cond-mat.dis-nn","http://arxiv.org/licenses/nonexclusive-distrib/1.0/","  We utilize neural-network quantum states (NQSs) to investigate the
ground-state properties of the Heisenberg model on a Shastry-Sutherland lattice
via variational Monte Carlo method. We show that already relatively simple NQSs
can be used to approximate the ground state of this model in its different
phases and regimes. We first compare several types of NQSs with each other on
small lattices and benchmark their variational energies against the exact
diagonalization results. We argue that when precision, generality and
computational costs are taken into account, a good choice for addressing larger
systems is a shallow restricted Boltzmann machine NQS. We then show that such
NQS can describe the main phases of the model in zero magnetic field. Moreover,
NQS based on a restricted Boltzmann machine correctly describes the intriguing
plateaus forming in magnetization of the model as a function of increasing
magnetic field.
","[{""version"":""v1"",""created"":""Fri, 24 Mar 2023 16:18:16 GMT""}]","2023-03-27"
"2303.14109","Jingzu Yee","Jingzu Yee, Daichi Igarashi, Shun Miyatake, Yoshiyuki Tagawa","Prediction of the morphological evolution of a splashing drop using an
  encoder-decoder","25 pages, 14 figures",,"10.1088/2632-2153/acc727",,"physics.flu-dyn cs.CV","http://creativecommons.org/licenses/by/4.0/","  The impact of a drop on a solid surface is an important phenomenon that has
various implications and applications. However, the multiphase nature of this
phenomenon causes complications in the prediction of its morphological
evolution, especially when the drop splashes. While most machine-learning-based
drop-impact studies have centred around physical parameters, this study used a
computer-vision strategy by training an encoder-decoder to predict the drop
morphologies using image data. Herein, we show that this trained
encoder-decoder is able to successfully generate videos that show the
morphologies of splashing and non-splashing drops. Remarkably, in each frame of
these generated videos, the spreading diameter of the drop was found to be in
good agreement with that of the actual videos. Moreover, there was also a high
accuracy in splashing/non-splashing prediction. These findings demonstrate the
ability of the trained encoder-decoder to generate videos that can accurately
represent the drop morphologies. This approach provides a faster and cheaper
alternative to experimental and numerical studies.
","[{""version"":""v1"",""created"":""Fri, 24 Mar 2023 16:18:22 GMT""}]","2023-03-27"
"2303.14110","Gergely Barcza","Zsolt Benedek, Rohit Babar, \'Ad\'am Ganyecz, Tibor Szilv\'asi, \""Ors
  Legeza, Gergely Barcza, Viktor Iv\'ady","Symmetric carbon tetramers forming chemically stable spin qubits in hBN","main document (29 pages, 5 figures, 2 tables) + supplementary
  material (14 pages, 9 figures, 7 tables)",,,,"cond-mat.mtrl-sci","http://creativecommons.org/licenses/by-nc-nd/4.0/","  Point defect quantum bits in semiconductors have the potential to
revolutionize sensing at atomic scales. Currently, vacancy related defects,
such as the NV center in diamond and the VB$^-$ in hexagonal boron nitride
(hBN), are at the forefront of high spatial resolution and low dimensional
sensing. On the other hand, vacancies' reactive nature and instability at the
surface limit further developments. Here, we study the symmetric carbon
tetramers in hBN and propose them as a chemically stable spin qubit for sensing
in low dimensions. We utilize periodic-DFT and quantum chemistry approaches to
reliably and accurately predict the electronic, optical, and spin properties of
the studied defect. We show that the nitrogen centered symmetric carbon
tetramer gives rise to spin state dependent optical signals with strain
sensitive intersystem crossing rates. Furthermore, the weak hyperfine coupling
of the defect to their spin environments results in a reduced electron spin
resonance linewidth that may enhance sensitivity.
","[{""version"":""v1"",""created"":""Fri, 24 Mar 2023 16:18:55 GMT""}]","2023-03-27"
"2303.14111","Daniel Neider","Simon Lutz, Florian Wittbold, Simon Dierl, Benedikt B\""oing, Falk
  Howar, Barbara K\""onig, Emmanuel M\""uller, Daniel Neider","Interpretable Anomaly Detection via Discrete Optimization",,,,,"cs.LG cs.AI cs.FL","http://arxiv.org/licenses/nonexclusive-distrib/1.0/","  Anomaly detection is essential in many application domains, such as cyber
security, law enforcement, medicine, and fraud protection. However, the
decision-making of current deep learning approaches is notoriously hard to
understand, which often limits their practical applicability. To overcome this
limitation, we propose a framework for learning inherently interpretable
anomaly detectors from sequential data. More specifically, we consider the task
of learning a deterministic finite automaton (DFA) from a given multi-set of
unlabeled sequences. We show that this problem is computationally hard and
develop two learning algorithms based on constraint optimization. Moreover, we
introduce novel regularization schemes for our optimization problems that
improve the overall interpretability of our DFAs. Using a prototype
implementation, we demonstrate that our approach shows promising results in
terms of accuracy and F1 score.
","[{""version"":""v1"",""created"":""Fri, 24 Mar 2023 16:19:15 GMT""}]","2023-03-27"
"2303.14112","Marco-Tulio Fonseca Rodrigues","Marco-Tulio F. Rodrigues, Sathish Rajendran, Stephen E. Trask, Alison
  R. Dunlop, Avtar Singh, Jeffery M. Allen, Peter J. Weddle, Andrew M.
  Colclasure, Andrew N. Jansen","Cell-format-dependent mechanical damage in silicon anodes",,,,,"physics.chem-ph","http://creativecommons.org/licenses/by-nc-nd/4.0/","  It is generally believed that silicon-based anodes for Li-ion batteries would
benefit from stronger binders, as cyclic volume changes would not disrupt the
cohesion of the composite electrode. Here, we put this belief to the proof by
testing electrodes containing SiOx particles and an aromatic polyimide binder.
We observe that the electrodes can stretch laterally by as much as 6% during
the first cycle, indicating that internal stresses are high enough to induce
plastic deformation on the copper current collector. Remarkably, no coating
delamination is observed. Additional consequences were size-dependent: while
pouch-cell-sized electrodes developed wrinkles, coin-cell-sized ones remained
mostly smooth. We demonstrate that wrinkling of the current collector damages
the electrode coating, inactivating SiOx domains and accelerating capacity
fade. This size-dependent performance decay indicates that, in extreme cases,
testing outcomes are highly dependent on scale. Novel battery materials may
require testing at larger cell formats for complete validation.
","[{""version"":""v1"",""created"":""Fri, 24 Mar 2023 16:19:46 GMT""}]","2023-03-27"
"2303.14113","Mina Montazeri","Mina Montazeri, Pegah Rokhforoz, Hamed Kebriaei, Olga Fink","Incentive Mechanism in the Sponsored Content Market with Network Effect",,,,,"cs.GT","http://creativecommons.org/licenses/by/4.0/","  We propose an incentive mechanism for the sponsored content provider market
in which the communication of users can be represented by a graph and the
private information of the users is assumed to have a continuous distribution
function. The content provider stipulates incentive rewards to encourage users
to reveal their private information truthfully and increase their content
demand, which leads to an increase in advertising revenue. We prove that all
users gain a non-negative utility and disclose their private information
truthfully. Moreover, we study the effectiveness and scalability of the
proposed mechanism in a case study with different network structures.
","[{""version"":""v1"",""created"":""Fri, 24 Mar 2023 16:20:42 GMT""}]","2023-03-27"
"2303.14114","Shay Snyder","Shay Snyder (1), Hunter Thompson (2), Md Abdullah-Al Kaiser (3),
  Gregory Schwartz (4), Akhilesh Jaiswal (3), and Maryam Parsa (1) ((1) George
  Mason University, (2) Georgia Institute of Technology, (3) University of
  Southern California, (4) Northwestern University)","Object Motion Sensitivity: A Bio-inspired Solution to the Ego-motion
  Problem for Event-based Cameras","This document is 9 pages and has 6 figures, tables, and algorithms",,,,"cs.CV cs.NE","http://creativecommons.org/licenses/by/4.0/","  Neuromorphic (event-based) image sensors draw inspiration from the
human-retina to create an electronic device that can process visual stimuli in
a way that closely resembles its biological counterpart. These sensors process
information significantly different than the traditional RGB sensors.
Specifically, the sensory information generated by event-based image sensors
are orders of magnitude sparser compared to that of RGB sensors. The first
generation of neuromorphic image sensors, Dynamic Vision Sensor (DVS), are
inspired by the computations confined to the photoreceptors and the first
retinal synapse. In this work, we highlight the capability of the second
generation of neuromorphic image sensors, Integrated Retinal Functionality in
CMOS Image Sensors (IRIS), which aims to mimic full retinal computations from
photoreceptors to output of the retina (retinal ganglion cells) for targeted
feature-extraction. The feature of choice in this work is Object Motion
Sensitivity (OMS) that is processed locally in the IRIS sensor. Our results
show that OMS can accomplish standard computer vision tasks with similar
efficiency to conventional RGB and DVS solutions but offers drastic bandwidth
reduction. This cuts the wireless and computing power budgets and opens up vast
opportunities in high-speed, robust, energy-efficient, and low-bandwidth
real-time decision making.
","[{""version"":""v1"",""created"":""Fri, 24 Mar 2023 16:22:06 GMT""},{""version"":""v2"",""created"":""Mon, 27 Mar 2023 01:55:42 GMT""},{""version"":""v3"",""created"":""Fri, 14 Apr 2023 21:43:46 GMT""}]","2023-04-18"
