"2303.14640","Sixian Wang","Jincheng Dai, Sixian Wang, Ping Zhang, Xiaoqi Qin, Kai Niu, and
  Zhongwei Si","Dimensions of Semantic Coding: Explicit and Implicit",,,,,"eess.SP cs.IT math.IT","http://arxiv.org/licenses/nonexclusive-distrib/1.0/","  Recent advances in deep learning have led to increased interest in solving
high-efficiency end-to-end transmission problems using methods that employ the
nonlinear property of neural networks. These methods, we call semantic coding,
extract semantic features of the source signal across space and time, and
design source-channel coding methods to transmit these features over wireless
channels. Rapid progress has led to numerous research papers, but a
consolidation of the discovered knowledge has not yet emerged. In this article,
we gather ideas to categorize the expansive aspects on semantic coding as two
paradigms, i.e., explicit and implicit semantic coding. We first focus on those
two paradigms of semantic coding by identifying their common and different
components in building semantic communication systems. We then focus on the
applications of semantic coding to different transmission tasks. Our article
highlights the improved quality, flexibility, and capability brought by
semantic coded transmission. Finally, we point out future directions.
","[{""version"":""v1"",""created"":""Sun, 26 Mar 2023 06:26:50 GMT""}]","2023-03-28"
"2303.14641","Prakash Chandra Mondal Prof.","Ritu Gupta, Ankur Malik, Vincent Vivier and Prakash Chandra Mondal","Nanoscale molecular electrochemical supercapacitors","18 pages, 6 Figures",,,,"physics.app-ph cond-mat.mes-hall","http://creativecommons.org/licenses/by/4.0/","  Due to the shorter channel length allowing faster ion/charge movement,
nanoscale molecular thin films can be attractive electronic components for
next-generation high-performing energy storage devices. However, controlling
chemical functionalization and achieving stable electrode-molecule interfaces
at the nanoscale via covalent functionalization for low-voltage operational,
ultrafast charging/discharging remains a challenge. Herein, we present a
simple, controllable, scalable, low-cost, and versatile electrochemical
grafting approach to modulate chemical and electronic properties of graphite
rods (GRs) that are extracted from low-cost EVEREADY cells (1.5 US $ for 10
cells of 1.5 V). On the ANT-modified GR (ANT/GR), the total capacitance unveils
350-fold enhancement as compared to an unmodified GR tested with 0.1 M H2SO4
electrolyte ensured by both potentiostatic and galvanostatic measurements. Such
enhancement in capacitance is attributed to the contribution from the
electrical double layer and Faradaic charge transfer. Due to higher
conductivity, anthracene molecular layers possess more azo groups (-N=N-) over
pyrene, and naphthalene molecular films during the electrochemical grafting,
which is key to capacitance improvements. The ultra-low-loading nanofilms
expose high surface area leading to extremely high energy density. The
nanoscale molecular films (~ 23 nm thickness) show exceptional galvanostatic
charge-discharge cycling stability (10,000) that operates at low potential.
Electrochemical impedance spectroscopy was performed along with the DC
measurements to unravel in-depth charge storage performances. Electrochemically
grafted molecular films on GR show excellent balance in capacitance and
electrical conductivity, high diffusion coefficient toward ferrocene, and can
easily be synthesized in good yield on rigid to flexible electrodes.
","[{""version"":""v1"",""created"":""Sun, 26 Mar 2023 06:47:14 GMT""}]","2023-03-28"
"2303.14642","Morgan Lynch","Morgan H. Lynch","Experimental observation of a Rindler horizon","4 pages, 3 figures",,,,"hep-ph gr-qc hep-th","http://creativecommons.org/licenses/by/4.0/","  In this manuscript we confirm the presence of a Rindler horizon at CERN-NA63
by exploring its thermodynamics induced by the Unruh effect in their high
energy channeling radiation experiments. By linking the entropy of the emitted
radiation to the photon number, we find the measured spectrum to be a simple
manifestation of the second law of Rindler horizon thermodynamics and thus a
direct measurement of the recoil Fulling-Davies-Unruh (FDU) temperature.
Moreover, since the experiment is born out of an ultra-relativistic positron,
and the FDU temperature is defined in the proper frame, we find that
temperature boosts as a length and thus fast objects appear colder. The
spectrum also provides us with a simple setting to measure fundamental
constants, and we employ it to measure the positron mass.
","[{""version"":""v1"",""created"":""Sun, 26 Mar 2023 06:51:29 GMT""}]","2023-03-28"
"2303.14643","Yue Zhang","YUE Zhang, Suchen Wang, Shichao Kan, Zhenyu Weng, Yigang Cen, Yap-peng
  Tan","POAR: Towards Open-World Pedestrian Attribute Recognition",,,,,"cs.CV","http://arxiv.org/licenses/nonexclusive-distrib/1.0/","  Pedestrian attribute recognition (PAR) aims to predict the attributes of a
target pedestrian in a surveillance system. Existing methods address the PAR
problem by training a multi-label classifier with predefined attribute classes.
However, it is impossible to exhaust all pedestrian attributes in the real
world. To tackle this problem, we develop a novel pedestrian open-attribute
recognition (POAR) framework. Our key idea is to formulate the POAR problem as
an image-text search problem. We design a Transformer-based image encoder with
a masking strategy. A set of attribute tokens are introduced to focus on
specific pedestrian parts (e.g., head, upper body, lower body, feet, etc.) and
encode corresponding attributes into visual embeddings. Each attribute category
is described as a natural language sentence and encoded by the text encoder.
Then, we compute the similarity between the visual and text embeddings of
attributes to find the best attribute descriptions for the input images.
Different from existing methods that learn a specific classifier for each
attribute category, we model the pedestrian at a part-level and explore the
searching method to handle the unseen attributes. Finally, a many-to-many
contrastive (MTMC) loss with masked tokens is proposed to train the network
since a pedestrian image can comprise multiple attributes. Extensive
experiments have been conducted on benchmark PAR datasets with an
open-attribute setting. The results verified the effectiveness of the proposed
POAR method, which can form a strong baseline for the POAR task.
","[{""version"":""v1"",""created"":""Sun, 26 Mar 2023 06:59:23 GMT""}]","2023-03-28"
"2303.14644","Joya Chen","Joya Chen, Difei Gao, Kevin Qinghong Lin, Mike Zheng Shou","Affordance Grounding from Demonstration Video to Target Image","CVPR 2023",,,,"cs.CV","http://arxiv.org/licenses/nonexclusive-distrib/1.0/","  Humans excel at learning from expert demonstrations and solving their own
problems. To equip intelligent robots and assistants, such as AR glasses, with
this ability, it is essential to ground human hand interactions (i.e.,
affordances) from demonstration videos and apply them to a target image like a
user's AR glass view. The video-to-image affordance grounding task is
challenging due to (1) the need to predict fine-grained affordances, and (2)
the limited training data, which inadequately covers video-image discrepancies
and negatively impacts grounding. To tackle them, we propose Affordance
Transformer (Afformer), which has a fine-grained transformer-based decoder that
gradually refines affordance grounding. Moreover, we introduce Mask Affordance
Hand (MaskAHand), a self-supervised pre-training technique for synthesizing
video-image data and simulating context changes, enhancing affordance grounding
across video-image discrepancies. Afformer with MaskAHand pre-training achieves
state-of-the-art performance on multiple benchmarks, including a substantial
37% improvement on the OPRA dataset. Code is made available at
https://github.com/showlab/afformer.
","[{""version"":""v1"",""created"":""Sun, 26 Mar 2023 07:02:41 GMT""}]","2023-03-28"
"2303.14645","Dianyi Yang","Dianyi Yang, Jiadong Tang, Yu Gao, Yi Yang, Mengyin Fu","Sector Patch Embedding: An Embedding Module Conforming to The Distortion
  Pattern of Fisheye Image",,,,,"cs.CV cs.RO","http://arxiv.org/licenses/nonexclusive-distrib/1.0/","  Fisheye cameras suffer from image distortion while having a large field of
view(LFOV). And this fact leads to poor performance on some fisheye vision
tasks. One of the solutions is to optimize the current vision algorithm for
fisheye images. However, most of the CNN-based methods and the
Transformer-based methods lack the capability of leveraging distortion
information efficiently. In this work, we propose a novel patch embedding
method called Sector Patch Embedding(SPE), conforming to the distortion pattern
of the fisheye image. Furthermore, we put forward a synthetic fisheye dataset
based on the ImageNet-1K and explore the performance of several Transformer
models on the dataset. The classification top-1 accuracy of ViT and PVT is
improved by 0.75% and 2.8% with SPE respectively. The experiments show that the
proposed sector patch embedding method can better perceive distortion and
extract features on the fisheye images. Our method can be easily adopted to
other Transformer-based models. Source code is at
https://github.com/IN2-ViAUn/Sector-Patch-Embedding.
","[{""version"":""v1"",""created"":""Sun, 26 Mar 2023 07:20:02 GMT""}]","2023-03-28"
"2303.14646","Dacheng Wen","Dacheng Wen, Yupeng Li, Francis C.M. Lau","A Survey of Machine Learning-Based Ride-Hailing Planning",,,,,"cs.LG cs.AI","http://creativecommons.org/licenses/by-nc-nd/4.0/","  Ride-hailing is a sustainable transportation paradigm where riders access
door-to-door traveling services through a mobile phone application, which has
attracted a colossal amount of usage. There are two major planning tasks in a
ride-hailing system: (1) matching, i.e., assigning available vehicles to pick
up the riders, and (2) repositioning, i.e., proactively relocating vehicles to
certain locations to balance the supply and demand of ride-hailing services.
Recently, many studies of ride-hailing planning that leverage machine learning
techniques have emerged. In this article, we present a comprehensive overview
on latest developments of machine learning-based ride-hailing planning. To
offer a clear and structured review, we introduce a taxonomy into which we
carefully fit the different categories of related works according to the types
of their planning tasks and solution schemes, which include collective
matching, distributed matching, collective repositioning, distributed
repositioning, and joint matching and repositioning. We further shed light on
many real-world datasets and simulators that are indispensable for empirical
studies on machine learning-based ride-hailing planning strategies. At last, we
propose several promising research directions for this rapidly growing research
and practical field.
","[{""version"":""v1"",""created"":""Sun, 26 Mar 2023 07:21:03 GMT""}]","2023-03-28"
"2303.14647","Behrouz Minaei-Bidgoli","Najmeh Torabian, Behrouz Minaei-Bidgoli and Mohsen Jahanshahi","Farspredict: A benchmark dataset for link prediction","13 pages, 3 figures, 1 algorithm and 5 tables",,,,"cs.AI cs.CL","http://arxiv.org/licenses/nonexclusive-distrib/1.0/","  Link prediction with knowledge graph embedding (KGE) is a popular method for
knowledge graph completion. Furthermore, training KGEs on non-English knowledge
graph promote knowledge extraction and knowledge graph reasoning in the context
of these languages. However, many challenges in non-English KGEs pose to
learning a low-dimensional representation of a knowledge graph's entities and
relations. This paper proposes ""Farspredict"" a Persian knowledge graph based on
Farsbase (the most comprehensive knowledge graph in Persian). It also explains
how the knowledge graph structure affects link prediction accuracy in KGE. To
evaluate Farspredict, we implemented the popular models of KGE on it and
compared the results with Freebase. Given the analysis results, some
optimizations on the knowledge graph are carried out to improve its
functionality in the KGE. As a result, a new Persian knowledge graph is
achieved. Implementation results in the KGE models on Farspredict outperforming
Freebases in many cases. At last, we discuss what improvements could be
effective in enhancing the quality of Farspredict and how much it improves.
","[{""version"":""v1"",""created"":""Sun, 26 Mar 2023 07:41:26 GMT""}]","2023-03-28"
"2303.14648","Prakash Chandra Mondal Prof.","Ranjeev Kumar Parashar, Suchita Kandpal, Prasanta Bandyopadhyay,
  Mainak Sadhukhan, Rajesh Kumar, and Prakash Chandra Mondal","Molecular lighting goes less powering","13 Pages, 7 Figures",,,,"cond-mat.mtrl-sci","http://creativecommons.org/licenses/by/4.0/","  The present era has seen tremendous demands for low-cost electrochromic
materials for visible-region multicolor display technology, paper-based,
flexible, and wearable electronic devices, smart windows, and optoelectronic
applications. Towards this goal, we report large-scale polyelectrochromic
devices fabricated on rigid to flexible ITO substrates comprising novel
anthracene containing viologen,
(1,1'-bis(anthracen-9-ylmethyl)-[4,4'-bipyridine]-1,1'-diium bromide,
abbreviated as AnV2+), and polythiophene (P3HT). Inter-estingly, the devices
show three states of reversible visible color in response to the applied bias,
sub-second to second switching time (0.7 s/1.6 s), and high coloration
efficiency (484 cm2/C), longer cycling stability up to 3000 s (103 switching
cycles). Thanks to the anthracenes moieties introduced to viologen that inhibit
formation of undesired dimer of cation radicals formed in response to the
applied bias, other-wise it would hamper the devices reconfiguration. The
devices are fully characterized, and electrochromic performances are ensured by
bias-dependent UV-Vis, and Raman spectroscopy. The fabricated electro-chromic
devices are tested with the commercially available low-cost cells to perform,
which is highly de-sired for practical applications. The computational study
facilitates the understanding of experimental re-sults. The alternating current
(AC)-based electrical impedance spectroscopy reveals that P3HT facilitates
reducing charge transfer resistance of the devices. Our work shows CMOS
compatibility and one of the best-performing devices that could pave the way
for developing cost-effective flexible, and wearable electrochromic devices.
","[{""version"":""v1"",""created"":""Sun, 26 Mar 2023 07:42:19 GMT""},{""version"":""v2"",""created"":""Tue, 28 Mar 2023 14:56:46 GMT""}]","2023-03-29"
"2303.14649","Preeti Bhandari","Preeti Bhandari, Vikas Malik and Moshe Schechter","Variable range hopping in a non-equilibrium steady state","8 pages, 7 figures",,,,"cond-mat.dis-nn","http://creativecommons.org/licenses/by/4.0/","  We propose a Monte Carlo simulation to understand electron transport in a
non-equilibrium steady state (\textit{NESS}) for the lattice Coulomb Glass
model, created by continuous excitation of single electrons to high energies
followed by relaxation of the system. Around the Fermi level, the \textit{NESS}
state approximately obeys the Fermi-Dirac statistics, with an effective
temperature ($T_{eff}$) greater than the system's bath temperature ($T$).
$T_{eff}$ is a function of $T$ and the rate of photon absorption by the system.
Furthermore, we find that the change in conductivity is only a function of
relaxation times and is almost independent of the bath temperature. Our results
indicate that the conductivity of the \textit{NESS} state can still be
characterized by the Efros-Shklovskii law with an effective temperature
$T_{eff}>T$. Additionally, the dominance of phonon-less hopping over
phonon-assisted hopping is used to explain the relevance of the hot-electron
model to the conductivity of the \textit{NESS} state.
","[{""version"":""v1"",""created"":""Sun, 26 Mar 2023 07:43:38 GMT""}]","2023-03-28"
"2303.14650","Gerardo F. Goya","Jes\'us A. Fuentes-Garc\'ia, Beatriz Sanz-Sagu\'e, Reyes Mallada, M.
  Ricardo Ibarra and Gerardo F. Goya","Magnetic nanofibers for remotely triggered catalytic activity applied to
  the degradation of organic pollutants","31 pages, 16 figures","Materials & Design 226 (2023) 111615","10.1016/j.matdes.2023.111615",,"physics.app-ph cond-mat.soft","http://creativecommons.org/licenses/by/4.0/","  This work reports on the synthesis and characterization of a new type of
electrospun magnetic nanofibers (MNFs), and their application for degradation
of organic pollutants using remote magnetic inductive heating. We describe a
simple protocol combining a fast (app. 5 min) synthesis of
MnFe\textsubscript{2}O\textsubscript{4} magnetic nanoparticles (MNPs) by
sonochemical route, optimized for inductive heating, with their subsequent
incorporation in electrospun MNFs composed of polyacrylonitrile (PAN)
nanofibers. The resulting multifunctional MNFs (average diameter $\phi = 760
\pm 150$ nm) contain up to $\approx 30%$wt. of the MNPs. The composite showed
superhydrophobic behaviour ($\theta_c = 165^\circ$) and a band gap value of
1.75 eV. We found that the presence of MNPs embedded into the polymeric
nanofibers modify the exothermic and the glass transitions temperatures
compared with pure PAN nanofibers, suggesting a strong attachment between MNPs
and polymeric chains. The MNFs could be remotely activated by alternating
magnetic fields (AMF, $f = 200-800$ kHz, $H_0 = 10-36$ kA/m) for accelerating
the catalytic reactions of the organic dye methylene blue (MB). A remarkable
stability of the MNFs against degradation under extreme pH conditions
($3<pH<10$) resulted in a sustained heating efficiency after many heating
cycles. We observed a degradation efficiency $>80%$ in the presence of hydrogen
peroxide under AMFs, attributed to Fe\textsuperscript{2+}/\textsuperscript{3+}
and Mn\textsuperscript{2+}/\textsuperscript{3+}/\textsuperscript{4+} active
centers on the surface of the MNP/MNFs observed from XPS data. The capacity of
these materials for magnetic remote activation appeals catalytic applications
under conditions of darkness or restrained access, where no photocatalytic
reactions can be achieved.
","[{""version"":""v1"",""created"":""Sun, 26 Mar 2023 07:44:00 GMT""}]","2023-03-28"
"2303.14651","Jie Hu","Jie Hu, Linyan Huang, Tianhe Ren, Shengchuan Zhang, Rongrong Ji, and
  Liujuan Cao","You Only Segment Once: Towards Real-Time Panoptic Segmentation","CVPR 2023",,,,"cs.CV","http://creativecommons.org/licenses/by/4.0/","  In this paper, we propose YOSO, a real-time panoptic segmentation framework.
YOSO predicts masks via dynamic convolutions between panoptic kernels and image
feature maps, in which you only need to segment once for both instance and
semantic segmentation tasks. To reduce the computational overhead, we design a
feature pyramid aggregator for the feature map extraction, and a separable
dynamic decoder for the panoptic kernel generation. The aggregator
re-parameterizes interpolation-first modules in a convolution-first way, which
significantly speeds up the pipeline without any additional costs. The decoder
performs multi-head cross-attention via separable dynamic convolution for
better efficiency and accuracy. To the best of our knowledge, YOSO is the first
real-time panoptic segmentation framework that delivers competitive performance
compared to state-of-the-art models. Specifically, YOSO achieves 46.4 PQ, 45.6
FPS on COCO; 52.5 PQ, 22.6 FPS on Cityscapes; 38.0 PQ, 35.4 FPS on ADE20K; and
34.1 PQ, 7.1 FPS on Mapillary Vistas. Code is available at
https://github.com/hujiecpp/YOSO.
","[{""version"":""v1"",""created"":""Sun, 26 Mar 2023 07:55:35 GMT""}]","2023-03-28"
"2303.14652","Bohao Peng","Bohao Peng, Zhuotao Tian, Xiaoyang Wu, Chenyao Wang, Shu Liu, Jingyong
  Su, Jiaya Jia","Hierarchical Dense Correlation Distillation for Few-Shot Segmentation","to be published in CVPR 2023, code is available at
  \url{https://github.com/Pbihao/HDMNet}",,,,"cs.CV cs.AI","http://arxiv.org/licenses/nonexclusive-distrib/1.0/","  Few-shot semantic segmentation (FSS) aims to form class-agnostic models
segmenting unseen classes with only a handful of annotations. Previous methods
limited to the semantic feature and prototype representation suffer from coarse
segmentation granularity and train-set overfitting. In this work, we design
Hierarchically Decoupled Matching Network (HDMNet) mining pixel-level support
correlation based on the transformer architecture. The self-attention modules
are used to assist in establishing hierarchical dense features, as a means to
accomplish the cascade matching between query and support features. Moreover,
we propose a matching module to reduce train-set overfitting and introduce
correlation distillation leveraging semantic correspondence from coarse
resolution to boost fine-grained segmentation. Our method performs decently in
experiments. We achieve $50.0\%$ mIoU on \coco~dataset one-shot setting and
$56.0\%$ on five-shot segmentation, respectively.
","[{""version"":""v1"",""created"":""Sun, 26 Mar 2023 08:13:12 GMT""}]","2023-03-28"
"2303.14653","Min Wang","Yingda Guan, Zhengyang Feng, Huiying Chang, Kuo Du, Tingting Li, Min
  Wang","SDTracker: Synthetic Data Based Multi-Object Tracking","cvpr2022 workshop",,,,"cs.CV","http://arxiv.org/licenses/nonexclusive-distrib/1.0/","  We present SDTracker, a method that harnesses the potential of synthetic data
for multi-object tracking of real-world scenes in a domain generalization and
semi-supervised fashion. First, we use the ImageNet dataset as an auxiliary to
randomize the style of synthetic data. With out-of-domain data, we further
enforce pyramid consistency loss across different ""stylized"" images from the
same sample to learn domain invariant features. Second, we adopt the
pseudo-labeling method to effectively utilize the unlabeled MOT17 training
data. To obtain high-quality pseudo-labels, we apply proximal policy
optimization (PPO2) algorithm to search confidence thresholds for each
sequence. When using the unlabeled MOT17 training set, combined with the
pure-motion tracking strategy upgraded via developed post-processing, we
finally reach 61.4 HOTA.
","[{""version"":""v1"",""created"":""Sun, 26 Mar 2023 08:21:22 GMT""}]","2023-03-28"
"2303.14654","Gerardo F. Goya","Zhila Shaterabadi, Gholamreza Nabiyouni, Gerardo F Goya, Meysam
  Soleymani","The effect of the magnetically dead layer on the magnetization and the
  magnetic anisotropy of the dextran coated magnetite nanoparticles","16 pages, 1 table, 3 figures","Applied Physics A (2022) 128:631","10.1007/s00339-022-05675-x",,"cond-mat.mtrl-sci","http://creativecommons.org/licenses/by/4.0/","  We present a study on the magnetic behavior of dextran-coated magnetite
nanoparticles (DM NPs) with sizes between 3 and 19 nm, synthesized by
hydrothermal-assisted co-precipitation method. The decrease of saturation
magnetization ($M_s$) with decreasing particle size has been modeled by
assuming the existence of a spin-disordered layer at the particle surface,
which is magnetically dead. Based on this core-shell model and taking into
account the weight contribution of the non-magnetic coating layer (dextran) to
the whole magnetization, the dead layer thickness ($t$) and saturation
magnetization $M_s$ of the magnetic cores in our samples were estimated to be
$t = 6.8~\mathrm{\AA}$ and $M_s = 98.8~\mathrm{emu/g}$, respectively. The data
of $M_s$ were analyzed using a law of approach to saturation, indicating an
increase in effective magnetic anisotropy ($K_{eff}$) with decreasing particle
size as expected from the increased surface/volume ratio in small MNPs. The
obtained $K_{eff}$ values were successfully modeled by including an extra
contribution of dipolar interactions due to the formation of chain-like
clusters of MNPs. The surface magnetic anisotropy ($K_s$) was estimated to be
about $K_s = 1.04\times10^5~\mathrm{J/m^3}$. Our method provides a simple and
accurate way to obtain the $M_s$ core values in surface-disordered MNPs, a
relevant parameter required for magnetic modeling in many applications.
","[{""version"":""v1"",""created"":""Sun, 26 Mar 2023 08:29:31 GMT""}]","2023-03-28"
"2303.14655","Ji Qi","Ji Qi, Jifan Yu, Teng Tu, Kunyu Gao, Yifan Xu, Xinyu Guan, Xiaozhi
  Wang, Yuxiao Dong, Bin Xu, Lei Hou, Juanzi Li, Jie Tang, Weidong Guo, Hui
  Liu, Yu Xu","GOAL: A Challenging Knowledge-grounded Video Captioning Benchmark for
  Real-time Soccer Commentary Generation",,,,,"cs.CV cs.CL cs.LG","http://arxiv.org/licenses/nonexclusive-distrib/1.0/","  Despite the recent emergence of video captioning models, how to generate
vivid, fine-grained video descriptions based on the background knowledge (i.e.,
long and informative commentary about the domain-specific scenes with
appropriate reasoning) is still far from being solved, which however has great
applications such as automatic sports narrative. In this paper, we present
GOAL, a benchmark of over 8.9k soccer video clips, 22k sentences, and 42k
knowledge triples for proposing a challenging new task setting as
Knowledge-grounded Video Captioning (KGVC). Moreover, we conduct experimental
adaption of existing methods to show the difficulty and potential directions
for solving this valuable and applicable task.
","[{""version"":""v1"",""created"":""Sun, 26 Mar 2023 08:43:36 GMT""}]","2023-03-28"
