"2303.14706","Qian Wang","Qian Wang, Yiqun Wang, Michael Birsak, Peter Wonka","BlobGAN-3D: A Spatially-Disentangled 3D-Aware Generative Model for
  Indoor Scenes",,,,,"cs.CV","http://arxiv.org/licenses/nonexclusive-distrib/1.0/","  3D-aware image synthesis has attracted increasing interest as it models the
3D nature of our real world. However, performing realistic object-level editing
of the generated images in the multi-object scenario still remains a challenge.
Recently, a 2D GAN termed BlobGAN has demonstrated great multi-object editing
capabilities on real-world indoor scene datasets. In this work, we propose
BlobGAN-3D, which is a 3D-aware improvement of the original 2D BlobGAN. We
enable explicit camera pose control while maintaining the disentanglement for
individual objects in the scene by extending the 2D blobs into 3D blobs. We
keep the object-level editing capabilities of BlobGAN and in addition allow
flexible control over the 3D location of the objects in the scene. We test our
method on real-world indoor datasets and show that our method can achieve
comparable image quality compared to the 2D BlobGAN and other 3D-aware GAN
baselines while being able to enable camera pose control and object-level
editing in the challenging multi-object real-world scenarios.
","[{""version"":""v1"",""created"":""Sun, 26 Mar 2023 12:23:11 GMT""}]","2023-03-28"
"2303.14707","Xinhang Liu","Xinhang Liu, Yu-Wing Tai, Chi-Keung Tang","Clean-NeRF: Reformulating NeRF to account for View-Dependent
  Observations",,,,,"cs.CV","http://creativecommons.org/licenses/by-nc-nd/4.0/","  While Neural Radiance Fields (NeRFs) had achieved unprecedented novel view
synthesis results, they have been struggling in dealing with large-scale
cluttered scenes with sparse input views and highly view-dependent appearances.
Specifically, existing NeRF-based models tend to produce blurry rendering with
the volumetric reconstruction often inaccurate, where a lot of reconstruction
errors are observed in the form of foggy ""floaters"" hovering within the entire
volume of an opaque 3D scene. Such inaccuracies impede NeRF's potential for
accurate 3D NeRF registration, object detection, segmentation, etc., which
possibly accounts for only limited significant research effort so far to
directly address these important 3D fundamental computer vision problems to
date. This paper analyzes the NeRF's struggles in such settings and proposes
Clean-NeRF for accurate 3D reconstruction and novel view rendering in complex
scenes. Our key insights consist of enforcing effective appearance and geometry
constraints, which are absent in the conventional NeRF reconstruction, by 1)
automatically detecting and modeling view-dependent appearances in the training
views to prevent them from interfering with density estimation, which is
complete with 2) a geometric correction procedure performed on each traced ray
during inference. Clean-NeRF can be implemented as a plug-in that can
immediately benefit existing NeRF-based methods without additional input. Codes
will be released.
","[{""version"":""v1"",""created"":""Sun, 26 Mar 2023 12:24:31 GMT""}]","2023-03-28"
"2303.14708","Huiru Wang","Huiru Wang, Xiuhong Li, Zenyu Ren, Dan Yang, chunming Ma","Exploring Multimodal Sentiment Analysis via CBAM Attention and
  Double-layer BiLSTM Architecture",,,,,"cs.CV cs.MM","http://arxiv.org/licenses/nonexclusive-distrib/1.0/","  Because multimodal data contains more modal information, multimodal sentiment
analysis has become a recent research hotspot. However, redundant information
is easily involved in feature fusion after feature extraction, which has a
certain impact on the feature representation after fusion. Therefore, in this
papaer, we propose a new multimodal sentiment analysis model. In our model, we
use BERT + BiLSTM as new feature extractor to capture the long-distance
dependencies in sentences and consider the position information of input
sequences to obtain richer text features. To remove redundant information and
make the network pay more attention to the correlation between image and text
features, CNN and CBAM attention are added after splicing text features and
picture features, to improve the feature representation ability. On the
MVSA-single dataset and HFM dataset, compared with the baseline model, the ACC
of our model is improved by 1.78% and 1.91%, and the F1 value is enhanced by
3.09% and 2.0%, respectively. The experimental results show that our model
achieves a sound effect, similar to the advanced model.
","[{""version"":""v1"",""created"":""Sun, 26 Mar 2023 12:34:01 GMT""}]","2023-03-28"
"2303.14709","Jordanka Kovaceva","Jordanka Kovaceva, Nikolce Murgovski, Bal\'azs Kulcs\'ar, Henk
  Wymeersch, Jonas B\""argman","Critical Zones for Comfortable Collision Avoidance with a Leading
  Vehicle",,,,,"cs.RO cs.SY eess.SY","http://arxiv.org/licenses/nonexclusive-distrib/1.0/","  This paper provides a general framework for efficiently obtaining the
appropriate intervention time for collision avoidance systems to just avoid a
rear-end crash. The proposed framework incorporates a driver comfort model and
a vehicle model. We show that there is a relationship between driver steering
manoeuvres based on acceleration and jerk, and steering angle and steering
angle rate profiles. We investigate how four different vehicle models influence
the time when steering needs to be initiated to avoid a rear-end collision. The
models assessed were: a dynamic bicycle model (DM), a steady-state cornering
model (SSCM), a kinematic model (KM) and a point mass model (PMM). We show that
all models can be described by a parameter-varying linear system. We provide
three algorithms for steering that use a linear system to compute the
intervention time efficiently for all four vehicle models. Two of the
algorithms use backward reachability simulation and one uses forward
simulation. Results show that the SSCM, KM and PMM do not accurately estimate
the intervention time for a certain set of vehicle conditions. Due to its fast
computation time, DM with a backward reachability algorithm can be used for
rapid offline safety benefit assessment, while DM with a forward simulation
algorithm is better suited for online real-time usage.
","[{""version"":""v1"",""created"":""Sun, 26 Mar 2023 12:35:51 GMT""}]","2023-03-28"
"2303.14710","Martin P\'epin","Martin P\'epin and Alfredo Viola","Asymptotic analysis and efficient random sampling of directed ordered
  acyclic graphs","32 pages, 12 figures. For the implementation of the algorithms, see
  https://github.com/Kerl13/randdag",,,,"cs.DM math.CO","http://creativecommons.org/licenses/by-nc-nd/4.0/","  Directed acyclic graphs (DAGs) are directed graphs in which there is no path
from a vertex to itself. DAGs are an omnipresent data structure in computer
science and the problem of counting the DAGs of given number of vertices and to
sample them uniformly at random has been solved respectively in the 70's and
the 00's. In this paper, we propose to explore a new variation of this model
where DAGs are endowed with an independent ordering of the out-edges of each
vertex, thus allowing to model a wide range of existing data structures. We
provide efficient algorithms for sampling objects of this new class, both with
or without control on the number of edges, and obtain an asymptotic equivalent
of their number. We also show the applicability of our method by providing an
effective algorithm for the random generation of classical labelled DAGs with a
prescribed number of vertices and edges, based on a similar approach. This is
the first known algorithm for sampling labelled DAGs with full control on the
number of edges, and it meets a need in terms of applications, that had already
been acknowledged in the literature.
","[{""version"":""v1"",""created"":""Sun, 26 Mar 2023 12:39:56 GMT""}]","2023-03-28"
"2303.14711","Marcel Reimann","Marcel Reimann, Jungeun Won, Hiroyuki Takahashi, Antonio Yaghy,
  Yunchan Hwang, Stefan Ploner, Junhong Lin, Jessica Girgis, Kenneth Lam, Siyu
  Chen, Nadia K. Waheed, Andreas Maier, James G. Fujimoto","Unsupervised detection of small hyperreflective features in ultrahigh
  resolution optical coherence tomography","Accepted as poster at BVM workshop 2023
  (https://www.bvm-workshop.org/). The arXiv version provides full quality
  figures. 6 pages content (2 figures)",,,,"eess.IV cs.CV","http://creativecommons.org/licenses/by-nc-sa/4.0/","  Recent advances in optical coherence tomography such as the development of
high speed ultrahigh resolution scanners and corresponding signal processing
techniques may reveal new potential biomarkers in retinal diseases. Newly
visible features are, for example, small hyperreflective specks in age-related
macular degeneration. Identifying these new markers is crucial to investigate
potential association with disease progression and treatment outcomes.
Therefore, it is necessary to reliably detect these features in 3D volumetric
scans. Because manual labeling of entire volumes is infeasible a need for
automatic detection arises. Labeled datasets are often not publicly available
and there are usually large variations in scan protocols and scanner types.
Thus, this work focuses on an unsupervised approach that is based on local
peak-detection and random walker segmentation to detect small features on each
B-scan of the volume.
","[{""version"":""v1"",""created"":""Sun, 26 Mar 2023 12:45:42 GMT""}]","2023-03-28"
"2303.14712","Sivaprasad Kumar S","Surya Giri and S. Sivaprasad Kumar","Toeplitz determinants of Logarithmic coefficients for Starlike and
  Convex functions",,,,,"math.CV","http://arxiv.org/licenses/nonexclusive-distrib/1.0/","  In this study, we deal with the sharp bounds of certain Toeplitz determinants
whose entries are the logarithmic coefficients of analytic univalent functions
$f$ such that the quantity $z f'(z)/f(z)$ takes values in a specific domain
lying in the right half plane. The established results provide the bounds for
the classes of starlike and convex functions, as well as various of their
subclasses.
","[{""version"":""v1"",""created"":""Sun, 26 Mar 2023 12:45:52 GMT""}]","2023-03-28"
"2303.14713","Peng Liang","Aakash Ahmad, Muhammad Waseem, Peng Liang, Mahdi Fehmideh, Arif Ali
  Khan, David Georg Reichelt, Tommi Mikkonen","Engineering Software Systems for Quantum Computing as a Service: A
  Mapping Study",,,,,"cs.SE","http://creativecommons.org/licenses/by/4.0/","  Quantum systems have started to emerge as a disruptive technology and
enabling platforms - exploiting the principles of quantum mechanics - to
achieve quantum supremacy in computing. Academic research, industrial projects
(e.g., Amazon Braket), and consortiums like 'Quantum Flagship' are striving to
develop practically capable and commercially viable quantum computing (QC)
systems and technologies. Quantum Computing as a Service (QCaaS) is viewed as a
solution attuned to the philosophy of service-orientation that can offer QC
resources and platforms, as utility computing, to individuals and organisations
who do not own quantum computers. To understand the quantum service development
life cycle and pinpoint emerging trends, we used evidence-based software
engineering approach to conduct a systematic mapping study (SMS) of research
that enables or enhances QCaaS. The SMS process retrieved a total of 55
studies, and based on their qualitative assessment we selected 9 of them to
investigate (i) the functional aspects, design models, patterns, programming
languages, deployment platforms, and (ii) trends of emerging research on QCaaS.
The results indicate three modelling notations and a catalogue of five design
patterns to architect QCaaS, whereas Python (native code or frameworks) and
Amazon Braket are the predominant solutions to implement and deploy QCaaS
solutions. From the quantum software engineering (QSE) perspective, this SMS
provides empirically grounded findings that could help derive processes,
patterns, and reference architectures to engineer software services for QC.
","[{""version"":""v1"",""created"":""Sun, 26 Mar 2023 12:50:22 GMT""}]","2023-03-28"
"2303.14714","Jaan Parts","Aubrey D.N.J. de Grey, Jaan Parts","On lower bounds of the order of $k$-chromatic unit distance graphs",,"Geombinatorics 32/2 (2022) 72-74",,,"math.CO","http://creativecommons.org/licenses/by/4.0/","  Here we give refined numerical values for the minimum number of vertices of
$k$-chromatic unit distance graphs in the Euclidean plane.
","[{""version"":""v1"",""created"":""Sun, 26 Mar 2023 13:02:20 GMT""}]","2023-03-28"
"2303.14715","Manoj Kumar","Federico Corberi, Manoj Kumar, Eugenio Lippiello, Paolo Politi","Domain statistics in the relaxation of the one-dimensional Ising model
  with strong long-range interactions","10 pages",,,,"cond-mat.stat-mech","http://arxiv.org/licenses/nonexclusive-distrib/1.0/","  After a zero temperature quench, we study the kinetics of the one-dimensional
Ising model with long-range interactions between spins at distance $r$ decaying
as $r^{-\alpha}$, with $\alpha \le 1$. As shown in our recent study [SciPost
Phys 10, 109 (2021)] that only a fraction of the non-equilibrium trajectories
is characterized by the presence of coarsening domains while in the remaining
ones the system is quickly driven towards a magnetised state. Restricting to
realisations displaying coarsening we compute numerically the probability
distribution of the size of the domains and find that it exhibits a scaling
behaviour with an unusual $\alpha$-dependent power-law decay. This peculiar
behaviour is also related to the divergence of the average size of domains with
system size at finite times. Such a scenario differs from the one observed when
$\alpha>1$, where the distribution decays exponentially. Finally, based on
numerical results and on analytical calculations we argue that the average
domain size grows asymptotically linearly in time.
","[{""version"":""v1"",""created"":""Sun, 26 Mar 2023 13:02:27 GMT""}]","2023-03-28"
"2303.14716","Giovanni Montana","Alex Beeson and Giovanni Montana","Balancing policy constraint and ensemble size in uncertainty-based
  offline reinforcement learning",,,,,"cs.LG","http://arxiv.org/licenses/nonexclusive-distrib/1.0/","  Offline reinforcement learning agents seek optimal policies from fixed data
sets. With environmental interaction prohibited, agents face significant
challenges in preventing errors in value estimates from compounding and
subsequently causing the learning process to collapse. Uncertainty estimation
using ensembles compensates for this by penalising high-variance value
estimates, allowing agents to learn robust policies based on data-driven
actions. However, the requirement for large ensembles to facilitate sufficient
penalisation results in significant computational overhead. In this work, we
examine the role of policy constraints as a mechanism for regulating
uncertainty, and the corresponding balance between level of constraint and
ensemble size. By incorporating behavioural cloning into policy updates, we
show empirically that sufficient penalisation can be achieved with a much
smaller ensemble size, substantially reducing computational demand while
retaining state-of-the-art performance on benchmarking tasks. Furthermore, we
show how such an approach can facilitate stable online fine tuning, allowing
for continued policy improvement while avoiding severe performance drops.
","[{""version"":""v1"",""created"":""Sun, 26 Mar 2023 13:03:11 GMT""}]","2023-03-28"
"2303.14717","Jianhui Yu","Jianhui Yu, Hao Zhu, Liming Jiang, Chen Change Loy, Weidong Cai, Wayne
  Wu","CelebV-Text: A Large-Scale Facial Text-Video Dataset","Accepted by CVPR2023. Project Page: https://celebv-text.github.io/",,,,"cs.CV","http://arxiv.org/licenses/nonexclusive-distrib/1.0/","  Text-driven generation models are flourishing in video generation and
editing. However, face-centric text-to-video generation remains a challenge due
to the lack of a suitable dataset containing high-quality videos and highly
relevant texts. This paper presents CelebV-Text, a large-scale, diverse, and
high-quality dataset of facial text-video pairs, to facilitate research on
facial text-to-video generation tasks. CelebV-Text comprises 70,000 in-the-wild
face video clips with diverse visual content, each paired with 20 texts
generated using the proposed semi-automatic text generation strategy. The
provided texts are of high quality, describing both static and dynamic
attributes precisely. The superiority of CelebV-Text over other datasets is
demonstrated via comprehensive statistical analysis of the videos, texts, and
text-video relevance. The effectiveness and potential of CelebV-Text are
further shown through extensive self-evaluation. A benchmark is constructed
with representative methods to standardize the evaluation of the facial
text-to-video generation task. All data and models are publicly available.
","[{""version"":""v1"",""created"":""Sun, 26 Mar 2023 13:06:35 GMT""}]","2023-03-28"
"2303.14718","Kazuki Sugihara","Kazuki Sugihara, Moju Zhao, Takuzumi Nishio, Tasuku Makabe, Kei Okada,
  Masayuki Inaba","Design and Control of a Humanoid Equipped with Flight Unit and Wheels
  for Multimodal Locomotion","8 pages 17 figures",,,,"cs.RO","http://arxiv.org/licenses/nonexclusive-distrib/1.0/","  Humanoids are versatile robotic platforms because of their limbs with
multiple degrees of freedom. Although humanoids can walk like humans, the speed
is relatively slow, and they cannot run over large barriers. To address these
problems, we aim to achieve rapid terrestrial locomotion ability and
simultaneously expand the domain of locomotion to the air by utilizing thrust
for propulsion. In this paper, we first describe an optimized construction
method of a humanoid robot equipped with wheels and a flight unit to achieve
these abilities. Then, we describe the integrated control framework of the
proposed flying humanoid for each mode of locomotion: aerial locomotion, leg
locomotion, and wheel locomotion. Finally, we achieved multimodal locomotion
and aerial manipulation experiments using the robot platform proposed in this
work. To the best of our knowledge, it is the first time to achieve three
different types of locomotion, including flight, by a single humanoid.
","[{""version"":""v1"",""created"":""Sun, 26 Mar 2023 13:09:14 GMT""}]","2023-03-28"
"2303.14719","Victor Shirandami","Victor Shirandami","Dense Forests Constructed from Grids","18 pages",,,,"math.NT math.MG","http://creativecommons.org/licenses/by/4.0/","  A dense forest is a set $F \subset \mathbb{R}^n$ with the property that for
all $\varepsilon > 0$ there exists a number $V(\varepsilon) > 0$ such that all
line segments of length $V(\varepsilon)$ are $\varepsilon$-close to a point in
$F$. The function $V$ is called a visibility function of $F$. In this paper we
study dense forests constructed from finite unions of translated lattices
(grids). First, we provide a necessary and sufficient condition for a finite
union of grids to be a dense forest in terms of the irrationality properties of
the matrices defining them. This answers a question raised by Adiceam, Solomon,
and Weiss (2022). To complement this, we further show that such sets
generically admit effective visibility bounds in the following sense: for all
$\eta > 0$, there exists a $k \in \mathbb{N}$ such that almost all unions of
$k$ grids are dense forests admitting a visibility function $V(\varepsilon) \ll
\varepsilon^{-(n-1) -\eta}$. This is arbitrarily close to optimal in the sense
that if a finite union of grids admits a visibility function $V$, then this
function necessarily satisfies $V(\varepsilon) \gg \varepsilon^{-(n-1)}$. One
of the main novelties of this work is that the notion of `almost all' is
considered with respect to several underlying measures, which are defined
according to the Iwasawa decomposition of the matrices used to define the
grids. In this respect, the results obtained here vastly extend those of
Adiceam, Solomon, and Weiss (2022) who provided similar effective visibility
bounds for a particular family of generic unimodular lattices.
","[{""version"":""v1"",""created"":""Sun, 26 Mar 2023 13:11:49 GMT""}]","2023-03-28"
"2303.14720","Bashar I. Ahmad","Nermin Caber, Jiaming Liang, Bashar I. Ahmad, Simon Godsill, Alexandra
  Bremers, Philip Thomas, David Oxtoby and Lee Skrypchuk","Driver Profiling and Bayesian Workload Estimation Using Naturalistic
  Peripheral Detection Study Data",,,,,"eess.SP cs.LG cs.SY eess.SY","http://creativecommons.org/publicdomain/zero/1.0/","  Monitoring drivers' mental workload facilitates initiating and maintaining
safe interactions with in-vehicle information systems, and thus delivers
adaptive human machine interaction with reduced impact on the primary task of
driving. In this paper, we tackle the problem of workload estimation from
driving performance data. First, we present a novel on-road study for
collecting subjective workload data via a modified peripheral detection task in
naturalistic settings. Key environmental factors that induce a high mental
workload are identified via video analysis, e.g. junctions and behaviour of
vehicle in front. Second, a supervised learning framework using
state-of-the-art time series classifiers (e.g. convolutional neural network and
transform techniques) is introduced to profile drivers based on the average
workload they experience during a journey. A Bayesian filtering approach is
then proposed for sequentially estimating, in (near) real-time, the driver's
instantaneous workload. This computationally efficient and flexible method can
be easily personalised to a driver (e.g. incorporate their inferred average
workload profile), adapted to driving/environmental contexts (e.g. road type)
and extended with data streams from new sources. The efficacy of the presented
profiling and instantaneous workload estimation approaches are demonstrated
using the on-road study data, showing $F_{1}$ scores of up to 92% and 81%,
respectively.
","[{""version"":""v1"",""created"":""Sun, 26 Mar 2023 13:15:44 GMT""}]","2023-03-28"
"2303.14721","Claudius Heyer","Claudius Heyer","The Geometrical Lemma for Smooth Representations in Natural
  Characteristic","32 pages. Comments welcome!",,,,"math.RT math.NT","http://creativecommons.org/licenses/by/4.0/","  The Geometrical Lemma is a classical result in the theory of (complex) smooth
representations of $p$-adic reductive groups, which helps to analyze the
parabolic restriction of a parabolically induced representation by providing a
filtration whose graded pieces are (smaller) parabolic inductions of parabolic
restrictions. In this article, we establish the Geometrical Lemma for the
derived category of smooth mod $p$ representations of a $p$-adic reductive
group.
  As an important application we compute higher extension groups between
parabolically induced representations, which in a slightly different context
had been achieved by Hauseux assuming a conjecture of Emerton concerning the
higher ordinary parts functor. We also compute the (cohomology functors of the)
left adjoint of derived parabolic induction on principal series and generalized
Steinberg representations.
","[{""version"":""v1"",""created"":""Sun, 26 Mar 2023 13:18:04 GMT""}]","2023-03-28"
"2303.14722","Jaan Parts","Jaan Parts","More certainty in coloring the plane with a forbidden distance interval",,"Geombinatorics 32/4 (2023) 159-185",,,"math.CO","http://creativecommons.org/licenses/by/4.0/","  In the mysterious and colorful world of chromatic numbers, where there are a
lot of unknown, there is an amazing thing. It turns out that for some intervals
of forbidden distances on the plane, one can specify the exact value of the
chromatic number $\chi$. Two sets of such intervals have been found, for
$\chi=7$ and 9. We call them islands of certainty. Here we increase the size of
these islands, and add three new ones with $\chi=8$, 12, 13. We also %formulate
conjectures which predict conjecture islands for $\chi=14$, 15, 16. Are there
islands of certainty for $\chi$=10 or 11? This is still a mystery. Roll up for
the Mystery Tour.
","[{""version"":""v1"",""created"":""Sun, 26 Mar 2023 13:19:50 GMT""}]","2023-03-28"
