"2303.14572","Yinzhan Xu","Timothy M. Chan, Virginia Vassilevska Williams, Yinzhan Xu","Fredman's Trick Meets Dominance Product: Fine-Grained Complexity of
  Unweighted APSP, 3SUM Counting, and More","To appear at STOC'23",,,,"cs.DS","http://arxiv.org/licenses/nonexclusive-distrib/1.0/","  In this paper we carefully combine Fredman's trick [SICOMP'76] and
Matou\v{s}ek's approach for dominance product [IPL'91] to obtain powerful
results in fine-grained complexity:
  - Under the hypothesis that APSP for undirected graphs with edge weights in
$\{1, 2, \ldots, n\}$ requires $n^{3-o(1)}$ time (when $\omega=2$), we show a
variety of conditional lower bounds, including an $n^{7/3-o(1)}$ lower bound
for unweighted directed APSP and an $n^{2.2-o(1)}$ lower bound for computing
the Minimum Witness Product between two $n \times n$ Boolean matrices, even if
$\omega=2$, improving upon their trivial $n^2$ lower bounds. Our techniques can
also be used to reduce the unweighted directed APSP problem to other problems.
In particular, we show that (when $\omega = 2$), if unweighted directed APSP
requires $n^{2.5-o(1)}$ time, then Minimum Witness Product requires
$n^{7/3-o(1)}$ time.
  - We show that, surprisingly, many central problems in fine-grained
complexity are equivalent to their natural counting versions. In particular, we
show that Min-Plus Product and Exact Triangle are subcubically equivalent to
their counting versions, and 3SUM is subquadratically equivalent to its
counting version.
  - We obtain new algorithms using new variants of the Balog-Szemer\'edi-Gowers
theorem from additive combinatorics. For example, we get an $O(n^{3.83})$ time
deterministic algorithm for exactly counting the number of shortest paths in an
arbitrary weighted graph, improving the textbook $\widetilde{O}(n^{4})$ time
algorithm. We also get faster algorithms for 3SUM in preprocessed universes,
and deterministic algorithms for 3SUM on monotone sets in $\{1, 2, \ldots,
n\}^d$.
","[{""version"":""v1"",""created"":""Sat, 25 Mar 2023 21:54:03 GMT""}]","2023-03-28"
"2303.14573","Anees Peringal","Anees Peringal, Mohamad Chehadeh, Igor Boiko, Yahya Zweiri","Relay-based identification of Aerodynamic and Delay Sensor Dynamics with
  applications for Unmanned Aerial Vehicles","9 pages, 5 figures, This work has been submitted to the IEEE for
  possible publication. Copyright may be transferred without notice, after
  which this version may no longer be accessible",,,,"eess.SY cs.SY","http://creativecommons.org/licenses/by-nc-sa/4.0/","  In this paper, we present a real-time system identification method based on
relay feedback testing with applications to multirotor unmanned aerial
vehicles. The proposed identification method provides an alternative to the
expensive lab testing of certain UAV dynamic parameters. Moreover, it has the
advantage of identifying the parameters that get changed throughout the
operation of the UAV, which requires onboard identification methods. The
modified relay feedback test (MRFT) is used to generate stable limit cycles at
frequency points that reveal the underlying UAV dynamics. The locus of the
perturbed relay system (LPRS) is used to predict the exact amplitude and
frequency of these limit cycles. Real-time identification is achieved by using
the homogeneity properties of the MRFT and the LPRS which are proven in this
paper. The proposed identification method was tested experimentally to estimate
the aerodynamic parameters as well as the onboard sensor's time delay
parameters. The MRFT testing takes a few seconds to perform, and the
identification computations take an average of 0.2 seconds to complete in
modern embedded computers. The proposed identification method is compared
against state-of-the-art alternatives. Advantages in identification accuracy
and quantification of uncertainty in estimated parameters are shown.
","[{""version"":""v1"",""created"":""Sat, 25 Mar 2023 22:06:29 GMT""}]","2023-03-28"
"2303.14574","Jean-Philippe Nicolas","Jack Borthwick, Eric Gourgoulhon, Jean-Philippe Nicolas","Peeling at extreme black hole horizons","33 pages, 3 figures",,,,"gr-qc math-ph math.AP math.MP","http://creativecommons.org/licenses/by/4.0/","  The starting point of this work was an intriguing similarity between the
behaviour of fields near a degenerate horizon and near the infinity of an
asymptotically flat spacetime, as revealed by the scattering theory for Dirac
fields in the ``exterior'' region of the extreme Kerr - de Sitter black hole,
developed by one of the authors (JB). However, in that situation, the
comparison was somewhat clouded by some of the analytical techniques used in
intermediate steps of the proof. The aim of the present work is to clarify the
comparison further by studying instead the peeling behaviour of solutions to
the wave equation at an extremal horizon. We focus first on the extreme
Reissner-Nordstr\""om black hole, for which the Couch-Torrence inversion (a
global conformal isometry that exchanges the horizon and infinity) makes the
analogy explicit. Then, we explore more general spherically symmetric
situations using the Couch-Torrence inversion outside of its natural context.
","[{""version"":""v1"",""created"":""Sat, 25 Mar 2023 22:09:36 GMT""}]","2023-03-28"
"2303.14575","Santosh Lohakare","Santosh V Lohakare and Krishna Rathore and B. Mishra","Observational constrained F(R, G) gravity cosmological model and the
  dynamical system analysis","13 pages, 6 figures",,,,"gr-qc","http://arxiv.org/licenses/nonexclusive-distrib/1.0/","  The geometrical and dynamical parameters of the F(R, G) gravity cosmological
model are constrained through the cosmological data sets. The functional form
of F(R, G) involves the square Ricci scalar and the higher power of the
Gauss-Bonnet invariant. The observed value of the free parameters in the
expression of H(z), the Hubble parameter, indicates a different phase of the
evolution of the Universe. In all the data sets, the early deceleration and
late time acceleration behavior of the Universe has been observed. We develop a
set of dynamical equations for a given physical system and find the numerical
solutions, along with phase-space solutions, and the stability of individual
critical points. We also discuss the asymptotic behavior of the critical points
of the system.
","[{""version"":""v1"",""created"":""Sat, 25 Mar 2023 22:18:59 GMT""}]","2023-03-28"
"2303.14576","Cheng Zhang","Cheng Zhang","Automatic Generation of Multiple-Choice Questions","thesis",,,,"cs.CL","http://creativecommons.org/licenses/by/4.0/","  Creating multiple-choice questions to assess reading comprehension of a given
article involves generating question-answer pairs (QAPs) and adequate
distractors. We present two methods to tackle the challenge of QAP generations:
(1) A deep-learning-based end-to-end question generation system based on T5
Transformer with Preprocessing and Postprocessing Pipelines (TP3). We use the
finetuned T5 model for our downstream task of question generation and improve
accuracy using a combination of various NLP tools and algorithms in
preprocessing and postprocessing to select appropriate answers and filter
undesirable questions. (2) A sequence-learning-based scheme to generate
adequate QAPs via meta-sequence representations of sentences. A meta-sequence
is a sequence of vectors comprising semantic and syntactic tags. we devise a
scheme called MetaQA to learn meta sequences from training data to form pairs
of a meta sequence for a declarative sentence and a corresponding interrogative
sentence. The TP3 works well on unseen data, which is complemented by MetaQA.
Both methods can generate well-formed and grammatically correct questions.
Moreover, we present a novel approach to automatically generate adequate
distractors for a given QAP. The method is a combination of part-of-speech
tagging, named-entity tagging, semantic-role labeling, regular expressions,
domain knowledge bases, word embeddings, word edit distance, WordNet, and other
algorithms.
","[{""version"":""v1"",""created"":""Sat, 25 Mar 2023 22:45:54 GMT""}]","2023-03-28"
"2303.14577","Jan Hubi\v{c}ka","Tristan Bice, No\'e de Rancourt, Jan Hubi\v{c}ka, Mat\v{e}j
  Kone\v{c}n\'y","Big Ramsey degrees in the metric setting","6 pages; extended abstract",,,,"math.FA cs.DM math.CO math.LO","http://arxiv.org/licenses/nonexclusive-distrib/1.0/","  Oscillation stability is an important concept in Banach space theory which
happens to be closely connected to discrete Ramsey theory. For example, Gowers
proved oscillation stability for the Banach space $c_0$ using his now famous
Ramsey theorem for $\mathrm{FIN}_k$ as the key ingredient. We develop the
theory behind this connection and introduce the notion of compact big Ramsey
degrees, extending the theory of (discrete) big Ramsey degrees. We then prove
existence of compact big Ramsey degrees for the Banach space $\ell_\infty$ and
the Urysohn sphere, with an explicit characterization in the case of
$\ell_\infty$.
","[{""version"":""v1"",""created"":""Sat, 25 Mar 2023 22:47:16 GMT""}]","2023-03-28"
"2303.14578","Godwin Osabutey","Pierluigi Contucci, Emanuele Mingione, Godwin Osabutey","Limit theorems for the cubic mean-field Ising model",,,,,"math-ph math.MP","http://arxiv.org/licenses/nonexclusive-distrib/1.0/","  We study a mean-field spin model with three- and two-body interactions. The
equilibrium measure for large volumes is shown to have three pure states, the
phases of the model. They include the two with opposite magnetization and an
unpolarized one with zero magnetization, merging at the critical point. We
prove that the central limit theorem holds for a suitably rescaled
magnetization, while its violation with the typical quartic behavior appears at
the critical point.
","[{""version"":""v1"",""created"":""Sat, 25 Mar 2023 22:47:37 GMT""}]","2023-03-28"
"2303.14579","Thomas Finn Lidbetter","Thomas F. Lidbetter","Improved Bound for the Gerver-Ramsey Collinearity Problem","22 pages, 4 figures",,,,"math.CO cs.FL","http://arxiv.org/licenses/nonexclusive-distrib/1.0/","  Let $S$ be a finite subset of $\mathbb{Z}^n$. A vector sequence
$(\mathbf{z}_i)$ is an $S$-walk if and only if $\mathbf{z}_{i+1} -
\mathbf{z}_i$ is an element of $S$ for all $i$. Gerver and Ramsey showed in
1979 that for $S\subset \mathbb{Z}^3$ there exists an infinite $S$-walk in
which no $5^{11} + 1=48{\small,}828{\small,}126$ points are collinear. Here, we
use the same general approach, but with the aid of a computer search, to
improve the bound to $189$.
","[{""version"":""v1"",""created"":""Sat, 25 Mar 2023 23:00:04 GMT""},{""version"":""v2"",""created"":""Fri, 7 Apr 2023 22:32:55 GMT""}]","2023-04-11"
"2303.14580","Yidong Chen","Yidong Chen and Marius Junge","Noncommutative Poisson Random Measure and Its Applications",,,,,"math.OA hep-th math-ph math.MP math.PR math.QA","http://creativecommons.org/licenses/by/4.0/","  We introduce a noncommutative Poisson random measure on a von Neumann
algebra. This is a noncommutative generalization of the classical Poisson
random measure. We call this construction Poissonization. Poissonization is a
functor from the category of von Neumann algebras with normal semifinite
faithful weights to the category of von Neumann algebras with normal faithful
states. Poissonization is a natural adaptation of the second quantization to
the context of von Neumann algebras. The construction is compatible with normal
(weight-preserving) homomorphisms and unital normal completely positive
(weight-preserving) maps. We present two main applications of Poissonization.
First Poissonization provides a new framework to construct algebraic quantum
field theories that are not generalized free field theories. Second
Poissonization permits straight-forward calculations of quantum relative
entropies (and other quantum information quantities) in the case of type III
von Neumann algebras.
","[{""version"":""v1"",""created"":""Sat, 25 Mar 2023 23:06:21 GMT""}]","2023-03-28"
"2303.14581","Joseph Cohen","Joseph Cohen, Xun Huan, Jun Ni","Shapley-based Explainable AI for Clustering Applications in Fault
  Diagnosis and Prognosis","23 pages with 8 figures",,,,"cs.LG cs.SY eess.SP eess.SY","http://creativecommons.org/licenses/by/4.0/","  Data-driven artificial intelligence models require explainability in
intelligent manufacturing to streamline adoption and trust in modern industry.
However, recently developed explainable artificial intelligence (XAI)
techniques that estimate feature contributions on a model-agnostic level such
as SHapley Additive exPlanations (SHAP) have not yet been evaluated for
semi-supervised fault diagnosis and prognosis problems characterized by class
imbalance and weakly labeled datasets. This paper explores the potential of
utilizing Shapley values for a new clustering framework compatible with
semi-supervised learning problems, loosening the strict supervision requirement
of current XAI techniques. This broad methodology is validated on two case
studies: a heatmap image dataset obtained from a semiconductor manufacturing
process featuring class imbalance, and a benchmark dataset utilized in the 2021
Prognostics and Health Management (PHM) Data Challenge. Semi-supervised
clustering based on Shapley values significantly improves upon clustering
quality compared to the fully unsupervised case, deriving information-dense and
meaningful clusters that relate to underlying fault diagnosis model
predictions. These clusters can also be characterized by high-precision
decision rules in terms of original feature values, as demonstrated in the
second case study. The rules, limited to 1-2 terms utilizing original feature
scales, describe 12 out of the 16 derived equipment failure clusters with
precision exceeding 0.85, showcasing the promising utility of the explainable
clustering framework for intelligent manufacturing applications.
","[{""version"":""v1"",""created"":""Sat, 25 Mar 2023 23:13:11 GMT""}]","2023-03-28"
"2303.14582","Hongyang Zhang","Dongyue Li, Huy L. Nguyen, and Hongyang R. Zhang","Identification of Negative Transfers in Multitask Learning Using
  Surrogate Models","30 pages, 7 figures, 7 tables. Published in Transactions on Machine
  Learning Research, March 2023",,,,"cs.LG cs.AI cs.CL stat.ML","http://creativecommons.org/licenses/by/4.0/","  Multitask learning is widely used in practice to train a low-resource target
task by augmenting it with multiple related source tasks. Yet, naively
combining all the source tasks with a target task does not always improve the
prediction performance for the target task due to negative transfers. Thus, a
critical problem in multitask learning is identifying subsets of source tasks
that would benefit the target task. This problem is computationally challenging
since the number of subsets grows exponentially with the number of source
tasks; efficient heuristics for subset selection does not always capture the
relationship between task subsets and multitask learning performances. In this
paper, we introduce an efficient procedure to address this problem via
surrogate modeling. In surrogate modeling, we sample (random) subsets of source
tasks and precompute their multitask learning performances; Then, we
approximate the precomputed performances with a linear regression model that
can also be used to predict the multitask performance of unseen task subsets.
We show theoretically and empirically that fitting this model only requires
sampling linearly many subsets in the number of source tasks. The fitted model
provides a relevance score between each source task and the target task; We use
the relevance scores to perform subset selection for multitask learning by
thresholding. Through extensive experiments, we show that our approach predicts
negative transfers from multiple source tasks to target tasks much more
accurately than existing task affinity measures. Additionally, we demonstrate
that for five weak supervision datasets, our approach consistently improves
upon existing optimization methods for multi-task learning.
","[{""version"":""v1"",""created"":""Sat, 25 Mar 2023 23:16:11 GMT""}]","2023-03-28"
"2303.14583","Lingyun Ding","Lingyun Ding","Shear dispersion of multispecies electrolyte solutions in the channel
  domain",,,,,"physics.flu-dyn math.AP physics.chem-ph","http://arxiv.org/licenses/nonexclusive-distrib/1.0/","  In multispecies electrolyte solutions, even in the absence of an external
electric field, differences in ion diffusivities induce an electric potential
and generate additional fluxes for each species. This electro-diffusion process
is well-described by the advection-Nernst-Planck equation. This study aims to
analyze the long-time behavior of the governing equation under the
electroneutrality and zero current conditions and investigate how the
diffusion-induced electric potential and the shear flow enhance the effective
diffusion coefficients of each species in channel domains. To achieve this
goal, the homogenization method was used to derive a reduced model of the
advection-Nernst-Planck equation in the channel domain. There are several
interesting properties of the effective equation. First, it is a generalization
of the Taylor dispersion, with a nonlinear diffusion tensor replacing the
scalar diffusion coefficient. Second, the effective equation reveals that the
system without the flow is asymptotically equivalent to the system with a
strong flow and scaled physical parameters. Furthermore, when the background
concentration is much greater than the perturbed concentration, the effective
equation reduces to a multidimensional diffusion equation, consistent with the
classical Taylor dispersion theory. However, for zero background concentration,
the ion-electric interaction results in several phenomena don't present in the
advection-diffusion equation, including upstream migration of some species,
spontaneous separation of ions, and non-monotonic dependence of the effective
diffusivity on P\'eclet numbers. Last, the dependence of effective diffusivity
on concentration and ion diffusivity suggests a method to infer the
concentration ratio of each component and ion diffusivity by measuring the
effective diffusivity.
","[{""version"":""v1"",""created"":""Sat, 25 Mar 2023 23:20:06 GMT""}]","2023-03-28"
"2303.14584","Phani Krishna Uppala","Phani Krishna Uppala, Abhishek Bamotra, Shriti Priya, Vaidehi Joshi","Learning video embedding space with Natural Language Supervision",,,,,"cs.CV","http://creativecommons.org/licenses/by/4.0/","  The recent success of the CLIP model has shown its potential to be applied to
a wide range of vision and language tasks. However this only establishes
embedding space relationship of language to images, not to the video domain. In
this paper, we propose a novel approach to map video embedding space to natural
langugage. We propose a two-stage approach that first extracts visual features
from each frame of a video using a pre-trained CNN, and then uses the CLIP
model to encode the visual features for the video domain, along with the
corresponding text descriptions. We evaluate our method on two benchmark
datasets, UCF101 and HMDB51, and achieve state-of-the-art performance on both
tasks.
","[{""version"":""v1"",""created"":""Sat, 25 Mar 2023 23:24:57 GMT""},{""version"":""v2"",""created"":""Sat, 8 Apr 2023 02:44:20 GMT""}]","2023-04-11"
"2303.14585","Yizhi Wang","Yuqing Wang, Yizhi Wang, Longhui Yu, Yuesheng Zhu, Zhouhui Lian","DeepVecFont-v2: Exploiting Transformers to Synthesize Vector Fonts with
  Higher Quality","Accepted by CVPR 2023. Code:
  https://github.com/yizhiwang96/deepvecfont-v2",,,,"cs.CV cs.GR","http://arxiv.org/licenses/nonexclusive-distrib/1.0/","  Vector font synthesis is a challenging and ongoing problem in the fields of
Computer Vision and Computer Graphics. The recently-proposed DeepVecFont
achieved state-of-the-art performance by exploiting information of both the
image and sequence modalities of vector fonts. However, it has limited
capability for handling long sequence data and heavily relies on an
image-guided outline refinement post-processing. Thus, vector glyphs
synthesized by DeepVecFont still often contain some distortions and artifacts
and cannot rival human-designed results. To address the above problems, this
paper proposes an enhanced version of DeepVecFont mainly by making the
following three novel technical contributions. First, we adopt Transformers
instead of RNNs to process sequential data and design a relaxation
representation for vector outlines, markedly improving the model's capability
and stability of synthesizing long and complex outlines. Second, we propose to
sample auxiliary points in addition to control points to precisely align the
generated and target B\'ezier curves or lines. Finally, to alleviate error
accumulation in the sequential generation process, we develop a context-based
self-refinement module based on another Transformer-based decoder to remove
artifacts in the initially synthesized glyphs. Both qualitative and
quantitative results demonstrate that the proposed method effectively resolves
those intrinsic problems of the original DeepVecFont and outperforms existing
approaches in generating English and Chinese vector fonts with complicated
structures and diverse styles.
","[{""version"":""v1"",""created"":""Sat, 25 Mar 2023 23:28:19 GMT""}]","2023-03-28"
"2303.14586","Feng Long","Feng Long, Bin B. Ren, Nicole L. Wallack, Daniel Harsono, Gregory J.
  Herczeg, Paola Pinilla, Dimitri Mawet, Michael C. Liu, Sean M. Andrews,
  Xue-Ning Bai, Sylvie Cabrit, Lucas A. Cieza, Doug Johnstone, Jarron M.
  Leisenring, Giuseppe Lodato, Yao Liu, Carlo F. Manara, Gijs D. Mulders,
  Enrico Ragusa, Steph Sallum, Yangfan Shi, Marco Tazzari, Taichi Uyama, Kevin
  Wagner, David J. Wilner, Jerry W. Xuan","A Large Double-ring Disk around the Taurus M Dwarf J04124068+2438157","15 pages, 5 figures. Accepted for publication in ApJ",,"10.3847/1538-4357/acc843",,"astro-ph.EP","http://arxiv.org/licenses/nonexclusive-distrib/1.0/","  Planet formation imprints signatures on the physical structures of disks. In
this paper, we present high-resolution ($\sim$50 mas, 8 au) Atacama Large
Millimeter/submillimeter Array (ALMA) observations of 1.3 mm dust continuum and
CO line emission toward the disk around the M3.5 star 2MASS J04124068+2438157.
The dust disk consists only of two narrow rings at radial distances of 0.47 and
0.78 arcsec ($\sim$70 and 116 au), with Gaussian $\sigma$ widths of 5.6 and 8.5
au, respectively. The width of the outer ring is smaller than the estimated
pressure scale height by $\sim25\%$, suggesting dust trapping in a radial
pressure bump. The dust disk size, set by the location of the outermost ring,
is significantly larger (by $3\sigma$) than other disks with similar millimeter
luminosity, which can be explained by an early formation of local pressure bump
to stop radial drift of millimeter dust grains. After considering the disk's
physical structure and accretion properties, we prefer planet--disk interaction
over dead zone or photoevaporation models to explain the observed dust disk
morphology. We carry out high-contrast imaging at $L'$ band using Keck/NIRC2 to
search for potential young planets, but do not identify any source above
$5\sigma$. Within the dust gap between the two rings, we reach a contrast level
of $\sim$7 mag, constraining the possible planet below $\sim$2--4 $M_{\rm
Jup}$. Analyses of the gap/ring properties suggest a $\sim$Saturn mass planet
at $\sim$90 au is likely responsible for the formation of the outer ring, which
can be potentially revealed with JWST.
","[{""version"":""v1"",""created"":""Sat, 25 Mar 2023 23:31:24 GMT""}]","2023-05-31"
"2303.14587","Shuhong Chen","Shuhong Chen, Kevin Zhang, Yichun Shi, Heng Wang, Yiheng Zhu, Guoxian
  Song, Sizhe An, Janus Kristjansson, Xiao Yang, Matthias Zwicker","PAniC-3D: Stylized Single-view 3D Reconstruction from Portraits of Anime
  Characters","CVPR 2023, code release:
  https://github.com/ShuhongChen/panic3d-anime-reconstruction",,,,"cs.CV","http://creativecommons.org/licenses/by/4.0/","  We propose PAniC-3D, a system to reconstruct stylized 3D character heads
directly from illustrated (p)ortraits of (ani)me (c)haracters. Our anime-style
domain poses unique challenges to single-view reconstruction; compared to
natural images of human heads, character portrait illustrations have hair and
accessories with more complex and diverse geometry, and are shaded with
non-photorealistic contour lines. In addition, there is a lack of both 3D model
and portrait illustration data suitable to train and evaluate this ambiguous
stylized reconstruction task. Facing these challenges, our proposed PAniC-3D
architecture crosses the illustration-to-3D domain gap with a line-filling
model, and represents sophisticated geometries with a volumetric radiance
field. We train our system with two large new datasets (11.2k Vroid 3D models,
1k Vtuber portrait illustrations), and evaluate on a novel AnimeRecon benchmark
of illustration-to-3D pairs. PAniC-3D significantly outperforms baseline
methods, and provides data to establish the task of stylized reconstruction
from portrait illustrations.
","[{""version"":""v1"",""created"":""Sat, 25 Mar 2023 23:36:17 GMT""}]","2023-03-28"
