"2305.00897","Masaki Sakuma","Masaki Sakuma","Ground states for p-fractional Choquard-type equations with critical
  local nonlinearity and doubly critical nonlocality","14 pages",,,,"math.AP","http://arxiv.org/licenses/nonexclusive-distrib/1.0/","  We consider a $p$-fractional Choquard-type equation \[ (-\Delta)_p^s
u+a|u|^{p-2}u=b(K\ast F(u))F'(u)+\varepsilon_g |u|^{p_g-2}u \quad\text{in
$\mathbb{R}^N$}, \] where $0<s<1<p<N/s$, $p<p_g\leq p_s^*$,
$(a,b,\varepsilon_g)\in (0,\infty)^3$, $K(x)= |x|^{-(N-\alpha)}$, $\alpha\in
(0,N)$, and $F$ is a doubly critical nonlinearity in the sense of the
Hardy-Littlewood-Sobolev inequality. It is noteworthy that the local
nonlinearity may also have critical growth. Combining Brezis-Nirenberg's method
with some new ideas, we obtain the ground state solutions via the mountain pass
lemma and a generalized Lions-type theorem.
","[{""version"":""v1"",""created"":""Mon, 1 May 2023 16:00:03 GMT""}]","2023-05-02"
"2305.00898","Bhagwati Duggal Prashad","B.P. Duggal","On strict isometric and strict symmetric commuting $d$-tuples of Banach
  space operators","None",,,,"math.FA","http://creativecommons.org/licenses/by/4.0/","  Given commuting $d$-tuples $\mathbb{S}_i$ and $\mathbb{T}_i$, $1\leq i\leq
2$, Banach space operators such that the tensor products pair
$(\mathbb{S}_1\otimes\mathbb{S}_2,\mathbb{T}_1\otimes\mathbb{T}_2)$ is strict
$m$-isometric (resp., $\mathbb{S}_1$, $\mathbb{S}_2$ are invertible and
$(\mathbb{S}_1 \otimes \mathbb{S}_2, \mathbb{T}_1 \otimes\mathbb{T}_2)$ is
strict $m$-symmetric), there exist integers $m_i >0$, and a non-zero scalar
$c$, such that $m=m_1+m_2-1$, $(\mathbb{S}_1, {\frac{1}{c}}\mathbb{T}_1)$ is
strict $m_1$-isometric and $(\mathbb{S}_2, c\mathbb{T}_2)$ is strict
$m_2$-isometric (resp., there exist integers $m_i >0$, and a non-zero scalar
$c$, such that $m=m_1+m_2-1$, $(\mathbb{S}_1,{\frac{1}{c}}\mathbb{T}_1)$ is
strict $m_1$-symmetric and $(\mathbb{S}_2, c\mathbb{T}_2)$ is strict
$m_2$-symmetric. However, $(\mathbb{S}_i,\mathbb{T}_i)$ is strict
$m_i$-isometric (resp., strict $m_i$-symmetric) for $1\leq i\leq 2$ implies
only that $(\mathbb{S}_1\otimes \mathbb{S}_2, \mathbb{T}_1\otimes
\mathbb{T}_2)$ is $m$-isometric (resp., $(\mathbb{S}_1 \otimes \mathbb{S}_2,
\mathbb{T}_1\otimes\mathbb{T}_2)$ is $m$-symmetric).
","[{""version"":""v1"",""created"":""Mon, 1 May 2023 16:02:26 GMT""},{""version"":""v2"",""created"":""Wed, 3 May 2023 09:07:02 GMT""}]","2023-05-04"
"2305.00899","Alban Sauret","Deok-Hoon Jeong, Langqi Xing, Michael Ka Ho Lee, Nathan Vani, Alban
  Sauret","Deposition and alignment of fiber suspensions by dip coating",,,,,"cond-mat.soft physics.flu-dyn","http://arxiv.org/licenses/nonexclusive-distrib/1.0/","  The dip coating of suspensions made of monodisperse non-Brownian spherical
particles dispersed in a Newtonian fluid leads to different coating regimes
depending on the ratio of the particle diameter to the thickness of the film
entrained on the substrate. In particular, dilute particles dispersed in the
liquid are entrained only above a threshold value of film thickness. In the
case of anisotropic particles, in particular fibers, the smallest
characteristic dimension will control the entrainment of the particle.
Furthermore, it is possible to control the orientation of the anisotropic
particles depending on the substrate geometry. To test the hypotheses, we
performed dip-coating experiments with dilute suspensions of non-Brownian
fibers with different length-to-diameter aspect ratios. We characterize the
number of fibers entrained on the surface of the substrate as a function of the
withdrawal velocity, allowing us to estimate a threshold capillary number below
which all the particles remain in the liquid bath. Besides, we measure the
angular distribution of the entrained fibers for two different substrate
geometries: flat plates and cylindrical rods. We then measure the film
thickness for more concentrated fiber suspensions. The entrainment of the
fibers on a flat plate and a cylindrical rod is primarily controlled by the
smaller characteristic length of the fibers: their diameter. At first order,
the entrainment threshold scales similarly to that of spherical particles. The
length of the fibers only appears to have a minor influence on the entrainment
threshold. No preferential alignment is observed for non-Brownian fibers on a
flat plate, except for very thin films, whereas the fibers tend to align
themselves along the axis of a cylindrical rod for a large enough ratio of the
fiber length to the radius of the cylindrical rod.
","[{""version"":""v1"",""created"":""Mon, 1 May 2023 16:03:31 GMT""}]","2023-05-02"
"2305.00903","Evgueni Dinvay","Evgueni Dinvay and Sigmund Selberg","A conservative stochastic Dirac-Klein-Gordon system",,,,,"math.AP","http://creativecommons.org/publicdomain/zero/1.0/","  Considered herein is a particular nonlinear dispersive stochastic system
consisting of Dirac and Klein-Gordon equations. They are coupled by nonlinear
terms due to the Yukawa interaction. We consider a case of homogeneous
multiplicative noise that seems to be very natural from the perspective of the
least action formalism. We are able to show existence and uniqueness of a
corresponding Cauchy problem in Bourgain spaces. Moreover, the regarded model
implies charge conservation, known for the deterministic analogue of the
system, and this is used to prove a global existence result for suitable
initial data.
","[{""version"":""v1"",""created"":""Mon, 1 May 2023 16:06:37 GMT""}]","2023-05-02"
"2305.00914","Amelia Stokolosa","Amelia Stokolosa","Inverses of Product Kernels and Flag Kernels on Graded Lie Groups","20 pages",,,,"math.CA","http://arxiv.org/licenses/nonexclusive-distrib/1.0/","  Let $T(f) = f * K$, where $K$ is a product kernel or a flag kernel on a
graded Lie group $G$. Suppose $T$ is invertible on $L^2(G)$. We prove that its
inverse is given by $T^{-1}(g) = g*L$, where $L$ is a product kernel or a flag
kernel accordingly.
","[{""version"":""v1"",""created"":""Mon, 1 May 2023 16:11:37 GMT""},{""version"":""v2"",""created"":""Thu, 4 May 2023 19:46:00 GMT""}]","2023-05-08"
"2305.00916","Joel Karlsson","Joel Karlsson, Bengt E. W. Nilsson","The complete Kaluza-Klein spectra of $\mathcal{N} = 1$ and $\mathcal{N}
  = 0$ M-theory on $AdS_4 \times (\text{squashed } S^7)$","87 pages, 8 figures, 20 tables",,,,"hep-th","http://creativecommons.org/licenses/by/4.0/","  The squashed seven-sphere operator spectrum is completed by deriving the
spectrum of the spin-3/2 operator. The implications of the results for the
$AdS_4$ $\mathcal{N} = 1$ supermultiplets obtained from compactification of
eleven-dimensional supergravity are analysed. The weak $G_2$ holonomy plays an
important role when solving the eigenvalue equations on the squashed sphere.
Here, a novel and more universal algebraic approach to the whole eigenvalue
problem on coset manifolds is provided. Having obtained full control of all the
operator spectra, we can finally determine the irreps $D(E_0, s)$ for all
supermultiplets in the left-squashed vacuum. This includes an analysis of
possible boundary conditions. By performing an orientation flip on the
seven-sphere, we also obtain the full spectrum for the non-supersymmetric
right-squashed compactification which is of interest in the swampland context
and in particular for the $AdS$ swampland conjecture. Here, a number of
boundary condition ambiguities arise making the analysis of dual marginal
operators somewhat involved. This work is a direct continuation of [1] and [2].
","[{""version"":""v1"",""created"":""Mon, 1 May 2023 16:12:01 GMT""}]","2023-05-02"
"2305.00921","Nathanael Gill","Nathanael Gill, Christopher Fontes, Charles Starrett","The STAG Code: A Fully Relativistic Super Transition Array Calculation
  Using Green's Functions",,,,,"physics.plasm-ph physics.atom-ph","http://arxiv.org/licenses/nonexclusive-distrib/1.0/","  Calculating opacities for a wide range of plasma conditions (i.e.
temperature, density, element) requires detailed knowledge of the plasma
configuration space and electronic structure. For plasmas composed of heavier
elements, relativistic effects are important in both the electronic structure
and the details of opacity spectra. We extend our previously described
superconfiguration and super transition array capabilities [N. M. Gill et al.,
JPB, 56, 015001 (2023)] to include a fully relativistic formalism. The use of
hybrid bound-continuum supershells in our superconfigurations demonstrates the
importance of a consistent treatment of bound and continuum electrons in dense
plasma opacities, and we expand the discussion of these consequences to include
issues associated with equation of state and electron correlations between
bound and continuum electrons.
","[{""version"":""v1"",""created"":""Mon, 1 May 2023 16:15:51 GMT""}]","2023-05-02"
"2305.00922","Rathee Nishant","Nishant Rathee, Mahender Singh","Relative Rota-Baxter groups and skew left braces","Comments and Suggestions are welcome",,,,"math.QA math.GR math.RA","http://creativecommons.org/licenses/by/4.0/","  Relative Rota-Baxter groups are generalisations of Rota-Baxter groups and
introduced recently in the context of Lie groups. In this paper, we explore
connections of relative Rota-Baxter groups with skew left braces, which are
well-known to give non-degenerate set-theoretic solutions of the Yang-Baxter
equation. We prove that every relative Rota-Baxter group gives rise to a skew
left brace, and conversely, every skew left brace arises from a relative
Rota-Baxter group. It turns out that there is an isomorphism between the two
categories under some mild restrictions. We propose an efficient GAP algorithm,
which would enable the computation of relative Rota-Baxter operators on finite
groups. In the end, we introduce the notion of isoclinism of relative
Rota-Baxter groups and prove that an isoclinism of these objects induces an
isoclinism of corresponding skew left braces.
","[{""version"":""v1"",""created"":""Mon, 1 May 2023 16:17:20 GMT""}]","2023-05-02"
"2305.00923","Ananya Sadana","Arunima Jaiswal, Ananya Sadana","Early Detection of Alzheimer's Disease using Bottleneck Transformers",,"Arunima Jaiswal & Ananya Sadana, 2022. ""Early Detection of
  Alzheimer's Disease Using Bottleneck Transformers,"" International Journal of
  Intelligent Information Technologies (IJIIT), IGI Global, vol. 18(2), pages
  1-14, April","10.4018/IJIIT.296268",,"eess.IV cs.CV","http://creativecommons.org/licenses/by/4.0/","  Early detection of Alzheimer's Disease (AD) and its prodromal state, Mild
Cognitive Impairment (MCI), is crucial for providing suitable treatment and
preventing the disease from progressing. It can also aid researchers and
clinicians to identify early biomarkers and minister new treatments that have
been a subject of extensive research. The application of deep learning
techniques on structural Magnetic Resonance Imaging (MRI) has shown promising
results in diagnosing the disease. In this research, we intend to introduce a
novel approach of using an ensemble of the self-attention-based Bottleneck
Transformers with a sharpness aware minimizer for early detection of
Alzheimer's Disease. The proposed approach has been tested on the widely
accepted ADNI dataset and evaluated using accuracy, precision, recall, F1
score, and ROC-AUC score as the performance metrics.
","[{""version"":""v1"",""created"":""Mon, 1 May 2023 16:17:52 GMT""}]","2023-05-02"
"2305.00924","Rebecca Centeno","Rebecca Centeno, Ivan Mili\'c, Matthias Rempel, Nariaki V. Nitta,
  Xudong Sun","Limitations and biases in the retrieval of the polar magnetic field I:
  the role of the magnetic filling factor in Milne-Eddington inversions of
  simulated Hinode/SP data","Accepted for publication in ApJ",,,,"astro-ph.SR","http://creativecommons.org/licenses/by/4.0/","  We study the extent to which Milne-Eddington inversions are able to retrieve
and characterize the magnetic landscape of the solar poles from observations by
the spectropolarimeter onboard Hinode. In particular, we evaluate whether a
variable magnetic filling factor is an adequate modeling technique for
retrieving the intrinsic magnetic properties from every pixel in the polar
field of view. We first generate synthetic spectra emerging from a numerical
simulation of a ""plage"" region at an inclined line of sight of 65$^{\circ}$,
and degrade the data to emulate real observations. Then, we invert the
synthetic spectra with two Milne-Eddington inversion codes that feature
different treatments of the magnetic filling factor, and relate the retrieved
magnetic quantities back to their original values in the simulation cube. We
find that while the apparent retrieved magnetic properties map well the
spatially-degraded simulation, the intrinsic magnetic quantities bear little
relation to the magnetic field at the native resolution of the simulation. We
discuss the systematic biases caused by line-of-sight foreshortening, spatial
degradation, photon noise and modeling assumptions embedded in the inversion
algorithm.
","[{""version"":""v1"",""created"":""Mon, 1 May 2023 16:18:33 GMT""}]","2023-05-02"
"2305.00925","Joseph Bao","Joseph Bao, Murat Kantarcioglu, Yevgeniy Vorobeychik, Charles Kamhoua","IoTFlowGenerator: Crafting Synthetic IoT Device Traffic Flows for Cyber
  Deception","FLAIRS-36",,,,"cs.CR cs.LG","http://creativecommons.org/licenses/by/4.0/","  Over the years, honeypots emerged as an important security tool to understand
attacker intent and deceive attackers to spend time and resources. Recently,
honeypots are being deployed for Internet of things (IoT) devices to lure
attackers, and learn their behavior. However, most of the existing IoT
honeypots, even the high interaction ones, are easily detected by an attacker
who can observe honeypot traffic due to lack of real network traffic
originating from the honeypot. This implies that, to build better honeypots and
enhance cyber deception capabilities, IoT honeypots need to generate realistic
network traffic flows. To achieve this goal, we propose a novel deep learning
based approach for generating traffic flows that mimic real network traffic due
to user and IoT device interactions. A key technical challenge that our
approach overcomes is scarcity of device-specific IoT traffic data to
effectively train a generator. We address this challenge by leveraging a core
generative adversarial learning algorithm for sequences along with domain
specific knowledge common to IoT devices. Through an extensive experimental
evaluation with 18 IoT devices, we demonstrate that the proposed synthetic IoT
traffic generation tool significantly outperforms state of the art sequence and
packet generators in remaining indistinguishable from real traffic even to an
adaptive attacker.
","[{""version"":""v1"",""created"":""Mon, 1 May 2023 16:24:07 GMT""}]","2023-05-02"
"2305.00926","Siddhant Arora","Siddhant Arora, Hayato Futami, Emiru Tsunoo, Brian Yan, Shinji
  Watanabe","Joint Modelling of Spoken Language Understanding Tasks with Integrated
  Dialog History","Accepted at ICASSP 20223",,,,"cs.CL cs.SD eess.AS","http://arxiv.org/licenses/nonexclusive-distrib/1.0/","  Most human interactions occur in the form of spoken conversations where the
semantic meaning of a given utterance depends on the context. Each utterance in
spoken conversation can be represented by many semantic and speaker attributes,
and there has been an interest in building Spoken Language Understanding (SLU)
systems for automatically predicting these attributes. Recent work has shown
that incorporating dialogue history can help advance SLU performance. However,
separate models are used for each SLU task, leading to an increase in inference
time and computation cost. Motivated by this, we aim to ask: can we jointly
model all the SLU tasks while incorporating context to facilitate low-latency
and lightweight inference? To answer this, we propose a novel model
architecture that learns dialog context to jointly predict the intent, dialog
act, speaker role, and emotion for the spoken utterance. Note that our joint
prediction is based on an autoregressive model and we need to decide the
prediction order of dialog attributes, which is not trivial. To mitigate the
issue, we also propose an order agnostic training method. Our experiments show
that our joint model achieves similar results to task-specific classifiers and
can effectively integrate dialog context to further improve the SLU
performance.
","[{""version"":""v1"",""created"":""Mon, 1 May 2023 16:26:18 GMT""}]","2023-05-02"
"2305.00927","Joshua Gardner","Josh Gardner, Renzhe Yu, Quan Nguyen, Christopher Brooks, Rene
  Kizilcec","Cross-Institutional Transfer Learning for Educational Models:
  Implications for Model Performance, Fairness, and Equity","Code to reproduce our experiments is available at
  https://github.com/educational-technology-collective/cross-institutional-transfer-learning-facct-2023","FAccT 2023","10.1145/3593013.3594107",,"cs.LG cs.CY","http://creativecommons.org/licenses/by/4.0/","  Modern machine learning increasingly supports paradigms that are
multi-institutional (using data from multiple institutions during training) or
cross-institutional (using models from multiple institutions for inference),
but the empirical effects of these paradigms are not well understood. This
study investigates cross-institutional learning via an empirical case study in
higher education. We propose a framework and metrics for assessing the utility
and fairness of student dropout prediction models that are transferred across
institutions. We examine the feasibility of cross-institutional transfer under
real-world data- and model-sharing constraints, quantifying model biases for
intersectional student identities, characterizing potential disparate impact
due to these biases, and investigating the impact of various
cross-institutional ensembling approaches on fairness and overall model
performance. We perform this analysis on data representing over 200,000
enrolled students annually from four universities without sharing training data
between institutions.
  We find that a simple zero-shot cross-institutional transfer procedure can
achieve similar performance to locally-trained models for all institutions in
our study, without sacrificing model fairness. We also find that stacked
ensembling provides no additional benefits to overall performance or fairness
compared to either a local model or the zero-shot transfer procedure we tested.
We find no evidence of a fairness-accuracy tradeoff across dozens of models and
transfer schemes evaluated. Our auditing procedure also highlights the
importance of intersectional fairness analysis, revealing performance
disparities at the intersection of sensitive identity groups that are concealed
under one-dimensional analysis.
","[{""version"":""v1"",""created"":""Mon, 1 May 2023 16:27:49 GMT""}]","2023-05-02"
"2305.00928","Adrian Sinclair","Adrian K. Sinclair, James R. Burgoyne, Yaqiong Li, Cody Duell, Scott
  C. Chapman, Anthony I. Huber, and Ruixuan Xie","Breaking the 10 mW/pixel Limit for Kinetic Inductance Detector Readout
  Electronics","to appear in the ISSTT 2022 conference proceedings",,,,"astro-ph.IM","http://creativecommons.org/licenses/by/4.0/","  We demonstrate a prototype kinetic inductance detector (KID) readout system
that uses less than 10 mW per pixel. The CCAT-prime RFSoC based readout is
capable of reading four independent detector networks of up to 1000 KIDs each.
The power dissipation was measured to be less than 40 W while running
multi-tone combs on all four channels simultaneously. The system was also used
for the first time to perform sweeps and resonator identification on a
prototype 280 GHz array.
","[{""version"":""v1"",""created"":""Mon, 1 May 2023 16:29:05 GMT""}]","2023-05-02"
"2305.00929","J. Humberto Ramos","Prashant Ganesh, J. Humberto Ramos, Vinicius G. Goecks, Jared Paquet,
  Matthew Longmire, Nicholas R. Waytowich, Kevin Brink","Learning Flight Control Systems from Human Demonstrations and Real-Time
  Uncertainty-Informed Interventions","IFAC 2023",,,,"cs.RO","http://creativecommons.org/licenses/by-nc-nd/4.0/","  This paper describes a methodology for learning flight control systems from
human demonstrations and interventions while considering the estimated
uncertainty in the learned models. The proposed approach uses human
demonstrations to train an initial model via imitation learning and then
iteratively, improve its performance by using real-time human interventions.
The aim of the interventions is to correct undesired behaviors and adapt the
model to changes in the task dynamics. The learned model uncertainty is
estimated in real-time via Monte Carlo Dropout and the human supervisor is cued
for intervention via an audiovisual signal when this uncertainty exceeds a
predefined threshold. This proposed approach is validated in an autonomous
quadrotor landing task on both fixed and moving platforms. It is shown that
with this algorithm, a human can rapidly teach a flight task to an unmanned
aerial vehicle via demonstrating expert trajectories and then adapt the learned
model by intervening when the learned controller performs any undesired
maneuver, the task changes, and/or the model uncertainty exceeds a threshold
","[{""version"":""v1"",""created"":""Mon, 1 May 2023 16:31:07 GMT""}]","2023-05-02"
"2305.00930","Michael Dikshtein","Michael Dikshtein, Nir Weinberger, and Shlomo Shamai (Shitz)","On Mismatched Oblivious Relaying","Accepted to ISIT2023",,,,"cs.IT math.IT","http://arxiv.org/licenses/nonexclusive-distrib/1.0/","  We consider the problem of reliable communication over a discrete memoryless
channel (DMC) with the help of a relay, termed the information bottleneck (IB)
channel. There is no direct link between the source and the destination, and
the information flows in two hops. The first hop is a noisy channel from the
source to the relay. The second hop is a noiseless but limited-capacity
backhaul link from the relay to the decoder. We further assume that the relay
is oblivious to the transmission codebook. We examine two mismatch scenarios.
In the first setting, we assume the decoder is restricted to use some fixed
decoding rule, which is mismatched to the actual channel. In the second
setting, we assume that the relay is restricted to use some fixed compression
metric, which is again mismatched to the statistics of the relay input. We
establish bounds on the random- coding capacity of both settings, some of which
are shown to be ensemble tight.
","[{""version"":""v1"",""created"":""Mon, 1 May 2023 16:32:16 GMT""}]","2023-05-02"
"2305.00931","Benjamin Kraske","Benjamin D. Kraske, Anshu Saksena, Anna L. Buczak, Zachary N. Sunberg","Explanation through Reward Model Reconciliation using POMDP Tree Search",,,,,"cs.AI cs.HC cs.LG","http://arxiv.org/licenses/nonexclusive-distrib/1.0/","  As artificial intelligence (AI) algorithms are increasingly used in
mission-critical applications, promoting user-trust of these systems will be
essential to their success. Ensuring users understand the models over which
algorithms reason promotes user trust. This work seeks to reconcile differences
between the reward model that an algorithm uses for online partially observable
Markov decision (POMDP) planning and the implicit reward model assumed by a
human user. Action discrepancies, differences in decisions made by an algorithm
and user, are leveraged to estimate a user's objectives as expressed in
weightings of a reward function.
","[{""version"":""v1"",""created"":""Mon, 1 May 2023 16:32:45 GMT""}]","2023-05-02"
"2305.00933","Swapnil Mishra","Nicolas Banholzer, Thomas Mellan, H Juliette T Unwin, Stefan
  Feuerriegel, Swapnil Mishra, Samir Bhatt","A comparison of short-term probabilistic forecasts for the incidence of
  COVID-19 using mechanistic and statistical time series models","37 pages, 4 Figures, 9 Appendix figures",,,,"stat.AP cs.LG q-bio.PE stat.ML","http://creativecommons.org/licenses/by/4.0/","  Short-term forecasts of infectious disease spread are a critical component in
risk evaluation and public health decision making. While different models for
short-term forecasting have been developed, open questions about their relative
performance remain. Here, we compare short-term probabilistic forecasts of
popular mechanistic models based on the renewal equation with forecasts of
statistical time series models. Our empirical comparison is based on data of
the daily incidence of COVID-19 across six large US states over the first
pandemic year. We find that, on average, probabilistic forecasts from
statistical time series models are overall at least as accurate as forecasts
from mechanistic models. Moreover, statistical time series models better
capture volatility. Our findings suggest that domain knowledge, which is
integrated into mechanistic models by making assumptions about disease
dynamics, does not improve short-term forecasts of disease incidence. We note,
however, that forecasting is often only one of many objectives and thus
mechanistic models remain important, for example, to model the impact of
vaccines or the emergence of new variants.
","[{""version"":""v1"",""created"":""Mon, 1 May 2023 16:37:43 GMT""}]","2023-05-02"
