"2305.01395","Matias Vistnes","Matias Vistnes, Vijay Venu Vadlamudi, Sigurd Hofsmo Jakobsen, and
  Oddbj{\o}rn Gjerde","A Novel Approach for Solving Security Constrained Optimal Power Flow
  Using the Inverse Matrix Modification Lemma and Benders Decomposition",,,,,"math.OC","http://creativecommons.org/licenses/by/4.0/","  With the increasing complexity of power systems, faster methods for power
system reliability analysis are needed. We propose a novel methodology to solve
the security constrained optimal power flow (SCOPF) problem that reduces the
computational time by using the Sherman-Morrison-Woodbury identity and Benders
decomposition. The case study suggests that in a 500 node system, the run time
is reduced by 83.5% while ensuring a reliable operation of the system
considering short- and long-term post-contingency limits and reducing the
operational costs, compared to a preventive `N-1' strategy.
","[{""version"":""v1"",""created"":""Tue, 2 May 2023 13:13:43 GMT""}]","2023-05-03"
"2305.01396","Pak-Yeung Chan","Pak-Yeung Chan, Man-Chun Lee","Gap Theorem on Riemannian manifolds using Ricci flow","30 pages, minor changes",,,,"math.DG","http://arxiv.org/licenses/nonexclusive-distrib/1.0/","  In this work, we consider complete non-compact manifolds with non-negative
complex sectional curvature and small average curvature decay. By developing
the Ricci flow existence theory, we show that complete non-compact manifolds
with non-negative complex sectional curvature and sufficiently small average
curvature decay are necessarily flat. We also prove a gap Theorem in the
Euclidean volume case. In the compact case, we use the Ricci flow to generalise
the celebrated Gromov-Ruh Theorem in this direction.
","[{""version"":""v1"",""created"":""Tue, 2 May 2023 13:15:40 GMT""},{""version"":""v2"",""created"":""Thu, 11 May 2023 05:24:16 GMT""}]","2023-05-12"
"2305.01397","Eike Petersen","Eike Petersen, Enzo Ferrante, Melanie Ganz, Aasa Feragen","Are demographically invariant models and representations in medical
  imaging fair?",,,,,"cs.LG cs.CY eess.IV stat.ML","http://creativecommons.org/licenses/by/4.0/","  Medical imaging models have been shown to encode information about patient
demographics (age, race, sex) in their latent representation, raising concerns
about their potential for discrimination. Here, we ask whether it is feasible
and desirable to train models that do not encode demographic attributes. We
consider different types of invariance with respect to demographic attributes -
marginal, class-conditional, and counterfactual model invariance - and lay out
their equivalence to standard notions of algorithmic fairness. Drawing on
existing theory, we find that marginal and class-conditional invariance can be
considered overly restrictive approaches for achieving certain fairness
notions, resulting in significant predictive performance losses. Concerning
counterfactual model invariance, we note that defining medical image
counterfactuals with respect to demographic attributes is fraught with
complexities. Finally, we posit that demographic encoding may even be
considered advantageous if it enables learning a task-specific encoding of
demographic features that does not rely on human-constructed categories such as
'race' and 'gender'. We conclude that medical imaging models may need to encode
demographic attributes, lending further urgency to calls for comprehensive
model fairness assessments in terms of predictive performance.
","[{""version"":""v1"",""created"":""Tue, 2 May 2023 13:16:04 GMT""}]","2023-05-03"
"2305.01398","Tamas Haidegger","\'Arp\'ad Tak\'acs, Tam\'as Haidegger","Infrastructural Requirements and Regulatory Challenges of a Sustainable
  Urban Air Mobility Ecosystem",,"Buildings 12.6 (2022): 747","10.3390/buildings12060747",,"eess.SY cs.SY","http://creativecommons.org/licenses/by-sa/4.0/","  The United Nations has long put on the discussion agenda the sustainability
challenges of ur- banization, which have both direct and indirect effects on
future regulation strategies. Undoubtedly, most initiatives target better
quality of life, improved access to services & goods and environment pro-
tection. As commercial aerial urban transportation may become a feasible
research goal in the near future, the connection possibilities between cities
and regions scale up. It is expected that the growing number of vertical
takeoff & landing vehicles used for passenger and goods transportation will
change the infrastructure of the cities, and will have a significant effect on
the cityscapes as well. In addition to the widely discussed regulatory and
safety issues, the introduction of elevated traffic also raises environmental
concerns, which influences the existing and required service and control
infrastructure, and thus significantly affects sustainability. This paper
provides narrated overview of the most common aspects of safety, licensing and
regulations for passenger vertical takeoff & landing vehicles, and highlights
the most important aspects of infrastructure planning, design and operation,
which should be taken into account to maintain and efficiently operate this new
way of transportation, leading to a sustainable urban air mobility ecosystem.
","[{""version"":""v1"",""created"":""Tue, 2 May 2023 13:16:29 GMT""}]","2023-05-03"
"2305.01399","Samuel S\'anchez L\'opez","Samuel S\'anchez L\'opez, Konstantinos Dimopoulos, Alexandros Karam,
  and Eemeli Tomberg","Observable Gravitational Waves from Hyperkination in Palatini Gravity
  and Beyond","40 pages, 7 figures",,,,"gr-qc astro-ph.CO hep-th","http://creativecommons.org/licenses/by/4.0/","  We consider cosmology with an inflaton scalar field with an additional
quartic kinetic term. Such a theory can be motivated by Palatini $R+R^2$
modified gravity. Assuming a runaway inflaton potential, we take the Universe
to become dominated by the kinetic energy density of the scalar field after
inflation. Initially, the leading kinetic term is quartic and we call the
corresponding period hyperkination. Subsequently, the usual quadratic kinetic
term takes over and we have regular kination, until reheating. We study, both
analytically and numerically, the spectrum of primordial gravitational waves
generated during inflation and re-entering the horizon during the subsequent
eras. We demonstrate that the spectrum is flat for modes re-entering during
radiation domination and hyperkination and linear in frequency for modes
re-entering during kination: kinetic domination boosts the spectrum, but
hyperkination truncates its peak. As a result, the effects of the kinetic
period can be extended to observable frequencies without generating excessive
gravitational waves, which could otherwise destabilise the process of Big Bang
Nucleosynthesis. We show that there is ample parameter space for the primordial
gravitational waves to be observable in the near future. If observed, the
amplitude and `knee' of the spectrum will provide valuable insights into the
background theory.
","[{""version"":""v1"",""created"":""Tue, 2 May 2023 13:18:06 GMT""}]","2023-05-03"
"2305.01400","Gabriel Dulac-Arnold","Geoffrey Cideron, Baruch Tabanpour, Sebastian Curi, Sertan Girgin,
  Leonard Hussenot, Gabriel Dulac-Arnold, Matthieu Geist, Olivier Pietquin,
  Robert Dadashi","Get Back Here: Robust Imitation by Return-to-Distribution Planning",,,,,"cs.RO cs.AI cs.LG cs.SY eess.SY","http://creativecommons.org/licenses/by/4.0/","  We consider the Imitation Learning (IL) setup where expert data are not
collected on the actual deployment environment but on a different version. To
address the resulting distribution shift, we combine behavior cloning (BC) with
a planner that is tasked to bring the agent back to states visited by the
expert whenever the agent deviates from the demonstration distribution. The
resulting algorithm, POIR, can be trained offline, and leverages online
interactions to efficiently fine-tune its planner to improve performance over
time. We test POIR on a variety of human-generated manipulation demonstrations
in a realistic robotic manipulation simulator and show robustness of the
learned policy to different initial state distributions and noisy dynamics.
","[{""version"":""v1"",""created"":""Tue, 2 May 2023 13:19:08 GMT""}]","2023-05-03"
"2305.01401","Marcel F. Langer","Marcel F. Langer and J. Thorben Frank and Florian Knoop","Stress and heat flux via automatic differentiation","9 pages, 2 figures, 6 tables, excluding supplement (3 pages, 3
  figures, 2 tables). Additional information at https://marcel.science/glp",,,,"cond-mat.mtrl-sci cs.LG physics.comp-ph","http://arxiv.org/licenses/nonexclusive-distrib/1.0/","  Machine-learning potentials provide computationally efficient and accurate
approximations of the Born-Oppenheimer potential energy surface. This potential
determines many materials properties and simulation techniques usually require
its gradients, in particular forces and stress for molecular dynamics, and heat
flux for thermal transport properties. Recently developed potentials feature
high body order and can include equivariant semi-local interactions through
message-passing mechanisms. Due to their complex functional forms, they rely on
automatic differentiation (AD), overcoming the need for manual implementations
or finite-difference schemes to evaluate gradients. This study demonstrates a
unified AD approach to obtain forces, stress, and heat flux for such
potentials, and provides a model-independent implementation. The method is
tested on the Lennard-Jones potential, and then applied to predict cohesive
properties and thermal conductivity of tin selenide using an equivariant
message-passing neural network potential.
","[{""version"":""v1"",""created"":""Tue, 2 May 2023 13:20:35 GMT""}]","2023-05-03"
"2305.01402","Pia Loaiza","CUPID-Mo Collaboration: C. Augier, A. S. Barabash, F. Bellini, G.
  Benato, M. Beretta, L. Berg\'e, J. Billard, Yu. A. Borovlev, L. Cardani, N.
  Casali, A. Cazes, E. Celi, M. Chapellier, D. Chiesa, I. Dafinei, F. A.
  Danevich, M. De Jesus, P. de Marcillac, T. Dixon, L. Dumoulin, K. Eitel, F.
  Ferri, B. K. Fujikawa, J. Gascon, L. Gironi, A. Giuliani, V. D. Grigorieva,
  M.Gros, D. L. Helis, H.Z. Huang, R. Huang, L. Imbert, J. Johnston, A.
  Juillard, H. Khalife, M. Kleifges, V. V. Kobychev, Yu. G. Kolomensky, S.I.
  Konovalov, J. Kotila, P. Loaiza, L. Ma, E. P. Makarov, R. Mariam, L. Marini,
  S. Marnieros, X. F. Navick, C. Nones, E.B. Norman, E. Olivieri, J. L.
  Ouellet, L. Pagnanini, L. Pattavina, M. Pavan, H. Peng, G. Pessina, S. Pirro,
  D. V. Poda, O. G. Polischuk, S. Pozzi, E. Previtali, Th. Redon, A. Rojas, S.
  Rozov, V. Sanglard, J.A. Scarpaci, B. Schmidt, Y. Shen, V. N. Shlegel, V.
  Singh, C. Tomei, V. I. Tretyak, V. I. Umatov, L. Vagneron, M. Vel\'azquez, B.
  Welliver, L. Winslow, M. Xue, E. Yakushev, M. Zarytskyy, A. S. Zolotarova","The background model of the CUPID-Mo $0\nu\beta\beta$ experiment",,,,,"hep-ex physics.ins-det","http://arxiv.org/licenses/nonexclusive-distrib/1.0/","  CUPID-Mo, located in the Laboratoire Souterrain de Modane (France), was a
demonstrator for the next generation $0\nu\beta\beta$ decay experiment, CUPID.
It consisted of an array of 20 enriched Li$_{2}$$ ^{100}$MoO$_4$ bolometers and
20 Ge light detectors and has demonstrated that the technology of scintillating
bolometers with particle identification capabilities is mature. Furthermore,
CUPID-Mo can inform and validate the background prediction for CUPID. In this
paper, we present a detailed model of the CUPID-Mo backgrounds. This model is
able to describe well the features of the experimental data and enables studies
of the $2\nu\beta\beta$ decay and other processes with high precision. We also
measure the radio-purity of the Li$_{2}$$^{100}$MoO$_4$ crystals which are
found to be sufficient for the CUPID goals. Finally, we also obtain a
background index in the region of interest of
3.7$^{+0.9}_{-0.8}$(stat)$^{+1.5}_{-0.7}$(syst)$\times10^{-3}$counts/$\Delta$E$_{FWHM}$/mol$_{iso}$/yr,
the lowest in a bolometric $0\nu\beta\beta$ decay experiment.
","[{""version"":""v1"",""created"":""Tue, 2 May 2023 13:21:26 GMT""}]","2023-05-03"
"2305.01403","Christof Bertram","Christof A. Bertram, Taryn A. Donovan, Alexander Bartel","Systematic Review of Methods and Prognostic Value of Mitotic Activity.
  Part 1: Feline Tumors",,,,,"q-bio.SC","http://creativecommons.org/licenses/by-nc-nd/4.0/","  Increased proliferation is a key driver of tumorigenesis, and quantification
of mitotic activity is a standard task for prognostication. The goal of this
systematic review is scholarly analysis of all available references on mitotic
activity in feline tumors, and to provide an overview of the measuring methods
and prognostic value. A systematic literature search in PubMed and Scopus and a
manual search in Google Scholar was conducted. All articles on feline tumors
that correlated mitotic activity with patient outcome were identified. Data
analysis revealed that of the eligible 42 articles, the mitotic count (MC,
mitotic figures per tumor area) was evaluated in 39 instances and the mitotic
index (MI, mitotic figures per tumor cells) in three instances. The risk of
bias was considered high for most studies (26/42, 62%) based on small study
populations, insufficient details of the MC/MI methods, and lack of statistical
measures for diagnostic accuracy or effect on outcome. The MC/MI methods varied
markedly between studies. A significant association of the MC with survival was
determined in 21/29 (72%) studies, while one study found an inverse effect.
There were three tumor types with at least four studies and a prognostic
association was found in 5/6 studies on mast cell tumors, 5/5 on mammary tumors
and 3/4 on soft tissue sarcomas. The MI was shown to correlate with survival by
two research groups, however a comparison to the MC was not conducted. An
updated systematic review will be needed with of new literature for different
tumor types.
","[{""version"":""v1"",""created"":""Tue, 2 May 2023 13:22:12 GMT""}]","2023-05-03"
"2305.01404","Daniel Bennett","Daniel Bennett, Wojciech J. Jankowski, Gaurav Chaudhary, Efthimios
  Kaxiras and Robert-Jan Slager","Theory of polarization textures in crystal supercells","16 pages, 6 figures",,,,"cond-mat.mtrl-sci cond-mat.mes-hall","http://creativecommons.org/licenses/by/4.0/","  Recently, topologically nontrivial polarization textures have been predicted
and observed in nanoscale systems. While these polarization textures are
interesting and promising in terms of applications, their topology in general
is yet to be fully understood. For example, the relation between topological
polarization structures and band topology has not been explored, and polar
domain structures are typically considered in topologically trivial systems. In
particular, the local polarization in a crystal supercell is not well-defined,
and typically calculated using approximations which do not satisfy gauge
invariance. Furthermore, local polarization in supercells is typically
approximated using calculations involving smaller unit cells, meaning the
connection to the electronic structure of the supercell is lost. In this work,
we propose a definition of local polarization which is gauge invariant and can
be calculated directly from a supercell without approximations. We show using
first-principles calculations for commensurate bilayer hexagonal boron nitride
that our expressions for local polarization give the correct result at the unit
cell level, which is a first approximation to the local polarization in a
moir\'e superlattice. We also illustrate using an effective model that the
local polarization can be directly calculated in real space. Finally, we
discuss the relation between polarization and band topology, for which it is
essential to have a correct definition of polarization textures.
","[{""version"":""v1"",""created"":""Tue, 2 May 2023 13:25:56 GMT""}]","2023-05-04"
"2305.01405","Michael Horowitz","Michael C. Horowitz, Lauren Kahn, Julia Macdonald, Jacquelyn Schneider","Adopting AI: How Familiarity Breeds Both Trust and Contempt",,,,,"cs.CY","http://creativecommons.org/licenses/by/4.0/","  Despite pronouncements about the inevitable diffusion of artificial
intelligence and autonomous technologies, in practice it is human behavior, not
technology in a vacuum, that dictates how technology seeps into -- and changes
-- societies. In order to better understand how human preferences shape
technological adoption and the spread of AI-enabled autonomous technologies, we
look at representative adult samples of US public opinion in 2018 and 2020 on
the use of four types of autonomous technologies: vehicles, surgery, weapons,
and cyber defense. By focusing on these four diverse uses of AI-enabled
autonomy that span transportation, medicine, and national security, we exploit
the inherent variation between these AI-enabled autonomous use cases. We find
that those with familiarity and expertise with AI and similar technologies were
more likely to support all of the autonomous applications we tested (except
weapons) than those with a limited understanding of the technology. Individuals
that had already delegated the act of driving by using ride-share apps were
also more positive about autonomous vehicles. However, familiarity cut both
ways; individuals are also less likely to support AI-enabled technologies when
applied directly to their life, especially if technology automates tasks they
are already familiar with operating. Finally, opposition to AI-enabled military
applications has slightly increased over time.
","[{""version"":""v1"",""created"":""Tue, 2 May 2023 13:26:54 GMT""}]","2023-05-03"
"2305.01406","Hisayoshi Muramatsu","Hisayoshi Muramatsu, Keigo Kitagawa, Jun Watanabe, Ryohei Hisashiki","A Mobile Quad-Arm Robot ARMS: Wheel-Legged Tripedal Mobility and
  Quad-Arm Manipulation",,,,,"cs.RO","http://arxiv.org/licenses/nonexclusive-distrib/1.0/","  This letter proposes a mobile quad-arm robot: ARMS that unifies wheel-legged
tripedal mobility, wheeled mobility, and quad-arm manipulation. The four arms
have different mechanics and are designed to be general-purpose arms to enable
the wheel-legged hybrid mobilities and manipulation. The
three-degree-of-freedom (DOF) front arm has an active wheel, which is used for
wheel-legged tripedal walking and wheel driving with passive wheels attached to
the torso. The three-DOF rear arms are series elastic arms, which are used for
wheel-legged tripedal walking, object grasping, and manipulation. The two-DOF
upper arm is used for manipulation only; its position and orientation are
determined by coordinating all arms. Each motor is controlled by an angle
controller and trajectory modification with angle, angular velocity, angular
acceleration, and torque constraints. ARMS was experimentally validated on the
basis of the following four tasks: wheel-legged walking, wheel-driving,
wheel-driving with grasping, and carrying a bag.
","[{""version"":""v1"",""created"":""Tue, 2 May 2023 13:27:42 GMT""}]","2023-05-03"
"2305.01407","Markus Horn","Markus Horn, Thomas Wodtko, Michael Buchholz, Klaus Dietmayer","Extrinsic Infrastructure Calibration Using the Hand-Eye Robot-World
  Formulation","Accepted at 2023 IEEE Intelligent Vehicles Symposium",,,,"cs.RO","http://arxiv.org/licenses/nonexclusive-distrib/1.0/","  We propose a certifiably globally optimal approach for solving the hand-eye
robot-world problem supporting multiple sensors and targets at once. Further,
we leverage this formulation for estimating a geo-referenced calibration of
infrastructure sensors. Since vehicle motion recorded by infrastructure sensors
is mostly planar, obtaining a unique solution for the respective hand-eye
robot-world problem is unfeasible without incorporating additional knowledge.
Hence, we extend our proposed method to include a-priori knowledge, i.e., the
translation norm of calibration targets, to yield a unique solution. Our
approach achieves state-of-the-art results on simulated and real-world data.
Especially on real-world intersection data, our approach utilizing the
translation norm is the only method providing accurate results.
","[{""version"":""v1"",""created"":""Tue, 2 May 2023 13:29:13 GMT""}]","2023-05-03"
"2305.01408","Andreas Wipf","L. O'Raifeartaigh, N. Straumann, A. Wipf","Aharonov-Bohm effect in Presence of Superconductors","Published version: Foundations of Physics, Vol. 23 (1993) 703-709
  doi: 10.1007/BF01883804 arXiv-ed February 18, 1993 ; \LaTeX-ed May 1, 2023
  Uploaded to arXiv to help researchers with limited library facilities","Foundations of Physics, Vol. 23 (1993) 703-709","10.1007/BF01883804","DIAS-STP-92-46","quant-ph","http://creativecommons.org/licenses/by/4.0/","  The analysis of a previous paper, in which it was shown that the energy for
the Aharonov-Bohm effect could be traced to the interaction energy between the
magnetic field of the electron and the background magnetic field, is extended
to cover the case in which the magnetic field of the electron is shielded from
the background magnetic field by superconducting material. The paradox that
arises from the fact that such a shielding would apparently preclude the
possibility of an interaction energy is resolved and, within the limits of the
ideal situation considered, the observed experimental result is derived.
","[{""version"":""v1"",""created"":""Tue, 2 May 2023 13:30:02 GMT""}]","2023-05-03"
"2305.01409","Sergey Tyul'bashev A.","S.A. Tyul'bashev, G.E. Tyul'basheva","Search for pulsars in an area with coordinates 3h < \alpha < 4h and +21o
  < \delta < +42o","published in Astronomy Reports, translated by Yandex translator with
  correction of scientific lexis, 7 pages, 3 figures, 2 tables","Astronomy Reports, 2023, v.67, p.172-180","10.1134/S1063772923020099",,"astro-ph.HE","http://arxiv.org/licenses/nonexclusive-distrib/1.0/","  On the Large Phased Array (LPA) of Lebedev Physics Institute (LPI), a search
for pulsars outside the Galaxy plane was carried out in a 300 sq. deg area. The
search with a sensitivity 5-10 times better than that of previously conducted
surveys was at a frequency of 111 MHz. The search was carried out in the summed
power spectra. With an accumulation equivalent to 100 hours of continuous
observations for each point of the area, 5 known pulsars were detected with a
signal-to-noise ratio (S/N) from 20 to 1300 in the first harmonic of the
spectrum. Average profiles were obtained for the detected pulsars. Estimates of
the peak and integral flux densities of the found pulsars are given for
individual sessions and for the power spectra summarized over 5.5 years,
obtained using the developed method based on measurements of the height of
harmonics in the power spectrum. No new pulsars have been detected in the area.
Apparently, when searching for pulsars in the area, we have approached the
lower limit of the luminosity of the second pulsars. The completeness of the
survey is at the level of 0.5 mJy.
","[{""version"":""v1"",""created"":""Tue, 2 May 2023 13:31:04 GMT""}]","2023-05-03"
"2305.01410","Xiaodong Zhou","Xiaodong Zhou, Wanxiang Feng, Run-Wu Zhang, Libor Smejkal, Jairo
  Sinova, Yuriy Mokrousov, and Yugui Yao","Crystal Thermal Transport in Altermagnetic RuO2","6 pages",,,,"cond-mat.mtrl-sci","http://arxiv.org/licenses/nonexclusive-distrib/1.0/","  We demonstrate the emergence of a pronounced thermal transport in the
recently discovered class of magnetic materials-altermagents. From symmetry
arguments and first principles calculations performed for the showcase
altermagnet, RuO2, we uncover that crystal Nernst and crystal thermal Hall
effects in this material are very large and strongly anisotropic with respect
to the Neel vector. We find the large crystal thermal transport to originate
from three sources of Berry's curvature in momentum space: the pseudo-nodal
surfaces, the Weyl fermions due to crossings between well-separated bands, and
the spin-flip ladder transitions, defined by transitions among very weakly
spin-split states of similar dispersion crossing the Fermi surface. Moreover,
we reveal that the anomalous thermal and electrical transport coefficients in
RuO2 are linked by an extended Wiedemann-Franz law in a temperature range much
wider than expected for conventional magnets. Our results suggest that
altermagnets may assume a leading role in realizing concepts in
spincaloritronics not achievable with ferromagnets or antiferromagnets.
","[{""version"":""v1"",""created"":""Tue, 2 May 2023 13:32:59 GMT""}]","2023-05-03"
"2305.01411","Gianluigi Pillonetto Dr.","Mauro Bisiacco and Gianluigi Pillonetto","Absolute integrability of Mercer kernels is only sufficient for RKHS
  stability",,,,,"eess.SY cs.LG cs.SY","http://creativecommons.org/licenses/by/4.0/","  Reproducing kernel Hilbert spaces (RKHSs) are special Hilbert spaces in
one-to-one correspondence with positive definite maps called kernels. They are
widely employed in machine learning to reconstruct unknown functions from
sparse and noisy data. In the last two decades, a subclass known as stable
RKHSs has been also introduced in the setting of linear system identification.
Stable RKHSs contain only absolutely integrable impulse responses over the
positive real line. Hence, they can be adopted as hypothesis spaces to estimate
linear, time-invariant and BIBO stable dynamic systems from input-output data.
Necessary and sufficient conditions for RKHS stability are available in the
literature and it is known that kernel absolute integrability implies
stability. Working in discrete-time, in a recent work we have proved that this
latter condition is only sufficient. Working in continuous-time, it is the
purpose of this note to prove that the same result holds also for Mercer
kernels.
","[{""version"":""v1"",""created"":""Tue, 2 May 2023 13:35:48 GMT""}]","2023-05-03"
