"2305.01095","Mahdi Rezaei","Rajmeet Singh, Saeed Mozaffari, Mahdi Rezaei, Shahpour Alirezaee","LSTM-based Preceding Vehicle Behaviour Prediction during Aggressive Lane
  Change for ACC Application",,,,,"cs.RO cs.AI cs.LG","http://creativecommons.org/licenses/by/4.0/","  The development of Adaptive Cruise Control (ACC) systems aims to enhance the
safety and comfort of vehicles by automatically regulating the speed of the
vehicle to ensure a safe gap from the preceding vehicle. However, conventional
ACC systems are unable to adapt themselves to changing driving conditions and
drivers' behavior. To address this limitation, we propose a Long Short-Term
Memory (LSTM) based ACC system that can learn from past driving experiences and
adapt and predict new situations in real time. The model is constructed based
on the real-world highD dataset, acquired from German highways with the
assistance of camera-equipped drones. We evaluated the ACC system under
aggressive lane changes when the side lane preceding vehicle cut off, forcing
the targeted driver to reduce speed. To this end, the proposed system was
assessed on a simulated driving environment and compared with a feedforward
Artificial Neural Network (ANN) model and Model Predictive Control (MPC) model.
The results show that the LSTM-based system is 19.25% more accurate than the
ANN model and 5.9% more accurate than the MPC model in terms of predicting
future values of subject vehicle acceleration. The simulation is done in
Matlab/Simulink environment.
","[{""version"":""v1"",""created"":""Mon, 1 May 2023 21:33:40 GMT""},{""version"":""v2"",""created"":""Fri, 5 May 2023 17:45:07 GMT""}]","2023-05-08"
"2305.01096","Mahdi Rezaei","Armin Nejadhossein Qasemabadi, Saeed Mozaffari, Mahdi Rezaei, Majid
  Ahmadi, Shahpour Alirezaee","A Novel Model for Driver Lane Change Prediction in Cooperative Adaptive
  Cruise Control Systems",,,,,"cs.RO cs.AI cs.LG","http://creativecommons.org/licenses/by/4.0/","  Accurate lane change prediction can reduce potential accidents and contribute
to higher road safety. Adaptive cruise control (ACC), lane departure avoidance
(LDA), and lane keeping assistance (LKA) are some conventional modules in
advanced driver assistance systems (ADAS). Thanks to vehicle-to-vehicle
communication (V2V), vehicles can share traffic information with surrounding
vehicles, enabling cooperative adaptive cruise control (CACC). While ACC relies
on the vehicle's sensors to obtain the position and velocity of the leading
vehicle, CACC also has access to the acceleration of multiple vehicles through
V2V communication. This paper compares the type of information (position,
velocity, acceleration) and the number of surrounding vehicles for driver lane
change prediction. We trained an LSTM (Long Short-Term Memory) on the HighD
dataset to predict lane change intention. Results indicate a significant
improvement in accuracy with an increase in the number of surrounding vehicles
and the information received from them. Specifically, the proposed model can
predict the ego vehicle lane change with 59.15% and 92.43% accuracy in ACC and
CACC scenarios, respectively.
","[{""version"":""v1"",""created"":""Mon, 1 May 2023 21:40:23 GMT""}]","2023-05-03"
"2305.01097","Ilias Magoulas","Ilias Magoulas and Francesco A. Evangelista","Unitary Coupled Cluster: Seizing the Quantum Moment",,,,,"physics.chem-ph quant-ph","http://arxiv.org/licenses/nonexclusive-distrib/1.0/","  Shallow, CNOT-efficient quantum circuits are crucial for performing accurate
computational chemistry simulations on current noisy quantum hardware. Here, we
explore the usefulness of non-iterative energy corrections, based on the method
of moments of coupled-cluster theory, for accelerating convergence toward full
configuration interaction. Our preliminary numerical results relying on
iteratively constructed ans\""{a}tze suggest that chemically accurate energies
can be obtained with substantially more compact circuits, implying enhanced
resilience to gate and decoherence noise.
","[{""version"":""v1"",""created"":""Mon, 1 May 2023 21:47:28 GMT""}]","2023-05-03"
"2305.01098","Joanne Truong","Joanne Truong, April Zitkovich, Sonia Chernova, Dhruv Batra, Tingnan
  Zhang, Jie Tan, Wenhao Yu","IndoorSim-to-OutdoorReal: Learning to Navigate Outdoors without any
  Outdoor Experience",,,,,"cs.RO","http://arxiv.org/licenses/nonexclusive-distrib/1.0/","  We present IndoorSim-to-OutdoorReal (I2O), an end-to-end learned visual
navigation approach, trained solely in simulated short-range indoor
environments, and demonstrates zero-shot sim-to-real transfer to the outdoors
for long-range navigation on the Spot robot. Our method uses zero real-world
experience (indoor or outdoor), and requires the simulator to model no
predominantly-outdoor phenomenon (sloped grounds, sidewalks, etc). The key to
I2O transfer is in providing the robot with additional context of the
environment (i.e., a satellite map, a rough sketch of a map by a human, etc.)
to guide the robot's navigation in the real-world. The provided context-maps do
not need to be accurate or complete -- real-world obstacles (e.g., trees,
bushes, pedestrians, etc.) are not drawn on the map, and openings are not
aligned with where they are in the real-world. Crucially, these inaccurate
context-maps provide a hint to the robot about a route to take to the goal. We
find that our method that leverages Context-Maps is able to successfully
navigate hundreds of meters in novel environments, avoiding novel obstacles on
its path, to a distant goal without a single collision or human intervention.
In comparison, policies without the additional context fail completely. Lastly,
we test the robustness of the Context-Map policy by adding varying degrees of
noise to the map in simulation. We find that the Context-Map policy is
surprisingly robust to noise in the provided context-map. In the presence of
significantly inaccurate maps (corrupted with 50% noise, or entirely blank
maps), the policy gracefully regresses to the behavior of a policy with no
context. Videos are available at https://www.joannetruong.com/projects/i2o.html
","[{""version"":""v1"",""created"":""Mon, 1 May 2023 21:55:49 GMT""},{""version"":""v2"",""created"":""Wed, 10 May 2023 00:26:45 GMT""}]","2023-05-11"
"2305.01099","Charlie Cowen-Breen","Charlie Cowen-Breen (1), Creston Brooks (2), Johannes Haubold (2),
  Barbara Graziosi (2) ((1) University of Cambridge, (2) Princeton University)","Logion: Machine Learning for Greek Philology","14 pages, 4 figures",,,,"cs.CL cs.LG","http://creativecommons.org/licenses/by/4.0/","  This paper presents machine-learning methods to address various problems in
Greek philology. After training a BERT model on the largest premodern Greek
dataset used for this purpose to date, we identify and correct previously
undetected errors made by scribes in the process of textual transmission, in
what is, to our knowledge, the first successful identification of such errors
via machine learning. Additionally, we demonstrate the model's capacity to fill
gaps caused by material deterioration of premodern manuscripts and compare the
model's performance to that of a domain expert. We find that best performance
is achieved when the domain expert is provided with model suggestions for
inspiration. With such human-computer collaborations in mind, we explore the
model's interpretability and find that certain attention heads appear to encode
select grammatical features of premodern Greek.
","[{""version"":""v1"",""created"":""Mon, 1 May 2023 21:56:25 GMT""}]","2023-05-03"
"2305.01100","Robert. Coquereaux","Robert Coquereaux and Jean-Bernard Zuber","Counting partitions by genus. II. A compendium of results","24 pages, 1 figure",,,,"math.CO math-ph math.MP","http://arxiv.org/licenses/nonexclusive-distrib/1.0/","  This article is devoted to the enumeration of set partitions, according to
their length, number of parts, cyclic type, and genus. Genus dependent Bell,
Stirling numbers, and Fa\`a di Bruno coefficients are introduced. Besides
attempting to summarize what is already known on the subject, we obtain new
generic results (in particular for partitions into two parts, for arbitrary
genus), and present computer generated new data extending the number of terms
known for sequences or families of such coefficients; this also allows us to
propose new conjectures.
","[{""version"":""v1"",""created"":""Mon, 1 May 2023 21:56:28 GMT""}]","2023-05-03"
"2305.01101","Jiaxing Qu","Jiaxing Qu, Yuxuan Richard Xie, Kamil M. Ciesielski, Claire E. Porter,
  Eric S. Toberer, Elif Ertekin","Leveraging Language Representation for Material Recommendation, Ranking,
  and Exploration",,,,,"cond-mat.mtrl-sci cs.LG","http://creativecommons.org/licenses/by/4.0/","  Data-driven approaches for material discovery and design have been
accelerated by emerging efforts in machine learning. However, general
representations of crystals to explore the vast material search space remain
limited. We introduce a material discovery framework that uses natural language
embeddings derived from language models as representations of compositional and
structural features. The discovery framework consists of a joint scheme that
first recalls relevant candidates, and next ranks the candidates based on
multiple target properties. The contextual knowledge encoded in language
representations conveys information about material properties and structures,
enabling both representational similarity analysis for recall, and multi-task
learning to share information across related properties. By applying the
framework to thermoelectrics, we demonstrate diversified recommendations of
prototype structures and identify under-studied high-performance material
spaces. The recommended materials are corroborated by first-principles
calculations and experiments, revealing novel materials with potential high
performance. Our framework provides a task-agnostic means for effective
material recommendation and can be applied to various material systems.
","[{""version"":""v1"",""created"":""Mon, 1 May 2023 21:58:29 GMT""},{""version"":""v2"",""created"":""Sat, 20 May 2023 03:35:30 GMT""}]","2023-05-23"
"2305.01102","Ahis Shrestha","Ahis Shrestha and Monica Olvera de la Cruz","Enhanced phoretic self-propulsion of active colloids through surface
  charge asymmetry",,,,,"cond-mat.soft physics.bio-ph physics.flu-dyn","http://arxiv.org/licenses/nonexclusive-distrib/1.0/","  Charged colloidal particles propel themselves through asymmetric fluxes of
chemically generated ions on their surface. We show that asymmetry in the
surface charge distribution introduces a new mode of self-phoretic motion for
chemically active particles that produce ionic species. Particles of sizes
smaller than or comparable to the Debye length achieve directed self-propulsion
through surface charge asymmetry even when ionic flux is uniform over the
particle surface. Janus nanoparticles endowed with both surface charge and
ionic flux asymmetries results in enhanced propulsion speeds of the order of
$\mu$m/s or higher. Our work provides a theoretical framework to quantitatively
determine the velocity of asymmetrically charged nanoparticles undergoing ionic
self-diffusiophoresis, and suggests an avenue for specifying surface properties
that optimize and regulate self-propulsion in ionic media.
","[{""version"":""v1"",""created"":""Mon, 1 May 2023 21:59:48 GMT""}]","2023-05-03"
"2305.01103","Felipe Gallego-Olaya","Yohny Calder\'on-Henao, Felipe Gallego-Olaya, and Hern\'an Giraldo","Relations Between the Strong Global dimension, Complexes of Fixed Size
  and Derived Category","20 pages and 3 figures. arXiv admin note: substantial text overlap
  with arXiv:2011.05220",,,,"math.RT","http://arxiv.org/licenses/nonexclusive-distrib/1.0/","  Let $\mathbb{Z}$ be the integer numbers, $\mathbb{k}$ an algebraically closed
field, $\Lambda$ a finite dimensional $\mathbb{k}$-algebra, mod$\Lambda$ the
category of finitely generated right modules, proj$\Lambda$ the full
subcategory of mod$\Lambda$ consisting of all projective $\Lambda$-modules, and
$C_n(proj\Lambda)$ the bounded complexes of projective $\Lambda$-modules of
fixed size for any integer $n\geq2$. We found an algorithm to calculate the
strong global dimension of $\Lambda$, when $\Lambda$ has finite strong global
dimension and derived-discrete, using the Auslander-Reiten quivers of the
categories $C_n(proj\Lambda)$. Also, we show the relation between the
Auslander-Reiten quiver of the bounded derived category $D^b(\Lambda)$ and the
Auslander-Reiten quiver of $C_{\eta+1}(proj\Lambda)$, where
$\eta=s.gl.dim(\Lambda)$ (strong global dimension of $\Lambda$).
","[{""version"":""v1"",""created"":""Mon, 1 May 2023 22:00:16 GMT""}]","2023-05-03"
"2305.01104","Matthew Johnson","Matthew Johnson and Barnaby Martin and Sukanya Pandey and Dani\""el
  Paulusma and Siani Smith and Erik Jan van Leeuwen","Complexity Framework for Forbidden Subgraphs III: When Problems are
  Tractable on Subcubic Graphs",,,,,"cs.DS math.CO","http://creativecommons.org/licenses/by/4.0/","  For any finite set $\mathcal{H} = \{H_1,\ldots,H_p\}$ of graphs, a graph is
$\mathcal{H}$-subgraph-free if it does not contain any of $H_1,\ldots,H_p$ as a
subgraph. In recent work, meta-classifications have been studied: these show
that if graph problems satisfy certain prescribed conditions, their complexity
is determined on classes of $\mathcal{H}$-subgraph-free graphs. We continue
this work and focus on problems that have polynomial-time solutions on classes
that have bounded treewidth or maximum degree at most~$3$ and examine their
complexity on $H$-subgraph-free graph classes where $H$ is a connected graph.
With this approach, we obtain comprehensive classifications for (Independent)
Feedback Vertex Set, Connected Vertex Cover, Colouring and Matching Cut. This
resolves a number of open problems.
  We highlight that, to establish that Independent Feedback Vertex Set belongs
to this collection of problems, we first show that it can be solved in
polynomial time on graphs of maximum degree $3$. We demonstrate that, with the
exception of the complete graph on four vertices, each graph in this class has
a minimum size feedback vertex set that is also an independent set.
","[{""version"":""v1"",""created"":""Mon, 1 May 2023 22:00:40 GMT""}]","2023-05-03"
"2305.01105","Salvador Barraza-Lopez","Shiva P. Poudel, Juan M. Marmolejo-Tejada, Joseph E. Roll, Mart\'in A.
  Mosquera, and Salvador Barraza-Lopez","Creating a three dimensional intrinsic electric dipole on rotated
  CrI$_3$ bilayers","Accepted at PRB on May 1, 2023","Phys. Rev. B 107, 195128 (2023)","10.1103/PhysRevB.107.195128",,"cond-mat.mes-hall cond-mat.mtrl-sci","http://creativecommons.org/licenses/by/4.0/","  Two-dimensional (2D) materials are being explored as a novel multiferroic
platform. One of the most studied magnetoelectric multiferroic 2D materials are
antiferromagnetically-coupled (AFM) CrI$_3$ bilayers. Neglecting magnetism,
those bilayers possess a crystalline point of inversion, which is only removed
by the antiparallel spin configuration among its two constituent monolayers.
The resultant intrinsic electric dipole on those bilayers has a magnitude no
larger than 0.04 pC/m, it points out-of-plane, and it reverts direction when
the--Ising-like--cromium spins are flipped (toward opposite layers {\em versus}
away from opposite layers). The combined presence of antiferromagnetism and a
weak intrinsic electric dipole makes this material a two-dimensional
magnetoelectric multiferroic. Here, we remove the crystalline center of
inversion of the bilayer by a relative $60^{\circ}$ rotation of its constituent
monolayers. This process {\em enhances} the out-of-plane intrinsic electric
dipole tenfold with respect to its magnitude in the non-rotated AFM bilayer and
also creates an even stronger and switchable in-plane intrinsic electric
dipole. The ability to create a three-dimensional electric dipole is important,
because it enhances the magnetoelectric coupling on this experimentally
accessible 2D material, which is explicitly calculated here as well.
","[{""version"":""v1"",""created"":""Mon, 1 May 2023 22:02:43 GMT""}]","2023-05-16"
"2305.01106","Mahdi Khojastehnia","Mahdi Khojastehnia, Ioannis Lambadaris, Ramy H Gohary, Sergey Loyka","Optimal Power Assignment for MIMO Channels Under Joint Total and
  Per-Group Power Constraints",,,,,"cs.IT math.IT","http://creativecommons.org/licenses/by/4.0/","  In this paper we consider a communication system with one transmitter and one
receiver. The transmit antennas are partitioned into disjoint groups, and each
group must satisfy an average power constraint in addition to the standard
overall one. The optimal power allocation (OPA) for the transmit antennas is
obtained for the following cases: (i) fixed multiple-input multiple-output
(MIMO) orthogonal channel, (ii) i.i.d. fading MIMO orthogonal channel, and
(iii) i.i.d. Rayleigh fading multiple-input single-output (MISO) and MIMO
channels. The channel orthogonality is encountered in the practical case of the
massive MIMO channel under favorable propagation conditions. The closed-form
solution to the OPA for a fixed channel is found using the Karush-Kuhn-Tucker
(KKT) conditions and it is similar to the standard water-filling procedure
while the effect of the per-group average power constraint is added. For a
fading channel, an algorithm is proposed to give the OPA, and the algorithm's
convergence is proved via a majorization inequality and a Schur-concavity
property.
","[{""version"":""v1"",""created"":""Mon, 1 May 2023 22:07:04 GMT""}]","2023-05-03"
"2305.01107","Shruti Gadewar","Shruti P. Gadewar (1), Elnaz Nourollahimoghadam (1), Ravi R. Bhatt
  (1), Abhinaav Ramesh (1), Shayan Javid (1), Iyad Ba Gari (1), Alyssa H. Zhu
  (1), Sophia Thomopoulos (1), Paul M. Thompson (1), Neda Jahanshad (1) (for
  the Alzheimer's Disease Neuroimaging Initiative, (1) Imaging Genetics Center,
  Mark and Mary Stevens Neuroimaging and Informatics Institute, Keck School of
  Medicine, University of Southern California, Marina del Rey, CA, USA)","A Comprehensive Corpus Callosum Segmentation Tool for Detecting Callosal
  Abnormalities and Genetic Associations from Multi Contrast MRIs",,,,,"q-bio.QM","http://creativecommons.org/licenses/by/4.0/","  Structural alterations of the midsagittal corpus callosum (midCC) have been
associated with a wide range of brain disorders. The midCC is visible on most
MRI contrasts and in many acquisitions with a limited field-of-view. Here, we
present an automated tool for segmenting and assessing the shape of the midCC
from T1w, T2w, and FLAIR images. We train a UNet on images from multiple public
datasets to obtain midCC segmentations. A quality control algorithm is also
built-in, trained on the midCC shape features. We calculate intraclass
correlations (ICC) and average Dice scores in a test-retest dataset to assess
segmentation reliability. We test our segmentation on poor quality and partial
brain scans. We highlight the biological significance of our extracted features
using data from over 40,000 individuals from the UK Biobank; we classify
clinically defined shape abnormalities and perform genetic analyses.
","[{""version"":""v1"",""created"":""Mon, 1 May 2023 22:15:44 GMT""}]","2023-05-03"
"2305.01108","Jim Freericks","J. K. Freericks","Focus on conceptual ideas in quantum mechanics for teacher training","Conference proceedings of the 2021 GIREP Webinar on how to train
  teachers for quantum mechanics, to appear in J. Phys. Conf. Ser",,"10.1088/1742-6596/2490/1/012004",,"physics.ed-ph quant-ph","http://arxiv.org/licenses/nonexclusive-distrib/1.0/","  In this work, we describe strategies and provide case-study activities that
can be used to examine the properties of superposition, entanglement, tagging,
complementarity, and measurement in quantum curricula geared for teacher
training. Having a solid foundation in these conceptual ideas is critical for
educators who will be adopting quantum ideas within the classroom. Yet they are
some of the most difficult concepts to master. We show how one can
systematically develop these conceptual foundations with thought experiments on
light and with thought experiments that employ the Stern-Gerlach experiment. We
emphasize the importance of computer animations in aiding the instruction on
these concepts.
","[{""version"":""v1"",""created"":""Mon, 1 May 2023 22:20:48 GMT""}]","2023-05-24"
"2305.01109","Lorenzo Masoero","Lorenzo Masoero, Doug Hains, James McQueen","Leveraging covariate adjustments at scale in online A/B testing",,,,,"stat.ME stat.AP","http://creativecommons.org/licenses/by/4.0/","  Companies offering web services routinely run randomized online experiments
to estimate the causal impact associated with the adoption of new features and
policies on key performance metrics of interest. These experiments are used to
estimate a variety of effects: the increase in click rate due to the
repositioning of a banner, the impact on subscription rate as a consequence of
a discount or special offer, etc. In these settings, even effects whose sizes
are very small can have large downstream impacts. The simple difference in
means estimator (Splawa-Neyman et al., 1990) is still the standard estimator of
choice for many online A/B testing platforms due to its simplicity. This
method, however, can fail to detect small effects, even when the experiment
contains thousands or millions of observational units. As a by-product of these
experiments, however, large amounts of additional data (covariates) are
collected. In this paper, we discuss benefits, costs and risks of allowing
experimenters to leverage more complicated estimators that make use of
covariates when estimating causal effects of interest. We adapt a recently
proposed general-purpose algorithm for the estimation of causal effects with
covariates to the setting of online A/B tests. Through this paradigm, we
implement several covariate-adjusted causal estimators. We thoroughly evaluate
their performance at scale, highlighting benefits and shortcomings of different
methods. We show on real experiments how ""covariate-adjusted"" estimators can
(i) lead to more precise quantification of the causal effects of interest and
(ii) fix issues related to imbalance across treatment arms - a practical
concern often overlooked in the literature. In turn, (iii) these more precise
estimates can reduce experimentation time, cutting cost and helping to
streamline decision-making processes, allowing for faster adoption of
beneficial interventions.
","[{""version"":""v1"",""created"":""Mon, 1 May 2023 22:28:18 GMT""}]","2023-05-03"
"2305.01110","Jonathan Lin","Jonathan Lin, Kerry Emanuel","Upwards Tropospheric Influence on Tropical Stratospheric Upwelling",,,,,"physics.ao-ph","http://creativecommons.org/licenses/by/4.0/","  The response of the stratosphere to a steady geopotential forcing is
considered in two separate theoretical models. Solutions to the linearized
quasi-geostrophic potential vorticity equations are first used to show that the
vertical length scale of a tropopause geopotential anomaly is initially
shallow, but significantly increased by diabatic heating from radiative
relaxation. This process is deemed as geostrophic adjustment of the
stratosphere to tropospheric forcing. Idealized, time-dependent calculations
show that tropopause geopotential anomalies can appreciably rise in the
stratosphere on time scales of a couple months. A previously developed, coupled
troposphere-stratosphere model is introduced and modified to further understand
how tropospheric geopotential forcing can induce upwelling in the stratosphere.
Solutions to steady, zonally-symmetric sea-surface-temperature forcings in the
linear $\beta$-plane model show that the upwards stratospheric penetration of
the thermally induced tropopause geopotential anomaly is controlled by a
non-dimensional parameter that depends on the ratio between the time scale of
wave-drag to that of radiation. It is also shown that the horizontal scale of
the tropopause geopotential anomaly modulates the vertical scale of the
anomaly. When Earth-like non-dimensional parameters are used, the theoretical
model predicts stratospheric temperature anomalies around two times larger in
magnitude than those in the boundary layer, approximately in line with
observational data. The results are argued to show that wave-drag alone may not
suffice to explain certain observed features of the lower stratosphere,
foremost of which is the anti-correlation between sea-surface temperature and
lower stratospheric temperature.
","[{""version"":""v1"",""created"":""Mon, 1 May 2023 22:31:54 GMT""}]","2023-05-03"
