"2305.01241","Hendric Vo{\ss}","Hendric Vo{\ss} and Stefan Kopp","AQ-GT: a Temporally Aligned and Quantized GRU-Transformer for Co-Speech
  Gesture Synthesis",,,,,"cs.HC cs.GR cs.LG cs.SD eess.AS","http://arxiv.org/licenses/nonexclusive-distrib/1.0/","  The generation of realistic and contextually relevant co-speech gestures is a
challenging yet increasingly important task in the creation of multimodal
artificial agents. Prior methods focused on learning a direct correspondence
between co-speech gesture representations and produced motions, which created
seemingly natural but often unconvincing gestures during human assessment. We
present an approach to pre-train partial gesture sequences using a generative
adversarial network with a quantization pipeline. The resulting codebook
vectors serve as both input and output in our framework, forming the basis for
the generation and reconstruction of gestures. By learning the mapping of a
latent space representation as opposed to directly mapping it to a vector
representation, this framework facilitates the generation of highly realistic
and expressive gestures that closely replicate human movement and behavior,
while simultaneously avoiding artifacts in the generation process. We evaluate
our approach by comparing it with established methods for generating co-speech
gestures as well as with existing datasets of human behavior. We also perform
an ablation study to assess our findings. The results show that our approach
outperforms the current state of the art by a clear margin and is partially
indistinguishable from human gesturing. We make our data pipeline and the
generation framework publicly available.
","[{""version"":""v1"",""created"":""Tue, 2 May 2023 07:59:38 GMT""},{""version"":""v2"",""created"":""Mon, 8 May 2023 11:59:12 GMT""}]","2023-05-09"
"2305.01242","Thomas Purcell","Thomas A. R. Purcell and Matthias Scheffler and Luca M. Ghiringhelli","Recent advances in the SISSO method and their implementation in the
  SISSO++ code","10 pages, 7 figures, 4 tables",,,,"physics.data-an cond-mat.mtrl-sci physics.comp-ph","http://creativecommons.org/licenses/by/4.0/","  Accurate and explainable artificial-intelligence (AI) models are promising
tools for the acceleration of the discovery of new materials, ore new
applications for existing materials. Recently, symbolic regression has become
an increasingly popular tool for explainable AI because it yields models that
are relatively simple analytical descriptions of target properties. Due to its
deterministic nature, the sure-independence screening and sparsifying operator
(SISSO) method is a particularly promising approach for this application. Here
we describe the new advancements of the SISSO algorithm, as implemented into
SISSO++, a C++ code with Python bindings. We introduce a new representation of
the mathematical expressions found by SISSO. This is a first step towards
introducing ``grammar'' rules into the feature creation step. Importantly, by
introducing a controlled non-linear optimization to the feature creation step
we expand the range of possible descriptors found by the methodology. Finally,
we introduce refinements to the solver algorithms for both regression and
classification, that drastically increase the reliability and efficiency of
SISSO. For all of these improvements to the basic SISSO algorithm, we not only
illustrate their potential impact, but also fully detail how they operate both
mathematically and computationally.
","[{""version"":""v1"",""created"":""Tue, 2 May 2023 08:00:28 GMT""}]","2023-05-03"
"2305.01243","Jun Zhang","Jun Zhang, Xiaohan Lin, Weinan E and Yi Qin Gao","Machine-Learned Invertible Coarse Graining for Multiscale Molecular
  Modeling","10 pages, 5 figures, plus SI",,,,"physics.comp-ph cs.LG","http://creativecommons.org/licenses/by-nc-sa/4.0/","  Multiscale molecular modeling is widely applied in scientific research of
molecular properties over large time and length scales. Two specific challenges
are commonly present in multiscale modeling, provided that information between
the coarse and fine representations of molecules needs to be properly
exchanged: One is to construct coarse grained (CG) models by passing
information from the fine to coarse levels; the other is to restore finer
molecular details given CG configurations. Although these two problems are
commonly addressed independently, in this work, we present a theory connecting
them, and develop a methodology called Cycle Coarse Graining (CCG) to solve
both problems in a unified manner. In CCG, reconstruction can be achieved via a
tractable optimization process, leading to a general method to retrieve fine
details from CG simulations, which in turn, delivers a new solution to the CG
problem, yielding an efficient way to calculate free energies in a
rare-event-free manner. CCG thus provides a systematic way for multiscale
molecular modeling, where the finer details of CG simulations can be
efficiently retrieved, and the CG models can be improved consistently.
","[{""version"":""v1"",""created"":""Tue, 2 May 2023 08:05:42 GMT""}]","2023-05-03"
"2305.01244","Masafumi Hattori","Kenta Hashizume, Masafumi Hattori","On boundedness and moduli spaces of K-stable Calabi-Yau fibrations over
  curves","68 pages",,,,"math.AG math.DG","http://arxiv.org/licenses/nonexclusive-distrib/1.0/","  We show boundedness of polarized Calabi--Yau fibrations over curves only with
fixed volumes of general fibers and Iitaka volumes. As its application, we
construct a separated coarse moduli space of K-stable Calabi-Yau fibrations
over curves in an adiabatic sense [Hat22b] and show that all members (resp.
smooth members) of the moduli are simultaneously uniformly K-stable (resp. have
cscK metrics) for a certain choice of polarizations.
","[{""version"":""v1"",""created"":""Tue, 2 May 2023 08:09:41 GMT""}]","2023-05-03"
"2305.01245","Jingcai Guo","Jingcai Guo, Yuanyuan Xu, Wenchao Xu, Yufeng Zhan, Yuxia Sun, Song Guo","MDENet: Multi-modal Dual-embedding Networks for Malware Open-set
  Recognition","14 pages, 7 figures",,,,"cs.CR cs.LG","http://arxiv.org/licenses/nonexclusive-distrib/1.0/","  Malware open-set recognition (MOSR) aims at jointly classifying malware
samples from known families and detect the ones from novel unknown families,
respectively. Existing works mostly rely on a well-trained classifier
considering the predicted probabilities of each known family with a
threshold-based detection to achieve the MOSR. However, our observation reveals
that the feature distributions of malware samples are extremely similar to each
other even between known and unknown families. Thus the obtained classifier may
produce overly high probabilities of testing unknown samples toward known
families and degrade the model performance. In this paper, we propose the
Multi-modal Dual-Embedding Networks, dubbed MDENet, to take advantage of
comprehensive malware features (i.e., malware images and malware sentences)
from different modalities to enhance the diversity of malware feature space,
which is more representative and discriminative for down-stream recognition.
Last, to further guarantee the open-set recognition, we dually embed the fused
multi-modal representation into one primary space and an associated sub-space,
i.e., discriminative and exclusive spaces, with contrastive sampling and
rho-bounded enclosing sphere regularizations, which resort to classification
and detection, respectively. Moreover, we also enrich our previously proposed
large-scaled malware dataset MAL-100 with multi-modal characteristics and
contribute an improved version dubbed MAL-100+. Experimental results on the
widely used malware dataset Mailing and the proposed MAL-100+ demonstrate the
effectiveness of our method.
","[{""version"":""v1"",""created"":""Tue, 2 May 2023 08:09:51 GMT""}]","2023-05-03"
"2305.01246","He Liu","He Liu, Yong-Hang Yang, Yue Han, and Peng-Cheng Chu","Properties of quark matter and hybrid stars from a quasiparticle model","10 pages, 8 figures",,,,"nucl-th","http://arxiv.org/licenses/nonexclusive-distrib/1.0/","  We investigate the properties of hybrid stars with the hadron-quark phase
transition by using a quasiparticle model. Results from our study indicate that
the coupling constant $g$ can stiffen the EOS of hybrid star matter and thus
increase the hybrid star maximum mass and its tidal deformability, whereas it
also decreases the mass and radius of the pure quark core. In addition, we find
that a step change of the sound velocity occurs in the hadron-quark mixed
phase, and it is restored with the decrease of nucleon and lepton degrees of
freedom in the high density quark phase. The approximate rule that the
polytropic index $\gamma \leq 1.75$ can also be used as a criterion for
separating hadronic from quark matter in our work. The hypothesis of absolutely
stable SQM (or ""Witten hypothesis"") suggests that a hybrid star containing a
sufficient amount of SQM in its core will rapidly convert into a strange quark
star. The SQM in hybrid stars therefore should break the absolutely stable
condition, and the energy per nucleon ($E/A$) of both $ud$QM and SQM must
exceed the lowest energy per nucleon 930 MeV. As a result, we provide the
maximum mass, minimum radius $R_{1.4}$ and minimum tidal deformation
$\Lambda_{1.4}$ of the hybrid stars as well as the maximum mass and radius of
the quark matter core with different $g$ values within the allowable regions
($E/A>930$ MeV) on the $g-B^{1/4}$ plane. Using the constraints from
astrophysical observations and heavy-ion experiments for comparison, our
results indicate that the recently discovered massive neutron stars be well
described as hybrid stars in the quasiparticle model, and confirm that the
sizable quark-matter cores ($R_{QC}>6.5$ km) containing the mixed phase can
appear in $2M_{\odot}$ massive stars.
","[{""version"":""v1"",""created"":""Tue, 2 May 2023 08:15:40 GMT""}]","2023-05-03"
"2305.01247","Marco T\'ulio Quintino","Simon Milz, Marco T\'ulio Quintino","Transformations between arbitrary (quantum) objects and the emergence of
  indefinite causality","31 pages, 8 figures",,,,"quant-ph","http://creativecommons.org/licenses/by/4.0/","  Many fundamental and key objects in quantum mechanics are linear mappings
between particular affine/linear spaces. This structure includes basic quantum
elements such as states, measurements, channels, instruments, non-signalling
channels and channels with memory, and also higher-order operations such as
superchannels, quantum combs, n-time processes, testers, and process matrices
which may not respect a definite causal order. Deducing and characterising
their structural properties in terms of linear and semidefinite constraints is
not only of foundational relevance, but plays an important role in enabling the
numerical optimization over sets of quantum objects and allowing simpler
connections between different concepts and objects. Here, we provide a general
framework to deduce these properties in a direct and easy to use way.
Additionally, while primarily guided by practical quantum mechanical
considerations, we extend our analysis to mappings between \textit{general}
linear/affine spaces and derive their properties, opening the possibility for
analysing sets which are not explicitly forbidden by quantum theory, but are
still not much explored. Together, these results yield versatile and readily
applicable tools for all tasks that require the characterization of linear
transformations, in quantum mechanics and beyond. As an application of our
methods, we discuss the emergence of indefinite causality in higher-order
quantum transformation.
","[{""version"":""v1"",""created"":""Tue, 2 May 2023 08:21:38 GMT""}]","2023-05-03"
"2305.01248","Vladislav Ryzhikov Dr","Marie Fortin, Boris Konev, Vladislav Ryzhikov, Yury Savateev, Frank
  Wolter, Michael Zakharyaschev","Reverse Engineering of Temporal Queries Mediated by LTL Ontologies","To be published in IJCAI 2023 proceedings",,,,"cs.LO cs.AI","http://creativecommons.org/licenses/by-sa/4.0/","  In reverse engineering of database queries, we aim to construct a query from
a given set of answers and non-answers; it can then be used to explore the data
further or as an explanation of the answers and non-answers. We investigate
this query-by-example problem for queries formulated in positive fragments of
linear temporal logic LTL over timestamped data, focusing on the design of
suitable query languages and the combined and data complexity of deciding
whether there exists a query in the given language that separates the given
answers from non-answers. We consider both plain LTL queries and those mediated
by LTL-ontologies.
","[{""version"":""v1"",""created"":""Tue, 2 May 2023 08:27:39 GMT""},{""version"":""v2"",""created"":""Thu, 4 May 2023 19:20:26 GMT""}]","2023-05-08"
"2305.01249","Kamil Jerabek","Kamil Je\v{r}\'abek, Libor Pol\v{c}\'ak","Network Error Logging: HTTP Archive Analysis",,,,,"cs.NI","http://creativecommons.org/licenses/by/4.0/","  Network Error Logging helps web server operators detect operational problems
in real-time to provide fast and reliable services. HTTP Archive provides
detail information of historical data on HTTP requests. This paper leverages
the data and provides a long term analysis of Network Error Logging deployment.
The deployment raised from 0 to 11.73 % (almost 2,250,000 unique domains) since
2019. Current deployment is dominated by Cloudflare. Although we observed
different policies, the default settings prevail. Third party collectors emerge
raising the diversity needed to gather sound data. Even so, many service deploy
self-hosted services. Moreover, we identify potentially malicious adversaries
deploy collectors on randomly-generated domains and shortened URLs.
","[{""version"":""v1"",""created"":""Tue, 2 May 2023 08:28:39 GMT""}]","2023-05-03"
"2305.01250","Lorena Acuna","Lorena Acuna, Magali Deleuil, Olivier Mousis","Interior-atmosphere modelling to assess the observability of rocky
  planets with JWST","15 pages, 9 figures. Accepted for publication in A&A",,,,"astro-ph.EP","http://creativecommons.org/licenses/by/4.0/","  Super-Earths present compositions dominated by refractory materials. However,
there is a degeneracy in their interior structure between a planet with no
atmosphere and a small Fe content, and a planet with a thin atmosphere and a
higher core mass fraction. To break this degeneracy, atmospheric
characterization observations are required. We present a self-consistent
interior-atmosphere model to constrain the volatile mass fraction, surface
pressure, and temperature of rocky planets with water and CO2 atmospheres.
These parameters obtained in our analysis can then be used to predict
observations in emission spectroscopy and photometry with JWST, which can
determine the presence of an atmosphere, and if present, its composition. To
obtain the bolometric emission and Bond albedo for an atmosphere in
radiative-convective equilibrium, we present the k-uncorrelated approximation
for fast computations within our retrieval on planetary mass, radius and host
stellar abundances. For the generation of emission spectra, we use our
k-correlated atmospheric model. An adaptive MCMC is used for an efficient
sampling of the parameter space at low volatile mass fractions. We show how to
use our modelling approach to predict observations with JWST for TRAPPIST-1 c
and 55 Cancri e. TRAPPIST-1 c's most likely scenario is a bare surface,
although the presence of an atmosphere cannot be ruled out. If the emission in
the MIRI F1500 filter is 731 ppm or higher, there would be a water-rich
atmosphere. For fluxes between 730 and 400 ppm, no atmosphere is present, while
low emission fluxes (300 ppm) indicate a CO2-dominated atmosphere. In the case
of 55 Cancri e, a combined spectrum with NIRCam and MIRI LRS may present high
uncertainties at wavelengths between 3 and 3.7 $\mu$m. However, this does not
affect the identification of H2O and CO2 because they do not present spectral
features in this wavelength range.
","[{""version"":""v1"",""created"":""Tue, 2 May 2023 08:30:11 GMT""}]","2023-05-03"
"2305.01251","David Vo\v{s}ahl\'ik","David Vo\v{s}ahl\'ik and Tom\'a\v{s} Hani\v{s}","Traction Control Allocation Employing Vehicle Motion Feedback Controller
  for Four-wheel-independent-drive Vehicle",,,,,"eess.SY cs.SY","http://creativecommons.org/publicdomain/zero/1.0/","  A novel vehicle traction algorithm solving the traction force allocation
problem based on vehicle center point motion feedback controller is proposed in
this paper. The center point motion feedback control system proposed utilizes
individual wheel torque actuation assuming all wheels are individually driven.
The approach presented is an alternative to the various direct
optimization-based traction force/torque allocation schemes. The proposed
system has many benefits, such as significant reduction of the algorithm
complexity by merging most traction system functionalities into one. Such a
system enables significant simplification, unification, and standardization of
powertrain control design. Moreover, many signals needed by conventional
traction force allocation methods are not required to be measured or estimated
with the proposed approach, which are among others vehicle mass, wheel loading
(normal force), and vehicle center of gravity location. Vehicle center point
trajectory setpoints and measurements are transformed to each wheel, where the
tracking is ensured using the wheel torque actuation. The proposed control
architecture performance and analysis are shown using the nonlinear twin-track
vehicle model implemented in Matlab $\&$ Simulink environment. The performance
is then validated using high fidelity FEE CTU in Prague EFORCE formula model
implemented in IPG CarMaker environment with selected test scenarios. Finally,
the results of the proposed control allocation are compared to the
state-of-the-art approach.
","[{""version"":""v1"",""created"":""Tue, 2 May 2023 08:30:39 GMT""}]","2023-05-03"
"2305.01252","Jia-Hao Syu","Jia-Hao Syu and Jerry Chun-Wei Lin and Marcin Fojcik and Rafa{\l}
  Cupek","HTPS: Heterogeneous Transferring Prediction System for Healthcare
  Datasets",,,,,"cs.LG","http://arxiv.org/licenses/nonexclusive-distrib/1.0/","  Medical internet of things leads to revolutionary improvements in medical
services, also known as smart healthcare. With the big healthcare data, data
mining and machine learning can assist wellness management and intelligent
diagnosis, and achieve the P4-medicine. However, healthcare data has high
sparsity and heterogeneity. In this paper, we propose a Heterogeneous
Transferring Prediction System (HTPS). Feature engineering mechanism transforms
the dataset into sparse and dense feature matrices, and autoencoders in the
embedding networks not only embed features but also transfer knowledge from
heterogeneous datasets. Experimental results show that the proposed HTPS
outperforms the benchmark systems on various prediction tasks and datasets, and
ablation studies present the effectiveness of each designed mechanism.
Experimental results demonstrate the negative impact of heterogeneous data on
benchmark systems and the high transferability of the proposed HTPS.
","[{""version"":""v1"",""created"":""Tue, 2 May 2023 08:31:29 GMT""}]","2023-05-03"
"2305.01253","Xiachong Feng","Xiachong Feng, Xiaocheng Feng, Bing Qin","The Role of Summarization in Generative Agents: A Preliminary
  Perspective",,,,,"cs.CL","http://creativecommons.org/licenses/by/4.0/","  Generative agents that simulate human society show tremendous potential for
further research and practical applications. Specifically, the generative agent
architecture comprising several meticulously designed modules constitutes the
most critical component. To facilitate progress in this research, this report
presents our integrated perspective on comprehending generative agents through
summarization, since we believe summarization is the most fundamental and
indispensable capacity of generative agents manifested across diverse
scenarios. We hope this report can provide insight into understanding the
importance of summarization capacity in generative agents and motivate future
research.
","[{""version"":""v1"",""created"":""Tue, 2 May 2023 08:35:09 GMT""}]","2023-05-03"
"2305.01254","Xiaodong Cheng","Xiaodong Cheng, Tudor C. Ionescu, Monica P\u{a}tra\c{s}cu","Time-Domain Moment Matching for Second-Order Systems",,,,,"math.OC","http://creativecommons.org/licenses/by/4.0/","  This paper studies a structure-preserving model reduction problem for
large-scale second-order dynamical systems via the framework of time-domain
moment matching. The moments of a second-order system are interpreted as the
solutions of second-order Sylvester equations, which leads to families of
parameterized second-order reduced models that match the moments of an original
second-order system at selected interpolation points. Based on this, a
two-sided moment matching problem is addressed, providing a unique second-order
reduced system that match two distinct sets interpolation points. Furthermore,
we also construct the reduced second-order systems that matches the moments of
both zero and first order derivative of the original second-order system.
Finally, the Loewner framework is extended to the second-order systems, where
two parameterized families of models are presented that retain the second-order
structure and interpolate sets of tangential data.
","[{""version"":""v1"",""created"":""Tue, 2 May 2023 08:35:14 GMT""}]","2023-05-03"
"2305.01255","Markus Sch\""on","Markus Sch\""on, Michael Buchholz, Klaus Dietmayer","RT-K-Net: Revisiting K-Net for Real-Time Panoptic Segmentation","Accepted at 2023 IEEE Intelligent Vehicles Symposium",,,,"cs.CV","http://arxiv.org/licenses/nonexclusive-distrib/1.0/","  Panoptic segmentation is one of the most challenging scene parsing tasks,
combining the tasks of semantic segmentation and instance segmentation. While
much progress has been made, few works focus on the real-time application of
panoptic segmentation methods. In this paper, we revisit the recently
introduced K-Net architecture. We propose vital changes to the architecture,
training, and inference procedure, which massively decrease latency and improve
performance. Our resulting RT-K-Net sets a new state-of-the-art performance for
real-time panoptic segmentation methods on the Cityscapes dataset and shows
promising results on the challenging Mapillary Vistas dataset. On Cityscapes,
RT-K-Net reaches 60.2 % PQ with an average inference time of 32 ms for full
resolution 1024x2048 pixel images on a single Titan RTX GPU. On Mapillary
Vistas, RT-K-Net reaches 33.2 % PQ with an average inference time of 69 ms.
Source code is available at https://github.com/markusschoen/RT-K-Net.
","[{""version"":""v1"",""created"":""Tue, 2 May 2023 08:36:02 GMT""}]","2023-05-03"
"2305.01256","Koya Murakami","Koya Murakami, Atsushi J. Nishizawa, Kentaro Nagamine, Ikko Shimizu","Impact of astrophysical effects on the dark matter mass constraint with
  21cm intensity mapping","17 pages, 12 figures",,,,"astro-ph.CO astro-ph.GA","http://arxiv.org/licenses/nonexclusive-distrib/1.0/","  We present an innovative approach to constraining the non-cold dark matter
model using a convolutional neural network (CNN). We perform a suite of
hydrodynamic simulations with varying dark matter particle masses and generate
mock 21cm radio intensity maps to trace the dark matter distribution. Our
proposed method complements the traditional power spectrum analysis. We compare
our CNN classification results with those from the power spectrum of the
differential brightness temperature map of 21cm radiation, and find that the
CNN outperforms the latter. Moreover, we investigate the impact of baryonic
physics on the dark matter model constraint, including star formation,
self-shielding of HI gas, and UV background model. We find that these effects
may introduce some contamination in the dark matter constraint, but they are
insignificant when compared to the realistic system noise of the SKA
instruments.
","[{""version"":""v1"",""created"":""Tue, 2 May 2023 08:37:46 GMT""}]","2023-05-03"
