"2305.08079","Jiancheng An","Jiancheng An, Chao Xu, Derrick Wing Kwan Ng, George C.
  Alexandropoulos, Chongwen Huang, Chau Yuen, and Lajos Hanzo","Stacked Intelligent Metasurfaces for Efficient Holographic MIMO
  Communications in 6G","17 pages, 17 figures, 1 table, accepted by IEEE JSAC",,,,"cs.IT eess.SP math.IT","http://arxiv.org/licenses/nonexclusive-distrib/1.0/","  The revolutionary technology of \emph{Stacked Intelligent Metasurfaces (SIM)}
has been recently shown to be capable of carrying out advanced signal
processing directly in the native electromagnetic (EM) wave domain. An SIM is
fabricated by a sophisticated amalgam of multiple stacked metasurface layers,
which may outperform its single-layer metasurface counterparts, such as
reconfigurable intelligent surfaces (RISd) and metasurface lenses. We harness
this new SIM concept for implementing efficient holographic multiple-input
multiple-output (HMIMO) communications that dot require excessive
radio-frequency (RF) chains, which constitutes a substantial benefit compared
to existing implementations. We first present an HMIMO communication system
based on a pair of SIMs at the transmitter (TX) and receiver (RX),
respectively. In sharp contrast to the conventional MIMO designs, the
considered SIMs are capable of automatically accomplishing transmit precoding
and receiver combining, as the EM waves propagate through them. As such, each
information data stream can be directly radiated and recovered from the
corresponding transmit and receive ports. Secondly, we formulate the problem of
minimizing the error between the actual end-to-end SIMs'parametrized channel
matrix and the target diagonal one, with the latter representing a flawless
interference-free system of parallel subchannels. This is achieved by jointly
optimizing the phase shifts associated with all the metasurface layers of both
the TX-SIM and RX-SIM. We then design a gradient descent algorithm to solve the
resultant non-convex problem. Furthermore, we theoretically analyze the HMIMO
channel capacity bound and provide some useful fundamental insights. Extensive
simulation results are provided for characterizing our SIM-based HMIMO system,
quantifying its substantial performance benefits.
","[{""version"":""v1"",""created"":""Sun, 14 May 2023 06:09:38 GMT""}]","2023-05-16"
"2305.08080","Darshit Satishkumar Patel","Darshit Patel and Azim Eskandarian","Probabilistic RRT Connect with intermediate goal selection for online
  planning of autonomous vehicles","Submitted to IFAC Modelling, Estimation and Control Conference 2023.
  6 Pages and 8 Figures",,,,"cs.RO","http://creativecommons.org/licenses/by-sa/4.0/","  Rapidly Exploring Random Trees (RRT) is one of the most widely used
algorithms for motion planning in the field of robotics. To reduce the
exploration time, RRT-Connect was introduced where two trees are simultaneously
formed and eventually connected. Probabilistic RRT used the concept of position
probability map to introduce goal biasing for faster convergence. In this
paper, we propose a modified method to combine the pRRT and RRT-Connect
techniques and obtain a feasible trajectory around the obstacles quickly.
Instead of forming a single tree from the start point to the destination point,
intermediate goal points are selected around the obstacles. Multiple trees are
formed to connect the start, destination, and intermediate goal points. These
partial trees are eventually connected to form an overall safe path around the
obstacles. The obtained path is tracked using an MPC + Stanley controller which
results in a trajectory with control commands at each time step. The
trajectories generated by the proposed methods are more optimal and in
accordance with human intuition. The algorithm is compared with the standard
RRT and pRRT for studying its relative performance.
","[{""version"":""v1"",""created"":""Sun, 14 May 2023 06:26:10 GMT""}]","2023-05-16"
"2305.08081","Ke Ma","Ke Ma, Yiliang Sang, Yang Ming, Jin Lian, Chang Tian, Zhaocheng Wang","Deep Learning Empowered Type-II Codebook: New Paradigm for Enhancing CSI
  Feedback","This updated version has been submitted to IEEE for possible
  publication. Copyright may be transferred without notice",,,,"cs.IT cs.AI math.IT","http://arxiv.org/licenses/nonexclusive-distrib/1.0/","  Deep learning based channel state information (CSI) feedback in frequency
division duplex systems has drawn much attention in both academia and industry.
In this paper, we focus on integrating the Type-II codebook in the beyond
fifth-generation (B5G) wireless systems with deep learning to enhance the
performance of CSI feedback. In contrast to its counterpart in Release 16, the
Type-II codebook in Release 17 (R17) exploits the angular-delay-domain partial
reciprocity between uplink and downlink channels and selects part of
angular-delay-domain ports for measuring and feeding back the downlink CSI,
where the performance of the conventional deep learning methods is limited due
to the deficiency of sparse structures. To address this issue, we propose the
new paradigm of adopting deep learning to improve the performance of R17
Type-II codebook. Firstly, considering the relatively low signal-to-noise ratio
of uplink channels, deep learning is utilized to refine the selection of the
dominant angular-delay-domain ports, where the focal loss is harnessed to solve
the class imbalance problem. Secondly, we propose to reconstruct the downlink
CSI by way of deep learning based on the feedback of R17 Type-II codebook at
the base station, where the information of sparse structures can be effectively
leveraged. Finally, a weighted shortcut module is designed to facilitate the
accurate reconstruction, and a two-stage loss function with the combination of
the mean squared error and sum rate is proposed for adapting to actual
multi-user scenarios. Simulation results demonstrate that our proposed
angular-delay-domain port selection and CSI reconstruction paradigm can improve
the sum rate performance by more than 10% compared with the traditional R17
Type-II codebook and deep learning benchmarks.
","[{""version"":""v1"",""created"":""Sun, 14 May 2023 06:27:35 GMT""},{""version"":""v2"",""created"":""Wed, 31 May 2023 02:08:38 GMT""}]","2023-06-01"
"2305.08082","Parth Bambhaniya","Dhruv Arora, Parth Bambhaniya, Dipanjan Dey and Pankaj S. Joshi","Tidal forces in the Simpson-Visser black-bounce and wormhole spacetimes","12 pages, 17 figures",,,,"gr-qc","http://creativecommons.org/licenses/by/4.0/","  The concept of regular black holes has gained attention in recent years,
especially in the context of quantum gravity theories. In these theories, the
existence of singularities is paradoxical as they represent a breakdown of the
laws of physics. Motivated by the recent developments in this area, we study
the tidal force effects in one such family of regular geometries described by
the Simpson-Visser metric. We find the radial and angular force profiles for a
radially in-falling particle in this spacetime and calculate the variation of
the geodesic separation vector with the radial coordinate using two different
initial conditions. These results are then compared with that of Schwarzschild
black hole spacetime. We show that for a regular black hole, both radial and
angular tidal forces show a peak outside the horizon and then fall to
ultimately switch their behavior from stretching to compression and vice-versa.
Also, they are finite at $r=0$ unlike the Schwarzschild spacetime. It is also
seen that the angular deviation profile shows an oscillating behavior for a
particular initial condition. Our analysis can be used to distinguish between
regular black hole, one-way and two-way wormholes and a singular black hole
spacetimes.
","[{""version"":""v1"",""created"":""Sun, 14 May 2023 06:30:12 GMT""}]","2023-05-16"
"2305.08083","Egor Frolov","A. Buzulutskov, E. Frolov, E. Borisova, V. Nosov, V. Oleynikov, A.
  Sokolov","Unraveling the puzzle of slow components in two-phase argon detectors
  for dark matter searches using Thick Gas Electron Multiplier","8 pages, 11 figures",,,,"physics.ins-det astro-ph.IM hep-ex","http://arxiv.org/licenses/nonexclusive-distrib/1.0/","  The effect of proportional electroluminescence (EL) is used to record the
primary ionization signal (S2) in the gas phase of two-phase argon detectors
for dark matter particle (WIMP) searches and low-energy neutrino experiments.
Our previous studies of EL time properties revealed the presence of two unusual
slow components in S2 signal of two-phase argon detector, with time constants
of about 4-5 $\mu$s and 50 $\mu$s. The puzzle of slow components is that their
time constants and contributions to the overall signal increase with electric
field (starting from a certain threshold), which cannot be explained by any of
the known mechanisms of photon and electron emission in two-phase media. There
are indications that these slow components result from delayed electrons,
temporarily trapped during their drift in the EL gap on metastable negative
argon ions of yet unknown nature. In this work, this hypothesis is convincingly
confirmed by studying the time properties of electroluminescence in a Thick Gas
Electron Multiplier (THGEM) coupled to the EL gap of two-phase argon detector.
In particular, an unusual slow component in EL signal, similar to that observed
in the EL gap, was observed in THGEM itself. In addition, with the help of
THGEM operated in electron multiplication mode, the slow component was observed
directly in the charge signal, unambiguously confirming the effect of trapped
electrons in S2 signal. These results will help to unravel the puzzle of slow
components in two-phase argon detectors and thus to understand the background
in low-mass WIMP searches.
","[{""version"":""v1"",""created"":""Sun, 14 May 2023 06:59:41 GMT""}]","2023-05-16"
"2305.08084","Egor Frolov","A. Buzulutskov, E. Frolov, E. Borisova, V. Nosov, V. Oleynikov, A.
  Sokolov","First observation of neutral bremsstrahlung electroluminescence in
  liquid argon","6 pages, 4 figures",,,,"physics.ins-det hep-ex","http://arxiv.org/licenses/nonexclusive-distrib/1.0/","  Recent discovery of additional mechanism of electroluminescence (EL) in noble
gases due to neutral bremsstrahlung (NBrS) effect led to a prediction that NBrS
EL should be present in noble liquids as well. A rigorous theory of NBrS EL in
noble liquids was developed accordingly in the framework of Cohen-Lekner and
Atrazhev approach. In this work, we confirm this prediction: for the first
time, visible-range EL has been observed in liquid Ar at electric fields
reaching 90~kV/cm, using Gas Electron Multiplier (GEM) and Thick GEM (THGEM)
structures. Absolute light yields of the EL were measured and found to be in
excellent agreement with the theory, provided that momentum-transfer cross
section of electron-atom scattering (instead of energy-transfer one) is used
for calculation of NBrS cross section.
","[{""version"":""v1"",""created"":""Sun, 14 May 2023 07:08:05 GMT""}]","2023-05-16"
"2305.08085","Tommaso Ruggeri","Tommaso Ruggeri","Eckart equations, Maxwellian iteration and Relativistic Causal Theories
  of Divergence type","16 pages. In press in Philosophical Transactions A",,,,"math-ph cond-mat.stat-mech gr-qc math.MP","http://creativecommons.org/licenses/by/4.0/","  We consider a general causal relativistic theory of divergence type in the
framework of Rational Extended Thermodynamics (RET) for a compressible,
possibly dense, gas. We require that the system converges in the Maxwellian
iteration's first step to the parabolic Eckart equations. This requirement
implies a constraint between the two coefficients present in the triple tensor
evaluated at equilibrium. Moreover, the production tensor is determined for
prescript thermal and caloric state equations and given heat conductivity,
shear, and bulk viscosities. In the second part, we prove that if the original
hyperbolic system satisfies the universal principles of RET, as can be put in
the symmetric form using the \emph{main field}, it always satisfies the
previous compatibility condition. Therefore any causal system of divergence
type that satisfies the entropy principle with a convex entropy converges to
the Eckart system in the Maxwellian iteration also when we have no information
at the mesoscopic scale from the kinetic theory.
  The obtained results are tested on the RET theories of rarefied monatomic and
polyatomic gases.
","[{""version"":""v1"",""created"":""Sun, 14 May 2023 07:27:50 GMT""}]","2023-05-16"
"2305.08086","Anupam Mondal","Anupam Mondal, Pritam Chandra Pramanik","A note on an application of discrete Morse theoretic techniques on the
  complex of disconnected graphs","5 pages, 3 figures",,,,"math.CO math.AT","http://arxiv.org/licenses/nonexclusive-distrib/1.0/","  Robin Forman's highly influential 2002 paper titled A User's Guide to
Discrete Morse Theory presents an overview of the subject in a very readable
manner. As a proof of concept, the author determines the topology (homotopy
type) of the abstract simplicial complex of disconnected graphs of order $n$
(which was previously done by Victor Vassiliev using classical topological
methods) using discrete Morse theoretic techniques, which are purely
combinatorial in nature. The techniques involve the construction (and
verification) of a discrete gradient vector field on the complex. However, the
verification part relies on a claim that doesn't seem to hold. In this note, we
provide a couple of counterexamples against this specific claim and also an
alternative proof of the claim that the constructed discrete vector field is
indeed a gradient vector field.
","[{""version"":""v1"",""created"":""Sun, 14 May 2023 07:28:25 GMT""}]","2023-05-16"
"2305.08087","Arim Song","Eric Ragoucy, Arim Song, Uhi Rinn Suh","$N=2$ supersymmetric structures on classical $W$-algebras",,,,,"math-ph math.MP","http://creativecommons.org/licenses/by/4.0/","  We describe an $N=2$ supersymmetric Poisson vertex algebra structure of $N=1$
(resp. $N=0$) classical $W$-algebra associated with $\mathfrak{sl}(n+1|n)$ and
the odd (resp. even) principal nilpotent element. This $N=2$ supersymmetric
structure is connected to the principal $\mathfrak{sl}(2|1)$-embedding in
$\mathfrak{sl}(n+1|n)$ superalgebras, which are the only basic Lie
superalgebras that admit such a principal embedding.
","[{""version"":""v1"",""created"":""Sun, 14 May 2023 07:30:42 GMT""}]","2023-05-16"
"2305.08088","Qiushi Sun","Qiushi Sun, Chengcheng Han, Nuo Chen, Renyu Zhu, Jingyang Gong, Xiang
  Li, Ming Gao","Make Prompt-based Black-Box Tuning Colorful: Boosting Model
  Generalization from Three Orthogonal Perspectives","Work in progress",,,,"cs.CL cs.AI","http://creativecommons.org/licenses/by/4.0/","  Large language models (LLMs) have shown increasing power on various natural
language processing (NLP) tasks. However, tuning these models for downstream
tasks usually needs exorbitant costs or is unavailable due to commercial
considerations. Recently, black-box tuning has been proposed to address this
problem by optimizing task-specific prompts without accessing the gradients and
hidden representations. However, most existing works have yet fully exploited
the potential of gradient-free optimization under the scenario of few-shot
learning. In this paper, we describe BBT-RGB, a suite of straightforward and
complementary techniques for enhancing the efficiency and performance of
black-box optimization. Specifically, our method includes three plug-and-play
components: (1) Two-stage derivative-free optimization strategy that
facilitates fast convergence and mitigates overfitting; (2) Automatic
verbalizer construction with its novel usage under few-shot settings; (3)
Better prompt initialization policy based on instruction search and
auto-selected demonstration. Extensive experiments across various tasks on
natural language understanding and inference demonstrate the effectiveness of
our method. Our codes are publicly available at
https://github.com/QiushiSun/BBT-RGB.
","[{""version"":""v1"",""created"":""Sun, 14 May 2023 07:33:59 GMT""}]","2023-05-16"
"2305.08089","Davoud Kamani","Hamidreza Daniali and Davoud Kamani","Open String Pair Production from the Interacting Dressed-Angled
  D-Strings","13 pages, LATEX2e, no figure","Eur. Phys. J. C (2023) 83:408","10.1140/epjc/s10052-023-11589-6",,"hep-th","http://creativecommons.org/licenses/by/4.0/","  We calculate the rate of the open string pair production from the interaction
of two non-intersecting D-strings at angle. The D-strings have been equipped
with the $U(1)$ gauge potentials in the presence of the Kalb-Ramond field. This
rate will be discussed when the D-strings intersect each other. Our
computations is in the framework of the bosonic string theory.
","[{""version"":""v1"",""created"":""Sun, 14 May 2023 07:45:48 GMT""}]","2023-05-19"
"2305.08090","Umberto Pappalettera","Martina Hofmanov\'a, Umberto Pappalettera, Rongchan Zhu, Xiangchan Zhu","Anomalous and total dissipation due to advection by solutions of
  randomly forced Navier-Stokes equations","24 pages",,,,"math.AP math.PR","http://arxiv.org/licenses/nonexclusive-distrib/1.0/","  We show the existence of a velocity field $v$, solution of (randomly) forced
Navier-Stokes equations, which produces total dissipation of kinetic energy in
finite time when advecting a passive scalar $\rho$. The total dissipation holds
true uniformly in the viscosity parameter and the initial conditions $\rho_0$,
in particular the dissipation is anomalous. Dissipation induced by single
realizations of $v$ is also discussed. Our results extend to the case when
$\rho$ is replaced by a solution to the two or three dimensional
(deterministic) Navier-Stokes equations advected by $v$.
","[{""version"":""v1"",""created"":""Sun, 14 May 2023 08:02:54 GMT""},{""version"":""v2"",""created"":""Sun, 21 May 2023 07:27:01 GMT""}]","2023-05-23"
"2305.08091","Zu-Cheng Chen","Yu-Mei Wu, Zu-Cheng Chen, and Qing-Guo Huang","Pulsar timing residual induced by ultralight tensor dark matter","12 pages, 3 figures",,,,"hep-ph astro-ph.CO astro-ph.HE gr-qc","http://creativecommons.org/licenses/by/4.0/","  Ultralight boson fields, with a mass around $10^{-23}\text{eV}$, are
promising candidates for the elusive cosmological dark matter. These fields
induce a periodic oscillation of the spacetime metric in the nanohertz
frequency band, which is detectable by pulsar timing arrays. In this paper, we
investigate the gravitational effect of ultralight tensor dark matter on the
arrival time of radio pulses from pulsars. We find that the pulsar timing
signal caused by tensor dark matter exhibits a different angular dependence
than that by scalar and vector dark matter, making it possible to distinguish
the ultralight dark matter signal with different spins. Combining the
gravitational effect and the coupling effect of ultralight tensor dark matter
with standard model matter provides a complementary way to constrain the
coupling parameter $\alpha$. We estimate $\alpha \lesssim 10^{-6}\sim 10^{-5}$
in the mass range $m<5\times 10^{-23}\mathrm{eV}$ with current pulsar timing
array.
","[{""version"":""v1"",""created"":""Sun, 14 May 2023 08:04:57 GMT""}]","2023-05-16"
"2305.08092","Wentao Hu","Wentao Hu, Xiurong Jiang, Jiarun Liu, Yuqi Yang, Hui Tian","Meta-DM: Applications of Diffusion Models on Few-Shot Learning",,,,,"cs.LG cs.CV","http://arxiv.org/licenses/nonexclusive-distrib/1.0/","  In the field of few-shot learning (FSL), extensive research has focused on
improving network structures and training strategies. However, the role of data
processing modules has not been fully explored. Therefore, in this paper, we
propose Meta-DM, a generalized data processing module for FSL problems based on
diffusion models. Meta-DM is a simple yet effective module that can be easily
integrated with existing FSL methods, leading to significant performance
improvements in both supervised and unsupervised settings. We provide a
theoretical analysis of Meta-DM and evaluate its performance on several
algorithms. Our experiments show that combining Meta-DM with certain methods
achieves state-of-the-art results.
","[{""version"":""v1"",""created"":""Sun, 14 May 2023 08:05:30 GMT""}]","2023-05-16"
"2305.08093","Beatriz Cabrero-Daniel","Beatriz Cabrero-Daniel","AI for Agile development: a Meta-Analysis","8 pages, 2 figures, 24th International Conference on Agile Software
  Development. AI-Assisted Agile Software Development Research Workshop",,,,"cs.SE cs.AI","http://creativecommons.org/licenses/by-nc-nd/4.0/","  This study explores the benefits and challenges of integrating Artificial
Intelligence with Agile software development methodologies, focusing on
improving continuous integration and delivery. A systematic literature review
and longitudinal meta-analysis of the retrieved studies was conducted to
analyse the role of Artificial Intelligence and it's future applications within
Agile software development. The review helped identify critical challenges,
such as the need for specialised socio-technical expertise. While Artificial
Intelligence holds promise for improved software development practices, further
research is needed to better understand its impact on processes and
practitioners, and to address the indirect challenges associated with its
implementation.
","[{""version"":""v1"",""created"":""Sun, 14 May 2023 08:10:40 GMT""}]","2023-05-16"
"2305.08094","Ahmed Elliethy","Eslam Mostafa, Hussein A. Aly, Ahmed Elliethy","Accelerating genetic optimization of nonlinear model predictive control
  by learning optimal search space size",,,,,"math.OC cs.CC cs.NE cs.RO","http://creativecommons.org/licenses/by/4.0/","  Nonlinear model predictive control (NMPC) solves a multivariate optimization
problem to estimate the system's optimal control inputs in each control cycle.
Such optimization is made more difficult by several factors, such as
nonlinearities inherited in the system, highly coupled inputs, and various
constraints related to the system's physical limitations. These factors make
the optimization to be non-convex and hard to solve traditionally. Genetic
algorithm (GA) is typically used extensively to tackle such optimization in
several application domains because it does not involve differential
calculation or gradient evaluation in its solution estimation. However, the
size of the search space in which the GA searches for the optimal control
inputs is crucial for the applicability of the GA with systems that require
fast response. This paper proposes an approach to accelerate the genetic
optimization of NMPC by learning optimal search space size. The proposed
approach trains a multivariate regression model to adaptively predict the best
smallest search space in every control cycle. The estimated best smallest size
of search space is fed to the GA to allow for searching the optimal control
inputs within this search space. The proposed approach not only reduces the
GA's computational time but also improves the chance of obtaining the optimal
control inputs in each cycle. The proposed approach was evaluated on two
nonlinear systems and compared with two other genetic-based NMPC approaches
implemented on the GPU of a Nvidia Jetson TX2 embedded platform in a
processor-in-the-loop (PIL) fashion. The results show that the proposed
approach provides a 39-53\% reduction in computational time. Additionally, it
increases the convergence percentage to the optimal control inputs within the
cycle's time by 48-56\%, resulting in a significant performance enhancement.
The source code is available on GitHub.
","[{""version"":""v1"",""created"":""Sun, 14 May 2023 08:10:49 GMT""}]","2023-05-16"
"2305.08095","Yuxuan He","Yuxuan He, Jia Liu, Xiaolin Ma, Xiao-Ping Wang","Exploring Ultralight Scalar Assistance in Sterile Neutrino Dark Matter:
  Cold Spectrum and Unusual X/Gamma-ray Signatures","15 pages, 5 figures",,,,"hep-ph astro-ph.CO","http://arxiv.org/licenses/nonexclusive-distrib/1.0/","  We present a scalar-driven sterile neutrino production model where the
interaction with the ultralight scalar field modifies the oscillation
production of sterile neutrinos in the early universe. The model effectively
suppresses the production of sterile neutrinos at low temperatures due to the
heavy scalar mass, resulting in a colder matter power spectrum that avoids
constraints from small-scale structure observations. In this model, the
dominant dark matter relic is from sterile neutrinos, with only a small
fraction originating from the ultralight scalar. Furthermore, the model
predicts a detectable X/Gamma-ray flux proportional to the cubic density of
local sterile neutrinos for a light scalar mass due to the light scalar
coupling tosterile neutrinos. This distinguishes our model from normal decaying
dark matter, which has a linear dependence on the density. In addition, the
model predicts a potential low-energy monochromatic neutrino signal that can be
detectable by future neutrino telescopes.
","[{""version"":""v1"",""created"":""Sun, 14 May 2023 08:20:14 GMT""}]","2023-05-16"
