"2305.07955","Hasan Sabri Melihcan Erol","H.S. Melihcan Erol, Erixhen Sula, Lizhong Zheng","On Semi-Supervised Estimation of Distributions","Presented in ISIT-2023",,,,"math.ST cs.IT math.IT stat.TH","http://arxiv.org/licenses/nonexclusive-distrib/1.0/","  We study the problem of estimating the joint probability mass function (pmf)
over two random variables. In particular, the estimation is based on the
observation of $m$ samples containing both variables and $n$ samples missing
one fixed variable. We adopt the minimax framework with $l^p_p$ loss functions,
and we show that the composition of uni-variate minimax estimators achieves
minimax risk with the optimal first-order constant for $p \ge 2$, in the regime
$m = o(n)$.
","[{""version"":""v1"",""created"":""Sat, 13 May 2023 16:01:37 GMT""},{""version"":""v2"",""created"":""Tue, 16 May 2023 00:41:36 GMT""}]","2023-05-17"
"2305.07956","Mark Sellke","Mark Sellke","The Threshold Energy of Low Temperature Langevin Dynamics for Pure
  Spherical Spin Glasses","24 pages",,,,"cond-mat.dis-nn math-ph math.MP math.PR","http://creativecommons.org/licenses/by/4.0/","  We study the Langevin dynamics for spherical $p$-spin models, focusing on the
short time regime described by the Cugliandolo-Kurchan equations. Confirming a
1999 conjecture of Biroli, we show the asymptotic energy achieved is exactly
$E_{\infty}(p)=2\sqrt{\frac{p-1}{p}}$ in the low temperature limit. The upper
bound uses hardness results for Lipschitz optimization algorithms and applies
for all temperatures. For the lower bound, we prove the dynamics reaches and
stays above the lowest energy of any approximate local maximum. In fact the
latter behavior holds for any Hamiltonian obeying natural smoothness estimates,
even with disorder-dependent initialization and on exponential time-scales.
","[{""version"":""v1"",""created"":""Sat, 13 May 2023 16:05:12 GMT""}]","2023-05-16"
"2305.07957","Gabriel Landi Dr.","Gabriel T. Landi","Patterns in the jump-channel statistics of boundary driven quantum
  chains",,,,,"quant-ph cond-mat.stat-mech","http://arxiv.org/licenses/nonexclusive-distrib/1.0/","  We consider the stochastic process stemming from continuously measuring a
quantum system with multiple jump channels. The process is described not only
by the random times between jumps, but also by a sequence of emitted symbols
representing each jump channel. We establish the fundamental properties of this
sequence of symbols. First, we determine a special set of superoperators that
completely govern the dynamics, and provide an efficient way for computing
multi-point distributions and for simulating stochastic trajectories. We also
determine the conditions for the stochastic process to be stationary and show
that the memory between distant emissions is determined by the spectral
properties of a specific superoperator. Finally, we show that some systems
support a pattern, where the evolution after each jump runs over a closed set
of states. This, as we argue, can be used to greatly facilitate our prediction
of future outcomes. We illustrate these ideas by studying transport through a
boundary-driven one-dimensional XY spin chain. We show that the statistics
depends dramatically on the chain size. And that the presence of pairing terms
in the Hamiltonian destroy any existing patterns.
","[{""version"":""v1"",""created"":""Sat, 13 May 2023 16:13:50 GMT""}]","2023-05-16"
"2305.07958","Thiago D. Sim\~ao","Patrick Wienh\""oft, Marnix Suilen, Thiago D. Sim\~ao, Clemens
  Dubslaff, Christel Baier, Nils Jansen","More for Less: Safe Policy Improvement With Stronger Performance
  Guarantees","Accecpted at IJCAI 2023",,,,"cs.LG cs.AI","http://creativecommons.org/licenses/by/4.0/","  In an offline reinforcement learning setting, the safe policy improvement
(SPI) problem aims to improve the performance of a behavior policy according to
which sample data has been generated. State-of-the-art approaches to SPI
require a high number of samples to provide practical probabilistic guarantees
on the improved policy's performance. We present a novel approach to the SPI
problem that provides the means to require less data for such guarantees.
Specifically, to prove the correctness of these guarantees, we devise implicit
transformations on the data set and the underlying environment model that serve
as theoretical foundations to derive tighter improvement bounds for SPI. Our
empirical evaluation, using the well-established SPI with baseline
bootstrapping (SPIBB) algorithm, on standard benchmarks shows that our method
indeed significantly reduces the sample complexity of the SPIBB algorithm.
","[{""version"":""v1"",""created"":""Sat, 13 May 2023 16:22:21 GMT""}]","2023-05-16"
"2305.07959","Tommaso Aldinucci","Tommaso Aldinucci","A Novel Memetic Strategy for Optimized Learning of Classification Trees",,,,,"cs.LG stat.CO","http://arxiv.org/licenses/nonexclusive-distrib/1.0/","  Given the increasing interest in interpretable machine learning,
classification trees have again attracted the attention of the scientific
community because of their glass-box structure. These models are usually built
using greedy procedures, solving subproblems to find cuts in the feature space
that minimize some impurity measures. In contrast to this standard greedy
approach and to the recent advances in the definition of the learning problem
through MILP-based exact formulations, in this paper we propose a novel
evolutionary algorithm for the induction of classification trees that exploits
a memetic approach that is able to handle datasets with thousands of points.
Our procedure combines the exploration of the feasible space of solutions with
local searches to obtain structures with generalization capabilities that are
competitive with the state-of-the-art methods.
","[{""version"":""v1"",""created"":""Sat, 13 May 2023 16:29:10 GMT""}]","2023-05-16"
"2305.07960","Ozer Can Devecioglu","Ozer Can Devecioglu, Serkan Kiranyaz, Amer Elhmes, Sadok Sassi, Turker
  Ince, Onur Avci, Mohammad Hesam Soleimani-Babakamali, Ertugrul Taciroglu, and
  Moncef Gabbouj","Sound-to-Vibration Transformation for Sensorless Motor Health Monitoring",,,,,"cs.SD cs.HC eess.AS","http://creativecommons.org/licenses/by/4.0/","  Automatic sensor-based detection of motor failures such as bearing faults is
crucial for predictive maintenance in various industries. Numerous
methodologies have been developed over the years to detect bearing faults.
Despite the appearance of numerous different approaches for diagnosing faults
in motors have been proposed, vibration-based methods have become the de facto
standard and the most commonly used techniques. However, acquiring reliable
vibration signals, especially from rotating machinery, can sometimes be
infeasibly difficult due to challenging installation and operational conditions
(e.g., variations on accelerometer locations on the motor body), which will not
only alter the signal patterns significantly but may also induce severe
artifacts. Moreover, sensors are costly and require periodic maintenance to
sustain a reliable signal acquisition. To address these drawbacks and void the
need for vibration sensors, in this study, we propose a novel
sound-to-vibration transformation method that can synthesize realistic
vibration signals directly from the sound measurements regardless of the
working conditions, fault type, and fault severity. As a result, using this
transformation, the data acquired by a simple sound recorder, e.g., a mobile
phone, can be transformed into the vibration signal, which can then be used for
fault detection by a pre-trained model. The proposed method is extensively
evaluated over the benchmark Qatar University Dual-Machine Bearing Fault
Benchmark dataset (QU-DMBF), which encapsulates sound and vibration data from
two different machines operating under various conditions. Experimental results
show that this novel approach can synthesize such realistic vibration signals
that can directly be used for reliable and highly accurate motor health
monitoring.
","[{""version"":""v1"",""created"":""Sat, 13 May 2023 16:37:18 GMT""}]","2023-05-16"
"2305.07961","Luke Friedman","Luke Friedman, Sameer Ahuja, David Allen, Zhenning Tan, Hakim
  Sidahmed, Changbo Long, Jun Xie, Gabriel Schubiner, Ajay Patel, Harsh Lara,
  Brian Chu, Zexi Chen, Manoj Tiwari","Leveraging Large Language Models in Conversational Recommender Systems",,,,,"cs.IR cs.CL cs.LG","http://creativecommons.org/licenses/by/4.0/","  A Conversational Recommender System (CRS) offers increased transparency and
control to users by enabling them to engage with the system through a real-time
multi-turn dialogue. Recently, Large Language Models (LLMs) have exhibited an
unprecedented ability to converse naturally and incorporate world knowledge and
common-sense reasoning into language understanding, unlocking the potential of
this paradigm. However, effectively leveraging LLMs within a CRS introduces new
technical challenges, including properly understanding and controlling a
complex conversation and retrieving from external sources of information. These
issues are exacerbated by a large, evolving item corpus and a lack of
conversational data for training. In this paper, we provide a roadmap for
building an end-to-end large-scale CRS using LLMs. In particular, we propose
new implementations for user preference understanding, flexible dialogue
management and explainable recommendations as part of an integrated
architecture powered by LLMs. For improved personalization, we describe how an
LLM can consume interpretable natural language user profiles and use them to
modulate session-level context. To overcome conversational data limitations in
the absence of an existing production CRS, we propose techniques for building a
controllable LLM-based user simulator to generate synthetic conversations. As a
proof of concept we introduce RecLLM, a large-scale CRS for YouTube videos
built on LaMDA, and demonstrate its fluency and diverse functionality through
some illustrative example conversations.
","[{""version"":""v1"",""created"":""Sat, 13 May 2023 16:40:07 GMT""},{""version"":""v2"",""created"":""Tue, 16 May 2023 21:21:46 GMT""}]","2023-05-18"
"2305.07962","Constantin Runge","Constantin Runge and Thomas Wiegart and Diego Lentner","Improved List Decoding for Polar-Coded Probabilistic Shaping","5 pages, 3 figures; submitted to ISTC 2023",,,,"cs.IT math.IT","http://arxiv.org/licenses/nonexclusive-distrib/1.0/","  A modified list decoder with improved error performance is proposed for
polar-coded probabilistic shaping. The decoder exploits the deterministic
encoding rule for shaping bits to rule out candidate code words that the
encoder would not generate.
","[{""version"":""v1"",""created"":""Sat, 13 May 2023 16:41:56 GMT""}]","2023-05-16"
"2305.07963","Eduardo Barredo Alamilla","Eduardo Barredo-Alamilla, Luis F. Urrutia, Manoel M. Ferreira Jr","Electromagnetic Radiation in chiral matter: the Cherenkov case","Submitted to Physical Review D",,,,"hep-ph cond-mat.mes-hall hep-th","http://arxiv.org/licenses/nonexclusive-distrib/1.0/","  Starting from the modified Maxwell equations in Carroll-Field-Jackiw
electrodynamics we study the electromagnetic radiation in a chiral medium
characterized by an axion coupling $\theta(x)=b_\mu x^\mu$, with $b_\mu=
(0,\mathbf{b})$, which gives rise to the magnetoelectric effect. Employing the
stationary phase approximation we construct the Green's matrix in the radiation
zone which allows the calculation of the corresponding electromagnetic
potentials and fields for arbitrary sources. We obtain a general expression for
the angular distribution of the radiated energy per unit frequency. As an
application we consider a charge moving at constant velocity parallel to
$\mathbf{b}$ in the medium and discuss the resulting Cherenkov radiation. We
recover the vacuum Cherenkov radiation. For the case of a material with
refraction index $n > 1$ we find that zero, one or two Cherenkov cones can
appear. The spectral distribution of the radiation together with the comparison
of the radiation output of each cone are presented, as well as some angular
plots showing the appearance of the cones.
","[{""version"":""v1"",""created"":""Sat, 13 May 2023 16:42:57 GMT""}]","2023-05-16"
"2305.07964","Diego Berti","Diego Berti, Luca Bisconti, Davide Catania","Global existence for a 3D Tropical Climate Model with damping and small
  initial data in $\dot H^{1/2}(\mathbb{R}^3)$","20 pages",,,,"math.AP","http://creativecommons.org/licenses/by/4.0/","  We consider a 3D Tropical Climate Model with damping terms in the equation of
the barotropic mode $u$ and in the equation of the first baroclinic mode $v$ of
the velocity. The equation for the temperature $\theta$ is free from dampings.
We prove global existence in time for this system assuming the initial data
$(u_0, v_0,\theta_0)$ small, in terms of the homogeneous space $\dot
H^{1/2}(\mathbb{R}^3)$.
","[{""version"":""v1"",""created"":""Sat, 13 May 2023 16:44:15 GMT""}]","2023-05-16"
"2305.07965","Xinyi Luo","Xinyi Luo, Yuyang Wang, Lik-Hang Lee, Zihan Xing, Shan Jin, Boya Dong,
  Yuanyi Hu, Zeming Chen, Jing Yan, Pan Hui","Using a virtual reality interview simulator to explore factors
  influencing people's behavior","12 pages, 4 pictures, 9 tables",,,,"cs.HC","http://arxiv.org/licenses/nonexclusive-distrib/1.0/","  Virtual reality interview simulator (VRIS) provides an effective and
manageable approach for candidates prone to being very nervous during
interviews, yet, the major anxiety-inducing elements remain unknown. During an
interview, the anxiety levels, overall experience, and performance of
interviewees might be affected by various circumstances. By analyzing
electrodermal activity and questionnaire, we investigated the influence of five
variables: (I) \textit{Realism}; (II) \textit{Question type}; (III)
\textit{Interviewer attitude}; (IV) \textit{Timing}; and (V)
\textit{Preparation}. As such, an orthogonal design $L_8(4^1 \times 2^4)$ with
eight experiments ($O A_8$ matrix) was implemented, in which 19 college
students took part in the experiments. Considering the anxiety, overall
experience, and performance of the interviewees, results indicate that
\textit{Question type} plays a major role; secondly, \textit{Realism},
\textit{Preparation}, and \textit{Interviewer attitude} all have some degree of
influence; lastly, \textit{Timing} have little to no impact. Specifically,
professional interview questions elicited a greater degree of anxiety than
personal ones among the categories of interview questions. This work
contributes to our understanding of anxiety-stimulating factors during job
interviews in virtual reality and provides cues for designing future VRIS.
","[{""version"":""v1"",""created"":""Sat, 13 May 2023 16:51:31 GMT""},{""version"":""v2"",""created"":""Tue, 16 May 2023 05:28:58 GMT""}]","2023-05-17"
"2305.07966","Houcine Ben Dali","Houcine Ben Dali and Maciej Do{\l}\k{e}ga","Positive formula for Jack polynomials, Jack characters and proof of
  Lassalle's conjecture","44 pages, 3 figures",,,,"math.CO","http://arxiv.org/licenses/nonexclusive-distrib/1.0/","  We give an explicit formula for the power-sum expansion of Jack polynomials.
We deduce it from a more general formula, which we provide here, that
interprets Jack characters in terms of bipartite maps. We prove Lassalle's
conjecture from 2008 on integrality and positivity of Jack characters in
Stanley's coordinates and give a new formula for Jack polynomials using
creation operators.
","[{""version"":""v1"",""created"":""Sat, 13 May 2023 17:00:02 GMT""}]","2023-05-16"
"2305.07967","Pawan Kumar","Jayadev Naram, Tanmay Kumar Sinha, Pawan Kumar","Structured Low-Rank Tensor Learning","Accepted in OPT21, NeurIPS, 13 pages",,,,"cs.LG cs.NA math.NA","http://creativecommons.org/licenses/by/4.0/","  We consider the problem of learning low-rank tensors from partial
observations with structural constraints, and propose a novel factorization of
such tensors, which leads to a simpler optimization problem. The resulting
problem is an optimization problem on manifolds. We develop first-order and
second-order Riemannian optimization algorithms to solve it. The duality gap
for the resulting problem is derived, and we experimentally verify the
correctness of the proposed algorithm. We demonstrate the algorithm on
nonnegative constraints and Hankel constraints.
","[{""version"":""v1"",""created"":""Sat, 13 May 2023 17:04:54 GMT""}]","2023-05-16"
"2305.07968","Miguel A. Porras","Miguel A. Porras, Miguel Casado-\'Alvaro, and Isabel Gonzalo","Teleportation of a quantum particle in a potential via quantum Zeno
  dynamics","7 pages, 5 figures",,,,"quant-ph","http://arxiv.org/licenses/nonexclusive-distrib/1.0/","  We report on the possibility of teleportation of a quantum particle, a
distinctly different phenomenon from the teleportation of a quantum state
through entanglement. With the first meaning, teleportation is theoretically
possible by placing the particle initially at rest (with a certain uncertainty)
out of any equilibrium point of a potential well or barrier and by frequently
monitoring whether the particle remains at rest. This quantum Zeno dynamics
inhibits acceleration, and features disappearance from the classical turning
point and appearance in other turning point, if there is any other, with a
probability that approaches unity by increasing the frequency of the
measurements. This phenomenon has all the ingredients attributed in science
fiction to teleportation: The particle is always at rest, cannot be found in
the path between the two turning points, and saves travel time. We discuss the
feasibility, in principle, of teleportation of electrons, protons and other
particles, and conclude its increasing impracticability as the particle gets
heavier.
","[{""version"":""v1"",""created"":""Sat, 13 May 2023 17:08:18 GMT""}]","2023-05-16"
"2305.07969","Yutian Chen","Yutian Chen, Hao Kang, Vivian Zhai, Liangze Li, Rita Singh, Bhiksha
  Raj","GPT-Sentinel: Distinguishing Human and ChatGPT Generated Content",,,,,"cs.CL","http://arxiv.org/licenses/nonexclusive-distrib/1.0/","  This paper presents a novel approach for detecting ChatGPT-generated vs.
human-written text using language models. To this end, we first collected and
released a pre-processed dataset named OpenGPTText, which consists of rephrased
content generated using ChatGPT. We then designed, implemented, and trained two
different models for text classification, using Robustly Optimized BERT
Pretraining Approach (RoBERTa) and Text-to-Text Transfer Transformer (T5),
respectively. Our models achieved remarkable results, with an accuracy of over
97% on the test dataset, as evaluated through various metrics. Furthermore, we
conducted an interpretability study to showcase our model's ability to extract
and differentiate key features between human-written and ChatGPT-generated
text. Our findings provide important insights into the effective use of
language models to detect generated text.
","[{""version"":""v1"",""created"":""Sat, 13 May 2023 17:12:11 GMT""},{""version"":""v2"",""created"":""Wed, 17 May 2023 18:21:03 GMT""}]","2023-05-19"
"2305.07970","Steve Phelps","Steve Phelps and Yvan I. Russell","Investigating Emergent Goal-Like Behaviour in Large Language Models
  Using Experimental Economics","13 pages, 2 figures. For associated code see
  https://github.com/phelps-sg/llm-cooperation",,,,"cs.GT cs.AI cs.CY econ.GN q-fin.EC","http://arxiv.org/licenses/nonexclusive-distrib/1.0/","  In this study, we investigate the capacity of large language models (LLMs),
specifically GPT-3.5, to operationalise natural language descriptions of
cooperative, competitive, altruistic, and self-interested behavior in social
dilemmas. Our focus is on the iterated Prisoner's Dilemma, a classic example of
a non-zero-sum interaction, but our broader research program encompasses a
range of experimental economics scenarios, including the ultimatum game,
dictator game, and public goods game. Using a within-subject experimental
design, we instantiated LLM-generated agents with various prompts that conveyed
different cooperative and competitive stances. We then assessed the agents'
level of cooperation in the iterated Prisoner's Dilemma, taking into account
their responsiveness to the cooperative or defection actions of their partners.
Our results provide evidence that LLMs can translate natural language
descriptions of altruism and selfishness into appropriate behaviour to some
extent, but exhibit limitations in adapting their behavior based on conditioned
reciprocity. The observed pattern of increased cooperation with defectors and
decreased cooperation with cooperators highlights potential constraints in the
LLM's ability to generalize its knowledge about human behavior in social
dilemmas. We call upon the research community to further explore the factors
contributing to the emergent behavior of LLM-generated agents in a wider array
of social dilemmas, examining the impact of model architecture, training
parameters, and various partner strategies on agent behavior. As more advanced
LLMs like GPT-4 become available, it is crucial to investigate whether they
exhibit similar limitations or are capable of more nuanced cooperative
behaviors, ultimately fostering the development of AI systems that better align
with human values and social norms.
","[{""version"":""v1"",""created"":""Sat, 13 May 2023 17:23:16 GMT""}]","2023-05-16"
"2305.07971","Atsushi Suzuki","Atsushi Suzuki, Atsushi Nitanda, Taiji Suzuki, Jing Wang, Feng Tian,
  and Kenji Yamanishi","Tight and fast generalization error bound of graph embedding in metric
  space",,,,,"stat.ML cs.LG","http://arxiv.org/licenses/nonexclusive-distrib/1.0/","  Recent studies have experimentally shown that we can achieve in non-Euclidean
metric space effective and efficient graph embedding, which aims to obtain the
vertices' representations reflecting the graph's structure in the metric space.
Specifically, graph embedding in hyperbolic space has experimentally succeeded
in embedding graphs with hierarchical-tree structure, e.g., data in natural
languages, social networks, and knowledge bases. However, recent theoretical
analyses have shown a much higher upper bound on non-Euclidean graph
embedding's generalization error than Euclidean one's, where a high
generalization error indicates that the incompleteness and noise in the data
can significantly damage learning performance. It implies that the existing
bound cannot guarantee the success of graph embedding in non-Euclidean metric
space in a practical training data size, which can prevent non-Euclidean graph
embedding's application in real problems. This paper provides a novel upper
bound of graph embedding's generalization error by evaluating the local
Rademacher complexity of the model as a function set of the distances of
representation couples. Our bound clarifies that the performance of graph
embedding in non-Euclidean metric space, including hyperbolic space, is better
than the existing upper bounds suggest. Specifically, our new upper bound is
polynomial in the metric space's geometric radius $R$ and can be
$O(\frac{1}{S})$ at the fastest, where $S$ is the training data size. Our bound
is significantly tighter and faster than the existing one, which can be
exponential to $R$ and $O(\frac{1}{\sqrt{S}})$ at the fastest. Specific
calculations on example cases show that graph embedding in non-Euclidean metric
space can outperform that in Euclidean space with much smaller training data
than the existing bound has suggested.
","[{""version"":""v1"",""created"":""Sat, 13 May 2023 17:29:18 GMT""}]","2023-05-16"
"2305.07972","Agam Shah","Agam Shah and Suvan Paturi and Sudheer Chava","Trillion Dollar Words: A New Financial Dataset, Task & Market Analysis","ACL 2023 (main)",,,,"cs.CL q-fin.CP","http://creativecommons.org/licenses/by-nc-sa/4.0/","  Monetary policy pronouncements by Federal Open Market Committee (FOMC) are a
major driver of financial market returns. We construct the largest tokenized
and annotated dataset of FOMC speeches, meeting minutes, and press conference
transcripts in order to understand how monetary policy influences financial
markets. In this study, we develop a novel task of hawkish-dovish
classification and benchmark various pre-trained language models on the
proposed dataset. Using the best-performing model (RoBERTa-large), we construct
a measure of monetary policy stance for the FOMC document release days. To
evaluate the constructed measure, we study its impact on the treasury market,
stock market, and macroeconomic indicators. Our dataset, models, and code are
publicly available on Huggingface and GitHub under CC BY-NC 4.0 license.
","[{""version"":""v1"",""created"":""Sat, 13 May 2023 17:32:39 GMT""}]","2023-05-16"
