"2305.08129","Uri Banin","Yonatan Ossia, Adar Levi, Yossef E. Panfil, Somnath Koley, Einav
  Scharf, Nadav Chefetz, Sergei Remennik, Atzmon Vakahi and Uri Banin","Electric field induced color switching in colloidal quantum dot
  molecules at room temperature","Manuscript: 27 pages, 6 figures, Supplementary: 38 pages",,,,"cond-mat.mes-hall cond-mat.mtrl-sci physics.chem-ph physics.optics","http://arxiv.org/licenses/nonexclusive-distrib/1.0/","  Colloidal semiconductor quantum dots are robust emitters implemented in
numerous prototype and commercial optoelectronic devices. However, active
fluorescence color tuning, achieved so far by electric-field induced Stark
effect, has been limited to a small spectral range, and accompanied by
intensity reduction due to the electron-hole charge separation effect.
Utilizing quantum dot molecules that manifest two coupled emission centers, we
present a novel electric-field induced instantaneous color switching effect.
Reversible emission color switching without intensity loss is achieved on a
single particle level, as corroborated by correlated electron microscopy
imaging. Simulations establish that this is due to the electron wavefunction
toggling between the two centers dictated by the electric-field and affected by
the coupling strength. The quantum dot molecules manifesting two coupled
emission centers may be tailored to emit distinct colors, opening the path for
sensitive field sensing and color switchable devices such as a novel pixel
design for displays or an electric field color tunable single photon source.
","[{""version"":""v1"",""created"":""Sun, 14 May 2023 11:28:40 GMT""}]","2023-05-16"
"2305.08130","Nirjhar Das","Nirjhar Das and Arpan Chattopadhyay","Inverse Reinforcement Learning With Constraint Recovery",,,,,"cs.LG cs.AI","http://creativecommons.org/licenses/by-nc-sa/4.0/","  In this work, we propose a novel inverse reinforcement learning (IRL)
algorithm for constrained Markov decision process (CMDP) problems. In standard
IRL problems, the inverse learner or agent seeks to recover the reward function
of the MDP, given a set of trajectory demonstrations for the optimal policy. In
this work, we seek to infer not only the reward functions of the CMDP, but also
the constraints. Using the principle of maximum entropy, we show that the IRL
with constraint recovery (IRL-CR) problem can be cast as a constrained
non-convex optimization problem. We reduce it to an alternating constrained
optimization problem whose sub-problems are convex. We use exponentiated
gradient descent algorithm to solve it. Finally, we demonstrate the efficacy of
our algorithm for the grid world environment.
","[{""version"":""v1"",""created"":""Sun, 14 May 2023 11:49:37 GMT""}]","2023-05-16"
"2305.08131","Tian-Wei Liu","Tian-Wei Liu, Jiang-Bo Bai, Nicholas Fantuzzi","Analytical model for predicting folding stable state of bistable
  deployable composite boom","arXiv admin note: substantial text overlap with arXiv:2305.05289",,,,"physics.class-ph","http://creativecommons.org/licenses/by/4.0/","  The bistable deployable composite boom (Bi-DCB) can achieve bistable function
by storing and releasing strain energy, which has a good application prospect
in space field. For example, it serves as the main support section of
deployable structures (e.g., solar arrays and antennas). This paper
investigates the folding stable state of the Bi-DCB through the analytical
method. Based on the classical Archimedes' helix, the geometrical model of the
Bi-DCB was established. Using energy principle, an analytical model for
predicting the folding stable state of the Bi-DCB was presented. The failure
indices of six Bi-DCBs in the folding stable state were calculated using the
Tsai-Hill criterion and the maximum stress criterion. To validate the
analytical model proposed in this paper, the prediction results were compared
with the results of two Finite Element Models (FEMs) and experimental results,
and the four were in good agreement. Finally, the effect of geometric
parameters (i.e., radius of cross-section, thickness and length) on the folding
stable state of the Bi-DCB was further investigated with the aid of the
analytical model. It is shown that geometric parameters are one of the key
factors affecting the folding stable state of the Bi-DCB.
","[{""version"":""v1"",""created"":""Sun, 14 May 2023 11:49:58 GMT""}]","2023-05-16"
"2305.08132","Byung-Hak Hwang","Byung-Hak Hwang","Noncommutative symmetric functions and skewing operators","19 pages, comments welcome!",,,,"math.CO","http://arxiv.org/licenses/nonexclusive-distrib/1.0/","  Skewing operators play a central role in the symmetric function theory
because of the importance of the product structure of the symmetric function
space. The theory of noncommutative symmetric functions is a useful tool for
studying expansions of a given symmetric function in terms of various bases. In
this paper, we establish a further development of the theory for studying
skewing operators. Using this machinery, we are able to easily reproduce the
Littlewood--Richardson rule, and provide recurrence relations for chromatic
quasisymmetric functions, which generalizes Harada--Precup's recurrence.
","[{""version"":""v1"",""created"":""Sun, 14 May 2023 12:01:23 GMT""}]","2023-05-16"
"2305.08133","Abhijit Mathad","Abhijit Mathad (On behalf of the LHCb collaboration)","Lepton flavour universality tests in $b \to c l \nu$ decays at the LHCb
  experiment","contribution to the 2023 Electroweak session of the 57th Rencontres
  de Moriond. 6 pages and 5 figures",,,,"hep-ex","http://creativecommons.org/licenses/by-sa/4.0/","  Semileptonic charged current $b \to c l^- \overline{\nu}_l$ decays offer a
compelling avenue to probe the limits of the Standard Model and investigate
lepton flavor universality (LFU). While the SM maintains flavor universality,
new physics models can introduce interactions that violate this universality,
particularly for decays involving third-generation quarks and leptons. An
enticing observable to test LFU is the ratio of branching fractions of $b \to c
\tau^- \overline{\nu}_\tau$ and $b \to c \mu^- \overline{\nu}_\mu$ decays.
Recently, the LHCb experiment measured this ratio using $\overline{B} \to
D^{(*)} l^- \overline{\nu}_l$ decays. We discuss these results in this
proceedings of the 57th Rencontres de Moriond on Electroweak Interactions and
Unified Theories.
","[{""version"":""v1"",""created"":""Sun, 14 May 2023 12:03:23 GMT""}]","2023-05-16"
"2305.08134","Emel G\""urb\""uz","Emel G\""urb\""uz and Biplab Sanyal","Systematic study of amorphous 2D graphene, silicene and silicon carbide:
  Investigation of structural, electronic, optical and vibrational properties",,,,,"cond-mat.mtrl-sci","http://arxiv.org/licenses/nonexclusive-distrib/1.0/","  Although 2D solids and their vdW heterostructures have garnered much
attention recently, their amorphous forms have been less explored. We present a
detailed analysis of the structural, electronic, and thermal properties of 2D
amorphous graphene (A-Gra), silicene (A-Si), and silicon carbide (A-SiC) using
Classical Molecular Dynamics (MD) simulations and first-principles
calculations. Our results showed that A-Gra is planar at 0 K and wrinkled at
300 K, like its crystalline counterpart. At both temperatures, it can form
stable vdW solids while maintaining metallic behavior. We also demonstrate that
A-Si creates covalent bonds in layered structures while keeping its
metallicity. Its optical spectrum is blue-shifted in parallel polarization
relative to crystalline silicene, and its plasmon peak is in the UV range with
six-times higher intensity. Furthermore, we show that 2D silicon carbide can be
stabilized as a single layer or in layered structures with bonding between Si
atoms only. A-SiC's plasmon peak is in the UV range. All three structures'
optical spectra are observed as red-shifted compared to their crystalline
counterparts, and their absorption spectra range from IR to UV. Their common
heat carriers are extendons, especially diffusions, and their thermal
conductivity is calculated to be lower than that of their crystalline
counterparts. Our findings suggest that the uneven charge distributions around
local ring structures in all three systems can be exploited in future
electronic, thermo-electric, and opto-electronic devices with local
functionality.
","[{""version"":""v1"",""created"":""Sun, 14 May 2023 12:03:37 GMT""}]","2023-05-16"
"2305.08135","Qianglong Chen","Qianglong Chen, Guohai Xu, Ming Yan, Ji Zhang, Fei Huang, Luo Si and
  Yin Zhang","Distinguish Before Answer: Generating Contrastive Explanation as
  Knowledge for Commonsense Question Answering","Accepted to ACL2023(Findings). The Camera-ready Version",,,,"cs.CL cs.AI","http://creativecommons.org/licenses/by-nc-sa/4.0/","  Existing knowledge-enhanced methods have achieved remarkable results in
certain QA tasks via obtaining diverse knowledge from different knowledge
bases. However, limited by the properties of retrieved knowledge, they still
have trouble benefiting from both the knowledge relevance and distinguishment
simultaneously. To address the challenge, we propose CPACE, a Concept-centric
Prompt-bAsed Contrastive Explanation Generation model, which aims to convert
obtained symbolic knowledge into a contrastive explanation for better
distinguishing the differences among given candidates. Firstly, following
previous works, we retrieve different types of symbolic knowledge with a
concept-centric knowledge extraction module. After that, we generate
corresponding contrastive explanations using acquired symbolic knowledge and
explanation prompts as guidance for better modeling the knowledge
distinguishment and interpretability. Finally, we regard the generated
contrastive explanation as external knowledge for downstream task enhancement.
We conduct a series of experiments on three widely-used question-answering
datasets: CSQA, QASC, and OBQA. Experimental results demonstrate that with the
help of generated contrastive explanation, our CPACE model achieves new SOTA on
CSQA (89.8% on the testing set, 0.9% higher than human performance), and gains
impressive improvement on QASC and OBQA (4.2% and 3.5%, respectively).
","[{""version"":""v1"",""created"":""Sun, 14 May 2023 12:12:24 GMT""},{""version"":""v2"",""created"":""Sun, 21 May 2023 15:07:23 GMT""}]","2023-05-23"
"2305.08136","Kouji Tahata","Kouji Tahata and Kohei Matsuda","Diagonals-parameter symmetry model and its property for square
  contingency tables with ordinal categories","17 pages",,,,"stat.ME","http://arxiv.org/licenses/nonexclusive-distrib/1.0/","  Previously, the diagonals-parameter symmetry model based on $f$-divergence
(denoted by DPS[$f$]) was reported to be equivalent to the diagonals-parameter
symmetry model regardless of the function $f$, but the proof was omitted. Here,
we derive the DPS[$f$] model and the proof of the relation between the two
models. We can obtain various interpretations of the diagonals-parameter
symmetry model from the result. Additionally, the necessary and sufficient
conditions for symmetry and property between test statistics for goodness of
fit are discussed.
","[{""version"":""v1"",""created"":""Sun, 14 May 2023 12:12:45 GMT""}]","2023-05-16"
"2305.08137","Roee Mordechai Francos","Roee M. Francos, Alfred M. Bruckstein","Spiral Sweeping Search for Smart Evaders",,,,,"cs.MA","http://creativecommons.org/licenses/by/4.0/","  Consider a given planar circular region, in which there is an unknown number
of smart mobile evaders. We wish to detect evaders using a line formation of
sweeping agents whose total sensing length is predetermined. We propose
procedures for designing spiral sweeping protocols that ensure the successful
completion of the task, thus deriving conditions on the sweeping speed of the
linear formation and its path. Successful completion of the task implies that
evaders with a given limit on their speed cannot escape the sweeping agents. A
simpler task for the sweeping formation is the confinement of evaders to a
desired region, such as their original domain. The feasibility of completing
these tasks depends on geometric and dynamic constraints that impose a lower
bound on the speed that the sweeping agents must have. This critical speed is
derived to ensure the satisfaction of the confinement task. Increasing the
speed above the lower bound enables the sweepers to complete the search task as
well. We develop two spiral line formation search processes for smart evaders,
that address current limitations in search against smart evaders. Additionally,
we present a quantitative and qualitative comparison analysis between the total
search time of circular line formation sweep processes and spiral line
formation processes. We evaluate the different strategies by using two metrics,
total search time and the minimal critical speed required for a successful
search.
","[{""version"":""v1"",""created"":""Sun, 14 May 2023 12:15:05 GMT""}]","2023-05-16"
"2305.08138","Subhashis Banerjee","Prashant Agrawal, Abhinav Nakarmi, Mahavir Prasad Jhawar, Subodh
  Sharma, and Subhashis Banerjee","Traceable mixnets",,,,,"cs.CR","http://creativecommons.org/licenses/by/4.0/","  We introduce the notion of \emph{traceable mixnets}. In a traditional mixnet,
multiple mix-servers jointly permute and decrypt a list of ciphertexts to
produce a list of plaintexts, along with a proof of correctness, such that the
association between individual ciphertexts and plaintexts remains completely
hidden. However, in many applications, the privacy-utility tradeoff requires
answering some specific queries about this association, without revealing any
information beyond the query result. We consider queries of the following type:
a) given a ciphertext in the mixnet input list, whether it encrypts one of a
given subset of plaintexts in the output list, and b) given a plaintext in the
mixnet output list, whether it is a decryption of one of a given subset of
ciphertexts in the input list. Traceable mixnets allow the mix-servers to
jointly prove answers to the above queries to a querier such that neither the
querier nor a threshold number of mix-servers learn any information beyond the
query result. If the querier is not corrupted, the corrupted mix-servers do not
even learn the query result. We propose a construction of a traceable mixnet
using novel distributed zero-knowledge proofs of \emph{set membership} and a
related primitive we introduce called \emph{reverse set membership}. Although
the set membership problem has been studied in the single-prover setting, the
main challenge in our distributed setting lies in making sure that none of the
mix-servers learn the association between ciphertexts and plaintexts during the
proof. Our construction is faster than existing techniques by at least one
order of magnitude.
","[{""version"":""v1"",""created"":""Sun, 14 May 2023 12:18:59 GMT""}]","2023-05-16"
"2305.08139","Eitam Sheetrit","Eitam Sheetrit, Menachem Brief, Oren Elisha","Predicting Unplanned Readmissions in the Intensive Care Unit: A
  Multimodality Evaluation",,,,,"cs.LG","http://arxiv.org/licenses/nonexclusive-distrib/1.0/","  A hospital readmission is when a patient who was discharged from the hospital
is admitted again for the same or related care within a certain period.
Hospital readmissions are a significant problem in the healthcare domain, as
they lead to increased hospitalization costs, decreased patient satisfaction,
and increased risk of adverse outcomes such as infections, medication errors,
and even death. The problem of hospital readmissions is particularly acute in
intensive care units (ICUs), due to the severity of the patients' conditions,
and the substantial risk of complications. Predicting Unplanned Readmissions in
ICUs is a challenging task, as it involves analyzing different data modalities,
such as static data, unstructured free text, sequences of diagnoses and
procedures, and multivariate time-series. Here, we investigate the
effectiveness of each data modality separately, then alongside with others,
using state-of-the-art machine learning approaches in time-series analysis and
natural language processing. Using our evaluation process, we are able to
determine the contribution of each data modality, and for the first time in the
context of readmission, establish a hierarchy of their predictive value.
Additionally, we demonstrate the impact of Temporal Abstractions in enhancing
the performance of time-series approaches to readmission prediction. Due to
conflicting definitions in the literature, we also provide a clear definition
of the term Unplanned Readmission to enhance reproducibility and consistency of
future research and to prevent any potential misunderstandings that could
result from diverse interpretations of the term. Our experimental results on a
large benchmark clinical data set show that Discharge Notes written by
physicians, have better capabilities for readmission prediction than all other
modalities.
","[{""version"":""v1"",""created"":""Sun, 14 May 2023 12:20:13 GMT""}]","2023-05-16"
"2305.08140","Liu Jiahui","Jiahui Liu, Jesper Byggmastar, Zheyong Fan, Ping Qian, and Yanjing Su","Large-scale machine-learning molecular dynamics simulation of primary
  radiation damage in tungsten",,,,,"physics.comp-ph","http://arxiv.org/licenses/nonexclusive-distrib/1.0/","  Simulating collision cascades and radiation damage poses a long-standing
challenge for existing interatomic potentials, both in terms of accuracy and
efficiency. Machine-learning based interatomic potentials have shown
sufficiently high accuracy for radiation damage simulations, but most existing
ones are still not efficient enough to model high energy collision cascades
with sufficiently large space and time scales. To this end, we here extend the
highly efficient neuroevolution potential (NEP) framework by combining it with
the Ziegler-Biersack-Littmark (ZBL) screened nuclear repulsion potential,
obtaining a NEP-ZBL framework. We train a NEP-ZBL model for tungsten and
demonstrate its accuracy in terms of the elastic properties, melting point, and
various energetics of defects that are relevant for radiation damage. We then
perform large-scale molecular dynamics simulations with the NEP-ZBL model with
up to 8.1 million atoms and 240 ps (using a single 40-GB A100 GPU) to study
primary radiation damage of tungsten in both bulk and thin-foil forms. In bulk
tungsten, the interstitial dislocation loops formed by cascades are dominated
by 1/2<111> loops, but we also observe <100> interstitial dislocation loops
forming directly in the first few picoseconds of a cascade simulation. The
damage resulting from the cascades differs significantly in foil and shows that
larger and more vacancy clusters as well as smaller and fewer interstitial
clusters are produced due to the presence of a free surface.
","[{""version"":""v1"",""created"":""Sun, 14 May 2023 12:21:02 GMT""}]","2023-05-16"
"2305.08141","Liang-Jian Zou","Zhong-Yi Wang, Da-Yong Liu, Liang-Jian Zou","Electronic instability in pressured black phosphorus under strong
  magnetic field","15 pages,6 figures",,,,"cond-mat.str-el","http://creativecommons.org/licenses/by/4.0/","  In this paper we have systematically studied the electronic instability of
pressured black phosphorous (BP) under strong magnetic field. We first present
an effective model Hamiltonian for pressured BP near the Lifshitz point. We
show that when the magnetic field exceeds a certain critical value, the
nodal-line semimetal (NLSM) state of BP with a small band overlap re-enters
semiconductive phase by re-opening a small gap. This results in a narrow-band
semiconductor with a partially flat valence band edge. We show that above this
critical magnetic field, two possible instabilities, i.e., charge density wave
(CDW) phase or excitonic insulator (EI) phase, are predicted as the ground
state for high and low doping concentrations, respectively. By comparing our
results with the experiment, we suggest the field-induced instability observed
in recent experiment as EI. Furthermore, we propose that the semimetallic BP
under pressure with small band overlaps may provide a good platform to study
the magneto-exciton insulators. Our findings bring the first insight into the
electronic instability of topological NLSM in the quantum limit.
","[{""version"":""v1"",""created"":""Sun, 14 May 2023 12:22:41 GMT""}]","2023-05-16"
"2305.08142","Abdusattar Kurban","Abdusattar Kurban, Xia Zhou, Na Wang, Yong-Feng Huang, Yu-Bin Wang,
  and Nurimangul Nurmamat","Dynamics of the clumps partially disrupted from a planet around a
  neutron star","11 pages, 6 figures, 2 tables","Monthly Notices of the Royal Astronomical Society, 522, 4265-4274
  (2023)","10.1093/mnras/stad1260",,"astro-ph.HE","http://arxiv.org/licenses/nonexclusive-distrib/1.0/","  Tidal disruption events are common in the Universe, which may occur in
various compact star systems and could account for many astrophysical
phenomena. Depending on the separation between the central compact star and its
companion, either a full disruption or a partial disruption may occur. The
partial disruption of a rocky planet around a neutron star can produce
kilometer-sized clumps, but the main portion of the planet can survive. The
dynamical evolution of these clumps is still poorly understood. In this study,
the characteristics of partial disruption of a rocky planet in a highly
elliptical orbit around a neutron star is investigated. The periastron of the
planet is assumed to be very close to the neutron star so that it would be
partially disrupted by tidal force every time it passes through the periastron.
It is found that the fragments generated in the process will change their
orbits on a time scale of a few orbital periods due to the combined influence
of the neutron star and the remnant planet, and will finally collide with the
central neutron star. Possible outcomes of the collisions are discussed.
","[{""version"":""v1"",""created"":""Sun, 14 May 2023 12:24:19 GMT""}]","2023-05-16"
"2305.08143","Saurabh Band","Saurabh Band (1), Florian Stechmann (2), Malavika Unnikrishnan (1),
  Shadi Attarha (1), Christiane Heinicke (2), Andreas Willig (3) and Anna
  F\""orster (1) ((1) Dept. Sustainable Communication Networks, University of
  Bremen, (2) Center of Applied Space Technology and Microgravity, University
  of Bremen, (3) Dept. Computer Science and Software Engineering, University of
  Canterbury)","Reliability Analysis of Monitoring System for Extraterrestrial Habitat
  using CTMC and Empirical Evaluation","15 pages, 11 figures",,,,"eess.SY cs.SY","http://creativecommons.org/licenses/by/4.0/","  Among the various required resources for this civilization, the habitat is
one of the crucial resources to live on Mars. Such an extraterrestrial habitat
is designed to provide a safe place to live during the initial missions. It is
equipped with monitoring and life support systems to ensure the astronauts'
safety. In this work, we present a robust monitoring system with a use case for
extraterrestrial habitats. Similar to a typical monitoring system, it consists
of sensor nodes and a gateway connected through a wireless communication
channel. In our system, we introduce robustness to various failures that can
occur after deployment, namely, board, sensor and gateway failure, in the form
of redundancy. For each failure, the problem is tackled differently. For the
first two types, we use additional hardware as backup, while for the last type,
we use neighbouring devices as backups. The backup devices function as
replacements for the failed component, which helps the system to collect the
data which would otherwise be lost. We evaluate how much the performance of the
system improves by using backup devices. We use a Continuous-Time Markov chain
for the theoretical evaluation and an experimental setup that includes the
hardware prototype for the empirical evaluation. We also analyze the effect of
a simple medium access mechanism on the system's performance in the presence of
heavy noise on the channel. Based on our requirements, we use a simple custom
medium access control (MAC) algorithm called Slotted-ALOHA with Random Back-off
(SARB) to make communication reliable. We demonstrate that around $30-34\%$ of
the packets are recovered, with the use of backup devices (redundancy), which
would otherwise be lost in case of failures. We also demonstrate that the
system's performance improves by $3.8-13.2\%$ with the use of a simple medium
access technique (SARB).
","[{""version"":""v1"",""created"":""Sun, 14 May 2023 12:29:16 GMT""}]","2023-05-16"
