"2305.08029","Zihao Wang","Zihao Wang, Le Ma, Chen Zhang, Bo Han, Yikai Wang, Xinyi Chen, HaoRong
  Hong, Wenbo Liu, Xinda Wu, Kejun Zhang","SongDriver2: Real-time Emotion-based Music Arrangement with Soft
  Transition",,,,,"cs.SD cs.AI eess.AS","http://arxiv.org/licenses/nonexclusive-distrib/1.0/","  Real-time emotion-based music arrangement, which aims to transform a given
music piece into another one that evokes specific emotional resonance with the
user in real-time, holds significant application value in various scenarios,
e.g., music therapy, video game soundtracks, and movie scores. However,
balancing emotion real-time fit with soft emotion transition is a challenge due
to the fine-grained and mutable nature of the target emotion. Existing studies
mainly focus on achieving emotion real-time fit, while the issue of soft
transition remains understudied, affecting the overall emotional coherence of
the music. In this paper, we propose SongDriver2 to address this balance.
Specifically, we first recognize the last timestep's music emotion and then
fuse it with the current timestep's target input emotion. The fused emotion
then serves as the guidance for SongDriver2 to generate the upcoming music
based on the input melody data. To adjust music similarity and emotion
real-time fit flexibly, we downsample the original melody and feed it into the
generation model. Furthermore, we design four music theory features to leverage
domain knowledge to enhance emotion information and employ semi-supervised
learning to mitigate the subjective bias introduced by manual dataset
annotation. According to the evaluation results, SongDriver2 surpasses the
state-of-the-art methods in both objective and subjective metrics. These
results demonstrate that SongDriver2 achieves real-time fit and soft
transitions simultaneously, enhancing the coherence of the generated music.
","[{""version"":""v1"",""created"":""Sun, 14 May 2023 00:09:48 GMT""}]","2023-05-16"
"2305.08030","Mohamed Chabab","B. Ait Ouazghour and M. Chabab","The two Higgs doublet type-II seesaw model: Naturalness and $\bar{B}\to
  X_s\gamma$ versus heavy Higgs masses","9 pages, 4 figures, LaTeX",,,,"hep-ph","http://creativecommons.org/licenses/by/4.0/","  We extend the work \cite{Ouazghour:2018mld} to a more general and detailed
analysis through studying the naturalness problem and $B$ physics constraints
within the context of two higgs doublets model augmented with a complex scalar
triplet field ($2HDMcT$). We first derive the modified Vetman conditions and
show that naturalness problem might be evaded at the electroweak scale. Then,
we evaluate the branching ratio of $\bar{B}\to X_s\gamma$ radiative decay at
the Next to leading order. Besides unitarity, boundedness from below
constraints and the present collider data from Higgs signal rate measurements,
the parameter space of $2HDMcT$ is then revisited to see how the modified
Veltman conditions and $\bar{B}\to X_s\gamma$ experimental bounds induce
significant delimitations. Our analysis shows that the naturalness affects
drastically the masses of heavy Higgs $h_3$, $A_2$, $H_2^\pm$ and $H^{\pm\pm}$.
More specifically, we considered three benchmak scenarios corresponding to
$\mu_2 > 20, 40, 70$ GeV. For $\mu_2 > 40$, we find stringent upper limits on
$m_{h_2}$, $m_{A_1}$ and $m_{H_1^\pm}$ at $880$, $920$ and $918$ GeV
respectively. If, in addition, the measurements of $\bar{B}\to X_s\gamma$ decay
rate are also considered, the lower masses limits of nonstandard Higgs bosons
($h_2$, $h_3$, $A_1$, $A_2$, $H_1^\pm$, $H_2^\pm$, $H^{\pm\pm}$) are pushed up
to higher values located between $490$ and $750$ GeV. Besides, we also
demonstrate that the $\bar{B}\to X_s\gamma$ experimental limits can only be
accommodated within $2HDMcT$ if two conditions are fullfilled : $\alpha_1$
parameter positive and the Higgs mass hierarchy
$m_{h_{3}}>m_{H_2^\pm}>m_{H^{\pm\pm}}$.
","[{""version"":""v1"",""created"":""Sun, 14 May 2023 00:15:50 GMT""}]","2023-05-16"
"2305.08031","Muhammad Huzaifa","Raza Imam, Muhammad Huzaifa, and Mohammed El-Amine Azz","On enhancing the robustness of Vision Transformers: Defensive Diffusion","Our code is publicly available at
  https://github.com/Muhammad-Huzaifaa/Defensive_Diffusion",,,,"cs.CV cs.AI","http://creativecommons.org/licenses/by/4.0/","  Privacy and confidentiality of medical data are of utmost importance in
healthcare settings. ViTs, the SOTA vision model, rely on large amounts of
patient data for training, which raises concerns about data security and the
potential for unauthorized access. Adversaries may exploit vulnerabilities in
ViTs to extract sensitive patient information and compromising patient privacy.
This work address these vulnerabilities to ensure the trustworthiness and
reliability of ViTs in medical applications. In this work, we introduced a
defensive diffusion technique as an adversarial purifier to eliminate
adversarial noise introduced by attackers in the original image. By utilizing
the denoising capabilities of the diffusion model, we employ a reverse
diffusion process to effectively eliminate the adversarial noise from the
attack sample, resulting in a cleaner image that is then fed into the ViT
blocks. Our findings demonstrate the effectiveness of the diffusion model in
eliminating attack-agnostic adversarial noise from images. Additionally, we
propose combining knowledge distillation with our framework to obtain a
lightweight student model that is both computationally efficient and robust
against gray box attacks. Comparison of our method with a SOTA baseline method,
SEViT, shows that our work is able to outperform the baseline. Extensive
experiments conducted on a publicly available Tuberculosis X-ray dataset
validate the computational efficiency and improved robustness achieved by our
proposed architecture.
","[{""version"":""v1"",""created"":""Sun, 14 May 2023 00:17:33 GMT""}]","2023-05-16"
"2305.08032","Xun-Jie Xu","Xun-Jie Xu","Neutrino forces and experimental probes","6 pages, 4 figures, Contribution to the 2023 Electroweak session of
  the 57th Rencontres de Moriond",,,,"hep-ph astro-ph.CO hep-ex","http://creativecommons.org/licenses/by/4.0/","  Neutrinos as almost massless particles could mediate long-range forces, known
as neutrino forces. In this talk, I will introduce some theoretical aspects of
neutrino forces, including why the potential of a neutrino force has the
$1/r^{5}$ form and how it may vary under different circumstances. Experimental
probes and possible implications for cosmology are also briefly discussed.
","[{""version"":""v1"",""created"":""Sun, 14 May 2023 00:27:52 GMT""}]","2023-05-16"
"2305.08033","Chad McKell","Chad McKell, Mohammad Sina Nabizadeh, Stephanie Wang, Albert Chern","Wave Simulations in Infinite Spacetime","7 pages, 5 figures",,,,"math.NA cs.NA","http://arxiv.org/licenses/nonexclusive-distrib/1.0/","  Solving the wave equation on an infinite domain has been an ongoing challenge
in scientific computing. Conventional approaches to this problem only generate
numerical solutions on a small subset of the infinite domain. In this paper, we
present a method for solving the wave equation on the entire infinite domain
using only finite computation time and memory. Our method is based on the
conformal invariance of the scalar wave equation under the Kelvin
transformation in Minkowski spacetime. As a result of the conformal invariance,
any wave problem with compact initial data contained in a causality cone is
equivalent to a wave problem on a bounded set in Minkowski spacetime. We use
this fact to perform wave simulations in infinite spacetime using a finite
discretization of the bounded spacetime with no additional loss of accuracy
introduced by the Kelvin transformation.
","[{""version"":""v1"",""created"":""Sun, 14 May 2023 00:29:27 GMT""}]","2023-05-16"
"2305.08034","Shaahin Angizi","Ranyang Zhou, Sabbir Ahmed, Adnan Siraj Rakin, Shaahin Angizi","DNN-Defender: An in-DRAM Deep Neural Network Defense Mechanism for
  Adversarial Weight Attack","10 pages, 11 figures",,,,"cs.CR cs.AI","http://creativecommons.org/licenses/by/4.0/","  With deep learning deployed in many security-sensitive areas, machine
learning security is becoming progressively important. Recent studies
demonstrate attackers can exploit system-level techniques exploiting the
RowHammer vulnerability of DRAM to deterministically and precisely flip bits in
Deep Neural Networks (DNN) model weights to affect inference accuracy. The
existing defense mechanisms are software-based, such as weight reconstruction
requiring expensive training overhead or performance degradation. On the other
hand, generic hardware-based victim-/aggressor-focused mechanisms impose
expensive hardware overheads and preserve the spatial connection between victim
and aggressor rows. In this paper, we present the first DRAM-based
victim-focused defense mechanism tailored for quantized DNNs, named
DNN-Defender that leverages the potential of in-DRAM swapping to withstand the
targeted bit-flip attacks. Our results indicate that DNN-Defender can deliver a
high level of protection downgrading the performance of targeted RowHammer
attacks to a random attack level. In addition, the proposed defense has no
accuracy drop on CIFAR-10 and ImageNet datasets without requiring any software
training or incurring additional hardware overhead.
","[{""version"":""v1"",""created"":""Sun, 14 May 2023 00:30:58 GMT""}]","2023-05-16"
"2305.08035","Kiseok Yeon","Kiseok Yeon","The Hasse principle for homogeneous polynomials with random coefficients
  over thin sets","92 pages, all comments are welcome!",,,,"math.NT","http://creativecommons.org/licenses/by/4.0/","  Let $d$ and $n$ be natural numbers. Let $\langle \boldsymbol{a},
\nu_{d,n}(\boldsymbol{x})\rangle\in \mathbb{Z}[\boldsymbol{x}]$ be a
homogeneous polynomial in $n$ variables of degree $d$ with integer coefficients
$\boldsymbol{a}$, where $\langle\cdot,\cdot\rangle$ denotes the inner product,
and $\nu_{d,n}: \mathbb{R}^n\rightarrow \mathbb{R}^N$ denotes the Veronese
embedding with $N=\binom{n+d-1}{d}$. Consider a variety $V_{\boldsymbol{a}}$ in
$\mathbb{P}^{n-1}$, defined by $\langle \boldsymbol{a},
\nu_{d,n}(\boldsymbol{x})\rangle=0.$ In this paper, we examine a set of these
varieties, defined by
  $$\mathbb{V}^{P}_{d,n}(A)=\{ V_{\boldsymbol{a}}\in \mathbb{P}^{n-1}|\
P(\boldsymbol{a})=0,\ \|\boldsymbol{a}\|_{\infty}\leq A\},$$
  where $P\in \mathbb{Z}[\boldsymbol{x}]$ is a non-singular homogeneous
polynomial of degree $k\geq 2$. We confirm that when $d\geq 4$, $n$ is
sufficiently large in terms of $d$, and $k\leq d,$ the proportion of elements
in $\mathbb{V}^{P}_{d,n}(A)$, which do not satisfy the Hasse principle,
converges to $0$ as $A\rightarrow \infty$. We make explicit a lower bound on
$n$ guaranteeing this conclusion, and in particular, show that when $d\geq 14$
it suffices to take $n\geq 32d+17$. In order to establish it, we mainly use the
Hardy-Littlewood circle method.
","[{""version"":""v1"",""created"":""Sun, 14 May 2023 00:36:12 GMT""}]","2023-05-16"
"2305.08036","Andrey A Popov","Andrey A. Popov, Renato Zanetti","Small-data Reduced Order Modeling of Chaotic Dynamics through SyCo-AE:
  Synthetically Constrained Autoencoders",,,,,"cs.LG math.DS","http://arxiv.org/licenses/nonexclusive-distrib/1.0/","  Data-driven reduced order modeling of chaotic dynamics can result in systems
that either dissipate or diverge catastrophically. Leveraging non-linear
dimensionality reduction of autoencoders and the freedom of non-linear operator
inference with neural-networks, we aim to solve this problem by imposing a
synthetic constraint in the reduced order space. The synthetic constraint
allows our reduced order model both the freedom to remain fully non-linear and
highly unstable while preventing divergence. We illustrate the methodology with
the classical 40-variable Lorenz '96 equations, showing that our methodology is
capable of producing medium-to-long range forecasts with lower error using less
data.
","[{""version"":""v1"",""created"":""Sun, 14 May 2023 00:42:24 GMT""}]","2023-05-16"
"2305.08037","Ce Zhou","Ce Zhou (1), Qiben Yan (1), Zhiyuan Yu (2), Eshan Dixit (1), Ning
  Zhang (2), Huacheng Zeng (1), and Alireza Safdari Ghanhdari (3) ((1) Michigan
  State University, (2) Washington University in St. Louis, (3) Texas A&M
  University )","ChargeX: Exploring State Switching Attack on Electric Vehicle Charging
  Systems","13 pages, 13 figures",,,,"cs.CR cs.AR","http://arxiv.org/licenses/nonexclusive-distrib/1.0/","  Electric Vehicle (EV) has become one of the promising solutions to the
ever-evolving environmental and energy crisis. The key to the wide adoption of
EVs is a pervasive charging infrastructure, composed of both private/home
chargers and public/commercial charging stations. The security of EV charging,
however, has not been thoroughly investigated. This paper investigates the
communication mechanisms between the chargers and EVs, and exposes the lack of
protection on the authenticity in the SAE J1772 charging control protocol. To
showcase our discoveries, we propose a new class of attacks, ChargeX, which
aims to manipulate the charging states or charging rates of EV chargers with
the goal of disrupting the charging schedules, causing a denial of service
(DoS), or degrading the battery performance. ChargeX inserts a hardware attack
circuit to strategically modify the charging control signals. We design and
implement multiple attack systems, and evaluate the attacks on a public
charging station and two home chargers using a simulated vehicle load in the
lab environment. Extensive experiments on different types of chargers
demonstrate the effectiveness and generalization of ChargeX. Specifically, we
demonstrate that ChargeX can force the switching of an EV's charging state from
``stand by"" to ``charging"", even when the vehicle is not in the charging state.
We further validate the attacks on a Tesla Model 3 vehicle to demonstrate the
disruptive impacts of ChargeX. If deployed, ChargeX may significantly demolish
people's trust in the EV charging infrastructure.
","[{""version"":""v1"",""created"":""Sun, 14 May 2023 00:57:52 GMT""}]","2023-05-16"
"2305.08038","Yang Li","Xinyu He, Ning Chen, Jingpei Chen, Xuezhou Wang, Yang Li","First Principles and Machine Learning Identify Key Pairing Strength
  Factors of Cuprate Superconductors",,,,,"cond-mat.supr-con","http://creativecommons.org/licenses/by/4.0/","  By using band structure calculations of quantum mechanical theory, some
important peaks of DoS (Density of States) were obtained and classified based
on crystal structure laws of cuprate superconductivity. In particular, the
orbital interactions of the in-plane and out-of-plane ions of the copper-oxygen
plane were investigated. The position, half-width, and height of DOS peak
features were collected for all 35 typical curate systems which have critical
temperature maximum data from the works of literature. By training test of 7
common machine learning algorithms, the relationship between the Tc maximum
values and these orbital interaction parameters were mined. It was found that
the key features of the orbital interaction affecting the Tc maximum were not
only the flat band but also a new interaction between core orbitals in a deeper
energy band position.
","[{""version"":""v1"",""created"":""Sun, 14 May 2023 00:59:41 GMT""}]","2023-05-16"
"2305.08039","Jingda Yang","Jingda Yang, Ying Wang, Yanjun Pan, Tuyen X. Tran","Systematic Meets Unintended: Prior Knowledge Adaptive 5G Vulnerability
  Detection via Multi-Fuzzing",,,,,"cs.CR","http://creativecommons.org/licenses/by/4.0/","  The virtualization and softwarization of 5G and NextG are critical enablers
of the shift to flexibility, but they also present a potential attack surface
for threats. However, current security research in communication systems
focuses on specific aspects of security challenges and lacks a holistic
perspective. To address this challenge, a novel systematic fuzzing approach is
proposed to reveal, detect, and predict vulnerabilities with and without prior
knowledge assumptions from attackers. It also serves as a digital twin platform
for system testing and defense simulation pipeline. Three fuzzing strategies
are proposed: Listen-and-Learn (LAL), Synchronize-and-Learn (SyAL), and
Source-and-Learn (SoAL). The LAL strategy is a black-box fuzzing strategy used
to discover vulnerabilities without prior protocol knowledge, while the SyAL
strategy, also a black-box fuzzing method, targets vulnerabilities more
accurately with attacker-accessible user information and a novel
probability-based fuzzing approach. The white-box fuzzing strategy, SoAL, is
then employed to identify and explain vulnerabilities through fuzzing of
significant bits. Using the srsRAN 5G platform, the LAL strategy identifies 129
RRC connection vulnerabilities with an average detection duration of 0.072s.
Leveraging the probability-based fuzzing algorithm, the SyAL strategy
outperforms existing models in precision and recall, using significantly fewer
fuzzing cases. SoAL detects three man-in-the-middle vulnerabilities stemming
from 5G protocol vulnerabilities. The proposed solution is scalable to other
open-source and commercial 5G platforms and protocols beyond RRC. Extensive
experimental results demonstrate that the proposed solution is an efficient and
efficient approach to validate 5G security; meanwhile, it serves as real-time
vulnerability detection and proactive defense.
","[{""version"":""v1"",""created"":""Sun, 14 May 2023 01:00:54 GMT""}]","2023-05-16"
"2305.08040","Dixian Zhu","Dixian Zhu, Bokun Wang, Zhi Chen, Yaxing Wang, Milan Sonka, Xiaodong
  Wu, Tianbao Yang","Provable Multi-instance Deep AUC Maximization with Stochastic Pooling","To appear in ICML2023, 23 pages",,,,"cs.LG cs.AI","http://creativecommons.org/licenses/by/4.0/","  This paper considers a novel application of deep AUC maximization (DAM) for
multi-instance learning (MIL), in which a single class label is assigned to a
bag of instances (e.g., multiple 2D slices of a CT scan for a patient). We
address a neglected yet non-negligible computational challenge of MIL in the
context of DAM, i.e., bag size is too large to be loaded into {GPU} memory for
backpropagation, which is required by the standard pooling methods of MIL. To
tackle this challenge, we propose variance-reduced stochastic pooling methods
in the spirit of stochastic optimization by formulating the loss function over
the pooled prediction as a multi-level compositional function. By synthesizing
techniques from stochastic compositional optimization and non-convex min-max
optimization, we propose a unified and provable muli-instance DAM (MIDAM)
algorithm with stochastic smoothed-max pooling or stochastic attention-based
pooling, which only samples a few instances for each bag to compute a
stochastic gradient estimator and to update the model parameter. We establish a
similar convergence rate of the proposed MIDAM algorithm as the
state-of-the-art DAM algorithms. Our extensive experiments on conventional MIL
datasets and medical datasets demonstrate the superiority of our MIDAM
algorithm.
","[{""version"":""v1"",""created"":""Sun, 14 May 2023 01:29:56 GMT""},{""version"":""v2"",""created"":""Thu, 18 May 2023 18:01:45 GMT""},{""version"":""v3"",""created"":""Mon, 29 May 2023 04:57:27 GMT""},{""version"":""v4"",""created"":""Tue, 6 Jun 2023 05:32:49 GMT""}]","2023-06-07"
"2305.08041","Saeid Tizpaz-Niari","Hector Reyes, Saeid Tizpaz-Niari, and Vladik Kreinovich","Over-Measurement Paradox: Suspension of Thermonuclear Research Center
  and Need to Update Standards","To Appear in Uncertainty, Constraints, and Decision Making (Springer,
  Cham, Switzerland)",,,,"stat.OT","http://creativecommons.org/licenses/by/4.0/","  In general, the more measurements we perform, the more information we gain
about the system and thus, the more adequate decisions we will be able to make.
However, in situations when we perform measurements to check for safety, the
situation is sometimes opposite: the more additional measurements we perform
beyond what is required, the worse the decisions will be: namely, the higher
the chance that a perfectly safe system will be erroneously classified as
unsafe and therefore, unnecessary additional features will be added to the
system design. This is not just a theoretical possibility: exactly this
phenomenon is one of the reasons why the construction of a world-wide
thermonuclear research center has been suspended. In this paper, we show that
the reason for this paradox is in the way the safety standards are formulated
now -- what was a right formulation when sensors were much more expensive is no
longer adequate now when sensors and measurements are much cheaper. We also
propose how to modify the safety standards so as to avoid this paradox and make
sure that additional measurements always lead to better solutions.
","[{""version"":""v1"",""created"":""Sun, 14 May 2023 01:34:21 GMT""}]","2023-05-16"
"2305.08042","Sheng Zhong","Sheng Zhong, Nima Fazeli, and Dmitry Berenson","CHSEL: Producing Diverse Plausible Pose Estimates from Contact and Free
  Space Data","10 pages with 1 page appendix, camera-ready version for RSS 2023
  (accepted)",,,,"cs.RO cs.CV","http://creativecommons.org/licenses/by/4.0/","  This paper proposes a novel method for estimating the set of plausible poses
of a rigid object from a set of points with volumetric information, such as
whether each point is in free space or on the surface of the object. In
particular, we study how pose can be estimated from force and tactile data
arising from contact. Using data derived from contact is challenging because it
is inherently less information-dense than visual data, and thus the pose
estimation problem is severely under-constrained when there are few contacts.
Rather than attempting to estimate the true pose of the object, which is not
tractable without a large number of contacts, we seek to estimate a plausible
set of poses which obey the constraints imposed by the sensor data. Existing
methods struggle to estimate this set because they are either designed for
single pose estimates or require informative priors to be effective. Our
approach to this problem, Constrained pose Hypothesis Set Elimination (CHSEL),
has three key attributes: 1) It considers volumetric information, which allows
us to account for known free space; 2) It uses a novel differentiable
volumetric cost function to take advantage of powerful gradient-based
optimization tools; and 3) It uses methods from the Quality Diversity (QD)
optimization literature to produce a diverse set of high-quality poses. To our
knowledge, QD methods have not been used previously for pose registration. We
also show how to update our plausible pose estimates online as more data is
gathered by the robot. Our experiments suggest that CHSEL shows large
performance improvements over several baseline methods for both simulated and
real-world data.
","[{""version"":""v1"",""created"":""Sun, 14 May 2023 01:43:10 GMT""}]","2023-05-16"
"2305.08043","Peicheng Jiang","Peicheng Jiang (for the BESIII Collaboration)","ALPs searches at BESIII","4 pages, 4 figures, contribution to the 2023 Electroweak session of
  the 57th Rencontres de Moriond",,,,"hep-ex","http://creativecommons.org/licenses/by/4.0/","  A search for an axion-like particle with 2.7 billion $\psi(3686)$ events
collected by the BESIII detector is presented. No significant signal is
observed, and the upper limits on the branching fraction of
$J/\psi\rightarrow\gamma a$ and the ALP-photon coupling constant
$g_{a\gamma\gamma}$ are set at the 95% confidence level in the mass range of
$0.165\leq m_a\leq 2.84$ GeV/$c^2$. The limits on $B(J/\psi\rightarrow\gamma
a)$ range from $8.3\times10^{-8}$ to $1.8\times10^{-6}$ over the search region,
and the constraints on the ALP-photon coupling are the most stringent to date
for $0.165\leq m_a\leq 1.468$ GeV/$c^2$.
","[{""version"":""v1"",""created"":""Sun, 14 May 2023 01:53:46 GMT""}]","2023-05-16"
