"2305.12358","Thomas Wendler","Mehdi Astaraki, Francesca De Benetti, Yousef Yeganeh, Iuliana
  Toma-Dasu, \""Orjan Smedby, Chunliang Wang, Nassir Navab, Thomas Wendler","AutoPaint: A Self-Inpainting Method for Unsupervised Anomaly Detection","41 pages, 15 figures, follow-up paper to conference abstract at
  yearly meeting of German Nuclear Medicine in 2022",,,,"cs.CV cs.LG eess.IV","http://arxiv.org/licenses/nonexclusive-distrib/1.0/","  Robust and accurate detection and segmentation of heterogenous tumors
appearing in different anatomical organs with supervised methods require
large-scale labeled datasets covering all possible types of diseases. Due to
the unavailability of such rich datasets and the high cost of annotations,
unsupervised anomaly detection (UAD) methods have been developed aiming to
detect the pathologies as deviation from the normality by utilizing the
unlabeled healthy image data. However, developed UAD models are often trained
with an incomplete distribution of healthy anatomies and have difficulties in
preserving anatomical constraints. This work intends to, first, propose a
robust inpainting model to learn the details of healthy anatomies and
reconstruct high-resolution images by preserving anatomical constraints.
Second, we propose an autoinpainting pipeline to automatically detect tumors,
replace their appearance with the learned healthy anatomies, and based on that
segment the tumoral volumes in a purely unsupervised fashion. Three imaging
datasets, including PET, CT, and PET-CT scans of lung tumors and head and neck
tumors, are studied as benchmarks for evaluation. Experimental results
demonstrate the significant superiority of the proposed method over a wide
range of state-of-the-art UAD methods. Moreover, the unsupervised method we
propose produces comparable results to a robust supervised segmentation method
when applied to multimodal images.
","[{""version"":""v1"",""created"":""Sun, 21 May 2023 05:45:38 GMT""}]","2023-05-23"
"2305.12359","B.Sundar Rajan","Navya Saxena, Anjana A. Mahesh, and B. Sundar Rajan","An Optimal Two-Step Decoding at Receivers with Side Information in
  PSK-Modulated Index Coding","24 pages and 7 figures",,,,"cs.IT math.IT","http://arxiv.org/licenses/nonexclusive-distrib/1.0/","  This paper studies noisy index coding problems over single-input
single-output broadcast channels. The codewords from a chosen index code of
length $N$ are transmitted after $2^N$-PSK modulation over an AWGN channel. In
""Index Coded PSK Modulation for prioritized Receivers,"" the authors showed that
when a length-$N$ index code is transmitted as a $2^N$-PSK symbol, the ML
decoder at a receiver decodes directly to the message bit rather than following
the two-step decoding process of first demodulating the PSK symbol and
equivalently the index-coded bits and then doing index-decoding. In this paper,
we consider unprioritized receivers and follow the two-step decoding process at
the receivers. After estimating the PSK symbol using an ML decoder, at a
receiver, there might be more than one decoding strategy, i.e., a linear
combination of index-coded bits and different subsets of side information bits,
that can be used to estimate the requested message. Thomas et al. in [""Single
Uniprior Index Coding With Min Max Probability of Error Over Fading Channels,""]
showed that for binary-modulated index code transmissions, minimizing the
number of transmissions used to decode a requested message is equivalent to
minimizing the probability of error. This paper shows that this is no longer
the case while employing multi-level modulations. Further, we consider that the
side information available to each receiver is also noisy and derive an
expression for the probability that a requested message bit is estimated
erroneously at a receiver. We also show that the criterion for choosing a
decoding strategy that gives the best probability of error performance at a
receiver changes with the signal-to-noise ratio at which the side information
is broadcast.
","[{""version"":""v1"",""created"":""Sun, 21 May 2023 06:06:37 GMT""}]","2023-05-23"
"2305.12360","Minki Kim","Minki Kim and Alan Lew","Extensions of the Colorful Helly Theorem for $d$-collapsible and
  $d$-Leray complexes","20 pages, 1 figure",,,,"math.CO","http://arxiv.org/licenses/nonexclusive-distrib/1.0/","  We present extensions of the Colorful Helly Theorem for $d$-collapsible and
$d$-Leray complexes, providing a common generalization to the matroidal
versions of the theorem due to Kalai and Meshulam, the ``very colorful"" Helly
theorem introduced by Arocha, B\'ar\'any, Bracho, Fabila and Montejano, and the
``semi-intersecting"" colorful Helly theorem proved by Montejano and Karasev.
  As an application, we obtain the following extension of Tverberg's Theorem:
Let $A$ be a finite set of points in $\mathbb{R}^d$ with $|A|>(r-1)(d+1)$.
Then, there exist a partition $A_1,\ldots,A_r$ of $A$ and a subset $B\subset A$
of size $(r-1)(d+1)$, such that $\cap_{i=1}^r \text{conv}( (B\cup\{p\})\cap
A_i)\neq\emptyset$ for all $p\in A\setminus B$. That is, we obtain a partition
of $A$ into $r$ parts that remains a Tverberg partition even after removing all
but one arbitrary point from $A\setminus B$.
","[{""version"":""v1"",""created"":""Sun, 21 May 2023 06:18:09 GMT""}]","2023-05-23"
"2305.12361","Feipeng Ma","Tianyi Wang, Feipeng Ma, Zhenhua Liu, Fengyun Rao","A Dual-level Detection Method for Video Copy Detection",,,,,"cs.CV","http://arxiv.org/licenses/nonexclusive-distrib/1.0/","  With the development of multimedia technology, Video Copy Detection has been
a crucial problem for social media platforms. Meta AI hold Video Similarity
Challenge on CVPR 2023 to push the technology forward. In this paper, we share
our winner solutions on both tracks to help progress in this area. For
Descriptor Track, we propose a dual-level detection method with Video Editing
Detection (VED) and Frame Scenes Detection (FSD) to tackle the core challenges
on Video Copy Detection. Experimental results demonstrate the effectiveness and
efficiency of our proposed method. Code is available at
https://github.com/FeipengMa6/VSC22-Submission.
","[{""version"":""v1"",""created"":""Sun, 21 May 2023 06:19:08 GMT""}]","2023-05-23"
"2305.12362","Jie Zhou","Jie Zhou","Regularized Integrals on Configuration Spaces of Riemann Surfaces and
  Cohomological Pairings","35 pages, 3 figures",,,,"math.AG hep-th math-ph math.CV math.MP","http://arxiv.org/licenses/nonexclusive-distrib/1.0/","  We extend the notion of regularized integrals introduced by Li-Zhou that aims
to assign finite values to divergent integrals on configuration spaces of
Riemann surfaces. We then give cohomological formulations for the extended
notion using the tools of current cohomology and mixed Hodge structures. We
also provide practical ways of constructing representatives of the
corresponding cohomology classes in terms of smooth differential forms.
","[{""version"":""v1"",""created"":""Sun, 21 May 2023 06:19:57 GMT""}]","2023-05-23"
"2305.12363","Laksh Nanwani","Laksh Nanwani, Anmol Agarwal, Kanishk Jain, Raghav Prabhakar, Aaron
  Monis, Aditya Mathur, Krishna Murthy, Abdul Hafez, Vineet Gandhi, K. Madhava
  Krishna","Instance-Level Semantic Maps for Vision Language Navigation",,,,,"cs.RO","http://creativecommons.org/licenses/by/4.0/","  Humans have a natural ability to perform semantic associations with the
surrounding objects in the environment. This allows them to create a mental map
of the environment which helps them to navigate on-demand when given a
linguistic instruction. A natural goal in Vision Language Navigation (VLN)
research is to impart autonomous agents with similar capabilities. Recently
introduced VL Maps \cite{huang23vlmaps} take a step towards this goal by
creating a semantic spatial map representation of the environment without any
labelled data. However, their representations are limited for practical
applicability as they do not distinguish between different instances of the
same object. In this work, we address this limitation by integrating
instance-level information into spatial map representation using a community
detection algorithm and by utilizing word ontology learned by large language
models (LLMs) to perform open-set semantic associations in the mapping
representation. The resulting map representation improves the navigation
performance by two-fold (233\%) on realistic language commands with
instance-specific descriptions compared to VL Maps. We validate the
practicality and effectiveness of our approach through extensive qualitative
and quantitative experiments.
","[{""version"":""v1"",""created"":""Sun, 21 May 2023 06:26:35 GMT""},{""version"":""v2"",""created"":""Tue, 23 May 2023 08:57:06 GMT""}]","2023-05-24"
"2305.12364","Taeisha Nundlall","Taeisha Nundlall, Terence L Van Zyl","Machine Learning for Socially Responsible Portfolio Optimisation",,,"10.1145/3596947.3596966",,"q-fin.PM cs.LG","http://creativecommons.org/licenses/by-nc-nd/4.0/","  Socially responsible investors build investment portfolios intending to
incite social and environmental advancement alongside a financial return.
Although Mean-Variance (MV) models successfully generate the highest possible
return based on an investor's risk tolerance, MV models do not make provisions
for additional constraints relevant to socially responsible (SR) investors. In
response to this problem, the MV model must consider Environmental, Social, and
Governance (ESG) scores in optimisation. Based on the prominent MV model, this
study implements portfolio optimisation for socially responsible investors. The
amended MV model allows SR investors to enter markets with competitive SR
portfolios despite facing a trade-off between their investment Sharpe Ratio and
the average ESG score of the portfolio.
","[{""version"":""v1"",""created"":""Sun, 21 May 2023 06:28:53 GMT""}]","2023-05-23"
"2305.12365","Marco Huber","Xinyang Wu, Elisabeth Wedernikow, Christof Nitsche, Marco F. Huber","Towards Optimal Energy Management Strategy for Hybrid Electric Vehicle
  with Reinforcement Learning","Accepted at the 35th IEEE Intelligent Vehicles Symposium (IV 2023)",,,,"cs.LG","http://arxiv.org/licenses/nonexclusive-distrib/1.0/","  In recent years, the development of Artificial Intelligence (AI) has shown
tremendous potential in diverse areas. Among them, reinforcement learning (RL)
has proven to be an effective solution for learning intelligent control
strategies. As an inevitable trend for mitigating climate change, hybrid
electric vehicles (HEVs) rely on efficient energy management strategies (EMS)
to minimize energy consumption. Many researchers have employed RL to learn
optimal EMS for specific vehicle models. However, most of these models tend to
be complex and proprietary, making them unsuitable for broad applicability.
This paper presents a novel framework, in which we implement and integrate
RL-based EMS with the open-source vehicle simulation tool called FASTSim. The
learned RL-based EMSs are evaluated on various vehicle models using different
test drive cycles and prove to be effective in improving energy efficiency.
","[{""version"":""v1"",""created"":""Sun, 21 May 2023 06:29:17 GMT""}]","2023-05-23"
"2305.12366","Guillaume Rousselet","Rand R. Wilcox and Guillaume A. Rousselet","A Quantile Shift Approach To Main Effects And Interactions In A 2-By-2
  Design","GitHub repository: https://github.com/GRousselet/decinter/",,,,"stat.ME stat.AP","http://creativecommons.org/licenses/by/4.0/","  When comparing two independent groups, shift functions are basically
techniques that compare multiple quantiles rather than a single measure of
location, the goal being to get a more detailed understanding of how the
distributions differ. Various versions have been proposed and studied. This
paper deals with extensions of these methods to main effects and interactions
in a between-by-between, 2-by-2 design. Two approaches are studied, one that
compares the deciles of the distributions, and one that has a certain
connection to the Wilcoxon-Mann-Whitney method. For both methods, we propose an
implementation using the Harrell-Davis quantile estimator, used in conjunction
with a percentile bootstrap approach. We report results of simulations of false
and true positive rates.
","[{""version"":""v1"",""created"":""Sun, 21 May 2023 06:29:31 GMT""}]","2023-05-23"
"2305.12367","Yorgo Senikoglu","Tekin Dereli and Yorgo Senikoglu","Weyl Neutrinos In Plane Symmetric Spacetimes",,,,,"gr-qc","http://arxiv.org/licenses/nonexclusive-distrib/1.0/","  We investigate complex quaternion-valued exterior differential forms over
4-dimensional Lorentzian spacetimes and explore Weyl spinor fields as minimal
left ideals within the complex quaternion algebra. The variational derivation
of the coupled Einstein-Weyl equations from an action is presented, and the
resulting field equations for both first and second order variations are
derived and simplified. Exact plane symmetric solutions of the Einstein-Weyl
equations are discussed, and two families of exact solutions describing
left-moving and right-moving neutrino plane waves are provided. The study
highlights the significance of adjusting a quartic self-coupling of the Weyl
spinor in the action to ensure the equivalence of the field equations.
","[{""version"":""v1"",""created"":""Sun, 21 May 2023 06:35:06 GMT""}]","2023-05-23"
"2305.12368","Mikhail Skopenkov","Mikhail Khristoforov, Mikhail Skopenkov, Stanislav Smirnov","A generalization of Cardy's and Schramm's formulae","14 pages, 6 figures",,,,"math.PR math-ph math.CV math.MP","http://arxiv.org/licenses/nonexclusive-distrib/1.0/","  We study critical site percolation on the triangular lattice. We find the
difference of the probabilities of having a percolation interface to the right
and to the left of two given points in the scaling limit. This generalizes both
Cardy's and Schramm's formulae. The generalization involves a new interesting
discrete analytic observable and an unexpected conformal mapping.
","[{""version"":""v1"",""created"":""Sun, 21 May 2023 06:36:25 GMT""}]","2023-05-23"
"2305.12369","Yubin Kim","Yubin Kim, Dong Won Lee, Paul Pu Liang, Sharifa Algohwinem, Cynthia
  Breazeal, Hae Won Park","HIINT: Historical, Intra- and Inter- personal Dynamics Modeling with
  Cross-person Memory Transformer",,,,,"cs.CV cs.AI cs.LG","http://creativecommons.org/licenses/by/4.0/","  Accurately modeling affect dynamics, which refers to the changes and
fluctuations in emotions and affective displays during human conversations, is
crucial for understanding human interactions. By analyzing affect dynamics, we
can gain insights into how people communicate, respond to different situations,
and form relationships. However, modeling affect dynamics is challenging due to
contextual factors, such as the complex and nuanced nature of interpersonal
relationships, the situation, and other factors that influence affective
displays. To address this challenge, we propose a Cross-person Memory
Transformer (CPM-T) framework which is able to explicitly model affective
dynamics (intrapersonal and interpersonal influences) by identifying verbal and
non-verbal cues, and with a large language model to utilize the pre-trained
knowledge and perform verbal reasoning. The CPM-T framework maintains memory
modules to store and update the contexts within the conversation window,
enabling the model to capture dependencies between earlier and later parts of a
conversation. Additionally, our framework employs cross-modal attention to
effectively align information from multi-modalities and leverage cross-person
attention to align behaviors in multi-party interactions. We evaluate the
effectiveness and generalizability of our approach on three publicly available
datasets for joint engagement, rapport, and human beliefs prediction tasks.
Remarkably, the CPM-T framework outperforms baseline models in average
F1-scores by up to 7.3%, 9.3%, and 2.0% respectively. Finally, we demonstrate
the importance of each component in the framework via ablation studies with
respect to multimodal temporal behavior.
","[{""version"":""v1"",""created"":""Sun, 21 May 2023 06:43:35 GMT""}]","2023-05-23"
"2305.12370","Andrey Tsiganov","A.V. Tsiganov","Rotations and integrability","15 pages, LaTeX with AMS fonts",,,,"nlin.SI math-ph math.DS math.MP","http://arxiv.org/licenses/nonexclusive-distrib/1.0/","  We discuss few families of integrable and superintegrable systems in
$n$-dimensional Euclidean space, which are invariant to $m\geq n-2$ rotations.
Invariant Hamiltonian $H=\sum p_i^2+V(q)$ and additional integral of motion $G$
are polynomials of second and fourth order in momenta, which can be obtained
using various realizations of the Lie algebra $so(4)$.
","[{""version"":""v1"",""created"":""Sun, 21 May 2023 06:44:02 GMT""}]","2023-05-23"
"2305.12371","Amit Kumar","Amit Kumar, Shantipriya Parida, Ajay Pratap and Anil Kumar Singh","Machine Translation by Projecting Text into the Same
  Phonetic-Orthographic Space Using a Common Encoding","17 pages, 2 figures",,,,"cs.CL","http://creativecommons.org/licenses/by-nc-sa/4.0/","  The use of subword embedding has proved to be a major innovation in Neural
Machine Translation (NMT). It helps NMT to learn better context vectors for Low
Resource Languages (LRLs) so as to predict the target words by better modelling
the morphologies of the two languages and also the morphosyntax transfer. Even
so, their performance for translation in Indian language to Indian language
scenario is still not as good as for resource-rich languages. One reason for
this is the relative morphological richness of Indian languages, while another
is that most of them fall into the extremely low resource or zero-shot
categories. Since most major Indian languages use Indic or Brahmi origin
scripts, the text written in them is highly phonetic in nature and phonetically
similar in terms of abstract letters and their arrangements. We use these
characteristics of Indian languages and their scripts to propose an approach
based on common multilingual Latin-based encodings (WX notation) that take
advantage of language similarity while addressing the morphological complexity
issue in NMT. These multilingual Latin-based encodings in NMT, together with
Byte Pair Embedding (BPE) allow us to better exploit their phonetic and
orthographic as well as lexical similarities to improve the translation quality
by projecting different but similar languages on the same orthographic-phonetic
character space. We verify the proposed approach by demonstrating experiments
on similar language pairs (Gujarati-Hindi, Marathi-Hindi, Nepali-Hindi,
Maithili-Hindi, Punjabi-Hindi, and Urdu-Hindi) under low resource conditions.
The proposed approach shows an improvement in a majority of cases, in one case
as much as ~10 BLEU points compared to baseline techniques for similar language
pairs. We also get up to ~1 BLEU points improvement on distant and zero-shot
language pairs.
","[{""version"":""v1"",""created"":""Sun, 21 May 2023 06:46:33 GMT""}]","2023-05-23"
"2305.12372","Xinyu Bian","Xinyu Bian, Yuyi Mao, Jun Zhang","Joint Activity-Delay Detection and Channel Estimation for Asynchronous
  Massive Random Access",,,,,"eess.SP cs.IT math.IT","http://arxiv.org/licenses/nonexclusive-distrib/1.0/","  Most existing studies on joint activity detection and channel estimation for
grant-free massive random access (RA) systems assume perfect synchronization
among all active users, which is hard to achieve in practice. Therefore, this
paper considers asynchronous grant-free massive RA systems and develops novel
algorithms for joint user activity detection, synchronization delay detection,
and channel estimation. In particular, the framework of orthogonal approximate
message passing (OAMP) is first utilized to deal with the non-independent and
identically distributed (i.i.d.) pilot matrix in asynchronous grant-free
massive RA systems, and an OAMP-based algorithm capable of leveraging the
common sparsity among the received pilot signals from multiple base station
antennas is developed. To reduce the computational complexity, a memory AMP
(MAMP)based algorithm is further proposed that eliminates the matrix inversions
in the OAMP-based algorithm. Simulation results demonstrate the effectiveness
of the two proposed algorithms over the baseline methods. Besides, the
MAMP-based algorithm reduces 37% of the computations while maintaining
comparable detection/estimation accuracy, compared with the OAMP-based
algorithm.
","[{""version"":""v1"",""created"":""Sun, 21 May 2023 06:48:31 GMT""}]","2023-05-23"
"2305.12373","Akihiro Inoue","Akihiro Inoue, Ken Ohsuga, Hiroyuki R. Takahashi and Yuta Asahina","Modeling of Thermal Emission from ULX Pulsar Swift J0243.6+6124 with
  General Relativistic Radiation MHD simulations","24 pages, 9 figures, 2 tables, accepted for publication in ApJ",,,,"astro-ph.HE","http://creativecommons.org/licenses/by/4.0/","  We perform general relativistic radiation magnetohydrodynamics (MHD)
simulations of super-Eddington accretion flows around a neutron star with a
dipole magnetic field for modeling the galactic ultra-luminous X-ray source
(ULX) exhibiting X-ray pulsations, Swift J0243.6+6124. Our simulations show the
accretion columns near the magnetic poles, the accretion disk outside the
magnetosphere, and the outflows from the disk. It is revealed that the
effectively optically thick outflows, consistent with the observed thermal
emission at $\sim10^7$ K, are generated if the mass accretion rate is much
higher than the Eddington rate $\dot{M}_{\rm Edd}$ and the magnetospheric
radius is smaller than the spherization radius. In order to explain the
blackbody radius ($\sim 100-500$ km) without contradicting the reported spin
period ($9.8~{\rm s}$) and spin-up rate ($\dot{P}=-2.22\times10^{-8}~{\rm
s~s^{-1}}$), the mass accretion rate of $(200-1200)\dot{M}_{\rm Edd}$ is
required. Since the thermal emission was detected in two observations with
$\dot{P}$ of $-2.22\times10^{-8}~{\rm s~s^{-1}}$ and $-1.75\times10^{-8}~{\rm
s~s^{-1}}$ but not in another with $\dot{P}=-6.8 \times10^{-9}~{\rm s~s^{-1}}$,
the surface magnetic field strength of the neutron star in Swift J0243.6+6124
is estimated to be between $3\times10^{11}~{\rm G}$ and $4\times10^{12}~{\rm
G}$. From this restricted range of magnetic field strength, the accretion rate
would be $(200-500)\dot{M}_{\rm Edd}$ when the thermal emission appears and
$(60-100)\dot{M}_{\rm Edd}$ when it is not detected. Our results support the
hypothesis that the super-Eddington phase in the 2017-2018 giant outburst of
Swift J0243.6+6124 is powered by highly super-Eddington accretion flows onto a
magnetized neutron star.
","[{""version"":""v1"",""created"":""Sun, 21 May 2023 06:56:17 GMT""}]","2023-05-23"
"2305.12374","Kiichi Tashiro","Kiichi Tashiro","Existence of BV flow via elliptic regularization","19 pages",,,,"math.DG math.AP","http://arxiv.org/licenses/nonexclusive-distrib/1.0/","  We investigate a mean curvature flow obtained via elliptic regularization,
and prove that it is not only a Brakke flow, but additionally a generalized BV
flow proposed by Stuvard and Tonegawa. In particular, we show that the change
in volume of the evolving phase can be expressed in terms of the generalized
mean curvature of the Brakke flow.
","[{""version"":""v1"",""created"":""Sun, 21 May 2023 07:07:44 GMT""}]","2023-05-23"
"2305.12375","Zhou-Run Zhu","Zhou-Run Zhu and Defu Hou","Inverse magnetic catalysis and energy loss in holographic QCD model","29 pages, 22 figures",,,,"hep-ph","http://arxiv.org/licenses/nonexclusive-distrib/1.0/","  In this paper, we consider an Einstein-Maxwell-dilaton holographic model for
light quarks with nonzero magnetic field and chemical potential. The phase
diagram in $T-\mu$ and $T-B$ planes are obtained. We observe the inverse
magnetic catalysis (IMC) which is consistent with the lattice results. We
discuss the influences of magnetic field and chemical potential on the location
of critical endpoint (CEP). We find magnetic field increases critical
$\mu_{\scriptscriptstyle CEP}$ of CEP in $T-\mu$ plane and chemical potential
increases critical $B_{\scriptscriptstyle CEP}$ of CEP in $T-B$ plane. In
further research, we observe the equations of state (EoS) near the phase
transition temperature are non-monotonic. From the results of energy loss, we
find that the drag force of heavy quark and jet quenching parameter behave an
enhancement near the phase transition temperature. The peak values of drag
force and $\hat{q}$ are pushed towards lower temperature when increasing $B$ or
$\mu$. This phenomenon is consistent with the phase transition temperature
decreases with increasing $B$ or $\mu$ in this holographic model. Moreover, we
find heavy quark may lose more energy when perpendicular to magnetic field
which is consistent with the results of jet quenching parameter.
","[{""version"":""v1"",""created"":""Sun, 21 May 2023 07:09:55 GMT""}]","2023-05-23"
