"2305.12424","Tetsuya Kobayashi J","Mengji Zhang, Yusuke Hiki, Akira Funahashi, Tetsuya J. Kobayashi","Mol-PECO: a deep learning model to predict human olfactory perception
  from molecular structures","17 pages, 8 figures",,,,"cs.LG cs.AI q-bio.BM q-bio.NC","http://creativecommons.org/licenses/by/4.0/","  While visual and auditory information conveyed by wavelength of light and
frequency of sound have been decoded, predicting olfactory information encoded
by the combination of odorants remains challenging due to the unknown and
potentially discontinuous perceptual space of smells and odorants. Herein, we
develop a deep learning model called Mol-PECO (Molecular Representation by
Positional Encoding of Coulomb Matrix) to predict olfactory perception from
molecular structures. Mol-PECO updates the learned atom embedding by
directional graph convolutional networks (GCN), which model the Laplacian
eigenfunctions as positional encoding, and Coulomb matrix, which encodes atomic
coordinates and charges. With a comprehensive dataset of 8,503 molecules,
Mol-PECO directly achieves an area-under-the-receiver-operating-characteristic
(AUROC) of 0.813 in 118 odor descriptors, superior to the machine learning of
molecular fingerprints (AUROC of 0.761) and GCN of adjacency matrix (AUROC of
0.678). The learned embeddings by Mol-PECO also capture a meaningful odor space
with global clustering of descriptors and local retrieval of similar odorants.
Our work may promote the understanding and decoding of the olfactory sense and
mechanisms.
","[{""version"":""v1"",""created"":""Sun, 21 May 2023 10:44:02 GMT""}]","2023-05-23"
"2305.12425","Ziqian Ning","Ziqian Ning, Yuepeng Jiang, Pengcheng Zhu, Jixun Yao, Shuai Wang, Lei
  Xie, Mengxiao Bi","DualVC: Dual-mode Voice Conversion using Intra-model Knowledge
  Distillation and Hybrid Predictive Coding",,,,,"eess.AS cs.SD","http://arxiv.org/licenses/nonexclusive-distrib/1.0/","  Voice conversion is an increasingly popular technology, and the growing
number of real-time applications requires models with streaming conversion
capabilities. Unlike typical (non-streaming) voice conversion, which can
leverage the entire utterance as full context, streaming voice conversion faces
significant challenges due to the missing future information, resulting in
degraded intelligibility, speaker similarity, and sound quality. To address
this challenge, we propose DualVC, a dual-mode neural voice conversion approach
that supports both streaming and non-streaming modes using jointly trained
separate network parameters. Furthermore, we propose intra-model knowledge
distillation and hybrid predictive coding (HPC) to enhance the performance of
streaming conversion. Additionally, we incorporate data augmentation to train a
noise-robust autoregressive decoder, improving the model's performance on
long-form speech conversion. Experimental results demonstrate that the proposed
model outperforms the baseline models in the context of streaming voice
conversion, while maintaining comparable performance to the non-streaming
topline system that leverages the complete context, albeit with a latency of
only 252.8 ms.
","[{""version"":""v1"",""created"":""Sun, 21 May 2023 10:45:48 GMT""},{""version"":""v2"",""created"":""Wed, 31 May 2023 01:17:27 GMT""}]","2023-06-01"
"2305.12426","Laurent Mertz","Josselin Garnier and Laurent Mertz","Computing the diffusivity of a particle subject to dry friction with
  colored noise",,,,,"cond-mat.stat-mech math.PR","http://creativecommons.org/licenses/by-nc-nd/4.0/","  Experimental studies and numerical simulations have been devoted to the
motion of an object subjected to a dry friction and an external random force.
The experimental and numerical observations suggest that the variance of the
object displacement grows linearly with time. Here, the variance growth rate is
called diffusivity. The goal of this paper is to propose efficient stochastic
simulation methods for computing the diffusivity when the external random force
is white or colored and to provide a theoretical justification supporting
experimental observations. We show that the variance of the object displacement
has a linear growth in time. We obtain a representation formula for the
diffusivity as an expectation of a functional of an excursion. This makes it
possible to design a consistent estimator of the diffusivity with an associated
confidence interval. We show that the estimator has much better convergence
properties than usual Monte Carlo estimators. From highly accurate simulations
we can then propose and discuss scaling relations between the diffusivity,
noise strength and correlation time.
","[{""version"":""v1"",""created"":""Sun, 21 May 2023 10:54:02 GMT""}]","2023-05-23"
"2305.12427","Nikolaos Tsagkas","Nikolaos Tsagkas, Oisin Mac Aodha and Chris Xiaoxuan Lu","VL-Fields: Towards Language-Grounded Neural Implicit Spatial
  Representations","Project page: https://tsagkas.github.io/vl-fields/",,,,"cs.CV","http://creativecommons.org/licenses/by/4.0/","  We present Visual-Language Fields (VL-Fields), a neural implicit spatial
representation that enables open-vocabulary semantic queries. Our model encodes
and fuses the geometry of a scene with vision-language trained latent features
by distilling information from a language-driven segmentation model. VL-Fields
is trained without requiring any prior knowledge of the scene object classes,
which makes it a promising representation for the field of robotics. Our model
outperformed the similar CLIP-Fields model in the task of semantic segmentation
by almost 10%.
","[{""version"":""v1"",""created"":""Sun, 21 May 2023 10:55:27 GMT""},{""version"":""v2"",""created"":""Thu, 25 May 2023 08:38:52 GMT""}]","2023-05-26"
"2305.12428","Semiha Kosu","Semiha Kosu, Mohammadreza Babaei, Serdar \""Ozg\""ur Ata, Lutfiye
  Durak-Ata, and Halim Yanikomeroglu","Linear/Non-Linear Energy Harvesting Models via Multi-Antenna Relay
  Cooperation in V2V Communications",,,,,"cs.IT eess.SP math.IT","http://arxiv.org/licenses/nonexclusive-distrib/1.0/","  Vehicle-to-vehicle (V2V) communications is a part of next-generation wireless
networks to create smart cities with the connectivity of intelligent
transportation systems. Besides, green communications is considered in V2V
communication systems for energy sustainability and carbon neutrality. In this
scope, radio-frequency (RF) energy harvesting (EH) provides a battery-free
energy source as a solution for the future of V2V communications. Herein, the
employment of RF-EH in V2V communications is considered where the bit error
probability (BEP) of a dual-hop decode-and-forward relaying system is obtained
depending on the utilization of antennas at the relay. The multiple antenna
power-constraint relay harvests its power by applying dedicated antenna
(DA)/power splitting (PS) EH modes and linear (L)/nonlinear (NL) EH models.
Moreover, the links between nodes are exposed to double-Rayleigh fading.
Finally, the performance of different system parameters is compared using
theoretical derivations of BEP. The results provide a comprehensive analysis of
the proposed system considering PS/DA-EH modes and L/NL-EH models, as well as
deterministic/uniformly distributed placement of nodes. It is observed that
PS-EH outperforms DA-EH assuming a placement of an equal number of antennas and
distances. Moreover, optimal performance of PS/DA-EH is achieved by allocating
more power and increasing the number of antennas for EH, respectively.
","[{""version"":""v1"",""created"":""Sun, 21 May 2023 10:57:25 GMT""}]","2023-05-23"
"2305.12429","Andrew Hassell","Jesse Gell-Redman and Sean Gomes and Andrew Hassell","Scattering regularity for small data solutions of the nonlinear
  Schr\""{o}dinger equation","48 pages, 2 figures",,,,"math.AP math-ph math.MP","http://arxiv.org/licenses/nonexclusive-distrib/1.0/","  Using the Fredholm theory of the linear time-dependent Schr\""odinger equation
set up in our previous article arXiv:2201.03140, we solve the final-state
problem for the nonlinear Schr\""odinger problem $$ (D_t + \Delta + V) u = N[u],
\quad u(z,t) \sim (4\pi it)^{-n/2} e^{i|z|^2/4t} f\big( \frac{z}{2t} \big),
\quad t \to -\infty, $$ where $u : \mathbb{R}^{n+1} \to \mathbb{C}$ is the
unknown and $f : \mathbb{R}^n \to \mathbb{C}$ is the asymptotic data. Here $D_t
= -i \frac{\partial}{\partial t}$ and $\Delta = \sum_{j=1}^n D_{z_j} D_{z_j}$
is the positive Laplacian, or more generally a compactly supported, nontrapping
perturbation of this, $V$ is a smooth compactly supported potential function,
and the nonlinear term $N$ is a (suitable) polynomial in $u$, $\partial_{z_j}u$
and their complex conjugates satisfying phase invariance. Our assumption on the
asymptotic data $f$ is that it is small in a certain function space
$\mathcal{W}^k$ constructed in arXiv:2201.03140, for sufficiently large $k \in
\mathbb{N}$, where the index $k$ measures both regularity and decay at infinity
(it is similar to, but not quite a standard weighted Sobolev space $H^{k,
k}(\mathbb{R}^n)$). We find that for $N[u] = \pm |u|^{p-1} u$, $p$ odd, and
$(n,p) \neq (1, 3)$ then if the asymptotic data as $t \to -\infty$ is small in
$\mathcal{W}^k$, then the asymptotic data as $t \to +\infty$ is also in
$\mathcal{W}^k$; that is, the nonlinear scattering map preserves these spaces
of asymptotic data. For a more general nonlinearity involving derivatives of
$u$, we show that if the asymptotic data as $t \to -\infty$ is small in
$\langle \zeta \rangle^{-1} \mathcal{W}^k_\zeta$, then the asymptotic data as
$t \to +\infty$ is also in this space (where $\zeta$ is the argument of $f$).
","[{""version"":""v1"",""created"":""Sun, 21 May 2023 11:06:52 GMT""}]","2023-05-23"
"2305.12430","Xue Zhaolong","Zhaolong Xue, Aoyu Gong, Yuan-Hsun Lo, Sirui Tian and Yijin Zhang","Deadline-Constrained Opportunistic Spectrum Access With Spectrum Handoff","6 pages, 10 figures",,,,"eess.SY cs.SY","http://arxiv.org/licenses/nonexclusive-distrib/1.0/","  This paper considers designing an optimal policy for deadline-constrained
access in cognitive radio networks, where a secondary user needs to complete a
packet transmission over the vacant spectrum within a delivery deadline. To
minimize the total access cost, it is desirable to design an optimal
opportunistic access policy by utilizing channel dynamics and sensing outcomes.
We take non-negligible switching overheads, a state-dependent overtime penalty,
and practical switching operations into consideration in the Markov decision
process formulation of such an access problem under wide-band sensing.
Moreover, we establish the existence of monotone optimal decision rules to
reduce the complexity of computing an optimal policy. Simulation results verify
our theoretical studies and the cost advantage over other policies.
","[{""version"":""v1"",""created"":""Sun, 21 May 2023 11:15:13 GMT""}]","2023-05-23"
"2305.12431","Aswathylakshmi P","P Aswathylakshmi and Radha Krishna Ganti","Pilotless Uplink for Massive MIMO Systems","6 pages, 9 figures, submitted to IEEE Global Communications
  Conference (Globecom) 2023",,,,"cs.IT eess.SP math.IT","http://creativecommons.org/licenses/by-nc-sa/4.0/","  Massive MIMO antennas in cellular systems help support a large number of
users in the same time-frequency resource and also provide significant array
gain for uplink reception. However, channel estimation in such large antenna
systems can be tricky, not only since pilot assignment for multiple users is
challenging, but also because the pilot overhead especially for rapidly
changing channels can diminish the system throughput quite significantly. A
pilotless transceiver where the receiver can perform blind demodulation can
solve these issues and boost system throughput by eliminating the need for
pilots in channel estimation. In this paper, we propose an iterative matrix
decomposition algorithm for the blind demodulation of massive MIMO OFDM
signals. This new decomposition technique provides estimates of both the user
symbols and the user channel in the frequency domain simultaneously (to a
scaling factor) without any pilots. Simulation results demonstrate that the
lack of pilots does not affect the error performance of the proposed algorithm
when compared to maximal-ratio-combining (MRC) with pilot-based channel
estimation across a wide range of signal strengths.
","[{""version"":""v1"",""created"":""Sun, 21 May 2023 11:19:45 GMT""}]","2023-05-23"
"2305.12432","Alessandro Finamore","Idio Guarino, Chao Wang, Alessandro Finamore, Antonio Pescape, Dario
  Rossi","Many or Few Samples? Comparing Transfer, Contrastive and Meta-Learning
  in Encrypted Traffic Classification","to appear in Traffic Measurements and Analysis (TMA) 2023",,,,"cs.LG cs.NI","http://arxiv.org/licenses/nonexclusive-distrib/1.0/","  The popularity of Deep Learning (DL), coupled with network traffic visibility
reduction due to the increased adoption of HTTPS, QUIC and DNS-SEC, re-ignited
interest towards Traffic Classification (TC). However, to tame the dependency
from task-specific large labeled datasets we need to find better ways to learn
representations that are valid across tasks. In this work we investigate this
problem comparing transfer learning, meta-learning and contrastive learning
against reference Machine Learning (ML) tree-based and monolithic DL models (16
methods total). Using two publicly available datasets, namely MIRAGE19 (40
classes) and AppClassNet (500 classes), we show that (i) using large datasets
we can obtain more general representations, (ii) contrastive learning is the
best methodology and (iii) meta-learning the worst one, and (iv) while ML
tree-based cannot handle large tasks but fits well small tasks, by means of
reusing learned representations, DL methods are reaching tree-based models
performance also for small tasks.
","[{""version"":""v1"",""created"":""Sun, 21 May 2023 11:20:49 GMT""},{""version"":""v2"",""created"":""Sat, 3 Jun 2023 07:56:53 GMT""}]","2023-06-06"
"2305.12433","Yaohua Zang","Yaohua Zang, Gang Bao","ParticleWNN: a Novel Neural Networks Framework for Solving Partial
  Differential Equations",,,,,"cs.LG cs.NA math.NA","http://creativecommons.org/licenses/by/4.0/","  Deep neural networks (DNNs) have been widely used to solve partial
differential equations (PDEs) in recent years. In this work, a novel deep
learning-based framework named Particle Weak-form based Neural Networks
(ParticleWNN) is developed for solving PDEs in the weak form. In this
framework, the trial space is chosen as the space of DNNs, and the test space
is constructed by functions compactly supported in extremely small regions
whose centers are particles. To train the neural networks, an R-adaptive
strategy is designed to adaptively modify the radius of regions during
training. The ParticleWNN inherits the advantages of weak/variational
formulation, such as requiring less regularity of the solution and a small
number of quadrature points for computing the integrals. Moreover, due to the
special construction of the test functions, the ParticleWNN allows local
training of networks, parallel implementation, and integral calculations only
in extremely small regions. The framework is particularly desirable for solving
problems with high-dimensional and complex domains. The efficiency and accuracy
of the ParticleWNN are demonstrated with several numerical examples. The
numerical results show clear advantages of the ParticleWNN over the
state-of-the-art methods.
","[{""version"":""v1"",""created"":""Sun, 21 May 2023 11:22:48 GMT""},{""version"":""v2"",""created"":""Tue, 23 May 2023 01:51:03 GMT""}]","2023-05-24"
"2305.12434","Wenxuan Wang","Yuxuan Wan, Wenxuan Wang, Pinjia He, Jiazhen Gu, Haonan Bai, Michael
  Lyu","BiasAsker: Measuring the Bias in Conversational AI System","Accepted by FSE 2023",,,,"cs.CL cs.AI","http://arxiv.org/licenses/nonexclusive-distrib/1.0/","  Powered by advanced Artificial Intelligence (AI) techniques, conversational
AI systems, such as ChatGPT and digital assistants like Siri, have been widely
deployed in daily life. However, such systems may still produce content
containing biases and stereotypes, causing potential social problems. Due to
the data-driven, black-box nature of modern AI techniques, comprehensively
identifying and measuring biases in conversational systems remains a
challenging task. Particularly, it is hard to generate inputs that can
comprehensively trigger potential bias due to the lack of data containing both
social groups as well as biased properties. In addition, modern conversational
systems can produce diverse responses (e.g., chatting and explanation), which
makes existing bias detection methods simply based on the sentiment and the
toxicity hardly being adopted. In this paper, we propose BiasAsker, an
automated framework to identify and measure social bias in conversational AI
systems. To obtain social groups and biased properties, we construct a
comprehensive social bias dataset, containing a total of 841 groups and 8,110
biased properties. Given the dataset, BiasAsker automatically generates
questions and adopts a novel method based on existence measurement to identify
two types of biases (i.e., absolute bias and related bias) in conversational
systems. Extensive experiments on 8 commercial systems and 2 famous research
models, such as ChatGPT and GPT-3, show that 32.83% of the questions generated
by BiasAsker can trigger biased behaviors in these widely deployed
conversational systems. All the code, data, and experimental results have been
released to facilitate future research.
","[{""version"":""v1"",""created"":""Sun, 21 May 2023 11:25:59 GMT""}]","2023-05-23"
"2305.12435","Dong Xie","Dong Xie, Chunling Xu","Quantum estimation of tripartite coupling in Spin-Magnon-Mechanical
  Hybrid Systems","7pages,1figure",,,,"quant-ph","http://creativecommons.org/licenses/by/4.0/","  Tripartite interactions play a fundamental role in the quantum information
processing and quantum technology. However, it is generally difficult to
realize strong tripartite coupling. We investigate the estimation of a
tripartite coupling strength in a hybrid setup composed of a single
nitrogen-vacancy (NV) center and a micromagnet. A time-independent parametric
drive can be utilized to increase the estimation precision of the tripartite
coupling strength. By calculating the quantum Fisher information (QFI), we can
obtain the optimal estimation precision by measuring the eigenstate of the
tripartite system. At the critical position, the QFI is divergent due to that
the preparation time of the eigenstate is divergent. When the system is
subjected to a dissipation, the QFI near the critical point of the
driven-dissipation phase transition is analytically obtained. The direct
intensity measurement is the optimal measurement near the dissipation phase
transition point. In addition, we quantify the robustness of an imperfect
measurement operator by the measurement noise susceptibility based on the error
propagation formula. We find that the direct intensity measurement is enough
robust against small measurement disturbance from a coherent drive. But it can
be disturbed by the nonlinear anti-harmonic measurement noise, especially near
the critical point.
","[{""version"":""v1"",""created"":""Sun, 21 May 2023 11:31:26 GMT""}]","2023-05-23"
"2305.12436","Mario Nicola Mazziotta","S. De Gaetano, L. Di Venere, F. Gargano, F. Loparco, L. Lorusso, M. N.
  Mazziotta, G. Panzarini, R. Pillera and D. Serini","Constraints on the gamma-ray emission from Small Solar System Bodies
  with the Fermi Large Area Telescope data","21 pages, 18 figures; accepted for publication in ApJ;",,,,"astro-ph.HE astro-ph.IM astro-ph.SR","http://creativecommons.org/licenses/by/4.0/","  All known Small Solar System Bodies have diameters between a few meters and a
few thousands of kilometers. Based on the collisional evolution of Solar System
Bodies, a larger number of asteroids with diameters down to $\sim 2$ m is
thought to exist. As all Solar System Bodies, Small Bodies can be passive
sources of high-energy gamma rays, produced by the interaction of energetic
cosmic rays impinging on their surfaces. Since the majority of known asteroids
are in orbits between Mars and Jupiter (in a region known as the Main Belt), we
expect them to produce a diffuse emission close to the ecliptic plane. In this
work we have studied the gamma-ray emission coming from the ecliptic using the
data collected by the Large Area Telescope onboard the Fermi satellite. We have
fit the results with simulations of the gamma-ray intensity at source level
(calculated with the software FLUKA) to constrain the Small Solar System Bodies
population. Finally, we have proposed a model describing the distribution of
asteroid sizes and we have used the LAT data to constrain the gamma-ray
emission expected from this model and, in turn, on the model itself.
","[{""version"":""v1"",""created"":""Sun, 21 May 2023 11:38:58 GMT""}]","2023-05-23"
"2305.12437","Xijun Wang","Xijun Wang, Ruiqi Xian, Tianrui Guan, Dinesh Manocha","Prompt Learning for Action Recognition",,,,,"cs.CV","http://creativecommons.org/licenses/by/4.0/","  We present a new general learning approach for action recognition, Prompt
Learning for Action Recognition (PLAR), which leverages the strengths of prompt
learning to guide the learning process. Our approach is designed to predict the
action label by helping the models focus on the descriptions or instructions
associated with actions in the input videos. Our formulation uses various
prompts, including optical flow, large vision models, and learnable prompts to
improve the recognition performance. Moreover, we propose a learnable prompt
method that learns to dynamically generate prompts from a pool of prompt
experts under different inputs. By sharing the same objective, our proposed
PLAR can optimize prompts that guide the model's predictions while explicitly
learning input-invariant (prompt experts pool) and input-specific
(data-dependent) prompt knowledge. We evaluate our approach on datasets
consisting of both ground camera videos and aerial videos, and scenes with
single-agent and multi-agent actions. In practice, we observe a 3.17-10.2%
accuracy improvement on the aerial multi-agent dataset, Okutamam and 0.8-2.6%
improvement on the ground camera single-agent dataset, Something Something V2.
We plan to release our code on the WWW.
","[{""version"":""v1"",""created"":""Sun, 21 May 2023 11:51:09 GMT""}]","2023-05-23"
"2305.12438","Gaven Martin Prof","Mihai Florincescu and Gaven Martin","On the Conformal Energy of Quasisymmetric and Quasim\""obius Mappings",,,,,"math.CV","http://arxiv.org/licenses/nonexclusive-distrib/1.0/","  This article identifies the conformal energy (or mean distortion) of extremal
mappings of finite distortion with a given quasisymmetric mapping of the circle
as boundary data. The conformal energy of $g_o:\IS\to\IS$ is
\begin{equation}\label{energy} \mathcal
E(g_o)=-\frac{1}{4\pi^2}\iint_{\mathbb{S}\times \mathbb{S}}\log
|g_o(\zeta)-g_o(\eta)| \: d\zeta d\bar{\eta} < \infty \end{equation}
  We give explicit formulae for the conformal energy of circle homeomorphisms
directly in terms of their data. As an example, if $g_o: \mathbb{S} \rightarrow
\mathbb{S}$ is an $\eta$-quasi-M\""obius self homeomorphism of the unit circle,
then \begin{align*} \mathcal E(g_o) \leq \frac{1}{\pi} \int^{\pi/2}_0 \log \eta
\big[ \cot^2(t/2)\big] \,\cos(t) \; dt \end{align*} This estimate is sharp.
Additionally we show how a circle homeomorphism of finite conformal energy can
be uniformly approximated on $\IS$ by mappings of strictly smaller energy.
","[{""version"":""v1"",""created"":""Sun, 21 May 2023 11:54:15 GMT""}]","2023-05-23"
"2305.12439","Guang-Yu Guo","Yi-Shiuan Huang, Yang-Hao Chan and Guang-Yu Guo","Large shift current via in-gap and charge-neutral exciton excitations in
  BN nanotubes and single BN layer","12 pages, 8 figures and 2 tables",,,,"cond-mat.mes-hall physics.app-ph physics.comp-ph","http://creativecommons.org/licenses/by/4.0/","  We perform {\it ab initio} many-body calculations to investigate the exciton
shift current in small diameter zigzag BN nanotubes and also single BN sheet,
using the GW plus Bethe-Salpeter equation (GW-BSE) method with the newly
developed efficient algorithms. Our GW-BSE calculations reveal a giant in-gap
peak in the shift current spectrum in all the studied BN systems due to the
excitation of the A exciton. The peak value of the excitonic shift current is
more than three times larger than that of the quasiparticle shift current, and
is attributed to the gigantic enhancement of the optical dipole matrix element
by the A exciton resonance. The effective exciton shift current conductivity is
nearly ten times larger than the largest shift conductivity observed in
ferroelectric semiconductors. Importantly, the direction of the shift current
in the BN nanotubes is found to be independent of the tube chirality ($n,0$)
(or diameter), contrary to the simple rule of $
sgn(J_\text{shift})=\text{mod}(n,3)$ predicted by previous model Hamiltonian
studies. Finally, our {\it ab initio} calculations also show that the exciton
excitation energies decrease significantly with the decreasing diameter due to
the curvature-induced orbital rehybridization in small diameter zigzag BN
nanotubes.
","[{""version"":""v1"",""created"":""Sun, 21 May 2023 12:05:23 GMT""}]","2023-05-23"
