"2305.12292","Ryan Cory-Wright","Dimitris Bertsimas, Ryan Cory-Wright, Sean Lo, and Jean Pauphilet","Optimal Low-Rank Matrix Completion: Semidefinite Relaxations and
  Eigenvector Disjunctions","Also posted to Optimization Online on 15 May; code freely available
  on GitHub; feedback always appreciated",,,,"cs.LG math.OC stat.ML","http://arxiv.org/licenses/nonexclusive-distrib/1.0/","  Low-rank matrix completion consists of computing a matrix of minimal
complexity that recovers a given set of observations as accurately as possible,
and has numerous applications such as product recommendation. Unfortunately,
existing methods for solving low-rank matrix completion are heuristics that,
while highly scalable and often identifying high-quality solutions, do not
possess any optimality guarantees. We reexamine matrix completion with an
optimality-oriented eye, by reformulating low-rank problems as convex problems
over the non-convex set of projection matrices and implementing a disjunctive
branch-and-bound scheme that solves them to certifiable optimality. Further, we
derive a novel and often tight class of convex relaxations by decomposing a
low-rank matrix as a sum of rank-one matrices and incentivizing, via a Shor
relaxation, that each two-by-two minor in each rank-one matrix has determinant
zero. In numerical experiments, our new convex relaxations decrease the
optimality gap by two orders of magnitude compared to existing attempts.
Moreover, we showcase the performance of our disjunctive branch-and-bound
scheme and demonstrate that it solves matrix completion problems over 150x150
matrices to certifiable optimality in hours, constituting an order of magnitude
improvement on the state-of-the-art for certifiably optimal methods.
","[{""version"":""v1"",""created"":""Sat, 20 May 2023 22:04:34 GMT""}]","2023-05-23"
"2305.12293","Jihun Lee","Jihun Lee, Ah-Hyoung Lee, Vincent Leung, Farah Laiwalla, Miguel Angel
  Lopez-Gordo, Lawrence Larson, and Arto Nurmikko","An Asynchronous Wireless Network for Capturing Event-Driven Data from
  Large Populations of Autonomous Sensors",,,,,"eess.SP","http://creativecommons.org/licenses/by-nc-nd/4.0/","  We introduce a wireless RF network concept for capturing sparse event-driven
data from large populations of spatially distributed autonomous microsensors,
possibly numbered in the thousands. Each sensor is assumed to be a microchip
capable of event detection in transforming time-varying inputs to spike trains.
Inspired by brain information processing, we have developed a spectrally
efficient, low-error rate asynchronous networking concept based on a
code-division multiple access method. We characterize the network performance
of several dozen submillimeter-size silicon microchips experimentally,
complemented by larger scale in silico simulations. A comparison is made
between different implementations of on-chip clocks. Testing the notion that
spike-based wireless communication is naturally matched with downstream sensor
population analysis by neuromorphic computing techniques, we then deploy a
spiking neural network (SNN) machine learning model to decode data from eight
thousand spiking neurons in the primate cortex for accurate prediction of hand
movement in a cursor control task.
","[{""version"":""v1"",""created"":""Sat, 20 May 2023 22:16:45 GMT""}]","2023-05-23"
"2305.12294","Pablo And\'ujar-Guerrero","Pablo And\'ujar Guerrero","Cardinality of definable families of sets in o-minimal structures","I have two surnames: And\'ujar Guerrero. ArXiV is unable to represent
  this and instead considers And\'ujar my middle name when generating citations
  etc",,,,"math.LO","http://creativecommons.org/licenses/by-nc-sa/4.0/","  We prove that any definable family of subsets of a definable infinite set $A$
in an o-minimal structure has cardinality at most $|A|$. We derive some
consequences in terms of counting definable types and existence of definable
topological spaces.
","[{""version"":""v1"",""created"":""Sat, 20 May 2023 22:22:32 GMT""}]","2023-06-05"
"2305.12295","Liangming Pan","Liangming Pan, Alon Albalak, Xinyi Wang, William Yang Wang","Logic-LM: Empowering Large Language Models with Symbolic Solvers for
  Faithful Logical Reasoning","Technical Report",,,,"cs.CL cs.AI","http://creativecommons.org/licenses/by/4.0/","  Large Language Models (LLMs) have shown human-like reasoning abilities but
still struggle with complex logical problems. This paper introduces a novel
framework, Logic-LM, which integrates LLMs with symbolic reasoning to improve
logical problem-solving. Our method first utilizes LLMs to translate a natural
language problem into a symbolic formulation. Afterward, a deterministic
symbolic solver performs inference on the formulated problem. We also introduce
a self-refinement stage, which utilizes the symbolic solver's error messages to
revise symbolic formalizations. We demonstrate Logic-LM's effectiveness on four
logical reasoning datasets: ProofWriter, PrOntoQA, FOLIO, and LogicalDeduction.
Our results show significant improvement compared to LLMs alone, with an
average performance boost of 62.6% over standard prompting and 23.5% over
chain-of-thought prompting. Our findings suggest that Logic-LM, by combining
LLMs with symbolic logic, offers a promising avenue for faithful logical
reasoning. Code and data are publicly available at
https://github.com/teacherpeterpan/Logic-LLM.
","[{""version"":""v1"",""created"":""Sat, 20 May 2023 22:25:38 GMT""}]","2023-05-23"
"2305.12296","Xilong Zhou","Xilong Zhou, Milo\v{s} Ha\v{s}an, Valentin Deschaintre, Paul Guerrero,
  Yannick Hold-Geoffroy, Kalyan Sunkavalli, Nima Khademi Kalantari","PhotoMat: A Material Generator Learned from Single Flash Photos",,"Siggraph 2023","10.1145/3588432.3591535",,"cs.CV cs.AI cs.GR","http://arxiv.org/licenses/nonexclusive-distrib/1.0/","  Authoring high-quality digital materials is key to realism in 3D rendering.
Previous generative models for materials have been trained exclusively on
synthetic data; such data is limited in availability and has a visual gap to
real materials. We circumvent this limitation by proposing PhotoMat: the first
material generator trained exclusively on real photos of material samples
captured using a cell phone camera with flash. Supervision on individual
material maps is not available in this setting. Instead, we train a generator
for a neural material representation that is rendered with a learned relighting
module to create arbitrarily lit RGB images; these are compared against real
photos using a discriminator. We then train a material maps estimator to decode
material reflectance properties from the neural material representation. We
train PhotoMat with a new dataset of 12,000 material photos captured with
handheld phone cameras under flash lighting. We demonstrate that our generated
materials have better visual quality than previous material generators trained
on synthetic data. Moreover, we can fit analytical material models to closely
match these generated neural materials, thus allowing for further editing and
use in 3D rendering.
","[{""version"":""v1"",""created"":""Sat, 20 May 2023 22:27:41 GMT""},{""version"":""v2"",""created"":""Tue, 23 May 2023 17:26:27 GMT""}]","2023-05-24"
"2305.12297","Ginestra Bianconi","Ginestra Bianconi and Sergey N. Dorogovtsev","The theory of percolation on hypergraphs","(11 pages, 4 figures)",,,,"physics.soc-ph cond-mat.dis-nn cond-mat.stat-mech cs.SI","http://arxiv.org/licenses/nonexclusive-distrib/1.0/","  Hypergraphs are able to capture interactions between two or more nodes and
for this reason they are raising significant attention in the context of
opinion dynamics, epidemic spreading, synchronization and game theory. However
hypergraph robustness to random damage is not yet widely explored. While the
hypegraph structure can be always encoded in a factor graph, i.e. a bipartite
network between nodes and hyperedges, here we reveal that percolation on
hypegraphs is distinct from percolation on their corresponding factor graphs
when nodes are randomly damaged. Notably, we show that the node percolation
threshold on hypergraphs exceeds node percolation threshold on factor graphs.
Furthermore we show that differently from what happens in ordinary graphs,
containing only edges of cardinality $2$, on hypergraphs the node percolation
threshold and hyperedge percolation threshold do not coincide, with the node
percolation threshold exceeding the hyperedge percolation threshold. These
results are obtained within a message-passing theory valid in the locally
tree-like approximation of the factor graph. In the same approximation we
analytically predict the phase diagram and the critical properties of hypegraph
percolation on random hypergraphs and on multiplex hypergraphs. We compare the
results obtained for hypergraph percolation with the ones for percolation on
factor graphs and we validate our results with Monte Carlo simulations and
message-passing predictions on random hypergraphs and on the real hypergraph of
US Senate committees.
","[{""version"":""v1"",""created"":""Sat, 20 May 2023 22:32:05 GMT""}]","2023-05-23"
"2305.12298","Saif Nouma","Saif E. Nouma and Attila A. Yavuz","Post-Quantum Hybrid Digital Signatures with Hardware-Support for Digital
  Twins","20 pages, 7 figures",,,,"cs.CR","http://creativecommons.org/licenses/by-nc-nd/4.0/","  Digital Twins (DT) virtually model cyber-physical objects using Internet of
Things (IoT) components (e.g., sensors) to gather and process senstive
information stored in the cloud. Trustworthiness of the streamed data is
crucial which requires quantum safety and breach resiliency. Digital signatures
are essential for scalable authentication and non-repudiation. Yet, NIST PQC
signature standards are exorbitantly costly for low-end IoT without considering
forward security. Moreover, Post-Quantum (PQ) signatures lack aggregation,
which is highly desirable to reduce the transmission and storage burdens in
DTs. Hence, there is an urgent need for lightweight digital signatures that
offer compromise resiliency and compactness while permitting an effective
transition into the PQ era for DTs.
  We create a series of highly lightweight digital signatures called
Hardware-ASsisted Efficient Signature (HASES) that meets the above
requirements. The core of HASES is a hardware-assisted cryptographic commitment
construct oracle (CCO) that permits verifiers to obtain expensive commitments
without signer interaction. We created three HASES schemes: PQ-HASES is a
forward-secure PQ signature, LA-HASES is an efficient aggregate Elliptic-Curve
signature, and HY-HASES is a novel hybrid scheme that combines PQ-HASES and
LA-HASES with novel strong nesting and sequential aggregation. HASES does not
require a secure-hardware on the signer. We proved that HASES schemes are
secure and implemented them on commodity hardware and an 8-bit AVR ATmega2560.
Our experiments confirm that PQ-HASES and LA-HASES are two magnitudes of times
more signer efficient than their PQ and conventional-secure counterparts,
respectively. HY-HASES outperforms NIST PQC and conventional signature
combinations, offering a standardcompliant transitional solution for emerging
DTs. We open-source HASES schemes for public testing and adaptation.
","[{""version"":""v1"",""created"":""Sat, 20 May 2023 23:00:14 GMT""}]","2023-05-23"
"2305.12299","Vignon Oussa S","Vignon Oussa","Zero set of Zak transform and the HRT Conjecture",,,,,"math.FA","http://creativecommons.org/licenses/by/4.0/","  The HRT (Heil-Ramanathan-Topiwala) posits the linear independence of any set
of nonzero square-integrable vectors obtained from a single nonzero vector $f$
by applying a finite set of time-frequency shift operators. In this short note,
we present findings centered on the zero set of the Zak transform of $f$, and a
distinct arrangement involving a finite set of $N$ points on an integer lattice
in the time-frequency plane, excluding a specific point.
","[{""version"":""v1"",""created"":""Sat, 20 May 2023 23:37:25 GMT""}]","2023-05-23"
"2305.12300","Xiang-Bin Wang","Jian Leng, Fan Yang, Xiang-Bin Wang","Improving D2p Grover's algorithm to reach performance upper bound under
  phase noise","7 pages, 8 figures",,,,"quant-ph","http://arxiv.org/licenses/nonexclusive-distrib/1.0/","  The original Grover's algorithm has a success probability to output a correct
solution, while deterministic Grover's algorithms improve the success
probability to 100%. However, the success probability of deterministic Grover's
algorithm decreases in noisy environment. Here we improve the deterministic
two-parameter (D2p) Grover's algorithm to reach the upper bound for success
probability under phase noise. We prove that it is not possible to design any
deterministic Grover's algorithm whose success probability is higher than our
improved D2p protocol's under phase noise.
","[{""version"":""v1"",""created"":""Sat, 20 May 2023 23:49:31 GMT""}]","2023-05-23"
"2305.12301","Soujanya Poria","Yi Xuan Tan, Navonil Majumder, Soujanya Poria","Sentence Embedder Guided Utterance Encoder (SEGUE) for Spoken Language
  Understanding","Interspeech 2023",,,,"cs.CL cs.AI cs.SD eess.AS","http://creativecommons.org/licenses/by-sa/4.0/","  The pre-trained speech encoder wav2vec 2.0 performs very well on various
spoken language understanding (SLU) tasks. However, on many tasks, it trails
behind text encoders with textual input. To improve the understanding
capability of SLU encoders, various studies have used knowledge distillation to
transfer knowledge from natural language understanding (NLU) encoders. We use a
very simple method of distilling from a textual sentence embedder directly into
wav2vec 2.0 as pre-training, utilizing paired audio-text datasets. We observed
that this method is indeed capable of improving SLU task performance in
fine-tuned settings, as well as full-data and few-shot transfer on a frozen
encoder. However, the model performs worse on certain tasks highlighting the
strengths and weaknesses of our approach.
","[{""version"":""v1"",""created"":""Sat, 20 May 2023 23:55:55 GMT""}]","2023-05-23"
"2305.12302","Ko Ohm","K. W. Ohm","Projection Theorems and Isometries of Hyperbolic Spaces","11 pages",,,,"math.CA math.DS","http://arxiv.org/licenses/nonexclusive-distrib/1.0/","  We prove a restricted projection theorem for an n-2 dimensional family of
projections from $\mathbb R^n$ to $\mathbb R$.
  The family we consider arises naturally in the context of the adjoint
representation of the maximal unipotent subgroup of ${\rm SO}(n-1,1)$ on the
Lie algebra of ${\rm SO}(n,1)$.
","[{""version"":""v1"",""created"":""Sat, 20 May 2023 23:57:18 GMT""}]","2023-05-23"
"2305.12303","Shi Chen","Shi Chen, Zhiyan Ding, Qin Li, Stephen J. Wright","On optimal bases for multiscale PDEs and Bayesian homogenization",,,,,"math.NA cs.NA","http://arxiv.org/licenses/nonexclusive-distrib/1.0/","  PDE solutions are numerically represented by basis functions. Classical
methods employ pre-defined bases that encode minimum desired PDE properties,
which naturally cause redundant computations. What are the best bases to
numerically represent PDE solutions? From the analytical perspective, the
Kolmogorov $n$-width is a popular criterion for selecting representative basis
functions. From the Bayesian computation perspective, the concept of optimality
selects the modes that, when known, minimize the variance of the conditional
distribution of the rest of the solution. We show that these two definitions of
optimality are equivalent. Numerically, both criteria reduce to solving a
Singular Value Decomposition (SVD), a procedure that can be made numerically
efficient through randomized sampling. We demonstrate computationally the
effectiveness of the basis functions so obtained on several linear and
nonlinear problems. In all cases, the optimal accuracy is achieved with a small
set of basis functions.
","[{""version"":""v1"",""created"":""Sun, 21 May 2023 00:07:27 GMT""}]","2023-05-23"
"2305.12304","Alessio Celeste","Alessio T. B. Celeste and Adriano M. Santos","Lorentz violation in $\gamma$-pair production ($e^{+}e^{-} \rightarrow
  \gamma\gamma$)",,,,,"hep-ph hep-th","http://arxiv.org/licenses/nonexclusive-distrib/1.0/","  This paper specifically focuses on the choice of a temporal background field
over a spatial one in the context of Lorentz symmetry breaking. By examining
the implications of this choice, we aim to understand the effects of Lorentz
violation in different scenarios, with an emphasis on the consequences of
adopting a purely temporal background field. In the analysis of $\gamma$-pair
production, a brief approach in QED is presented, exploring the production of a
pair of photons. Furthermore, the study investigates Lorentz violation with
vectorial nonminimal coupling, analyzing the modifications introduced by this
coupling in the scattering amplitude at the vertex. Additionally, Lorentz
violation with axial-like nonminimal coupling is explored, with a particular
focus. The additional coupling introduces further modifications to the
scattering amplitude, highlighting the intricate nature of Lorentz symmetry
breaking in different scenarios.
","[{""version"":""v1"",""created"":""Sun, 21 May 2023 00:25:05 GMT""},{""version"":""v2"",""created"":""Sat, 3 Jun 2023 15:56:41 GMT""}]","2023-06-06"
"2305.12305","Nikolaos Kidonakis","Nikolaos Kidonakis and Alberto Tonero","aNNLO results for $t{\bar t}\gamma$ cross sections","6 pages, 2 figures; presented at DIS2023, XXX International Workshop
  on Deep-Inelastic Scattering and Related Subjects, 27-31 March 2023",,,,"hep-ph","http://arxiv.org/licenses/nonexclusive-distrib/1.0/","  We present theoretical calculations of total cross sections and top-quark
transverse-momentum and rapidity distributions in the associated production of
a top-antitop pair with a photon ($t{\bar t}\gamma$ production). We include
complete QCD and electroweak corrections at NLO as well as soft-gluon
corrections at approximate NNLO (aNNLO). The aNNLO corrections are very
significant, they decrease theoretical uncertainties, and they are needed for
better comparison with data from the LHC.
","[{""version"":""v1"",""created"":""Sun, 21 May 2023 00:25:56 GMT""}]","2023-05-23"
"2305.12306","Mohammad Farajzadeh Tehrani","Mohammad Farajzadeh-Tehrani and Charles Frohman","On compactifications of the SL(2,C) character varieties of punctured
  surfaces","21 figures",,,,"math.AG math.GT","http://creativecommons.org/licenses/by-nc-nd/4.0/","  This paper addresses several conjectures and questions regarding the absolute
and relative compactifications of the SL(2,C)-character variety of an
$n$-punctured Riemann surface without boundary. We study a class of projective
compactifications determined by ideal triangulations of the surface and prove
explicit results concerning the boundary divisors of these compactifications.
Notably, we establish that the boundary divisors are toric varieties and
confirm a well-known conjecture asserting that the (dual) boundary complex of
any (positive dimensional) relative character variety is a sphere.
Additionally, we verify that relative SL(2,C)-character varieties are log
Calabi-Yau. In a different vein, we enhance and streamline Komyo's
compactification method, which utilizes a projective compactification of
SL(2,C) to compactify the (relative) character varieties. Specifically, we
construct a uniform relative compactification over the base space of
$\mathbb{C}^n$ and determine its monodromy, addressing a question posed by
Simpson.
","[{""version"":""v1"",""created"":""Sun, 21 May 2023 00:29:18 GMT""}]","2023-05-23"
"2305.12307","Tanay Komarlu","Tanay Komarlu, Minhao Jiang, Xuan Wang, Jiawei Han","OntoType: Ontology-Guided Zero-Shot Fine-Grained Entity Typing with Weak
  Supervision from Pre-Trained Language Models",,,,,"cs.CL","http://arxiv.org/licenses/nonexclusive-distrib/1.0/","  Fine-grained entity typing (FET), which assigns entities in text with
context-sensitive, fine-grained semantic types, will play an important role in
natural language understanding. A supervised FET method, which typically relies
on human-annotated corpora for training, is costly and difficult to scale.
Recent studies leverage pre-trained language models (PLMs) to generate rich and
context-aware weak supervision for FET. However, a PLM may still generate a
mixture of rough and fine-grained types, or tokens unsuitable for typing. In
this study, we vision that an ontology provides a semantics-rich, hierarchical
structure, which will help select the best results generated by multiple PLM
models and head words. Specifically, we propose a novel zero-shot,
ontology-guided FET method, OntoType, which follows a type ontological
structure, from coarse to fine, ensembles multiple PLM prompting results to
generate a set of type candidates, and refines its type resolution, under the
local context with a natural language inference model. Our experiments on the
Ontonotes, FIGER, and NYT datasets using their associated ontological
structures demonstrate that our method outperforms the state-of-the-art
zero-shot fine-grained entity typing methods. Our error analysis shows that
refinement of the existing ontology structures will further improve
fine-grained entity typing.
","[{""version"":""v1"",""created"":""Sun, 21 May 2023 00:32:37 GMT""}]","2023-05-23"
"2305.12308","Chao-Kai Wen","Lung-Sheng Tsai, Shang-Ling Shih, Pei-Kai Liao, and Chao-Kai Wen","MIMO Evolution toward 6G: End-User-Centric Collaborative MIMO","7 pages, 5 figures, 1 table. This work has been submitted to the IEEE
  for possible publication. Copyright may be transferred without notice, after
  which this version may no longer be accessible",,,,"cs.IT math.IT","http://creativecommons.org/licenses/by-nc-sa/4.0/","  In 6G, the trend of transitioning from massive antenna elements to even more
massive ones is continued. However, installing additional antennas in the
limited space of user equipment (UE) is challenging, resulting in limited
capacity scaling gain for end-users, despite network-side support for
increasing numbers of antennas. To address this issue, we propose an
end-user-centric collaborative MIMO (UE-CoMIMO) framework that groups several
fixed or portable devices to provide a virtual abundance of antennas. This
article outlines how advanced L1 relays and conventional relays enable device
collaboration to offer diversity, rank, and localization enhancements. We
demonstrate through system-level simulations how the UE-CoMIMO approaches lead
to significant performance gains. Lastly, we discuss necessary research efforts
to make UE-CoMIMO available for 6G and future research directions.
","[{""version"":""v1"",""created"":""Sun, 21 May 2023 00:48:04 GMT""}]","2023-05-23"
"2305.12309","Dongwei Zhao","Dongwei Zhao, Audun Botterud, Marija Ilic","Uniform Pricing vs Pay as Bid in 100%-Renewables Electricity Markets: A
  Game-theoretical Analysis","2023 ACM E-energy",,,,"eess.SY cs.GT cs.SY econ.TH","http://creativecommons.org/licenses/by/4.0/","  This paper evaluates market equilibrium under different pricing mechanisms in
a two-settlement 100%-renewables electricity market. Given general probability
distributions of renewable energy, we establish game-theoretical models to
analyze equilibrium bidding strategies, market prices, and profits under
uniform pricing (UP) and pay-as-bid pricing (PAB). We prove that UP can
incentivize suppliers to withhold bidding quantities and lead to price spikes.
PAB can reduce the market price, but it may lead to a mixed-strategy price
equilibrium. Then, we present a regulated uniform pricing scheme (RUP) based on
suppliers' marginal costs that include penalty costs for real-time deviations.
We show that RUP can achieve lower yet positive prices and profits compared
with PAB in a duopoly market, which approximates the least-cost system outcome.
Simulations with synthetic and real data find that under PAB and RUP, higher
uncertainty of renewables and real-time shortage penalty prices can increase
the market price by encouraging lower bidding quantities, thereby increasing
suppliers' profits.
","[{""version"":""v1"",""created"":""Sun, 21 May 2023 00:50:39 GMT""}]","2023-05-23"
"2305.12310","Ruiyi Yang","Amit Singer and Ruiyi Yang","Alignment of Density Maps in Wasserstein Distance",,,,,"eess.IV q-bio.QM stat.ML","http://arxiv.org/licenses/nonexclusive-distrib/1.0/","  In this paper we propose an algorithm for aligning three-dimensional objects
when represented as density maps, motivated by applications in cryogenic
electron microscopy. The algorithm is based on minimizing the 1-Wasserstein
distance between the density maps after a rigid transformation. The induced
loss function enjoys a more benign landscape than its Euclidean counterpart and
Bayesian optimization is employed for computation. Numerical experiments show
improved accuracy and efficiency over existing algorithms on the alignment of
real protein molecules. In the context of aligning heterogeneous pairs, we
illustrate a potential need for new distance functions.
","[{""version"":""v1"",""created"":""Sun, 21 May 2023 01:13:43 GMT""}]","2023-05-23"
