"2306.01731","Weichao Zhou","Weichao Zhou, Wenchao Li","PAGAR: Imitation Learning with Protagonist Antagonist Guided Adversarial
  Reward",,,,,"cs.LG","http://creativecommons.org/licenses/by/4.0/","  Imitation learning (IL) algorithms often rely on inverse reinforcement
learning (IRL) to first learn a reward function from expert demonstrations.
However, IRL can suffer from identifiability issues and there is no performance
or efficiency guarantee when training with the learned reward function. In this
paper, we propose Protagonist Antagonist Guided Adversarial Reward (PAGAR), a
semi-supervised learning paradigm for designing rewards for policy training.
PAGAR employs an iterative adversarially search for reward functions to
maximize the performance gap between a protagonist policy and an antagonist
policy. This allows the protagonist policy to perform well across a set of
possible reward functions despite the identifiability issue. When integrated
with IRL-based IL, PAGAR guarantees that the trained policy succeeds in the
underlying task. Furthermore, we introduce a practical on-and-off policy
approach to IL with PAGAR. This approach maximally utilizes samples from both
the protagonist and antagonist policies for the optimization of policy and
reward functions. Experimental results demonstrate that our algorithm achieves
higher training efficiency compared to state-of-the-art IL/IRL baselines in
standard settings, as well as zero-shot learning from demonstrations in
transfer environments.
","[{""version"":""v1"",""created"":""Fri, 2 Jun 2023 17:57:53 GMT""}]","2023-06-05"
"2306.01732","Hanyuan Liu","Hanyuan Liu, Minshan Xie, Jinbo Xing, Chengze Li, Tien-Tsin Wong","Video Colorization with Pre-trained Text-to-Image Diffusion Models","project page: https://colordiffuser.github.io/",,,,"cs.CV cs.AI cs.GR","http://arxiv.org/licenses/nonexclusive-distrib/1.0/","  Video colorization is a challenging task that involves inferring plausible
and temporally consistent colors for grayscale frames. In this paper, we
present ColorDiffuser, an adaptation of a pre-trained text-to-image latent
diffusion model for video colorization. With the proposed adapter-based
approach, we repropose the pre-trained text-to-image model to accept input
grayscale video frames, with the optional text description, for video
colorization. To enhance the temporal coherence and maintain the vividness of
colorization across frames, we propose two novel techniques: the Color
Propagation Attention and Alternated Sampling Strategy. Color Propagation
Attention enables the model to refine its colorization decision based on a
reference latent frame, while Alternated Sampling Strategy captures
spatiotemporal dependencies by using the next and previous adjacent latent
frames alternatively as reference during the generative diffusion sampling
steps. This encourages bidirectional color information propagation between
adjacent video frames, leading to improved color consistency across frames. We
conduct extensive experiments on benchmark datasets, and the results
demonstrate the effectiveness of our proposed framework. The evaluations show
that ColorDiffuser achieves state-of-the-art performance in video colorization,
surpassing existing methods in terms of color fidelity, temporal consistency,
and visual quality.
","[{""version"":""v1"",""created"":""Fri, 2 Jun 2023 17:58:00 GMT""}]","2023-06-05"
"2306.01733","Srikar Appalaraju","Srikar Appalaraju, Peng Tang, Qi Dong, Nishant Sankaran, Yichu Zhou,
  R. Manmatha","DocFormerv2: Local Features for Document Understanding",,,,,"cs.CV cs.CL cs.LG","http://creativecommons.org/licenses/by-nc-nd/4.0/","  We propose DocFormerv2, a multi-modal transformer for Visual Document
Understanding (VDU). The VDU domain entails understanding documents (beyond
mere OCR predictions) e.g., extracting information from a form, VQA for
documents and other tasks. VDU is challenging as it needs a model to make sense
of multiple modalities (visual, language and spatial) to make a prediction. Our
approach, termed DocFormerv2 is an encoder-decoder transformer which takes as
input - vision, language and spatial features. DocFormerv2 is pre-trained with
unsupervised tasks employed asymmetrically i.e., two novel document tasks on
encoder and one on the auto-regressive decoder. The unsupervised tasks have
been carefully designed to ensure that the pre-training encourages
local-feature alignment between multiple modalities. DocFormerv2 when evaluated
on nine datasets shows state-of-the-art performance over strong baselines e.g.
TabFact (4.3%), InfoVQA (1.4%), FUNSD (1%). Furthermore, to show generalization
capabilities, on three VQA tasks involving scene-text, Doc- Formerv2
outperforms previous comparably-sized models and even does better than much
larger models (such as GIT2, PaLi and Flamingo) on some tasks. Extensive
ablations show that due to its pre-training, DocFormerv2 understands multiple
modalities better than prior-art in VDU.
","[{""version"":""v1"",""created"":""Fri, 2 Jun 2023 17:58:03 GMT""}]","2023-06-05"
"2306.01734","Pedro H. Zambrano","Jose Moncayo and Pedro H. Zambrano","Constructible sets in lattice-valued models: A negative result",,,,,"math.LO","http://arxiv.org/licenses/nonexclusive-distrib/1.0/","  We investigate different set-theoretic constructions in Residuated Logic
based on Fitting's work on Intuitionistic Set Theory. We start by stating some
results concerning constructible sets within valued models of Set Theory. We
present two distinct constructions of the constructible universe:
$\mathfrak{L}^{\mathbb{Q}}$ and $\mathbb{L}^{\mathbb{Q}}$, and show that they
are isomorphic to V (the classical von Neumann universe) and L (the classical
G\""odel constructible universe), respectively. Even though lattice-valued
models are the natural way to study non-classical Set Theory (e.g.,
Intuitionistic, Residuated, Paraconsistent Set Theory),our results prove that
the use of lattice-valued models is not suitable to study the notion of
constructibility in logics weaker than classical logic.
","[{""version"":""v1"",""created"":""Fri, 2 Jun 2023 17:58:21 GMT""}]","2023-06-05"
"2306.01735","Michael Saxon","Michael Saxon, William Yang Wang","Multilingual Conceptual Coverage in Text-to-Image Models","ACL 2023 main conference; 16 pages, 13 figures",,,,"cs.CL cs.AI cs.CV eess.IV","http://arxiv.org/licenses/nonexclusive-distrib/1.0/","  We propose ""Conceptual Coverage Across Languages"" (CoCo-CroLa), a technique
for benchmarking the degree to which any generative text-to-image system
provides multilingual parity to its training language in terms of tangible
nouns. For each model we can assess ""conceptual coverage"" of a given target
language relative to a source language by comparing the population of images
generated for a series of tangible nouns in the source language to the
population of images generated for each noun under translation in the target
language. This technique allows us to estimate how well-suited a model is to a
target language as well as identify model-specific weaknesses, spurious
correlations, and biases without a-priori assumptions. We demonstrate how it
can be used to benchmark T2I models in terms of multilinguality, and how
despite its simplicity it is a good proxy for impressive generalization.
","[{""version"":""v1"",""created"":""Fri, 2 Jun 2023 17:59:09 GMT""}]","2023-06-05"
"2306.01736","Xiuye Gu","Xiuye Gu, Yin Cui, Jonathan Huang, Abdullah Rashwan, Xuan Yang, Xingyi
  Zhou, Golnaz Ghiasi, Weicheng Kuo, Huizhong Chen, Liang-Chieh Chen, David A
  Ross","DaTaSeg: Taming a Universal Multi-Dataset Multi-Task Segmentation Model",,,,,"cs.CV cs.AI cs.LG","http://arxiv.org/licenses/nonexclusive-distrib/1.0/","  Observing the close relationship among panoptic, semantic and instance
segmentation tasks, we propose to train a universal multi-dataset multi-task
segmentation model: DaTaSeg.We use a shared representation (mask proposals with
class predictions) for all tasks. To tackle task discrepancy, we adopt
different merge operations and post-processing for different tasks. We also
leverage weak-supervision, allowing our segmentation model to benefit from
cheaper bounding box annotations. To share knowledge across datasets, we use
text embeddings from the same semantic embedding space as classifiers and share
all network parameters among datasets. We train DaTaSeg on ADE semantic, COCO
panoptic, and Objects365 detection datasets. DaTaSeg improves performance on
all datasets, especially small-scale datasets, achieving 54.0 mIoU on ADE
semantic and 53.5 PQ on COCO panoptic. DaTaSeg also enables weakly-supervised
knowledge transfer on ADE panoptic and Objects365 instance segmentation.
Experiments show DaTaSeg scales with the number of training datasets and
enables open-vocabulary segmentation through direct transfer. In addition, we
annotate an Objects365 instance segmentation set of 1,000 images and will
release it as a public benchmark.
","[{""version"":""v1"",""created"":""Fri, 2 Jun 2023 17:59:24 GMT""}]","2023-06-05"
"2306.01737","Joyce Kwan","Joyce Kwan, Perrin Segura, Yanfei Li, Sooshin Kim, Alexey V. Gorshkov,
  Andr\'e Eckardt, Brice Bakkali-Hassani, Markus Greiner","Realization of 1D Anyons with Arbitrary Statistical Phase","8+10 pages, 5 figures",,,,"cond-mat.quant-gas physics.atom-ph quant-ph","http://arxiv.org/licenses/nonexclusive-distrib/1.0/","  Low-dimensional quantum systems can host anyons, particles with exchange
statistics that are neither bosonic nor fermionic. Despite indications of a
wealth of exotic phenomena, the physics of anyons in one dimension (1D) remains
largely unexplored. Here, we realize Abelian anyons in 1D with arbitrary
exchange statistics using ultracold atoms in an optical lattice, where we
engineer the statistical phase via a density-dependent Peierls phase. We
explore the dynamical behavior of two anyons undergoing quantum walks, and
observe the anyonic Hanbury Brown-Twiss effect, as well as the formation of
bound states without on-site interactions. Once interactions are introduced, we
observe spatially asymmetric transport in contrast to the symmetric dynamics of
bosons and fermions. Our work forms the foundation for exploring the many-body
behavior of 1D anyons.
","[{""version"":""v1"",""created"":""Fri, 2 Jun 2023 17:59:29 GMT""}]","2023-06-05"
"2306.01738","Zhangyang Qi","Zhangyang Qi, Jiaqi Wang, Xiaoyang Wu, Hengshuang Zhao","OCBEV: Object-Centric BEV Transformer for Multi-View 3D Object Detection",,,,,"cs.CV","http://arxiv.org/licenses/nonexclusive-distrib/1.0/","  Multi-view 3D object detection is becoming popular in autonomous driving due
to its high effectiveness and low cost. Most of the current state-of-the-art
detectors follow the query-based bird's-eye-view (BEV) paradigm, which benefits
from both BEV's strong perception power and end-to-end pipeline. Despite
achieving substantial progress, existing works model objects via globally
leveraging temporal and spatial information of BEV features, resulting in
problems when handling the challenging complex and dynamic autonomous driving
scenarios. In this paper, we proposed an Object-Centric query-BEV detector
OCBEV, which can carve the temporal and spatial cues of moving targets more
effectively. OCBEV comprises three designs: Object Aligned Temporal Fusion
aligns the BEV feature based on ego-motion and estimated current locations of
moving objects, leading to a precise instance-level feature fusion. Object
Focused Multi-View Sampling samples more 3D features from an adaptive local
height ranges of objects for each scene to enrich foreground information.
Object Informed Query Enhancement replaces part of pre-defined decoder queries
in common DETR-style decoders with positional features of objects on
high-confidence locations, introducing more direct object positional priors.
Extensive experimental evaluations are conducted on the challenging nuScenes
dataset. Our approach achieves a state-of-the-art result, surpassing the
traditional BEVFormer by 1.5 NDS points. Moreover, we have a faster convergence
speed and only need half of the training iterations to get comparable
performance, which further demonstrates its effectiveness.
","[{""version"":""v1"",""created"":""Fri, 2 Jun 2023 17:59:48 GMT""}]","2023-06-05"
"2306.01827","MD Abdullah Al Nasim","Angona Biswas, MD Abdullah Al Nasim, Md Shahin Ali, Ismail Hossain,
  Dr. Md Azim Ullah, Sajedul Talukder","Active Learning on Medical Image","12 pages, 8 figures; Acceptance of the chapter for the Springer book
  ""Data-driven approaches to medical imaging""",,,,"eess.IV","http://creativecommons.org/publicdomain/zero/1.0/","  The development of medical science greatly depends on the increased
utilization of machine learning algorithms. By incorporating machine learning,
the medical imaging field can significantly improve in terms of the speed and
accuracy of the diagnostic process. Computed tomography (CT), magnetic
resonance imaging (MRI), X-ray imaging, ultrasound imaging, and positron
emission tomography (PET) are the most commonly used types of imaging data in
the diagnosis process, and machine learning can aid in detecting diseases at an
early stage. However, training machine learning models with limited annotated
medical image data poses a challenge. The majority of medical image datasets
have limited data, which can impede the pattern-learning process of
machine-learning algorithms. Additionally, the lack of labeled data is another
critical issue for machine learning. In this context, active learning
techniques can be employed to address the challenge of limited annotated
medical image data. Active learning involves iteratively selecting the most
informative samples from a large pool of unlabeled data for annotation by
experts. By actively selecting the most relevant and informative samples,
active learning reduces the reliance on large amounts of labeled data and
maximizes the model's learning capacity with minimal human labeling effort. By
incorporating active learning into the training process, medical imaging
machine learning models can make more efficient use of the available labeled
data, improving their accuracy and performance. This approach allows medical
professionals to focus their efforts on annotating the most critical cases,
while the machine learning model actively learns from these annotated samples
to improve its diagnostic capabilities.
","[{""version"":""v1"",""created"":""Fri, 2 Jun 2023 16:24:39 GMT""},{""version"":""v2"",""created"":""Wed, 7 Jun 2023 14:42:42 GMT""}]","2023-06-08"
"2306.01828","Daniel Bear","Daniel M. Bear, Kevin Feigelis, Honglin Chen, Wanhee Lee, Rahul
  Venkatesh, Klemen Kotar, Alex Durango, Daniel L.K. Yamins","Unifying (Machine) Vision via Counterfactual World Modeling",,,,,"cs.CV cs.AI","http://creativecommons.org/licenses/by/4.0/","  Leading approaches in machine vision employ different architectures for
different tasks, trained on costly task-specific labeled datasets. This
complexity has held back progress in areas, such as robotics, where robust
task-general perception remains a bottleneck. In contrast, ""foundation models""
of natural language have shown how large pre-trained neural networks can
provide zero-shot solutions to a broad spectrum of apparently distinct tasks.
Here we introduce Counterfactual World Modeling (CWM), a framework for
constructing a visual foundation model: a unified, unsupervised network that
can be prompted to perform a wide variety of visual computations. CWM has two
key components, which resolve the core issues that have hindered application of
the foundation model concept to vision. The first is structured masking, a
generalization of masked prediction methods that encourages a prediction model
to capture the low-dimensional structure in visual data. The model thereby
factors the key physical components of a scene and exposes an interface to them
via small sets of visual tokens. This in turn enables CWM's second main idea --
counterfactual prompting -- the observation that many apparently distinct
visual representations can be computed, in a zero-shot manner, by comparing the
prediction model's output on real inputs versus slightly modified
(""counterfactual"") inputs. We show that CWM generates high-quality readouts on
real-world images and videos for a diversity of tasks, including estimation of
keypoints, optical flow, occlusions, object segments, and relative depth. Taken
together, our results show that CWM is a promising path to unifying the
manifold strands of machine vision in a conceptually simple foundation.
","[{""version"":""v1"",""created"":""Fri, 2 Jun 2023 17:45:44 GMT""}]","2023-06-06"
"2306.01829","Ralph Silva","Ralph Silva, Nuriya Nurgalieva, Henrik Wilming","Ticking clocks in quantum theory","16 pages + 3 pages appendix, 4 figures",,,,"quant-ph","http://creativecommons.org/licenses/by/4.0/","  We present a derivation of the structure and dynamics of a ticking clock by
showing that for finite systems a single natural principle serves to
distinguish what we understand as ticking clocks from time-keeping systems in
general. As a result we recover the bipartite structure of such a clock: that
the information about ticks is a classical degree of freedom. We describe the
most general form of the dynamics of such a clock, and discuss the additional
simplifications to go from a general ticking clock to models encountered in
literature. The resultant framework encompasses various recent research results
despite their apparent differences. Finally, we introduce the information
theory of ticking clocks, distinguishing their abstract information content and
the actually accessible information.
","[{""version"":""v1"",""created"":""Fri, 2 Jun 2023 18:00:01 GMT""}]","2023-06-06"
"2306.01830","Ethan Nadler","Ethan O. Nadler, Daneng Yang, Hai-Bo Yu","An SIDM Solution to the Extreme Diversity of Low-mass Halo Properties","10 pages, 6 figures",,,,"astro-ph.GA astro-ph.CO hep-ph","http://arxiv.org/licenses/nonexclusive-distrib/1.0/","  The properties of low-mass dark matter halos appear to be remarkably diverse
relative to predictions of cold, collisionless dark matter, even in the
presence of baryons. We show that self-interacting dark matter can
simultaneously explain two extreme measurements of halo diversity in different
directions -- namely, the rotation curves of low-concentration halos associated
with gas-rich ultra-diffuse galaxies in the field and the inner density profile
of the dense substructure perturbing the strong lens galaxy SDSSJ0946+1006. We
present the first cosmological zoom-in simulation featuring strong dark matter
self-interactions in a galaxy group environment centered on a
$10^{13}~M_{\mathrm{\odot}}$ host halo. These interactions produce
kiloparsec-scale cores in low-concentration isolated halos, which could host
the ultra-diffuse galaxies, while most surviving subhalos of the group-mass
host are deeply core-collapsed, yielding excellent candidates for the observed
dense strong-lens perturber. Our scenario can be further tested with
observations of galactic systems over a wide mass range.
","[{""version"":""v1"",""created"":""Fri, 2 Jun 2023 18:00:01 GMT""}]","2023-06-06"
"2306.01831","Arthur Parzygnat","James Fullwood and Arthur J. Parzygnat","On dynamical measures of quantum information","Comments welcome!",,,,"quant-ph cs.IT gr-qc math.IT","http://arxiv.org/licenses/nonexclusive-distrib/1.0/","  In this work, we use the theory of quantum states over time to define an
entropy $S(\rho,\mathcal{E})$ associated with quantum processes
$(\rho,\mathcal{E})$, where $\rho$ is a state and $\mathcal{E}$ is a quantum
channel responsible for the dynamical evolution of $\rho$. The entropy
$S(\rho,\mathcal{E})$ is a generalization of the von Neumann entropy in the
sense that $S(\rho,\mathrm{id})=S(\rho)$ (where $\mathrm{id}$ denotes the
identity channel), and is a dynamical analogue of the quantum joint entropy for
bipartite states. Such an entropy is then used to define dynamical formulations
of the quantum conditional entropy and quantum mutual information, and we show
such information measures satisfy many desirable properties, such as a quantum
entropic Bayes' rule. We also use our entropy function to quantify the
information loss/gain associated with the dynamical evolution of quantum
systems, which enables us to formulate a precise notion of information
conservation for quantum processes.
","[{""version"":""v1"",""created"":""Fri, 2 Jun 2023 18:00:01 GMT""}]","2023-06-06"
"2306.01832","Joseph Simon","Joseph Simon","Exploring Proxies for the Supermassive Black Hole Mass Function:
  Implications for Pulsar Timing Arrays","11 pages, 5 figures, published in The Astrophysical Journal Letters","ApJL 949 L24 (2023)","10.3847/2041-8213/acd18e",,"astro-ph.GA astro-ph.HE","http://creativecommons.org/licenses/by/4.0/","  Supermassive black holes (SMBHs) reside at the center of every massive galaxy
in the local Universe with masses that closely correlate with observations of
their host galaxy implying a connected evolutionary history. The population of
binary SMBHs, which form following galaxy mergers, is expected to produce a
gravitational wave background (GWB) detectable by pulsar timing arrays (PTAs).
PTAs are starting to see hints of what may be a GWB, and the amplitude of the
emerging signal is towards the higher end of model predictions. Simulated
populations of binary SMBHs can be constructed from observations of galaxies
and are used to make predictions about the nature of the GWB. The greatest
source of uncertainty in these observation-based models comes from the
inference of the SMBH mass function, which is derived from observed host galaxy
properties. In this paper, I undertake a new approach for inferring the SMBH
mass function starting from a velocity dispersion function rather than a galaxy
stellar mass function. I argue that this method allows for a more direct
inference by relying on a larger suite of individual galaxy observations as
well as relying on a more ""fundamental"" SMBH mass relation. I find that the
resulting binary SMBH population contains more massive systems at higher
redshifts than previous models. Additionally, I explore the implications for
the detection of individually resolvable sources in PTA data.
","[{""version"":""v1"",""created"":""Fri, 2 Jun 2023 18:00:01 GMT""}]","2023-06-06"
"2306.01833","Tetyana Pitik","Tetyana Pitik, Irene Tamborra, Massimiliano Lincetto, Anna Franckowiak","Optically Informed Searches of High-Energy Neutrinos from
  Interaction-Powered Supernovae","20 pages, including 14 figures and 3 appendices",,,,"astro-ph.HE astro-ph.IM hep-ph","http://arxiv.org/licenses/nonexclusive-distrib/1.0/","  The interaction between the ejecta of supernovae (SNe) of Type IIn and a
dense circumstellar medium (CSM) can efficiently generate thermal UV/optical
radiation and lead to the emission of neutrinos in the $1$-$10^{3}$ TeV range.
We investigate the connection between the neutrino signal detectable at the
IceCube Neutrino Observatory and the electromagnetic signal observable by
optical wide-field, high-cadence surveys to outline the best strategy for
upcoming follow-up searches. We outline a semi-analytical model that connects
the optical lightcurve properties to the SN parameters and find that a large
peak luminosity ($ L_{\rm{peak}}\gtrsim 10^{43}$-$10^{44}$ erg) and an average
rise time ($t_{\rm{rise}}\gtrsim 10$-$40$ days) are necessary for copious
neutrino emission. Nevertheless, the most promising $ L_{\rm{peak}}$ and
$t_{\rm{rise}}$ are not sufficient to guarantee ideal conditions for neutrino
detection. Comparable optical properties can be obtained for SN configurations
that are not optimal for neutrino emission. Such ambiguous correspondence
between the optical lightcurve properties and the number of IceCube neutrino
events implies that relying on optical observations only, a range of expected
neutrino events should be considered (e.g. the expected number of neutrino
events can vary up to two orders of magnitude for some among the brightest SNe
IIn observed by the Zwicky Transient Facility up to now, SN 2020usa and SN
2020in). In addition, the peak in the high-energy neutrino curve should be
expected a few $t_{\rm{rise}}$ after the peak in the optical lightcurve. Our
findings highlight that it is crucial to infer the SN properties from
multi-wavelength observations rather than focusing on the optical band only to
enhance upcoming neutrino searches.
","[{""version"":""v1"",""created"":""Fri, 2 Jun 2023 18:00:01 GMT""}]","2023-06-06"
