"2306.02046","Chang Liu","Yaoxin Li, Yongchao Wang, Zichen Lian, Hao Li, Zhiting Gao, Liangcai
  Xu, Huan Wang, Ruie Lu, Longfei Li, Yang Feng, Tianlong Xia, Chang Liu,
  Shuang Jia, Yang Wu, Jinsong Zhang, Chang Liu, Yayu Wang","Two types of zero Hall phenomena in few-layer MnBi$_2$Te$_4$","21 pages, 4 figures",,,,"cond-mat.mes-hall cond-mat.mtrl-sci","http://arxiv.org/licenses/nonexclusive-distrib/1.0/","  The van der Waals antiferromagnetic topological insulator MnBi$_2$Te$_4$
represents a promising platform for exploring the layer-dependent magnetism and
topological states of matter. Despite the realization of several quantized
phenomena, such as the quantum anomalous Hall effect and the axion insulator
state, the recently observed discrepancies between magnetic and transport
properties have aroused controversies concerning the topological nature of
MnBi$_2$Te$_4$ in the ground state. Here, we demonstrate the existence of two
distinct types of zero Hall phenomena in few-layer MnBi$_2$Te$_4$. In addition
to the robust zero Hall plateau associated with the axion insulator state, an
unexpected zero Hall phenomenon also occurs in some odd-number-septuple layer
devices. Importantly, a statistical survey of the optical contrast in more than
200 MnBi$_2$Te$_4$ reveals that such accidental zero Hall phenomenon arises
from the reduction of effective thickness during fabrication process, a factor
that was rarely noticed in previous studies of 2D materials. Our finding not
only resolves the controversies on the relation between magnetism and anomalous
Hall effect in MnBi$_2$Te$_4$, but also highlights the critical issues
concerning the fabrication and characterization of devices based on 2D
materials.
","[{""version"":""v1"",""created"":""Sat, 3 Jun 2023 08:03:57 GMT""}]","2023-06-06"
"2306.02047","Guangjun Shen","Shen Gunagjun, Zhou Huan, Wu Jianglun","Large deviation principle for multi-scale distribution dependent
  stochastic differential equations driven by fractional Brownian motions","28 pages ,0 figures",,,,"math.PR","http://arxiv.org/licenses/nonexclusive-distrib/1.0/","  In this paper, we are concerned with multi-scale distribution dependent
stochastic differential equations driven by fractional Brownian motion (with
Hurst index $H>\frac12$ and standard Brownian motion, simultaneously. Our aim
is to establish a large deviation principle for the multi-scale distribution
dependent stochastic differential equations. This is done via the weak
convergence approach and our proof is based heavily on the fractional calculus.
","[{""version"":""v1"",""created"":""Sat, 3 Jun 2023 08:11:40 GMT""}]","2023-06-06"
"2306.02048","Somnath Bhowmick","Achintya Priydarshi, Abhinav Arora, Yogesh Singh Chauhan, Amit
  Agarwal, and Somnath Bhowmick","Versatility of type-II van der Waals heterostructures: a case study with
  SiH-CdCl2",,,,,"cond-mat.mtrl-sci","http://creativecommons.org/licenses/by/4.0/","  Unlike bilayers or a few layers thick materials, heterostructures are
designer materials formed by assembling different monolayers in any desired
sequence. As a result, while multilayer materials come with their intrinsic
properties, heterostructures can be tailor-made to suit specific applications.
Taking SiH-CdCl 2 as a representative system, we show the potential of
heterostructures for several applications, like piezoelectricity,
photocatalytic water splitting, and tunnel field effect transistor (TFET). Our
study confirms that the characteristics of the heterostructure mainly depend on
the potential difference between the constituent monolayers. From the vast
database of available layered materials, many such combinations with a suitable
potential difference are expected to have similar properties. Our work points
to a vast pool of assembled materials with multifunctionality, an excellent
asset for next-generation device applications.
","[{""version"":""v1"",""created"":""Sat, 3 Jun 2023 08:22:29 GMT""}]","2023-06-06"
"2306.02049","Kensen Shi","Kensen Shi, Hanjun Dai, Wen-Ding Li, Kevin Ellis, Charles Sutton","LambdaBeam: Neural Program Search with Higher-Order Functions and
  Lambdas",,,,,"cs.LG cs.PL","http://arxiv.org/licenses/nonexclusive-distrib/1.0/","  Search is an important technique in program synthesis that allows for
adaptive strategies such as focusing on particular search directions based on
execution results. Several prior works have demonstrated that neural models are
effective at guiding program synthesis searches. However, a common drawback of
those approaches is the inability to handle iterative loops, higher-order
functions, or lambda functions, thus limiting prior neural searches from
synthesizing longer and more general programs. We address this gap by designing
a search algorithm called LambdaBeam that can construct arbitrary lambda
functions that compose operations within a given DSL. We create semantic vector
representations of the execution behavior of the lambda functions and train a
neural policy network to choose which lambdas to construct during search, and
pass them as arguments to higher-order functions to perform looping
computations. Our experiments show that LambdaBeam outperforms neural,
symbolic, and LLM-based techniques in an integer list manipulation domain.
","[{""version"":""v1"",""created"":""Sat, 3 Jun 2023 08:24:53 GMT""}]","2023-06-06"
"2306.02050","Qingyang Zhang","Qingyang Zhang, Haitao Wu, Changqing Zhang, Qinghua Hu, Huazhu Fu,
  Joey Tianyi Zhou, Xi Peng","Provable Dynamic Fusion for Low-Quality Multimodal Data","Accepted by ICML 2023",,,,"cs.LG cs.CV","http://creativecommons.org/licenses/by/4.0/","  The inherent challenge of multimodal fusion is to precisely capture the
cross-modal correlation and flexibly conduct cross-modal interaction. To fully
release the value of each modality and mitigate the influence of low-quality
multimodal data, dynamic multimodal fusion emerges as a promising learning
paradigm. Despite its widespread use, theoretical justifications in this field
are still notably lacking. Can we design a provably robust multimodal fusion
method? This paper provides theoretical understandings to answer this question
under a most popular multimodal fusion framework from the generalization
perspective. We proceed to reveal that several uncertainty estimation solutions
are naturally available to achieve robust multimodal fusion. Then a novel
multimodal fusion framework termed Quality-aware Multimodal Fusion (QMF) is
proposed, which can improve the performance in terms of classification accuracy
and model robustness. Extensive experimental results on multiple benchmarks can
support our findings.
","[{""version"":""v1"",""created"":""Sat, 3 Jun 2023 08:32:35 GMT""},{""version"":""v2"",""created"":""Tue, 6 Jun 2023 13:46:22 GMT""}]","2023-06-07"
"2306.02051","Xiaoyan Zhao","Xiaoyan Zhao, Yang Deng, Min Yang, Lingzhi Wang, Rui Zhang, Hong
  Cheng, Wai Lam, Ying Shen, Ruifeng Xu","A Comprehensive Survey on Deep Learning for Relation Extraction: Recent
  Advances and New Frontiers",,,,,"cs.CL cs.AI","http://arxiv.org/licenses/nonexclusive-distrib/1.0/","  Relation extraction (RE) involves identifying the relations between entities
from unstructured texts. RE serves as the foundation for many natural language
processing (NLP) applications, such as knowledge graph completion, question
answering, and information retrieval. In recent years, deep neural networks
have dominated the field of RE and made noticeable progress. Subsequently, the
large pre-trained language models (PLMs) have taken the state-of-the-art of RE
to a new level. This survey provides a comprehensive review of existing deep
learning techniques for RE. First, we introduce RE resources, including RE
datasets and evaluation metrics. Second, we propose a new taxonomy to
categorize existing works from three perspectives (text representation, context
encoding, and triplet prediction). Third, we discuss several important
challenges faced by RE and summarize potential techniques to tackle these
challenges. Finally, we outline some promising future directions and prospects
in this field. This survey is expected to facilitate researchers' collaborative
efforts to tackle the challenges of real-life RE systems.
","[{""version"":""v1"",""created"":""Sat, 3 Jun 2023 08:39:25 GMT""},{""version"":""v2"",""created"":""Tue, 6 Jun 2023 12:39:21 GMT""}]","2023-06-07"
"2306.02052","Lea Frermann","Lea Frermann, Jiatong Li, Shima Khanehzar, Gosia Mikolajczak","Conflicts, Villains, Resolutions: Towards models of Narrative Media
  Framing","To appear in ACL 2023 (main conference)",,,,"cs.CL","http://creativecommons.org/licenses/by-sa/4.0/","  Despite increasing interest in the automatic detection of media frames in
NLP, the problem is typically simplified as single-label classification and
adopts a topic-like view on frames, evading modelling the broader
document-level narrative. In this work, we revisit a widely used
conceptualization of framing from the communication sciences which explicitly
captures elements of narratives, including conflict and its resolution, and
integrate it with the narrative framing of key entities in the story as heroes,
victims or villains. We adapt an effective annotation paradigm that breaks a
complex annotation task into a series of simpler binary questions, and present
an annotated data set of English news articles, and a case study on the framing
of climate change in articles from news outlets across the political spectrum.
Finally, we explore automatic multi-label prediction of our frames with
supervised and semi-supervised approaches, and present a novel retrieval-based
method which is both effective and transparent in its predictions. We conclude
with a discussion of opportunities and challenges for future work on
document-level models of narrative framing.
","[{""version"":""v1"",""created"":""Sat, 3 Jun 2023 08:50:13 GMT""}]","2023-06-06"
"2306.02053","Yanxiong Li","Yanxiong Li, Wenchang Cao, Jialong Li, Wei Xie, Qianhua He","Few-shot Class-incremental Audio Classification Using Stochastic
  Classifier","5 pages, 3 figures, 4 tables. Accepted for publication in INTERSPEECH
  2023",,,,"eess.AS","http://creativecommons.org/licenses/by-sa/4.0/","  It is generally assumed that number of classes is fixed in current audio
classification methods, and the model can recognize pregiven classes only. When
new classes emerge, the model needs to be retrained with adequate samples of
all classes. If new classes continually emerge, these methods will not work
well and even infeasible. In this study, we propose a method for fewshot
class-incremental audio classification, which continually recognizes new
classes and remember old ones. The proposed model consists of an embedding
extractor and a stochastic classifier. The former is trained in base session
and frozen in incremental sessions, while the latter is incrementally expanded
in all sessions. Two datasets (NS-100 and LS-100) are built by choosing samples
from audio corpora of NSynth and LibriSpeech, respectively. Results show that
our method exceeds four baseline ones in average accuracy and performance
dropping rate. Code is at https://github.com/vinceasvp/meta-sc.
","[{""version"":""v1"",""created"":""Sat, 3 Jun 2023 08:59:01 GMT""}]","2023-06-06"
"2306.02054","Yanxiong Li","Yanxiong Li, Wenchang Cao, Wei Xie, Qisheng Huang, Wenfeng Pang,
  Qianhua He","Low-Complexity Acoustic Scene Classification Using Data Augmentation and
  Lightweight ResNet","5 pages, 5 figures, 4 tables. Accepted for publication in the 16th
  IEEE International Conference on Signal Processing (IEEE ICSP)",,,,"eess.AS","http://creativecommons.org/licenses/by-sa/4.0/","  We present a work on low-complexity acoustic scene classification (ASC) with
multiple devices, namely the subtask A of Task 1 of the DCASE2021 challenge.
This subtask focuses on classifying audio samples of multiple devices with a
low-complexity model, where two main difficulties need to be overcome. First,
the audio samples are recorded by different devices, and there is mismatch of
recording devices in audio samples. We reduce the negative impact of the
mismatch of recording devices by using some effective strategies, including
data augmentation (e.g., mix-up, spectrum correction, pitch shift), usages of
multi-patch network structure and channel attention. Second, the model size
should be smaller than a threshold (e.g., 128 KB required by the DCASE2021
challenge). To meet this condition, we adopt a ResNet with both depthwise
separable convolution and channel attention as the backbone network, and
perform model compression. In summary, we propose a low-complexity ASC method
using data augmentation and a lightweight ResNet. Evaluated on the official
development and evaluation datasets, our method obtains classification accuracy
scores of 71.6% and 66.7%, respectively; and obtains Log-loss scores of 1.038
and 1.136, respectively. Our final model size is 110.3 KB which is smaller than
the maximum of 128 KB.
","[{""version"":""v1"",""created"":""Sat, 3 Jun 2023 09:05:29 GMT""}]","2023-06-06"
"2306.02055","MD Abdullah Al Nasim","Shuvra Sarker, Angona Biswas, MD Abdullah Al Nasim, Md Shahin Ali, Sai
  Puppala, Sajedul Talukder","Case Studies on X-Ray Imaging, MRI and Nuclear Imaging","15 pages, 3 figures, 4 tables; Acceptance of the chapter for the
  Springer book ""Data-driven approaches to medical imaging""",,,,"cs.AI","http://creativecommons.org/publicdomain/zero/1.0/","  The field of medical imaging is an essential aspect of the medical sciences,
involving various forms of radiation to capture images of the internal tissues
and organs of the body. These images provide vital information for clinical
diagnosis, and in this chapter, we will explore the use of X-ray, MRI, and
nuclear imaging in detecting severe illnesses. However, manual evaluation and
storage of these images can be a challenging and time-consuming process. To
address this issue, artificial intelligence (AI)-based techniques, particularly
deep learning (DL), have become increasingly popular for systematic feature
extraction and classification from imaging modalities, thereby aiding doctors
in making rapid and accurate diagnoses. In this review study, we will focus on
how AI-based approaches, particularly the use of Convolutional Neural Networks
(CNN), can assist in disease detection through medical imaging technology. CNN
is a commonly used approach for image analysis due to its ability to extract
features from raw input images, and as such, will be the primary area of
discussion in this study. Therefore, we have considered CNN as our discussion
area in this study to diagnose ailments using medical imaging technology.
","[{""version"":""v1"",""created"":""Sat, 3 Jun 2023 09:05:35 GMT""},{""version"":""v2"",""created"":""Wed, 7 Jun 2023 19:31:06 GMT""}]","2023-06-09"
"2306.02056","Petr Naryshkin","Petr Naryshkin and Andrea Vaccaro","Hyperfiniteness and Borel asymptotic dimension of boundary actions of
  hyperbolic groups","10 pages, comments welcome",,,,"math.GR math.DS math.LO","http://creativecommons.org/licenses/by/4.0/","  We give a new short proof of the theorem due to Marquis and Sabok, which
states that the orbit equivalence relation induced by the action of a finitely
generated hyperbolic group on its Gromov boundary is hyperfinite. Our methods
permit moreover to show that every such action has finite Borel asymptotic
dimension.
","[{""version"":""v1"",""created"":""Sat, 3 Jun 2023 09:06:31 GMT""}]","2023-06-06"
"2306.02057","Jianhua Zhang","Zibing Shen and Jianhua Zhang and Li Yu and Yuxiang Zhang and Zhen
  Zhang and Xidong Hu","DataAI-6G: A System Parameters Configurable Channel Dataset for AI-6G
  Research",,,,,"eess.SP","http://arxiv.org/licenses/nonexclusive-distrib/1.0/","  With the acceleration of the commercialization of fifth generation (5G)
mobile communication technology and the research for 6G communication systems,
the communication system has the characteristics of high frequency, multi-band,
high speed movement of users and large antenna array. These bring many
difficulties to obtain accurate channel state information (CSI), which makes
the performance of traditional communication methods be greatly restricted.
Therefore, there has been a lot of interest in using artificial intelligence
(AI) instead of traditional methods to improve performance. A common and
accurate dataset is essential for the research of AI communication. However,
the common datasets nowadays still lack some important features, such as mobile
features, spatial non-stationary features etc. To address these issues, we give
a dataset for future 6G communication. In this dataset, we address these issues
with specific simulation methods and accompanying code processing.
","[{""version"":""v1"",""created"":""Sat, 3 Jun 2023 09:14:35 GMT""}]","2023-06-06"
"2306.02058","Praveen Chandra Srivastava Dr.","P. C. Srivastava, S. Sharma, A. Kumar and P. Choudhary","Shell model study of first-forbidden beta decay around $^{208}$Pb","4 pages, 1 figure, 1 table, Journal of Physics: Conference Series
  [28th International Nuclear Physics Conference (INPC 2022) held at Cape Town,
  South Africa]",,,,"nucl-th nucl-ex","http://creativecommons.org/licenses/by/4.0/","  In the present work, we report a systematic theoretical study of the $\log
ft$ values for the forbidden $\beta^-$ decay transitions in the $^{208}$Pb
region. For this, we have considered $^{206}$Hg $\rightarrow$ $^{206}$Tl,
$^{208}$Hg $\rightarrow$ $^{208}$Tl, $^{206}$Tl $\rightarrow$ $^{206}$Pb and
$^{208}$Tl $\rightarrow$ $^{208}$Pb transitions. We have performed shell model
calculations using KHH7B interaction in valence shell 58-114 for protons and
100-164 for neutrons by considering ${\it 1p-1h}$ excitations for both protons
and neutrons simultaneously for daughter nuclei. This study presents the first
shell model results of $\beta^-$-decay corresponding to the recent experimental
data.
","[{""version"":""v1"",""created"":""Sat, 3 Jun 2023 09:14:38 GMT""}]","2023-06-06"
"2306.02059","Tadashi Kadowaki","Tadashi Kadowaki","Enhancing Quantum Annealing in Digital-Analog Quantum Computing","9 pages, 8 figures",,,,"quant-ph","http://arxiv.org/licenses/nonexclusive-distrib/1.0/","  Digital-analog quantum computing (DAQC) offers a promising approach to
addressing the challenges of building a practical quantum computer. By
efficiently allocating resources between digital and analog quantum circuits,
DAQC paves the way for achieving optimal performance. We propose an algorithm
designed to enhance the performance of quantum annealing. This method employs a
quantum gate to estimate the goodness of the final annealing state and find the
ground state of combinatorial optimization problems. We explore two strategies
for integrating the quantum annealing circuit into the DAQC framework: (1) for
state preparation, and (2) for embedding within the quantum gate. While the
former strategy does not yield performance improvements, we discover that the
latter enhances performance within a specific range of annealing time.
Algorithms demonstrating enhanced performance utilize the imaginary part of the
inner product of two states from different quantum annealing settings. This
measure reflects not only the energy of the classical cost function but also
the trajectory of the quantum dynamics. This study provides an example of how
processing quantum data using a quantum circuit can outperform classical data
processing, which discards quantum information.
","[{""version"":""v1"",""created"":""Sat, 3 Jun 2023 09:16:15 GMT""}]","2023-06-06"
"2306.02060","Yu Feng","Yu Feng, Liu Liu, Zhennan Zhou","A unified Bayesian inversion approach for a class of tumor growth models
  with different pressure laws","29 pages, 14 figures",,,,"math.NA cs.NA","http://arxiv.org/licenses/nonexclusive-distrib/1.0/","  In this paper, we use the Bayesian inversion approach to study the data
assimilation problem for a family of tumor growth models described by
porous-medium type equations. The models contain uncertain parameters and are
indexed by a physical parameter $m$, which characterizes the constitutive
relation between density and pressure. Based on these models, we employ the
Bayesian inversion framework to infer parametric and nonparametric unknowns
that affect tumor growth from noisy observations of tumor cell density. We
establish the well-posedness and the stability theories for the Bayesian
inversion problem and further prove the convergence of the posterior
distribution in the so-called incompressible limit, $m \rightarrow \infty$.
Since the posterior distribution across the index regime $m\in[2,\infty)$ can
thus be treated in a unified manner, such theoretical results also guide the
design of the numerical inference for the unknown. We propose a generic
computational framework for such inverse problems, which consists of a typical
sampling algorithm and an asymptotic preserving solver for the forward problem.
With extensive numerical tests, we demonstrate that the proposed method
achieves satisfactory accuracy in the Bayesian inference of the tumor growth
models, which is uniform with respect to the constitutive relation.
","[{""version"":""v1"",""created"":""Sat, 3 Jun 2023 09:18:33 GMT""}]","2023-06-06"
"2306.02061","Yuchao Wang","Yuchao Wang, Jingjing Fei, Haochen Wang, Wei Li, Tianpeng Bao, Liwei
  Wu, Rui Zhao, Yujun Shen","Balancing Logit Variation for Long-tailed Semantic Segmentation",,,,,"cs.CV","http://creativecommons.org/licenses/by/4.0/","  Semantic segmentation usually suffers from a long-tail data distribution. Due
to the imbalanced number of samples across categories, the features of those
tail classes may get squeezed into a narrow area in the feature space. Towards
a balanced feature distribution, we introduce category-wise variation into the
network predictions in the training phase such that an instance is no longer
projected to a feature point, but a small region instead. Such a perturbation
is highly dependent on the category scale, which appears as assigning smaller
variation to head classes and larger variation to tail classes. In this way, we
manage to close the gap between the feature areas of different categories,
resulting in a more balanced representation. It is noteworthy that the
introduced variation is discarded at the inference stage to facilitate a
confident prediction. Although with an embarrassingly simple implementation,
our method manifests itself in strong generalizability to various datasets and
task settings. Extensive experiments suggest that our plug-in design lends
itself well to a range of state-of-the-art approaches and boosts the
performance on top of them.
","[{""version"":""v1"",""created"":""Sat, 3 Jun 2023 09:19:24 GMT""}]","2023-06-06"
"2306.02062","Tianping Chen","Tianping Chen, Yujuan Han and Wenlian Lu","Synchronization analysis of high order layered complex networks",,,,,"nlin.CD","http://creativecommons.org/publicdomain/zero/1.0/","  In this letter, we propose high order layered complex networks. The
synchronization is discussed in detail. The relations of synchronization,
individual coupling matrices and the intrinsic function of the uncoupled system
are given. As special cases, synchronization of monolayer networks and
multiplex networks discussed in literature can be obtained.
","[{""version"":""v1"",""created"":""Sat, 3 Jun 2023 09:24:39 GMT""}]","2023-06-06"
"2306.02063","Yu Cao","Yu Cao, Jingrun Chen, Yixin Luo, Xiang Zhou","Exploring the Optimal Choice for Generative Processes in Diffusion
  Models: Ordinary vs Stochastic Differential Equations",,,,,"cs.LG","http://arxiv.org/licenses/nonexclusive-distrib/1.0/","  The diffusion model has shown remarkable success in computer vision, but it
remains unclear whether ODE-based probability flow or SDE-based diffusion
models are superior and under what circumstances. Comparing the two is
challenging due to dependencies on data distribution, score training, and other
numerical factors. In this paper, we examine the problem mathematically by
examining two limiting scenarios: the ODE case and the large diffusion case. We
first introduce a pulse-shape error to perturb the score function and analyze
error accumulation, with a generalization to arbitrary error. Our findings
indicate that when the perturbation occurs at the end of the generative
process, the ODE model outperforms the SDE model (with a large diffusion
coefficient). However, when the perturbation occurs earlier, the SDE model
outperforms the ODE model, and we demonstrate that the error of sample
generation due to pulse-shape error can be exponentially suppressed as the
diffusion term's magnitude increases to infinity. Numerical validation of this
phenomenon is provided using toy models such as Gaussian, Gaussian mixture
models, and Swiss roll. Finally, we experiment with MNIST and observe that
varying the diffusion coefficient can improve sample quality even when the
score function is not well trained.
","[{""version"":""v1"",""created"":""Sat, 3 Jun 2023 09:27:15 GMT""}]","2023-06-06"
