"2306.01933","Nikolai Mickevicius","Nikolai J. Mickevicius, Azadeh Sharafi, Andrew S. Nencka, Kevin M.
  Koch","Variable Resolution Sampling and Deep Learning-Based Image Recovery for
  Faster Multi-Spectral Imaging Near Metal Implants",,,,,"physics.med-ph","http://arxiv.org/licenses/nonexclusive-distrib/1.0/","  Purpose: In multi-spectral imaging (MSI), several fast spin echo volumes with
discrete Larmor frequency offsets are acquired in an interleaved fashion with
multiple concatenations. Here, a variable resolution (VR) method to nearly
halve scan time is proposed by only acquiring low resolution autocalibrating
signal in half of the concatenations.
  Methods: Knee MSI datasets were retrospectively undersampled with the
proposed variable resolution sampling scheme. A U-Net model was trained to
predict the full-resolution images from the VR input. Image quality was
assessed in 10 test subjects.
  Results: Spectral bin-combined images produced with the proposed variable
resolution sampling with deep learning reconstruction appear to be of high
quality and exhibited a median structural image similarity of 0.984 across test
subjects and slices.
  Conclusion: The proposed variable resolution sampling method shows promise
for drastically reducing the time it takes to collect multi-spectral imaging
data near metallic implants. Further studies will rigorously examine its
clinical utility across multiple implant scenarios.
","[{""version"":""v1"",""created"":""Fri, 2 Jun 2023 22:21:40 GMT""}]","2023-06-06"
"2306.01934","Carlos Mastalli","Saroj Prasad Chhatoi, Michele Pierallini, Franco Angelini, Carlos
  Mastalli, Manolo Garabini","Optimal Control for Articulated Soft Robots","14 pages, 15 figures, IEEE Transaction on Robotics (TRO)",,,,"cs.RO","http://creativecommons.org/licenses/by/4.0/","  Soft robots can execute tasks with safer interactions. However, control
techniques that can effectively exploit the systems' capabilities are still
missing. Differential dynamic programming (DDP) has emerged as a promising tool
for achieving highly dynamic tasks. But most of the literature deals with
applying DDP to articulated soft robots by using numerical differentiation, in
addition to using pure feed-forward control to perform explosive tasks.
Further, underactuated compliant robots are known to be difficult to control
and the use of DDP-based algorithms to control them is not yet addressed. We
propose an efficient DDP-based algorithm for trajectory optimization of
articulated soft robots that can optimize the state trajectory, input torques,
and stiffness profile. We provide an efficient method to compute the forward
dynamics and the analytical derivatives of series elastic actuators
(SEA)/variable stiffness actuators (VSA) and underactuated compliant robots. We
present a state-feedback controller that uses locally optimal feedback policies
obtained from DDP. We show through simulations and experiments that the use of
feedback is crucial in improving the performance and stabilization properties
of various tasks. We also show that the proposed method can be used to plan and
control underactuated compliant robots, with varying degrees of underactuation
effectively.
","[{""version"":""v1"",""created"":""Fri, 2 Jun 2023 22:28:04 GMT""}]","2023-06-06"
"2306.01935","Vivek N. Prakash","Setareh Gooshvar, Gopika Madhu, Melissa Ruszczyk, and Vivek N. Prakash","Non-bilaterians as Model Systems for Tissue Mechanics","Review paper, Comments/suggestions are welcome",,,,"q-bio.TO physics.bio-ph","http://creativecommons.org/licenses/by-nc-nd/4.0/","  In animals, epithelial tissues are barriers against the external environment,
providing protection against biological, chemical, and physical damage.
Depending on the animal's physiology and behavior, these tissues encounter
different types of mechanical forces and need to provide a suitable adaptive
response to ensure success. Therefore, understanding tissue mechanics in
different contexts is an important research area. Here, we review recent tissue
mechanics discoveries in a few early-divergent non-bilaterian animals --
Trichoplax adhaerens, Hydra vulgaris, and Aurelia aurita. We highlight each
animal's simple body plan and biology, and unique, rapid tissue remodeling
phenomena that play a crucial role in its physiology. We also discuss the
emergent large-scale mechanics that arise from small-scale phenomena. Finally,
we emphasize the enormous potential of these non-bilaterian animals to be model
systems for further investigation in tissue mechanics.
","[{""version"":""v1"",""created"":""Fri, 2 Jun 2023 22:28:16 GMT""}]","2023-06-06"
"2306.01936","Fabien H. Wagner","Fabien H Wagner, Sophia Roberts, Alison L Ritz, Griffin Carter,
  Ricardo Dalagnol, Samuel Favrichon, Mayumi CM Hirye, Martin Brandt, Philipe
  Ciais and Sassan Saatchi","Sub-Meter Tree Height Mapping of California using Aerial Images and
  LiDAR-Informed U-Net Model","29 pages, 9 figures, submitted to Remote Sensing in Ecology and
  Conservation (RSEC)",,,,"cs.CV eess.IV","http://creativecommons.org/licenses/by/4.0/","  Tree canopy height is one of the most important indicators of forest biomass,
productivity, and species diversity, but it is challenging to measure
accurately from the ground and from space. Here, we used a U-Net model adapted
for regression to map the canopy height of all trees in the state of California
with very high-resolution aerial imagery (60 cm) from the USDA-NAIP program.
The U-Net model was trained using canopy height models computed from aerial
LiDAR data as a reference, along with corresponding RGB-NIR NAIP images
collected in 2020. We evaluated the performance of the deep-learning model
using 42 independent 1 km$^2$ sites across various forest types and landscape
variations in California. Our predictions of tree heights exhibited a mean
error of 2.9 m and showed relatively low systematic bias across the entire
range of tree heights present in California. In 2020, trees taller than 5 m
covered ~ 19.3% of California. Our model successfully estimated canopy heights
up to 50 m without saturation, outperforming existing canopy height products
from global models. The approach we used allowed for the reconstruction of the
three-dimensional structure of individual trees as observed from nadir-looking
optical airborne imagery, suggesting a relatively robust estimation and mapping
capability, even in the presence of image distortion. These findings
demonstrate the potential of large-scale mapping and monitoring of tree height,
as well as potential biomass estimation, using NAIP imagery.
","[{""version"":""v1"",""created"":""Fri, 2 Jun 2023 22:29:58 GMT""}]","2023-06-06"
"2306.01937","Robert Lo","Robert Lo, Arnhav Datar, Abishek Sridhar","LIC-GAN: Language Information Conditioned Graph Generative GAN Model","15 pages, 8 figures",,,,"cs.LG cs.AI","http://creativecommons.org/licenses/by-sa/4.0/","  Deep generative models for Natural Language data offer a new angle on the
problem of graph synthesis: by optimizing differentiable models that directly
generate graphs, it is possible to side-step expensive search procedures in the
discrete and vast space of possible graphs. We introduce LIC-GAN, an implicit,
likelihood-free generative model for small graphs that circumvents the need for
expensive graph matching procedures. Our method takes as input a natural
language query and using a combination of language modelling and Generative
Adversarial Networks (GANs) and returns a graph that closely matches the
description of the query. We combine our approach with a reward network to
further enhance the graph generation with desired properties. Our experiments,
show that LIC-GAN does well on metrics such as PropMatch and Closeness getting
scores of 0.36 and 0.48. We also show that LIC-GAN performs as good as ChatGPT,
with ChatGPT getting scores of 0.40 and 0.42. We also conduct a few experiments
to demonstrate the robustness of our method, while also highlighting a few
interesting caveats of the model.
","[{""version"":""v1"",""created"":""Fri, 2 Jun 2023 22:39:14 GMT""}]","2023-06-06"
"2306.01938","Gianfranco Doretto","Marcela Mera-Trujillo, Shivang Patel, Yu Gu, Gianfranco Doretto","Self-supervised Interest Point Detection and Description for Fisheye and
  Perspective Images","CVPR Workshop on Omnidirectional Computer Vision, 2023",,,,"cs.CV cs.RO","http://creativecommons.org/licenses/by-nc-nd/4.0/","  Keypoint detection and matching is a fundamental task in many computer vision
problems, from shape reconstruction, to structure from motion, to AR/VR
applications and robotics. It is a well-studied problem with remarkable
successes such as SIFT, and more recent deep learning approaches. While great
robustness is exhibited by these techniques with respect to noise, illumination
variation, and rigid motion transformations, less attention has been placed on
image distortion sensitivity. In this work, we focus on the case when this is
caused by the geometry of the cameras used for image acquisition, and consider
the keypoint detection and matching problem between the hybrid scenario of a
fisheye and a projective image. We build on a state-of-the-art approach and
derive a self-supervised procedure that enables training an interest point
detector and descriptor network. We also collected two new datasets for
additional training and testing in this unexplored scenario, and we demonstrate
that current approaches are suboptimal because they are designed to work in
traditional projective conditions, while the proposed approach turns out to be
the most effective.
","[{""version"":""v1"",""created"":""Fri, 2 Jun 2023 22:39:33 GMT""}]","2023-06-06"
"2306.01939","Belgacem Selmi","Belgacem Selmi and Rahma Chbebb","Uncertainty principle for the Poly-axially L 2 {\alpha} -multiplier
  operators",,,,,"math.FA","http://creativecommons.org/licenses/by/4.0/","  In this article, the Heisenberg-Pauli-Weyl uncertainty principle and
Donoho-Stark s uncertainty principle are obtained for the Poly-axially L 2
{\alpha} -multiplier operators
","[{""version"":""v1"",""created"":""Fri, 2 Jun 2023 22:46:25 GMT""}]","2023-06-06"
"2306.01940","Elijah Pelofske","Kyle Henke, Elijah Pelofske, Georg Hahn, Garrett T. Kenyon","Sampling binary sparse coding QUBO models using a spiking neuromorphic
  processor",,,,"LA-UR-23-25877","cs.NE cs.CV cs.ET cs.LG","http://arxiv.org/licenses/nonexclusive-distrib/1.0/","  We consider the problem of computing a sparse binary representation of an
image. To be precise, given an image and an overcomplete, non-orthonormal
basis, we aim to find a sparse binary vector indicating the minimal set of
basis vectors that when added together best reconstruct the given input. We
formulate this problem with an $L_2$ loss on the reconstruction error, and an
$L_0$ (or, equivalently, an $L_1$) loss on the binary vector enforcing
sparsity. This yields a so-called Quadratic Unconstrained Binary Optimization
(QUBO) problem, whose solution is generally NP-hard to find. The contribution
of this work is twofold. First, the method of unsupervised and unnormalized
dictionary feature learning for a desired sparsity level to best match the data
is presented. Second, the binary sparse coding problem is then solved on the
Loihi 1 neuromorphic chip by the use of stochastic networks of neurons to
traverse the non-convex energy landscape. The solutions are benchmarked against
the classical heuristic simulated annealing. We demonstrate neuromorphic
computing is suitable for sampling low energy solutions of binary sparse coding
QUBO models, and although Loihi 1 is capable of sampling very sparse solutions
of the QUBO models, there needs to be improvement in the implementation in
order to be competitive with simulated annealing.
","[{""version"":""v1"",""created"":""Fri, 2 Jun 2023 22:47:18 GMT""}]","2023-06-06"
"2306.01941","Jennifer Wortman Vaughan","Q. Vera Liao and Jennifer Wortman Vaughan","AI Transparency in the Age of LLMs: A Human-Centered Research Roadmap",,,,,"cs.HC cs.AI cs.CY","http://arxiv.org/licenses/nonexclusive-distrib/1.0/","  The rise of powerful large language models (LLMs) brings about tremendous
opportunities for innovation but also looming risks for individuals and society
at large. We have reached a pivotal moment for ensuring that LLMs and
LLM-infused applications are developed and deployed responsibly. However, a
central pillar of responsible AI -- transparency -- is largely missing from the
current discourse around LLMs. It is paramount to pursue new approaches to
provide transparency for LLMs, and years of research at the intersection of AI
and human-computer interaction (HCI) highlight that we must do so with a
human-centered perspective: Transparency is fundamentally about supporting
appropriate human understanding, and this understanding is sought by different
stakeholders with different goals in different contexts. In this new era of
LLMs, we must develop and design approaches to transparency by considering the
needs of stakeholders in the emerging LLM ecosystem, the novel types of
LLM-infused applications being built, and the new usage patterns and challenges
around LLMs, all while building on lessons learned about how people process,
interact with, and make use of information. We reflect on the unique challenges
that arise in providing transparency for LLMs, along with lessons learned from
HCI and responsible AI research that has taken a human-centered perspective on
AI transparency. We then lay out four common approaches that the community has
taken to achieve transparency -- model reporting, publishing evaluation
results, providing explanations, and communicating uncertainty -- and call out
open questions around how these approaches may or may not be applied to LLMs.
We hope this provides a starting point for discussion and a useful roadmap for
future research.
","[{""version"":""v1"",""created"":""Fri, 2 Jun 2023 22:51:26 GMT""}]","2023-06-06"
"2306.01942","Guangzhi Sun","Guangzhi Sun, Xianrui Zheng, Chao Zhang, Philip C. Woodland","Can Contextual Biasing Remain Effective with Whisper and GPT-2?","To appear in Interspeech 2023",,,,"cs.CL cs.SD eess.AS","http://creativecommons.org/licenses/by/4.0/","  End-to-end automatic speech recognition (ASR) and large language models, such
as Whisper and GPT-2, have recently been scaled to use vast amounts of training
data. Despite the large amount of training data, infrequent content words that
occur in a particular task may still exhibit poor ASR performance, with
contextual biasing a possible remedy. This paper investigates the effectiveness
of neural contextual biasing for Whisper combined with GPT-2. Specifically,
this paper proposes integrating an adapted tree-constrained pointer generator
(TCPGen) component for Whisper and a dedicated training scheme to dynamically
adjust the final output without modifying any Whisper model parameters.
Experiments across three datasets show a considerable reduction in errors on
biasing words with a biasing list of 1000 words. Contextual biasing was more
effective when applied to domain-specific data and can boost the performance of
Whisper and GPT-2 without losing their generality.
","[{""version"":""v1"",""created"":""Fri, 2 Jun 2023 22:56:01 GMT""}]","2023-06-06"
"2306.01943","Sebastin Santy","Sebastin Santy, Jenny T. Liang, Ronan Le Bras, Katharina Reinecke,
  Maarten Sap","NLPositionality: Characterizing Design Biases of Datasets and Models","ACL 2023",,,,"cs.CL cs.CY cs.HC","http://arxiv.org/licenses/nonexclusive-distrib/1.0/","  Design biases in NLP systems, such as performance differences for different
populations, often stem from their creator's positionality, i.e., views and
lived experiences shaped by identity and background. Despite the prevalence and
risks of design biases, they are hard to quantify because researcher, system,
and dataset positionality is often unobserved. We introduce NLPositionality, a
framework for characterizing design biases and quantifying the positionality of
NLP datasets and models. Our framework continuously collects annotations from a
diverse pool of volunteer participants on LabintheWild, and statistically
quantifies alignment with dataset labels and model predictions. We apply
NLPositionality to existing datasets and models for two tasks -- social
acceptability and hate speech detection. To date, we have collected 16,299
annotations in over a year for 600 instances from 1,096 annotators across 87
countries. We find that datasets and models align predominantly with Western,
White, college-educated, and younger populations. Additionally, certain groups,
such as non-binary people and non-native English speakers, are further
marginalized by datasets and models as they rank least in alignment across all
tasks. Finally, we draw from prior literature to discuss how researchers can
examine their own positionality and that of their datasets and models, opening
the door for more inclusive NLP systems.
","[{""version"":""v1"",""created"":""Fri, 2 Jun 2023 23:02:09 GMT""}]","2023-06-06"
"2306.01944","Ayan Banerjee","Sameena Hossain, Payal Kamboj, Aranyak Maity, Tamiko Azuma, Ayan
  Banerjee, Sandeep K. S. Gupta","EdGCon: Auto-assigner of Iconicity Ratings Grounded by Lexical
  Properties to Aid in Generation of Technical Gestures","Accepted for publication in ACM SAC 2023",,,"ILTR-2023-1","cs.HC cs.AI cs.CL","http://creativecommons.org/licenses/by-nc-nd/4.0/","  Gestures that share similarities in their forms and are related in their
meanings, should be easier for learners to recognize and incorporate into their
existing lexicon. In that regard, to be more readily accepted as standard by
the Deaf and Hard of Hearing community, technical gestures in American Sign
Language (ASL) will optimally share similar in forms with their lexical
neighbors. We utilize a lexical database of ASL, ASL-LEX, to identify lexical
relations within a set of technical gestures. We use automated identification
for 3 unique sub-lexical properties in ASL- location, handshape and movement.
EdGCon assigned an iconicity rating based on the lexical property similarities
of the new gesture with an existing set of technical gestures and the
relatedness of the meaning of the new technical word to that of the existing
set of technical words. We collected 30 ad hoc crowdsourced technical gestures
from different internet websites and tested them against 31 gestures from the
DeafTEC technical corpus. We found that EdGCon was able to correctly
auto-assign the iconicity ratings 80.76% of the time.
","[{""version"":""v1"",""created"":""Fri, 2 Jun 2023 23:04:01 GMT""}]","2023-06-06"
"2306.01945","Oriol Nieto","Oriol Nieto, Zeyu Jin, Franck Dernoncourt, Justin Salamon","Efficient Spoken Language Recognition via Multilabel Classification","Accepted to InterSpeech 2023",,,,"cs.CL cs.LG","http://creativecommons.org/licenses/by/4.0/","  Spoken language recognition (SLR) is the task of automatically identifying
the language present in a speech signal. Existing SLR models are either too
computationally expensive or too large to run effectively on devices with
limited resources. For real-world deployment, a model should also gracefully
handle unseen languages outside of the target language set, yet prior work has
focused on closed-set classification where all input languages are known
a-priori. In this paper we address these two limitations: we explore efficient
model architectures for SLR based on convolutional networks, and propose a
multilabel training strategy to handle non-target languages at inference time.
Using the VoxLingua107 dataset, we show that our models obtain competitive
results while being orders of magnitude smaller and faster than current
state-of-the-art methods, and that our multilabel strategy is more robust to
unseen non-target languages compared to multiclass classification.
","[{""version"":""v1"",""created"":""Fri, 2 Jun 2023 23:04:19 GMT""}]","2023-06-06"
"2306.01946","Dirk Lorenz","Dirk A. Lorenz, Felix Schneppe, Lionel Tondji","Linearly convergent adjoint free solution of least squares problems by
  random descent",,,,,"math.NA cs.NA math.OC","http://creativecommons.org/publicdomain/zero/1.0/","  We consider the problem of solving linear least squares problems in a
framework where only evaluations of the linear map are possible. We derive
randomized methods that do not need any other matrix operations than forward
evaluations, especially no evaluation of the adjoint map is needed. Our method
is motivated by the simple observation that one can get an unbiased estimate of
the application of the adjoint. We show convergence of the method and then
derive a more efficient method that uses an exact linesearch. This method,
called random descent, resembles known methods in other context and has the
randomized coordinate descent method as special case. We provide convergence
analysis of the random descent method emphasizing the dependence on the
underlying distribution of the random vectors. Furthermore we investigate the
applicability of the method in the context of ill-posed inverse problems and
show that the method can have beneficial properties when the unknown solution
is rough. We illustrate the theoretical findings in numerical examples. One
particular result is that the random descent method actually outperforms
established transposed-free methods (TFQMR and CGS) in examples.
","[{""version"":""v1"",""created"":""Fri, 2 Jun 2023 23:04:57 GMT""}]","2023-06-06"
"2306.01947","Li Li","Li Li","Bipartite Determinantal Ideals and concurrent vertex maps",,,,,"math.AC math.CO","http://creativecommons.org/licenses/by/4.0/","  Bipartite determinantal ideals are introduced by Illian and the author as a
vast generalization of the classical determinantal ideals intensively studied
in commutative algebra, algebraic geometry, representation theory and
combinatorics. We introduce a combinatorial model called concurrent vertex maps
to describe the Stanley-Reisner complex of the initial ideal of any bipartite
determinantal ideal, and study properties and applications of this model.
","[{""version"":""v1"",""created"":""Fri, 2 Jun 2023 23:06:43 GMT""}]","2023-06-06"
"2306.01948","Leonie Woodland","Leonie Woodland, Izabella Lovas, M. Telling, D. Prabhakaran, Leon
  Balents, Radu Coldea","Excitations of quantum Ising chain CoNb2O6 in low transverse field:
  quantitative description of bound states stabilized by off-diagonal exchange
  and applied field","17 pages, 5 figures",,,,"cond-mat.str-el","http://arxiv.org/licenses/nonexclusive-distrib/1.0/","  We present experimental and theoretical evidence of novel bound state
formation in the low transverse field ordered phase of the
quasi-one-dimensional Ising-like material CoNb$_2$O$_6$. High resolution single
crystal inelastic neutron scattering measurements observe that small transverse
fields lead to a breakup of the spectrum into three parts, each evolving very
differently upon increasing field. We show that this can be naturally
understood starting from the excitations of the ordered phase of the transverse
field Ising model, domain wall quasiparticles (solitons). The transverse field
and a staggered off-diagonal exchange create one-soliton hopping terms with
opposite signs. This leads to a rich spectrum and a special field, when the
strengths of the off-diagonal exchange and transverse field match, at which
solitons become localized; the highest field investigated is very close to this
special regime. We solve this case analytically and find three two-soliton
continua, along with three novel bound states. We also present calculations
using exact diagonalization of a recently refined Hamiltonian model for
CoNb$_2$O$_6$ and using diagonalization of the two-soliton subspace, both of
which provide a quantitative agreement with the observed spectrum. The
theoretical two-soliton model qualitatively and quantitatively captures a
variety of non-trivial features in the observed spectrum, providing insight
into the underlying physics of bound state formation.
","[{""version"":""v1"",""created"":""Fri, 2 Jun 2023 23:07:28 GMT""}]","2023-06-06"
