"2306.05345","Krist\'of Kanalas","Krist\'of Kanalas","$\kappa $-left-exact and $\kappa $-regular copresheaves on $(\kappa
  ,\kappa )$-coherent categories",,,,,"math.CT","http://arxiv.org/licenses/nonexclusive-distrib/1.0/","  $\kappa $-left-exact copresheaves on a $(\kappa ,\kappa )$-coherent category
$\mathcal{C}$ form a full reflective subcategory in $\mathcal{C}\downarrow
\mathbf{Coh}^{\sim }_{\kappa ,\kappa }$, the category of $(\kappa ,\kappa
)$-coherent functors out of $\mathcal{C}$. Given a $\kappa $-lex
$F:\mathcal{C}\to \mathbf{Set}$ the construction extends $\mathcal{C}$ by
adding constants along $F$.
  $\kappa $-regular copresheaves are identified with $(\kappa ,\kappa
)$-coherent functors to sheaves over $\kappa $-complete, $(\kappa ,\kappa
)$-distributive Boolean-algebras. As an application we prove an infinitary
version of the Heyting-valued completeness theorem, and characterise which
$\kappa $-filtered colimit preserving functors $\mathbf{Coh}_{\kappa ,\kappa
}(\mathcal{D},\mathbf{Set})\to \mathbf{Coh}_{\kappa ,\kappa
}(\mathcal{C},\mathbf{Set})$ are coming from an interpretation $\mathcal{C}\to
\mathcal{D}$.
  We investigate the functorial properties of two semiring invariants of lex
copresheaves over coherent categories.
","[{""version"":""v1"",""created"":""Thu, 8 Jun 2023 16:47:21 GMT""}]","2023-06-09"
"2306.05346","Ricardo Ortiz Cano","Ricardo Ortiz","Olympicene radicals as building blocks of two-dimensional anisotropic
  networks",,,,,"cond-mat.mes-hall","http://arxiv.org/licenses/nonexclusive-distrib/1.0/","  I propose monoradical nanographenes without C3 symmetry as building blocks to
design two-dimensional (2D) carbon crystals. As representative examples I study
the honeycomb and Kagome lattices, showing that by replacing the sites with
olympicene radicals the band dispersion near the Fermi energy corresponds,
respectively, to that of Kekul\'e/anti-Kekul\'e graphene and breathing Kagome
tight-binding models. As a consequence, finite islands of these new crystals
present corner states close to the Fermi energy, just like the parent models.
In the case of Kekul\'e/anti-Kekul\'e graphene, such states are topologically
protected, standing as examples of second-order topological insulators with a
non-zero Z2- or Z6-Berry phase. Differently, those of the breathing Kagome
lattice are of trivial nature, but the ground state has been predicted to be a
spin liquid in the antiferromagnetic Heisenberg model. Hence, 2D systems made
of low-symmetric nanographenes may be convenient platforms to explore exotic
physics in carbon materials.
","[{""version"":""v1"",""created"":""Thu, 8 Jun 2023 16:48:41 GMT""}]","2023-06-09"
"2306.05347","Timur Dzhatdoev","Timur A. Dzhatdoev, Egor I. Podlesnyi and Grigory I. Rubtsov","First constraints on the strength of the extragalactic magnetic field
  from $\gamma$-ray observations of GRB 221009A","5 pages, 6 figures",,,,"astro-ph.HE","http://arxiv.org/licenses/nonexclusive-distrib/1.0/","  The extragalactic magnetic field (EGMF) could be probed with $\gamma$-ray
observations of distant sources. Primary very high energy (VHE) $\gamma$-rays
from these sources absorb on extragalactic background light photons, and
secondary electrons/positrons from the pair production acts create cascade
$\gamma$-rays. These cascade $\gamma$-rays could be detected with space
$\gamma$-ray telescopes such as Fermi-LAT. The $\gamma$-ray burst GRB 221009A
was an exceptionally bright transient well suited for intergalactic
$\gamma$-ray propagation studies. Using publicly-available Fermi-LAT data, we
obtain upper limits on the spectrum of delayed emission from GRB 221009A during
the time window of 30 days after the burst, and compare these with model
spectra calculated for various EGMF strengths $B$, obtaining lower limits on
$B$. We show that the values of $B < 10^{-18}$ G are excluded. For some
optimistic models of the VHE spectrum of GRB 221009A, the values of $B <
10^{-17}$ G are excluded.
","[{""version"":""v1"",""created"":""Thu, 8 Jun 2023 16:49:52 GMT""}]","2023-06-09"
"2306.05348","Pinaki Chaudhuri","Umang A. Dattani, Smarajit Karmakar, Pinaki Chaudhuri","Athermal quasistatic cavitation in amorphous solids: effect of random
  pinning",,,,,"cond-mat.soft","http://creativecommons.org/licenses/by/4.0/","  Amorphous solids are known to fail catastrophically via fracture, wherein
cavitation at nano-metric scales is known to play a significant role.
Micro-alloying via inclusions is often used as a means to increase the fracture
toughness of amorphous solids. Modeling such inclusions as randomly pinned
particles that move only affinely and do not participate in plastic relaxation,
we study how the pinning influences the process of cavitation-driven fracture
in an amorphous solid. Using extensive numerical simulations and probing in the
athermal quasistatic limit, we show that just by pinning a very small fraction
of particles, the tensile strength is increased and also the cavitation is
delayed. Further, the cavitation that is expected to be spatially heterogeneous
becomes spatially homogeneous by forming a large number of small cavities
instead of a dominant cavity.
","[{""version"":""v1"",""created"":""Thu, 8 Jun 2023 16:51:52 GMT""}]","2023-06-09"
"2306.05349","Seok-Bae Yun","Byung-Hoon Hwang, Myeong-Su Lee, Seok-Bae Yun","Relativistic BGK model for gas mixtures",,,,,"math.AP","http://creativecommons.org/licenses/by/4.0/","  Unlike the case for classical particles, the literature on BGK type models
for relativistic gas mixture is extremely limited. There are a few results
%\cite{Kremer,Kremer3,KP} in which such relativistic BGK models for gas mixture
are employed to compute transport coefficients. However, to the best knowledge
of authors, relativistic BGK models for gas mixtures with complete presentation
of the relaxation operators are missing in the literature.
  In this paper, we fill this gap by suggesting a BGK model for relativistic
gas mixtures for which the existence of each equilibrium coefficients in the
relaxation operator is rigorously guaranteed in a way that all the essential
physical properties are satisfied such as the conservation laws, the H-theorem,
the capturing of the correct equilibrium state, the indifferentiability
principle, and the recovery of the classical BGK model in the Newtonian limit.
","[{""version"":""v1"",""created"":""Thu, 8 Jun 2023 16:52:07 GMT""}]","2023-06-09"
"2306.05350","Tiantian Feng","Tiantian Feng and Shrikanth Narayanan","PEFT-SER: On the Use of Parameter Efficient Transfer Learning Approaches
  For Speech Emotion Recognition Using Pre-trained Speech Models","This work was accepted to the 11th International Conference on
  Affective Computing and Intelligent Interaction (ACII), 2023",,,,"cs.SD eess.AS","http://arxiv.org/licenses/nonexclusive-distrib/1.0/","  Many recent studies have focused on fine-tuning pre-trained models for speech
emotion recognition (SER), resulting in promising performance compared to
traditional methods that rely largely on low-level, knowledge-inspired acoustic
features. These pre-trained speech models learn general-purpose speech
representations using self-supervised or weakly-supervised learning objectives
from large-scale datasets. Despite the significant advances made in SER through
the use of pre-trained architecture, fine-tuning these large pre-trained models
for different datasets requires saving copies of entire weight parameters,
rendering them impractical to deploy in real-world settings. As an alternative,
this work explores parameter-efficient fine-tuning (PEFT) approaches for
adapting pre-trained speech models for emotion recognition. Specifically, we
evaluate the efficacy of adapter tuning, embedding prompt tuning, and LoRa
(Low-rank approximation) on four popular SER testbeds. Our results reveal that
LoRa achieves the best fine-tuning performance in emotion recognition while
enhancing fairness and requiring only a minimal extra amount of weight
parameters. Furthermore, our findings offer novel insights into future research
directions in SER, distinct from existing approaches focusing on directly
fine-tuning the model architecture. Our code is publicly available under:
https://github.com/usc-sail/peft-ser.
","[{""version"":""v1"",""created"":""Thu, 8 Jun 2023 16:53:02 GMT""}]","2023-06-09"
"2306.05351","Aurelien Schmitt","A. Schmitt, L. Abou-Hamdan, M. Tharrault, S. Rossetti, D. Mele, R.
  Bretel, A. Pierret, M. Rosticher, P. Morfin, T. Taniguchi, K. Watanabe, J.M.
  Berroir, G. F\`eve, G. M\'enard, B. Pla\c{c}ais, C. Voisin, J.P. Hugonin,
  J.J. Greffet, P. Bouchon, Y. De Wilde and E. Baudin","Electroluminescence of the graphene 2D semi-metal","Main text (8 pages , 3 figures ) + Supplementary Information ( 19
  pages , 19 figures)",,,,"cond-mat.mes-hall","http://creativecommons.org/licenses/by/4.0/","  Electroluminescence, a non-thermal radiative process, is ubiquitous in
semi-conductors and insulators but fundamentally precluded in metals. We show
here that this restriction can be circumvented in high-quality graphene. By
investigating the radiative emission of semi-metallic graphene field-effect
transistors over a broad spectral range, spanning the near- and mid-infrared,
we demonstrate direct far-field electroluminescence from hBN-encapsulated
graphene in the mid-infrared under large bias in ambient conditions. Through a
series of test experiments ruling out its incandescence origin, we determine
that the electroluminescent signal results from the electrical pumping produced
by interband tunneling. We show that the mid-infrared electroluminescence is
spectrally shaped by a natural quarter-wave resonance of the heterostructure.
This work invites a reassessment of the use of metals and semi-metals as
non-equilibrium light emitters, and the exploration of their intriguing
specificities in terms of carrier injection and relaxation, as well as emission
tunability and switching speed.
","[{""version"":""v1"",""created"":""Thu, 8 Jun 2023 16:56:09 GMT""}]","2023-06-09"
"2306.05352","Florian Trinter","Karen Mudryk, Chin Lee, Luk\'a\v{s} Toman\'ik, Sebastian Malerz,
  Florian Trinter, Uwe Hergenhahn, Daniel M. Neumark, Petr Slav\'i\v{c}ek,
  Stephen Bradforth, and Bernd Winter","How does Mg$^{2+}_{(aq)}$ interact with ATP$_{(aq)}$? Observations
  through the lens of liquid-jet photoelectron spectroscopy","Main manuscript: 16 pages, 8 figures. Supporting information: 30
  pages, 7 figures",,,,"physics.chem-ph","http://creativecommons.org/licenses/by/4.0/","  Site-specific information on how adenosine triphosphate in the aqueous phase
(ATP$_{(aq)}$) interacts with magnesium (Mg$^{2+}_{(aq)}$) is a prerequisite to
understanding its complex biochemistry. To gather such information, we apply
liquid-jet photoelectron spectroscopy (LJ-PES) assisted by electronic-structure
calculations to study ATP$_{(aq)}$ solutions with and without dissolved
Mg$^{2+}$. Valence photoemission data reveal spectral changes in the phosphate
and adenine features of ATP$_{(aq)}$ due to interactions with the divalent
cation. Chemical shifts in Mg 2p, Mg 2s, P 2p, and P 2s core-level spectra as a
function of the Mg$^{2+}$/ATP concentration ratio are correlated to the
formation of [MgATP]$^{-2}_{(aq)}$ and Mg$_2$ATP$_{(aq)}$ complexes,
demonstrating the element-sensitivity of the technique to Mg$^{2+}$-phosphate
interactions. In addition, we report and compare P 2s data from ATP$_{(aq)}$
and adenosine mono- and di-phosphate (AMP$_{(aq)}$ and ADP$_{(aq)}$,
respectively) solutions, probing the electronic structure of the phosphate
chain and the local environment of individual phosphate units in ATP$_{(aq)}$.
Finally, we have recorded intermolecular Coulombic decay (ICD) spectra
initiated by ionization of Mg 1s electrons to probe ligand exchange in the
Mg$^{2+}$-ATP$_{(aq)}$ coordination environment, demonstrating the unique
capabilities of ICD for revealing structural information. Our results provide
an overview of the electronic structure of ATP$_{(aq)}$ and
Mg$^{2+}$-ATP$_{(aq)}$ moieties relevant to phosphorylation and
dephosphorylation reactions that are central to bioenergetics in living
organisms.
","[{""version"":""v1"",""created"":""Thu, 8 Jun 2023 16:56:37 GMT""}]","2023-06-09"
"2306.05353","Junjie Sheng","Junjie Sheng, Wenhao Li, Bo Jin, Hongyuan Zha, Jun Wang, Xiangfeng
  Wang","Negotiated Reasoning: On Provably Addressing Relative
  Over-Generalization","21 pages",,,,"cs.AI cs.MA","http://creativecommons.org/licenses/by/4.0/","  Over-generalization is a thorny issue in cognitive science, where people may
become overly cautious due to past experiences. Agents in multi-agent
reinforcement learning (MARL) also have been found to suffer relative
over-generalization (RO) as people do and stuck to sub-optimal cooperation.
Recent methods have shown that assigning reasoning ability to agents can
mitigate RO algorithmically and empirically, but there has been a lack of
theoretical understanding of RO, let alone designing provably RO-free methods.
This paper first proves that RO can be avoided when the MARL method satisfies a
consistent reasoning requirement under certain conditions. Then we introduce a
novel reasoning framework, called negotiated reasoning, that first builds the
connection between reasoning and RO with theoretical justifications. After
that, we propose an instantiated algorithm, Stein variational negotiated
reasoning (SVNR), which uses Stein variational gradient descent to derive a
negotiation policy that provably avoids RO in MARL under maximum entropy policy
iteration. The method is further parameterized with neural networks for
amortized learning, making computation efficient. Numerical experiments on many
RO-challenged environments demonstrate the superiority and efficiency of SVNR
compared to state-of-the-art methods in addressing RO.
","[{""version"":""v1"",""created"":""Thu, 8 Jun 2023 16:57:12 GMT""}]","2023-06-09"
"2306.05354","Biswajit Pandey","Anindita Nandi, Biswajit Pandey, Prakash Sarkar","The correlations between galaxy properties in different environments of
  the cosmic web","20 pages, 10 figures, 5 tables, comments welcome",,,,"astro-ph.CO astro-ph.GA","http://arxiv.org/licenses/nonexclusive-distrib/1.0/","  We study the correlations between galaxy properties in different environments
of the cosmic web using a volume limited sample from the SDSS. We determine the
geometric environment at the location of each galaxy using the eigenvalues of
the tidal tensor. The correlations are then separately analyzed in different
cosmic web environments. We use the Pearson correlation coefficient and the
normalized mutual information for measuring the correlations. Using a
two-tailed t-test, we find that the correlations between the galaxy properties
are sensitive to the geometric environments. The stellar mass can be an
important link between the galaxy properties and the environment. We repeat the
analysis after matching the stellar mass distributions in different
environments and find that the conclusions remain unchanged for most of the
relations. Our study suggests that the galaxy properties and their
interrelationships are susceptible to the geometric environments of the cosmic
web.
","[{""version"":""v1"",""created"":""Thu, 8 Jun 2023 17:00:48 GMT""}]","2023-06-09"
"2306.05355","Sebastian K\""olsch","Sebastian K\""olsch, Alfons Georg Schuck, Michael Huth","Epitaxial thin films of binary Eu-compounds close to a valence
  transition",,,,,"cond-mat.str-el cond-mat.mes-hall","http://creativecommons.org/licenses/by/4.0/","  Intermetallic binary compounds of europium reveal a variety of interesting
phenomena due to the interconnection between two different magnetic and 4f
electronic (valence) states, which are particularly close in energy. The
valence states or magnetic properties are thus particularly sensitive to
strain-tuning in these materials. Consequently, we grew epitaxial EuPd$_2$
(magnetic Eu$^{2+}$) and EuPd$_3$ (nonmagnetic Eu$^{3+}$) thin films on
MgO(001) substrates using molecular beam epitaxy. Ambient X-ray diffraction
confirms an epitaxial relationship of cubic Laves-type (C15) EuPd$_2$ with an
(111)-out-of plane orientation, whereby four distinct in-plane crystallographic
domains develop. For simple cubic EuPd$_3$ two different out-of-plane
orientations can be obtained by changing the substrate annealing temperature
under ultra-high vacuum conditions from 600{\deg} C to 1000{\deg} C for one
hour. A small resistance minimum evolves for EuPd$_3$ thin films grown with low
temperature substrate annealing, which was previously found even in single
crystals of EuPd$_3$ and might be attributed to a Kondo or weak localization
effect. Absence of influence of an applied magnetic fields and magnetotransport
measurements suggest always a nonmagnetic ground state for EuPd$_3$ thin films,
i. e., a purely trivalent Eu valence, as previously found in EuPd3 single
crystals. For EuPd$_2$ magnetic ordering below ~72 K is observed, quite similar
to single crystal behaviour. Additional field dependent measurements of the
magnetoresistance and the Hall effect show hysteresis effects below ~0.4 T and
an anomalous Hall effect below ~70 K, which saturates around 1.4 T, thus
proving a ferromagnetic ground state of the divalent Eu.
","[{""version"":""v1"",""created"":""Thu, 8 Jun 2023 17:01:02 GMT""}]","2023-06-09"
"2306.05356","Ge Yuan","Ge Yuan, Maomao Li, Yong Zhang, Huicheng Zheng","ReliableSwap: Boosting General Face Swapping Via Reliable Supervision","Project page: https://reliable-swap.github.io/ ; Github repository:
  https://github.com/ygtxr1997/ReliableSwap ; Demo (HuggingFace):
  https://huggingface.co/spaces/ygtxr1997/ReliableSwap_Demo ;",,,,"cs.CV","http://arxiv.org/licenses/nonexclusive-distrib/1.0/","  Almost all advanced face swapping approaches use reconstruction as the proxy
task, i.e., supervision only exists when the target and source belong to the
same person. Otherwise, lacking pixel-level supervision, these methods struggle
for source identity preservation. This paper proposes to construct reliable
supervision, dubbed cycle triplets, which serves as the image-level guidance
when the source identity differs from the target one during training.
Specifically, we use face reenactment and blending techniques to synthesize the
swapped face from real images in advance, where the synthetic face preserves
source identity and target attributes. However, there may be some artifacts in
such a synthetic face. To avoid the potential artifacts and drive the
distribution of the network output close to the natural one, we reversely take
synthetic images as input while the real face as reliable supervision during
the training stage of face swapping. Besides, we empirically find that the
existing methods tend to lose lower-face details like face shape and mouth from
the source. This paper additionally designs a FixerNet, providing
discriminative embeddings of lower faces as an enhancement. Our face swapping
framework, named ReliableSwap, can boost the performance of any existing face
swapping network with negligible overhead. Extensive experiments demonstrate
the efficacy of our ReliableSwap, especially in identity preservation. The
project page is https://reliable-swap.github.io/.
","[{""version"":""v1"",""created"":""Thu, 8 Jun 2023 17:01:14 GMT""}]","2023-06-09"
"2306.05357","Yilun Du","Nan Liu, Yilun Du, Shuang Li, Joshua B. Tenenbaum, Antonio Torralba","Unsupervised Compositional Concepts Discovery with Text-to-Image
  Generative Models","Project Webpage:
  https://energy-based-model.github.io/unsupervised-concept-discovery/",,,,"cs.CV cs.AI cs.LG","http://creativecommons.org/licenses/by/4.0/","  Text-to-image generative models have enabled high-resolution image synthesis
across different domains, but require users to specify the content they wish to
generate. In this paper, we consider the inverse problem -- given a collection
of different images, can we discover the generative concepts that represent
each image? We present an unsupervised approach to discover generative concepts
from a collection of images, disentangling different art styles in paintings,
objects, and lighting from kitchen scenes, and discovering image classes given
ImageNet images. We show how such generative concepts can accurately represent
the content of images, be recombined and composed to generate new artistic and
hybrid images, and be further used as a representation for downstream
classification tasks.
","[{""version"":""v1"",""created"":""Thu, 8 Jun 2023 17:02:15 GMT""}]","2023-06-09"
"2306.05360","Zheng Yuan","Adaeze Adigwe (1), Zheng Yuan (2 and 3)((1) University of Edinburgh,
  United Kingdom, (2) Istituto Italiano di Tecnologia, Italy, (3) Universit\`a
  di Ferrara, Italy)","The ADAIO System at the BEA-2023 Shared Task on Generating AI Teacher
  Responses in Educational Dialogues","Accepted in the BEA workshop at ACL 2023",,,,"cs.CL cs.AI cs.CY","http://creativecommons.org/licenses/by-nc-nd/4.0/","  This paper presents the ADAIO team's system entry in the Building Educational
Applications (BEA) 2023 Shared Task on Generating AI Teacher Responses in
Educational Dialogues. The task aims to assess the performance of
state-of-the-art generative models as AI teachers in producing suitable
responses within a student-teacher dialogue. Our system comprises evaluating
various baseline models using OpenAI GPT-3 and designing diverse prompts to
prompt the OpenAI models for teacher response generation. After the challenge,
our system achieved second place by employing a few-shot prompt-based approach
with the OpenAI text-davinci-003 model. The results highlight the few-shot
learning capabilities of large-language models, particularly OpenAI's GPT-3, in
the role of AI teachers.
","[{""version"":""v1"",""created"":""Thu, 8 Jun 2023 17:05:38 GMT""}]","2023-06-09"
"2306.05361","Kazuhiro Ito","Kazuhiro Ito","Deformation theory for prismatic $G$-displays","54 pages, comments welcome",,,,"math.NT math.AG","http://arxiv.org/licenses/nonexclusive-distrib/1.0/","  We develop the deformation theory for $G$-$\mu$-displays over the prismatic
site of Bhatt-Scholze. As an application, we prove the local representability
of integral local Shimura varieties with hyperspecial level structure. We also
revisit and extend some classification results of $p$-divisible groups, using
our deformation theory.
","[{""version"":""v1"",""created"":""Thu, 8 Jun 2023 17:06:06 GMT""}]","2023-06-09"
"2306.05362","Dungang Liu","Shaobo Li, Zhaohu Fan, Ivy Liu, Philip S. Morrison, Dungang Liu","Surrogate method for partial association between mixed data with
  application to well-being survey analysis","38 pages",,,,"stat.ME","http://creativecommons.org/licenses/by-nc-nd/4.0/","  This paper is motivated by the analysis of a survey study of college student
wellbeing before and after the outbreak of the COVID-19 pandemic. A statistical
challenge in well-being survey studies lies in that outcome variables are often
recorded in different scales, be it continuous, binary, or ordinal. The
presence of mixed data complicates the assessment of the associations between
them while adjusting for covariates. In our study, of particular interest are
the associations between college students' wellbeing and other mental health
measures and how other risk factors moderate these associations during the
pandemic. To this end, we propose a unifying framework for studying partial
association between mixed data. This is achieved by defining a unified residual
using the surrogate method. The idea is to map the residual randomness to the
same continuous scale, regardless of the original scales of outcome variables.
It applies to virtually all commonly used models for covariate adjustments. We
demonstrate the validity of using such defined residuals to assess partial
association. In particular, we develop a measure that generalizes classical
Kendall's tau in the sense that it can size both partial and marginal
associations. More importantly, our development advances the theory of the
surrogate method developed in recent years by showing that it can be used
without requiring outcome variables having a latent variable structure. The use
of our method in the well-being survey analysis reveals (i) significant
moderation effects (i.e., the difference between partial and marginal
associations) of some key risk factors; and (ii) an elevated moderation effect
of physical health, loneliness, and accommodation after the onset of COVID-19.
","[{""version"":""v1"",""created"":""Thu, 8 Jun 2023 17:06:28 GMT""}]","2023-06-09"
