"2301.03240","Jian-Gang Guo","Junjie Wang, Tianping Ying, Jun Deng, Cuiying Pei, Tongxu Yu, Xu Chen,
  Yimin Wan, Mingzhang Yang, Weiyi Dai, Dongliang Yang, Yanchun Li, Shiyan Li,
  Soshi Iimura, Shixuan Du, Hideo Hosono, Yanpeng Qi, Jian-gang Guo","Superconductivity in an Orbital-reoriented SnAs Square Lattice: a Case
  Study of Li0.6Sn2As2 and NaSnAs","6 pages,4 figures, Accepted by Angew. Chem. Int. Ed",,,,"cond-mat.supr-con cond-mat.mtrl-sci","http://creativecommons.org/licenses/by/4.0/","  Searching for functional square lattices in layered superconductor systems
offers an explicit clue to modify the electron behavior and find exotic
properties. The trigonal SnAs3 structural units in SnAs-based systems are
relatively conformable to distortion, which provides the possibility to achieve
structurally topological transformation and higher superconducting transition
temperatures. In the present work, the functional As square lattice was
realized and activated in Li0.6Sn2As2 and NaSnAs through a topotactic
structural transformation of trigonal SnAs3 to square SnAs4 under pressure,
resulting in a record-high Tc among all synthesized SnAs-based compounds.
Meanwhile, the conductive channel transfers from the out-of-plane pz orbital to
the in-plane px+py orbitals, facilitating electron hopping within the square 2D
lattice and boosting the superconductivity. The reorientation of p-orbital
following a directed local structure transformation provides an effective
strategy to modify layered superconductors.
","[{""version"":""v1"",""created"":""Mon, 9 Jan 2023 10:13:48 GMT""}]","2023-01-10"
"2301.03241","Alice Shapley","Alice E. Shapley, Ryan L. Sanders, Naveen A. Reddy, Michael W.
  Topping, Gabriel B. Brammer","JWST/NIRSpec Balmer-line Measurements of Star Formation and Dust
  Attenuation at z~3-6","8 pages, 4 figures, submitted to ApJ",,,,"astro-ph.GA","http://arxiv.org/licenses/nonexclusive-distrib/1.0/","  We present an analysis of the star-formation rates (SFRs) and dust
attenuation properties of star-forming galaxies at $2.7\leq z<6.5$ drawn from
the Cosmic Evolution Early Release Science (CEERS) Survey. Our analysis is
based on {\it JWST}/NIRSpec Micro-Shutter Assembly (MSA) $R\sim1000$
spectroscopic observations covering approximately $1-5$$\mu$m. Our primary
rest-frame optical spectroscopic measurements are H$\alpha$/H$\beta$ Balmer
decrements, which we use as an indicator of nebular dust attenuation. In turn,
we use Balmer decrements to obtain dust-corrected H$\alpha$-based SFRs (i.e.,
SFR(H$\alpha$)). We construct the relationship between SFR(H$\alpha$) and
stellar mass ($M_*$) in three bins of redshift ($2.7\leq z< 4.0$, $4.0\leq z<
5.0$, and $5.0\leq z<6.5$), which represents the first time the star-forming
main sequence has been traced at these redshifts using direct spectroscopic
measurements of Balmer emission as a proxy for SFR. In tracing the relationship
between SFR(H$\alpha$) and $M_*$ back to such early times ($z>3$), it is
essential to use a conversion factor between H$\alpha$ and SFR that accounts
for the subsolar metallicity prevalent among distant galaxies. We also use
measured Balmer decrements to investigate the relationship between dust
attenuation and stellar mass out to $z\sim6$. The lack of significant redshift
evolution in attenuation at fixed stellar mass, previously confirmed using
Balmer decrements out to $z\sim2.3$, appears to hold out to $z\sim 6.5$. Given
the rapidly evolving gas, dust, and metal content of star-forming galaxies at
fixed mass, this lack of significant evolution in attenuation provides an
ongoing challenge to explain.
","[{""version"":""v1"",""created"":""Mon, 9 Jan 2023 10:14:12 GMT""}]","2023-01-10"
"2301.03242","Rapha\""el Pourcelot","R. Pourcelot, E. H. Por, M. N'Diaye, H. Benard, G. Brady, L. Canas, M.
  Carbillet, K. Dohlen, I. Laginja, J. Lugten, J. Noss, M. D. Perrin, P.
  Petrone, L. Pueyo, S. F. Redmond, A. Sahoo, A. Vigan, S. D. Will, R. Soummer","Low-order wavefront control using a Zernike sensor through Lyot
  coronagraphs for exoplanet imaging: II. Concurrent operation with stroke
  minimization",,"A&A 672, A73 (2023)","10.1051/0004-6361/202244857",,"astro-ph.IM","http://arxiv.org/licenses/nonexclusive-distrib/1.0/","  Wavefront sensing and control (WFSC) will play a key role in improving the
stability of future large segmented space telescopes while relaxing the
thermo-mechanical constraints on the observatory structure. Coupled with a
coronagraph to reject the light of an observed bright star, WFSC enables the
generation and stabilisation of a dark hole (DH) in the star image to perform
planet observations. While WFSC traditionally relies on a single wavefront
sensor (WFS) input to measure wavefront errors, the next generation of
instruments will require several WFSs to address aberrations with different
sets of spatial and temporal frequency contents. The multiple measurements
produced in such a way will then have to be combined and converted to commands
for deformable mirrors (DMs) to modify the wavefront subsequently. We
asynchronously operate a loop controlling the high-order modes digging a DH and
a control loop that uses the rejected light by a Lyot coronagraph with a
Zernike wavefront sensor to stabilize the low-order aberrations. Using the
HiCAT testbed with a segmented telescope aperture, we implement concurrent
operations and quantify the expected cross-talk between the two controllers. We
then present experiments that alternate high-order and low-order control loops
to identify and estimate their respective contributions. We show an efficient
combination of the high-order and low-order control loops, keeping a DH
contrast better than 5 x 10-8 over a 30 min experiment and stability
improvement by a factor of 1.5. In particular, we show a contrast gain of 1.5
at separations close to the DH inner working angle, thanks to the low-order
controller contribution. Concurrently digging a DH and using the light rejected
by a Lyot coronagraph to stabilize the wavefront is a promising path towards
exoplanet imaging and spectroscopy with future large space observatories.
","[{""version"":""v1"",""created"":""Mon, 9 Jan 2023 10:15:34 GMT""}]","2023-04-05"
"2301.03243","Varun Jindal","Akshay Kumar and Varun Jindal","Dual of an extended locally convex space",,,,,"math.FA","http://creativecommons.org/licenses/by/4.0/","  This paper aims to study the dual of an extended locally convex space. In
particular, we study the weak and weak* topologies as well as the topology of
uniform convergence on bounded subsets of an extended locally convex space. As
an application to function spaces, we show that the weak topology for the space
C(X) of all real-valued continuous functions on a metric space (X,d) endowed
with the topology of strong uniform convergence on bornology coincides with its
finest locally convex topology if and only if the bornology is of all finite
subsets of X.
","[{""version"":""v1"",""created"":""Mon, 9 Jan 2023 10:16:37 GMT""}]","2023-01-10"
"2301.03244","Thilo Welz","Eric S. Knop, Markus Pauly, Tim Friede, Thilo Welz","The impact of neglected confounding and interactions in mixed-effects
  meta-regression","10 pages, 2 figures. arXiv admin note: text overlap with
  arXiv:2201.05491",,,,"stat.ME stat.AP","http://creativecommons.org/licenses/by/4.0/","  Analysts seldom include interaction terms in meta-regression model, what can
introduce bias if an interaction is present. We illustrate this in the current
paper by re-analyzing an example from research on acute heart failure, where
neglecting an interaction might have led to erroneous inference and
conclusions. Moreover, we perform a brief simulation study based on this
example highlighting the effects caused by omitting or unnecessarily including
interaction terms. Based on our results, we recommend to always include
interaction terms in mixed-effects meta-regression models, when such
interactions are plausible.
","[{""version"":""v1"",""created"":""Mon, 9 Jan 2023 10:22:16 GMT""}]","2023-01-10"
"2301.03245","Maciej Molas Dr.","A. O. Slobodeniuk and M. R. Molas","Exciton spectrum in atomically thin monolayers: The role of hBN
  encapsulation","7 pages, 4 figures + SM",,,,"cond-mat.mes-hall cond-mat.mtrl-sci","http://arxiv.org/licenses/nonexclusive-distrib/1.0/","  The high-quality structures containing semiconducting transition metal
dichalcogenides (S-TMDs) monolayer (MLs) required for optical and electrical
studies are achieved by their encapsulation in hexagonal BN (hBN) flakes. To
examine the effect of hBN thickness in these systems, we consider a model with
an S-TMD ML placed between a semi-infinite in the out-of-plane direction
substrate and complex top cover layers: a layer of finite thickness, adjacent
to the ML, and a semi-infinite in the out-of-plane direction top part. We
obtain the expression for the Coulomb potential for such a structure. Using
this result, we demonstrate that the energies of excitonic $s$ states in the
structure with WSe$_2$ ML change significantly for the top hBN with thickness
less than 30 layers for different substrate cases, such as hBN and SiO$_2$. For
the larger thickness of the top hBN flake, the binding energies of the excitons
are saturated to their values of the bulk hBN limit.
","[{""version"":""v1"",""created"":""Mon, 9 Jan 2023 10:23:15 GMT""},{""version"":""v2"",""created"":""Mon, 15 May 2023 11:24:16 GMT""}]","2023-05-16"
"2301.03246","Zhichao Jiang","Zhichao Jiang, Shizhe Chen and Peng Ding","An instrumental variable method for point processes: generalised Wald
  estimation based on deconvolution",,,,,"stat.ME","http://arxiv.org/licenses/nonexclusive-distrib/1.0/","  Point processes are probabilistic tools for modeling event data. While there
exists a fast-growing literature studying the relationships between point
processes, it remains unexplored how such relationships connect to causal
effects. In the presence of unmeasured confounders, parameters from point
process models do not necessarily have causal interpretations. We propose an
instrumental variable method for causal inference with point process treatment
and outcome. We define causal quantities based on potential outcomes and
establish nonparametric identification results with a binary instrumental
variable. We extend the traditional Wald estimation to deal with point process
treatment and outcome, showing that it should be performed after a Fourier
transform of the intention-to-treat effects on the treatment and outcome and
thus takes the form of deconvolution. We term this as the generalised Wald
estimation and propose an estimation strategy based on well-established
deconvolution methods.
","[{""version"":""v1"",""created"":""Mon, 9 Jan 2023 10:23:26 GMT""}]","2023-01-10"
"2301.03247","Ben Lang","Ben Lang, Edmund Harbord and Ruth Oulton","Reflection by two level system: phase singularities on the Poincar\'e
  hypersphere","5 pages, 4 figures",,,,"physics.optics quant-ph","http://creativecommons.org/licenses/by/4.0/","  We consider the reflection of a photon by a two-level system in a
quasi-one-dimensional waveguide. This is important in part because it forms the
backdrop for more complicated proposals where many emitters are coupled to the
waveguide: leading to super and subradiant coupling even when the emitters are
distant. The incorporation of chiral effects, for example unidirectional
emission of dipole emitters, has already led to rich physics such as dimer
coupling. However, chirality is not the only effect of the dipole, as we
explore from a phase singularity perspective. We demonstrate that control of
the dipole allows a rich variety of control of the phase and amplitude of the
scattered light in both directions. This expands the scope for the physics of
1D chains of emitters.
","[{""version"":""v1"",""created"":""Mon, 9 Jan 2023 10:25:34 GMT""}]","2023-01-10"
"2301.03248","Oona Rainio","Oona Rainio","Inequalities for the generalized point pair function","17 pages, 1 figure",,,,"math.MG","http://arxiv.org/licenses/nonexclusive-distrib/1.0/","  We study a new generalized version of the point pair function defined with a
constant $\alpha>0$. We prove that this function is a quasi-metric for all
values of $\alpha>0$, and compare it to several hyperbolic-type metrics, such
as the $j^*$-metric, the triangular ratio metric, and the hyperbolic metric.
Most of the inequalities presented here have the best possible constants in
terms of $\alpha$. Furthermore, we research the distortion of the generalized
point pair function under conformal and quasiregular mappings.
","[{""version"":""v1"",""created"":""Mon, 9 Jan 2023 10:25:39 GMT""}]","2023-01-10"
"2301.03249","Noraiz Tahir","Noraiz Tahir, Francesco De Paolis, Asghar Qadir, Achille A. Nucita","On the Galactic Halos Rotation by Planck Data","18 pages, 7 figrues, Journal: Symmetry, Special Issues:Recent
  Advances Studies Cosmic Microwave Background","Symmetry 2023, 15, 160","10.3390/sym15010160",,"astro-ph.GA","http://creativecommons.org/publicdomain/zero/1.0/","  As galactic halos are not directly visible, there are many ambiguities
regarding their composition and rotational velocity. Though most of the dark
matter is non-baryonic, {\it some fraction is}, and it can be used to trace the
halo rotation. Asymmetries in the CMB towards M31 had been seen in the Planck
data and ascribed to the rotational Doppler shift of the M31 halo.
Subsequently, the same methods were used in the direction of five other
galaxies belonging to the Local Group, namely M33, M81, M82, NGC 5128, and NGC
4594. It had been proved that there could be stable clouds of gas and dust in
thermal equilibrium with the CMB at 2.7 K, which had been called ``virial
clouds''. In this paper, adopting this scenerio, an attempt is made to
constrain the fraction of dust grains and gas molecules in the clouds.
","[{""version"":""v1"",""created"":""Mon, 9 Jan 2023 10:28:38 GMT""}]","2023-01-10"
"2301.03250","Lotte Weedage","Lotte Weedage, Syllas Rangel, Clara Stegehuis and Suzan Bayhan","On the resilience of cellular networks: how can national roaming help?","13 pages, 10 figures",,,,"cs.NI","http://creativecommons.org/licenses/by/4.0/","  Cellular networks have become one of the critical infrastructures, as many
services depend increasingly on wireless connectivity. Therefore, it is
important to quantify the resilience of existing cellular network
infrastructures against potential risks, ranging from natural disasters to
security attacks, that might occur with a low probability but can lead to
severe disruption of the services. In this paper, we combine models with public
data from national bodies on mobile network operator (MNO) infrastructures,
population distribution, and urbanity level to assess the coverage and capacity
of a cellular network at a country scale. Our analysis offers insights on the
potential weak points that need improvement to ensure a low fraction of
disconnected population (FDP) and high fraction of satisfied population (FSP).
As a resilience improvement approach, we investigate in which regions and to
what extent each MNO can benefit from infrastructure sharing or national
roaming, i.e., all MNOs act as a single national operator. As our case study,
we focus on Dutch cellular infrastructure and model risks as random failures,
correlated failures in a geographic region, and abrupt increase in the number
of users. Our analysis shows that there is a wide performance difference across
MNOs and geographic regions in terms of FDP and FSP. However, national roaming
consistently offers significant benefits, e.g., up to 13% improvement in FDP
and up to 55% in FSP when the networks function without any failures.
","[{""version"":""v1"",""created"":""Mon, 9 Jan 2023 10:29:17 GMT""}]","2023-01-10"
"2301.03251","Huanyu Bian","Huanyu Bian, Zhilong Jia, Menghan Dou, Yuan Fang, Lei Li, Yiming Zhao,
  Hanchao Wang, Zhaohui Zhou, Wei Wang, Wenyu Zhu, Ye Li, Yang Yang, Weiming
  Zhang, Nenghai Yu, Zhaoyun Chen, Guoping Guo","VQNet 2.0: A New Generation Machine Learning Framework that Unifies
  Classical and Quantum",,,,,"quant-ph cs.LG","http://arxiv.org/licenses/nonexclusive-distrib/1.0/","  With the rapid development of classical and quantum machine learning, a large
number of machine learning frameworks have been proposed. However, existing
machine learning frameworks usually only focus on classical or quantum, rather
than both. Therefore, based on VQNet 1.0, we further propose VQNet 2.0, a new
generation of unified classical and quantum machine learning framework that
supports hybrid optimization. The core library of the framework is implemented
in C++, and the user level is implemented in Python, and it supports deployment
on quantum and classical hardware. In this article, we analyze the development
trend of the new generation machine learning framework and introduce the design
principles of VQNet 2.0 in detail: unity, practicality, efficiency, and
compatibility, as well as full particulars of implementation. We illustrate the
functions of VQNet 2.0 through several basic applications, including classical
convolutional neural networks, quantum autoencoders, hybrid classical-quantum
networks, etc. After that, through extensive experiments, we demonstrate that
the operation speed of VQNet 2.0 is higher than the comparison method. Finally,
through extensive experiments, we demonstrate that VQNet 2.0 can deploy on
different hardware platforms, the overall calculation speed is faster than the
comparison method. It also can be mixed and optimized with quantum circuits
composed of multiple quantum computing libraries.
","[{""version"":""v1"",""created"":""Mon, 9 Jan 2023 10:31:18 GMT""}]","2023-01-10"
"2301.03252","Artem Shelmanov","Akim Tsvigun, Ivan Lysenko, Danila Sedashov, Ivan Lazichny, Eldar
  Damirov, Vladimir Karlov, Artemy Belousov, Leonid Sanochkin, Maxim Panov,
  Alexander Panchenko, Mikhail Burtsev, Artem Shelmanov","Active Learning for Abstractive Text Summarization","Accepted at EMNLP-2022 Findings",,,,"cs.CL","http://creativecommons.org/licenses/by/4.0/","  Construction of human-curated annotated datasets for abstractive text
summarization (ATS) is very time-consuming and expensive because creating each
instance requires a human annotator to read a long document and compose a
shorter summary that would preserve the key information relayed by the original
document. Active Learning (AL) is a technique developed to reduce the amount of
annotation required to achieve a certain level of machine learning model
performance. In information extraction and text classification, AL can reduce
the amount of labor up to multiple times. Despite its potential for aiding
expensive annotation, as far as we know, there were no effective AL query
strategies for ATS. This stems from the fact that many AL strategies rely on
uncertainty estimation, while as we show in our work, uncertain instances are
usually noisy, and selecting them can degrade the model performance compared to
passive annotation. We address this problem by proposing the first effective
query strategy for AL in ATS based on diversity principles. We show that given
a certain annotation budget, using our strategy in AL annotation helps to
improve the model performance in terms of ROUGE and consistency scores.
Additionally, we analyze the effect of self-learning and show that it can
further increase the performance of the model.
","[{""version"":""v1"",""created"":""Mon, 9 Jan 2023 10:33:14 GMT""}]","2023-01-10"
"2301.03253","Priyank Oza","Priyank Oza, Jagmohan Tyagi","Mixed fully nonlinear local and nonlocal elliptic operators in
  Heisenberg group","23 pages",,,,"math.AP","http://arxiv.org/licenses/nonexclusive-distrib/1.0/","  We establish the comparison principle, existence and regularity of viscosity
solutions to the following problem concerning the mixed operator:
  \begin{align}
  \begin{cases}
  \alpha\mathcal{M}^+_{\lambda,\Lambda}\big(D^2_{\mathbbm{H}^N,S}u\big)-\beta\big(-\Delta_{\mathbbm{H}^N}\big)^su=f
&\text{in } \,{\Omega},
  u=g &\text{in } \,\mathbbm{H}^N\setminus\Omega,
  \end{cases}
  \end{align}
  where $\mathcal{M}_{\lambda,\Lambda}^+$ is the extremal Pucci's operator and
$(-\Delta_{\mathbbm{H}^N})^s$ denotes the fractional sub-Laplacian on
Heisenberg group. Here $\alpha\geq 0$ and $\beta>0$ are constants.
","[{""version"":""v1"",""created"":""Mon, 9 Jan 2023 10:38:20 GMT""}]","2023-01-10"
"2301.03254","Jeremie Vidal","J. Vidal, D. C\'ebron","Precession-driven flows in stress-free ellipsoids","30 pages, 10 figures. Published in J. Fluid Mech","Journal of Fluid Mechanics, 2023, 954, A5","10.1017/jfm.2022.976",,"physics.flu-dyn physics.geo-ph","http://arxiv.org/licenses/nonexclusive-distrib/1.0/","  Motivated by modelling rotating turbulence in planetary fluid layers, we
investigate precession-driven flows in ellipsoids subject to stress-free
boundary conditions (SF-BC). The SF-BC could indeed unlock numerical
constraints associated with the no-slip boundary conditions (NS-BC), but are
also relevant for some astrophysical applications. Although SF-BC have been
employed in the pioneering work of Lorenzani & Tilgner (J. Fluid Mech., 2003,
492, pp. 363--379), they have scarcely been used due to the discovery of some
specific mathematical issues associated with angular momentum conservation. We
revisit the problem using asymptotic analysis in the low-viscosity regime,
which is validated with numerical simulations. First, we extend the reduced
model of uniform-vorticity flows in ellipsoids to account for SF-BC. We show
that the long-term evolution of angular momentum is affected by viscosity in
triaxial geometries, but also in axisymmetric ellipsoids when the mean rotation
axis of the fluid is not the symmetry axis. In a regime relevant to planets, we
analytically obtain the primary forced flow in triaxial geometries, which
exhibits a second inviscid resonance. Then, we investigate the bulk
instabilities existing in precessing ellipsoids. We show that using SF-BC would
be useful to explore the non-viscous instabilities (e.g. Kerswell, Geophys.
Astrophys. Fluid Dyn., 1993, 72, pp. 107-144), which are presumably relevant
for planetary applications but are often hampered in experiments or simulations
with NS-BC.
","[{""version"":""v1"",""created"":""Mon, 9 Jan 2023 10:41:03 GMT""}]","2023-01-10"
"2301.03255","Gennadiy Ilyuta","Gennadiy Ilyuta","The simultaneous multiplication formulas for Apostol-Bernoulli
  polynomials and generalized Frobenius-Euler polynomials","in Russian",,,,"math.NT math.CO","http://creativecommons.org/licenses/by/4.0/","  We prove the simultaneous multiplication formulas for Apostol-Bernoulli
polynomials and generalized Frobenius-Euler polynomials. These formulas contain
Dedekind-Rademacher sums, Apostol-Dedekind sums and Fourier-Dedekind sums.
","[{""version"":""v1"",""created"":""Mon, 9 Jan 2023 10:41:05 GMT""}]","2023-01-10"
"2301.03256","Thorsten Hesjedal","Gerrit van der Laan and Thorsten Hesjedal","X-ray detected ferromagnetic resonance techniques for the study of
  magnetization dynamics","10 pages, 5 figures",,"10.1016/j.nimb.2023.04.005",,"cond-mat.mtrl-sci cond-mat.other","http://creativecommons.org/licenses/by/4.0/","  Element-specific spectroscopies using synchrotron-radiation can provide
unique insights into materials properties. The recently developed technique of
X-ray detected ferromagnetic resonance (XFMR) allows studying the magnetization
dynamics of magnetic spin structures. Magnetic sensitivity in XFMR is obtained
from the X-ray magnetic circular dichroism (XMCD) effect, where the phase of
the magnetization precession of each magnetic layer with respect to the
exciting radio frequency is obtained using stroboscopic probing of the spin
precession. Measurement of both amplitude and phase response in the magnetic
layers as a function of bias field can give a clear signature of spin-transfer
torque (STT) coupling between ferromagnetic layers due to spin pumping. Over
the last few years, there have been new developments utilizing X-ray scattering
techniques to reveal the precessional magnetization dynamics of ordered spin
structures in the GHz frequency range. The techniques of diffraction and
reflectometry ferromagnetic resonance (DFMR and RFMR) provide novel ways for
the probing of the dynamics of chiral and multilayered magnetic materials,
thereby opening up new pathways for the development of high-density and
low-energy consumption data processing solutions.
","[{""version"":""v1"",""created"":""Mon, 9 Jan 2023 10:45:40 GMT""}]","2023-05-17"
