"2301.03157","Stefanie I. Becker","Zachary Hamblin-Frohman, Koralalage Don Raveen Amarasekera and
  Stefanie I. Becker","The progression of visual search in multiple item displays: First
  relational, then feature-based","~7,000 words, 5 figures",,,,"q-bio.NC","http://creativecommons.org/licenses/by-nc-nd/4.0/","  It is well-known that visual attention can be tuned in a context-dependent
manner to elementary features, such as searching for all redder items or the
reddest item, supporting a relational theory of visual attention. However, in
previous studies, the conditions were often conducive for relational search,
allowing successfully selecting the target relationally on 50% of trials or
more. Moreover, the search displays were often only sparsely populated and
presented repeatedly, rendering it possible that relational search was based on
context learning and not spontaneous. The present study tested the shape of the
attentional tuning function in 36-item search displays, when the target never
had a maximal feature value (e.g., was never the reddest or yellowest item),
and when only the target colour but not the context colour was known. The first
fixations on a trial showed that these displays still reliably evoked
relational search, even when participants had no advance information about the
context and no on-task training. Context learning further strengthened
relational tuning on subsequent trials, but was not necessary for relational
search. Analysing the progression of visual search within a singe trial showed
that attention is first guided to the relationally maximal item (e.g.,
reddest), then the next-maximal (e.g., next-reddest) item, and so forth, before
attention can hone in on target-matching features. In sum, the results support
two tenets of the relational account, that information about the dominant
feature in a display can be rapidly extracted and used to guide attention to
the relatively best-matching features.
","[{""version"":""v1"",""created"":""Mon, 9 Jan 2023 03:08:52 GMT""}]","2023-01-10"
"2301.03158","Sudhansu Biswal S.","Sudhansu S. Biswal, Sushree S. Mishra and K. Sridhar","Resolution of the LHCb $\eta_c$ anomaly","8 pages, 3 figures",,"10.1007/JHEP05(2023)120",,"hep-ph hep-ex","http://arxiv.org/licenses/nonexclusive-distrib/1.0/","  Due to the heavy-quark symmetry of Non-Relativistic Quantum Chromodynamics
(NRQCD), the cross-section for the production of $\eta_c$ can be predicted.
This NRQCD prediction when confronted with data from the LHCb is seen to fail
miserably. We address this LHCb $\eta_c$ anomaly in this paper using a new
approach called modified NRQCD, an approach that has been shown to work
extremely well for studying $J/\psi$, $\psi^{\prime}$ and $\chi_c$ production
at the LHC. We show, in the present paper, that the predictions for $\eta_c$
production agrees very well with LHCb measurements at the three different
values of energy that the experiment has presented data for. Modified NRQCD
also explains the intriguing agreement of the LHCb $\eta_c$ data with the
colour-singlet prediction. The remarkable agreement of the theoretical
predictions with the LHCb data suggests that modified NRQCD is closer to
apprehending the true dynamics of quarkonium production.
","[{""version"":""v1"",""created"":""Mon, 9 Jan 2023 03:34:56 GMT""}]","2023-05-31"
"2301.03159","Pintu Bhunia","Suvendu Jana, Pintu Bhunia, Kallol Paul","Numerical radius inequalities and estimation of zeros of polynomials","16 pages",,,,"math.FA","http://arxiv.org/licenses/nonexclusive-distrib/1.0/","  Let $A$ be a bounded linear operator defined on a complex Hilbert space and
let $|A|=(A^*A)^{1/2}$ be the positive square root of $A$.
  Among other refinements of the well known numerical radius inequality
$w^2(A)\leq \frac12 \|A^*A+AA^*\|$,
  we show that
  \begin{eqnarray*}
  w^2(A)&\leq&\frac{1}{4} w^2
\left(|A|+i|A^*|\right)+\frac{1}{8}\left\||A|^2+|A^*|^2\right
\|+\frac{1}{4}w\left(|A||A^*|\right)
  &\leq& \frac12 \|A^*A+AA^*\|.
  \end{eqnarray*} Also, we develop inequalities involving numerical radius and
spectral radius for the sum of the product operators, from which we derive the
following inequalities $$ w^p(A) \leq \frac{1}{\sqrt{2} } w(|A|^p+i|A^*|^p
)\leq \|A\|^p$$ for all $p\geq 1.$ Further, we derive new bounds for the zeros
of complex polynomials.
","[{""version"":""v1"",""created"":""Mon, 9 Jan 2023 03:41:09 GMT""}]","2023-01-10"
"2301.03160","Haowei Wang","Haowei Wang, Jiayi Ji, Yiyi Zhou, Yongjian Wu, Xiaoshuai Sun","Towards Real-Time Panoptic Narrative Grounding by an End-to-End
  Grounding Network","9 pages, 5 figures, accepted by AAAI23",,,,"cs.CV","http://arxiv.org/licenses/nonexclusive-distrib/1.0/","  Panoptic Narrative Grounding (PNG) is an emerging cross-modal grounding task,
which locates the target regions of an image corresponding to the text
description. Existing approaches for PNG are mainly based on a two-stage
paradigm, which is computationally expensive. In this paper, we propose a
one-stage network for real-time PNG, termed End-to-End Panoptic Narrative
Grounding network (EPNG), which directly generates masks for referents.
Specifically, we propose two innovative designs, i.e., Locality-Perceptive
Attention (LPA) and a bidirectional Semantic Alignment Loss (SAL), to properly
handle the many-to-many relationship between textual expressions and visual
objects. LPA embeds the local spatial priors into attention modeling, i.e., a
pixel may belong to multiple masks at different scales, thereby improving
segmentation. To help understand the complex semantic relationships, SAL
proposes a bidirectional contrastive objective to regularize the semantic
consistency inter modalities. Extensive experiments on the PNG benchmark
dataset demonstrate the effectiveness and efficiency of our method. Compared to
the single-stage baseline, our method achieves a significant improvement of up
to 9.4% accuracy. More importantly, our EPNG is 10 times faster than the
two-stage model. Meanwhile, the generalization ability of EPNG is also
validated by zero-shot experiments on other grounding tasks.
","[{""version"":""v1"",""created"":""Mon, 9 Jan 2023 03:57:14 GMT""}]","2023-01-10"
"2301.03161","Dominic Yang","Dominic Yang, Yurun Ge, Thien Nguyen, Jacob Moorman, Denali Molitor,
  Andrea Bertozzi","Structural Equivalence in Subgraph Matching","To appear in IEEE Transactions on Network Science and Engineering",,,,"cs.DS","http://creativecommons.org/licenses/by/4.0/","  Symmetry plays a major role in subgraph matching both in the description of
the graphs in question and in how it confounds the search process. This work
addresses how to quantify these effects and how to use symmetries to increase
the efficiency of subgraph isomorphism algorithms. We introduce rigorous
definitions of structural equivalence and establish conditions for when it can
be safely used to generate more solutions. We illustrate how to adapt standard
search routines to utilize these symmetries to accelerate search and compactly
describe the solution space. We then adapt a state-of-the-art solver and
perform a comprehensive series of tests to demonstrate these methods' efficacy
on a standard benchmark set. We extend these methods to multiplex graphs and
present results on large multiplex networks drawn from transportation systems,
social media, adversarial attacks, and knowledge graphs.
","[{""version"":""v1"",""created"":""Mon, 9 Jan 2023 04:01:17 GMT""}]","2023-01-10"
"2301.03162","Aydogan Ozcan","Hanlong Chen, Luzhe Huang, Tairan Liu, Aydogan Ozcan","eFIN: Enhanced Fourier Imager Network for generalizable autofocusing and
  pixel super-resolution in holographic imaging","10 Pages, 4 Figures","IEEE Journal of Selected Topics in Quantum Electronics (2023)","10.1109/JSTQE.2023.3248684",,"physics.optics cs.CV cs.LG","http://arxiv.org/licenses/nonexclusive-distrib/1.0/","  The application of deep learning techniques has greatly enhanced holographic
imaging capabilities, leading to improved phase recovery and image
reconstruction. Here, we introduce a deep neural network termed enhanced
Fourier Imager Network (eFIN) as a highly generalizable framework for hologram
reconstruction with pixel super-resolution and image autofocusing. Through
holographic microscopy experiments involving lung, prostate and salivary gland
tissue sections and Papanicolau (Pap) smears, we demonstrate that eFIN has a
superior image reconstruction quality and exhibits external generalization to
new types of samples never seen during the training phase. This network
achieves a wide autofocusing axial range of 0.35 mm, with the capability to
accurately predict the hologram axial distances by physics-informed learning.
eFIN enables 3x pixel super-resolution imaging and increases the
space-bandwidth product of the reconstructed images by 9-fold with almost no
performance loss, which allows for significant time savings in holographic
imaging and data processing steps. Our results showcase the advancements of
eFIN in pushing the boundaries of holographic imaging for various applications
in e.g., quantitative phase imaging and label-free microscopy.
","[{""version"":""v1"",""created"":""Mon, 9 Jan 2023 04:12:10 GMT""}]","2023-02-28"
"2301.03163","Vipin K Yadav","Vipin K Yadav","VIPER: A Plasma Wave Detection Instrument onboard Indian Venus Orbiter
  Spacecraft",,,,,"physics.plasm-ph physics.space-ph","http://creativecommons.org/licenses/by/4.0/","  Plasma waves are observed in almost all the solar system objects. The
planetary ionospheres are capable of sustaining plasma waves which are observed
there and play an important role in the ionospheric dynamics. Venus does not
possess a global magnetic field unlike Earth. The solar EUV radiation ionizes
the neutrals and generates a plasma environment around Venus which can sustain
plasma waves. Very few attempts are made to observe all plasma waves that can
exist around Venus and that too with instruments having a limited dynamic range
such as with Pioneer Venus Orbiter and Venus Express. However, there are some
other plasma waves which can exist around Venus but are yet to be observed.
","[{""version"":""v1"",""created"":""Mon, 9 Jan 2023 04:21:09 GMT""}]","2023-01-10"
"2301.03164","Ali Mirza Dr","Ali Mirza, Imran Siddiqi","Cursive Caption Text Detection in Videos","19 pages, 16 figures",,,,"cs.CV cs.AI cs.LG","http://arxiv.org/licenses/nonexclusive-distrib/1.0/","  Textual content appearing in videos represents an interesting index for
semantic retrieval of videos (from archives), generation of alerts (live
streams) as well as high level applications like opinion mining and content
summarization. One of the key components of such systems is the detection of
textual content in video frames and the same makes the subject of our present
study. This paper presents a robust technique for detection of textual content
appearing in video frames. More specifically we target text in cursive script
taking Urdu text as a case study. Detection of textual regions in video frames
is carried out by fine-tuning object detectors based on deep convolutional
neural networks for the specific case of text detection. Since it is common to
have videos with caption text in multiple-scripts, cursive text is
distinguished from Latin text using a script-identification module. Finally,
detection and script identification are combined in a single end-to-end
trainable system. Experiments on a comprehensive dataset of around 11,000 video
frames report an F-measure of 0.91.
","[{""version"":""v1"",""created"":""Mon, 9 Jan 2023 04:30:48 GMT""}]","2023-01-10"
"2301.03165","Andrew Yang","Andrew Yang","Explicit bounds on $\zeta(s)$ in the critical strip and a zero-free
  region","51 pages. Comments are welcome",,,,"math.NT","http://arxiv.org/licenses/nonexclusive-distrib/1.0/","  We derive explicit upper bounds for the Riemann zeta-function $\zeta(\sigma +
it)$ on the lines $\sigma = 1 - k/(2^k - 2)$ for integer $k \ge 4$. This is
used to show that the zeta-function has no zeroes in the region $$\sigma > 1 -
\frac{\log\log|t|}{21.432\log|t|},\qquad |t| \ge 3.$$ This is the largest known
zero-free region for $\exp(209) \le t \le \exp(5\cdot 10^{5})$. Our results
rely on an explicit version of the van der Corput $A^nB$ process for bounding
exponential sums.
","[{""version"":""v1"",""created"":""Mon, 9 Jan 2023 04:42:34 GMT""}]","2023-01-10"
"2301.03166","Jieyang Chen","Jieyang Chen, Xin Liang, Kai Zhao, Hadi Zamani Sabzi, Laxmi Bhuyan,
  Zizhong Chen","Improving Energy Saving of One-sided Matrix Decompositions on CPU-GPU
  Heterogeneous Systems",,,"10.1145/3572848.3577496",,"cs.DC","http://creativecommons.org/licenses/by/4.0/","  One-sided dense matrix decompositions (e.g., Cholesky, LU, and QR) are the
key components in scientific computing in many different fields. Although their
design has been highly optimized for modern processors, they still consume a
considerable amount of energy. As CPU-GPU heterogeneous systems are commonly
used for matrix decompositions, in this work, we aim to further improve the
energy saving of one-sided matrix decompositions on CPU-GPU heterogeneous
systems. We first build an Algorithm-Based Fault Tolerance protected
overclocking technique (ABFT-OC) to enable us to exploit reliable overclocking
for key matrix decomposition operations. Then, we design an energy-saving
matrix decomposition framework, Bi-directional Slack Reclamation(BSR), that can
intelligently combine the capability provided by ABFT-OC and DVFS to maximize
energy saving and maintain performance and reliability. Experiments show that
BSR is able to save up to 11.7% more energy compared with the current best
energy saving optimization approach with no performance degradation and up to
14.1% Energy * Delay^2 reduction. Also, BSR enables the Pareto efficient
performance-energy trade-off, which is able to provide up to 1.43x performance
improvement without costing extra energy.
","[{""version"":""v1"",""created"":""Mon, 9 Jan 2023 04:42:37 GMT""},{""version"":""v2"",""created"":""Wed, 26 Apr 2023 12:14:22 GMT""}]","2023-04-27"
"2301.03167","Duhwan Mun","Seungeun Lim, Changmo Yeo, Fazhi He, Jinwon Lee, Duhwan Mun","Machining feature recognition using descriptors with range constraints
  for mechanical 3D models",,,,,"cs.CG cs.CV","http://creativecommons.org/licenses/by-nc-nd/4.0/","  In machining feature recognition, geometric elements generated in a
three-dimensional computer-aided design model are identified. This technique is
used in manufacturability evaluation, process planning, and tool path
generation. Here, we propose a method of recognizing 16 types of machining
features using descriptors, often used in shape-based part retrieval studies.
The base face is selected for each feature type, and descriptors express the
base face's minimum, maximum, and equal conditions. Furthermore, the similarity
in the three conditions between the descriptors extracted from the target face
and those from the base face is calculated. If the similarity is greater than
or equal to the threshold, the target face is determined as the base face of
the feature. Machining feature recognition tests were conducted for two test
cases using the proposed method, and all machining features included in the
test cases were successfully recognized. Also, it was confirmed through an
additional test that the proposed method in this study showed better feature
recognition performance than the latest artificial neural network.
","[{""version"":""v1"",""created"":""Mon, 9 Jan 2023 04:50:06 GMT""}]","2023-01-10"
"2301.03168","Hiroki Matsui","Hiroki Matsui","Triangular spectra and their applications to derived categories of
  noetherian schemes","19 pages",,,,"math.AG math.CT","http://arxiv.org/licenses/nonexclusive-distrib/1.0/","  For a triangulated category $\mathcal{T}$, Matsui recently introduced a
topological space $\mathrm{Spec}_\triangle(\mathcal{T})$ which we call the
triangular spectrum of $\mathcal{T}$ as an analog of the Balmer spectrum
introduced by Balmer for a tensor triangulated category. In the present paper,
we use the triangular spectrum to reconstruct a noetherian scheme $X$ from its
perfect derived category $\mathrm{D^{pf}}(X)$. As an application, we give an
alternative proof of the Bondal-Orlov-Ballard reconstruction theorem. Moreover,
we define the structure sheaf on $\mathrm{Spec}_\triangle(\mathcal{T})$ and
compare the triangular spectrum and the Balmer spectrum as ringed spaces.
","[{""version"":""v1"",""created"":""Mon, 9 Jan 2023 04:55:31 GMT""}]","2023-01-10"
"2301.03169","Jinwoo Bae","Jinwoo Bae and Kyumin Hwang and Sunghoon Im","A Study on the Generality of Neural Network Structures for Monocular
  Depth Estimation","under review. This paper extends our previous work in
  arXiv:2205.11083",,,,"cs.CV cs.AI","http://arxiv.org/licenses/nonexclusive-distrib/1.0/","  Monocular depth estimation has been widely studied, and significant
improvements in performance have been recently reported. However, most previous
works are evaluated on a few benchmark datasets, such as KITTI datasets, and
none of the works provide an in-depth analysis of the generalization
performance of monocular depth estimation. In this paper, we deeply investigate
the various backbone networks (e.g.CNN and Transformer models) toward the
generalization of monocular depth estimation. First, we evaluate
state-of-the-art models on both in-distribution and out-of-distribution
datasets, which have never been seen during network training. Then, we
investigate the internal properties of the representations from the
intermediate layers of CNN-/Transformer-based models using synthetic
texture-shifted datasets. Through extensive experiments, we observe that the
Transformers exhibit a strong shape-bias rather than CNNs, which have a strong
texture-bias. We also discover that texture-biased models exhibit worse
generalization performance for monocular depth estimation than shape-biased
models. We demonstrate that similar aspects are observed in real-world driving
datasets captured under diverse environments. Lastly, we conduct a dense
ablation study with various backbone networks which are utilized in modern
strategies. The experiments demonstrate that the intrinsic locality of the CNNs
and the self-attention of the Transformers induce texture-bias and shape-bias,
respectively.
","[{""version"":""v1"",""created"":""Mon, 9 Jan 2023 04:58:12 GMT""},{""version"":""v2"",""created"":""Tue, 10 Jan 2023 02:30:25 GMT""}]","2023-01-11"
"2301.03170","Kh\'a-\^I T\^o","Kh\'a-\^I T\^o","Cluster Formation and Relaxation in Particle Rafts under Uniform Radial
  Expansion",,,,,"cond-mat.soft","http://creativecommons.org/licenses/by/4.0/","  Particle rafts floating at an air-liquid interface exhibit a variety of
behaviors when interfacial flow is introduced. Motivated by previous
experimental observations, the failure pattern of particle rafts under uniform
radial expansion is reported in this paper. The expansion process is
specifically designed to expand the system affinely in the radial direction and
to keep the velocity gradient constant throughout. A strong resemblance to the
results of particle rafts under uniform uniaxial expansion[1] is found. The
size of the cluster emerging as the rafts are pulled apart scales inversely
with the pulling velocity. This is a result of two competing velocities: the
inter-particle separation speed provided by the flow and a size-dependent
relaxation speed for clustering. A model, generalized from a one-dimensional
linear (in)stability calculation, is in agreement with the failure morphology
found for this radially expanded system. Nonlinear relaxation and particle
rearrangement is observed after the initial clustering occurs. This is a
feature unique to a two-dimensional system. With its easily accessible particle
dynamics at the microscopic level, this system provides insights into the
morphology controlled by two competing mechanisms in two or higher dimensions
and across different scales.
","[{""version"":""v1"",""created"":""Mon, 9 Jan 2023 05:07:17 GMT""}]","2023-01-10"
"2301.03171","Takaya Matsuura","Takaya Matsuura, Shinichiro Yamano, Yui Kuramochi, Toshihiko Sasaki,
  Masato Koashi","Refined finite-size analysis of binary-modulation continuous-variable
  quantum key distribution","27 pages, 3 figures, Modified for journal submission",,,,"quant-ph","http://arxiv.org/licenses/nonexclusive-distrib/1.0/","  Recent studies showed the finite-size security of binary-modulation CV-QKD
protocols against general attacks. However, they gave poor key-rate scaling
against transmission distance. Here, we extend the security proof based on
complementarity, which is used in the discrete-variable QKD, to the previously
developed binary-modulation CV-QKD protocols with reverse reconciliation under
the finite-size regime and obtain large improvements in the key rates. Notably,
the key rate in the asymptotic limit scales linearly against the attenuation
rate, which is known to be optimal scaling but is not achieved in previous
finite-size analyses. This refined security approach may offer full-fledged
security proofs for other discrete-modulation CV-QKD protocols.
","[{""version"":""v1"",""created"":""Mon, 9 Jan 2023 05:11:23 GMT""},{""version"":""v2"",""created"":""Thu, 26 Jan 2023 22:40:34 GMT""}]","2023-01-30"
"2301.03172","Mingyan Zhang","Lixiu Wang, Mingyan Zhang, and Qian Zhang","Fully H(gradcurl)-nonconforming Finite Element Method for The Singularly
  Perturbed Quad-curl Problem on Cubical Meshes",,,,,"math.NA cs.NA","http://arxiv.org/licenses/nonexclusive-distrib/1.0/","  In this paper, we develop two fully nonconforming (both H(grad
curl)-nonconforming and H(curl)-nonconforming) finite elements on cubical
meshes which can fit into the Stokes complex. The newly proposed elements have
24 and 36 degrees of freedom, respectively. Different from the fully H(grad
curl)-nonconforming tetrahedral finite elements in [9], the elements in this
paper lead to a robust finite element method to solve the singularly perturbed
quad-curl problem. To confirm this, we prove the optimal convergence of order
$O(h)$ for a fixed parameter $\epsilon$ and the uniform convergence of order
$O(h^{1/2})$ for any value of $\epsilon$. Some numerical examples are used to
verify the correctness of the theoretical analysis.
","[{""version"":""v1"",""created"":""Mon, 9 Jan 2023 05:13:19 GMT""},{""version"":""v2"",""created"":""Fri, 13 Jan 2023 16:04:56 GMT""}]","2023-01-16"
"2301.03173","Jesus Cruz Rojas","Jes\'us Cruz Rojas, Tuna Demircik, Matti J\""arvinen","Popcorn transitions and approach to conformality in homogeneous
  holographic nuclear matter","15 pages, 5 figures",,,,"hep-th nucl-th","http://creativecommons.org/licenses/by/4.0/","  We study cold and dense nuclear matter by using the gauge/gravity duality. To
this end we use the Witten-Sakai-Sugimoto model and the V-QCD models with an
approach where the nuclear matter is taken to be spatially homogeneous. We
focus on the ''popcorn'' transitions, which are phase transitions in the
nuclear matter phases induced by changes in the layer structure of the
configuration on the gravity side. We demonstrate that the equation of state
for the homogeneous nuclear matter becomes approximately conformal at high
densities, and compare our results to other approaches.
","[{""version"":""v1"",""created"":""Mon, 9 Jan 2023 05:13:50 GMT""}]","2023-01-10"
"2301.03174","Liqun Qi","Liqun Qi, Xiangke Wang and Chunfeng Cui","Augmented Quaternion and Augmented Unit Quaternion Optimization",,,,,"cs.RO math.OC","http://creativecommons.org/licenses/by/4.0/","  In this paper, we introduce and explore augmented quaternions and augmented
unit quaternions, and present an augmented unit quaternion optimization model.
An augmented quaternion consist of a quaternion and a translation vector. The
multiplication rule of augmented quaternion is defined. An augmented unit
quaternion consists of a unit quaternion and a translation vector. The
augmented unit quaternions form a Lie group. By means of augmented unit
quaternions, we study the error model and kinematics. Then we formulate two
classical problems in robot research, i.e., the hand-eye calibration problem
and the simultaneous localization and mapping (SLAM) problem as augmented unit
quaternion optimization problems, which are actually real smooth spherical
equality constrained optimization problems. Comparing with the corresponding
unit dual quaternion optimization model, the augmented unit quaternion
optimization model has less variables and removes the orthogonality
constraints.
","[{""version"":""v1"",""created"":""Mon, 9 Jan 2023 05:21:17 GMT""},{""version"":""v2"",""created"":""Mon, 27 Feb 2023 10:40:22 GMT""}]","2023-02-28"
"2301.03175","Guoyong Gu","Guoyong Gu and Junfeng Yang","Tight Convergence Rate in Subgradient Norm of the Proximal Point
  Algorithm",,,,,"math.OC","http://creativecommons.org/licenses/by/4.0/","  Proximal point algorithm has found many applications, and it has been playing
fundamental roles in the understanding, design, and analysis of many
first-order methods. In this paper, we derive the tight convergence rate in
subgradient norm of the proximal point algorithm, which was conjectured by
Taylor, Hendrickx and Glineur [SIAM J.~Optim., 27 (2017), pp.~1283--1313]. This
sort of convergence results in terms of the residual (sub)gradient norm is
particularly interesting when considering dual methods, where the dual residual
gradient norm corresponds to the primal distance to feasibility.
","[{""version"":""v1"",""created"":""Mon, 9 Jan 2023 05:24:45 GMT""}]","2023-01-10"
