"2301.03342","Yue Chen","Dongxiang Yan, Shihan Huang, Yue Chen","Real-time Feedback Based Online Aggregate EV Power Flexibility
  Characterization","12 pages, 13 figures",,,,"math.OC cs.SY eess.SY","http://creativecommons.org/licenses/by-nc-nd/4.0/","  As an essential measure to combat global warming, electric vehicles (EVs)
have witnessed rapid growth. Meanwhile, thanks to the flexibility of EV
charging, vehicle-to-grid (V2G) interaction has captured great attention.
However, the direct control of individual EVs is challenging due to their small
capacity, large number, and private information. Hence, it is the aggregator
that interacts with the grid on behalf of EVs by characterizing their aggregate
flexibility. In this paper, we focus on the aggregate EV power flexibility
characterization problem. First, an offline model is built to obtain the lower
and upper bounds of the aggregate power flexibility region. It ensures that any
trajectory within the region is feasible. Then, considering that parameters
such as real-time electricity prices and EV arrival/departure times are not
known in advance, an online algorithm is developed based on Lyapunov
optimization techniques. We prove that the charging time delays for EVs always
meet the requirement even if they are not considered explicitly. Furthermore,
real-time feedback is designed and integrated into the proposed online
algorithm to better unlock EV power flexibility. Comprehensive performance
comparisons are carried out to demonstrate the advantages of the proposed
method.
","[{""version"":""v1"",""created"":""Mon, 9 Jan 2023 13:53:36 GMT""}]","2023-01-10"
"2301.03343","William Milner","W. R. Milner, L. Yan, R. B. Hutson, C. Sanner, J. Ye","High-fidelity imaging of a band insulator in a three-dimensional optical
  lattice clock","10 pages, 8 figures",,,,"physics.atom-ph cond-mat.quant-gas","http://creativecommons.org/licenses/by/4.0/","  We report on the observation of a high-density, band insulating state in a
three-dimensional optical lattice clock. Filled with a nuclear-spin polarized
degenerate Fermi gas of 87Sr, the 3D lattice has one atom per site in the
ground motional state, thus guarding against frequency shifts due to contact
interactions. At this high density where the average distance between atoms is
comparable to the probe wavelength, standard imaging techniques suffer from
large systematic errors. To spatially probe frequency shifts in the clock and
measure thermodynamic properties of this system, accurate imaging techniques at
high optical depths are required. Using a combination of highly saturated
fluorescence and absorption imaging, we confirm the density distribution in our
3D optical lattice in agreement with a single spin band insulating state.
Combining our clock platform with this high filling fraction opens the door to
studying new classes of long-lived, many-body states arising from dipolar
interactions.
","[{""version"":""v1"",""created"":""Mon, 9 Jan 2023 13:53:39 GMT""}]","2023-01-10"
"2301.03344","Zhuosheng Zhang","Zhuosheng Zhang, Kehai Chen, Rui Wang, Masao Utiyama, Eiichiro Sumita,
  Zuchao Li, Hai Zhao","Universal Multimodal Representation for Language Understanding","Accepted by IEEE Transactions on Pattern Analysis and Machine
  Intelligence (TPAMI)",,"10.1109/TPAMI.2023.3234170",,"cs.CL cs.AI cs.CV","http://arxiv.org/licenses/nonexclusive-distrib/1.0/","  Representation learning is the foundation of natural language processing
(NLP). This work presents new methods to employ visual information as assistant
signals to general NLP tasks. For each sentence, we first retrieve a flexible
number of images either from a light topic-image lookup table extracted over
the existing sentence-image pairs or a shared cross-modal embedding space that
is pre-trained on out-of-shelf text-image pairs. Then, the text and images are
encoded by a Transformer encoder and convolutional neural network,
respectively. The two sequences of representations are further fused by an
attention layer for the interaction of the two modalities. In this study, the
retrieval process is controllable and flexible. The universal visual
representation overcomes the lack of large-scale bilingual sentence-image
pairs. Our method can be easily applied to text-only tasks without manually
annotated multimodal parallel corpora. We apply the proposed method to a wide
range of natural language generation and understanding tasks, including neural
machine translation, natural language inference, and semantic similarity.
Experimental results show that our method is generally effective for different
tasks and languages. Analysis indicates that the visual signals enrich textual
representations of content words, provide fine-grained grounding information
about the relationship between concepts and events, and potentially conduce to
disambiguation.
","[{""version"":""v1"",""created"":""Mon, 9 Jan 2023 13:54:11 GMT""}]","2023-01-10"
"2301.03345","Emanuele Frascaroli","Emanuele Frascaroli, Riccardo Benaglia, Matteo Boschini, Luca
  Moschella, Cosimo Fiorini, Emanuele Rodol\`a, Simone Calderara","CaSpeR: Latent Spectral Regularization for Continual Learning","11 pages, 3 figures",,,,"cs.LG","http://arxiv.org/licenses/nonexclusive-distrib/1.0/","  While biological intelligence grows organically as new knowledge is gathered
throughout life, Artificial Neural Networks forget catastrophically whenever
they face a changing training data distribution. Rehearsal-based Continual
Learning (CL) approaches have been established as a versatile and reliable
solution to overcome this limitation; however, sudden input disruptions and
memory constraints are known to alter the consistency of their predictions. We
study this phenomenon by investigating the geometric characteristics of the
learner's latent space and find that replayed data points of different classes
increasingly mix up, interfering with classification. Hence, we propose a
geometric regularizer that enforces weak requirements on the Laplacian spectrum
of the latent space, promoting a partitioning behavior. We show that our
proposal, called Continual Spectral Regularizer (CaSpeR), can be easily
combined with any rehearsal-based CL approach and improves the performance of
SOTA methods on standard benchmarks. Finally, we conduct additional analysis to
provide insights into CaSpeR's effects and applicability.
","[{""version"":""v1"",""created"":""Mon, 9 Jan 2023 13:56:59 GMT""},{""version"":""v2"",""created"":""Wed, 1 Feb 2023 16:56:30 GMT""}]","2023-02-02"
"2301.03346","Galin Borisov","Galin B. Borisov, Apostolos A. Christou, Gordana Apostolovska","Physical and dynamical properties of selected Earth co-orbital asteroids","13 pages, 12 figures and 4 tables","Planetary and Space Science, Volume 225, 2023, 105619, ISSN
  0032-0633","10.1016/j.pss.2022.105619",,"astro-ph.EP","http://creativecommons.org/licenses/by/4.0/","  We present our investigations of the physical and dynamical properties of
selected Earth co-orbital asteroids. The photometric optical light curves as
well as rotation periods and pole solutions for a sample of four Earth
co-orbital asteroids, namely (138175) 2000 EE104 (P=13.9476+/-0.0051 hrs),
(418849) 2008 WM64 (P=2.4077+/-0.0001 hrs), 2016 CA138 (P=5.3137+/-0.0016 hrs)
and 2017 SL16 (P=0.3188+/-0.0053 hrs), are determined or improved and presented
in this work. For this investigation, we combine observations carried out at
the Bulgarian National Astronomical Observatory - Rozhen using the FoReRo2
instrument attached to the 2mRCC telescope as well as sparse data from AstDys2
database. Parallel to the rotational properties we did numerical dynamical
simulations to investigate the orbital stability of those objects and to find
out if there is a relation with their rotational properties. Our results show
that the orbit stability is affected by the orbit itself and mainly its
eccentricity and inclination, which are responsible for the close encounters
with other Solar system planets. We cannot make a definitive conclusion about
the relation between orbit stability and the rotational state of the asteroids,
so we need further investigations and observations in order to prove or
disprove it.
","[{""version"":""v1"",""created"":""Mon, 9 Jan 2023 13:58:12 GMT""}]","2023-01-10"
"2301.03347","Yi Geng","Yi Geng","A Novel Waveform Design for OFDM-Based Joint Sensing and Communication
  System","3rd IEEE International Symposium on Joint Communications & Sensing
  (JC&S 2023), accepted and to be published",,,,"cs.IT eess.SP math.IT","http://arxiv.org/licenses/nonexclusive-distrib/1.0/","  The dominating waveform in 5G is orthogonal frequency division multiplexing
(OFDM). OFDM will remain a promising waveform candidate for joint communication
and sensing (JCAS) in 6G since OFDM can provide excellent data transmission
capability and accurate sensing information. This paper proposes a novel
OFDM-based diagonal waveform structure and corresponding signal processing
algorithm. This approach allocates the sensing signals along the diagonal of
the time-frequency resource block. Therefore, the sensing signals in a linear
structure span both the frequency and time domains. The range and velocity of
the object can be estimated simultaneously by applying 1D-discrete Fourier
transform (DFT) to the diagonal sensing signals. Compared to the conventional
2D-DFT OFDM radar algorithm, the computational complexity of the proposed
algorithm is low. In addition, the sensing overhead can be substantially
reduced. The performance of the proposed waveform is evaluated using simulation
and analysis of results.
","[{""version"":""v1"",""created"":""Mon, 9 Jan 2023 14:00:21 GMT""}]","2023-01-10"
"2301.03348","Sarah McIntyre","Sarah R.N. McIntyre, Penelope L. King, Franklin P. Mills","A rocky exoplanet classification method and its application to
  calculating surface pressure and surface temperature","Accepted for publication in MNRAS, 13 pages, 7 figures",,"10.1093/mnras/stad095",,"astro-ph.EP astro-ph.IM","http://arxiv.org/licenses/nonexclusive-distrib/1.0/","  With over 5,000 exoplanets currently detected, there is a need for a primary
classification method to prioritise candidates for biosignature observations.
Here, we develop a classification method to categorise rocky exoplanets based
on their closest solar system analogue using available data of observed stellar
and planetary features, masses, and radii, to model non-thermal atmospheric
escape, thermal atmospheric escape, and stellar irradiation boundaries.
Applying this classification method to the 720 rocky exoplanets in our sample
with uncertainties in planetary masses, radii, stellar temperatures, and fluxes
propagated via a Monte Carlo model indicates that 22% $\pm$ 8% are Mercury
analogues, 39% $\pm$ 4% are Mars analogues, 11% $\pm$ 1% are Venus analogues,
2% $\pm$ 1% are Earth analogues, and 26% $\pm$ 12% are without a known
planetary counterpart in our solar system. Extrapolating to conditions on LHS
3844b and GJ 1252b, our classification method gives results reasonably
consistent with current observations. Subsequently, to demonstrate the
functionality of this classification method, we plot our catalogued sample of
exoplanets on an adjusted surface pressure versus temperature phase diagram,
presenting more realistic estimates of the potential surface phases (gas,
liquid or ice). Our new classification method could help target selection for
future exoplanet characterisation missions.
","[{""version"":""v1"",""created"":""Mon, 9 Jan 2023 14:04:06 GMT""}]","2023-01-25"
"2301.03349","David Thompson","David M. Thompson and Yan Daniel Zhao","Choosing statistical models to assess biological interaction as a
  departure from additivity of effects","29 pages, 3 tables, 3 figures",,,,"stat.AP","http://creativecommons.org/licenses/by/4.0/","  Vanderweele and Knol define biological interaction as an instance wherein
""two exposures physically interact to bring about the outcome."" A hallmark of
biological interaction is that the total effect, produced when factors act
together, differs from the sum of effects when the factors operate
independently. Epidemiologists construct statistical models to assess
biological interaction. The form of the statistical model determines whether it
is suited to detecting departures from additivity of effects or for detecting
departures from multiplicativity of effects. A consensus exists that biological
interaction should be assessed as a departure from additivity of effects. This
paper compares three statistical models' assessment of a data example that
appears in several epidemiology textbooks to illustrate biological interaction
in a binomial outcome. A linear binomial model quantifies departure from
additivity in the data example in terms of differences in probabilities. It
generates directly interpretable estimates and 95% confidence intervals for
parameters including the interaction contrast (IC). Log binomial and logistic
regression models detect no departure from multiplicativity in the data
example. However, their estimates contribute to calculation of a ""Relative
Excess Risk Due to Interaction"" (RERI), a measure of departure from additivity
on a relative risk scale. The linear binomial model directly produces
interpretable assessments of departures from additivity of effects and deserves
wider use in research and in the teaching of epidemiology. Strategies exist to
address the model's limitations.
","[{""version"":""v1"",""created"":""Mon, 9 Jan 2023 14:04:32 GMT""}]","2023-01-10"
"2301.03352","Anouk Goossens","Anouk S. Goossens, Majid Ahmadi, Divyanshu Gupta, Ishitro Bhaduri,
  Bart J. Kooi and Tamalika Banerjee","Memristive Memory Enhancement by Device Miniaturization for Neuromorphic
  Computing","main text: 11 pages, 5 figures",,,,"cs.ET cond-mat.mtrl-sci physics.app-ph","http://arxiv.org/licenses/nonexclusive-distrib/1.0/","  The areal footprint of memristors is a key consideration in material-based
neuromorophic computing and large-scale architecture integration. Electronic
transport in the most widely investigated memristive devices is mediated by
filaments, posing a challenge to their scalability in architecture
implementation. Here we present a compelling alternative memristive device and
demonstrate that areal downscaling leads to enhancement in memristive memory
window, while maintaining analogue behavior, contrary to expectations. Our
device designs directly integrated on semiconducting Nb-SrTiO$_3$ allows
leveraging electric field effects at edges, increasing the dynamic range in
smaller devices. Our findings are substantiated by studying the microscopic
nature of switching using scanning transmission electron microscopy, in
different resistive states, revealing an interfacial layer whose physical
extent is influenced by applied electric fields. The ability of Nb-SrTiO$_3$
memristors to satisfy hardware and software requirements with downscaling,
while significantly enhancing memristive functionalities, makes them strong
contenders for non-von Neumann computing, beyond CMOS.
","[{""version"":""v1"",""created"":""Mon, 9 Jan 2023 14:07:35 GMT""}]","2023-01-11"
"2301.03353","Ozan \""Ozdemir","Ozan \""Ozdemir, Matthias Kerzel, Cornelius Weber, Jae Hee Lee,
  Muhammad Burhan Hafez, Patrick Bruns, Stefan Wermter","Learning Bidirectional Action-Language Translation with Limited
  Supervision and Incongruent Input","Published in: Applied Artificial Intelligence, 37:1, 2179167","Applied Artificial Intelligence Volume 37, 2023 - Issue 1","10.1080/08839514.2023.2179167",,"cs.CL cs.AI cs.NE cs.RO","http://creativecommons.org/licenses/by/4.0/","  Human infant learning happens during exploration of the environment, by
interaction with objects, and by listening to and repeating utterances
casually, which is analogous to unsupervised learning. Only occasionally, a
learning infant would receive a matching verbal description of an action it is
committing, which is similar to supervised learning. Such a learning mechanism
can be mimicked with deep learning. We model this weakly supervised learning
paradigm using our Paired Gated Autoencoders (PGAE) model, which combines an
action and a language autoencoder. After observing a performance drop when
reducing the proportion of supervised training, we introduce the Paired
Transformed Autoencoders (PTAE) model, using Transformer-based crossmodal
attention. PTAE achieves significantly higher accuracy in language-to-action
and action-to-language translations, particularly in realistic but difficult
cases when only few supervised training samples are available. We also test
whether the trained model behaves realistically with conflicting multimodal
input. In accordance with the concept of incongruence in psychology, conflict
deteriorates the model output. Conflicting action input has a more severe
impact than conflicting language input, and more conflicting features lead to
larger interference. PTAE can be trained on mostly unlabelled data where
labeled data is scarce, and it behaves plausibly when tested with incongruent
input.
","[{""version"":""v1"",""created"":""Mon, 9 Jan 2023 14:09:09 GMT""},{""version"":""v2"",""created"":""Wed, 22 Feb 2023 15:54:47 GMT""}]","2023-02-23"
"2301.03357","Evgeny F. Talantsev","E.F. Talantsev","$d$-wave superconductivity as a model for diborides apart MgB$_2$","23 pages, 9 figures","Symmetry 15, 812 (2023)","10.3390/sym15040812",,"cond-mat.supr-con","http://arxiv.org/licenses/nonexclusive-distrib/1.0/","  Recently, Pei et al. (arXiv2105.13250) reported that ambient pressure
${\beta}$-MoB$_2$ exhibits a phase transition to ${\alpha}$-MoB$_2$ (space
group: $P6/mmm$) at pressure P~70 GPa and this high-pressure phase is a
high-temperature superconductor exhibited $T_c=32 K$ at P~110 GPa. Despite
${\alpha}$-MoB$_2$ has the same crystalline structure as ambient pressure
MgB$_2$2 and the $T_c$'s of ${\alpha}$-MoB$_2$ and MgB$_2$ are very close, the
first principles calculations showed that in ${\alpha}$-MoB$_2$ the states near
the Fermi level, ${\epsilon}_F$, are dominated by the $d$-electrons of Mo
atoms, while in MgB$_2$ the $p$-orbitals of boron atomic sheets dominantly
contribute to the states near the ${\epsilon}_F$. More recently, Hire et al.
(arXiv2212.14869) reported that the $P6/mmm$-phase can be stabilized at ambient
pressure in $Nb_{1-x}Mo_{x}B_{2}$ solid solutions, and these ternary alloys
exhibit $T_c=8 K$. In addition, Pei et al. (Sci. China-Phys. Mech. Astron. 65,
287412 (2022)) showed that compressed WB$_2$ exhibits $T_c=15 K$ at P~121 GPa.
Here, we analyzed experimental data reported for $P6/mmm$-phases of
$Nb_{1-x}Mo_{x}B_{2}$ (x = 0.25; 1.0) and highly-compressed WB$_2$, and showed
that these three phases exhibit $d$-wave superconductivity. We also deduced the
gap-to-transition temperature ratio for these three phases. We found that
$Nb_{0.75}Mo_{0.25}B_{2}$ exhibits high strength of nonadiabaticity, which is
quantified by the ratio of $T_{\theta}/T_F=3.5$, which is by one order of
magnitude exceeds the ratio in MgB$_2$, ${\alpha}$-MoB$_2$, WB$_2$, pnictides,
cuprates, and highly-compressed hydrides.
","[{""version"":""v1"",""created"":""Mon, 9 Jan 2023 14:09:45 GMT""},{""version"":""v2"",""created"":""Tue, 10 Jan 2023 10:20:01 GMT""}]","2023-03-28"
"2301.03360","Isabell Stucke","Isabell Stucke, Deborah Morgenstern, Thorsten Simon, Georg J. Mayr,
  Achim Zeileis, Gerhard Diendorfer, Wolfgang Schulz, Hannes Pichler","Upward lightning at wind turbines: Risk assessment from larger-scale
  meteorology","24 pages, 8 figures",,,,"stat.ML cs.LG","http://creativecommons.org/licenses/by/4.0/","  Upward lightning (UL) has become an increasingly important threat to wind
turbines as ever more of them are being installed for renewably producing
electricity. The taller the wind turbine the higher the risk that the type of
lightning striking the man-made structure is UL. UL can be much more
destructive than downward lightning due to its long lasting initial continuous
current leading to a large charge transfer within the lightning discharge
process. Current standards for the risk assessment of lightning at wind
turbines mainly take the summer lightning activity into account, which is
inferred from LLS. Ground truth lightning current measurements reveal that less
than 50% of UL might be detected by lightning location systems (LLS). This
leads to a large underestimation of the proportion of LLS-non-detectable UL at
wind turbines, which is the dominant lightning type in the cold season. This
study aims to assess the risk of LLS-detectable and LLS-non-detectable UL at
wind turbines using direct UL measurements at the Gaisberg Tower (Austria) and
S\""antis Tower (Switzerland). Direct UL observations are linked to
meteorological reanalysis data and joined by random forests, a powerful machine
learning technique. The meteorological drivers for the non-/occurrence of
LLS-detectable and LLS-non-detectable UL, respectively, are found from the
random forest models trained at the towers and have large predictive skill on
independent data. In a second step the results from the tower-trained models
are extended to a larger study domain (Central and Northern Germany). The
tower-trained models for LLS-detectable lightning is independently verified at
wind turbine locations in that domain and found to reliably diagnose that type
of UL. Risk maps based on case study events show that high diagnosed
probabilities in the study domain coincide with actual UL events.
","[{""version"":""v1"",""created"":""Mon, 9 Jan 2023 14:12:35 GMT""}]","2023-01-10"
"2301.03361","Giovanna Carnovale","N. Andruskiewitsch, G. Carnovale, G. Garc\'ia","Finite-dimensional pointed Hopf algebras over finite simple groups of
  Lie type VII. Semisimple classes in PSL(n,q) and PSp(2n,q)",,,,,"math.QA math.GR","http://arxiv.org/licenses/nonexclusive-distrib/1.0/","  We show that the Nichols algebra of a simple Yetter-Drinfeld module over a
projective special linear group over a finite field whose support is a
semisimple orbit has infinite dimension, provided that the elements of the
orbit are reducible; we obtain a similar result for all semisimple orbits in a
finite symplectic group except in low rank. We prove that orbits of irreducible
elements in the projective special linear groups could not be treated with our
methods. We conclude that any finite-dimensional pointed Hopf algebra H with
group of grouplike elements isomorphic to PSL(n,q) (n greater than or equal to
4), PSL(3,q) (q greater than 2), or PSp(2n,q) (n greater than or equal to 3),
is isomorphic to a group algebra, completing work in arXiv:1506.06794.
","[{""version"":""v1"",""created"":""Mon, 9 Jan 2023 14:13:43 GMT""}]","2023-01-10"
"2301.03362","Bahjat Kawar","Michael Elad, Bahjat Kawar, Gregory Vaksman","Image Denoising: The Deep Learning Revolution and Beyond -- A Survey
  Paper --",,,,,"eess.IV cs.CV","http://arxiv.org/licenses/nonexclusive-distrib/1.0/","  Image denoising (removal of additive white Gaussian noise from an image) is
one of the oldest and most studied problems in image processing. An extensive
work over several decades has led to thousands of papers on this subject, and
to many well-performing algorithms for this task. Indeed, 10 years ago, these
achievements have led some researchers to suspect that ""Denoising is Dead"", in
the sense that all that can be achieved in this domain has already been
obtained. However, this turned out to be far from the truth, with the
penetration of deep learning (DL) into image processing. The era of DL brought
a revolution to image denoising, both by taking the lead in today's ability for
noise removal in images, and by broadening the scope of denoising problems
being treated. Our paper starts by describing this evolution, highlighting in
particular the tension and synergy that exist between classical approaches and
modern DL-based alternatives in design of image denoisers.
  The recent transitions in the field of image denoising go far beyond the
ability to design better denoisers. In the 2nd part of this paper we focus on
recently discovered abilities and prospects of image denoisers. We expose the
possibility of using denoisers to serve other problems, such as regularizing
general inverse problems and serving as the prime engine in diffusion-based
image synthesis. We also unveil the idea that denoising and other inverse
problems might not have a unique solution as common algorithms would have us
believe. Instead, we describe constructive ways to produce randomized and
diverse high quality results for inverse problems, all fueled by the progress
that DL brought to image denoising.
  This survey paper aims to provide a broad view of the history of image
denoising and closely related topics. Our aim is to give a better context to
recent discoveries, and to the influence of DL in our domain.
","[{""version"":""v1"",""created"":""Mon, 9 Jan 2023 14:16:40 GMT""}]","2023-01-10"
