"2301.11069","Aftab Alam Mr.","Shah Khalid, Shah Khusro, Aftab Alam, Abdul Wahid","BERT-Embedding and Citation Network Analysis based Query Expansion
  Technique for Scholarly Search","10",,,,"cs.IR","http://arxiv.org/licenses/nonexclusive-distrib/1.0/","  The enormous growth of research publications has made it challenging for
academic search engines to bring the most relevant papers against the given
search query. Numerous solutions have been proposed over the years to improve
the effectiveness of academic search, including exploiting query expansion and
citation analysis. Query expansion techniques mitigate the mismatch between the
language used in a query and indexed documents. However, these techniques can
suffer from introducing non-relevant information while expanding the original
query. Recently, contextualized model BERT to document retrieval has been quite
successful in query expansion. Motivated by such issues and inspired by the
success of BERT, this paper proposes a novel approach called QeBERT. QeBERT
exploits BERT-based embedding and Citation Network Analysis (CNA) in query
expansion for improving scholarly search. Specifically, we use the
context-aware BERT-embedding and CNA for query expansion in Pseudo-Relevance
Feedback (PRF) fash-ion. Initial experimental results on the ACL dataset show
that BERT-embedding can provide a valuable augmentation to query expansion and
improve search relevance when combined with CNA.
","[{""version"":""v1"",""created"":""Thu, 26 Jan 2023 12:57:13 GMT""}]","2023-01-27"
"2301.11070","Sergei Krivov","Sergei V. Krivov","Nonequilibrium Optimal Reaction Coordinates for Diffusion",,,,,"physics.chem-ph cond-mat.soft cond-mat.stat-mech math.PR physics.data-an","http://creativecommons.org/licenses/by/4.0/","  Complex multidimensional stochastic dynamics can be approximately described
as diffusion along reaction coordinates (RCs). If the RCs are optimally
selected, the diffusive model allows one to compute important properties of the
dynamics exactly. The committor is a primary example of an optimal RC.
Recently, additive eigenvectors (addevs) have been introduced in order to
extend the formalism to non-equilibrium dynamics. An addev describes a
sub-ensemble of trajectories of a stochastic process together with an optimal
RC. The sub-ensemble is conditioned to have a single RC optimal for both the
forward and time-reversed non-equilibrium dynamics of the sub-ensemble. Here we
consider stationary addevs and obtain the following results. We show that the
forward and time-reversed committors are functions of the addev, meaning a
diffusive model along an addev RC can be used to compute important properties
of non-equilibrium dynamics exactly. The rates of the conditioned stochastic
process, describing an addev sub-ensemble, can be computed ``on the fly'', thus
allowing efficient sampling schemes. We obtain two families of addev solutions
for diffusion. The first is described by equations of classical mechanics,
while the second can be approximated by quantum mechanical equations. We show
how the potential can be introduced into the formalism self-consistently. The
developments are illustrated on simple examples. The two addev families provide
stochastic models together with optimal RCs and new sampling schemes for
classical and quantum mechanical systems. It suggests that the conditioned
stochastic processes defined by addevs are suitable for description of dynamics
of physical origin.
","[{""version"":""v1"",""created"":""Thu, 26 Jan 2023 12:57:15 GMT""},{""version"":""v2"",""created"":""Tue, 11 Apr 2023 11:54:12 GMT""}]","2023-04-12"
"2301.11071","Amos Uderzo","Amos Uderzo","First-order approximation of strong vector equilibria with application
  to nondifferentiable constrained optimization",,,,,"math.OC","http://creativecommons.org/licenses/by/4.0/","  Vector equilibrium problems are a natural generalization to the context of
partially ordered spaces of the Ky Fan inequality, where scalar bifunctions are
replaced with vector bifunctions. In the present paper, the local geometry of
the strong solution set to these problems is investigated through its
inner/outer conical approximations. Formulae for approximating the contingent
cone to the set of strong vector equilibria are established, which are
expressed via Bouligand derivatives of the bifunctions. These results are
subsequently employed for deriving both necessary and sufficient optimality
conditions for problems, whose feasible region is the strong solution set to a
vector equilibrium problem, so they can be cast in mathematical programming
with equilibrium constraints.
","[{""version"":""v1"",""created"":""Thu, 26 Jan 2023 13:09:34 GMT""}]","2023-01-27"
"2301.11072","Jean Bernard Lasserre","Jean-Bernard Lasserre (LAAS-POP)","A modified Christoffel function and its asymptotic properties","Rapport LAAS n 23003",,,"Rapport LAAS n 23003","math.OC","http://arxiv.org/licenses/nonexclusive-distrib/1.0/","  We introduce a certain variant (or regularization) $\tilde{\Lambda}^\mu_n$ of
the standard Christoffel function $\Lambda^\mu_n$ associated with a measure
$\mu$ on a compact set $\Omega\subset \mathbb{R}^d$. Its reciprocal is now a
sum-of-squares polynomial in the variables $(x,\varepsilon)$, $\varepsilon>0$.
It shares the same dichotomy property of the standard Christoffel function,
that is, the growth with $n$ of its inverse is at most polynomial inside and
exponential outside the support of the measure. Its distinguishing and crucial
feature states that for fixed $\varepsilon>0$, and under weak assumptions,
$\lim_{n\to\infty}
\varepsilon^{-d}\tilde{\Lambda}^\mu_n(\xi,\varepsilon)=f(\zeta_\varepsilon)$
where $f$ (assumed to be continuous) is the unknown density of $\mu$ w.r.t.
Lebesgue measure on $\Omega$, and
$\zeta_\varepsilon\in\mathbf{B}_\infty(\xi,\varepsilon)$ (and so
$f(\zeta_\varepsilon)\approx f(\xi)$ when $\varepsilon>0$ is small). This is in
contrast with the standard Christoffel function where if $\lim_{n\to\infty}
n^d\Lambda^\mu_n(\xi)$ exists, it is of the form $f(\xi)/\omega_E(\xi)$ where
$\omega_E$ is the density of the equilibrium measure of $\Omega$, usually
unknown. At last but not least, the additional computational burden (when
compared to computing $\Lambda^\mu_n$) is just integrating symbolically the
monomial basis $(x^{\alpha})_{\alpha\in\mathbb{N}^d_n}$ on the box $\{x: \Vert
x-\xi\Vert_\infty<\varepsilon/2\}$, so that $1/\tilde{\Lambda}^\mu_n$ is
obtained as an explicit polynomial of $(\xi,\varepsilon)$.
","[{""version"":""v1"",""created"":""Thu, 26 Jan 2023 13:11:48 GMT""}]","2023-01-27"
"2301.11073","Rupert Levene","Shaun M. Fallat, H. Tracy Hall, Rupert H. Levene, Seth A. Meyer,
  Shahla Nasserasr, Polona Oblak, Helena \v{S}migoc","Spectral arbitrariness for trees fails spectacularly","45 pages",,,,"math.CO math.SP","http://creativecommons.org/licenses/by/4.0/","  If $G$ is a graph and $\mathbf{m}$ is an ordered multiplicity list which is
realizable by at least one symmetric matrix with graph $G$, what can we say
about the eigenvalues of all such realizing matrices for $\mathbf{m}$? It has
sometimes been tempting to expect, especially in the case that $G$ is a tree,
that any spacing of the multiple eigenvalues should be realizable. In 2004,
however, F. Barioli and S. Fallat produced the first counterexample: a tree on
16 vertices and an ordered multiplicity list for which every realizing set of
eigenvalues obeys a nontrivial linear constraint.
  We extend this by giving an infinite family of trees and ordered multiplicity
lists whose sets of realizing eigenvalues are very highly constrained, with at
most 5 degrees of freedom, regardless of the size of the tree in this family.
In particular, we give the first examples of multiplicity lists for a tree
which impose nontrivial nonlinear eigenvalue constraints and produce an ordered
multiplicity list which is achieved by a unique set of eigenvalues, up to
shifting and scaling.
","[{""version"":""v1"",""created"":""Thu, 26 Jan 2023 13:12:36 GMT""}]","2023-01-27"
"2301.11074","Justin Goldston","Justin Goldston, Tomer Jordi Chaffer, Justyna Osowska, and Charles von
  Goins II","Digital Inheritance in Web3: A Case Study of Soulbound Tokens and the
  Social Recovery Pallet within the Polkadot and Kusama Ecosystems","To be published in IEEE Access",,,,"cs.CR","http://creativecommons.org/licenses/by/4.0/","  In recent years discussions centered around digital inheritance have
increased among social media users and across blockchain ecosystems. As a
result digital assets such as social media content cryptocurrencies and
non-fungible tokens have become increasingly valuable and widespread, leading
to the need for clear and secure mechanisms for transferring these assets upon
the testators death or incapacitation. This study proposes a framework for
digital inheritance using soulbound tokens and the social recovery pallet as a
use case in the Polkadot and Kusama blockchain networks. The findings discussed
within this study suggest that while soulbound tokens and the social recovery
pallet offer a promising solution for creating a digital inheritance plan the
findings also raise important considerations for testators digital executors
and developers. While further research is needed to fully understand the
potential impacts and risks of other technologies such as artificial
intelligence and quantum computing this study provides a primer for users to
begin planning a digital inheritance strategy and for developers to develop a
more intuitive solution.
","[{""version"":""v1"",""created"":""Thu, 26 Jan 2023 13:12:45 GMT""}]","2023-01-27"
"2301.11075","Cyril Letrouit","Suresh Eswarathasan, Cyril Letrouit (MIT)","Nodal sets of eigenfunctions of sub-Laplacians",,,,,"math.AP","http://arxiv.org/licenses/nonexclusive-distrib/1.0/","  Nodal sets of eigenfunctions of elliptic operators on compact manifolds have
been studiedextensively over the past decades. In this note, we initiate the
study of nodal sets ofeigenfunctions of hypoelliptic operators on compact
manifolds, focusing on sub-Laplacians.A standard example is the sum of squares
of bracket-generating vector fields on compactquotients of the Heisenberg
group. Our results show that nodal sets behave in an anisotropicway which can
be analyzed with standard tools from sub-Riemannian geometry such
assub-Riemannian dilations, nilpotent approximation and desingularization at
singular points.Furthermore, we provide a simple example demonstrating that for
sub-Laplacians, the Hausdorff measure of nodal sets of eigenfunctions cannot be
bounded above by $C\sqrt{\lambda}$, which is thebound conjectured by Yau for
Laplace-Beltrami operators on smooth manifolds.
","[{""version"":""v1"",""created"":""Thu, 26 Jan 2023 13:15:55 GMT""}]","2023-01-27"
"2301.11076","Tom\'a\v{s} Henych","Tom\'a\v{s} Henych, Ji\v{r}\'i Borovi\v{c}ka, Pavel Spurn\'y","Semi-automatic meteoroid fragmentation modeling using genetic algorithms","Accepted for publication in A&A, 17 pages, 27 figures","A&A 671, A23 (2023)","10.1051/0004-6361/202245023",,"astro-ph.EP astro-ph.IM","http://creativecommons.org/licenses/by-nc-nd/4.0/","  Meteoroids are pieces of asteroids and comets. They serve as unique probes to
the physical and chemical properties of their parent bodies. We can derive some
of these properties when meteoroids collide with the atmosphere of Earth and
become a meteor or a bolide. Even more information can be obtained when
meteoroids are mechanically strong and slow enough to drop meteorites. Through
physical modeling of bright meteors, we describe their fragmentation in the
atmosphere. We also derive their mechanical strength and the mass distribution
of the fragments, some of which may hit the ground as meteorites. We developed
a semi-automatic program for meteoroid fragmentation modeling using parallel
genetic algorithms. This allowed us to determine the most probable
fragmentation cascade of the meteoroid, and also to specify its initial mass
and velocity. These parameters can be used in turn to derive the heliocentric
orbit of the meteoroid and to place constraints on its likely age as a separate
object. The program offers plausible solutions for the majority of fireballs we
tested, and the quality of the solutions is comparable to that of manual
solutions. The two solutions are not the same in detail, but the derived
quantities, such as the fragment masses of the larger fragments and the proxy
for their mechanical strength, are very similar. With this method, we would
like to describe the mechanical properties and structure of both meteoroids
belonging to major meteor showers and those that cause exceptional fireballs.
","[{""version"":""v1"",""created"":""Thu, 26 Jan 2023 13:16:04 GMT""}]","2023-03-08"
"2301.11077","Lucas Vacossin","Lucas Vacossin (DMA, LMO)","Improved Fractal Weyl upper bound in obstacle scattering",,,,,"math.AP math-ph math.MP math.SP","http://arxiv.org/licenses/nonexclusive-distrib/1.0/","  In this paper, we are interested in the problem of scattering by strictly
convex obstacles in the plane. We provide an upper bound for the number
$N(r,\gamma)$ of resonances in the box $\{r \le \Re(\lambda) \le r + 1$;
$\Im(\lambda) \ge - \gamma \}$. It was proved in a work of S. Nonnenmacher, J.
Sj{\""o}strand and M. Zworski (2014) that $N (r,\gamma) = O_\gamma (r^{d_H})$
where $2d_H + 1$ is the Hausdorff dimension of the trapped set of the billiard
flow. In this article, we provide an improved upper bound in the band $0 \le
\gamma < \gamma_{cl} /2$, where $\gamma_{cl}$ is the classical decay rate of
the flow. This improved Weyl upper bound is in the spirit of the ones of F.
Naud (2012) and S. Dyatlov (2019) in the case of convex co-compact surfaces,
and of S. Dyatlov and L. Jin (2017) in the case of open quantum baker's maps.
","[{""version"":""v1"",""created"":""Thu, 26 Jan 2023 13:16:47 GMT""}]","2023-01-27"
"2301.11079","Johannes Mauritzen","Hakim Lyngstad{\aa}s and Johannes Mauritzen","Adults in the room? The auditor and dividends in small firms: Evidence
  from a natural experiment",,,,,"econ.GN q-fin.EC","http://creativecommons.org/licenses/by/4.0/","  We examine the effect of auditing on dividends in small private firms. We
hypothesize that auditing can constrain dividends by way of promoting
accounting conservatism. We use register data on private Norwegian firms and
random variation induced by the introduction of a policy allowing small private
firms to forgo the use of an auditor to estimate the effect of auditing on
dividend payout. Identification is obtained by a regression discontinuity
around the arbitrary thresholds for the policy. Propensity score matching is
used to create a balanced synthetic control. We consistently find that forgoing
auditing led to a significant increase in dividends in small private firms.
","[{""version"":""v1"",""created"":""Thu, 26 Jan 2023 13:17:23 GMT""}]","2023-01-27"
"2301.11080","Zizhao He","Zizhao He, Nan Li, Xiaoyue Cao, Rui Li, Hu Zou, Simon Dye","Discovering strongly lensed quasar candidates with catalogue-based
  methods from DESI Legacy Surveys","Accepted by A&A. 14 pages, 11 figures. Comments are welcome","A&A 672, A123 (2023)","10.1051/0004-6361/202245484",,"astro-ph.CO","http://creativecommons.org/licenses/by/4.0/","  The Hubble tension, revealed by a $\sim 5\sigma$ discrepancy between
measurements of the Hubble-Lemaitre constant from early- and local-Universe
observations, is one of the most significant problems in modern cosmology. In
order to better understand the origin of this mismatch, independent techniques
to measure $H_0$, such as strong lensing time delays, are required. Notably,
the sample size of such systems is key to minimising statistical uncertainties
and cosmic variance, which can be improved by exploring the datasets of
large-scale sky surveys like DESI (Dark Energy Spectroscopic Instrument). We
identify possible strong lensing time-delay systems within DESI by selecting
candidate multiply imaged lensed quasars from a catalogue of 24,440,816
candidate QSOs contained in the 9th data release of the DESI Legacy Imaging
Surveys (DESI-LS). Using a friend-of-friends-like algorithm on spatial
co-ordinates, our method generates an initial list of compact quasar groups.
This list is subsequently filtered using a measure of the similarity of colours
of a group's members and the likelihood that they are quasars. A visual
inspection finally selects candidate strong lensing systems based on the
spatial configuration of the group members. We identify 620 new candidate
multiply imaged lensed quasars (101 Grade-A, 214 Grade-B, 305 Grade-C). This
number excludes 53 known spectroscopically confirmed systems and existing
candidate systems identified in other similar catalogues. When available, these
new candidates will be further checked by combining the spectroscopic and
photometric data from DESI. The catalogues and images of the candidates in this
work are available online
(https://github.com/EigenHermit/lensed_qso_cand_catalogue_He-22/).
","[{""version"":""v1"",""created"":""Thu, 26 Jan 2023 13:18:14 GMT""}]","2023-04-12"
"2301.11081","Frederic Lavancier","Fr\'ed\'eric Lavancier (LMJL), Ege Rubak (AAU)","On simulation of continuous determinantal point processes",,,,,"stat.ME","http://arxiv.org/licenses/nonexclusive-distrib/1.0/","  We review how to simulate continuous determinantal point processes (DPPs) and
improve the current simulation algorithms in several important special cases as
well as detail how certain types of conditional simulation can be carried out.
Importantly we show how to speed up the simulation of the widely used Fourier
based projection DPPs, which arise as approximations of more general DPPs. The
algorithms are implemented and published as open source software.
","[{""version"":""v1"",""created"":""Thu, 26 Jan 2023 13:19:45 GMT""}]","2023-01-27"
"2301.11082","Jorge Vieira","B. Malaca, M. Pardal, D. Ramsey, J. Pierce, K. Weichman, I. Andriyash,
  W. B. Mori, J. P. Palastro, R. A. Fonseca, J. Vieira","Coherence and superradiance from a plasma-based quasiparticle
  accelerator","15 pages, 4 figures",,,,"physics.plasm-ph physics.acc-ph physics.optics","http://creativecommons.org/licenses/by/4.0/","  Coherent light sources, such as free electron lasers, provide bright beams
for biology, chemistry, physics, and advanced technological applications.
Increasing the brightness of these sources requires progressively larger
devices, with the largest being several km long (e.g., LCLS). Can we reverse
this trend, and bring these sources to the many thousands of labs spanning
universities, hospitals, and industry? Here we address this long-standing
question by rethinking basic principles of radiation physics. At the core of
our work is the introduction of quasi-particle-based light sources that rely on
the collective and macroscopic motion of an ensemble of light-emitting charges
to evolve and radiate in ways that would be unphysical when considering single
charges. The underlying concept allows for temporal coherence and superradiance
in fundamentally new configurations, providing radiation with clear
experimental signatures and revolutionary properties. The underlying concept is
illustrated with plasma accelerators but extends well beyond this case, such as
to nonlinear optical configurations. The simplicity of the quasi-particle
approach makes it suitable for experimental demonstrations at existing laser
and accelerator facilities.
","[{""version"":""v1"",""created"":""Thu, 26 Jan 2023 13:21:04 GMT""}]","2023-01-27"
"2301.11083","Behzad Bamdad Mehrabani","Behzad Bamdad Mehrabani, Jakob Erdmann, Luca Sgambi, Seyedehsan
  Seyedabrishami, Maaike Snelder","A Multiclass Simulation-Based Dynamic Traffic Assignment Model for Mixed
  Traffic Flow of Connected and Autonomous Vehicles and Human-Driven Vehicles",,,,,"eess.SY cs.SY","http://arxiv.org/licenses/nonexclusive-distrib/1.0/","  One of the potential capabilities of Connected and Autonomous Vehicles (CAVs)
is that they can have different route choice behavior and driving behavior
compared to human Driven Vehicles (HDVs). This will lead to mixed traffic flow
with multiple classes of route choice behavior. Therefore, it is crucial to
solve the multiclass Traffic Assignment Problem (TAP) in mixed traffic of CAVs
and HDVs. Few studies have tried to solve this problem; however, most used
analytical solutions, which are challenging to implement in real and large
networks (especially in dynamic cases). Also, studies in implementing
simulation-based methods have not considered all of CAVs' potential
capabilities. On the other hand, several different (conflicting) assumptions
are made about the CAV's route choice behavior in these studies. So, providing
a tool that can solve the multiclass TAP of mixed traffic under different
assumptions can help researchers to understand the impacts of CAVs better. To
fill these gaps, this study provides an open-source solution framework of the
multiclass simulation-based traffic assignment problem for mixed traffic of
CAVs and HDVs. This model assumes that CAVs follow system optimal principles
with rerouting capability, while HDVs follow user equilibrium principles.
Moreover, this model can capture the impacts of CAVs on road capacity by
considering distinct driving behavioral models in both micro and meso scales
traffic simulation. This proposed model is tested in two case studies which
shows that as the penetration rate of CAVs increases, the total travel time of
all vehicles decreases.
","[{""version"":""v1"",""created"":""Thu, 26 Jan 2023 13:22:15 GMT""}]","2023-01-27"
"2301.11084","Haosen Ge","Haosen Ge","Measuring Regulatory Barriers Using Annual Reports of Firms",,,,,"stat.AP econ.GN q-fin.EC","http://creativecommons.org/licenses/by/4.0/","  Existing studies show that regulation is a major barrier to global economic
integration. Nonetheless, identifying and measuring regulatory barriers remains
a challenging task for scholars. I propose a novel approach to quantify
regulatory barriers at the country-year level. Utilizing information from
annual reports of publicly listed companies in the U.S., I identify regulatory
barriers business practitioners encounter. The barrier information is first
extracted from the text documents by a cutting-edge neural language model
trained on a hand-coded training set. Then, I feed the extracted barrier
information into a dynamic item response theory model to estimate the numerical
barrier level of 40 countries between 2006 and 2015 while controlling for
various channels of confounding. I argue that the results returned by this
approach should be less likely to be contaminated by major confounders such as
international politics. Thus, they are well-suited for future political science
research.
","[{""version"":""v1"",""created"":""Thu, 26 Jan 2023 13:23:39 GMT""}]","2023-01-27"
"2301.11085","Hamed Hooshangnejad","Hamed Hooshangnejad, Quan Chen, Xue Feng, Rui Zhang, Kai Ding","deepPERFECT: Novel Deep Learning CT Synthesis Method for Expeditious
  Pancreatic Cancer Radiotherapy","paper is under review by medical physics",,"10.3390/cancers15113061",,"physics.med-ph","http://creativecommons.org/licenses/by-nc-sa/4.0/","  Pancreatic cancer with more than 60,000 new cases each year has less than 10
percent 5-year overall survival. Radiation therapy (RT) is an effective
treatment for Locally advanced pancreatic cancer (LAPC). The current clinical
RT workflow is lengthy and involves separate image acquisition for diagnostic
CT (dCT) and planning CT (pCT). Studies have shown a reduction in mortality
rate from expeditious radiotherapy treatment. dCT and pCT are acquired
separately because of the differences in the image acquisition setup and
patient body. We are presenting deepPERFECT: deep learning-based model to adapt
the shape of the patient body on dCT to the treatment delivery setup. Our
method expedites the treatment course by allowing the design of the initial RT
planning before the pCT acquisition. Thus, the physicians can evaluate the
potential RT prognosis ahead of time, verify the plan on the treatment day-one
CT and apply any online adaptation if needed. We used the data from 25
pancreatic cancer patients. The model was trained on 15 cases and tested on the
remaining ten cases. We evaluated the performance of four different
deep-learning architectures for this task. The synthesized CT (sCT) and regions
of interest (ROIs) were compared with ground truth (pCT) using Dice similarity
coefficient (DSC) and Hausdorff distance (HD). We found that the
three-dimensional Generative Adversarial Network (GAN) model trained on large
patches has the best performance. The average DSC and HD for body contours were
0.93, and 4.6 mm. We found no statistically significant difference between the
synthesized CT plans and the ground truth. We showed that employing deepPERFECT
shortens the current lengthy clinical workflow by at least one week and
improves the effectiveness of treatment and the quality of life of pancreatic
cancer patients.
","[{""version"":""v1"",""created"":""Thu, 26 Jan 2023 13:24:05 GMT""},{""version"":""v2"",""created"":""Fri, 27 Jan 2023 13:47:54 GMT""}]","2023-06-07"
