"2301.10804","Arvind Mohan","Surya Chakrabarti, Arvind T. Mohan, Datta V. Gaitonde, Daniel Livescu","Full trajectory optimizing operator inference for reduced-order modeling
  using differentiable programming",,,,"LA-UR-23-20434","physics.flu-dyn nlin.CD","http://creativecommons.org/licenses/by/4.0/","  Accurate and inexpensive Reduced Order Models (ROMs) for forecasting
turbulent flows can facilitate rapid design iterations and thus prove critical
for predictive control in engineering problems. Galerkin projection based
Reduced Order Models (GP-ROMs), derived by projecting the Navier-Stokes
equations on a truncated Proper Orthogonal Decomposition (POD) basis, are
popular because of their low computational costs and theoretical foundations.
However, the accuracy of traditional GP-ROMs degrades over long time prediction
horizons. To address this issue, we extend the recently proposed Neural
Galerkin Projection (NeuralGP) data driven framework to
compressibility-dominated transonic flow, considering a prototypical problem of
a buffeting NACA0012 airfoil governed by the full Navier-Stokes equations. The
algorithm maintains the form of the ROM-ODE obtained from the Galerkin
projection; however coefficients are learned directly from the data using
gradient descent facilitated by differentiable programming. This blends the
strengths of the physics driven GP-ROM and purely data driven neural
network-based techniques, resulting in a computationally cheaper model that is
easier to interpret. We show that the NeuralGP method minimizes a more rigorous
full trajectory error norm compared to a linearized error definition optimized
by the calibration procedure. We also find that while both procedures stabilize
the ROM by displacing the eigenvalues of the linear dynamics matrix of the
ROM-ODE to the complex left half-plane, the NeuralGP algorithm adds more
dissipation to the trailing POD modes resulting in its better long-term
performance. The results presented highlight the superior accuracy of the
NeuralGP technique compared to the traditional calibrated GP-ROM method.
","[{""version"":""v1"",""created"":""Wed, 25 Jan 2023 19:43:05 GMT""}]","2023-01-27"
"2301.10805","Cybele Vinagre","Lilian Markenzon, Allana S. S. Oliveira and Cybele T. M. Vinagre","Exploring structural properties of $k$-trees and block graphs","6 pages, 1 figure",,,,"math.CO","http://arxiv.org/licenses/nonexclusive-distrib/1.0/","  We present a new characterization of $k$-trees based on their reduced clique
graphs and $(k+1)$-line graphs, which are block graphs. We explore structural
properties of these two classes, showing that the number of clique-trees of a
$k$-tree $G$ equals the number of spanning trees of the $(k+1)$-line graph of
$G$. This relationship allows to present a new approach for determining the
number of spanning trees of any connected block graph. We show that these
results can be accomplished in linear time complexity.
","[{""version"":""v1"",""created"":""Wed, 25 Jan 2023 19:44:22 GMT""}]","2023-01-27"
"2301.10806","Claudio Gorodski","Claudio Gorodski and Iryna Kashuba and Mar\'ia Eugenia Martin","A moment map for the variety of Jordan algebras","26 pages",,,,"math.AG math.RA math.RT","http://arxiv.org/licenses/nonexclusive-distrib/1.0/","  We study the variety of complex $n$-dimensional Jordan algebras using
techniques from Geometric Invariant Theory.
","[{""version"":""v1"",""created"":""Wed, 25 Jan 2023 19:46:21 GMT""},{""version"":""v2"",""created"":""Mon, 3 Apr 2023 20:03:54 GMT""}]","2023-04-05"
"2301.10807","Bernhard Reus","Alexander Knapp and Heribert M\""uhlberger and Bernhard Reus","Interpreting Knowledge-based Programs (Extended Version with Proofs)",,,,,"cs.PL cs.LO","http://creativecommons.org/licenses/by/4.0/","  Knowledge-based programs specify multi-agent protocols with epistemic guards
that abstract from how agents learn and record facts or information about other
agents and the environment. Their interpretation involves a non-monotone mutual
dependency between the evaluation of epistemic guards over the reachable states
and the derivation of the reachable states depending on the evaluation of
epistemic guards. We apply the technique of a must/cannot analysis invented for
synchronous programming languages to the interpretation problem of
knowledge-based programs and demonstrate that the resulting constructive
interpretation is monotone and has a least fixed point. We relate our approach
with existing interpretation schemes for both synchronous and asynchronous
programs. Finally, we describe an implementation of the constructive
interpretation and illustrate the procedure by several examples and an
application to the Java memory model.
","[{""version"":""v1"",""created"":""Wed, 25 Jan 2023 19:51:38 GMT""}]","2023-01-27"
"2301.10808","Sanjukta Krishnagopal","Sanjukta Krishnagopal, Luana Ruiz","Graph Neural Tangent Kernel: Convergence on Large Graphs","Accepted in the 40th International Conference on Machine Learning
  (ICML), Honolulu, Hawaii",,,,"cs.LG math.ST stat.AP stat.CO stat.ML stat.TH","http://creativecommons.org/licenses/by/4.0/","  Graph neural networks (GNNs) achieve remarkable performance in graph machine
learning tasks but can be hard to train on large-graph data, where their
learning dynamics are not well understood. We investigate the training dynamics
of large-graph GNNs using graph neural tangent kernels (GNTKs) and graphons. In
the limit of large width, optimization of an overparametrized NN is equivalent
to kernel regression on the NTK. Here, we investigate how the GNTK evolves as
another independent dimension is varied: the graph size. We use graphons to
define limit objects -- graphon NNs for GNNs, and graphon NTKs for GNTKs -- ,
and prove that, on a sequence of graphs, the GNTKs converge to the graphon NTK.
We further prove that the spectrum of the GNTK, which is related to the
directions of fastest learning which becomes relevant during early stopping,
converges to the spectrum of the graphon NTK. This implies that in the
large-graph limit, the GNTK fitted on a graph of moderate size can be used to
solve the same task on the large graph, and to infer the learning dynamics of
the large-graph GNN. These results are verified empirically on node regression
and classification tasks.
","[{""version"":""v1"",""created"":""Wed, 25 Jan 2023 19:52:58 GMT""},{""version"":""v2"",""created"":""Wed, 31 May 2023 19:27:16 GMT""}]","2023-06-02"
"2301.10809","Zachariah Martin","Zachariah O. Martin, Alexander Senichev, Samuel Peana, Benjamin J.
  Lawrie, Alexei S. Lagutchev, Alexandra Boltasseva, and Vladimir M. Shalaev","Photophysics of Intrinsic Single-Photon Emitters in Silicon Nitride at
  Low Temperatures","21 pages, 10 figures",,,,"quant-ph physics.app-ph physics.optics","http://creativecommons.org/licenses/by/4.0/","  A robust process for fabricating intrinsic single-photon emitters in silicon
nitride has been recently established. These emitters show promise for quantum
applications due to room-temperature operation and monolithic integration with
the technologically mature silicon nitride photonics platform. Here, the
fundamental photophysical properties of these emitters are probed through
measurements of optical transition wavelengths, linewidths, and photon
antibunching as a function of temperature from 4.2K to 300K. Important insight
into the potential for lifetime-limited linewidths is provided through
measurements of inhomogeneous and temperature-dependent homogeneous broadening
of the zero-phonon lines. At 4.2K, spectral diffusion was found to be the main
broadening mechanism, while time-resolved spectroscopy measurements revealed
homogeneously broadened zero-phonon lines with instrument-limited linewidths.
","[{""version"":""v1"",""created"":""Wed, 25 Jan 2023 19:53:56 GMT""}]","2023-01-27"
"2301.10810","Caio Corro","Caio Corro","On the inconsistency of separable losses for structured prediction","Preprint, to appear in proc. of EACL 2023",,,,"cs.LG cs.CL stat.ML","http://creativecommons.org/licenses/by/4.0/","  In this paper, we prove that separable negative log-likelihood losses for
structured prediction are not necessarily Bayes consistent, or, in other words,
minimizing these losses may not result in a model that predicts the most
probable structure in the data distribution for a given input. This fact opens
the question of whether these losses are well-adapted for structured prediction
and, if so, why.
","[{""version"":""v1"",""created"":""Wed, 25 Jan 2023 20:02:07 GMT""}]","2023-01-27"
"2301.10811","Omar Medina","Cesar Bonilla, Johannes Herms, Omar Medina, Eduardo Peinado","Discrete dark matter mechanism as the source of neutrino mass scales","23 pages, 6 figures and 3 tables. Your comments are very welcome!",,,,"hep-ph hep-th","http://creativecommons.org/licenses/by/4.0/","  The hierarchy in scale between atmospheric and solar neutrino mass splittings
is investigated through two distinct neutrino mass mechanisms, from tree- and
one-loop-level contributions. We demonstrate that the minimal discrete dark
matter mechanism contains the ingredients for explaining this hierarchy. This
scenario is characterized by adding new RH neutrinos and scalar
$SU(2)$-doublets to the Standard Model as triplet representations of an $A_4$
flavor symmetry. The $A_4$ symmetry breaking, which occurs at the electroweak
scale, leads to a residual $\mathbb{Z}_2$ symmetry responsible for the dark
matter stability and dictates the neutrino phenomenology. Finally, we show that
to reproduce the neutrino mixing angles correctly it is necessary to violate
$CP$ in the scalar potential.
","[{""version"":""v1"",""created"":""Wed, 25 Jan 2023 20:05:31 GMT""}]","2023-01-27"
"2301.10812","Dexter Kozen","Dexter Kozen and Alexandra Silva","Multisets and Distributions","9 pages, 3 figures",,,,"cs.LO cs.PL","http://creativecommons.org/licenses/by/4.0/","  We give a lightweight alternative construction of Jacobs's distributive law
for multisets and distributions that does not involve any combinatorics. We
first give a distributive law for lists and distributions, then apply a general
theorem on 2-categories that allows properties of lists to be transferred
automatically to multisets. The theorem states that equations between 2-cells
are preserved by epic 2-natural transformations. In our application, the
appropriate epic 2-natural transformation is defined in terms of the Parikh
map, familiar from formal language theory, that takes a list to its multiset of
elements.
","[{""version"":""v1"",""created"":""Wed, 25 Jan 2023 20:23:36 GMT""}]","2023-01-27"
"2301.10813","Yijun Bian","Yijun Bian, Kun Zhang","Increasing Fairness in Compromise on Accuracy via Weighted Vote with
  Learning Guarantees","18 pages, 15 figures, and 6 tables",,,,"cs.LG cs.AI cs.CY","http://arxiv.org/licenses/nonexclusive-distrib/1.0/","  As the bias issue is being taken more and more seriously in widely applied
machine learning systems, the decrease in accuracy in most cases deeply
disturbs researchers when increasing fairness. To address this problem, we
present a novel analysis of the expected fairness quality via weighted vote,
suitable for both binary and multi-class classification. The analysis takes the
correction of biased predictions by ensemble members into account and provides
learning bounds that are amenable to efficient minimisation. We further propose
a pruning method based on this analysis and the concepts of domination and
Pareto optimality, which is able to increase fairness under a prerequisite of
little or even no accuracy decline. The experimental results indicate that the
proposed learning bounds are faithful and that the proposed pruning method can
indeed increase ensemble fairness without much accuracy degradation.
","[{""version"":""v1"",""created"":""Wed, 25 Jan 2023 20:31:06 GMT""}]","2023-01-27"
"2301.10814","Wengong Jin","Wengong Jin, Siranush Sarkizova, Xun Chen, Nir Hacohen, Caroline Uhler","Unsupervised Protein-Ligand Binding Energy Prediction via Neural Euler's
  Rotation Equation",,,,,"q-bio.BM cs.LG","http://arxiv.org/licenses/nonexclusive-distrib/1.0/","  Protein-ligand binding prediction is a fundamental problem in AI-driven drug
discovery. Prior work focused on supervised learning methods using a large set
of binding affinity data for small molecules, but it is hard to apply the same
strategy to other drug classes like antibodies as labelled data is limited. In
this paper, we explore unsupervised approaches and reformulate binding energy
prediction as a generative modeling task. Specifically, we train an
energy-based model on a set of unlabelled protein-ligand complexes using SE(3)
denoising score matching and interpret its log-likelihood as binding affinity.
Our key contribution is a new equivariant rotation prediction network called
Neural Euler's Rotation Equations (NERE) for SE(3) score matching. It predicts
a rotation by modeling the force and torque between protein and ligand atoms,
where the force is defined as the gradient of an energy function with respect
to atom coordinates. We evaluate NERE on protein-ligand and antibody-antigen
binding affinity prediction benchmarks. Our model outperforms all unsupervised
baselines (physics-based and statistical potentials) and matches supervised
learning methods in the antibody case.
","[{""version"":""v1"",""created"":""Wed, 25 Jan 2023 20:33:51 GMT""}]","2023-01-27"
"2301.10815","Baocheng Geng","Chen Quan, Baocheng Geng, Yunghsiang S. Han, Pramod K. Varshney","Human-machine Hierarchical Networks for Decision Making under Byzantine
  Attacks",,,,,"eess.SP","http://creativecommons.org/licenses/by-nc-sa/4.0/","  This paper proposes a belief-updating scheme in a human-machine collaborative
decision-making network to combat Byzantine attacks. A hierarchical framework
is used to realize the network where local decisions from physical sensors act
as reference decisions to improve the quality of human sensor decisions. During
the decision-making process, the belief that each physical sensor is malicious
is updated. The case when humans have side information available is
investigated, and its impact is analyzed. Simulation results substantiate that
the proposed scheme can significantly improve the quality of human sensor
decisions, even when most physical sensors are malicious. Moreover, the
performance of the proposed method does not necessarily depend on the knowledge
of the actual fraction of malicious physical sensors. Consequently, the
proposed scheme can effectively defend against Byzantine attacks and improve
the quality of human sensors' decisions so that the performance of the
human-machine collaborative system is enhanced.
","[{""version"":""v1"",""created"":""Wed, 25 Jan 2023 20:37:22 GMT""}]","2023-01-27"
"2301.10816","Justin Payan","Cyrus Cousins and Justin Payan and Yair Zick","Into the Unknown: Assigning Reviewers to Papers with Uncertain
  Affinities","14 pages, 0 figures. For associated code and data, see
  https://github.com/justinpayan/RAU",,,,"cs.GT","http://arxiv.org/licenses/nonexclusive-distrib/1.0/","  Peer review cannot work unless qualified and interested reviewers are
assigned to each paper. Nearly all automated reviewer assignment approaches
estimate real-valued affinity scores for each paper-reviewer pair that act as
proxies for the predicted quality of a future review; conferences then assign
reviewers to maximize the sum of these values. This procedure does not account
for noise in affinity score computation -- reviewers can only bid on a small
number of papers, and textual similarity models are inherently probabilistic
estimators. In this work, we assume paper-reviewer affinity scores are
estimated using a probabilistic model. Using these probabilistic estimates, we
bound the scores with high probability and maximize the worst-case sum of
scores for a reviewer allocation. Although we do not directly recommend any
particular method for estimation of probabilistic affinity scores, we
demonstrate how to robustly maximize the sum of scores across multiple
different models. Our general approach can be used to integrate a large variety
of probabilistic paper-reviewer affinity models into reviewer assignment,
opening the door to a much more robust peer review process.
","[{""version"":""v1"",""created"":""Wed, 25 Jan 2023 20:40:38 GMT""}]","2023-01-27"
"2301.10817","Dylan Galt","Dylan Galt, Mark McConnell","Cohomology at Infinity and the Well-Tempered Complex",,,,,"math.NT","http://arxiv.org/licenses/nonexclusive-distrib/1.0/","  We prove the existence of a sequence of commutative diagrams generalizing
existing results on the cohomology of the Borel-Serre boundary and well-rounded
retract to the context of the well-tempered complex. Our main theorem provides
a method for computing in finite terms the action of Hecke operators on the
equivariant cohomology of an arithmetic subgroup $\Gamma$ of the special linear
group $SL_n$.
","[{""version"":""v1"",""created"":""Wed, 25 Jan 2023 20:41:51 GMT""}]","2023-01-27"
"2301.10818","Simone Linz","Simone Linz, Kristina Wicke","Exploring spaces of semi-directed phylogenetic networks",,,,,"math.CO q-bio.PE","http://arxiv.org/licenses/nonexclusive-distrib/1.0/","  Semi-directed phylogenetic networks have recently emerged as a class of
phylogenetic networks sitting between rooted (directed) and unrooted
(undirected) phylogenetic networks as they contain both directed as well as
undirected edges. While the spaces of rooted phylogenetic networks and unrooted
phylogenetic networks have been analyzed in recent years and various
rearrangement moves to traverse these spaces have been introduced, the results
do not immediately carry over to semi-directed phylogenetic networks. Here, we
propose a simple rearrangement move for semi-directed phylogenetic networks,
called cut edge transfer (CET), and show that the space of semi-directed
level-$1$ networks with precisely $k$ reticulations is connected under CET.
This level-$1$ space is currently the predominantly used search space for most
algorithms that reconstruct semi-directed phylogenetic networks. Hence, every
semi-directed level-$1$ network with a fixed number of reticulations and leaf
set can be reached from any other such network by a sequence of CETs. By
introducing two additional moves, CET$^+$ and CET$^-$, that allow for the
addition or deletion of reticulations, we then establish connectedness for the
space of all semi-directed phylogenetic networks on a fixed leaf set. As a
byproduct of our results for semi-directed phylogenetic networks, we also show
that the space of rooted level-$1$ networks with a fixed number of
reticulations and leaf set is connected under CET, when translated into the
rooted setting.
","[{""version"":""v1"",""created"":""Wed, 25 Jan 2023 20:44:07 GMT""}]","2023-01-27"
"2301.10819","Adriano Barros","Adriano Barros and Carlos Romero","A brief note on the limit $\omega\rightarrow\infty$ in Weyl geometrical
  scalar-tensor theory","11 pages","Int.J.Mod.Phys.D 30 (2021) 15, 2150113","10.1142/S0218271821501133",,"gr-qc","http://creativecommons.org/licenses/by-nc-sa/4.0/","  We obtain vacuum solutions in the presence of a cosmological constant in the
context of the Weyl geometrical scalar-tensor theory. We investigate the limit
when $\omega$ goes to infinity and show by working out the solutions that in
this limit there are some cases in which the scalar field tends to a constant
(with the implicit consequence of the geometry becoming Riemannian), although
the solutions do not reduce to the corresponding Einstein solutions. We have
also extended a previous result, known in the literature, by showing that in
the case of vacuum with cosmological constant the field equations of the Weyl
geometrical scalar-tensor theory are formally identical to Brans-Dicke field
equations, even though these theories are not physically equivalent.
","[{""version"":""v1"",""created"":""Wed, 25 Jan 2023 20:44:41 GMT""}]","2023-01-27"
"2301.10820","Tim Seidelmann","Tim Seidelmann, Thomas K. Bracht, Barbara Ursula Lehner, Christian
  Schimpf, Michael Cosacchi, Moritz Cygorek, Alexei Vagov, Armando Rastelli,
  Doris E. Reiter, Vollrath Martin Axt","Two-photon excitation with finite pulses unlocks pure dephasing-induced
  degradation of entangled photons emitted by quantum dots","10 pages, 3 figures",,,,"cond-mat.mes-hall quant-ph","http://arxiv.org/licenses/nonexclusive-distrib/1.0/","  Semiconductor quantum dots have emerged as an especially promising platform
for the generation of polarization-entangled photon pairs. However, it was
demonstrated recently that the two-photon excitation scheme employed in
state-of-the-art experiments limits the achievable degree of entanglement by
introducing which-path information. In this work, the combined impact of
two-photon excitation and longitudinal acoustic phonons on photon pairs emitted
by strongly-confining quantum dots is investigated. It is found that phonons
further reduce the achievable degree of entanglement even in the limit of
vanishing temperature due to phonon-induced pure dephasing and phonon-assisted
one-photon processes, which increase the re-excitation probability. In
addition, the degree of entanglement, as measured by the concurrence, decreases
with rising temperature and/or pulse duration, even if the excitonic
fine-structure splitting is absent and when higher electronic states are out of
reach. Furthermore, in the case of finite fine-structure splittings, phonons
enlarge the discrepancy in concurrence for different laser polarizations.
","[{""version"":""v1"",""created"":""Wed, 25 Jan 2023 20:44:58 GMT""},{""version"":""v2"",""created"":""Wed, 26 Apr 2023 19:01:36 GMT""}]","2023-04-28"
"2301.10821","Kamil Ciesielski","Kamil M. Ciesielski (1, 2), Brenden R. Ortiz (1, 3), Lidia C. Gomes
  (4), Vanessa Meschke (1), Jesse M. Adamczyk (1), Tara L. Braden (1), Dariusz
  Kaczorowski (2), Elif Ertekin (5), and Eric S. Toberer (1), ((1) Department
  of Physics, Colorado School of Mines, Golden, Colorado, United States, (2)
  Institute of Low Temperature and Structure Research, Polish Academy of
  Sciences, Wroclaw, Poland, (3) Materials Department, University of
  California, Santa Barbara, California, United States, (4) Instituto de
  F\'isica Te\'orica, S\~ao Paulo State University (UNESP), S\~ao Paulo,
  Brazil, (5) Department of Mechanical Science and Engineering, University of
  Illinois Urbana Champaign, Champaign, Illinois, United States)","Origin of ultra-low thermal conductivity in unconventional clathrates:
  Strong scattering from extremely low-frequency rattling modes",,,,,"cond-mat.mtrl-sci","http://creativecommons.org/licenses/by/4.0/","  Recent discoveries of materials with ultra-low thermal conductivity open a
pathway to significant developments in the field of thermoelectricity. Here, we
conduct a comparative study of three chemically similar antimonides to
establish the root causes of their extraordinarily low thermal conductivity
($0.4-0.6$ Wm$^{-1}$K$^{-1}$ at 525 K). The materials of interest are: the
unconventional type-XI clathrate K$_{58}$Zn$_{122}$Sb$_{207}$, the tunnel
compound K$_{6.9}$Zn$_{21}$Sb$_{16}$, and the type-I clathrate
K$_8$Zn$_{15.5}$Cu$_{2.5}$Sb$_{28}$ discovered herein. Calculations of the
phonon dispersions show that the type-XI compound exhibits localized (i.e.,
rattling) phonon modes with unusually low frequencies that span the entire
acoustic regime. In contrast, rattling in the type-I clathrate is observed only
at higher frequencies, and no rattling modes are present in the tunnel
structure. Modeling reveals that low-frequency rattling modes profoundly limit
the acoustic scattering time; the scattering time of the type-XI clathrate is
half that of the type-I clathrate and a quarter of the tunnel compound. For all
three materials, the thermal conductivities are additionally suppressed by soft
framework bonding that lowers the acoustic group velocities, and structural
complexity that leads to diffusonic character of the optical modes.
Understanding details of thermal transport in structurally complex materials
will be crucial for developing the next generation of thermoelectrics.
","[{""version"":""v1"",""created"":""Wed, 25 Jan 2023 20:47:22 GMT""}]","2023-01-27"
