"2301.10932","Xian Yu","Xian Yu and Lei Ying","On the Global Convergence of Risk-Averse Policy Gradient Methods with
  Expected Conditional Risk Measures",,,,,"cs.LG math.OC stat.ML","http://arxiv.org/licenses/nonexclusive-distrib/1.0/","  Risk-sensitive reinforcement learning (RL) has become a popular tool to
control the risk of uncertain outcomes and ensure reliable performance in
various sequential decision-making problems. While policy gradient methods have
been developed for risk-sensitive RL, it remains unclear if these methods enjoy
the same global convergence guarantees as in the risk-neutral case. In this
paper, we consider a class of dynamic time-consistent risk measures, called
Expected Conditional Risk Measures (ECRMs), and derive policy gradient updates
for ECRM-based objective functions. Under both constrained direct
parameterization and unconstrained softmax parameterization, we provide global
convergence and iteration complexities of the corresponding risk-averse policy
gradient algorithms. We further test risk-averse variants of REINFORCE and
actor-critic algorithms to demonstrate the efficacy of our method and the
importance of risk control.
","[{""version"":""v1"",""created"":""Thu, 26 Jan 2023 04:35:28 GMT""},{""version"":""v2"",""created"":""Tue, 30 May 2023 01:14:20 GMT""}]","2023-05-31"
"2301.10933","Gyanendra Sharma","Gyanendra Sharma, Hiroshi Yasuda and Manuel Kuehner","Continuous Visual Feedback of Risk for Haptic Lateral Assistance",,,,,"cs.HC","http://creativecommons.org/licenses/by/4.0/","  Lateral assistance systems are a significant part of the currently existing
Advanced Driving Assistance System (ADAS). In most cases, such systems provide
intermittent audio and haptic feedback rather than continuous feedback, making
it difficult for drivers to form a clear mental model. In this paper, we
propose continuous visual feedback for the lateral assistance system by
leveraging the Head-Up Display (HUD) alongside haptic feedback through the
steering wheel. The HUD provides visualization of the risk profile underlying
the haptic feedback. We hypothesize that our proposed visualization helps form
a clear mental model and improves the system's acceptance. We conduct a user
study on a simulated version of a car driving on a two-lane freeway and compare
the haptic lateral assistance system with and without the visualization on the
HUD. While both conditions received high acceptance scores, there was no
significant gain or deterioration in acceptance between them. We discuss
potential improvements in the visualization based on anticipation performance
and qualitative feedback from users.
","[{""version"":""v1"",""created"":""Thu, 26 Jan 2023 04:41:47 GMT""}]","2023-01-27"
"2301.10934","Aydogan Ozcan","Artem Goncharov, Hyou-Arm Joung, Rajesh Ghosh, Gyeo-Re Han, Zachary S.
  Ballard, Quinn Maloney, Alexandra Bell, Chew Tin Zar Aung, Omai B. Garner,
  Dino Di Carlo, Aydogan Ozcan","Deep learning-enabled multiplexed point-of-care sensor using a
  paper-based fluorescence vertical flow assay","17 Pages, 6 Figures","Small (2023)","10.1002/smll.202300617",,"physics.med-ph physics.app-ph physics.bio-ph","http://arxiv.org/licenses/nonexclusive-distrib/1.0/","  We demonstrate multiplexed computational sensing with a point-of-care
serodiagnosis assay to simultaneously quantify three biomarkers of acute
cardiac injury. This point-of-care sensor includes a paper-based fluorescence
vertical flow assay (fxVFA) processed by a low-cost mobile reader, which
quantifies the target biomarkers through trained neural networks, all within
<15 min of test time using 50 microliters of serum sample per patient. This
fxVFA platform is validated using human serum samples to quantify three cardiac
biomarkers, i.e., myoglobin, creatine kinase-MB (CK-MB) and heart-type fatty
acid binding protein (FABP), achieving less than 0.52 ng/mL limit-of-detection
for all three biomarkers with minimal cross-reactivity. Biomarker concentration
quantification using the fxVFA that is coupled to neural network-based
inference is blindly tested using 46 individually activated cartridges, which
showed a high correlation with the ground truth concentrations for all three
biomarkers achieving > 0.9 linearity and < 15 % coefficient of variation. The
competitive performance of this multiplexed computational fxVFA along with its
inexpensive paper-based design and handheld footprint make it a promising
point-of-care sensor platform that could expand access to diagnostics in
resource-limited settings.
","[{""version"":""v1"",""created"":""Thu, 26 Jan 2023 04:45:13 GMT""}]","2023-05-01"
"2301.10935","William Simmons","William Simmons and Andr\'e Platzer","Differential Elimination and Algebraic Invariants of Polynomial
  Dynamical Systems",,,,,"cs.SC cs.LO math.AG math.DS","http://arxiv.org/licenses/nonexclusive-distrib/1.0/","  Invariant sets are a key ingredient for verifying safety and other properties
of cyber-physical systems that mix discrete and continuous dynamics. We adapt
the elimination-theoretic Rosenfeld-Gr\""{o}bner algorithm to systematically
obtain algebraic invariants of polynomial dynamical systems without using
Gr\""{o}bner bases or quantifier elimination. We identify totally real varieties
as an important class for efficient invariance checking.
","[{""version"":""v1"",""created"":""Thu, 26 Jan 2023 04:47:38 GMT""}]","2023-01-27"
"2301.10936","Ningxin Zheng","Ningxin Zheng, Huiqiang Jiang, Quanlu Zhang, Zhenhua Han, Yuqing Yang,
  Lingxiao Ma, Fan Yang, Lili Qiu, Mao Yang, Lidong Zhou","SparDA: Accelerating Dynamic Sparse Deep Neural Networks via
  Sparse-Dense Transformation",,,,,"cs.LG cs.NE","http://creativecommons.org/licenses/by/4.0/","  Due to its high cost-effectiveness, sparsity has become the most important
approach for building efficient deep-learning models. However, commodity
accelerators are built mainly for efficient dense computation, creating a huge
gap for general sparse computation to leverage. Existing solutions have to use
time-consuming compiling to improve the efficiency of sparse kernels in an
ahead-of-time manner and thus are limited to static sparsity. A wide range of
dynamic sparsity opportunities is missed because their sparsity patterns are
only known at runtime. This limits the future of building more biological
brain-like neural networks that should be dynamically and sparsely activated.
  In this paper, we bridge the gap between sparse computation and commodity
accelerators by proposing a system, called Spider, for efficiently executing
deep learning models with dynamic sparsity. We identify an important property
called permutation invariant that applies to most deep-learning computations.
The property enables Spider (1) to extract dynamic sparsity patterns of tensors
that are only known at runtime with little overhead; and (2) to transform the
dynamic sparse computation into an equivalent dense computation which has been
extremely optimized on commodity accelerators. Extensive evaluation on diverse
models shows Spider can extract and transform dynamic sparsity with negligible
overhead but brings up to 9.4x speedup over state-of-art solutions.
","[{""version"":""v1"",""created"":""Thu, 26 Jan 2023 04:50:14 GMT""}]","2023-01-27"
"2301.10937","Kai Fukami","Kai Fukami, Koji Fukagata, Kunihiko Taira","Super-Resolution Analysis via Machine Learning: A Survey for Fluid Flows",,,,,"physics.flu-dyn cs.LG physics.comp-ph","http://creativecommons.org/licenses/by/4.0/","  This paper surveys machine-learning-based super-resolution reconstruction for
vortical flows. Super resolution aims to find the high-resolution flow fields
from low-resolution data and is generally an approach used in image
reconstruction. In addition to surveying a variety of recent super-resolution
applications, we provide case studies of super-resolution analysis for an
example of two-dimensional decaying isotropic turbulence. We demonstrate that
physics-inspired model designs enable successful reconstruction of vortical
flows from spatially limited measurements. We also discuss the challenges and
outlooks of machine-learning-based super-resolution analysis for fluid flow
applications. The insights gained from this study can be leveraged for
super-resolution analysis of numerical and experimental flow data.
","[{""version"":""v1"",""created"":""Thu, 26 Jan 2023 04:56:27 GMT""},{""version"":""v2"",""created"":""Wed, 7 Jun 2023 01:02:28 GMT""}]","2023-06-08"
"2301.10938","Zikai Song","Zikai Song, Run Luo, Junqing Yu, Yi-Ping Phoebe Chen, Wei Yang","Compact Transformer Tracker with Correlative Masked Modeling","AAAI2023 oral",,,,"cs.CV","http://creativecommons.org/publicdomain/zero/1.0/","  Transformer framework has been showing superior performances in visual object
tracking for its great strength in information aggregation across the template
and search image with the well-known attention mechanism. Most recent advances
focus on exploring attention mechanism variants for better information
aggregation. We find these schemes are equivalent to or even just a subset of
the basic self-attention mechanism. In this paper, we prove that the vanilla
self-attention structure is sufficient for information aggregation, and
structural adaption is unnecessary. The key is not the attention structure, but
how to extract the discriminative feature for tracking and enhance the
communication between the target and search image. Based on this finding, we
adopt the basic vision transformer (ViT) architecture as our main tracker and
concatenate the template and search image for feature embedding. To guide the
encoder to capture the invariant feature for tracking, we attach a lightweight
correlative masked decoder which reconstructs the original template and search
image from the corresponding masked tokens. The correlative masked decoder
serves as a plugin for the compact transform tracker and is skipped in
inference. Our compact tracker uses the most simple structure which only
consists of a ViT backbone and a box head, and can run at 40 fps. Extensive
experiments show the proposed compact transform tracker outperforms existing
approaches, including advanced attention variants, and demonstrates the
sufficiency of self-attention in tracking tasks. Our method achieves
state-of-the-art performance on five challenging datasets, along with the
VOT2020, UAV123, LaSOT, TrackingNet, and GOT-10k benchmarks. Our project is
available at https://github.com/HUSTDML/CTTrack.
","[{""version"":""v1"",""created"":""Thu, 26 Jan 2023 04:58:08 GMT""}]","2023-01-27"
"2301.10939","Scott Geng","Scott Geng, Revant Teotia, Purva Tendulkar, Sachit Menon, and Carl
  Vondrick","Affective Faces for Goal-Driven Dyadic Communication",,,,,"cs.CV cs.CL cs.LG","http://arxiv.org/licenses/nonexclusive-distrib/1.0/","  We introduce a video framework for modeling the association between verbal
and non-verbal communication during dyadic conversation. Given the input speech
of a speaker, our approach retrieves a video of a listener, who has facial
expressions that would be socially appropriate given the context. Our approach
further allows the listener to be conditioned on their own goals,
personalities, or backgrounds. Our approach models conversations through a
composition of large language models and vision-language models, creating
internal representations that are interpretable and controllable. To study
multimodal communication, we propose a new video dataset of unscripted
conversations covering diverse topics and demographics. Experiments and
visualizations show our approach is able to output listeners that are
significantly more socially appropriate than baselines. However, many
challenges remain, and we release our dataset publicly to spur further
progress. See our website for video results, data, and code:
https://realtalk.cs.columbia.edu.
","[{""version"":""v1"",""created"":""Thu, 26 Jan 2023 05:00:09 GMT""}]","2023-01-27"
"2301.10940","Jia Jie Li","Jia Jie Li (SWU, Chongqing), Armen Sedrakian (FIAS, Frankfurt and
  Wroclaw U.), Mark Alford (Washington U., St. Louis)","Relativistic hybrid stars with sequential first-order phase transitions
  in light of multimessenger constraints","v2: matches published version, 11 pages, 11 figures","ApJ vol. 944 pg. 206 (2023)","10.3847/1538-4357/acb688",,"astro-ph.HE hep-ph nucl-th","http://creativecommons.org/licenses/by/4.0/","  In this work, we consider the properties of compact stars in which quark
matter has low- and high-density phases that are separated by a first-order
phase transition. Thus, unlike the commonly considered case of a single phase
transition from hadronic to quark matter, our models of hybrid stars contain
sequential phase transitions from hadronic matter to low- and then to
high-density quark matter phases. We extend our previous study of the parameter
space of hybrid stars with a single phase transition to those with sequential
phase transitions, taking into account the constraints on the mass and radius
of neutron stars from the NICER experiment, the experimental inferences of the
neutron skin thickness of the lead nucleus by the PREX-II experiment, and
constraints on the tidal deformability from the gravitational-wave event
GW170817. We determine the range of the masses for which both twin and triplet
configurations, i.e., identical-mass stars with two and three different values
of radii, arise.
","[{""version"":""v1"",""created"":""Thu, 26 Jan 2023 05:13:10 GMT""},{""version"":""v2"",""created"":""Thu, 9 Mar 2023 02:07:25 GMT""}]","2023-03-27"
"2301.10941","Min-Seop Kwak","Min-seop Kwak, Jiuhn Song, Seungryong Kim","GeCoNeRF: Few-shot Neural Radiance Fields via Geometric Consistency","ICML 2023",,,,"cs.CV","http://creativecommons.org/licenses/by-nc-nd/4.0/","  We present a novel framework to regularize Neural Radiance Field (NeRF) in a
few-shot setting with a geometry-aware consistency regularization. The proposed
approach leverages a rendered depth map at unobserved viewpoint to warp sparse
input images to the unobserved viewpoint and impose them as pseudo ground
truths to facilitate learning of NeRF. By encouraging such geometry-aware
consistency at a feature-level instead of using pixel-level reconstruction
loss, we regularize the NeRF at semantic and structural levels while allowing
for modeling view dependent radiance to account for color variations across
viewpoints. We also propose an effective method to filter out erroneous warped
solutions, along with training strategies to stabilize training during
optimization. We show that our model achieves competitive results compared to
state-of-the-art few-shot NeRF models. Project page is available at
https://ku-cvlab.github.io/GeCoNeRF/.
","[{""version"":""v1"",""created"":""Thu, 26 Jan 2023 05:14:12 GMT""},{""version"":""v2"",""created"":""Mon, 20 Mar 2023 14:57:52 GMT""},{""version"":""v3"",""created"":""Thu, 27 Apr 2023 05:34:01 GMT""}]","2023-04-28"
"2301.10942","Wanshan Li","Wanshan Li, Daren Wang, Alessandro Rinaldo","Divide and Conquer Dynamic Programming: An Almost Linear Time Change
  Point Detection Methodology in High Dimensions","84 pages, 6 figures, 6 tables",,,,"stat.ME","http://arxiv.org/licenses/nonexclusive-distrib/1.0/","  We develop a novel, general and computationally efficient framework, called
Divide and Conquer Dynamic Programming (DCDP), for localizing change points in
time series data with high-dimensional features. DCDP deploys a class of greedy
algorithms that are applicable to a broad variety of high-dimensional
statistical models and can enjoy almost linear computational complexity. We
investigate the performance of DCDP in three commonly studied change point
settings in high dimensions: the mean model, the Gaussian graphical model, and
the linear regression model. In all three cases, we derive non-asymptotic
bounds for the accuracy of the DCDP change point estimators. We demonstrate
that the DCDP procedures consistently estimate the change points with sharp,
and in some cases, optimal rates while incurring significantly smaller
computational costs than the best available algorithms. Our findings are
supported by extensive numerical experiments on both synthetic and real data.
","[{""version"":""v1"",""created"":""Thu, 26 Jan 2023 05:16:13 GMT""},{""version"":""v2"",""created"":""Tue, 30 May 2023 00:04:31 GMT""},{""version"":""v3"",""created"":""Fri, 2 Jun 2023 07:49:43 GMT""}]","2023-06-05"
"2301.10943","Jaemin Hong","Jaemin Hong and Sukyoung Ryu","Concrat: An Automatic C-to-Rust Lock API Translator for Concurrent
  Programs","13 pages, 3 figures, 1 table, In Proceedings of the ACM/IEEE 45th
  International Conference on Software Engineering (ICSE 2023)",,,,"cs.SE","http://creativecommons.org/licenses/by/4.0/","  Concurrent programs suffer from data races. To prevent data races,
programmers use locks. However, programs can eliminate data races only when
they acquire and release correct locks at correct timing. The lock API of C, in
which people have developed a large portion of legacy system programs, does not
validate the correct use of locks. On the other hand, Rust, a recently
developed system programming language, provides a lock API that guarantees the
correct use of locks via type checking. This makes rewriting legacy system
programs in Rust a promising way to retrofit safety into them. Unfortunately,
manual C-to-Rust translation is extremely laborious due to the discrepancies
between their lock APIs. Even the state-of-the-art automatic C-to-Rust
translator retains the C lock API, expecting developers to replace them with
the Rust lock API. In this work, we propose an automatic tool to replace the C
lock API with the Rust lock API. It facilitates C-to-Rust translation of
concurrent programs with less human effort than the current practice. Our tool
consists of a Rust code transformer that takes a lock summary as an input and a
static analyzer that efficiently generates precise lock summaries. We show that
the transformer is scalable and widely applicable while preserving the
semantics; it transforms 66 KLOC in 2.6 seconds and successfully handles 74% of
real-world programs. We also show that the analyzer is scalable and precise; it
analyzes 66 KLOC in 4.3 seconds.
","[{""version"":""v1"",""created"":""Thu, 26 Jan 2023 05:20:43 GMT""},{""version"":""v2"",""created"":""Fri, 27 Jan 2023 11:21:43 GMT""}]","2023-01-30"
"2301.10944","Yuxuan Lu","Yuxuan Lu, Qian Qi, Xi Chen","A Framework of Transaction Packaging in High-throughput Blockchains",,,,,"econ.GN cs.CR cs.DC cs.GT q-fin.EC","http://arxiv.org/licenses/nonexclusive-distrib/1.0/","  We develop a model of coordination and allocation of decentralized
multi-sided markets, in which our theoretical analysis is promisingly
optimizing the decentralized transaction packaging process at high-throughput
blockchains or Web 3.0 platforms. In contrast to the stylized centralized
platform, the decentralized platform is powered by blockchain technology, which
allows for secure and transparent Peer-to-Peer transactions among users.
Traditional single-chain-based blockchains suffer from the well-known
blockchain trilemma. Beyond the single-chain-based scheme, decentralized
high-throughput blockchains adopt parallel protocols to reconcile the
blockchain trilemma, implementing any tasking and desired allocation. However,
unneglectable network latency may induce partial observability, resulting in
incoordination and misallocation issues for the decentralized transaction
packaging process at the current high-throughput blockchain protocols.
  To address this problem, we consider a strategic coordination mechanism for
the decentralized transaction packaging process by using a game-theoretic
approach. Under a tractable two-period model, we find a Bayesian Nash
equilibrium of the miner's strategic transaction packaging under partial
observability. Along with novel algorithms for computing equilibrium payoffs,
we show that the decentralized platform can achieve an efficient and stable
market outcome. The model also highlights that the proposed mechanism can
endogenously offer a base fee per gas without any restructuration of the
initial blockchain transaction fee mechanism. The theoretical results that
underlie the algorithms also imply bounds on the computational complexity of
equilibrium payoffs.
","[{""version"":""v1"",""created"":""Thu, 26 Jan 2023 05:31:24 GMT""}]","2023-01-27"
"2301.10945","Jeongyeol Kwon","Jeongyeol Kwon, Dohyun Kwon, Stephen Wright, Robert Nowak","A Fully First-Order Method for Stochastic Bilevel Optimization",,,,,"math.OC cs.AI cs.LG","http://arxiv.org/licenses/nonexclusive-distrib/1.0/","  We consider stochastic unconstrained bilevel optimization problems when only
the first-order gradient oracles are available. While numerous optimization
methods have been proposed for tackling bilevel problems, existing methods
either tend to require possibly expensive calculations regarding Hessians of
lower-level objectives, or lack rigorous finite-time performance guarantees. In
this work, we propose a Fully First-order Stochastic Approximation (F2SA)
method, and study its non-asymptotic convergence properties. Specifically, we
show that F2SA converges to an $\epsilon$-stationary solution of the bilevel
problem after $\epsilon^{-7/2}, \epsilon^{-5/2}$, and $\epsilon^{-3/2}$
iterations (each iteration using $O(1)$ samples) when stochastic noises are in
both level objectives, only in the upper-level objective, and not present
(deterministic settings), respectively. We further show that if we employ
momentum-assisted gradient estimators, the iteration complexities can be
improved to $\epsilon^{-5/2}, \epsilon^{-4/2}$, and $\epsilon^{-3/2}$,
respectively. We demonstrate even superior practical performance of the
proposed method over existing second-order based approaches on MNIST
data-hypercleaning experiments.
","[{""version"":""v1"",""created"":""Thu, 26 Jan 2023 05:34:21 GMT""}]","2023-01-27"
"2301.10946","Sajana Perera","J. V. S. Sajana D. Perera","Band gap studies of nanocomposites of ZnO/SnO$_2$ with different molar
  ratios","11 pages, 5 figures",,,,"cond-mat.mtrl-sci","http://arxiv.org/licenses/nonexclusive-distrib/1.0/","  Nano particles of pure ZnO, pure SnO$_2$, and nanocomposites of ZnO/SnO$_2$
were synthesized using microwave hydrothermal technique starting from aqueous
solutions. Nanocomposites with different molar ratios of ZnO and SnO$_2$ were
prepared. Structural, morphological and optical properties of these samples
were investigated using XRD, SEM and UV-visible technique, respectively. The
single phases of ZnO and SnO$_2$ could be fabricated according to XRD patterns.
The relative intensities of different XRD peaks in different nanocomposite
samples were different by indicating that there are some preferred orientations
in different samples. In XRD patterns of nanocomposites, peaks of both pure ZnO
and pure SnO$_2$ samples appear. Particle size was in the range of nano-range
according to SEM micrographs. Optical bang gap was measured by UV-visible
spectrometer. Optical band gaps of nano composites are less than those of pure
ZnO and SnO$_2$ due to the increase of particle size.
","[{""version"":""v1"",""created"":""Thu, 26 Jan 2023 05:43:19 GMT""}]","2023-01-27"
"2301.10947","Jon McCormack","Nina Rajcic and Jon McCormack","Message Ritual: A Posthuman Account of Living with Lamp","Paper accepted for CHI2023, Hamburg, Germany April 23-28, 2023",,"10.1145/3544548.3581363",,"cs.HC cs.AI cs.NE","http://creativecommons.org/licenses/by-nc-nd/4.0/","  As we become increasingly entangled with digital technologies, the boundary
between human and machine is progressively blurring. Adopting a performative,
posthumanist perspective resolves this ambiguity by proposing that such
boundaries are not predetermined, rather they are enacted within a certain
material configuration. Using this approach, dubbed `Entanglement HCI', this
paper presents \emph{Message Ritual} -- a novel, integrated AI system that
encourages the re-framing of memory through machine generated poetics. Embodied
within a domestic table lamp, the system listens in on conversations occurring
within the home, drawing out key topics and phrases of the day and
reconstituting them through machine generated poetry, delivered to household
members via SMS upon waking each morning. Participants across four households
were asked to live with the lamp over a two week period. We present a
diffractive analysis exploring how the lamp \emph{becomes with} participants
and discuss the implications of this method for future HCI research.
","[{""version"":""v1"",""created"":""Thu, 26 Jan 2023 05:53:51 GMT""}]","2023-01-27"
"2301.10948","Maria Grechkoseeva","Alexander A. Buturlakin, Maria A. Grechkoseeva","The spectra of almost simple groups with socle $E_7(q)$",,,,,"math.GR","http://creativecommons.org/licenses/by-nc-nd/4.0/","  We give an explicit description of the set of element orders for every almost
simple group with socle $E_7(q)$.
","[{""version"":""v1"",""created"":""Thu, 26 Jan 2023 05:54:04 GMT""}]","2023-01-27"
