"2301.12138","Jing-ning Zhang","Xue-Gang Li, Hui-Kai Xu, Jun-Hua Wang, Ling-Zhi Tang, Dan-Wei Zhang,
  Chu-Hong Yang, Tang Su, Chen-Lu Wang, Zhen-Yu Mi, Wei-Jie Sun, Xue-Hui Liang,
  Mo Chen, Cheng-Yao Li, Ying-Shan Zhang, Ke-Huan Linghu, Jia-Xiu Han, Wei-Yang
  Liu, Yu-Long Feng, Pei Liu, Guang-Ming Xue, Jing-Ning Zhang, Yi-Rong Jin,
  Shi-Liang Zhu, Hai-Feng Yu, Qi-Kun Xue","Mapping a topology-disorder phase diagram with a quantum simulator",,,,,"quant-ph","http://arxiv.org/licenses/nonexclusive-distrib/1.0/","  The competition and interplay of topology and disorder has been one of the
most famous topics in the field of condensed matter physics. In addition to the
intuitive tendency to bring the system into a topologically trivial and
localized phase, it has been discovered that disorder can also induce
nontrivial topology and transport. To reveal rich and diverse phase structures,
mapping phase diagrams plays an important role in both theoretical and
experimental sides. Quantum simulation provides a prospective way to study the
target model, explore the phase diagram and reveal the underlying mechanism.
Thanks to the unprecedented controllability, superconducting quantum simulators
have been introduced to investigate complex many-body physics and bring thought
experiments into reality. To our best knowledge, the effort to map a phase
diagram with a rich structure is still lacking. Here we report a systematic
experimental study of the topology-disorder phase diagram with 32 qubits on a
programmable analog quantum simulator. We implement one-dimensional (1D)
disordered dimerized tight-binding models over a wide parameter range and
observe diverse phases, including the topological Anderson insulator (TAI) and
the inverse Anderson localization (IAL). Our experiment manifests the
efficiency, accuracy and flexibility of the superconducting-circuit device and
paves the way to the demonstration and understanding of many-body phenomena
with noisy intermediate-scale quantum simulators.
","[{""version"":""v1"",""created"":""Sat, 28 Jan 2023 09:19:41 GMT""}]","2023-01-31"
"2301.12139","Tosin Adewumi","Tosin Adewumi, Isabella S\""odergren, Lama Alkhaled, Sana Sabah Sabry,
  Foteini Liwicki and Marcus Liwicki","Bipol: Multi-axes Evaluation of Bias with Explainability in Benchmark
  Datasets","7 pages, 13 figures",,,,"cs.CL","http://creativecommons.org/licenses/by/4.0/","  We evaluate five English NLP benchmark datasets (available on the superGLUE
leaderboard) for bias, along multiple axes. The datasets are the following:
Boolean Question (Boolq), CommitmentBank (CB), Winograd Schema Challenge (WSC),
Winogender diagnostic (AXg), and Recognising Textual Entailment (RTE). Bias can
be harmful and it is known to be common in data, which ML models learn from. In
order to mitigate bias in data, it is crucial to be able to estimate it
objectively. We use bipol, a novel multi-axes bias metric with explainability,
to quantify and explain how much bias exists in these datasets. Multilingual,
multi-axes bias evaluation is not very common. Hence, we also contribute a new,
large labelled Swedish bias-detection dataset, with about 2 million samples;
translated from the English version. In addition, we contribute new multi-axes
lexica for bias detection in Swedish. We train a SotA model on the new dataset
for bias detection. We make the codes, model, and new dataset publicly
available.
","[{""version"":""v1"",""created"":""Sat, 28 Jan 2023 09:28:19 GMT""}]","2023-01-31"
"2301.12140","Yun Chen","Weikang Wang, Guanhua Chen, Hanqing Wang, Yue Han, Yun Chen","Multilingual Sentence Transformer as A Multilingual Word Aligner","Published at Findings of EMNLP 2022",,,,"cs.CL","http://arxiv.org/licenses/nonexclusive-distrib/1.0/","  Multilingual pretrained language models (mPLMs) have shown their
effectiveness in multilingual word alignment induction. However, these methods
usually start from mBERT or XLM-R. In this paper, we investigate whether
multilingual sentence Transformer LaBSE is a strong multilingual word aligner.
This idea is non-trivial as LaBSE is trained to learn language-agnostic
sentence-level embeddings, while the alignment extraction task requires the
more fine-grained word-level embeddings to be language-agnostic. We demonstrate
that the vanilla LaBSE outperforms other mPLMs currently used in the alignment
task, and then propose to finetune LaBSE on parallel corpus for further
improvement. Experiment results on seven language pairs show that our best
aligner outperforms previous state-of-the-art models of all varieties. In
addition, our aligner supports different language pairs in a single model, and
even achieves new state-of-the-art on zero-shot language pairs that does not
appear in the finetuning process.
","[{""version"":""v1"",""created"":""Sat, 28 Jan 2023 09:28:55 GMT""}]","2023-01-31"
"2301.12141","Pu Cao","Pu Cao, Lu Yang, Dongxu Liu, Shan Li, Yao Zhang, Qing Song","What Decreases Editing Capability? Domain-Specific Hybrid Refinement for
  Improved GAN Inversion",,,,,"cs.CV cs.AI","http://creativecommons.org/licenses/by/4.0/","  Recently, inversion methods have focused on additional high-rate information
in the generator (e.g., weights or intermediate features) to refine inversion
and editing results from embedded latent codes. Although these techniques gain
reasonable improvement in reconstruction, they decrease editing capability,
especially on complex images (e.g., containing occlusions, detailed
backgrounds, and artifacts). A vital crux is refining inversion results,
avoiding editing capability degradation. To tackle this problem, we introduce
Domain-Specific Hybrid Refinement (DHR), which draws on the advantages and
disadvantages of two mainstream refinement techniques to maintain editing
ability with fidelity improvement. Specifically, we first propose
Domain-Specific Segmentation to segment images into two parts: in-domain and
out-of-domain parts. The refinement process aims to maintain the editability
for in-domain areas and improve two domains' fidelity. We refine these two
parts by weight modulation and feature modulation, which we call Hybrid
Modulation Refinement. Our proposed method is compatible with all latent code
embedding methods. Extension experiments demonstrate that our approach achieves
state-of-the-art in real image inversion and editing. Code is available at
https://github.com/caopulan/GANInverter/tree/main/configs/dhr.
","[{""version"":""v1"",""created"":""Sat, 28 Jan 2023 09:31:20 GMT""},{""version"":""v2"",""created"":""Thu, 16 Mar 2023 10:58:20 GMT""}]","2023-03-17"
"2301.12142","Zaili Yan","Hui Zhang and Zaili Yan","The moment map for the variety of associative algebras",,,,,"math.DG math.RA","http://creativecommons.org/licenses/by/4.0/","  We consider the moment map $m:\mathbb{P}V_n\rightarrow
\text{i}\mathfrak{u}(n)$ for the action of $\text{GL}(n)$ on
$V_n=\otimes^{2}(\mathbb{C}^{n})^{*}\otimes\mathbb{C}^{n}$, and study the
critical points of the functional $F_n=\|m\|^{2}: \mathbb{P} V_n \rightarrow
\mathbb{R}$. Firstly, we prove that $[\mu]\in \mathbb{P}V_n$ is a critical
point if and only if $\text{M}_{\mu}=c_{\mu} I+D_{\mu}$ for some $c_{\mu} \in
\mathbb{R}$ and $D_{\mu} \in \text{Der}(\mu),$ where
$m([\mu])=\frac{\text{M}_{\mu}}{\|\mu\|^{2}}$. Then we show that any algebra
$\mu$ admits a Nikolayevsky derivation $\phi_\mu$ which is unique up to
automorphism, and if moreover, $[\mu]$ is a critical point of $F_n$, then
$\phi_\mu=-\frac{1}{c_\mu}D_\mu.$ Secondly, we characterize the maxima and
minima of the functional $F_n: \mathcal{A}_n \rightarrow \mathbb{R}$, where
$\mathcal{A}_n$ denotes the projectivization of the algebraic varieties of all
$n$-dimensional associative algebras. Furthermore, for an arbitrary critical
point $[\mu]$ of $F_n: \mathcal{A}_n \rightarrow \mathbb{R}$, we also obtain a
description of the algebraic structure of $[\mu]$. Finally, we classify the
critical points of $F_n: \mathcal{A}_n \rightarrow \mathbb{R}$ for $n=2$, $3$,
respectively.
","[{""version"":""v1"",""created"":""Sat, 28 Jan 2023 09:36:22 GMT""}]","2023-01-31"
"2301.12143","Hiroshi Ishimoto","Hiroshi Ishimoto","The endoscopic classification of representations of non-quasi-split odd
  special orthogonal groups","68 pages. Any comments are welcome",,,,"math.NT","http://arxiv.org/licenses/nonexclusive-distrib/1.0/","  In an earlier book of Arthur, the endoscopic classification of
representations of quasi-split orthogonal and symplectic groups was
established. Later Mok gave that of quasi-split unitary groups. After that,
Kaletha, Minguez, Shin, and White gave that of non-quasi-split unitary groups
for generic parameters. In this paper we prove the endoscopic classification of
representations of non-quasi-split odd special orthogonal groups for generic
parameters, following Kaletha, Minguez, Shin, and White.
","[{""version"":""v1"",""created"":""Sat, 28 Jan 2023 09:38:41 GMT""}]","2023-01-31"
"2301.12144","Zhong Zheng","Zhong Zheng, Siqiang Wang, Zesong Fei, Zhi Sun, Jinhong Yuan","On the Mutual Information of Multi-RIS Assisted MIMO: From
  Operator-Valued Free Probability Aspect","30 pages, 5 figures",,,,"cs.IT math.IT","http://creativecommons.org/licenses/by/4.0/","  The reconfigurable intelligent surface (RIS) is useful to effectively improve
the coverage and data rate of end-to-end communications. In contrast to the
well-studied coverage-extension use case, in this paper, multiple RIS panels
are introduced, aiming to enhance the data rate of multi-input multi-output
(MIMO) channels in presence of insufficient scattering. Specifically, via the
operator-valued free probability theory, the asymptotic mutual information of
the large-dimensional RIS-assisted MIMO channel is obtained under the Rician
fading with Weichselberger's correlation structure, in presence of both the
direct and the reflected links. Although the mutual information of Rician MIMO
channels scales linearly as the number of antennas and the signal-to-noise
ratio (SNR) in decibels, numerical results show that it requires sufficiently
large SNR, proportional to the Rician factor, in order to obtain the
theoretically guaranteed linear improvement. This paper shows that the proposed
multi-RIS deployment is especially effective to improve the mutual information
of MIMO channels under the large Rician factor conditions. When the reflected
links have similar arriving and departing angles across the RIS panels, a small
number of RIS panels are sufficient to harness the spatial degree of freedom of
the multi-RIS assisted MIMO channels.
","[{""version"":""v1"",""created"":""Sat, 28 Jan 2023 09:56:49 GMT""}]","2023-01-31"
"2301.12145","Nicolas Privault","Qingwei Liu and Nicolas Privault","Normal approximation of subgraph counts in the random-connection model",,,,,"math.PR","http://arxiv.org/licenses/nonexclusive-distrib/1.0/","  This paper derives normal approximation results for subgraph counts written
as multiparameter stochastic integrals in a random-connection model based on a
Poisson point process. By combinatorial arguments we express the cumulants of
general subgraph counts using sums over connected partition diagrams, after
cancellation of terms obtained by M\""obius inversion. Using the
Statulevi\v{c}ius condition, we deduce convergence rates in the Kolmogorov
distance by studying the growth of subgraph count cumulants as the intensity of
the underlying Poisson point process tends to infinity. Our analysis covers
general subgraphs in the dilute and full random graph regimes, and tree-like
subgraphs in the sparse random graph regime.
","[{""version"":""v1"",""created"":""Sat, 28 Jan 2023 09:57:18 GMT""},{""version"":""v2"",""created"":""Sun, 9 Apr 2023 07:52:47 GMT""}]","2023-04-11"
"2301.12146","Luke Pebody","Luke Pebody","On Tribonacci Sequences",,,,,"math.NT math.CO","http://creativecommons.org/licenses/by/4.0/","  Let a tribonacci sequence be a sequence of integers satisfying
$a_k=a_{k-1}+a_{k-2}+a_{k-3}$ for all $k\ge 4$. For any positive integers $k$
and $n$, denote by $f_k(n)$ the number of tribonacci sequences with $a_1, a_2,
a_3>0$ and with $a_k=n$. For all $n$, there is a maximum $k$ such that $f_k(n)$
is non-zero. Answering a question of Spiro \cite{Spiro}, we show that there is
a finite upper bound (we specifically prove 561001) on $f_k(n)$ for any
positive integer $n\ge 3$ and this maximum $k$. We do this by showing that
$f_k(n)$ has transitions in $n$ around constant multiples of $\phi^{3k/2}$
(where $\phi$ is the real root of $\phi^3=\phi^2+\phi+1$): there exists a
constant $C$ such that $f_k(n)>0$ whenever $n>C\phi^{3k/2}$ and for any
constant $T$, the values of $f_k(n)$ with $n<T\phi^{3k/2}$ have an upper bound
independent of $k$.
","[{""version"":""v1"",""created"":""Sat, 28 Jan 2023 10:04:35 GMT""}]","2023-01-31"
"2301.12147","Kenichiro Umezu","Kenichiro Umezu","Logistic elliptic equation with a nonlinear boundary condition arising
  from coastal fishery harvesting II","21 pages, 3 figures",,,,"math.AP","http://arxiv.org/licenses/nonexclusive-distrib/1.0/","  We study the positive solutions of the logistic elliptic equation with a
nonlinear Neumann boundary condition that models coastal fishery harvesting
([18]). An essential role is played by the smallest eigenvalue of the Dirichlet
eigenvalue problem, with respect to which a noncritical case is studied in
[32]. In this paper, we extend our analysis to the critical case and further
study the noncritical case for a more precise description of the positive
solution set. Our approach relies on the energy method, sub- and
supersolutions, and implicit function analysis.
","[{""version"":""v1"",""created"":""Sat, 28 Jan 2023 10:05:21 GMT""}]","2023-01-31"
"2301.12148","Ryoji Tanabe","Ryoji Tanabe and Ke Li","Quality Indicators for Preference-based Evolutionary Multi-objective
  Optimization Using a Reference Point: A Review and Analysis",,,,,"cs.NE","http://arxiv.org/licenses/nonexclusive-distrib/1.0/","  Some quality indicators have been proposed for benchmarking preference-based
evolutionary multi-objective optimization algorithms using a reference point.
Although a systematic review and analysis of the quality indicators are helpful
for both benchmarking and practical decision-making, neither has been
conducted. In this context, first, this paper reviews existing regions of
interest and quality indicators for preference-based evolutionary
multi-objective optimization using the reference point. We point out that each
quality indicator was designed for a different region of interest. Then, this
paper investigates the properties of the quality indicators. We demonstrate
that an achievement scalarizing function value is not always consistent with
the distance from a solution to the reference point in the objective space. We
observe that the regions of interest can be significantly different depending
on the position of the reference point and the shape of the Pareto front. We
identify undesirable properties of some quality indicators. We also show that
the ranking of preference-based evolutionary multi-objective optimization
algorithms depends on the choice of quality indicators.
","[{""version"":""v1"",""created"":""Sat, 28 Jan 2023 10:21:37 GMT""},{""version"":""v2"",""created"":""Thu, 1 Jun 2023 03:04:16 GMT""}]","2023-06-02"
"2301.12149","Yuanqi Chang","Jiawei Mao, Rui Xu, Xuesong Yin, Yuanqi Chang, Binling Nie, Aibin
  Huang","POSTER++: A simpler and stronger facial expression recognition network",,,,,"cs.CV","http://arxiv.org/licenses/nonexclusive-distrib/1.0/","  Facial expression recognition (FER) plays an important role in a variety of
real-world applications such as human-computer interaction. POSTER achieves the
state-of-the-art (SOTA) performance in FER by effectively combining facial
landmark and image features through two-stream pyramid cross-fusion design.
However, the architecture of POSTER is undoubtedly complex. It causes expensive
computational costs. In order to relieve the computational pressure of POSTER,
in this paper, we propose POSTER++. It improves POSTER in three directions:
cross-fusion, two-stream, and multi-scale feature extraction. In cross-fusion,
we use window-based cross-attention mechanism replacing vanilla cross-attention
mechanism. We remove the image-to-landmark branch in the two-stream design. For
multi-scale feature extraction, POSTER++ combines images with landmark's
multi-scale features to replace POSTER's pyramid design. Extensive experiments
on several standard datasets show that our POSTER++ achieves the SOTA FER
performance with the minimum computational cost. For example, POSTER++ reached
92.21% on RAF-DB, 67.49% on AffectNet (7 cls) and 63.77% on AffectNet (8 cls),
respectively, using only 8.4G floating point operations (FLOPs) and 43.7M
parameters (Param). This demonstrates the effectiveness of our improvements.
","[{""version"":""v1"",""created"":""Sat, 28 Jan 2023 10:23:44 GMT""},{""version"":""v2"",""created"":""Sun, 12 Feb 2023 11:04:37 GMT""}]","2023-02-14"
"2301.12150","Ali Azadbakht","Ali Azadbakht, Billie Meadowcroft, Thijs Varkevisser, Andela Saric,
  Daniela J. Kraft","Wrapping pathways of anisotropic dumbbell particles by giant unilamellar
  vesicles",,,"10.1021/acs.nanolett.3c00375",,"cond-mat.soft physics.bio-ph","http://arxiv.org/licenses/nonexclusive-distrib/1.0/","  Endocytosis is a key cellular process involved in the uptake of nutrients,
pathogens or the diagnosis and therapy of diseases. Most studies have focused
on spherical objects, whereas biologically relevant shapes can be highly
anisotropic. In this letter, we use an experimental model system based on Giant
Unilamellar Vesicles (GUVs) and dumbbell-shaped colloidal particles to mimic
and investigate the first stage of the passive endocytic process: engulfment of
an anisotropic object by the membrane. Our model has specific ligand-receptor
interactions realized by mobile receptors on the vesicles and immobile ligands
on the particles. Through a series of experiments, theory and molecular
dynamics simulations, we quantify the wrapping process of anisotropic dumbbells
by GUVs and identify distinct stages of the wrapping pathway. We find that the
strong curvature variation in the neck of the dumbbell as well as membrane
tension are crucial in determining both the speed of wrapping and the final
states.
","[{""version"":""v1"",""created"":""Sat, 28 Jan 2023 10:24:33 GMT""}]","2023-06-07"
"2301.12151","Holger Trittenbach","Jona Klemenc, Holger Trittenbach","Selecting Models based on the Risk of Damage Caused by Adversarial
  Attacks",,,,,"cs.LG cs.AI","http://arxiv.org/licenses/nonexclusive-distrib/1.0/","  Regulation, legal liabilities, and societal concerns challenge the adoption
of AI in safety and security-critical applications. One of the key concerns is
that adversaries can cause harm by manipulating model predictions without being
detected. Regulation hence demands an assessment of the risk of damage caused
by adversaries. Yet, there is no method to translate this high-level demand
into actionable metrics that quantify the risk of damage.
  In this article, we propose a method to model and statistically estimate the
probability of damage arising from adversarial attacks. We show that our
proposed estimator is statistically consistent and unbiased. In experiments, we
demonstrate that the estimation results of our method have a clear and
actionable interpretation and outperform conventional metrics. We then show how
operators can use the estimation results to reliably select the model with the
lowest risk.
","[{""version"":""v1"",""created"":""Sat, 28 Jan 2023 10:24:38 GMT""}]","2023-01-31"
"2301.12152","Anfeng Cheng","Anfeng Cheng, Yiding Liu, Weibin Li, Qian Dong, Shuaiqiang Wang,
  Zhengjie Huang, Shikun Feng, Zhicong Cheng and Dawei Yin","Layout-aware Webpage Quality Assessment","10 pages, 5 figures",,,,"cs.IR cs.AI","http://creativecommons.org/licenses/by-nc-sa/4.0/","  Identifying high-quality webpages is fundamental for real-world search
engines, which can fulfil users' information need with the less cognitive
burden. Early studies of \emph{webpage quality assessment} usually design
hand-crafted features that may only work on particular categories of webpages
(e.g., shopping websites, medical websites). They can hardly be applied to
real-world search engines that serve trillions of webpages with various types
and purposes. In this paper, we propose a novel layout-aware webpage quality
assessment model currently deployed in our search engine. Intuitively, layout
is a universal and critical dimension for the quality assessment of different
categories of webpages. Based on this, we directly employ the meta-data that
describes a webpage, i.e., Document Object Model (DOM) tree, as the input of
our model. The DOM tree data unifies the representation of webpages with
different categories and purposes and indicates the layout of webpages. To
assess webpage quality from complex DOM tree data, we propose a graph neural
network (GNN) based method that extracts rich layout-aware information that
implies webpage quality in an end-to-end manner. Moreover, we improve the GNN
method with an attentive readout function, external web categories and a
category-aware sampling method. We conduct rigorous offline and online
experiments to show that our proposed solution is effective in real search
engines, improving the overall usability and user experience.
","[{""version"":""v1"",""created"":""Sat, 28 Jan 2023 10:27:53 GMT""},{""version"":""v2"",""created"":""Sun, 5 Feb 2023 08:51:10 GMT""}]","2023-02-07"
"2301.12153","Eduardo Garc\'ia-Ju\'arez","Eduardo Garc\'ia-Ju\'arez, Po-Chun Kuo, Yoichiro Mori, Robert M.
  Strain","Well-Posedness of the 3D Peskin Problem","93 pages",,,,"math.AP","http://arxiv.org/licenses/nonexclusive-distrib/1.0/","  This paper introduces the 3D Peskin problem: a two-dimensional elastic
membrane immersed in a three-dimensional steady Stokes flow. We obtain the
equations that model this free boundary problem and show that they admit a
boundary integral reduction, providing an evolution equation for the elastic
interface. We consider general nonlinear elastic laws, i.e., the fully
nonlinear Peskin problem, and prove that the problem is well-posed in
low-regularity H\""older spaces. Moreover, we prove that the elastic membrane
becomes smooth instantly in time.
","[{""version"":""v1"",""created"":""Sat, 28 Jan 2023 10:31:56 GMT""}]","2023-01-31"
"2301.12154","Javier LLorca","Mingdi Yu, Yuchi Cui, Jingya Wang, Yiwen Chen, Zhigang Ding, Tao Ying,
  Javier Llorca, Xiaoqin Zeng","Critical resolved shear stresses for slip and twinning in Mg-Y-Ca alloys
  and their effect on the ductility",,"International Journal of Plasticity, 162, 103525, 2023",,,"cond-mat.mtrl-sci","http://creativecommons.org/licenses/by-nc-sa/4.0/","  The deformation mechanisms of an extruded Mg-5Y-0.08Ca (wt. %) alloy were
analyzed by means of micropillar compression tests on single crystals along
different orientations -- selected to activate specific deformation modes -- as
well as slip trace analysis, transmission electron microscopy and transmission
Kikuchi diffraction. The polycrystalline alloy presented a remarkable ductility
in tension (~32%) and negligible differences in the yield strength between
tension and compression. It was found that the presence of Y and Ca in solid
solution led to a huge increase in the CRSS for <a> basal slip (29 $\pm$ 5
MPa), <c+a> pyramidal slip (203 $\pm$ 7 MPa) and tensile twin nucleation (above
148 MPa), while the CRSS for <a> prismatic slip only increases up to 105 $\pm$
4 MPa. The changes in the CRSS for slip and tensile twinning in Mg-Y-Ca alloys
expectedly modify the dominant deformation mechanisms in polycrystals. In
particular, tensile twinning is replaced by <a> prismatic slip during
compressive deformation along the a-axis. The reduction of twinning (which
generally induces strong anisotropy in the plastic deformation in textured
alloys), and the activation of <a> prismatic slip (which provides an additional
plastic deformation mechanism with limited hardening) were responsible for the
large tensile ductility of the alloy.
","[{""version"":""v1"",""created"":""Sat, 28 Jan 2023 10:33:58 GMT""}]","2023-01-31"
"2301.12155","Yuting Li Dr","Yuting Irene Li, Rosalba Garcia-Millan, Michael E. Cates, \'Etienne
  Fodor","Towards a liquid-state theory for active matter","2 figures",,,,"cond-mat.soft cond-mat.stat-mech","http://arxiv.org/licenses/nonexclusive-distrib/1.0/","  In equilibrium, the collective behaviour of particles interacting via steep,
short-ranged potentials is well captured by the virial expansion of the free
energy at low density. Here, we extend this approach beyond equilibrium to the
case of active matter with self-propelled particles. Given that active systems
do not admit any free-energy description in general, our aim is to build the
dynamics of the coarse-grained density from first principles without any
equilibrium assumption. Starting from microscopic equations of motion, we
obtain the hierarchy of density correlations, which we close with an ansatz for
the two-point density valid in the dilute regime at small activity. This
closure yields the nonlinear dynamics of the one-point density, with
hydrodynamic coefficients depending explicitly on microscopic interactions, by
analogy with the equilibrium virial expansion. This dynamics admits a spinodal
instability for purely repulsive interactions, a signature of motility-induced
phase separation. Therefore, although our approach should be restricted to
dilute, weakly-active systems a priori, it actually captures the features of a
broader class of active matter.
","[{""version"":""v1"",""created"":""Sat, 28 Jan 2023 10:34:10 GMT""},{""version"":""v2"",""created"":""Wed, 24 May 2023 09:29:19 GMT""}]","2023-05-25"
