"2301.11752","Pravin Kumar Rana Mr.","Pravin Kumar Rana and Markus Flierl","Inter-View Depth Consistency Testing in Depth Difference Subspace",,,,,"cs.CV cs.MM eess.IV","http://creativecommons.org/licenses/by/4.0/","  Multiview depth imagery will play a critical role in free-viewpoint
television. This technology requires high quality virtual view synthesis to
enable viewers to move freely in a dynamic real world scene. Depth imagery at
different viewpoints is used to synthesize an arbitrary number of novel views.
Usually, depth images at multiple viewpoints are estimated individually by
stereo-matching algorithms, and hence, show lack of interview consistency. This
inconsistency affects the quality of view synthesis negatively. This paper
proposes a method for depth consistency testing in depth difference subspace to
enhance the depth representation of a scene across multiple viewpoints.
Furthermore, we propose a view synthesis algorithm that uses the obtained
consistency information to improve the visual quality of virtual views at
arbitrary viewpoints. Our method helps us to find a linear subspace for our
depth difference measurements in which we can test the inter-view consistency
efficiently. With this, our approach is able to enhance the depth information
for real world scenes. In combination with our consistency-adaptive view
synthesis, we improve the visual experience of the free-viewpoint user. The
experiments show that our approach enhances the objective quality of virtual
views by up to 1.4 dB. The advantage for the subjective quality is also
demonstrated.
","[{""version"":""v1"",""created"":""Fri, 27 Jan 2023 18:43:38 GMT""}]","2023-01-30"
"2301.11809","Eyad Hasan Hasan","Eyad Hasan Hasan","Quantization of Fractional Singular Lagrangian systems with Second-Order
  Derivatives Using Path Integral Method","arXiv admin note: substantial text overlap with arXiv:2301.08133",,,,"math.GM","http://creativecommons.org/licenses/by/4.0/","  The fractional quantization of singular systems with second order Lagrangian
is examined. The fractional singular Lagrangian is presented. The equations of
motion are written as total differential equations within fractional calculus.
Also, the set of Hamilton Jacobi partial differential equations is constructed
in fractional form. The path integral formulation and path integral
quantization for these systems are constructed within fractional derivatives.
We examined a mathematical singular Lagrangian with two primary first class
constraints.
","[{""version"":""v1"",""created"":""Fri, 27 Jan 2023 16:03:16 GMT""},{""version"":""v2"",""created"":""Tue, 31 Jan 2023 17:19:22 GMT""}]","2023-02-01"
"2301.11810","Floran de Putter","David van Son, Floran de Putter, Sebastian Vogel, Henk Corporaal","BOMP-NAS: Bayesian Optimization Mixed Precision NAS",,,,,"cs.LG cs.CV","http://arxiv.org/licenses/nonexclusive-distrib/1.0/","  Bayesian Optimization Mixed-Precision Neural Architecture Search (BOMP-NAS)
is an approach to quantization-aware neural architecture search (QA-NAS) that
leverages both Bayesian optimization (BO) and mixed-precision quantization (MP)
to efficiently search for compact, high performance deep neural networks. The
results show that integrating quantization-aware fine-tuning (QAFT) into the
NAS loop is a necessary step to find networks that perform well under
low-precision quantization: integrating it allows a model size reduction of
nearly 50\% on the CIFAR-10 dataset. BOMP-NAS is able to find neural networks
that achieve state of the art performance at much lower design costs. This
study shows that BOMP-NAS can find these neural networks at a 6x shorter search
time compared to the closest related work.
","[{""version"":""v1"",""created"":""Fri, 27 Jan 2023 16:04:34 GMT""}]","2023-01-30"
"2301.11814","M. Cristina Volpe","Maria Cristina Volpe","Neutrinos from dense: flavor mechanisms, theoretical approaches,
  observations, new directions","45 pages",,,,"hep-ph astro-ph.SR hep-ex nucl-th","http://arxiv.org/licenses/nonexclusive-distrib/1.0/","  Neutrino masses and mixings produce vacuum oscillations, an established
quantum mechanical phenomenon. In matter, the Mikheev-Smirnov-Wolfenstein
effect, due to neutrino interactions with the background particles, triggers
resonant flavor modification. In dense environments, sizable neutrino-neutrino
interactions, shock waves and turbulence impact the neutrino flavor content
under a variety of phenomena. Theoretical approaches of neutrino propagation
range from the mean-field approximation to the full quantum kinetic equations.
Intriguing connections have been uncovered between weakly interacting dense
neutrino gases and other many-body systems and domains, from condensed matter
and nuclear physics to quantum computing. Besides the intrinsic theoretical
interest, establishing how neutrinos change flavor contributes to answer the
longstanding open questions of how massive stars explode and of the r-process
sites. It is also important for future observations of core-collapse supernova
neutrinos and of the diffuse supernova neutrino background that should be
discovered in the foreseeable future.
","[{""version"":""v1"",""created"":""Fri, 27 Jan 2023 16:07:03 GMT""}]","2023-01-30"
"2301.11815","Matias Bundgaard-Nielsen","Matias Bundgaard-Nielsen and Emil Vosmar Denning and Marco Saldutti
  and Jesper M{\o}rk","A stochastic approach to the quantum noise of a single-emitter nanolaser","Revised and resubmitted for review",,,,"quant-ph physics.optics","http://arxiv.org/licenses/nonexclusive-distrib/1.0/","  It is shown that the intensity quantum noise of a single-emitter nanolaser
can be accurately computed by adopting a stochastic interpretation of the
standard rate equation model under the only assumption that the emitter
excitation and photon number are stochastic variables with integer values. This
extends the validity of rate equations beyond the mean-field limit and avoids
using the standard Langevin approach, which is shown to fail for few emitters.
The model is validated by comparison to full quantum simulations of the
relative intensity noise and second-order intensity correlation function,
g(2)({\tau} ). Surprisingly, even when the full quantum model displays vacuum
Rabi oscillations, which are not accounted for by rate equations, the intensity
quantum noise is correctly predicted by the stochastic approach. Adopting a
simple discretization of the emitter and photon populations, thus, goes a long
way in describing quantum noise in lasers. Besides providing a versatile and
easy-to-use tool for modeling a new generation of nanolasers with many possible
applications, these results provide insight into the fundamental nature of
quantum noise in lasers.
","[{""version"":""v1"",""created"":""Fri, 27 Jan 2023 16:10:33 GMT""},{""version"":""v2"",""created"":""Wed, 19 Apr 2023 13:24:49 GMT""}]","2023-04-20"
"2301.11816","Ying Zhang","Ying Zhang, Heyong Wang, Maoliang Yin, Jiankun Wang, and Changchun Hua","Bi-AM-RRT*: A Fast and Efficient Sampling-Based Motion Planning
  Algorithm in Dynamic Environments","Submitted to IEEE Transactions on Intelligent Vehicles",,,,"cs.RO","http://arxiv.org/licenses/nonexclusive-distrib/1.0/","  The efficiency of sampling-based motion planning brings wide application in
autonomous mobile robots. The conventional rapidly exploring random tree (RRT)
algorithm and its variants have gained significant successes, but there are
still challenges for the optimal motion planning of mobile robots in dynamic
environments. In this paper, based on Bidirectional RRT and the use of an
assisting metric (AM), we propose a novel motion planning algorithm, namely
Bi-AM-RRT*. Different from the existing RRT-based methods, the AM is introduced
in this paper to optimize the performance of robot motion planning in dynamic
environments with obstacles. On this basis, the bidirectional search sampling
strategy is employed to reduce the search time. Further, we present a new
rewiring method to shorten path lengths. The effectiveness and efficiency of
the proposed Bi-AM-RRT* are proved through comparative experiments in different
environments. Experimental results show that the Bi-AM-RRT* algorithm can
achieve better performance in terms of path length and search time, and always
finds near-optimal paths with the shortest search time when the diffusion
metric is used as the AM.
","[{""version"":""v1"",""created"":""Fri, 27 Jan 2023 16:11:03 GMT""},{""version"":""v2"",""created"":""Sun, 30 Apr 2023 09:24:18 GMT""}]","2023-05-02"
"2301.11817","Alexander Rogozin V.","Dmitriy Metelev, Alexander Rogozin, Dmitry Kovalev, Alexander Gasnikov","Is Consensus Acceleration Possible in Decentralized Optimization over
  Slowly Time-Varying Networks?",,,,,"math.OC","http://arxiv.org/licenses/nonexclusive-distrib/1.0/","  We consider decentralized optimization problems where one aims to minimize a
sum of convex smooth objective functions distributed between nodes in the
network. The links in the network can change from time to time. For the setting
when the amount of changes is arbitrary, lower complexity bounds and
corresponding optimal algorithms are known, and the consensus acceleration is
not possible. However, in practice the magnitude of network changes may be
limited. We derive lower communication complexity bounds for several regimes of
velocity of networks changes. Moreover, we show how to obtain accelerated
communication rates for a certain class of time-varying graphs using a specific
consensus algorithm.
","[{""version"":""v1"",""created"":""Fri, 27 Jan 2023 16:11:55 GMT""}]","2023-01-30"
"2301.11818","Michael D. Graham","Andrew J. Fox and Michael D. Graham","Predicting extreme events in a data-driven model of turbulent shear flow
  using an atlas of charts","7 pages, 7 figures",,,,"physics.flu-dyn","http://creativecommons.org/licenses/by/4.0/","  Dynamical systems with extreme events are difficult to capture with
data-driven modeling, due to the relative scarcity of data within extreme
events compared to the typical dynamics of the system, and the strong
dependence of the long-time occurrence of extreme events on short-time
conditions.A recently developed technique [Floryan, D. & Graham, M. D.
Data-driven discovery of intrinsic dynamics. Nat Mach Intell $\textbf{4}$,
1113-1120 (2022)], here denoted as $\textit{Charts and Atlases for Nonlinear
Data-Driven Dynamics on Manifolds}$, or CANDyMan, overcomes these difficulties
by decomposing the time series into separate charts based on data similarity,
learning dynamical models on each chart via individual time-mapping neural
networks, then stitching the charts together to create a single atlas to yield
a global dynamical model. We apply CANDyMan to a nine-dimensional model of
turbulent shear flow between infinite parallel free-slip walls under a
sinusoidal body force [Moehlis, J., Faisst, H. & Eckhardt, B. A low-dimensional
model for turbulent shear flows. New J Phys $\textbf{6}$, 56 (2004)], which
undergoes extreme events in the form of intermittent quasi-laminarization and
long-time full laminarization. We demonstrate that the CANDyMan method allows
the trained dynamical models to more accurately forecast the evolution of the
model coefficients, reducing the error in the predictions as the model evolves
forward in time. The technique exhibits more accurate predictions of extreme
events, capturing the frequency of quasi-laminarization events and predicting
the time until full laminarization more accurately than a single neural
network.
","[{""version"":""v1"",""created"":""Fri, 27 Jan 2023 16:15:51 GMT""}]","2023-01-30"
"2301.11819","Seishi Enomoto","Seishi Enomoto, Yu-Hang Su, Man-Zhu Zheng, Hong-Hao Zhang","Boltzmann equation and its cosmological applications","34 pages, 2 figures, 1 table",,,,"hep-ph","http://arxiv.org/licenses/nonexclusive-distrib/1.0/","  We review the derivation of the Boltzmann equation and its cosmological
applications in this paper. The derivation of the Boltzmann equation,
especially the collision term, is discussed in detail in the language of the
quantum field theory without any assumption of the finite temperature system.
We also discuss the integrated Boltzmann equation with the deal of the
temperature parameter as an extension of the standard equation. Among a number
of its cosmological applications, we mainly target two familiar examples, the
dynamics of the dark matter abundance through the freeze-out/in process and a
baryogenesis scenario. The formulations in those systems are briefly discussed
with techniques in their calculations.
","[{""version"":""v1"",""created"":""Fri, 27 Jan 2023 16:17:52 GMT""},{""version"":""v2"",""created"":""Tue, 31 Jan 2023 07:48:42 GMT""},{""version"":""v3"",""created"":""Tue, 28 Feb 2023 20:10:15 GMT""}]","2023-03-02"
"2301.11820","Robert Cardona","Robert Cardona","Hydrodynamic and symbolic models of hypercomputation","28 pages, corrections of the second part",,,,"math-ph cs.CC math.DS math.MP","http://arxiv.org/licenses/nonexclusive-distrib/1.0/","  Dynamical systems and physical models defined on idealized continuous phase
spaces are known to exhibit non-computable phenomena, examples include the wave
equation, recurrent neural networks, or Julia sets in holomorphic dynamics.
Inspired by the works of Moore and Siegelmann, we show that ideal fluids,
modeled by the Euler equations, are capable of simulating poly-time Turing
machines with polynomial advice on compact three-dimensional domains. The
complexity class that is shown to be computable by stationary ideal fluids is
precisely the one considered by Siegelmann in her study of analog recurrent
neural networks: the class $P/poly$. In the last part, we introduce a new class
of symbolic systems, related to countably piecewise linear transformations of
the unit square, that is capable of simulating Turing machines with advice in
real-time, contrary to previously known models.
","[{""version"":""v1"",""created"":""Fri, 27 Jan 2023 16:18:23 GMT""},{""version"":""v2"",""created"":""Mon, 6 Mar 2023 17:12:12 GMT""}]","2023-03-07"
"2301.11821","Stephen Adler","Stephen L. Adler","Dynamical gravastars may evade no-go results for exotic compact objects,
  together with further analytical and numerical results for the dynamical
  gravastar model","15 pages; sections 6 and 7 added in version 5",,,,"gr-qc","http://arxiv.org/licenses/nonexclusive-distrib/1.0/","  Using graphs plotted from the Mathematica notebooks posted with our paper
``Dynamical Gravastars'', we show that a dynamical gravastar has no hard
surface, and that a second light sphere resides in the deep interior where
there is maximum time dilation. These facts may permit dynamical gravastars to
evade no-go results for exotic compact objects relating to light leakage inside
the shadow, and nonlinear instabilities arising from an interior light sphere.
Testing either of these surmises will require further detailed modeling
calculations. We also discuss the effect of replacing the sigmoidal function in
the gravastar calculation by a unit step function, and we analyze why the
dynamical gravastar evades the singularities predicted by the Penrose and
Hawking singularity theorems, despite satisfying both the null and strong
energy conditions. Finally, we give a simplified two-step process for tuning
the initial value $\nu(0)={\rm nuinit}$ to achieve $\nu(\infty)=0$, and we give
exact integrals for the pressure differential equation in terms of $\nu(r)$ in
the interior and exterior regions.
","[{""version"":""v1"",""created"":""Fri, 27 Jan 2023 16:22:07 GMT""},{""version"":""v2"",""created"":""Mon, 30 Jan 2023 17:05:45 GMT""},{""version"":""v3"",""created"":""Mon, 13 Feb 2023 21:03:23 GMT""},{""version"":""v4"",""created"":""Tue, 14 Mar 2023 15:21:17 GMT""},{""version"":""v5"",""created"":""Wed, 24 May 2023 15:22:39 GMT""},{""version"":""v6"",""created"":""Thu, 25 May 2023 01:03:23 GMT""}]","2023-05-26"
"2301.11822","Giorgio Stefani","Marco Inversi and Giorgio Stefani","Lagrangian stability for a system of non-local continuity equations
  under Osgood condition","11 pages",,,,"math.AP math.CA","http://arxiv.org/licenses/nonexclusive-distrib/1.0/","  We extend known existence and uniqueness results of weak measure solutions
for systems of non-local continuity equations beyond the usual Lipschitz
regularity. Existence of weak measure solutions holds for uniformly continuous
vector fields and convolution kernels, while uniqueness follows from a
Lagrangian stability estimate under an additional Osgood condition.
","[{""version"":""v1"",""created"":""Fri, 27 Jan 2023 16:24:48 GMT""}]","2023-01-30"
"2301.11823","Mostafa Ahmadi","Mostafa Ahmadi, Amin Alizadeh Naeini, Mohammad Moein Sheikholeslami,
  Zahra Arjmandi, Yujia Zhang, and Gunho Sohn","HDPV-SLAM: Hybrid Depth-augmented Panoramic Visual SLAM for Mobile
  Mapping System with Tilted LiDAR and Panoramic Visual Camera",,,,,"cs.RO cs.CV","http://arxiv.org/licenses/nonexclusive-distrib/1.0/","  This paper proposes a novel visual simultaneous localization and mapping
(SLAM) system called Hybrid Depth-augmented Panoramic Visual SLAM (HDPV-SLAM),
that employs a panoramic camera and a tilted multi-beam LiDAR scanner to
generate accurate and metrically-scaled trajectories. RGB-D SLAM was the design
basis for HDPV-SLAM, which added depth information to visual features. It aims
to solve the two major issues hindering the performance of similar SLAM
systems. The first obstacle is the sparseness of LiDAR depth, which makes it
difficult to correlate it with the extracted visual features of the RGB image.
A deep learning-based depth estimation module for iteratively densifying sparse
LiDAR depth was suggested to address this issue. The second issue pertains to
the difficulties in depth association caused by a lack of horizontal overlap
between the panoramic camera and the tilted LiDAR sensor. To surmount this
difficulty, we present a hybrid depth association module that optimally
combines depth information estimated by two independent procedures,
feature-based triangulation and depth estimation. During a phase of feature
tracking, this hybrid depth association module aims to maximize the use of more
accurate depth information between the triangulated depth with visual features
tracked and the deep learning-based corrected depth. We evaluated the efficacy
of HDPV-SLAM using the 18.95 km-long York University and Teledyne Optech (YUTO)
MMS dataset. The experimental results demonstrate that the two proposed modules
contribute substantially to the performance of HDPV-SLAM, which surpasses that
of the state-of-the-art (SOTA) SLAM systems.
","[{""version"":""v1"",""created"":""Fri, 27 Jan 2023 16:25:28 GMT""},{""version"":""v2"",""created"":""Sat, 18 Mar 2023 06:25:51 GMT""}]","2023-03-21"
"2301.11824","Yuhao Zhang","Yuhao Zhang, Aws Albarghouthi, Loris D'Antoni","PECAN: A Deterministic Certified Defense Against Backdoor Attacks",,,,,"cs.CR cs.LG","http://creativecommons.org/licenses/by-nc-nd/4.0/","  Neural networks are vulnerable to backdoor poisoning attacks, where the
attackers maliciously poison the training set and insert triggers into the test
input to change the prediction of the victim model. Existing defenses for
backdoor attacks either provide no formal guarantees or come with
expensive-to-compute and ineffective probabilistic guarantees. We present
PECAN, an efficient and certified approach for defending against backdoor
attacks. The key insight powering PECAN is to apply off-the-shelf test-time
evasion certification techniques on a set of neural networks trained on
disjoint partitions of the data. We evaluate PECAN on image classification and
malware detection datasets. Our results demonstrate that PECAN can (1)
significantly outperform the state-of-the-art certified backdoor defense, both
in defense strength and efficiency, and (2) on real back-door attacks, PECAN
can reduce attack success rate by order of magnitude when compared to a range
of baselines from the literature.
","[{""version"":""v1"",""created"":""Fri, 27 Jan 2023 16:25:43 GMT""}]","2023-01-30"
"2301.11825","Hallouin Emmanuel","R\'egis Blache, Emmanuel Hallouin","Construction of good codes from weak Del Pezzo surfaces","33 pages",,,,"math.AG","http://arxiv.org/licenses/nonexclusive-distrib/1.0/","  We construct algebraic geometric codes from weak del Pezzo surfaces. The
codes are associated to the anti-canonical class of the anti-canonical model
and to the set of rational points of these models. Since we consider weak Del
Pezzo surfaces, the anti canonical model is not smooth any more. This
complicates the computation of the parameters of the codes; in particular we
need to distinguish the Cartier divisors from the Weil ones.
","[{""version"":""v1"",""created"":""Fri, 27 Jan 2023 16:26:00 GMT""}]","2023-01-30"
"2301.11826","Bojian Hou","Bojian Hou, Hongming Li, Zhicheng Jiao, Zhen Zhou, Hao Zheng, Yong Fan","Deep Clustering Survival Machines with Interpretable Expert
  Distributions",,,,,"cs.LG cs.AI","http://creativecommons.org/publicdomain/zero/1.0/","  Conventional survival analysis methods are typically ineffective to
characterize heterogeneity in the population while such information can be used
to assist predictive modeling. In this study, we propose a hybrid survival
analysis method, referred to as deep clustering survival machines, that
combines the discriminative and generative mechanisms. Similar to the mixture
models, we assume that the timing information of survival data is generatively
described by a mixture of certain numbers of parametric distributions, i.e.,
expert distributions. We learn weights of the expert distributions for
individual instances according to their features discriminatively such that
each instance's survival information can be characterized by a weighted
combination of the learned constant expert distributions. This method also
facilitates interpretable subgrouping/clustering of all instances according to
their associated expert distributions. Extensive experiments on both real and
synthetic datasets have demonstrated that the method is capable of obtaining
promising clustering results and competitive time-to-event predicting
performance.
","[{""version"":""v1"",""created"":""Fri, 27 Jan 2023 16:27:18 GMT""},{""version"":""v2"",""created"":""Tue, 21 Feb 2023 20:34:01 GMT""},{""version"":""v3"",""created"":""Fri, 10 Mar 2023 18:13:57 GMT""}]","2023-03-13"
"2301.11827","Christian T Preuss","A. Gehrmann-De Ridder, T. Gehrmann, E. W. N. Glover, A. Huss, C. T.
  Preuss, D. M. Walker","Precision phenomenology with fiducial cross sections in the
  triple-differential Drell-Yan process","49 pages, 22 figures",,"10.1007/JHEP05(2023)002",,"hep-ph hep-ex","http://arxiv.org/licenses/nonexclusive-distrib/1.0/","  The production of lepton pairs (Drell-Yan process) at the LHC is being
measured to high precision, enabling the extraction of distributions that are
triply differential in the di-lepton mass and rapidity as well as in the
scattering angle described by the leptons. The measurements are performed for a
fiducial phase space, defined by cuts on the individual lepton momenta and
rapidities. Based on the ATLAS triple-differential Drell-Yan measurement at
8~TeV, we perform a detailed investigation of the phenomenology of this process
based on state-of-the-art perturbative predictions in QCD and the electroweak
theory. Our results demonstrate the highly non-trivial interplay between
measurement variables and fiducial cuts, which leads to forbidden regions at
Born level, and induces sensitivity on extra particle emissions from higher
perturbative orders. We also investigate the sensitivity of the measurement on
parton distributions and electroweak parameters. We derive Standard-Model
theory predictions which combine NNLO QCD and NLO EW corrections and include
partial N$^3$LO QCD as well as higher-order EW corrections where appropriate.
Our results will enable the use of the triple-differential Drell-Yan data in a
precise experimental determination of the weak mixing angle.
","[{""version"":""v1"",""created"":""Fri, 27 Jan 2023 16:28:28 GMT""}]","2023-05-24"
"2301.11828","Hao Tian","Chenguang Liu, Hao Tian, Wai sun Don, Hong Wang","A fast computational framework for the linear bond-based peridynamic
  model",,,,,"math.NA cs.NA","http://creativecommons.org/licenses/by/4.0/","  Peridynamic (PD) theory is significant and promising in engineering and
materials science; however, it imposes challenges owing to the enormous
computational cost caused by its nonlocality. Our main contribution, which
overcomes the restrictions of the existing fast method, is a general
computational framework for the linear bond-based peridynamic models based on
the meshfree method, called the matrix-structure-based fast method (MSBFM),
which is suitable for the general case, including 2D/3D problems, and
static/dynamic issues, as well as problems with general boundary conditions, in
particular, problems with crack propagation. Consequently, we provide a general
calculation flow chart. The proposed computational framework is practical and
easily embedded into the existing computational algorithm. With this framework,
the computational cost is reduced from $O(N^2)$ to $O(N\log N)$, and the
storage request is reduced from $O(N^2)$ to $O(N)$, where N is the degree of
freedom. Finally, the vast reduction of the computational and memory
requirement is verified by numerical examples.
","[{""version"":""v1"",""created"":""Fri, 27 Jan 2023 16:28:43 GMT""}]","2023-01-30"
