"2301.11915","Mingyu Ding","Jie Zhu, Jiyang Qi, Mingyu Ding, Xiaokang Chen, Ping Luo, Xinggang
  Wang, Wenyu Liu, Leye Wang, Jingdong Wang","Understanding Self-Supervised Pretraining with Part-Aware Representation
  Learning",,,,,"cs.CV","http://arxiv.org/licenses/nonexclusive-distrib/1.0/","  In this paper, we are interested in understanding self-supervised pretraining
through studying the capability that self-supervised representation pretraining
methods learn part-aware representations. The study is mainly motivated by that
random views, used in contrastive learning, and random masked (visible)
patches, used in masked image modeling, are often about object parts.
  We explain that contrastive learning is a part-to-whole task: the projection
layer hallucinates the whole object representation from the object part
representation learned from the encoder, and that masked image modeling is a
part-to-part task: the masked patches of the object are hallucinated from the
visible patches. The explanation suggests that the self-supervised pretrained
encoder is required to understand the object part. We empirically compare the
off-the-shelf encoders pretrained with several representative methods on
object-level recognition and part-level recognition. The results show that the
fully-supervised model outperforms self-supervised models for object-level
recognition, and most self-supervised contrastive learning and masked image
modeling methods outperform the fully-supervised method for part-level
recognition. It is observed that the combination of contrastive learning and
masked image modeling further improves the performance.
","[{""version"":""v1"",""created"":""Fri, 27 Jan 2023 18:58:42 GMT""}]","2023-01-30"
"2301.11916","Xinyi Wang","Xinyi Wang, Wanrong Zhu, Michael Saxon, Mark Steyvers, William Yang
  Wang","Large Language Models Are Implicitly Topic Models: Explaining and
  Finding Good Demonstrations for In-Context Learning","code at:
  https://github.com/WANGXinyiLinda/concept-based-demonstration-selection",,,,"cs.CL cs.AI cs.LG","http://arxiv.org/licenses/nonexclusive-distrib/1.0/","  In recent years, pre-trained large language models have demonstrated
remarkable efficiency in achieving an inference-time few-shot learning
capability known as in-context learning. However, existing literature has
highlighted the sensitivity of this capability to the selection of few-shot
demonstrations. The underlying mechanisms by which this capability arises from
regular language model pretraining objectives remain poorly understood. In this
study, we aim to examine the in-context learning phenomenon through a Bayesian
lens, viewing large language models as topic models that implicitly infer
task-related information from demonstrations. On this premise, we propose an
algorithm for selecting optimal demonstrations from a set of annotated data and
demonstrate a significant 12.5% improvement relative to the random selection
baseline, averaged over eight GPT2 and GPT3 models on eight different
real-world text classification datasets. Our empirical findings support our
hypothesis that large language models implicitly infer a latent concept
variable.
","[{""version"":""v1"",""created"":""Fri, 27 Jan 2023 18:59:01 GMT""},{""version"":""v2"",""created"":""Thu, 4 May 2023 15:09:50 GMT""}]","2023-05-05"
"2301.11917","Ruben Verresen","Ruben Verresen","Everything is a quantum Ising model","9.5 pages + appendix",,,,"quant-ph cond-mat.quant-gas cond-mat.str-el","http://arxiv.org/licenses/nonexclusive-distrib/1.0/","  This work shows that any $k$-local Hamiltonian of qubits can be obtained from
a 4-state 'Ising' model with $k$-local diagonal interactions and a single-site
transverse field -- giving a new theoretical and experimental handle on quantum
matter. In particular, the classical Ising interactions can be determined by
replacing each Pauli operator with a $4 \times 4$ diagonal matrix. Subsequently
tuning a large transverse field projects out two of the four states, recovering
the original qubit model, with qudit generalizations. This leads to striking
correspondences, such as the spin-1/2 XY and Heisenberg models arising from the
large-field limit of 3-state and 4-state Potts models, respectively. Similarly,
the Kitaev honeycomb model emerges from classical interactions which enforce
loop states on the honeycomb lattice. These generalized Ising models also
display rich physics for smaller fields, including quantum criticality and
topological phases of matter. This work expands what is experimentally
achievable by showing how to realize any quantum spin model using only diagonal
interactions and a tuneable field -- ingredients found in, e.g., tweezer arrays
of Rydberg atoms or polar molecules. More broadly, 4-state spins can also be
encoded in the positions of itinerant particles, exemplified by a Bose-Hubbard
model realizing the Kitaev honeycomb model -- giving an experimental path to
its $\mathbb Z_2$ and non-Abelian topological quantum liquids.
","[{""version"":""v1"",""created"":""Fri, 27 Jan 2023 18:59:02 GMT""}]","2023-01-30"
"2301.11918","Adam \'Spiewak","Krzysztof Bara\'nski, Yonatan Gutman, Adam \'Spiewak","Regularity of almost-surely injective projections in Euclidean spaces",,,,,"math.CA","http://arxiv.org/licenses/nonexclusive-distrib/1.0/","  It is known that if a finite Borel measure $\mu$ in a Euclidean space has
Hausdorff dimension smaller than a positive integer $k$, then the orthogonal
projection onto almost every $k$-dimensional linear subspace is injective on a
set of full $\mu$-measure. We study the regularity of the inverses of such
projections. We prove that if $\mu$ has a compact support $X$ and
(respectively) the Hausdorff, upper box-counting or Assouad dimension of $X$ is
smaller than $k$, then the inverse is (respectively) continuous, pointwise
H\""older for some $\alpha \in (0,1)$ or pointwise H\""older for every $\alpha
\in (0,1)$. The result generalizes to the case of typical linear perturbations
of Lipschitz maps. Additionally, we construct a non-trivial measure on the
plane which admits almost-surely injective projections in every direction, and
show that no homogeneous self-similar measure has this property.
","[{""version"":""v1"",""created"":""Fri, 27 Jan 2023 18:59:07 GMT""}]","2023-01-30"
"2301.11919","Tyler Josephson","Charles Fox, Neil Tran, Nikki Nacion, Samiha Sharlin, and Tyler R.
  Josephson","Incorporating Background Knowledge in Symbolic Regression using a
  Computer Algebra System",,,,,"cs.LG cs.SC physics.chem-ph","http://creativecommons.org/licenses/by/4.0/","  Symbolic Regression (SR) can generate interpretable, concise expressions that
fit a given dataset, allowing for more human understanding of the structure
than black-box approaches. The addition of background knowledge (in the form of
symbolic mathematical constraints) allows for the generation of expressions
that are meaningful with respect to theory while also being consistent with
data. We specifically examine the addition of constraints to traditional
genetic algorithm (GA) based SR (PySR) as well as a Markov-chain Monte Carlo
(MCMC) based Bayesian SR architecture (Bayesian Machine Scientist), and apply
these to rediscovering adsorption equations from experimental, historical
datasets. We find that, while hard constraints prevent GA and MCMC SR from
searching, soft constraints can lead to improved performance both in terms of
search effectiveness and model meaningfulness, with computational costs
increasing by about an order-of-magnitude. If the constraints do not correlate
well with the dataset or expected models, they can hinder the search of
expressions. We find Bayesian SR is better these constraints (as the Bayesian
prior) than by modifying the fitness function in the GA
","[{""version"":""v1"",""created"":""Fri, 27 Jan 2023 18:59:25 GMT""},{""version"":""v2"",""created"":""Thu, 4 May 2023 14:52:27 GMT""}]","2023-05-05"
"2301.11920","Victor Bittencourt","V. A. S. V. Bittencourt and C. A. Potts and Y. Huang and J. P. Davis
  and S. Viola Kusminskiy","Magnomechanical backaction corrections due to coupling to higher order
  Walker modes and Kerr nonlinearities","19 pages, 9 figures",,"10.1103/PhysRevB.107.144411",,"cond-mat.mes-hall quant-ph","http://creativecommons.org/licenses/by/4.0/","  The radiation pressure-like coupling between magnons and phonons in magnets
can modify the phonon frequency (magnomechanical spring effect) and decay rate
(magnomechanical decay) via dynamical backaction. Such effects have been
recently observed by coupling the uniform magnon mode of a magnetic sphere (the
Kittel mode) to a microwave cavity. In particular, the ability to evade
backaction effects was demonstrated [C.A. Potts et al., arXiv:2211.13766
[quant-ph] (2022)], a requisite for applications such as magnomechanical based
thermometry. However, deviations were observed from the predicted
magnomechanical decay rate within the standard theoretical model. In this work,
we account for these deviations by considering corrections due to (i) magnetic
Kerr nonlinearities and (ii) the coupling of phonons to additional magnon
modes. Provided that such additional modes couple weakly to the driven cavity,
our model yields a correction proportional to the average Kittel magnon mode
occupation. We focus our results on magnetic spheres, where we show that the
magnetostatic Walker modes couple to the relevant mechanical modes as
efficiently as the Kittel mode. Our model yields excellent agreement with the
experimental data.
","[{""version"":""v1"",""created"":""Fri, 27 Jan 2023 18:59:59 GMT""},{""version"":""v2"",""created"":""Mon, 30 Jan 2023 14:07:37 GMT""},{""version"":""v3"",""created"":""Mon, 13 Mar 2023 16:18:46 GMT""},{""version"":""v4"",""created"":""Fri, 14 Apr 2023 14:58:44 GMT""}]","2023-04-17"
"2301.11934","Doruk Efe G\""okmen","Doruk Efe G\""okmen, Sounak Biswas, Sebastian D. Huber, Zohar Ringel,
  Felix Flicker, Maciej Koch-Janusz","Compression theory for inhomogeneous systems","9 pages, 7 figures",,,,"cond-mat.stat-mech cond-mat.dis-nn","http://creativecommons.org/licenses/by/4.0/","  The physics of complex systems stands to greatly benefit from the qualitative
changes in data availability and advances in data-driven computational methods.
Many of these systems can be represented by interacting degrees of freedom on
inhomogeneous graphs. However, the irregularity of the graph structure and the
vastness of configurational spaces present a fundamental challenge to
theoretical tools, such as the renormalization group, which were so successful
in characterizing the universal physical behaviour in critical phenomena. Here
we show that compression theory allows to extract relevant degrees of freedom
in arbitrary geometries, and develop efficient numerical tools to build an
effective theory from data. We demonstrate our method by applying it to a
strongly interacting system on an Ammann-Beenker quasicrystal, where it
discovers an exotic critical point with broken conformal symmetry.
","[{""version"":""v1"",""created"":""Fri, 27 Jan 2023 19:00:00 GMT""},{""version"":""v2"",""created"":""Tue, 16 May 2023 13:09:33 GMT""}]","2023-05-17"
"2301.11935","Lukas Burgholzer","Robert Wille and Lukas Burgholzer","MQT QMAP: Efficient Quantum Circuit Mapping","7 pages, 6 figures, invited paper for the International Symposium on
  Physical Design (ISPD '23)",,"10.1145/3569052.3578928",,"quant-ph cs.ET","http://arxiv.org/licenses/nonexclusive-distrib/1.0/","  Quantum computing is an emerging technology that has the potential to
revolutionize fields such as cryptography, machine learning, optimization, and
quantum simulation. However, a major challenge in the realization of quantum
algorithms on actual machines is ensuring that the gates in a quantum circuit
(i.e., corresponding operations) match the topology of a targeted architecture
so that the circuit can be executed while, at the same time, the resulting
costs (e.g., in terms of the number of additionally introduced gates, fidelity,
etc.) are kept low. This is known as the quantum circuit mapping problem. This
summary paper provides an overview of QMAP, an open-source tool that is part of
the Munich Quantum Toolkit (MQT) and offers efficient, automated, and
accessible methods for tackling this problem. To this end, the paper first
briefly reviews the problem. Afterwards, it shows how QMAP can be used to
efficiently map quantum circuits to quantum computing architectures from both a
user's and a developer's perspective. QMAP is publicly available as open-source
at https://github.com/cda-tum/qmap.
","[{""version"":""v1"",""created"":""Fri, 27 Jan 2023 19:00:00 GMT""}]","2023-01-31"
"2301.11936","Hayata Yamasaki","Hayata Yamasaki, Sathyawageeswar Subramanian, Satoshi Hayakawa, Sho
  Sonoda","Quantum Ridgelet Transform: Winning Lottery Ticket of Neural Networks
  with Quantum Computation","25 pages, 3 figures",,,,"quant-ph cs.LG stat.ML","http://arxiv.org/licenses/nonexclusive-distrib/1.0/","  Ridgelet transform has been a fundamental mathematical tool in the
theoretical studies of neural networks. However, the practical applicability of
ridgelet transform to conducting learning tasks was limited since its numerical
implementation by conventional classical computation requires an exponential
runtime $\exp(O(D))$ as data dimension $D$ increases. To address this problem,
we develop a quantum ridgelet transform (QRT), which implements the ridgelet
transform of a quantum state within a linear runtime $O(D)$ of quantum
computation. As an application, we also show that one can use QRT as a
fundamental subroutine for quantum machine learning (QML) to efficiently find a
sparse trainable subnetwork of large shallow wide neural networks without
conducting large-scale optimization of the original network. This application
discovers an efficient way in this regime to demonstrate the lottery ticket
hypothesis on finding such a sparse trainable neural network. These results
open an avenue of QML for accelerating learning tasks with commonly used
classical neural networks.
","[{""version"":""v1"",""created"":""Fri, 27 Jan 2023 19:00:00 GMT""}]","2023-01-31"
"2301.11937","Christopher Bambic","C. J. Bambic, H. R. Russell, C.S. Reynolds, A. C. Fabian, B. R.
  McNamara, and P. E. J. Nulsen","AGN Feeding and Feedback in M84: From Kiloparsec Scales to the Bondi
  Radius","17 pages, 9 figures, 2 tables, submitted to MNRAS",,"10.1093/mnras/stad824",,"astro-ph.HE astro-ph.GA","http://creativecommons.org/licenses/by/4.0/","  We present the deepest Chandra observation to date of the galaxy M84 in the
Virgo Cluster, with over 840 kiloseconds of data provided by legacy
observations and a recent 730 kilosecond campaign. The increased
signal-to-noise allows us to study the origins of the accretion flow feeding
the supermassive black hole in the center of M84 from the kiloparsec scales of
the X-ray halo to the Bondi radius, $R_{\rm B}$. Temperature, metallicity, and
deprojected density profiles are obtained in four sectors about M84's AGN,
extending into the Bondi radius. Rather than being dictated by the potential of
the black hole, the accretion flow is strongly influenced by the AGN's bipolar
radio jets. Along the jet axis, the density profile is consistent with $n_e
\propto r^{-1}$; however, the profiles flatten perpendicular to the jet. Radio
jets produce a significant asymmetry in the flow, violating a key assumption of
Bondi accretion. Temperature in the inner kiloparsec is approximately constant,
with only a slight increase from 0.6 to 0.7 keV approaching $R_{\rm B}$, and
there is no evidence for a temperature rise imposed by the black hole. The
Bondi accretion rate $\dot{M}_{\rm B}$ exceeds the rate inferred from AGN
luminosity and jet power by over four orders of magnitude. In sectors
perpendicular to the jet, $\dot{M}_{\rm B}$ measurements agree; however, the
accretion rate is $> 4 \sigma$ lower in the North sector along the jet, likely
due to cavities in the X-ray gas. Our measurements provide unique insight into
the fueling of AGN responsible for radio mode feedback in galaxy clusters.
","[{""version"":""v1"",""created"":""Fri, 27 Jan 2023 19:00:00 GMT""}]","2023-05-17"
"2301.11938","Jakob Ehring","Jakob Ehring (1,2,3), Sajad Abbar (1), Hans-Thomas Janka (2), Georg
  Raffelt (1), Irene Tamborra (4) ((1) MPI Physik, (2) MPI Astrophysik, (3) TUM
  Garching, (4) Niels Bohr Institute)","Fast Neutrino Flavor Conversion in Core-Collapse Supernovae: A
  Parametric Study in 1D Models","20 pages, 10 figures, slightly extended version, accepted by PRD","Phys. Rev. D 107, 103034 (2023)","10.1103/PhysRevD.107.103034",,"astro-ph.HE gr-qc hep-ph nucl-th","http://arxiv.org/licenses/nonexclusive-distrib/1.0/","  We explore the impact of small-scale flavor conversions of neutrinos, the
so-called fast flavor conversions (FFCs), on the dynamical evolution and
neutrino emission of core-collapse supernovae (CCSNe). In order to do that, we
implement FFCs in the spherically symmetric (1D) CCSN simulations of a 20
solar-mass progenitor model parametrically, assuming that FFCs happen at
densities lower than a systematically varied threshold value and lead to an
immediate flavor equilibrium consistent with lepton number conservation. We
find that besides hardening the electron neutrino and antineutrino spectra,
which helps the expansion of the shock by enhanced postshock heating, FFCs can
cause significant, nontrivial modifications of the energy transport in the SN
environment via increasing the heavy-lepton neutrino luminosities. In our
non-exploding models this results in extra cooling of the layers around the
neutrinospheres, which triggers a faster contraction of the proto-neutron star
and hence, in our 1D models, hampers the CCSN explosion. Although our study is
limited by the 1D nature of our simulations, it provides valuable insights into
how neutrino flavor conversions in the deepest CCSN regions can impact the
neutrino release and the corresponding response of the stellar medium.
","[{""version"":""v1"",""created"":""Fri, 27 Jan 2023 19:00:00 GMT""},{""version"":""v2"",""created"":""Sun, 2 Apr 2023 10:26:12 GMT""}]","2023-05-31"
"2301.11939","Tatsuya Matsumoto","Tatsuya Matsumoto, Brian D. Metzger","Synchrotron Afterglow Model for AT 2022cmc: Jetted Tidal Disruption
  Event or Engine-Powered Supernova?","11 pages, 9 figures, 2 tables, accepted for publication in MNRAS",,"10.1093/mnras/stad1182",,"astro-ph.HE","http://creativecommons.org/licenses/by/4.0/","  AT 2022cmc is a luminous optical transient ($\nu L_{\nu} \gtrsim 10^{45}$ erg
s$^{-1}$) accompanied by decaying non-thermal X-rays (peak duration $t_{\rm X}
\lesssim$ days and isotropic energy $E_{\rm X,iso} \gtrsim 10^{53}$ erg) and a
long-lived radio/mm synchrotron afterglow, which has been interpreted as a
jetted tidal disruption event (TDE). Both an equipartition analysis and a
detailed afterglow model reveals the radio/mm emitting plasma to be expanding
mildly relativistically (Lorentz factor $\Gamma \gtrsim\,few$) with an opening
angle $\theta_{\rm j}\simeq0.1$ and roughly fixed energy $E_{\rm j,iso} \gtrsim
few \times 10^{53}$ erg into an external medium of density profile $n \propto
R^{-k}$ with $k \simeq 1.5-2$, broadly similar to that of the first jetted TDE
candidate Swift J1644+57 and consistent with Bondi accretion at a rate $\sim
10^{-3}\dot{M}_{\rm Edd}$ onto a $10^{6}M_{\odot}$ black hole before the
outburst. The rapidly decaying optical emission over the first days is
consistent with fast-cooling synchrotron radiation from the same forward shock
as the radio/mm emission, while the bluer slowly decaying phase to follow
likely represents a separate thermal emission component. Emission from the
reverse shock may have peaked during the first days, but whose non-detection in
the optical band places an upper bound $\Gamma_{\rm j} \lesssim 100$ on the
Lorentz factor of the unshocked jet. Although a TDE origin for AT 2022cmc is
indeed supported by some observations, the vast difference between the
short-lived jet activity phase $t_{\rm X} \lesssim$ days relative to the
months-long thermal optical emission, also challenges this scenario. A stellar
core-collapse event giving birth to a magnetar or black hole engine of peak
duration $\sim 1$ day offers an alternative model also consistent with the
circumburst environment, if interpreted as a massive-star wind.
","[{""version"":""v1"",""created"":""Fri, 27 Jan 2023 19:00:00 GMT""},{""version"":""v2"",""created"":""Thu, 20 Apr 2023 13:56:15 GMT""}]","2023-05-03"
"2301.11940","Weiyao Ke","Weiyao Ke and Ivan Vitev","Understanding parton evolution in matter from renormalization group
  analysis","5 pages, 1 figure, with supplementary materials",,,"LA-UR-23-20730","hep-ph nucl-th","http://arxiv.org/licenses/nonexclusive-distrib/1.0/","  We perform a renormalization group (RG) analysis of collinear hadron
production in deep inelastic scattering on nuclei. We consider the limit where
one of the dimensionless in-medium scale ratios $E/(\mu_D^2 L) \gg 1$, with
$L,\mu_D,E$ being the medium size, inverse scattering range and the parton
energy in the nuclear rest frame, while the opacity $L/\lambda_g$ remains
small. We identify the fixed order and leading $\ln[E/(\mu_D^2 L)]$ enhanced
medium contributions to the semi-inclusive cross sections and derive RG
equations which resum multiple emissions near the $x\rightarrow 0,1$ endpoints
of the splitting functions at first order in opacity. We find that the
evolution equations obtained in this work treat the same type of radiation
enhancement in matter as the modified DGLAP approach, but differ in the way one
chooses to regulate the endpoint divergences and provide unique analytic
insight into the problem of resummation. The new RG evolution framework is
applied to study fragmentation in $e$A reactions.
","[{""version"":""v1"",""created"":""Fri, 27 Jan 2023 19:00:01 GMT""}]","2023-01-31"
"2301.11941","Caroline Owen","Caroline B. Owen, Carl-Johan Haster, Scott Perkins, Neil J. Cornish,
  Nicol\'as Yunes","Waveform accuracy and systematic uncertainties in current gravitational
  wave observations","14 pages, 7 figures",,,,"gr-qc","http://arxiv.org/licenses/nonexclusive-distrib/1.0/","  The post-Newtonian formalism plays an integral role in the models used to
extract information from gravitational wave data, but models that incorporate
this formalism are inherently approximations. Disagreement between an
approximate model and nature will produce mismodeling biases in the parameters
inferred from data, introducing systematic error. We here carry out a
proof-of-principle study of such systematic error by considering signals
produced by quasi-circular, inspiraling black hole binaries through an
injection and recovery campaign. In particular, we study how unknown, but
calibrated, higher-order post-Newtonian corrections to the gravitational wave
phase impact systematic error in recovered parameters. As a first study, we
produce injected data of non-spinning binaries as detected by a current,
second-generation network of ground-based observatories and recover them with
models of varying PN order in the phase. We find that the truncation of higher
order (>3.5) post-Newtonian corrections to the phase can produce significant
systematic error even at signal-to-noise ratios of current detector networks.
We propose a method to mitigate systematic error by marginalizing over our
ignorance in the waveform through the inclusion of higher-order post-Newtonian
coefficients as new model parameters. We show that this method can reduce
systematic error greatly at the cost of increasing statistical error.
","[{""version"":""v1"",""created"":""Fri, 27 Jan 2023 19:00:01 GMT""}]","2023-01-31"
