"2301.12024","Yunda Yan","Wen-Hua Chen and Yunda Yan","Stability of Finite Receding Horizon Control: A Complementary Approach",,,,,"math.OC cs.SY eess.SY","http://creativecommons.org/licenses/by-nc-nd/4.0/","  This paper presents a complementary approach to establish stability of finite
receding horizon control with a terminal cost. First a new augmented stage cost
is defined by rotating the terminal cost. Then a one-step optimisation problem
is defined based on this augmented stage cost. It is shown that a slightly
modified Model Predictive Control (MPC) algorithm is stable if the value
function of the augmented one-step cost (OSVF) is a control Lyapunov function.
The proposed stability condition is completely complementary to the existing
terminal cost based MPC stability conditions in the sense that they are
mutually excluded with each other. By using this approach, we are able to
establish stability for MPC algorithms with zero terminal cost or even negative
terminal cost as special cases. Combining this new approach with the existing
MPC stability theory, we are able to significantly relax the stability
requirement on MPC and extend the design space where stability are guaranteed.
The proposed approach will help to further reduce the gap between stability
theory and practical applications of MPC and other optimisation based control
methods.
","[{""version"":""v1"",""created"":""Fri, 27 Jan 2023 23:22:00 GMT""}]","2023-01-31"
"2301.12025","Pranav Singh","Pranav Singh and Jacopo Cirrone","Cross-Architectural Positive Pairs improve the effectiveness of
  Self-Supervised Learning","24 pages, 14 figures, Under Review. arXiv admin note: text overlap
  with arXiv:2206.04170",,,,"cs.CV cs.AI","http://creativecommons.org/licenses/by/4.0/","  Existing self-supervised techniques have extreme computational requirements
and suffer a substantial drop in performance with a reduction in batch size or
pretraining epochs. This paper presents Cross Architectural - Self Supervision
(CASS), a novel self-supervised learning approach that leverages Transformer
and CNN simultaneously. Compared to the existing state-of-the-art
self-supervised learning approaches, we empirically show that CASS-trained CNNs
and Transformers across four diverse datasets gained an average of 3.8% with 1%
labeled data, 5.9% with 10% labeled data, and 10.13% with 100% labeled data
while taking 69% less time. We also show that CASS is much more robust to
changes in batch size and training epochs than existing state-of-the-art
self-supervised learning approaches. We have open-sourced our code at
https://github.com/pranavsinghps1/CASS.
","[{""version"":""v1"",""created"":""Fri, 27 Jan 2023 23:27:24 GMT""}]","2023-01-31"
"2301.12026","Jonathan Bartlett","Jonathan W. Bartlett, Camila Olarte Parra, Rhian M. Daniel","G-formula for causal inference via multiple imputation","14 pages, 3 tables, 0 figures",,,,"stat.ME","http://arxiv.org/licenses/nonexclusive-distrib/1.0/","  G-formula is a popular approach for estimating treatment or exposure effects
from longitudinal data that are subject to time-varying confounding. G-formula
estimation is typically performed by Monte-Carlo simulation, with
non-parametric bootstrapping used for inference. We show that G-formula can be
implemented by exploiting existing methods for multiple imputation (MI) for
synthetic data. This involves using an existing modified version of Rubin's
variance estimator. In practice missing data is ubiquitous in longitudinal
datasets. We show that such missing data can be readily accommodated as part of
the MI procedure, and describe how MI software can be used to implement the
approach. We explore its performance using a simulation study.
","[{""version"":""v1"",""created"":""Fri, 27 Jan 2023 23:32:49 GMT""}]","2023-01-31"
"2301.12027","Omar Sleem","Omar M.Sleem, M.E. Ashour, N.S. Aybat and Constantino M. Lagoa","Lp Quasi-norm Minimization: Algorithm and Applications",,,,,"eess.SP","http://creativecommons.org/licenses/by/4.0/","  Sparsity finds applications in areas as diverse as statistics, machine
learning, and signal processing. Computations over sparse structures are less
complex compared to their dense counterparts, and their storage consumes less
space. This paper proposes a heuristic method for retrieving sparse approximate
solutions of optimization problems via minimizing the $\ell_{p}$ quasi-norm,
where $0<p<1$. An iterative two-block ADMM algorithm for minimizing the
$\ell_{p}$ quasi-norm subject to convex constraints is proposed. For $p=s/q<1$,
$s,q \in \mathbb{Z}_{+}$, the proposed algorithm requires solving for the roots
of a scalar degree $2q$ polynomial as opposed to applying a soft thresholding
operator in the case of $\ell_{1}$. The merit of that algorithm relies on its
ability to solve the $\ell_{p}$ quasi-norm minimization subject to any convex
set of constraints. However, it suffers from low speed, due to a convex
projection step in each iteration, and the lack of mathematical convergence
guarantee. We then aim to vanquish these shortcomings by relaxing the
assumption on the constraints set to be the set formed due to convex and
differentiable, with Lipschitz continuous gradient, functions, i.e.
specifically, polytope sets. Using a proximal gradient step, we mitigate the
convex projection step and hence enhance the algorithm speed while proving its
convergence. We then present various applications where the proposed algorithm
excels, namely, matrix rank minimization, sparse signal reconstruction from
noisy measurements, sparse binary classification, and system identification.
The results demonstrate the significant gains obtained by the proposed
algorithm compared to those via $\ell_{1}$ minimization.
","[{""version"":""v1"",""created"":""Fri, 27 Jan 2023 23:43:05 GMT""}]","2023-01-31"
"2301.12028","Melissa Antonelli","Melissa Antonelli and Ugo Dal Lago and Davide Davoli and Isabel
  Oitavem and Paolo Pistone","An Arithmetic Theory for the Poly-Time Random Functions","37 pages, pre-print",,,,"cs.CC cs.LO","http://creativecommons.org/licenses/by/4.0/","  We introduce a new bounded theory RS^1_2 and show that the functions which
are Sigma^b_1-representable in it are precisely random functions which can be
computed in polynomial time. Concretely, we pass through a class of oracle
functions over string, called POR, together with the theory of arithmetic
RS^1_2. Then, we show that functions computed by poly-time PTMs are
arithmetically characterized by a class of probabilistic bounded formulas.
","[{""version"":""v1"",""created"":""Fri, 27 Jan 2023 23:45:18 GMT""},{""version"":""v2"",""created"":""Mon, 6 Feb 2023 20:40:21 GMT""}]","2023-02-08"
"2301.12029","Ivana Malenica","Ivana Malenica, Rachael V. Phillips, Daniel Lazzareschi, Jeremy R.
  Coyle, Romain Pirracchio, Mark J. van der Laan","Multi-task Highly Adaptive Lasso",,,,,"stat.ML cs.LG stat.ME","http://arxiv.org/licenses/nonexclusive-distrib/1.0/","  We propose a novel, fully nonparametric approach for the multi-task learning,
the Multi-task Highly Adaptive Lasso (MT-HAL). MT-HAL simultaneously learns
features, samples and task associations important for the common model, while
imposing a shared sparse structure among similar tasks. Given multiple tasks,
our approach automatically finds a sparse sharing structure. The proposed MTL
algorithm attains a powerful dimension-free convergence rate of $o_p(n^{-1/4})$
or better. We show that MT-HAL outperforms sparsity-based MTL competitors
across a wide range of simulation studies, including settings with nonlinear
and linear relationships, varying levels of sparsity and task correlations, and
different numbers of covariates and sample size.
","[{""version"":""v1"",""created"":""Fri, 27 Jan 2023 23:46:57 GMT""}]","2023-01-31"
"2301.12030","Anand Jayarajan","Anand Jayarajan, Wei Zhao, Yudi Sun, Gennady Pekhimenko","TiLT: A Time-Centric Approach for Stream Query Optimization and
  Parallelization",,"Proceedings of the 28th ACM International Conference on
  Architectural Support for Programming Languages and Operating Systems, Volume
  2, 2023","10.1145/3575693.3575704",,"cs.DB cs.PL","http://creativecommons.org/licenses/by/4.0/","  Stream processing engines (SPEs) are widely used for large scale streaming
analytics over unbounded time-ordered data streams. Modern day streaming
analytics applications exhibit diverse compute characteristics and demand
strict latency and throughput requirements. Over the years, there has been
significant attention in building hardware-efficient stream processing engines
(SPEs) that support several query optimization, parallelization, and execution
strategies to meet the performance requirements of large scale streaming
analytics applications. However, in this work, we observe that these strategies
often fail to generalize well on many real-world streaming analytics
applications due to several inherent design limitations of current SPEs. We
further argue that these limitations stem from the shortcomings of the
fundamental design choices and the query representation model followed in
modern SPEs. To address these challenges, we first propose TiLT, a novel
intermediate representation (IR) that offers a highly expressive temporal query
language amenable to effective query optimization and parallelization
strategies. We subsequently build a compiler backend for TiLT that applies such
optimizations on streaming queries and generates hardware-efficient code to
achieve high performance on multi-core stream query executions. We demonstrate
that TiLT achieves up to 326x (20.49x on average) higher throughput compared to
state-of-the-art SPEs (e.g., Trill) across eight real-world streaming analytics
applications. TiLT source code is available at
https://github.com/ampersand-projects/tilt.git.
","[{""version"":""v1"",""created"":""Fri, 27 Jan 2023 23:50:12 GMT""}]","2023-01-31"
"2301.12031","Zhengliang Liu","Zhengliang Liu, Xinyu He, Lei Liu, Tianming Liu, Xiaoming Zhai","Context Matters: A Strategy to Pre-train Language Model for Science
  Education",,,,,"cs.AI","http://creativecommons.org/licenses/by/4.0/","  This study aims at improving the performance of scoring student responses in
science education automatically. BERT-based language models have shown
significant superiority over traditional NLP models in various language-related
tasks. However, science writing of students, including argumentation and
explanation, is domain-specific. In addition, the language used by students is
different from the language in journals and Wikipedia, which are training
sources of BERT and its existing variants. All these suggest that a
domain-specific model pre-trained using science education data may improve
model performance. However, the ideal type of data to contextualize pre-trained
language model and improve the performance in automatically scoring student
written responses remains unclear. Therefore, we employ different data in this
study to contextualize both BERT and SciBERT models and compare their
performance on automatic scoring of assessment tasks for scientific
argumentation. We use three datasets to pre-train the model: 1) journal
articles in science education, 2) a large dataset of students' written
responses (sample size over 50,000), and 3) a small dataset of students'
written responses of scientific argumentation tasks. Our experimental results
show that in-domain training corpora constructed from science questions and
responses improve language model performance on a wide variety of downstream
tasks. Our study confirms the effectiveness of continual pre-training on
domain-specific data in the education domain and demonstrates a generalizable
strategy for automating science education tasks with high accuracy. We plan to
release our data and SciEdBERT models for public use and community engagement.
","[{""version"":""v1"",""created"":""Fri, 27 Jan 2023 23:50:16 GMT""}]","2023-01-31"
"2301.12032","Ali Borji","Ali Borji","BinaryVQA: A Versatile Test Set to Evaluate the Out-of-Distribution
  Generalization of VQA Models",,,,,"cs.CV cs.AI","http://creativecommons.org/licenses/by/4.0/","  We introduce a new test set for visual question answering (VQA) called
BinaryVQA to push the limits of VQA models. Our dataset includes 7,800
questions across 1,024 images and covers a wide variety of objects, topics, and
concepts. For easy model evaluation, we only consider binary questions.
Questions and answers are formulated and verified carefully and manually.
Around 63% of the questions have positive answers. The median number of
questions per image and question length are 7 and 5, respectively. The state of
the art OFA model achieves 75% accuracy on BinaryVQA dataset, which is
significantly lower than its performance on the VQA v2 test-dev dataset
(94.7%). We also analyze the model behavior along several dimensions including:
a) performance over different categories such as text, counting and gaze
direction, b) model interpretability, c) the effect of question length on
accuracy, d) bias of models towards positive answers and introduction of a new
score called the ShuffleAcc, and e) sensitivity to spelling and grammar errors.
Our investigation demonstrates the difficulty of our dataset and shows that it
can challenge VQA models for next few years. Data and code are publicly
available at: DATA and CODE.
","[{""version"":""v1"",""created"":""Sat, 28 Jan 2023 00:03:44 GMT""}]","2023-01-31"
"2301.12033","Tomer Galanti","Tomer Galanti, Mengjia Xu, Liane Galanti, Tomaso Poggio","Norm-based Generalization Bounds for Compositionally Sparse Neural
  Networks",,,,,"cs.LG","http://creativecommons.org/licenses/by/4.0/","  In this paper, we investigate the Rademacher complexity of deep sparse neural
networks, where each neuron receives a small number of inputs. We prove
generalization bounds for multilayered sparse ReLU neural networks, including
convolutional neural networks. These bounds differ from previous ones, as they
consider the norms of the convolutional filters instead of the norms of the
associated Toeplitz matrices, independently of weight sharing between neurons.
  As we show theoretically, these bounds may be orders of magnitude better than
standard norm-based generalization bounds and empirically, they are almost
non-vacuous in estimating generalization in various simple classification
problems. Taken together, these results suggest that compositional sparsity of
the underlying target function is critical to the success of deep neural
networks.
","[{""version"":""v1"",""created"":""Sat, 28 Jan 2023 00:06:22 GMT""}]","2023-01-31"
"2301.12034","Kosuke Nakayama","Takemi Kato, Yongkai Li, Min Liu, Kosuke Nakayama, Zhiwei Wang, Seigo
  Souma, Miho Kitamura, Koji Horiba, Hiroshi Kumigashira, Takashi Takahashi,
  Yugui Yao, and Takafumi Sato","Surface-termination-dependent electronic states in kagome
  superconductors AV3Sb5 (A = K, Rb, Cs) studied by micro-ARPES","10 pages, 8 figures",,,,"cond-mat.supr-con cond-mat.str-el","http://creativecommons.org/licenses/by/4.0/","  Recently discovered kagome superconductors AV3Sb5 (A = K, Rb, Cs) exhibit
exotic bulk and surface physical properties such as charge-density wave (CDW)
and chirality, whereas their origins remain unresolved. By using micro-focused
angle-resolved photoemission spectroscopy, we discovered that AV3Sb5 commonly
exhibits two distinct polar surfaces depending on the termination; electron-
and hole-doped ones for the A- and Sb-termination, respectively. We observed
that the kagome-derived band shows a clear splitting in the A-terminated
surface while it is absent in the Sb-terminated counterpart, indicative of the
polarity-dependent CDW at the surface. Close comparison of the band-dependent
splitting reveals that the three-dimensional CDW structure of the K-terminated
surface is different from that of the Rb- or Cs-terminated surface, suggesting
the diversity of the CDW ground state. These results provide important insight
into the origin of CDW in kagome superconductors AV3Sb5.
","[{""version"":""v1"",""created"":""Sat, 28 Jan 2023 00:11:24 GMT""}]","2023-01-31"
"2301.12035","Diana Marcela Viveros Melo","Diana M. V. Melo, Lukas T. N. Landau, Rodrigo C. de Lamare","State Machine-based Waveforms for Channels With 1-Bit Quantization and
  Oversampling With Time-Instance Zero-Crossing Modulation",,,,,"eess.SP","http://arxiv.org/licenses/nonexclusive-distrib/1.0/","  Systems with 1-bit quantization and oversampling are promising for the
Internet of Things (IoT) devices in order to reduce the power consumption of
the analog-to-digital-converters. The novel time-instance zero-crossing (TI ZX)
modulation is a promising approach for this kind of channels but existing
studies rely on optimization problems with high computational complexity and
delay. In this work, we propose a practical waveform design based on the
established TI ZX modulation for a multiuser multi-input multi-output (MIMO)
downlink scenario with 1-bit quantization and temporal oversampling at the
receivers. In this sense, the proposed temporal transmit signals are
constructed by concatenating segments of coefficients which convey the
information into the time-instances of zero-crossings according to the TI ZX
mapping rules. The proposed waveform design is compared with other methods from
the literature. The methods are compared in terms of bit error rate and
normalized power spectral density. Numerical results show that the proposed
technique is suitable for multiuser MIMO system with 1-bit quantization while
tolerating some small amount of out-of-band radiation.
","[{""version"":""v1"",""created"":""Sat, 28 Jan 2023 00:20:01 GMT""},{""version"":""v2"",""created"":""Sat, 4 Feb 2023 00:40:38 GMT""},{""version"":""v3"",""created"":""Thu, 16 Mar 2023 15:42:01 GMT""}]","2023-03-17"
"2301.12036","Diyi Liu","Diyi Liu, Lanmin Liu, Lee D Han","Analyzing Robustness of the Deep Reinforcement Learning Algorithm in
  Ramp Metering Applications Considering False Data Injection Attack and
  Defense","15 pages, 6 figures",,,,"cs.LG","http://creativecommons.org/licenses/by-nc-nd/4.0/","  Decades of practices of ramp metering, by controlling downstream volume and
smoothing the interweaving traffic, have proved that ramp metering can decrease
total travel time, mitigate shockwaves, decrease rear-end collisions, reduce
pollution, etc. Besides traditional methods like ALIENA algorithms, Deep
Reinforcement Learning algorithms have been established recently to build finer
control on ramp metering. However, those Deep Learning models may be venerable
to adversarial attacks. Thus, it is important to investigate the robustness of
those models under False Data Injection adversarial attack. Furthermore,
algorithms capable of detecting anomaly data from clean data are the key to
safeguard Deep Learning algorithm. In this study, an online algorithm that can
distinguish adversarial data from clean data are tested. Results found that in
most cases anomaly data can be distinguished from clean data, although their
difference is too small to be manually distinguished by humans. In practice,
whenever adversarial/hazardous data is detected, the system can fall back to a
fixed control program, and experts should investigate the detectors status or
security protocols afterwards before real damages happen.
","[{""version"":""v1"",""created"":""Sat, 28 Jan 2023 00:40:46 GMT""}]","2023-01-31"
"2301.12037","Gabriel Regnault","Gabriel Regnault, Mitchell A. Kirby, Ruikang K. Wang, Tueng T. Shen,
  Matthew O'Donnell and Ivan Pelivanov","Possible depth-resolved reconstruction of shear moduli in the cornea
  following collagen crosslinking (CXL) with optical coherence tomography and
  elastography","Main: 10 Pages, 6 Figures Supplemental: 12 Pages, 3 Figures",,,,"physics.med-ph","http://creativecommons.org/licenses/by/4.0/","  Collagen crosslinking of the cornea (CXL) is commonly employed to prevent or
treat keratoconus. Although the change of corneal stiffness induced by CXL
surgery can be monitored with non-contact dynamic Optical Coherence
Elastography (OCE) by tracking mechanical wave propagation, the depth
dependence of this change is still unclear if the cornea is not crosslinked
through the whole depth. Here we propose to combine phase-decorrelation
measurement applied to OCT structural images and acoustic micro-tapping
(A$\mu$T) OCE to explore possible depth reconstruction of stiffness within
crosslinked corneas in an ex vivo human cornea sample. The analysis of
experimental OCT images is used to define the penetration depth of CXL into the
cornea, which varies from $\sim$100$\mu m$ in the periphery to $\sim$150$\mu m$
in the central area and exhibits a sharp transition between areas. This
information was used in a two-layer analytical model to quantify the stiffness
of the treated layer. We also discuss how the elastic moduli of partially
CXL-treated cornea layers reconstructed from OCE measurements reflect the
effective mechanical stiffness of the entire cornea to properly quantify
surgical outcome.
","[{""version"":""v1"",""created"":""Sat, 28 Jan 2023 00:44:05 GMT""},{""version"":""v2"",""created"":""Tue, 25 Apr 2023 22:17:41 GMT""}]","2023-04-27"
"2301.12038","Amrit Singh Bedi","Souradip Chakraborty, Amrit Singh Bedi, Alec Koppel, Mengdi Wang,
  Furong Huang, Dinesh Manocha","STEERING: Stein Information Directed Exploration for Model-Based
  Reinforcement Learning",,,,,"cs.LG cs.AI stat.ML","http://arxiv.org/licenses/nonexclusive-distrib/1.0/","  Directed Exploration is a crucial challenge in reinforcement learning (RL),
especially when rewards are sparse. Information-directed sampling (IDS), which
optimizes the information ratio, seeks to do so by augmenting regret with
information gain. However, estimating information gain is computationally
intractable or relies on restrictive assumptions which prohibit its use in many
practical instances. In this work, we posit an alternative exploration
incentive in terms of the integral probability metric (IPM) between a current
estimate of the transition model and the unknown optimal, which under suitable
conditions, can be computed in closed form with the kernelized Stein
discrepancy (KSD). Based on KSD, we develop a novel algorithm STEERING:
\textbf{STE}in information dir\textbf{E}cted exploration for model-based
\textbf{R}einforcement Learn\textbf{ING}. To enable its derivation, we develop
fundamentally new variants of KSD for discrete conditional distributions. We
further establish that STEERING archives sublinear Bayesian regret, improving
upon prior learning rates of information-augmented MBRL, IDS included.
Experimentally, we show that the proposed algorithm is computationally
affordable and outperforms several prior approaches.
","[{""version"":""v1"",""created"":""Sat, 28 Jan 2023 00:49:28 GMT""}]","2023-01-31"
"2301.12039","Marwan Omar Dr","Marwan Omar","Harnessing the Power of Decision Trees to Detect IoT Malware",,,,,"cs.CR cs.LG","http://creativecommons.org/licenses/by/4.0/","  Due to its simple installation and connectivity, the Internet of Things (IoT)
is susceptible to malware attacks. Being able to operate autonomously. As IoT
devices have become more prevalent, they have become the most tempting targets
for malware. Weak, guessable, or hard-coded passwords, and a lack of security
measures contribute to these vulnerabilities along with insecure network
connections and outdated update procedures. To understand IoT malware, current
methods and analysis ,using static methods, are ineffective. The field of deep
learning has made great strides in recent years due to their tremendous data
mining, learning, and expression capabilities, cybersecurity has enjoyed
tremendous growth in recent years. As a result, malware analysts will not have
to spend as much time analyzing malware. In this paper, we propose a novel
detection and analysis method that harnesses the power and simplicity of
decision trees. The experiments are conducted using a real word dataset,
MaleVis which is a publicly available dataset. Based on the results, we show
that our proposed approach outperforms existing state-of-the-art solutions in
that it achieves 97.23% precision and 95.89% recall in terms of detection and
classification. A specificity of 96.58%, F1-score of 96.40%, an accuracy of
96.43.
","[{""version"":""v1"",""created"":""Sat, 28 Jan 2023 00:56:10 GMT""}]","2023-01-31"
